"url","reviewerUsername","reviewerDisplayName","reviewerUrl","reviewerProductsCount","reviewText","date","recommended","hoursPlayed","voteText","helpfulPercent","votesHelpful","votesTotal","votesFunny","commentsCount"
"http://steamcommunity.com/id/slipperybrain/recommended/17410/","slipperybrain","[PolarisGames] Slipperybrain","http://steamcommunity.com/id/slipperybrain/","65 products in account","I liked that part when I didn't have to use Origin...","December 23, 2015","true","2.5"," 484 of 510 people (95%) found this review helpful 330 people found this review funny","95","484","510","330","5"
"http://steamcommunity.com/id/yabbadabbapoo/recommended/17410/","yabbadabbapoo","Lt. Commander Bright","http://steamcommunity.com/id/yabbadabbapoo/","579 products in account","Sometimes you just want to run, but then you realize you're fat.","January 13, 2014","true","22.7"," 1,852 of 2,100 people (88%) found this review helpful 14 people found this review funny","88","852","2","14","36"
"http://steamcommunity.com/id/janosbiro/recommended/17410/","janosbiro","Janos Biro","http://steamcommunity.com/id/janosbiro/","364 products in account","This game is awesome. Great story, great action, beautiful art, music and voice acting. A masterpiece.","November 8, 2014","true","8.4"," 460 of 495 people (93%) found this review helpful 15 people found this review funny","93","460","495","15","2"
"http://steamcommunity.com/id/Smiley2/recommended/17410/","Smiley2","SmiLeY- RIP Mohammed Ali","http://steamcommunity.com/id/Smiley2/","94 products in account","BEST PARKOUR GAME EVER!\n\n1- i Played this game\n\n2- i was ON FULL ENERGY\n\n3-  Exit the game\n\n4- go PRAKOUR IN REAL LIFE\n\n5- Broke my Leg go to Hospital\n\n10/10\n\nRecommended.\n\nBy The Way This Review is just for fun it's not real :)","November 4, 2014","true","0.8"," 1,979 of 2,332 people (85%) found this review helpful 1,431 people found this review funny","85","979","2","431","63"
"http://steamcommunity.com/id/Envy_Me_1_Forever_Till_Death/recommended/17410/","Envy_Me_1_Forever_Till_Death","◄The Lust of Ass►","http://steamcommunity.com/id/Envy_Me_1_Forever_Till_Death/","832 products in account","The game is fast first person platformer. A fresh new adaptation of true and tried platforming. Rather than moving slowly and timing the jump from the edge. Speed is what counts here. You need to be moving at a constant speed to kick open doors, catch a drop wire etc. etc. Every thing is setup for constant nonstop movement. The level designs are so perfect; once you get hang of controls there is no need to stop. The game takes you through roof tops, A/C vents, malls, office walk ways and lots of other varied setups. At every stage there are multiple paths to move forward. There is a lot of freedom and it is tied well with risks.\n\nA critical thing to understand here is that the start-up period of the game is ROUGH. You are expected to be able to wall-jump, balance on thin rails, jump over chasms, and do other challenging things. The controls are going to be hard to get used to. Don't give up. It could be frustrating. Stick at it, and give yourself time to get used to those controls. Keep working through the initial levels. The reward is well worth it.\n\nOnce you become used to the controls, the game really becomes captivating. You're expected to race top speed through a variety of obstacle courses. You have to think on the fly, react instantly, and pay attention to clues. It draws your mind in to focus on the moment.\n\nYou can replay levels to try different paths, to try to get a better speed, and simply to have fun. So even if you "solve" a level in one way, there are reasons to go back and replay them multiple times.\n\nThis game has been agony and ecstasy for me, and when I beat it I felt exhilarated. If you are a high-energy gamer who has the patience to try and try again, you will find yourself rewarded. If not, you should know ahead of time that there's no cathartic blasting your way out of trouble in this game.","December 19, 2013","true","4.3"," 438 of 489 people (90%) found this review helpful 2 people found this review funny","90","438","489","2","15"
"http://steamcommunity.com/id/ownosourus/recommended/17410/","ownosourus","ownosourus","http://steamcommunity.com/id/ownosourus/","3349 products in account","Mirror's Edge is a video game that definitely deserves a try.Its short length is the only complain I can mention about the campaign, because it's an incredible innovative title with a very powerful graphical side and an addictive gameplay proposal. A nice launching for this new saga that replaces the word 'brief' with the word 'intensity'.There's depth here that you'll only discover hours into time trialling a single stage and no other game in recent memory comes close to being as cool. I can't wait to see what Faith gets up to next. Console ports are usually a waste of time, but that's certainly not the case with Mirror's Edge. In fact, the PC version of the game offers even more than its console counterparts. Mirror’s Edge works like a charm with keyboard and mouse, too. Parkour above a shining beautiful city is a nice change of pace after normal shooters. Hopefully we get to see more games like this in the future.Mirrors Edge is an intense and intensely enjoyable experience from top to bottom that manages to capture a very interesting gameplay element and perfect it.","June 16, 2014","true","11.2"," 313 of 341 people (92%) found this review helpful 1 person found this review funny","92","313","341","0","0"
"http://steamcommunity.com/id/fherrera/recommended/17410/","fherrera","Fherrera","http://steamcommunity.com/id/fherrera/","153 products in account","Its now year 2015, and this game is still unique. Can't wait for sequel!","June 15, 2015","true","6.9"," 318 of 355 people (90%) found this review helpful 34 people found this review funny","90","318","355","34","9"
"http://steamcommunity.com/profiles/76561198058192239/recommended/17410/","76561198058192239","Jack Daniels","http://steamcommunity.com/profiles/76561198058192239/","53 products in account","A Cop was standing on the edge of a rooftop.\n\nI tried to Jump-kick him.\n\nCop moved to the side.\n\nI missed and fell off the rooftop.\n\n10/10 would accidently jump into my death again","June 11, 2015","true","16.9"," 667 of 797 people (84%) found this review helpful 1,054 people found this review funny","84","667","797","054","11"
"http://steamcommunity.com/id/officialxstatic/recommended/17410/","officialxstatic","The Prince Of Darkness","http://steamcommunity.com/id/officialxstatic/","87 products in account","Mirrors Edge\nThe Great Game That Nobody Bought\n\nBefore I start, ignore how long I have played this game. I mainly played this offline.\n\nMirrors Edge is a first person parkour game with some shooting elements. All combined highlights Faith's (the main character) trip through this beautiful city. The small details in the graphics, such as motion blur and even the dust particles when you land after a massive jump make this experience feel real at times. Highly recommended for fans of parkour based gameplay with the occasional fast paced, reflex combat.\n\nAlso this is one of the very few first person games where you can acually see your feet as well as your arms.  Mirrors Edge is also a fantastic game because it still looks good even if you don't have a gaming PC to run it. Futhermore it doesn't take up that much space on your computer. (around 7 gigs or so)\n\nThe only downside to this game is that it is a bit too short (around 6 hours). Keep in mind this is pretty much the only downside to this game.\n\nVerdict\n9/10\n"Parkour + Amazing Graphics + A Little Bit Of Shooting = A Game Worth Your Money"","October 31, 2014","true","0.3"," 180 of 192 people (94%) found this review helpful 10 people found this review funny","94","180","192","10","0"
"http://steamcommunity.com/id/zooketra/recommended/17410/","zooketra","ZooKetnya","http://steamcommunity.com/id/zooketra/","139 products in account","Took a few hundred hours to get used to the controls, after that the game drags on a bit, a bit meaning approx 1000 hours until you understand the basic background of the plot, after that the real journey begins, currently 200 hours into the main storyline, best RPG I've ever played.","October 18, 2015","true","666.2"," 726 of 892 people (81%) found this review helpful 908 people found this review funny","81","726","892","908","36"
"http://steamcommunity.com/profiles/76561198064190624/recommended/17410/","76561198064190624","The Fabulous Seagoat","http://steamcommunity.com/profiles/76561198064190624/","76 products in account","There's no mirrors. 9/10","December 15, 2015","true","1.2"," 309 of 359 people (86%) found this review helpful 503 people found this review funny","86","309","359","503","5"
"http://steamcommunity.com/id/Etherofficial/recommended/17410/","Etherofficial","Ether","http://steamcommunity.com/id/Etherofficial/","1513 products in account","Good gameplay fine locations simple fighting no DLCs\nLight side of EA","October 19, 2014","true","5.3"," 178 of 193 people (92%) found this review helpful 50 people found this review funny","92","178","193","50","7"
"http://steamcommunity.com/id/4wkn/recommended/17410/","4wkn","Lord Admiral Night Hawke|UK|","http://steamcommunity.com/id/4wkn/","289 products in account","The epitome of artistic game design. The combination of visuals, graphics, artistic feel and look of the game is just astonishing. The first game to do parkour and freerunning any real justice, ME shows you what it's like to be that guy/or girl without having to leave your damn seat.  DICE really nailed it but while as an idea it seems to work great, in practice a parkour game would be quite lacking in terms of content. And that is the main issue with the game: not enough content. Yes, there are speedruns to keep you playing and compete against other players worldwide but that does not really add any realistic level of playtime to the game. Most people won’t even bother.\n\nIf DICE had more time to tinker with the game, other notable examples to get ideas from (absolutely none at the time) or maybe more resources to work with, we could have possibly seen a much bigger game with a larger player base (that’s not to say that it was an experimental game, not at all). That perhaps explains why ME was not a major financial success, but still the most loved underrated game of all time.\n\nEveryone wanted a sequel, even those that logged like no more than 10 minutes into the game thought it’s cool and deserves a sequel. We are getting the sequel and it looks very promising so far. In my opinion, all that DICE needs to do to make sure that ME2 is a huge financial success is add more content, keep the feel and look of the game and improve it further.\n\nDICE’s work has always been inspiring and Mirror’s Edge is no different. The addition of combat and the constant feeling of  “I have to keep running to evade the highly trained ninja monkey special forces that are after me for no apparent reason (IHKREHTNMSFAMNAR)“ adds a sense of danger and foreboding to the game. It’s parkour as it should be.\n\nParkour is cool and everyone knows it. If you haven’t yet played the game, you owe it to yourself to do so.\n\nJust don’t go and play it with the Oculus Rift, especially not if you’re afraid of heights.\n\nYou have been warned….","August 20, 2014","true","27.8"," 175 of 190 people (92%) found this review helpful 1 person found this review funny","92","175","190","0","9"
"http://steamcommunity.com/id/epullay/recommended/17410/","epullay","{≕❡ᘉℒ≔} 🔥 ℐḠℕї⊥ᕮ™ 🔥","http://steamcommunity.com/id/epullay/","178 products in account","This game is...\n\n(•_•)\n( •_•)>⌐□-□\n(⌐□_□)\n\nEdgy.\n\nYEEEEEEEEEEEEEAAAAAAAAAAAAAH!\n\nBut honestly, this is an awesome game. It's really immersive, it's pretty smooth, the graphics are delicious, it has a great story, the OST is awesome.. And F*CKING PARKOUR!","September 19, 2015","true","22.6"," 199 of 227 people (88%) found this review helpful 217 people found this review funny","88","199","227","217","4"
"http://steamcommunity.com/id/pezus/recommended/17410/","pezus","PeZuS","http://steamcommunity.com/id/pezus/","228 products in account","This is "Catch me if you can" if Leonardo DiCaprio was a girl and Tom Hanks was multiple copies of generic looking cops","December 28, 2014","true","7.8"," 257 of 307 people (84%) found this review helpful 369 people found this review funny","84","257","307","369","2"
"http://steamcommunity.com/id/loopuleasa/recommended/17410/","loopuleasa","loopuleasa","http://steamcommunity.com/id/loopuleasa/","252 products in account","Lovely and unique game with the freedom of movement all games deserve.\n\n9/10 art style; I LOVE the architecture and minimalistic design this game has throughout it\n\n9/10 sound and effects; Really immersive and crystal clear music\n\nJUST LISTEN\nhttp://www.youtube.com/watch?v=Y05wiQQbFLU\n\n7/10 Story. Good story to keep you in the game.\n\n8/10 Gameplay; The only thing I don't like it's that it's not really an open-world game, which is what I expected it to be. It has missions after missions. This game does parkour right.\n\nIf you like parkour in general, this game is a must for you.\n\nIf you are a gamer that just wants to feel inspired a bit and you want to feel like you're breathing fresh, then you need to play this game. Such an uplifting and bad-♥♥♥ game.","August 17, 2013","true",""," 188 of 216 people (87%) found this review helpful","87","188","216","0","0"
"http://steamcommunity.com/id/sejian/recommended/17410/","sejian","JANUS","http://steamcommunity.com/id/sejian/","308 products in account","I waited almost 3 years to play this due to hardware limitations. I was not disappointed. Loved the story, game mechanics, and Faith. Eagerly awaiting Mirror's Edge 2.","November 14, 2014","true","21.8"," 135 of 147 people (92%) found this review helpful 8 people found this review funny","92","135","147","8","0"
"http://steamcommunity.com/id/canud1git/recommended/17410/","canud1git","D1g?","http://steamcommunity.com/id/canud1git/","130 products in account","Punched a guy in the balls, stole his shotgun, and then shot him in the balls again.\n11/10","March 27, 2014","true","8.9"," 680 of 877 people (78%) found this review helpful 1 person found this review funny","78","680","877","0","10"
"http://steamcommunity.com/id/xiiram/recommended/17410/","xiiram","Hyo","http://steamcommunity.com/id/xiiram/","1484 products in account","Mirror’s Edge is unique on its kind, you will not find another game with that gameplay and visual style, except of course, for Mirror's Edge Catalyst (…) that aside, the game can be described in just two words: Adrenaline and Speed. No, it’s not a racing game, but if you have heard of parkour, then you might have an idea of what it is about.\n\n★★★★☆ | Liked it","December 30, 2013","true","21.9"," 191 of 225 people (85%) found this review helpful","85","191","225","0","0"
"http://steamcommunity.com/id/achawcx/recommended/17410/","achawcx","Psychii™","http://steamcommunity.com/id/achawcx/","99 products in account","If Mirror's Edge was a combat game, it would be a mediocre game.\n\nIf Mirror's Edge was a First Person Shooter, it would be a terrible game.\n\nIf Mirror's Edge was a game that required me to buy Day 1 DLC and get a Premium membership just to play it, then I would facepalm so hard.\n\nIf Mirror's Edge was a game that has a very relaxing soundtrack that flows perfectly with what is going on, has graphics that are easy to the eye and are unique, and is emphasized on giving a parkour experience that has a mix of an ambient and adrenaline pumping feeling that no other game has done before, and you are interested in these features...\n\nThen you know what you have to do now.\n;)","December 3, 2014","true","6.5"," 146 of 165 people (88%) found this review helpful 41 people found this review funny","88","146","165","41","0"
"http://steamcommunity.com/id/bluewaddlingducky/recommended/17410/","bluewaddlingducky","Άλφα BlueDuck","http://steamcommunity.com/id/bluewaddlingducky/","25 products in account","A truly remarklable game. Really, it's not often you find a game like this. Beautiful graphics, a good plot, and a truly unique gameplay. I'd recommend buying this game.","December 10, 2015","true","11.9"," 107 of 114 people (94%) found this review helpful 11 people found this review funny","94","107","114","11","0"
"http://steamcommunity.com/id/Ijega/recommended/17410/","Ijega","~zXFTYWPo","http://steamcommunity.com/id/Ijega/","424 products in account","Beautiful work of art, cleanly inspiring us for the better. Now I do wish to say more about this game, I played it years ago on my neighbors xbox 360 but now I am looking forward to Catalyst! It reminds me of hitman which is funny. So the point I wish to bring up now is about the settings, I have a GTX 980 Ti (Very high graphics card) But I had problems running this game, at certain points. This is entirely because of PhysX. There are two files which are in the game when you install here on Steam, and if you remove them then the problem is fixed, because this game came out half a decade ago, those files are outdated, and removing them will allow proper updated ones that you already should have to take their place, the files you need to find are called: PhysXCore.dll & PhysXDevice.dll. To find them go to Where Steam is on your computer, usually under program files x86, then steamapps, common, mirrors edge of course, then the first file maybe, called binaries, just find and delete those two I mentioned before hand and you should be completley done if you are up to date otherwise. Now this works as of now for me, maybe it will not in the future but I think it is worth doing this right now to try to help others. I found this fix on a fourm here: http://forums.guru3d.com/showthread.php?t=335486 posted in 2010 apparently. It is 2015 now. Hope that helps you enjoy.","December 5, 2015","true","29.1"," 82 of 84 people (98%) found this review helpful 2 people found this review funny","98","82","84","2","0"
"http://steamcommunity.com/profiles/76561198063116291/recommended/17410/","76561198063116291","neverr","http://steamcommunity.com/profiles/76561198063116291/","106 products in account","+ Beautiful modern art style throughout, mix with comic art\n+ Runs amazingly on my toaster of a computer\n+ Enjoyable, rewarding parkour system\n\n- May start as frustrating, but once you understand the movement concepts, will be rewarding\n- Short\n\nTips: Wall run as often as possible and learn to side-step boost.\n[Edit]: Side-step boost will give instant momentum. Good for recovering. Multiple guides on this.","June 14, 2015","true","6.5"," 78 of 81 people (96%) found this review helpful 6 people found this review funny","96","78","81","6","1"
"http://steamcommunity.com/profiles/76561198143332906/recommended/17410/","76561198143332906","Jess","http://steamcommunity.com/profiles/76561198143332906/","59 products in account","GOTTA GO FAST LEIK SANIC","October 25, 2014","true","0.8"," 532 of 724 people (73%) found this review helpful 420 people found this review funny","73","532","724","420","16"
"http://steamcommunity.com/id/jmz98/recommended/17410/","jmz98","♛jmz","http://steamcommunity.com/id/jmz98/","667 products in account","I'm a great fan of this game. I loved this and I can't wait for Mirror's Edge 2 to hit.\n\nMirror's Edge Really does make you feel that you are doing some crazy parkour which most games now adays dont even offer.\n\nThe grahpics are remarkable for it's release year (2009) the atmosphere is truly outstanding and Faith, i'll let you decide on her. The only concern i had with this game was that the story was WAY to short, i was expecting that DICE could have gave alot more but oh well, Ethier way It's very innovational and cheap.\n\n100% Recommended.","November 26, 2013","true","5.8"," 145 of 177 people (82%) found this review helpful 2 people found this review funny","82","145","177","2","0"
"http://steamcommunity.com/id/BuTT_MaN/recommended/17410/","BuTT_MaN","Butt Man (idling)","http://steamcommunity.com/id/BuTT_MaN/","1276 products in account","Best parkour game out there!\n\nSimply amazing, it will become a cult classic, if it isnt already.\nStory wise the game is above average at best. The combat and gunfights are mediocre. The gameplay itself its pretty good at times, pretty crappy at others. Longetivity is pretty low too. But the graphics, art style and soundtrack make this game a must play, simply astonishing. It turns out to be an amazing experience, like no other on the market.\nReally, play this gem, you will certanily find something in this game that you will love.\n\nFinal Veridict: 8/10\nA shame Mirrors Edge 2 wont be coming to steam for sure. :(","March 2, 2015","true","4.7"," 98 of 111 people (88%) found this review helpful 5 people found this review funny","88","98","111","5","10"
"http://steamcommunity.com/profiles/76561198003741135/recommended/17410/","76561198003741135","Beast of No Nation","http://steamcommunity.com/profiles/76561198003741135/","55 products in account","You jump alot.","May 5, 2015","true","3.9"," 262 of 345 people (76%) found this review helpful 315 people found this review funny","76","262","345","315","10"
"http://steamcommunity.com/id/mstrchiefalexed/recommended/17410/","mstrchiefalexed","Stadarooni","http://steamcommunity.com/id/mstrchiefalexed/","75 products in account","Mirror's Edge is a game I've wanted to play for a while, and this past week I've completed it over once. Is it worth playing? Yes.\n\nFrom creators DICE (known for work on the Battlefield series and the 2015 Star Wars Battlefront), Mirror's Edge is a first-person platformer which involves parkour in all its glory, leaping across buildings, scaling walls, and traversing up factories. Parkour functions very smoothly, and the first-person view adds a layer of immersion which helps to sell the games atmosphere. Say what you want about the plot and characters (I found both to be good enough), this game's setting is a unique piece of art. Taking place sometime in the future in an unidentified utopian city controlled by a totalitarian government, Mirror's Edge conveys this by its very simplistic and pleasant art style: White everywhere, with bold colours such as brick red, lime green, or saphiere blue alongside. Cutscenses are also presented in a unqiue "drawing animation" (search up the first cutscene, I can't really explain it well), with a charm of their own. The soundtrack is also quite amazing, all the way from the main theme "Still Alive" to more atmospheric tracks used in the levels.\n\nAs for gameplay, this game is centered around parkour as I said before. Your moveset includes jumping (no duh), sliding, wall running, climbing, and clambering to name a few. The feeling of successfully pulling of multiple moves at a fast pace is incredibly rewarding, and the game is entirely hard to master. Difficultly (for parkour) progression is smooth throughout the entire game, and (at least for me) the game never felt cheap at any times. However, combat also is an important part of this game. In some sections enemy soldiers will attack you, and you'll have to use kicks and punches to either kill or unarm them, in order to use their weapons. Gunplay in this game is very basic (kind of surprising as this game comes from DICE), and only serves as a way to kill baddies faster. Weapons include SMG's, shotguns, and snipers, however you wont find yourself using them too often as the bulk of the game is parkour, and some sections with enemies do involve chases, which are awesome and tense.\n\nThat's pretty much this game! Sound a bit basic for you? Well, the main campaign/story mode is only 5 hours (it might take you shorter), and besides that there's a time trial mode, but that's pretty much the game. While a piece of art IMO, the game could have used a few more levels for the story mode, and perhaps a race mode for multiplayer, or at least something related to that. Gunplay/combat could also be expanded, and the parkour moveset could always be refined and expanded upon. Overall, it's an awesome concept and an original idea for a game, and I would give it a 7.5/10. For $19.99 it's a good price if you are absolutely sold on this game, but either than that I would either be cautious or wait for a price drop due to the lack of much content.\n\nAlso, Mirror's Edge 2 for 2016!","January 3, 2015","true","5.3"," 88 of 97 people (91%) found this review helpful 9 people found this review funny","91","88","97","9","2"
"http://steamcommunity.com/id/BundD/recommended/17410/","BundD","BundD (6=>)","http://steamcommunity.com/id/BundD/","607 products in account","A parkour paradise with picturesque visuals and fluid gameplay. With first person female protagonist Faith, the city is your playground!","March 22, 2015","true","16.4"," 80 of 86 people (93%) found this review helpful 4 people found this review funny","93","80","86","4","0"
