"url","reviewerUsername","reviewerDisplayName","reviewerUrl","reviewerProductsCount","reviewText","date","recommended","hoursPlayed","voteText","helpfulPercent","votesHelpful","votesTotal","votesFunny","commentsCount"
"http://steamcommunity.com/id/Darkway2308/recommended/17410/","Darkway2308","Darkway2308","http://steamcommunity.com/id/Darkway2308/","115 products in account","Needless to say, this is one of the greatest games ever made. It's a first person parkour game. I would leave it at that but that wouldn't be very helpful. As a free runner myself I can say this is the best free running engine I have seen in a game. Whereas games like Assassins' Creed feel too floaty and Sleeping Dogs feels too clunky, this really feels as if I'm the one doing it. The physics seem very accurate to doing the real thing, if ever so slightly floaty at points but compared to some of the engines I have played with, it's superior by far. The story is nothing special but the game makes up for that through game play mechanics and stunning visuals. It has been a long time since I completed the game but it's still very enjoyable to go back and improve your "flow". Would I recommend this game? Yes, if you want something original and enjoyable gaming wise, this will satisfy your want.","June 24, 2014","true","35.0"," 1 person found this review helpful","0","1","1","0","0"
"http://steamcommunity.com/profiles/76561198071066283/recommended/17410/","76561198071066283","Orien","http://steamcommunity.com/profiles/76561198071066283/","101 products in account","This Is Truly a great game, i highly recommend it, it is fast paced and has a multitude of different ways it can be played to suit any style.","June 26, 2014","true","7.4"," 1 person found this review helpful","0","1","1","0","0"
"http://steamcommunity.com/id/darkside55/recommended/17410/","darkside55","[DSE]Emperor","http://steamcommunity.com/id/darkside55/","120 products in account","Beautiful and challenging.","April 30, 2012","true","4.4"," 1 person found this review helpful","0","1","1","0","1"
"http://steamcommunity.com/profiles/76561197960281570/recommended/17410/","76561197960281570","Combat Gorge","http://steamcommunity.com/profiles/76561197960281570/","136 products in account","Just the artistic visuals of this game alone is enough to sell it, however, you mix in a game play style not dedicated to combat an more to moving seamlessly an quickly around the map parkour style, you've got a hit. This surprisinglywas developed by DICE/EA games, before they murder my affection with BF3 and BF4.  Can't wait for a sequel and am praying that they will stick to the general non combat game play and amazing visuals.","June 25, 2014","true","18.9"," 1 person found this review helpful","0","1","1","0","0"
"http://steamcommunity.com/id/subject-name-here/recommended/17410/","subject-name-here","Divine","http://steamcommunity.com/id/subject-name-here/","103 products in account","The game with the most realistic first-person view. While a bit short, it has some great moments and a very nice art style that differs from other games that use dull colours. You HAVE to buy it!","December 18, 2010","true","323.8"," 1 person found this review helpful","0","1","1","0","0"
"http://steamcommunity.com/profiles/76561198100290863/recommended/17410/","76561198100290863","Kate {GC}","http://steamcommunity.com/profiles/76561198100290863/","35 products in account","Best game EVER!!!","June 19, 2014","true","23.6"," 1 person found this review helpful","0","1","1","0","0"
"http://steamcommunity.com/id/mcdux0r/recommended/17410/","mcdux0r","dux0r","http://steamcommunity.com/id/mcdux0r/","1067 products in account","Unique, gorgeous, fun to explore, polished as ♥♥♥♥ and shiny as hell. It's surprising how under-rated this game is, and how ♥♥♥♥ing well made it is considering it's an EA game, but Christ it's good. The art style is simple and ♥♥♥♥in gorgeous, like a primary coloured version of Deus Ex: HR. The pacing is perfect, the controls and level design are solid and there's even a lil story weaved into the stitch. VERY solid game, very fun and very worth picking up. Hard to find a single flaw.","April 11, 2013","true","33.5"," 1 person found this review helpful","0","1","1","0","0"
"http://steamcommunity.com/profiles/76561198045246930/recommended/17410/","76561198045246930","Buttcrack level 3","http://steamcommunity.com/profiles/76561198045246930/","179 products in account","This game takes platforming to a whole new level. it is a fast paced, challenging, action packed, hanging on the edge, kind of game. combined with beautiful graphics, an amazing soundtrack, and intesnse storyline, this game is the best of its kind. the only flaw being that the campaign is too short. i only wish to play more of it......","December 24, 2012","true","26.1"," 1 person found this review helpful","0","1","1","0","0"
"http://steamcommunity.com/id/ovyerus/recommended/17410/","ovyerus","Ovyerus","http://steamcommunity.com/id/ovyerus/","97 products in account","The City. A marvel of modern technology and science. Skyscrapers rise into the air everywhere.\nWhile it is a beautiful sight, the City can be a dangerous place for some individuals.\n\nIn Mirrors Edge, you take the role of a Runner called Faith who's sister has been framed of a murder that she didn't commit, and you are being chased by the police, also known as 'Blues' by the Runners.\n\nMirrors Edge lets you preform wall-runs. death-defying leaps across buildings and vaults over objects. The graphics for Mirrors Edge are magnificient. Sometimes I just wanted to be able to stop and just soak it all in.\n\nWhile the game has a very basic art style - mostly white and red with the occasional blue, orange or green - this tends to help the player focus on intense moments of action. The hud is not cluttered at all, as it only comprises of a small dot in the middle of screen, which is used for aiming weapons.\n\nMirrors Edge doesn't focus on combat and instead focuses on movement throughout the enviroment, which is why I would extremely recommend that you play this. 9/10","September 25, 2014","true","12.8"," 1 person found this review helpful","0","1","1","0","0"
"http://steamcommunity.com/id/royalvampire/recommended/17410/","royalvampire","Aphyxia","http://steamcommunity.com/id/royalvampire/","540 products in account","Best atmosphere, best ambient music, best gameplay.","February 24, 2012","true","11.9"," 1 person found this review helpful","0","1","1","0","0"
"http://steamcommunity.com/id/matosha/recommended/17410/","matosha","Matosha","http://steamcommunity.com/id/matosha/","643 products in account","This isnt your run-ofthemill game. This is the run-ofyourlife game.","June 25, 2014","true","1.5"," 1 person found this review helpful","0","1","1","0","0"
"http://steamcommunity.com/profiles/76561198020682263/recommended/17410/","76561198020682263","Riley Rhynoceros","http://steamcommunity.com/profiles/76561198020682263/","94 products in account","This is a very unusual game but the paranoia is your constant companion! This is what turns this game to a good game! Try it and you know what I mean!!! The story is not the best but the atmosphere pulls you into another universe!!!","June 23, 2014","true","0.8"," 1 person found this review helpful","0","1","1","0","0"
"http://steamcommunity.com/id/curlack/recommended/17410/","curlack","Cheeky Nandos","http://steamcommunity.com/id/curlack/","61 products in account","A bit short but very good gameplay","June 24, 2014","true","5.2"," 1 person found this review helpful","0","1","1","0","0"
"http://steamcommunity.com/profiles/76561198014768720/recommended/17410/","76561198014768720","PZerg","http://steamcommunity.com/profiles/76561198014768720/","23 products in account","exciting game indeed. too bad it makes me feel like im gonna throw up after like 30 min. it is in literal terms that i feel dizzy from all the spinning and rolling and stuff. i woudl finish the game if my body would let me","June 24, 2014","true","2.8"," 1 person found this review helpful","0","1","1","0","0"
"http://steamcommunity.com/profiles/76561198117030214/recommended/17410/","76561198117030214","McGrevz","http://steamcommunity.com/profiles/76561198117030214/","79 products in account","a lot of fun cant wait for the sequel","June 24, 2014","true","7.5"," 1 person found this review helpful","0","1","1","0","1"
"http://steamcommunity.com/profiles/76561197966665011/recommended/17410/","76561197966665011","redeaderator","http://steamcommunity.com/profiles/76561197966665011/","214 products in account","Very cool concept with striking visuals. If you've ever wanted to parkour your way across the tops of skyscrapers while dodging gunfire, look no further.\n\nMy only serious con is that the controls can be frustrating, and the path ahead isn't always 100% obvious.","June 23, 2014","true","5.4"," 1 person found this review helpful","0","1","1","0","0"
"http://steamcommunity.com/profiles/76561198125374844/recommended/17410/","76561198125374844","Yung Weaving","http://steamcommunity.com/profiles/76561198125374844/","31 products in account","Amazing if you love parkour and a beautiful colorful city and great fun just running and jumping around, but if you like to stick to the the story its not that great!","June 24, 2014","true","2.4"," 1 person found this review helpful","0","1","1","0","0"
"http://steamcommunity.com/id/Sir_Nomad49/recommended/17410/","Sir_Nomad49","Sir_Nomad49","http://steamcommunity.com/id/Sir_Nomad49/","108 products in account","Beautiful Game! Love it!","June 24, 2014","true","3.1"," 1 person found this review helpful","0","1","1","0","0"
"http://steamcommunity.com/profiles/76561198066296904/recommended/17410/","76561198066296904","♥♥  FEIST GEIST  ♥♥","http://steamcommunity.com/profiles/76561198066296904/","170 products in account","Probably one of my favorite games. It's like a first person platformer. The graphics are super pretty, and the gameplay flows really well. The only bad part is the combat, which they will hopefully fix in the sequel. There really isn't anything wrong with the game besides the combat, and the fact that it is unlike most other first person experiences.\n\nFive years later, the game is still way worth the money. The game is still pretty, and it's still a lot of fun.","June 24, 2014","true","26.0"," 1 person found this review helpful","0","1","1","0","0"
"http://steamcommunity.com/profiles/76561198046839830/recommended/17410/","76561198046839830","anikifox","http://steamcommunity.com/profiles/76561198046839830/","91 products in account","Jump off of buildings simulator","June 22, 2014","true","0.8"," 1 person found this review helpful","0","1","1","0","0"
"http://steamcommunity.com/profiles/76561198038971992/recommended/17410/","76561198038971992","Oji","http://steamcommunity.com/profiles/76561198038971992/","88 products in account","I remember playing a demo of this years ago. Can't believe it took me this long to finally play it. This game is amazing. 9.5/10!!! I love the artwork and especially the music. Can't wait for Faith to return in Mirrors Edge II.","June 22, 2014","true","10.3"," 1 person found this review helpful","0","1","1","0","0"
"http://steamcommunity.com/id/icekimi/recommended/17410/","icekimi","Berto","http://steamcommunity.com/id/icekimi/","497 products in account","I've finished it for 3 times already now, dispite some flaws and feeling more of a prototype than a full fledged game, Mirror's Edge is one of my favourite games this gen. And definitly one of the most visually engaging I have ever played.\n\n4,5/ 5","January 22, 2013","true","11.0"," 1 person found this review helpful","0","1","1","0","0"
"http://steamcommunity.com/id/7cgd/recommended/17410/","7cgd","=7Cav=SSG.Grace.D","http://steamcommunity.com/id/7cgd/","35 products in account","In Mirror's Edge, you can choose to either play aggressively or passively. The whole fun of the game (and the obvious core) is running around and doing parkour in possibly one of the most beautiful cities you could ever parkour in (and clean).\n\nFor a game released in 2009, it's more than what you could ask for (visually/aesthetically talking).\nThe clean, peaceful and safe feeling that the environment around you provides is simply amazing (which is funny seeing how sometimes you might be running for your life).\n\nEven though the overall game is visually stunning, some of the levels (again, visually speaking) will just keep you speechless (causing my deaths several times in several levels, but..."IT WAS TOTALLY WORTH IT."\n\nThe game itself, well. Some levels you will find incredibly frustrating and nearly impossible at times, but that's actually a good thing, or a pro about the game. The reason behind this is, because once you manage to accomplish the level, the satisfaction and the sense of accomplishment (and lets admit, cleverness) is beyond satisfying.\n\nCons? Well, my top recommendation is to disable physx. That is basically the killer of the game. It can cause severe (and I mean SEVERE) frame issues and lag, even going as far as crashing your game.\nI'd also recommend avoiding confrontation when faced against many cops or snipers (oh how I despise those snipers).\n\nOh and, you'll find out what I mean when I say that you should probably RUN FOR YOUR LIFE when you're being chased by your shadows (or runner's shadows, not quite a spoiler. As you probably don't have a clue of what I'm taking about).\n\nIf you're having problems in deciding if the game is worth it or not, I guarantee it, if you love parkour and stunning visuals, go for it. I'd also recommend it so you get to know the origin of Mirror's Edge (as the second one will be coming out eventually).\n\nWhat are you waiting for, buy the game!","March 7, 2014","true","11.7"," 1 person found this review helpful","0","1","1","0","0"
"http://steamcommunity.com/id/Blaze_it_michael/recommended/17410/","Blaze_it_michael","armadildo","http://steamcommunity.com/id/Blaze_it_michael/","134 products in account","You can run really fast and jump over things.","February 19, 2014","true","1.2"," 1 person found this review helpful","0","1","1","0","0"
"http://steamcommunity.com/profiles/76561198069609009/recommended/17410/","76561198069609009","crazypotatoman","http://steamcommunity.com/profiles/76561198069609009/","132 products in account","Incredible game. Once you get past the cheesy cut-scenes, it really shines. A refreshing take on the over-done shooter.","March 9, 2014","true","8.0"," 1 person found this review helpful","0","1","1","0","0"
"http://steamcommunity.com/id/thewizard__/recommended/17410/","thewizard__","陰茎 息","http://steamcommunity.com/id/thewizard__/","142 products in account","Great fun, but don't be an idiot like me and play this with the mouse and keyboard. The headaches were insane","March 10, 2014","true","0.6"," 1 person found this review helpful","0","1","1","0","0"
"http://steamcommunity.com/id/NickToon/recommended/17410/","NickToon","NickToon","http://steamcommunity.com/id/NickToon/","92 products in account","New movement, great to be able to move around the city in real parkour style.\nLooking forward to trying out the next game","March 13, 2014","true","6.4"," 1 person found this review helpful","0","1","1","0","0"
"http://steamcommunity.com/id/JPBM/recommended/17410/","JPBM","Lothar","http://steamcommunity.com/id/JPBM/","156 products in account","I have been wanting to play this since release. Forgot about it for years. Bought it and just finished the game - it was really enjoyable: fresh, dynamic. Really recommend especially on an offer! Game is a bit short but the gameplay is something quite unique.","December 26, 2013","true","7.7"," 1 person found this review helpful","0","1","1","0","2"
"http://steamcommunity.com/id/mrnovis/recommended/17410/","mrnovis","BRAIN CANCER","http://steamcommunity.com/id/mrnovis/","96 products in account","This is one of my favourite games. The story line isn't the best but gameplay and visuals are one of the best I ever seen. I recommend this game to everyone who like action games.\n\nJedna z mých nejoblíbenějších her. Příběh není nejlepší, ale hratelnost a vizuální kabátek jsou na velmi slušné úrovni. Doporučuji tuto hru všem co mají rádi akční hry.","February 23, 2014","true","13.8"," 1 person found this review helpful","0","1","1","0","0"
"http://steamcommunity.com/profiles/76561197985778488/recommended/17410/","76561197985778488","A$AP Edamame ( ͡° ͜ʖ ͡°)","http://steamcommunity.com/profiles/76561197985778488/","206 products in account","Jump. Land. Slide. Repeat.\n\nNow you've learned how to make love. Buy this game and you'll know what I mean.","September 11, 2013","true","0.3"," 1 person found this review helpful","0","1","1","0","1"
"http://steamcommunity.com/profiles/76561198013865579/recommended/17410/","76561198013865579","nilen435","http://steamcommunity.com/profiles/76561198013865579/","135 products in account","Awesome game play. Running and jumping on the roofs in the sun is really fun. Solar fields soundtrack makes the experience really magical at times. Its not the same to run inside the big buildings and underground which dont have the same "freedom" feeling. About half the game is inside which I feels could have been less. Then the story. I dont like it. Its not really intresting and it feels like the reason you go to diffrent missons is small coincidental things she hears which just happen to give a small clue to another place and then it just continuces like that. The story line seems weak and drawn out.","February 18, 2014","true","11.2"," 1 person found this review helpful","0","1","1","0","0"
"http://steamcommunity.com/id/derpasaures/recommended/17410/","derpasaures","Exceed","http://steamcommunity.com/id/derpasaures/","185 products in account","A very fun game with good controls and great graphics, parkour is the best part of the game (obviously), it feels very satisfying to land an awesome combo and the animation is just unbelievable, physx is amazing but one thing that isnt fun is the guns, although the sniper looks very badass.","February 24, 2014","true","9.3"," 1 person found this review helpful","0","1","1","0","0"
"http://steamcommunity.com/id/saxonprince/recommended/17410/","saxonprince","ocbd","http://steamcommunity.com/id/saxonprince/","63 products in account","Pure awesomeness.  Very refreshing world and unobtrusive storyline that helps to immerse yourself in the seemingly pure cityscape.  Great for anyone that likes parkour games, obviously, but almost any platform-lover will fall in love with the control scheme and the puzzles' mechanics.","December 29, 2013","true","6.5"," 1 person found this review helpful","0","1","1","0","0"
"http://steamcommunity.com/profiles/76561198067696688/recommended/17410/","76561198067696688","amb2","http://steamcommunity.com/profiles/76561198067696688/","415 products in account","Amazing, cult-classic game! Probably my favorite game from Electronic Arts ever, this was a parkour/FPS that was out before parkour was quite as famous as it is now. Tight controls and great graphics considering the year it came out, at a sale price of $4.99 this is a must play!","February 1, 2014","true","9.2"," 1 person found this review helpful","0","1","1","0","0"
"http://steamcommunity.com/profiles/76561197981580855/recommended/17410/","76561197981580855","Czarkasm","http://steamcommunity.com/profiles/76561197981580855/","367 products in account","Always thought this looked cool, got it on the summer sale. After actually playing through a game I buy on sale for once, I have to say I'm SUPER impressed. I absolutely loved the color design of the game, the plot, the lead character, everything. Extremely original and nothing like ANY other game out there today. Great getaway from the staple fps, moba, mmo, or rts. I can't praise this game enough, and I'm quite sad that I finished it so quickly. Def. has a few replay values, though. GET IT!","July 19, 2012","true","7.8"," 1 person found this review helpful","0","1","1","0","0"
"http://steamcommunity.com/profiles/76561198035849122/recommended/17410/","76561198035849122","SinCity.","http://steamcommunity.com/profiles/76561198035849122/","316 products in account","Parkour","February 16, 2014","true","5.9"," 1 person found this review helpful","0","1","1","0","0"
"http://steamcommunity.com/profiles/76561198084957408/recommended/17410/","76561198084957408","Goku","http://steamcommunity.com/profiles/76561198084957408/","205 products in account","A fun, fast paced action game, if you like first person shooters then you will like this, you can free run until you're hearts content","September 1, 2013","true","0.7"," 1 person found this review helpful","0","1","1","0","0"
"http://steamcommunity.com/id/dethorhyne/recommended/17410/","dethorhyne","Jue Viole Grace","http://steamcommunity.com/id/dethorhyne/","348 products in account","the most amazing parkour game ever developed.. all from first person view.. a certain must for all gamers!","July 13, 2012","true","24.1"," 1 person found this review helpful","0","1","1","0","0"
"http://steamcommunity.com/id/DavidHorm/recommended/17410/","DavidHorm","DavidHorm","http://steamcommunity.com/id/DavidHorm/","170 products in account","Completed the game in 5 hours in mostly normal, and then eventually turned the level down to easy. The story was 'meh', but at least there was some sort of story. This was the first game though, where I was really scared while playing. This isn't a horror game, but you do run away a lot. Whenever people show up with guns, I freak out, and noticed that I was holding my breath the whole time while trying to flee from the gunmen. Pretty fun puzzle game.","March 2, 2014","true","5.0"," 1 person found this review helpful","0","1","1","0","0"
"http://steamcommunity.com/profiles/76561198028029898/recommended/17410/","76561198028029898","Your Lord and Savior","http://steamcommunity.com/profiles/76561198028029898/","144 products in account","Very good game. I recommend it to everybody.","February 19, 2014","true","7.3"," 1 person found this review helpful","0","1","1","0","0"
"http://steamcommunity.com/profiles/76561198018806953/recommended/17410/","76561198018806953","FusionEyes","http://steamcommunity.com/profiles/76561198018806953/","404 products in account","Cats land on their feet. This lady does not. 7/10 Make more cat like","February 19, 2014","true","1.5"," 1 person found this review helpful","0","1","1","0","0"
"http://steamcommunity.com/profiles/76561198073456365/recommended/17410/","76561198073456365","Basara Tōjō","http://steamcommunity.com/profiles/76561198073456365/","77 products in account","one of the most adrenaline pumping games ever , simply from MR K , if u like adventure and jumping from one building to another like a maniac from an asylum   , u gotta get  it to get really crazy XD","August 23, 2013","true","5.4"," 1 person found this review helpful","0","1","1","0","0"
"http://steamcommunity.com/id/ArctickPyromancer/recommended/17410/","ArctickPyromancer","Arctick","http://steamcommunity.com/id/ArctickPyromancer/","140 products in account","Ever wanted to do parkour but were too scared?  Well, now you can throw yourself off buildings without fear!  You know you've always wanted to...","June 19, 2013","true","26.6"," 1 person found this review helpful","0","1","1","0","0"
"http://steamcommunity.com/profiles/76561198058995480/recommended/17410/","76561198058995480","Tombomb2000","http://steamcommunity.com/profiles/76561198058995480/","113 products in account","Mirrors edge is a great game with good solid gameplay however my only issue is the the length of the game and the story is not great either. overall this game is totally worth your time!","February 23, 2014","true","8.6"," 1 person found this review helpful","0","1","1","0","0"
"http://steamcommunity.com/id/Auqa3456/recommended/17410/","Auqa3456","Captain_Tofu","http://steamcommunity.com/id/Auqa3456/","270 products in account","This game is truly one of the best games i've played in literally my whole life! (Besides the Fallout series) I have had so much fun playing this and I look towards playing Mirrors Edge 2 :D:","February 3, 2014","true","19.4"," 1 person found this review helpful","0","1","1","0","0"
