"url","reviewerUsername","reviewerDisplayName","reviewerUrl","reviewerProductsCount","reviewText","date","recommended","hoursPlayed","voteText","helpfulPercent","votesHelpful","votesTotal","votesFunny","commentsCount"
"http://steamcommunity.com/id/wintrwolf/recommended/17410/","wintrwolf","WintrWolf","http://steamcommunity.com/id/wintrwolf/","299 products in account","Mirror's Edge is one of those games that was made a few years ago, but still wipes the floor with most recent games. Don't let EA's involvement in the game throw you off, this one was from before the dark days that give us nightmares every night.\n\nWhile the storyline of the game is not amazing, it is still pretty decent and is still more interesting than a lot of storylines in current games. The main appeal of this game for me was the apparent freedom of movement you have, even though the levels are quite linear. The wide-open level design makes you feel like the path you take is not necessarily the one and only path through the level, even though most of the time it is. The time trial levels reuse some of the storyline levels, which makes them somewhat repetitive yet familliar in an environment where practising easily makes you more comfortable with the section you are running.\n\nThe freerunning mechanics don't feel clunky and with the focus on momentum, they feel really fast and smooth when you are playing well and have a reasonable drop in this when you are not (which still does not make the freerunning feel clunky).\n\nConsidering the game was released in 2009 for PC, you don't need one of those new-fangled super-toaster 5000 with four bread slots and fast-defrost action- glueing a few potatoes together should suffice. Since the game is over five years old, it is pretty cheap now, too. Unless you don't like this kind of game, there isn't much argument for not giving it a go.","April 19, 2015","true","3.7"," 2 of 2 people (100%) found this review helpful","100","2","2","0","3"
"http://steamcommunity.com/id/niggatastic/recommended/17410/","niggatastic","Tobu","http://steamcommunity.com/id/niggatastic/","55 products in account","If you are new to ths game, its ♥♥♥♥ing hard, especially on pc. But its a good game, nonetheless.","September 5, 2013","true","9.0"," 2 of 2 people (100%) found this review helpful","100","2","2","0","1"
"http://steamcommunity.com/id/HamlessHamSandwich/recommended/17410/","HamlessHamSandwich","Breadless Sandwich","http://steamcommunity.com/id/HamlessHamSandwich/","484 products in account","I'm not sure what this game has to do with mirrors but the jumping running is pretty rad.","September 28, 2013","true","25.1"," 2 of 2 people (100%) found this review helpful 9 people found this review funny","100","2","2","9","0"
"http://steamcommunity.com/id/drboots/recommended/17410/","drboots","Dr Boots","http://steamcommunity.com/id/drboots/","174 products in account","A very solid platformer with some action thrown in for good measure.  This game forces you to think in real time to get to your goal while dodging trigger happy cops in some parts.  You could also relieve the cops of their weapons and show them how to put it to better use if you're more of an aggressive player.  The levels are fairly linear, but the overall gameplay experience is one that is quite enjoyable.\n\nIt would be a good idea to play this one with a controller.\n\nPros:\nSolid freerunning platforming action in first person.\nPhysX support, for those with Nvidia cards\nCombat sequences don't clash with the actual gameplay, and you can choose to take out your attackers in most cases.\nA few extra challenges added in to really test your ability to cover ground.\nTime Trial mode once you ace story mode.\nExcellent graphics and environments.\n\nCons:\nLow replayability\n\nAfterthoughts\nPlay this one with a controller, as the controls are better suited for a controller as opposed to a keyboard.  AMD/ATI folks should turn off PhysX, it will really cull your performance.","December 6, 2014","true","6.2"," 2 of 2 people (100%) found this review helpful","100","2","2","0","0"
"http://steamcommunity.com/id/4stock8minutes/recommended/17410/","4stock8minutes","Barry McRaspberry","http://steamcommunity.com/id/4stock8minutes/","30 products in account","1. Starts game\n2. Starts running\n3.Feels inspired by parkour\n4.Ends up in hospital\n\n10/10 would break bones again.","July 16, 2015","true","18.7"," 2 of 2 people (100%) found this review helpful 3 people found this review funny","100","2","2","3","0"
"http://steamcommunity.com/id/KHFan20/recommended/17410/","KHFan20","KHFan20","http://steamcommunity.com/id/KHFan20/","205 products in account","Definitely one of the best games ever made. I have never seen anything like this before or after this game's release. It's a bit on the short side, but has a lot of replayability to make up for it and a "Speed Run" mode, where you can compare your times with friends. The combat is for the most part foucsed on melee, however you can disarm your enemies if you wish to use a gun. Every movement you make feels fluid and satisfying. The $20 price tag may feel like a bit much at first, but I assure you that you will not regret buying this game.","August 25, 2013","true","32.8"," 2 of 2 people (100%) found this review helpful","100","2","2","0","0"
"http://steamcommunity.com/id/1directon/recommended/17410/","1directon","eSports| Another One","http://steamcommunity.com/id/1directon/","64 products in account","Game did not have any mirrors\n\nThe game was not edgy\n\n12/10","December 26, 2014","true","18.3"," 2 of 2 people (100%) found this review helpful 3 people found this review funny","100","2","2","3","0"
"http://steamcommunity.com/id/ludorexperiens/recommended/17410/","ludorexperiens","Ludor Experiens","http://steamcommunity.com/id/ludorexperiens/","27 products in account","Very fun parkour game with some combat elements.\nThis game is really short though, so I recommand only picking it up when it's on sale.\n\nSome of the complaints vs. my experiences:\n- "Combat is wonky"\n-> True, but this is not a fighting game, if you run past the enemies and try to escape, it adds some pressure, making it possibly more challenging.\n\n- "Parkour under pressure is not fun"\n-> Dunno, I had a lot of fun trying to figure out a route while being chased. Had something of a movie.\n\n- "Enemies either cannot hit you when you are standing right in front of them or snipe you over 500 miles"\n-> True, but to be more specific: When the game wants to push you or hold you out of a specific area (e.g. if you try leaving the map) enemies become deadly accurate. That way you stay on track and don't try to fight your way out. And that not every enemy is deadly accurate is actually a good thing, don't you think ;)\n\n- "bah too much gun figthing"\n-> Well, it is a game taking place in a distopian future and you are on the other side of the law. As I said, 90% of the time you shouldn't and in most of the other cases you don't need to engage in fights.","November 27, 2015","true","19.0"," 2 of 2 people (100%) found this review helpful","100","2","2","0","2"
"http://steamcommunity.com/id/touuqe/recommended/17410/","touuqe","touuqe","http://steamcommunity.com/id/touuqe/","588 products in account","Why don't you have this game yet?","October 25, 2014","true","19.0"," 2 of 2 people (100%) found this review helpful","100","2","2","0","0"
"http://steamcommunity.com/id/jrminja/recommended/17410/","jrminja","Negation","http://steamcommunity.com/id/jrminja/","171 products in account","Some of he most immersive visuals, gameplay and competeitive multiplayer I have ever been graced with. I fell for this game from the moment I played it on the iPad, Xbox 360 and now PC.\n\nAnd the next one is upcoming ;)","February 7, 2014","true","25.6"," 2 of 2 people (100%) found this review helpful","100","2","2","0","0"
"http://steamcommunity.com/id/littleglacey/recommended/17410/","littleglacey","boopsnoot","http://steamcommunity.com/id/littleglacey/","105 products in account","Great atmosphere, and the art style in the cutscenes is awesome.","December 23, 2013","true","1.6"," 2 of 2 people (100%) found this review helpful 1 person found this review funny","100","2","2","0","0"
"http://steamcommunity.com/profiles/76561198107559046/recommended/17410/","76561198107559046","Sixty Five","http://steamcommunity.com/profiles/76561198107559046/","219 products in account","One of the best games in the world.  If you like games you will like this.","October 13, 2014","true","19.9"," 2 of 2 people (100%) found this review helpful","100","2","2","0","0"
"http://steamcommunity.com/id/xchibichan/recommended/17410/","xchibichan","xchibichan","http://steamcommunity.com/id/xchibichan/","29 products in account","It's so awesome! Ten points. It's got great dynamics and it is very immersive.","June 28, 2014","true","14.6"," 2 of 2 people (100%) found this review helpful","100","2","2","0","0"
"http://steamcommunity.com/id/magn0053/recommended/17410/","magn0053","Magn0053","http://steamcommunity.com/id/magn0053/","535 products in account","Simply just a brilliant game,\n\nIf you like parkour, but can't figure out how to do it yourself, this is great.\nIf you like games with a good story, and gameplay, this is great.\nWhile you're waiting for the release of Mirror's Edge Catalyst, this is great (It'll probably also be afterwards)\n\n11/10","June 2, 2015","true","43.0"," 2 of 2 people (100%) found this review helpful","100","2","2","0","0"
"http://steamcommunity.com/id/ReapersRaven/recommended/17410/","ReapersRaven","ReapersRaven","http://steamcommunity.com/id/ReapersRaven/","387 products in account","Ok got this beautiful game on PS3 first when it came out now so many years later got it on PC\nFor it being 6 years old it still looks amazing\n\nAlso...  PARKOUR IS FUN!\n\n9/10","January 8, 2015","true","1.6"," 2 of 2 people (100%) found this review helpful","100","2","2","0","0"
"http://steamcommunity.com/id/cappjr/recommended/17410/","cappjr","Capp Juror OS","http://steamcommunity.com/id/cappjr/","296 products in account","I have always really admired the aesthetics and concept of this game, and its good moments truly shine for me. If you haven't tried it already and are intrigued by a AAA first-person parkour game, definitely go for it.","July 26, 2012","true","9.1"," 2 of 2 people (100%) found this review helpful","100","2","2","0","0"
"http://steamcommunity.com/profiles/76561198035509600/recommended/17410/","76561198035509600","Cheryl","http://steamcommunity.com/profiles/76561198035509600/","50 products in account","This is the only game where I have actually finished the campaign within 6 to 7 hours. I kind of got mad sometimes when I got stuck on the edge or corner of something in a time trial but other than that it's a great game and I cant wait for the second one to come out.","June 28, 2014","true","11.5"," 2 of 2 people (100%) found this review helpful","100","2","2","0","0"
"http://steamcommunity.com/id/Yazar8/recommended/17410/","Yazar8","Tamer","http://steamcommunity.com/id/Yazar8/","41 products in account","Good enough.","December 26, 2015","true","9.3"," 2 of 2 people (100%) found this review helpful","100","2","2","0","0"
"http://steamcommunity.com/id/n00bshr00m/recommended/17410/","n00bshr00m","n00bshr00m","http://steamcommunity.com/id/n00bshr00m/","226 products in account","10/10. One of the best games by graphically and soundwise. The Game runs well and the gameplay is really smooth. Parkouring is one of the things I've always wanted to do, so this game made it happen. Soundtrack is amazing. Cutscenes are well animated. Graphics are eye candy and action sequences works fine. You can run, but you can also defend yourself by using weapons, for example I tried the shotgun and holy poop it felt good when the enemies flew through the air when I burst 'em with it. I think that this game looks a lot better than many other new games. Run. Jump. Feel the air below your feet. This will be an experience you'll remember the rest of your life.","May 15, 2014","true","5.3"," 2 of 2 people (100%) found this review helpful","100","2","2","0","0"
"http://steamcommunity.com/id/L0lil0LOL1il0o/recommended/17410/","L0lil0LOL1il0o","posh manatee","http://steamcommunity.com/id/L0lil0LOL1il0o/","48 products in account","Jump Fwip Run. Where the bloody hell am i?\n\n142/10","January 20, 2015","true","10.2"," 2 of 2 people (100%) found this review helpful 3 people found this review funny","100","2","2","3","0"
"http://steamcommunity.com/profiles/76561198083755742/recommended/17410/","76561198083755742","Young Thug","http://steamcommunity.com/profiles/76561198083755742/","163 products in account","This might be hard to believe, but this man is the leader of a group of lizards from the hyper elite. I know this first hand. I took care of this being as the mentor, as I am a hyper elite of the syntax-sector of the Illuminati. I have experimented with teleportation, Obama, and lizards shape-shifting into Secret-service agents. When the syntax-sector of the hyper elite barracks in the north pole, most experiments broke loose. This prototype, however, was smarter than most. With little to no signs of lizard-like structures when shape-shifted, he was the perfect man for our job. I once used my transformation powers, but was quickly spotted, and the extra-molecular shape-shifting superdinosaur came and saved me, with the hyperbeam harvested from Dialga in the Pokemon dimension. Yes, that show is real, made by the Ancient Gods from Sector-B//AnimationDimension//X-3, we transported the creatures into the "intelligent" planet called Earth, in my opinion, the weakest sector of the whole Illuminati. If you want more information about these creatures first hand, contact me via Google+ or teleportating to the hyperdimension in Class-A.","February 8, 2015","true","0.7"," 2 of 2 people (100%) found this review helpful 3 people found this review funny","100","2","2","3","0"
"http://steamcommunity.com/id/vpderp/recommended/17410/","vpderp","Vice President Derp","http://steamcommunity.com/id/vpderp/","135 products in account","The most challenging part of the game is avoiding the combat.","May 11, 2015","true","15.2"," 2 of 2 people (100%) found this review helpful 2 people found this review funny","100","2","2","2","2"
"http://steamcommunity.com/id/ntzy/recommended/17410/","ntzy","`ntzy.土猫","http://steamcommunity.com/id/ntzy/","43 products in account","this game gave me motion sickness. 10/10 would use scopolamine before playing.","December 25, 2014","true","0.9"," 2 of 2 people (100%) found this review helpful 3 people found this review funny","100","2","2","3","0"
"http://steamcommunity.com/id/DxrShiift/recommended/17410/","DxrShiift","dakota","http://steamcommunity.com/id/DxrShiift/","442 products in account","has nothing to do with mirrors and if you fall off the edge you die","June 20, 2014","true","0.8"," 2 of 2 people (100%) found this review helpful 2 people found this review funny","100","2","2","2","0"
"http://steamcommunity.com/profiles/76561198061491322/recommended/17410/","76561198061491322","frog","http://steamcommunity.com/profiles/76561198061491322/","54 products in account","An actual good game made by EA? WHAT IS THIS?","August 8, 2015","true","7.1"," 2 of 2 people (100%) found this review helpful 1 person found this review funny","100","2","2","0","0"
"http://steamcommunity.com/id/Peeez/recommended/17410/","Peeez","peez","http://steamcommunity.com/id/Peeez/","72 products in account","its looks fun but i have vertigo","March 23, 2015","true","0.6"," 2 of 2 people (100%) found this review helpful 1 person found this review funny","100","2","2","0","0"
"http://steamcommunity.com/profiles/76561198067045221/recommended/17410/","76561198067045221","thedudeeight","http://steamcommunity.com/profiles/76561198067045221/","56 products in account","I recommend this game.\nIt has found its place among my top three most interesting games.\n\nThe gameplay itself is very immersing and may be worded in a very simplyfied way as problem solving under timelimits.\nIt is however very heavy in getting the right timing for performing the right action. Altough one may slow time down for a short while i rarely use it because it disrupts the gameflow (in my humble opinion).\nI could not play this game in full resolution (1920x1080) when there where multiple enemys appearing. Even so there are only barely visible differences when playing on 1360x768 pixels thanks to the way the levels are buildt.\n\nOne fustrating thing is the setting of Savepoints, that force you (especially in the later chapters) to start some long passages over once you die/fail. On the other hand really being forced to get longer sequences  and timings right gives this game its charm and made me think back to the first Rayman i played on a Gameboy advance.\n\nAll in all a fun first person parkour game/ 3D Platform jump and run, that gives you the freedom to either fight your way trough or run past all obstacles without harming anyone. Wheras the main point is to match your timing and finding your way.\n\nPs.: Because I played offline my game time was not recorded.\n","January 8","true","0.4"," 2 of 2 people (100%) found this review helpful","100","2","2","0","0"
"http://steamcommunity.com/profiles/76561198066620259/recommended/17410/","76561198066620259","Gooby","http://steamcommunity.com/profiles/76561198066620259/","25 products in account","Fun game, but frustrating!","January 9","true","5.0"," 2 of 2 people (100%) found this review helpful","100","2","2","0","0"
"http://steamcommunity.com/id/tgbw/recommended/17410/","tgbw","Tgbw","http://steamcommunity.com/id/tgbw/","23 products in account","Mirror's Edge was released back in 2009 with it's gorgeous visuals and brilliant mechanics that still hold up to today's game's standards. In the world of Mirror's Edge you live in a dystopian city that appears innocent and comfortable yet is corrupted by surveilance at every corner. In a city like this information usually tends to get around and no one's secrets tend to be safe. This is where you come in, you take the role of Faith who is a runner. Runners are highly trained free-runners who can get information from one side of the city to another without government organisations stealing information.\nAs for structure of the game itself most of the mechanics are great yet the controls can feel quite fiddly. Sometimes in missions you can feel almost lost not knowing where to go by simply overlooking the red glint of a ledge you can climb upon.\nThe story in quite linear but most would say that that is okay due to amount of sheer fun you get by pulling off fluent streams of actions and dashing by at high speeds which is realy what this game is about. Game duration is also quite low as I completed this game within 10 hours.\nEven though this review does appear somewhat negative I did truely have quite an extensive amount of fun with this game so i'm rating it a 6.7 / 10","February 27, 2015","true","14.2"," 2 of 2 people (100%) found this review helpful","100","2","2","0","0"
"http://steamcommunity.com/id/wat54346/recommended/17410/","wat54346","Kitsolin","http://steamcommunity.com/id/wat54346/","38 products in account","Mirrors edge a game full of talk. What is it about and why is it so popular? Well if you love free running first person gun shooting action this is the game for you. The story sets off as the main protaganist faith (late after she joins the runners) Finds out her sister was about to get framed for a murder. Faith tries hard throughout the game to cover her name while the cops thinking Faith was the one who killed the man. Now about the gameplay, It's a great parkour game with things like wall running climbing on pipes rolling and many others but your character specializes in hand to hand combat making things a whole lot interesting. You can take guns from people in great fashion and even jump kick them. With that being said the question "Are there any mods for this game"? are possible but you'd have to download them off the internet, not from the workshop. So back to the question "Why is this game so popular?" That's up to you to decide based on all the things i have talked about here So If you like games like this check out some gameplay or even buy it!","May 24, 2014","true","214.6"," 2 of 2 people (100%) found this review helpful","100","2","2","0","0"
"http://steamcommunity.com/id/tgbw/recommended/17410/","tgbw","Tgbw","http://steamcommunity.com/id/tgbw/","23 products in account","Mirror's Edge was released back in 2009 with it's gorgeous visuals and brilliant mechanics that still hold up to today's game's standards. In the world of Mirror's Edge you live in a dystopian city that appears innocent and comfortable yet is corrupted by surveilance at every corner. In a city like this information usually tends to get around and no one's secrets tend to be safe. This is where you come in, you take the role of Faith who is a runner. Runners are highly trained free-runners who can get information from one side of the city to another without government organisations stealing information.\nAs for structure of the game itself most of the mechanics are great yet the controls can feel quite fiddly. Sometimes in missions you can feel almost lost not knowing where to go by simply overlooking the red glint of a ledge you can climb upon.\nThe story in quite linear but most would say that that is okay due to amount of sheer fun you get by pulling off fluent streams of actions and dashing by at high speeds which is realy what this game is about. Game duration is also quite low as I completed this game within 10 hours.\nEven though this review does appear somewhat negative I did truely have quite an extensive amount of fun with this game so i'm rating it a 6.7 / 10","February 27, 2015","true","14.2"," 2 of 2 people (100%) found this review helpful","100","2","2","0","0"
"http://steamcommunity.com/id/wintrwolf/recommended/17410/","wintrwolf","WintrWolf","http://steamcommunity.com/id/wintrwolf/","299 products in account","Mirror's Edge is one of those games that was made a few years ago, but still wipes the floor with most recent games. Don't let EA's involvement in the game throw you off, this one was from before the dark days that give us nightmares every night.\n\nWhile the storyline of the game is not amazing, it is still pretty decent and is still more interesting than a lot of storylines in current games. The main appeal of this game for me was the apparent freedom of movement you have, even though the levels are quite linear. The wide-open level design makes you feel like the path you take is not necessarily the one and only path through the level, even though most of the time it is. The time trial levels reuse some of the storyline levels, which makes them somewhat repetitive yet familliar in an environment where practising easily makes you more comfortable with the section you are running.\n\nThe freerunning mechanics don't feel clunky and with the focus on momentum, they feel really fast and smooth when you are playing well and have a reasonable drop in this when you are not (which still does not make the freerunning feel clunky).\n\nConsidering the game was released in 2009 for PC, you don't need one of those new-fangled super-toaster 5000 with four bread slots and fast-defrost action- glueing a few potatoes together should suffice. Since the game is over five years old, it is pretty cheap now, too. Unless you don't like this kind of game, there isn't much argument for not giving it a go.","April 19, 2015","true","3.7"," 2 of 2 people (100%) found this review helpful","100","2","2","0","3"
"http://steamcommunity.com/id/n00bshr00m/recommended/17410/","n00bshr00m","n00bshr00m","http://steamcommunity.com/id/n00bshr00m/","226 products in account","10/10. One of the best games by graphically and soundwise. The Game runs well and the gameplay is really smooth. Parkouring is one of the things I've always wanted to do, so this game made it happen. Soundtrack is amazing. Cutscenes are well animated. Graphics are eye candy and action sequences works fine. You can run, but you can also defend yourself by using weapons, for example I tried the shotgun and holy poop it felt good when the enemies flew through the air when I burst 'em with it. I think that this game looks a lot better than many other new games. Run. Jump. Feel the air below your feet. This will be an experience you'll remember the rest of your life.","May 15, 2014","true","5.3"," 2 of 2 people (100%) found this review helpful","100","2","2","0","0"
"http://steamcommunity.com/id/epicduck445/recommended/17410/","epicduck445","Salt-O-Matic-3000","http://steamcommunity.com/id/epicduck445/","161 products in account","Epic game enuf said.","September 19, 2014","true","23.8"," 2 of 2 people (100%) found this review helpful","100","2","2","0","0"
"http://steamcommunity.com/id/Metal-Gear-Solid-Fan/recommended/17410/","Metal-Gear-Solid-Fan","Venom Snake™","http://steamcommunity.com/id/Metal-Gear-Solid-Fan/","65 products in account","If you love parkour you will love this game. Its so much fun. You can choose your way of completing missions.","June 21, 2014","true","19.5"," 2 of 2 people (100%) found this review helpful","100","2","2","0","0"
