"url","reviewerUsername","reviewerDisplayName","reviewerUrl","reviewerProductsCount","reviewText","date","recommended","hoursPlayed","voteText","helpfulPercent","votesHelpful","votesTotal","votesFunny","commentsCount"
"http://steamcommunity.com/id/bestviruzwholeuniverse/recommended/17410/","bestviruzwholeuniverse",":(","http://steamcommunity.com/id/bestviruzwholeuniverse/","109 products in account","Perfect for people who like parkour and free-runnin'.","December 13, 2013","true","4.6"," 5 of 5 people (100%) found this review helpful","100","5","5","0","0"
"http://steamcommunity.com/id/trustwortyunicorn/recommended/17410/","trustwortyunicorn","Planless","http://steamcommunity.com/id/trustwortyunicorn/","448 products in account","One of the first kind of this gender of games.","June 23, 2014","true","6.7"," 5 of 5 people (100%) found this review helpful 2 people found this review funny","100","5","5","2","0"
"http://steamcommunity.com/id/drlime/recommended/17410/","drlime","Dr.Lime   Gayness Overload","http://steamcommunity.com/id/drlime/","141 products in account","Mirror's Edge has an interesting story and nice graphics. It's a game worth buying.","April 6","true","15.0"," 5 of 5 people (100%) found this review helpful","100","5","5","0","0"
"http://steamcommunity.com/profiles/76561198030305825/recommended/17410/","76561198030305825","Anderson","http://steamcommunity.com/profiles/76561198030305825/","263 products in account","A very solid platformer.\n\nYou will like it if you liked Prince of Persia by Ubisoft.\n\nTypical cyberpunk with impressive first-person animated running and jumping.\n\nMuch better than the average game Electronic Arts releases every year.","January 25","true","8.6"," 5 of 5 people (100%) found this review helpful 1 person found this review funny","100","5","5","0","0"
"http://steamcommunity.com/id/Zyryanoff/recommended/17410/","Zyryanoff","Zyryanoff","http://steamcommunity.com/id/Zyryanoff/","285 products in account","Good games never getting old. This is one of the not many projects which still manages to stand out from the crowd... as mysterious Faith.\nIt is not about hardcore gameplay. It's all about master's mix of great music, colors and fascinating movements of parkour.\nIf you want to feel that energy but can't jog right now - try this and I think you'll like.","December 20, 2013","true","9.9"," 5 of 5 people (100%) found this review helpful","100","5","5","0","0"
"http://steamcommunity.com/id/ejbspeed/recommended/17410/","ejbspeed","Pywackett-Barchetta","http://steamcommunity.com/id/ejbspeed/","340 products in account","I really can't say I know of any games quite like this one. It may be short, but it leaves one heck of an impact, and will easily draw you in for more. Having previously played it on the Xbox 360, I can attest that while you can finish the whole story in one sitting with relative ease, you'll likely be playing the bits you liked over and over again.\n\nThe story is where the game really shines. You quickly learn that the primarily trigger-based controls are, while unique, pretty intuitive after a while. Everything in the game feels natural pretty quickly. Finding a path, stringing together acrobatic moves, and generally making your way around. Only the combat really feels stilted, with a same few punch animations. You're mostly encouraged simply to disarm opponents by tapping the Y button when their weapon is highlighted, which gives you their gun and instantly knocks them out. This can get tedious, but pacifist runs are possible.\n\nThe cutscenes have an animated comic sort of look to them. This is decent enough for getting the point across. The plot exists, primarily to get you between things to run around. It does a well enough job, and has quite a few surprises for only ten levels. The actual story levels themselves are like a combined puzzle platformer, as you mull over how to get where you're going and pull off some intensely satisfying parkour once you get the hang of it. The color scheme and lighting keeps the areas distinct from each other and easy on the eyes. It's a very particular, stylized look that benefits the game well.\n\nAs for replay value, as the main story is short and sweet (it does not overstay its welcome by any stretch, but you may be expecting a bit more at the end), the game banks on you enjoying time trials. Really, really enjoying time trials. Because that's all there is. No other challenges in any way, shape, or form, just be the fastest. To be fair, it's quite clear the game is designed for this exact purpose when you start shaving valuable seconds off and learning how to keep momentum going throughout your run, but if you don't like them, already got the three runner bags hidden in each level, and, for whatever reason, don't feel a little thrill at pulling an awesome time off, you've pretty much finished the game as soon as the credits roll.\n\nThe music is excellently fitting. The game overall can put a fantastic feeling of adrenaline into you, and a feeling of success when you figure out a new way through a level. There's no faster way to give someone a fear of heights than having them fall to their death in this game. The loading times are almost gone in the PC version (only three "Loading Level" screens still appeared for me), but the lengthy elevator rides and various delays meant to mask them are still perfectly intact, leading to some rather pointless waiting in the middle of a good run. Finally, the time trial scores are not registered through Steam. They are tracked through an EA Online account, which basically means you will not be finding your friend's times and racing your ghosts without a lot of undue effort.\n\nIn the end, though, this is quite the amazing game, and I must still recommend it, if only because it leaves an amazing impression and stands alone as an experience. There's just nothing quite like it.","June 8, 2014","true","21.9"," 6 of 7 people (86%) found this review helpful","86","6","7","0","0"
"http://steamcommunity.com/id/freemmaann/recommended/17410/","freemmaann","freemmaann: coding","http://steamcommunity.com/id/freemmaann/","112 products in account","Well, atleast the songs good.","September 21, 2014","true","8.5"," 6 of 7 people (86%) found this review helpful","86","6","7","0","0"
"http://steamcommunity.com/profiles/76561198010058862/recommended/17410/","76561198010058862","Lukas","http://steamcommunity.com/profiles/76561198010058862/","45 products in account","I first played this game back in 2009 when it came out and I still play it to this very day from time to time.\n\nGameplay is smooth with the perfect mix of realism and arcade elements to still make it a game. It really feels like you flow through the levels, quickly fight back (or escape) an enemy and get back on track running towards your goal. The game has also some of the greatests vistas of urban landscapes I have ever witnessed in a videogame. The level design is remarkably beautiful to date.\n\nSome negative aspects I could drag your attention to are its lenght and the way the story is presented. The game is short, no doubt. Although it offers a certain level or replayability because of its open level design, each time you play it you will finish it faster (but we can say that about just any game, can't we?). As for the story, it feels like it is just there; a filler that gives you a reason to run from point A to point B. But you do not really get into it and what you actually do in the game does not feel too much related to its further development.\n\nHowever, I do not think they are game breaking or that the experience suffers as a whole from these two elements, otherwise I would not have been playing it for the past 5 years, let alone recommend it.","February 26, 2015","true","45.9"," 6 of 7 people (86%) found this review helpful 1 person found this review funny","86","6","7","0","0"
"http://steamcommunity.com/id/ArmouredGeneral88/recommended/17410/","ArmouredGeneral88","ArmouredGeneral88","http://steamcommunity.com/id/ArmouredGeneral88/","83 products in account","Really great game built on a really good engine. The graphics are superb even though they are somewhat simplistic. It keeps you focused on the game and finding a path through each level (there are many differrent paths in each level). The story line is great however I think that they should have given more background information at the start of the game with a short movie as there are several things that don't get explained till well into the game which would make more sense if the backstory was told properly at the beginning.\n\nStill I love this game and am looking forward to Mirror's Edge 2.\n\n10/10 from me!","November 2, 2014","true","20.6"," 7 of 9 people (78%) found this review helpful","78","7","9","0","0"
"http://steamcommunity.com/id/good-natured_lazy_introvert/recommended/17410/","good-natured_lazy_introvert","EugenePip","http://steamcommunity.com/id/good-natured_lazy_introvert/","95 products in account","В конце ♥♥♥♥♥♥♥♥!","December 8, 2013","true","0.4"," 7 of 9 people (78%) found this review helpful","78","7","9","0","2"
"http://steamcommunity.com/profiles/76561197988903500/recommended/17410/","76561197988903500","hl2abortion.jpg","http://steamcommunity.com/profiles/76561197988903500/","1000 products in account","An accurate simulation of what it is like to be Jace Conners.","September 8, 2014","true","14.4"," 7 of 9 people (78%) found this review helpful 4 people found this review funny","78","7","9","4","0"
"http://steamcommunity.com/id/Victiny/recommended/17410/","Victiny","♥Victiny <HyperX>","http://steamcommunity.com/id/Victiny/","11 products in account","Pretty awesome game to play! I used to play it a lot on my other account!","November 23, 2014","true","5.2"," 4 of 4 people (100%) found this review helpful","100","4","4","0","0"
"http://steamcommunity.com/id/Sakamaha/recommended/17410/","Sakamaha","The Boy Wonder","http://steamcommunity.com/id/Sakamaha/","146 products in account","A very good and intresting game.\n\nThe game is unique in its own way. I really enjoy the parkour mechanics of the game, it is original and I have yet to experience anything like it in other titles. The world design is briliant, it is very clean and beautiful. Considering the game was realesed in 2009 makes it even more impressive. The graphics is really "up to date".\n\nThere are also a few things I did not like. The story is not the best and the gun play (whitch does appear frequently) is terrible. You cannot aim, you can't see your current ammo and you can't reload. This can be really frustrating in clutch scenarios and it does not help that the crosshair is bad.\n\nHowever, I would recommend this game to all the people that are looking for a parkour/running game with cool "jumps" and different ways to reach the target. The game is good on what it does, but not really anything more.\n\n\nI would like to excuse for any grammar or spelling mistakes, english is not my main language :)","June 29, 2014","true","7.9"," 4 of 4 people (100%) found this review helpful","100","4","4","0","1"
"http://steamcommunity.com/id/zardonic/recommended/17410/","zardonic","Zardonic","http://steamcommunity.com/id/zardonic/","288 products in account","An absolute masterpiece of innovative game design in every single way!","May 18, 2014","true","7.0"," 4 of 4 people (100%) found this review helpful","100","4","4","0","0"
"http://steamcommunity.com/id/deadgarry/recommended/17410/","deadgarry","MONSTER","http://steamcommunity.com/id/deadgarry/","697 products in account","Плюсы\n1.Очень хорошая графика\n2.Невероятный паркур\n3.Хорошая музыка\nМинусы\n1.Неудобное управление\nМоя оценка 9","April 18, 2013","true","0.6"," 4 of 4 people (100%) found this review helpful","100","4","4","0","0"
"http://steamcommunity.com/id/Narsuaq/recommended/17410/","Narsuaq","Narsuaq","http://steamcommunity.com/id/Narsuaq/","177 products in account","This is one of those rare games. It's not about parkour. It's not about killing the enemy. It's not about getting to the end. No, Mirror's Edge is much more. It's more about the place in which the atmosphere and music takes me. I can be standing on top of a rooftop looking out to the corrupt and broken city with its glimmering skyscrapers and effecient infrastructure. Or I can be hiding in out in a maintenance room listening to the whirling sounds of various pieces of machinery compliment the ambient soundtrack. No matter where I am in this game, I am always taken away, and it's that reason alone, that tiny reason, is why I love this game to death.","August 16, 2013","true","5.2"," 4 of 4 people (100%) found this review helpful","100","4","4","0","2"
"http://steamcommunity.com/id/rumwik/recommended/17410/","rumwik","garumwik","http://steamcommunity.com/id/rumwik/","92 products in account","released in 2009 and it still looks amazing.","December 3, 2013","true","44.2"," 4 of 4 people (100%) found this review helpful","100","4","4","0","0"
"http://steamcommunity.com/id/skippersaurus/recommended/17410/","skippersaurus","skippersaurus","http://steamcommunity.com/id/skippersaurus/","386 products in account","running around at the speed of sound\n-sanic","September 4, 2014","true","72.5"," 4 of 4 people (100%) found this review helpful 2 people found this review funny","100","4","4","2","7"
"http://steamcommunity.com/id/fox_dmitriy/recommended/17410/","fox_dmitriy","Frisk The Fox","http://steamcommunity.com/id/fox_dmitriy/","492 products in account","Оригинальная игрушка :3","December 27, 2011","true","7.6"," 4 of 4 people (100%) found this review helpful 1 person found this review funny","100","4","4","0","0"
"http://steamcommunity.com/id/bobthespacecadet/recommended/17410/","bobthespacecadet",""Bob" the Space Cadet","http://steamcommunity.com/id/bobthespacecadet/","699 products in account","It's a pretty short game, but it looks great on a good computer and it's a hulluva lot of fun running and jumping across the building-tops - especially when you get it right. Be prepared to fall a lot though ;)","March 21, 2012","true","9.0"," 4 of 4 people (100%) found this review helpful","100","4","4","0","0"
"http://steamcommunity.com/id/TheClawesome/recommended/17410/","TheClawesome","Clayton","http://steamcommunity.com/id/TheClawesome/","205 products in account","Awesome Game, great feel and art style, I have played it about 5 times over, never fails to be fun. Would recomend!","December 18, 2013","true","18.1"," 4 of 4 people (100%) found this review helpful","100","4","4","0","1"
"http://steamcommunity.com/id/milleniu/recommended/17410/","milleniu","milleniu","http://steamcommunity.com/id/milleniu/","30 products in account","This game is just amazing, even if you don't plan on trying to access the upper parts of the scoreboard, you should give it a try, because you'll have one of your best gaming experience","December 15, 2013","true","148.9"," 4 of 4 people (100%) found this review helpful","100","4","4","0","0"
"http://steamcommunity.com/id/1276357/recommended/17410/","1276357","SneakyToast","http://steamcommunity.com/id/1276357/","70 products in account","great training very nice graphics good voice actors great gameplay good fighting good moves good storyline cutcenses are amazing  awsome characters its like a parkour simulator except with cops its awsome busting doors jump attacks slide kicks combos disarms from behing and front great slowmotion for disarming this is far by the greatest game while it is also a First person shooter it doesnt mean you need to use weapons the climbing animation is amazing i love playing this and you can compete with friends to try and beat there time it is amazing","December 2, 2013","true","23.0"," 4 of 4 people (100%) found this review helpful","100","4","4","0","0"
"http://steamcommunity.com/id/cnfsdkid/recommended/17410/","cnfsdkid","User Root","http://steamcommunity.com/id/cnfsdkid/","59 products in account","You gotta have a little faith in Faith. You're gonna get shot, shocked or fall to your death multiple times.\n\nor\n\nI'm still clumsy virtually.","February 5","true","9.6"," 4 of 4 people (100%) found this review helpful 2 people found this review funny","100","4","4","2","0"
"http://steamcommunity.com/id/frugl1/recommended/17410/","frugl1","Frugl1","http://steamcommunity.com/id/frugl1/","1242 products in account","While Mirror's Edge may be both short and easy, it is also one of the most innovative interpretations of the platforming genre in recent memory. The gameplay has a great flow to it and the pacing is great (and ignoring a few bottlenecks in the level design). Oh, and it looks nice!","July 2, 2015","true","9.4"," 4 of 4 people (100%) found this review helpful 3 people found this review funny","100","4","4","3","0"
"http://steamcommunity.com/id/Strife_Cloud/recommended/17410/","Strife_Cloud","Cloud Strife","http://steamcommunity.com/id/Strife_Cloud/","86 products in account","quite an interesting game. Graphics were lovely and the music is just absolutely beautiful.","March 3, 2014","true","5.5"," 4 of 4 people (100%) found this review helpful","100","4","4","0","0"
"http://steamcommunity.com/id/asanoy_28/recommended/17410/","asanoy_28","Dark † Blaze","http://steamcommunity.com/id/asanoy_28/","407 products in account","AWESOME GAME!\nI really liked the parkour style gameplay. Kickass game!\nI was surprised that the ending mission took less than 5 seconds on my first try, maybe because I followed my instincts as Faith and haven't done otherwise.\n\nWhat I don't like in this game is that I can't disarm opponents early in the game. I just learned it when I'm already at chapter 8 when I used my adrenaline first then was able to successfully disarm an opponent. Another thing I hate though, is that I had motion sickness in early levels...\n\nI don't know about the game's replay value since I just completed normal mode in 10 hours, and I don't think that I would play it on hard mode. Also, I got all the bags before I ended it with the help of a guide.\n\nBut overall, I'd recommend this game to anyone who likes action-type games, since I really enjoyed it.\n\nThumbs up, yow! I heard part 2 is coming. Will wait for its release.\n","March 10, 2015","true","10.3"," 4 of 4 people (100%) found this review helpful 1 person found this review funny","100","4","4","0","0"
"http://steamcommunity.com/id/R1997/recommended/17410/","R1997","RAGNOS","http://steamcommunity.com/id/R1997/","407 products in account","Overal rating: 10/10\n\nGood:\n+Story\n+Parkour\n+Fight scenes\n+Funny animations\n\nBad:\n-Weapons are ruining the game little bit\n-Sometimes you fall of the building for no reason\n\nConclusion:\nFinished it 3 times can't wait for second one, if you love the action and fast movements this is for you.","August 21, 2014","true","8.7"," 4 of 4 people (100%) found this review helpful","100","4","4","0","0"
"http://steamcommunity.com/id/asanoy_28/recommended/17410/","asanoy_28","Dark † Blaze","http://steamcommunity.com/id/asanoy_28/","407 products in account","AWESOME GAME!\nI really liked the parkour style gameplay. Kickass game!\nI was surprised that the ending mission took less than 5 seconds on my first try, maybe because I followed my instincts as Faith and haven't done otherwise.\n\nWhat I don't like in this game is that I can't disarm opponents early in the game. I just learned it when I'm already at chapter 8 when I used my adrenaline first then was able to successfully disarm an opponent. Another thing I hate though, is that I had motion sickness in early levels...\n\nI don't know about the game's replay value since I just completed normal mode in 10 hours, and I don't think that I would play it on hard mode. Also, I got all the bags before I ended it with the help of a guide.\n\nBut overall, I'd recommend this game to anyone who likes action-type games, since I really enjoyed it.\n\nThumbs up, yow! I heard part 2 is coming. Will wait for its release.\n","March 10, 2015","true","10.3"," 4 of 4 people (100%) found this review helpful 1 person found this review funny","100","4","4","0","0"
"http://steamcommunity.com/id/gingaimaninja/recommended/17410/","gingaimaninja","gingaimaninja","http://steamcommunity.com/id/gingaimaninja/","58 products in account","Now that I have a time trial world record, I have to fight to keep the ladies off of me. 10/10.","November 27, 2014","true","845.1"," 4 of 4 people (100%) found this review helpful 3 people found this review funny","100","4","4","3","0"
"http://steamcommunity.com/id/ThatOneCheetah/recommended/17410/","ThatOneCheetah","Arena","http://steamcommunity.com/id/ThatOneCheetah/","145 products in account","Played it on Xbox and PC, both nice experiences.\n\nNote for people with an NVidia GPU: Disable PhysX, glass shattering will destroy your fps otherwise.","July 14, 2015","true","3.9"," 4 of 4 people (100%) found this review helpful","100","4","4","0","0"
"http://steamcommunity.com/id/miiniik/recommended/17410/","miiniik","MiiniiK","http://steamcommunity.com/id/miiniik/","125 products in account","Have you ever played a game that is so intense that it makes your palms sweaty? Your heart feels like it’ll beat out of your chest as a jolt of adrenaline runs through your system. You know those games? Yeah, Mirror’s Edge is one of those games.","March 5","true","1.7"," 4 of 4 people (100%) found this review helpful 1 person found this review funny","100","4","4","0","0"
"http://steamcommunity.com/id/nomad3117/recommended/17410/","nomad3117","Fuck Norris","http://steamcommunity.com/id/nomad3117/","264 products in account","Although the campaign is easily 4 hours long on normal difficulty, I would still recommend this game to anybody of all tastes. This is a unique blend of first-person action and platformer style puzzle solving. Although the story isn't very engaging, it fits the atmosphere of the game perfectly. The visuals are stunning if not photorealistic at times. It performs very well and you will encounter very little problems and bugs along the way\n\nPros\n\n+Stunning Graphics.\n+Easy to learn, hard to master gameplay.\n+Engaging and captivating atmosphere.\n+Appropriate storyline which fits well into the game's universe.\n+Arcade mode for speedruns\n\nCons\n-Poor AI sometimes throwing the game off balance.\n-Short Story mode 4-5 hours on first playthough.\n-Lack of graphics customisation\n-Little extra content\n-Very linear\n\nUltimately I would recommend this game, especially as it it dirt cheap. It is well worth a play through and I guarantee it will leave a lasting impression on the player for years to come.","November 12, 2015","true","4.3"," 4 of 4 people (100%) found this review helpful 1 person found this review funny","100","4","4","0","0"
"http://steamcommunity.com/id/TheThornZ/recommended/17410/","TheThornZ","Asylum Bound Games","http://steamcommunity.com/id/TheThornZ/","186 products in account","Great game but you must have a 360 controller for this. I had a really hard time getting through even the most basic tasks with the keyboard and mouse. To be honest I do not have a gaming keyboard and mouse so I am uncertain if that would make a difference or not. Night and day between controller and keyboard. Great story, graphics and it keeps you wanting to play more.","May 19, 2015","true","3.1"," 4 of 4 people (100%) found this review helpful","100","4","4","0","0"
"http://steamcommunity.com/profiles/76561198268907009/recommended/17410/","76561198268907009","josephall3n","http://steamcommunity.com/profiles/76561198268907009/","18 products in account","I have extensively played this game through over and over.With the new game (and beta) on the horizon i thought i'd play through it again.When it's free-flowing, there's no game like it.However, gun play and sticky combat prevent it from being a completely free flowing design.There IS a story here, even if parts get lost in cartoon-like cutscenes and dodgy dialogue.I recommend this game to anyone to get an idea of what Mirrors Edge is all about before they buy Catalyst9the new game).","April 15","true","17.6"," 4 of 4 people (100%) found this review helpful","100","4","4","0","0"
"http://steamcommunity.com/id/Abdulla-/recommended/17410/","Abdulla-","Abdulla","http://steamcommunity.com/id/Abdulla-/","305 products in account","You play as character name Faith her sister arrested for something she didn’t do, you get to jump from rooftop to the next it’s fun, the puzzles are awesome it really let you think to work your situation, the game will be short if you know your control but very nice game, problem with the game was PhysX didn’t work in my pc and the story was not that much you play it more for gameplay then story.","April 13","true","4.5"," 4 of 4 people (100%) found this review helpful 1 person found this review funny","100","4","4","0","1"
"http://steamcommunity.com/id/mandalorez/recommended/17410/","mandalorez","The Deer Hunter","http://steamcommunity.com/id/mandalorez/","321 products in account","Mirror's Edge brings a new style to gaming. It's futuristic vividly colored landscapes and parkour style adds a new depth to the game. Although the campaign is rather short and the multiplayer aspect seems limited, it was a breath taking game that I'd never tried before. The ending will want you grasping for the sequel.","December 22, 2014","true","18.5"," 5 of 6 people (83%) found this review helpful","83","5","6","0","0"
"http://steamcommunity.com/id/pinkjazztrancers/recommended/17410/","pinkjazztrancers","yes","http://steamcommunity.com/id/pinkjazztrancers/","332 products in account","Great game, can't wait for the sequel.","October 31, 2014","true","5.9"," 5 of 6 people (83%) found this review helpful","83","5","6","0","0"
