"url","reviewerUsername","reviewerDisplayName","reviewerUrl","reviewerProductsCount","reviewText","date","recommended","hoursPlayed","voteText","helpfulPercent","votesHelpful","votesTotal","votesFunny","commentsCount"
"http://steamcommunity.com/id/digixros/recommended/18040/","digixros","Atlas","http://steamcommunity.com/id/digixros/","1606 products in account","Easy to play, funny story and funny dialogue. Story length properly, you don't need to collect the best equipment like Diablo and you will get all achievements if you play carefully in single playthrough. The game hasn't had complicated equipment and upgrade system(I think this is a shortcoming too).\n易上手，剧情欢乐，流程短，成就剧情全解一天足矣，不需要刷刷刷，没繁杂的装备和升级系统（也是缺点）。不过我玩起来感觉还是普普通通的。","December 4, 2013","true","20.5"," 0 of 1 people (0%) found this review helpful","0","0","1","0","0"
"http://steamcommunity.com/id/silviodella/recommended/18040/","silviodella","Frigo","http://steamcommunity.com/id/silviodella/","76 products in account","davvero divertente, alla lunga diventa ripetitivo ma consiglio di provarlo.","November 26, 2013","true","0.6"," 0 of 1 people (0%) found this review helpful","0","0","1","0","0"
"http://steamcommunity.com/id/Torghatten/recommended/18040/","Torghatten","Torghatten","http://steamcommunity.com/id/Torghatten/","230 products in account","Шедевр как он есть: диалоги, квесты и рисовка - особенно!\nПридраться можно разве что к нескольким скриптам в паре мест.","May 27, 2013","true","11.0"," 0 of 1 people (0%) found this review helpful","0","0","1","0","0"
"http://steamcommunity.com/id/DragonOfTime/recommended/18040/","DragonOfTime","DragonOfTime","http://steamcommunity.com/id/DragonOfTime/","1080 products in account","This game is simply hilarious. It is the game where I laughed the most while playing ever. If you like the whacky humor of games like Sam & Max or Monkey Island, you'll definately like it.","November 27, 2010","true","10.6"," 0 of 1 people (0%) found this review helpful","0","0","1","0","0"
"http://steamcommunity.com/id/jstamos013/recommended/18040/","jstamos013","Stamos","http://steamcommunity.com/id/jstamos013/","1142 products in account","Deathspank is diablo gameplay combined with...some absurd humor. I feel as if the humor fits a specific comedy style but I can't recall exactly what that is. In any case, the result is kind of boring. The jokes occasionally elicit a "...heh." in classic internet fashion and the gameplay is stale after 5 minutes.\n","May 15","false","2.0"," 0 of 1 people (0%) found this review helpful","0","0","1","0","0"
"http://steamcommunity.com/id/gxam/recommended/18040/","gxam","gxam","http://steamcommunity.com/id/gxam/","388 products in account","This game is mechanically boring.  It lives or dies based on whether or not you find its humor amusing.  I mostly did not.  If you find rainbow colored unicorn feces amusing, though, you might enjoy it more than I did.","September 22, 2014","false","9.9"," 8 of 18 people (44%) found this review helpful 2 people found this review funny","44","8","18","2","0"
"http://steamcommunity.com/id/neulyiaa/recommended/18040/","neulyiaa","Anowi","http://steamcommunity.com/id/neulyiaa/","4351 products in account","그럭저럭 할만한 인디 rpg 게임\n\n가볍게 시간 때우기로 좋다.","November 8, 2013","true","8.3"," 4 of 10 people (40%) found this review helpful","40","4","10","0","0"
"http://steamcommunity.com/id/pwkfisher/recommended/18040/","pwkfisher","Shark Joe","http://steamcommunity.com/id/pwkfisher/","628 products in account",""Greetings, Taco Wench!"\n\nWhile the gameplay is a little hacky-slashy and not very fun to play in continuous large chunks, the humor in this game is hilarious and worth the price of admission.  Play every day for about an hour-two hours at a time, and you'll love this game.","July 3, 2011","true","9.5"," 0 of 2 people (0%) found this review helpful","0","0","2","0","0"
"http://steamcommunity.com/id/Skaery/recommended/18040/","Skaery","Skaery","http://steamcommunity.com/id/Skaery/","4374 products in account",""The Epic Humor of Ron Gilbert" - that's all you really need to know, since you can't go wrong with a game from the guy behind the Monkey Island franchise. The game is not very long, but then again, the price isn't that high. Get the game for the humour, which is great.","November 24, 2010","true","7.7"," 0 of 2 people (0%) found this review helpful","0","0","2","0","0"
"http://steamcommunity.com/profiles/76561198102559988/recommended/18040/","76561198102559988","jorge_sayavedra","http://steamcommunity.com/profiles/76561198102559988/","243 products in account","Very fun game!","October 30, 2013","true","11.5"," 0 of 2 people (0%) found this review helpful","0","0","2","0","4"
"http://steamcommunity.com/id/SergeantBunsley/recommended/18040/","SergeantBunsley","Bunsley","http://steamcommunity.com/id/SergeantBunsley/","153 products in account","This is basically what Bunsley sounds like.","March 22, 2014","true","8.7"," 0 of 2 people (0%) found this review helpful","0","0","2","0","1"
"http://steamcommunity.com/profiles/76561198038156154/recommended/18040/","76561198038156154","Klao","http://steamcommunity.com/profiles/76561198038156154/","380 products in account","8/10","February 28, 2014","true","11.8"," 0 of 4 people (0%) found this review helpful","0","0","4","0","0"
"http://steamcommunity.com/id/DCCXVIII/recommended/18040/","DCCXVIII","DCCXVIII","http://steamcommunity.com/id/DCCXVIII/","56 products in account","Pick it up for less than $5. Otherwise don't bother.","August 16, 2015","false","20.1"," 0 of 4 people (0%) found this review helpful","0","0","4","0","0"
"http://steamcommunity.com/id/Meatsteak/recommended/18040/","Meatsteak","Meatsteak","http://steamcommunity.com/id/Meatsteak/","285 products in account","While I did enjoy the brain-dead humour for a while, it wasn't long until I got bored of the brain-dead gameplay.  There simply isn't enough variation and challenge, and the fetch-the-thing missions are just there to waste your time.\n\nCompleted over half, but I don't care about finishing it.","January 7, 2014","false","8.1"," 6 of 17 people (35%) found this review helpful","35","6","17","0","0"
"http://steamcommunity.com/id/NAANNOOO/recommended/18040/","NAANNOOO","(((Nano Shinonome)))","http://steamcommunity.com/id/NAANNOOO/","1185 products in account","no","February 20","false","0.2"," 2 of 9 people (22%) found this review helpful","22","2","9","0","0"
"http://steamcommunity.com/profiles/76561198022205580/recommended/18040/","76561198022205580","lundse","http://steamcommunity.com/profiles/76561198022205580/","20 products in account","Not very funny, uninteresting gameplay, too simple. Felt short, but I was actually kind of relieved. Did not enjoy the second half, bc of repetition. I love levelling/loot and humour in games - but neither worked here.","September 25, 2014","false","16.0"," 2 of 12 people (17%) found this review helpful","17","2","12","0","0"
"http://steamcommunity.com/id/sadyc/recommended/18040/","sadyc","sadyc","http://steamcommunity.com/id/sadyc/","483 products in account","Not as funny as it wants to be. And on top of that the gameplay is bad compared with other action rpgs in our days.","December 2, 2013","false","0.5"," 2 of 13 people (15%) found this review helpful","15","2","13","0","0"
"http://steamcommunity.com/id/Xanaset/recommended/18040/","Xanaset","Caketown","http://steamcommunity.com/id/Xanaset/","225 products in account","First joke: "HA HA HA HA"\nSecond joke: "Heh, heh..."\nThird joke: "Hmm..."\nFourth joke: *quit*\n\nNot sure what the fifth joke is like but I'm pretty sure i won't be going back to find out.\nEasily skippable unless you are very easily amused.","April 17, 2012","false","3.4"," 7 of 25 people (28%) found this review helpful 1 person found this review funny","28","7","25","0","0"
"http://steamcommunity.com/id/itchypoop/recommended/18040/","itchypoop","Kami","http://steamcommunity.com/id/itchypoop/","172 products in account","I can't remember when i bought this game, or why. What i do remember is that about four hours in i was bored out of my mind and another five hours later i coulden't take it any more. Shure the humor is pretty good in this game, but after a while it gets onboxious and irritating.\n\nThe same goes for the gameplay, something that is fun at first soon becomes very grindy and a bit confusing. It looked way more fun in the videos than it really was. I'm shure alot of people liked this game, but I could not force myself to play it thru to the end.","December 3, 2013","false","9.6"," 1 of 12 people (8%) found this review helpful","8","1","12","0","0"
"http://steamcommunity.com/id/slicer3500/recommended/18040/","slicer3500","Slicer3500","http://steamcommunity.com/id/slicer3500/","134 products in account","Worst game I have EVER played, never buy it, it is slow, has  stupid humor (I wouldn't even call it humor) and It is just an ugly game. sorry HotHead Games but this is your worst game you have ever made","November 27, 2013","false","3.3"," 2 of 17 people (12%) found this review helpful","12","2","17","0","0"
"http://steamcommunity.com/profiles/76561198092010120/recommended/18040/","76561198092010120","LT.Billy","http://steamcommunity.com/profiles/76561198092010120/","67 products in account","I Cant Play The GAME! :(","April 8, 2014","false","0.2"," 0 of 14 people (0%) found this review helpful 1 person found this review funny","0","0","14","0","0"
"http://steamcommunity.com/id/cleverurl/recommended/18040/","cleverurl","cleverusername","http://steamcommunity.com/id/cleverurl/","231 products in account","Good game mechanics, great storyline, fantastic humor. Great game that is extremely well made.","June 30, 2011","true","30.1"," No ratings yet","0","0","0","0","0"
"http://steamcommunity.com/id/Fexlom/recommended/18040/","Fexlom","Fexlom","http://steamcommunity.com/id/Fexlom/","1048 products in account","","December 19, 2014","true","13.7"," No ratings yet","0","0","0","0","0"
"http://steamcommunity.com/id/needlescro/recommended/18040/","needlescro","needlescro","http://steamcommunity.com/id/needlescro/","542 products in account","Nice little ARPG, nice childish humor...","December 22, 2014","true","14.5"," No ratings yet","0","0","0","0","0"
"http://steamcommunity.com/profiles/76561198014097194/recommended/18040/","76561198014097194","Makikomi","http://steamcommunity.com/profiles/76561198014097194/","613 products in account","An arcade-style RPG with silly voices, silly scripts, silly monsters and silly quests. It's not a terribly serious game. But it's very enjoyable and very good! :)","January 15, 2011","true","20.1"," No ratings yet","0","0","0","0","0"
"http://steamcommunity.com/profiles/76561198068434361/recommended/18040/","76561198068434361","Captain of the Black Egrets","http://steamcommunity.com/profiles/76561198068434361/","80 products in account","THIS GAME IS THE BEST. The gameplay is really intuitive, the dialogue options are hilarious and numerous, and the plot is super easy to advance. 10/10, would play again.","November 22, 2014","true","1.0"," No ratings yet","0","0","0","0","0"
"http://steamcommunity.com/id/RonAFGreve/recommended/18040/","RonAFGreve","Ron AF Greve","http://steamcommunity.com/id/RonAFGreve/","236 products in account","The Deathspank series and 'On the Rain Slick Precipice of Darkness' 1 and 2 are all cartoon like games with, first and foremost, lots of fun dialogues. I got the first Precipice game in a bundle and just gave it a try, then after finishing bought the others.\n\nThese are all great games, I love the 2D artwork and the way the whole thing is put together. For instance, mall details like when you switch weapons you see Deathspank wielding it in the preview (I know this is common among the bigger game developers but for a relatively unknown game maker it is nice to see that they created a finished rather than a rushed product) .\n\nUnfortunately the screenshots alone do not do these games justice since you are not aware of the funny dialogue (if the first game wouldn't have come with the bundle, I bought, I probably wouldn't have tried them at all).\n\nDeathspank is secondly a hack and slash. Although you die rather frequently (ok, I die rather frequently :-) ), you will just respawn close by so it isn't such a big deal. Personally I have set it to the easy setting and then it should be playable by anyone, I think.\n\nI really love all of these games and finished ORSPD 1 and 2 twice (note that I didn't play ORSPD 3 and 4 because these are different kind of games with retro graphics)  and Deathspank 1 once.\n\nI would recommend any of them if you enjoy a not so serious game with lots of fun dialogue.","October 18, 2014","true","66.8"," No ratings yet","0","0","0","0","0"
"http://steamcommunity.com/id/damned_queen/recommended/18040/","damned_queen","Damned Queen","http://steamcommunity.com/id/damned_queen/","140 products in account","I love it!\nVery funny and entertaining, couldn't stop playing.\nGreat great RPG that makes fun of the usual RPGs XD","November 16, 2014","true","28.0"," No ratings yet","0","0","0","0","0"
"http://steamcommunity.com/profiles/76561198028854198/recommended/18040/","76561198028854198","Trixtergal","http://steamcommunity.com/profiles/76561198028854198/","9 products in account","Absolutely loved this game, played the whole series. really good for some downtime","November 11, 2014","true","11.8"," No ratings yet","0","0","0","0","0"
"http://steamcommunity.com/profiles/76561198060567736/recommended/18040/","76561198060567736","Aaron","http://steamcommunity.com/profiles/76561198060567736/","338 products in account","Tons of fun and somewhat funny.","July 10, 2014","true","7.9"," No ratings yet","0","0","0","0","0"
"http://steamcommunity.com/profiles/76561198064586532/recommended/18040/","76561198064586532","Blkik","http://steamcommunity.com/profiles/76561198064586532/","140 products in account","Awesome game. One of my favorites. Love it\nGraphics, animation, enviroment and music is  well made.\n\nFunny Heroe, Sarcastic dialoques, Epic Humor,  Large world with lots of sidequests (some extremelly ridiculous) and enough of hours to play. Lots of loot: cash, food, weapons, items.\nEnjoyable, addicted and quite hard\n\nI have played all three of the series but this is my favorite","August 4, 2014","true","16.5"," No ratings yet","0","0","0","0","0"
"http://steamcommunity.com/profiles/76561198058372781/recommended/18040/","76561198058372781","Siq Trix","http://steamcommunity.com/profiles/76561198058372781/","149 products in account","Some things that happened when i played this games include: giggling, snorting, farting, laughing outloud, gasping at jokes and having alot of fun playing. did get a little tedious by the end but well worth my time. The lolz are genuine.","July 18, 2014","true","13.1"," No ratings yet","0","0","0","0","0"
"http://steamcommunity.com/id/googleman81/recommended/18040/","googleman81","googleman81","http://steamcommunity.com/id/googleman81/","253 products in account","this game is awesome. it has death and spanks and deathspanks and chickens and english accents. what a ride!","December 10, 2010","true","12.3"," No ratings yet","0","0","0","0","1"
"http://steamcommunity.com/id/chen-doge/recommended/18040/","chen-doge","chen-doge","http://steamcommunity.com/id/chen-doge/","369 products in account","dis ♥♥♥♥ is fun, yo","December 30, 2010","true","9.2"," No ratings yet","0","0","0","0","0"
"http://steamcommunity.com/id/khazmirr25/recommended/18040/","khazmirr25","Mother Fucker","http://steamcommunity.com/id/khazmirr25/","177 products in account","awesome game!","June 27, 2014","true","0.7"," No ratings yet","0","0","0","0","0"
"http://steamcommunity.com/id/linkalee/recommended/18040/","linkalee","Linkalee","http://steamcommunity.com/id/linkalee/","126 products in account","I have mixed feelings for Deathspank. It's very obvious it's from an Indie developer; the controls are kind of odd, but you can rebind them, or just ignore them like me and hack and slash your way to over 200k damage taken (no death statistic is terrible). The fact that you can't actually turn off click-to-move except while holding down a key is awkward. The music gets repetitive after a while, and it might get confusing as to where to head next. And the questing system is just your generic boring questing system. But where Deathspank shines most is the dialogue, oh my God. Even most item descriptions are pretty random and humerous. The graphics are pretty nice too, I like them, and I also like the very original enemy types (Kangamoos, Bearalopes, and Sabretooth Donkeys come to mind). Dragons look kind of strange, more like reptilian orcs than anything else, but all the others are just amazing and perfect. If you like randomess and don't mind subpar mechanics, you'll enjoy this a lot.","May 17, 2012","true","13.5"," No ratings yet","0","0","0","0","0"
"http://steamcommunity.com/id/fgsouza/recommended/18040/","fgsouza","fgsouza","http://steamcommunity.com/id/fgsouza/","245 products in account","Great game, witty and funny. A good throwback to the old times.","January 15, 2011","true","16.3"," No ratings yet","0","0","0","0","0"
"http://steamcommunity.com/id/76561197978895500/recommended/18040/","76561197978895500","FidLi","http://steamcommunity.com/id/76561197978895500/","249 products in account","Entertaining story,  funny characters, challenging gameplay... 10 hours of incredible experiences","August 27, 2014","true","11.2"," No ratings yet","0","0","0","0","0"
"http://steamcommunity.com/id/ZombieEater/recommended/18040/","ZombieEater","Murtagh","http://steamcommunity.com/id/ZombieEater/","224 products in account","In this game you stuff small children in a sack, collect unicorn feces to grow crops, eat cheeseburgers, and bludgeon leprechauns to death to take their magical weapons. They should have just called it "The Murtagh Simulator"","December 24, 2010","true","9.6"," No ratings yet","0","0","0","0","0"
"http://steamcommunity.com/id/nothingness/recommended/18040/","nothingness","Nothingness","http://steamcommunity.com/id/nothingness/","2008 products in account","Fun game. Takes about 10 hours or so to beat. Funny jokes and good voice actors.","September 24, 2011","true","12.6"," No ratings yet","0","0","0","0","0"
"http://steamcommunity.com/profiles/76561198007554934/recommended/18040/","76561198007554934","melkathi","http://steamcommunity.com/profiles/76561198007554934/","478 products in account","While the game may not be bringing anything new to the genre (run around - slaughter everything - loot the corpses), the humour makes it stand above the competition. Those who enjoyed the original Monkey Island will be thrilled to laugh again like it was 1990. People who missed that game will finally get to understand why we loved it so much.\nRon Gilbert and Hothead brought out a game that really should be part of every gamer's collection.","July 3, 2011","true","12.9"," No ratings yet","0","0","0","0","0"
"http://steamcommunity.com/id/Jeimsie/recommended/18040/","Jeimsie","Jeims","http://steamcommunity.com/id/Jeimsie/","551 products in account","Whoever thought of combining warcraft and monkey island is a genius.\nWant some hack and slash leveling action on top off with some dark humor? Then this is your game right here.","November 28, 2013","true","3.3"," No ratings yet","0","0","0","0","0"
"http://steamcommunity.com/profiles/76561198043886393/recommended/18040/","76561198043886393","Pootie Wienerfish","http://steamcommunity.com/profiles/76561198043886393/","173 products in account","Oh boy, where to begin.\n\n\nFor starters, I recommend you know what you're buying before you buy it. The reason is because this game has terrible, drawn out fetch quests, a very strange difficulty curve,  lackluster coop, and meh graphics. So, after all that ♥♥♥♥ I just gave this game, why is it still "Recommended?" I'll tell you why, this is game funny as ♥♥♥♥. The humor is literally the only thing that kept me going, especially the item descriptions. It only makes sense, seeing as it was made the the mind behind "Secret of Monkey Island" Ron Gilbert. Overall, it's pretty fun, but the only reason you'd ever buy it is for some great laughs. Also DeathSpank's voice is great.","December 7, 2013","true","14.0"," No ratings yet","0","0","0","0","0"
"http://steamcommunity.com/id/tonkytron/recommended/18040/","tonkytron","Sleepy Mod","http://steamcommunity.com/id/tonkytron/","1166 products in account","The reviews for this game all gush at the humor and jokes and they are all right. This game is actually hilarious throughout whether it's a Peter Griffin-style quip or shooting chickens out of a handheld cannon. The quests are the standard kill/collect format but the premise behind them is often so creative and hilarious that it completely makes up for the lack of innovation. There are tons of weapons and armor to find although the majority of what you will use is gotten through quest rewards. The art style is as perfectly stylized as Psychonauts and even the music feels distinctly Deathspank. This game might just be worth full price so if you want a solid action rpg I definitely recommend it.","December 6, 2012","true","7.0"," No ratings yet","0","0","0","0","2"
"http://steamcommunity.com/id/Es0x/recommended/18040/","Es0x","[Esox] Lucius^","http://steamcommunity.com/id/Es0x/","295 products in account","Good game","August 17, 2013","true","21.4"," No ratings yet","0","0","0","0","0"
"http://steamcommunity.com/id/mokagogo/recommended/18040/","mokagogo","Mokagogo","http://steamcommunity.com/id/mokagogo/","477 products in account","May consume your life for about 15 hours. Well worth it -- made by Ron Gilbert, creator of Monkey Island, this game retains his humour (well, an updated version of it), but the puzzle element is somewhat reduced (impossible 'add this to that' puzzles are banished), a massive 3D world to explore (with extraordinary and innovative use of 'scrolling' 2D artwork in it), lots of weapons, fighting, banishing of demons, collecting of guts and mating glands, and general heroic heroism -- all in the name of finding The Artifact. Level up today -- grab DeathSpank.","February 1, 2011","true","15.7"," No ratings yet","0","0","0","0","0"
"http://steamcommunity.com/profiles/76561197970364291/recommended/18040/","76561197970364291","The Rog","http://steamcommunity.com/profiles/76561197970364291/","367 products in account","Holy Crap!\nI haven't had this much fun since the first Diablo and the good old days of Monkey Island!","December 2, 2010","true","12.6"," No ratings yet","0","0","0","0","0"
"http://steamcommunity.com/id/DoctorEars/recommended/18040/","DoctorEars","DoctorEars","http://steamcommunity.com/id/DoctorEars/","327 products in account","Better than I had expected. Funny story and dialogue, good gameplay. Definitely recommended.","November 27, 2010","true","11.6"," No ratings yet","0","0","0","0","0"
"http://steamcommunity.com/profiles/76561198002953992/recommended/18040/","76561198002953992","necroWAAAGHicon","http://steamcommunity.com/profiles/76561198002953992/","359 products in account","Probably the most funny game I played for months, honestly!","November 19, 2010","true","17.3"," No ratings yet","0","0","0","0","0"
"http://steamcommunity.com/id/76561197978895500/recommended/18040/","76561197978895500","FidLi","http://steamcommunity.com/id/76561197978895500/","249 products in account","Entertaining story,  funny characters, challenging gameplay... 10 hours of incredible experiences","August 27, 2014","true","11.2"," No ratings yet","0","0","0","0","0"
"http://steamcommunity.com/id/chen-doge/recommended/18040/","chen-doge","chen-doge","http://steamcommunity.com/id/chen-doge/","369 products in account","dis ♥♥♥♥ is fun, yo","December 30, 2010","true","9.2"," No ratings yet","0","0","0","0","0"
"http://steamcommunity.com/profiles/76561198064586532/recommended/18040/","76561198064586532","Blkik","http://steamcommunity.com/profiles/76561198064586532/","140 products in account","Awesome game. One of my favorites. Love it\nGraphics, animation, enviroment and music is  well made.\n\nFunny Heroe, Sarcastic dialoques, Epic Humor,  Large world with lots of sidequests (some extremelly ridiculous) and enough of hours to play. Lots of loot: cash, food, weapons, items.\nEnjoyable, addicted and quite hard\n\nI have played all three of the series but this is my favorite","August 4, 2014","true","16.5"," No ratings yet","0","0","0","0","0"
"http://steamcommunity.com/id/SwiftCrack/recommended/18040/","SwiftCrack","[LUE] SwiftCrack","http://steamcommunity.com/id/SwiftCrack/","1347 products in account","Pretty fun, really easy though.","April 1, 2013","true","10.1"," No ratings yet","0","0","0","0","0"
