"url","reviewerUsername","reviewerDisplayName","reviewerUrl","reviewerProductsCount","reviewText","date","recommended","hoursPlayed","voteText","helpfulPercent","votesHelpful","votesTotal","votesFunny","commentsCount"
"http://steamcommunity.com/id/Megalogamer/recommended/18040/","Megalogamer","pohs met","http://steamcommunity.com/id/Megalogamer/","186 products in account","Actually my favorite game ever\nget the trilogy\nserious the writing is genius, the characters are unforgettable, and the combat, though it seems repetative, is pretty fun with the different styles/weapons","June 18, 2015","true","9.9"," 1 person found this review helpful","0","1","1","0","0"
"http://steamcommunity.com/id/archinowsk/recommended/18040/","archinowsk","Archinowsk","http://steamcommunity.com/id/archinowsk/","3295 products in account","Not a masterpiece, but decent fun. Action, humor, and simple puzzles.","July 4, 2015","true","9.2"," 1 person found this review helpful","0","1","1","0","0"
"http://steamcommunity.com/id/christofchaos/recommended/18040/","christofchaos","Christofchaos","http://steamcommunity.com/id/christofchaos/","371 products in account","Great game.  Witty and charming.  Nice length.  One hint: Learn to block.\n\nGameplay: 8/10\n\n-A gamepad is a must.  Handles well, just clunky at times.  Doesn't get in the way though.\n\nStory: 5/10\n\n-A bit simple.  Not where the game shines.\n\nCharacters: 9/10\n\n-Most of the characters in the game fit perfectly.\n\nVisuals: 10/10\n\n-Really nice looking game.  Artwork is fantastic.\n\nOverall:  8/10 (Average of other scores)\n\nWorth a play through.  Recommend.","May 17, 2015","true","9.6"," 1 person found this review helpful","0","1","1","0","0"
"http://steamcommunity.com/profiles/76561198017636421/recommended/18040/","76561198017636421","Zillu","http://steamcommunity.com/profiles/76561198017636421/","427 products in account","Hilarious RPG !!\n","April 12, 2015","true","11.5"," 1 person found this review helpful","0","1","1","0","0"
"http://steamcommunity.com/id/Decapitator69/recommended/18040/","Decapitator69","Decapitator","http://steamcommunity.com/id/Decapitator69/","608 products in account","It's as cheesy as hell (which I love), but underneath all of the cheese, which is like a cheesy pizza with more cheese with a crust made out of nothing but cheese, smarmite and sarcastasauce, is a really, really good, challenging, good looking and addictive RPG that just keeps you playing. It's good with a controller too if you don't feel like sitting at your desk chair, but instead in your comfy super-loungy, soft and plushy lounge chair with a foot rest!\n\n","February 13, 2015","true","28.5"," 1 person found this review helpful","0","1","1","0","0"
"http://steamcommunity.com/id/ShrekyOgre/recommended/18040/","ShrekyOgre","Shreky","http://steamcommunity.com/id/ShrekyOgre/","545 products in account","A must have game! I enjoyed every minute!","October 18, 2013","true","11.8"," 1 person found this review helpful","0","1","1","0","0"
"http://steamcommunity.com/id/exothermaniac/recommended/18040/","exothermaniac","Exothermaniac","http://steamcommunity.com/id/exothermaniac/","200 products in account","DeathSpank. The name of the protagonist says it all. This game is all about the story and the very entertaining voice acting. The fourth wall is broken repeatedly as means of telling the story. The gameplay is somewhat clunky in combat on PC, where mouse cursor adjusts where you are facing - meaning you may suddenly expose DeathSpanks back to attack when you just want to move past an enemy slightly. Still, this game is worth some time just for the dialogue.","November 24, 2013","true","18.9"," 1 person found this review helpful","0","1","1","0","0"
"http://steamcommunity.com/id/fappy-san/recommended/18040/","fappy-san","Fappy-sama","http://steamcommunity.com/id/fappy-san/","1942 products in account","DeathSpank is a amazing little RPG, not as deep as other RPG's but its humorous and a lot of fun, pick it up if you are not so gready for a unique little adventure.\n\nI'll give this one 10 orphan's out of 10\n\n- Blaise Smith","November 19, 2010","true","20.9"," 1 person found this review helpful","0","1","1","0","0"
"http://steamcommunity.com/id/mano_kratos/recommended/18040/","mano_kratos","Daniboy","http://steamcommunity.com/id/mano_kratos/","128 products in account","Uma mistura de Diablo com Monkey Island. Morte Espanca é bonito, divertido, e engraçado. Se você gosta de bater em monstros e dar boas risadas, não tem porque não vestir a tanga roxa e ser um "Dispensor da Justiça, um vencedor do Mal, e um Herói dos Oprimidos".\n\n10/10","October 21, 2013","true","6.1"," 1 person found this review helpful","0","1","1","0","4"
"http://steamcommunity.com/id/hermangalkin/recommended/18040/","hermangalkin","Agosto","http://steamcommunity.com/id/hermangalkin/","224 products in account","L'epicità fatta a videogioco!","October 22, 2013","true","3.7"," 1 person found this review helpful","0","1","1","0","0"
"http://steamcommunity.com/id/lakerko/recommended/18040/","lakerko","laker","http://steamcommunity.com/id/lakerko/","586 products in account","I love the stupid humor in this game. I love the stupid quests and stupid story. And I love the stupid characters.\n\nBut the gameplay is weak. The combat system is clunky, repetitive, boring after a while. There will come a time when the fun from the humor will be defeated by the weak mechanics. After the that point, the game becomes bigger and bigger pain.\n\nI would buy it on sale and enjoy it while the fun lasts.","May 1","true","14.1"," 1 person found this review helpful","0","1","1","0","0"
"http://steamcommunity.com/profiles/76561198029246369/recommended/18040/","76561198029246369","Spooklord","http://steamcommunity.com/profiles/76561198029246369/","150 products in account","One day Deathspank will be my stripper name","January 23, 2014","true","22.3"," 1 person found this review helpful","0","1","1","0","0"
"http://steamcommunity.com/profiles/76561198031911270/recommended/18040/","76561198031911270","reiyichi","http://steamcommunity.com/profiles/76561198031911270/","59 products in account","This is one of the funniest, crudest, best damn time you will have, in a 2d action rpg. I love this series, though, I did not like the fact that eventually the game starts to get so much more difficult as you get to the mid to higher levels. Now I am not so wimpy that I cannot handle a challenge, but in some areas, you will be swarmed by enemies, some or all of which are tough enemy types, such as the tough mother spider types (it has been a while since I played so I forget a lot of the enemies) and the Jotuns. Yes, they will have minion types with them that just die in a few hits, but then you get swarmed by a bunch of regular spider types or jotuns or demons or w/e, and you are toast.\n\nNow, maybe I am missing something, and there is a trick to it to avoid getting swarmed like that and dying, a lot. But for me, if I die too many times, then it is no longer fun for me. I am not saying I don't like challenging games, I do, I just hate dying every 5 minutes or so, or dying until I figure out the secret... I am in no way saying that makes this game bad, it doesn't, I am saying I am probably a bad player. If you are a fan of crude humor, hilarious plot lines and quests, and hilarious weaponry and quest rewards and action RPGs, then this is your game. If not, or if you are like me and are not a fan of dying, a lot, then this may not be your game, still worth looking at though, to see if you will like it.","August 12, 2015","true","8.6"," 1 person found this review helpful 1 person found this review funny","0","1","1","0","0"
"http://steamcommunity.com/id/SephirRQ/recommended/18040/","SephirRQ","Sephir","http://steamcommunity.com/id/SephirRQ/","540 products in account","Funny RPG, worth a try!","August 12, 2011","true","6.3"," 1 person found this review helpful","0","1","1","0","0"
"http://steamcommunity.com/profiles/76561198036617517/recommended/18040/","76561198036617517","kﭐѪ♭♡ ՖLﭐ꒞㉹ kiмb","http://steamcommunity.com/profiles/76561198036617517/","20 products in account","One of my favourite games, ever. Diablo parody, mixed with great humour and 3d paper model-like visuals. Voice acting and writing is brilliantly fun.","December 18, 2015","true","4.8"," 1 person found this review helpful","0","1","1","0","0"
"http://steamcommunity.com/id/nubstick888/recommended/18040/","nubstick888","nubstick","http://steamcommunity.com/id/nubstick888/","520 products in account","wonderful game! a little bit old though... old but gold!","December 24, 2013","true","14.1"," 2 of 3 people (67%) found this review helpful","67","2","3","0","0"
"http://steamcommunity.com/id/amnuts/recommended/18040/","amnuts","andy","http://steamcommunity.com/id/amnuts/","110 products in account","Have only played it for a 10 or so minutes (and that includes watching the intro video) but I absolutely love the game so far!  Love the humour and the graphic style.  Looking forward to dedicating some time to actual playing it now.","October 18, 2013","true","5.6"," 2 of 3 people (67%) found this review helpful","67","2","3","0","0"
"http://steamcommunity.com/id/amnuts/recommended/18040/","amnuts","andy","http://steamcommunity.com/id/amnuts/","110 products in account","Have only played it for a 10 or so minutes (and that includes watching the intro video) but I absolutely love the game so far!  Love the humour and the graphic style.  Looking forward to dedicating some time to actual playing it now.","October 18, 2013","true","5.6"," 2 of 3 people (67%) found this review helpful","67","2","3","0","0"
"http://steamcommunity.com/id/shardplate/recommended/18040/","shardplate","shardplate","http://steamcommunity.com/id/shardplate/","10 products in account","Fun and lighthearted game with quirky graphics and an absurd but hilarious storyline. Easy to get the hang of and great for casual gaming. Short but sweet.","September 6, 2014","true","13.1"," 2 of 3 people (67%) found this review helpful","67","2","3","0","0"
"http://steamcommunity.com/id/thebigwhoop863/recommended/18040/","thebigwhoop863","TheBigWhoop863","http://steamcommunity.com/id/thebigwhoop863/","43 products in account","LOTS of humour, lovely and distinctive graphic style and hours of satisfying mindless murder! Lots of fun, laughter and brutal weapons! I love it!","February 19, 2014","true","13.2"," 2 of 3 people (67%) found this review helpful","67","2","3","0","0"
"http://steamcommunity.com/id/TorturedKittens/recommended/18040/","TorturedKittens","Captain Toenail","http://steamcommunity.com/id/TorturedKittens/","1012 products in account","This game is pure laughs... Just laughs all the day long.","March 17, 2014","true","2.5"," 2 of 3 people (67%) found this review helpful","67","2","3","0","0"
"http://steamcommunity.com/id/Sysg3n/recommended/18040/","Sysg3n","Sysgen","http://steamcommunity.com/id/Sysg3n/","4617 products in account","An action rpg favorite laced with great humor.  Well over 100 quests.  Professional though intentionally quirky voice overs.  Our hero massacres everything from "stoopid" chickens to unicorns and dragons.   An outstanding unique cartoonish visual presentation compliments the standard gameplay of this genre complete with alternate weapon sets and a well designed inventory mangement system.","May 19, 2012","true","19.9"," 2 of 3 people (67%) found this review helpful","67","2","3","0","0"
"http://steamcommunity.com/id/Trublade/recommended/18040/","Trublade","Trublade","http://steamcommunity.com/id/Trublade/","518 products in account","Ron Gilbert is the MAN!\n\nhttps://www.youtube.com/watch?v=NzxmMwNXA1M","August 19, 2015","true","0.6"," 2 of 3 people (67%) found this review helpful","67","2","3","0","0"
"http://steamcommunity.com/id/rivereyes/recommended/18040/","rivereyes","Borracho","http://steamcommunity.com/id/rivereyes/","698 products in account","This is some of the best 15 Euros you are going to spend on  a game.\n\nHilarious, engaging and tongue-in-cheek, this is one for the Monkey Island generation who wonders what happened to the soul of games.","October 27, 2010","true","8.3"," 2 of 3 people (67%) found this review helpful","67","2","3","0","0"
"http://steamcommunity.com/id/ellipsis15/recommended/18040/","ellipsis15","Ellipsis","http://steamcommunity.com/id/ellipsis15/","232 products in account","Wow. Such Spank. Much Death. Very Spanky. How Spankity. So Deathy.","March 22, 2014","true","0.1"," 3 of 6 people (50%) found this review helpful","50","3","6","0","0"
"http://steamcommunity.com/id/reboot/recommended/18040/","reboot","ReBoot","http://steamcommunity.com/id/reboot/","1259 products in account","Crossover of Diablo and Monkey Island, ROFL for serious.","July 13, 2012","true","46.3"," 1 of 2 people (50%) found this review helpful","50","1","2","0","0"
"http://steamcommunity.com/id/lukozer/recommended/18040/","lukozer","Lukozer","http://steamcommunity.com/id/lukozer/","421 products in account","This game is simply superb... You MUST buy it!","October 21, 2013","true","13.8"," 1 of 2 people (50%) found this review helpful","50","1","2","0","0"
"http://steamcommunity.com/profiles/76561198043565456/recommended/18040/","76561198043565456","Sir Ploops","http://steamcommunity.com/profiles/76561198043565456/","73 products in account","'Tis a Silly adventure with comical equipment and dialog!","June 21, 2014","true","2.0"," 1 of 2 people (50%) found this review helpful","50","1","2","0","0"
"http://steamcommunity.com/id/RuleBlader/recommended/18040/","RuleBlader","RuleBlader","http://steamcommunity.com/id/RuleBlader/","342 products in account","Fun action rpg with a nice touch of comedy.\nThe voice of DeathSpank is also quite hilarious.\nSimple but fun game.\n","October 13, 2014","true","15.5"," 1 of 2 people (50%) found this review helpful","50","1","2","0","0"
"http://steamcommunity.com/id/TwoFoxSix/recommended/18040/","TwoFoxSix","TwoFoxSix","http://steamcommunity.com/id/TwoFoxSix/","685 products in account","Short (8 hours) game that has a lot of crude humor.  Worth the play","October 17, 2014","true","8.0"," 1 of 2 people (50%) found this review helpful","50","1","2","0","0"
"http://steamcommunity.com/id/chantor/recommended/18040/","chantor","Chantor","http://steamcommunity.com/id/chantor/","1093 products in account","I had some good laughs playing this. Definitely recommend","April 17, 2015","true","12.0"," 1 of 2 people (50%) found this review helpful","50","1","2","0","0"
"http://steamcommunity.com/profiles/76561198057718856/recommended/18040/","76561198057718856","yindang213-pro","http://steamcommunity.com/profiles/76561198057718856/","298 products in account","....................................................................................................I can not laugh for one more time!!!!!!!","February 5, 2014","true","11.9"," 1 of 2 people (50%) found this review helpful","50","1","2","0","0"
"http://steamcommunity.com/id/markdj/recommended/18040/","markdj","dj.","http://steamcommunity.com/id/markdj/","2975 products in account","DeathSpank is a solid third person action RPG with a lot of ridiculous humor (my kind :)). It's fairly colorful, so don't expect a style similar to Diablo here. Actually, I'm glad it's colorful. It stands out from the rest this way. Anyway, there is loot (just not a whole lot) and there are quite a lot of quests for a downloadable game. The combat is solid and the skills/weapons are decent but not all that spectacular unfortunately. I did have a lot of fun with it though, and you can expect about 8-9 hours of gameplay. So more than enough.\nBy the way, if you like this game, make sure you try out the other Deathspank games as well.\n\n[Rating: 78/100]","September 11, 2011","true",""," 1 of 2 people (50%) found this review helpful","50","1","2","0","0"
"http://steamcommunity.com/id/sonnybynum/recommended/18040/","sonnybynum","Zakeeus","http://steamcommunity.com/id/sonnybynum/","472 products in account","One more upvote. An early leader in intelligent, funny, delightful RPG comedy. A solid game, and a solid script. Talent abounds in this production. [applause]","October 4, 2015","true","12.2"," 2 of 4 people (50%) found this review helpful","50","2","4","0","0"
"http://steamcommunity.com/id/myth1cal/recommended/18040/","myth1cal","My✚hical","http://steamcommunity.com/id/myth1cal/","874 products in account","Dispenser of Justice, Vanquisher of Evil, and Hero to the Downtrodden, DeathSpank journeys on a quest to find 'The Artifact'. The game embodies a variety of classic RPG elements, tons of loot and a humorous touch. Tied together by the Hack'n'Slash approach, DeathSpank is a must play for all RPG enthusiasts.\n\n+ Funny storyline\n+ Funny take on protagonist\n+ Classic RPG elements\n+ Tons of loot and a multitude of equipment combos/sets\n+ Easy Achievements\n+ Local Co-op\n- No Trading Cards (Emotes/Backgrounds)\n\n\nPersonal Ranking: 8.5/10","September 9, 2015","true","15.7"," 1 of 2 people (50%) found this review helpful","50","1","2","0","0"
"http://steamcommunity.com/id/Imban/recommended/18040/","Imban","Imban","http://steamcommunity.com/id/Imban/","1581 products in account","DeathSpank is a thoroughly mediocre action RPG that takes after Diablo but never manages to be all that entertaining.\n\nProbably my biggest mechanical issue with the game is the itemization - there's no randomly generated loot, and almost all items are just straight upgrades that require higher levels to equip. The only exception to these are the weapons which allow you to use your Justice Meter, which also have tiered upgrades, but deciding which of them to use is actually slightly interesting - though I found the spinning swords to be the best of them by far, to the point where I didn't really use the others much. This also affects the stores in the game, which have very little worth purchasing until you're level 18 and can just buy the best equipment in the game - before that point, items are far too expensive, don't offer a huge benefit (unless, as it did for me, the game basically refused to ever drop crossbows for you) and will likely be replaced quickly with items dropped by monsters or found in treasure chests.\n\nWith the itemization out of the way, the game is on the simple side - except for a few difficulty spikes like the Pip Village, I found Normal to basically be walking through the early game and killing everything in 1-3 hits, and later doing it just as fast from range with the crossbow. There's a variety of consumable items, but I only really used the healing items because it didn't seem like I ever really needed any of the others, or had a clear idea of when element resistance potions or whatnot would even have been useful. So, yeah. The combat wasn't terribly interesting, and neither were the rewards for the combat.\n\nThe parody elements were occasionally amusing, but frequently fell flat for me - that you're going on a set of stupid fetch quests isn't made any better by the game calling attention to how stupid the fetch quests are, for instance. It's one of my gripes about parody RPGs in general, that they frequently seem to think that it excuses replicating bad game design for the sake of parody. Some of the more puzzle-like quests were amusing, however, and weren't something I was used to in this type of game.\n\nUltimately, DeathSpank is the kind of game I would mostly suggest trying if you think its style of humor would appeal to you. It doesn't really stack up well without that. (Unfortunately, it also seems as if DeathSpank never goes on sale any more, from what I've heard? So I can't even really suggest picking it up on the cheap, even though it's over five years old now.)","December 2, 2015","false","7.1"," 8 of 17 people (47%) found this review helpful","47","8","17","0","0"
"http://steamcommunity.com/profiles/76561198035005384/recommended/18040/","76561198035005384","TechPriest44","http://steamcommunity.com/profiles/76561198035005384/","125 products in account","Humorous, cleverly made, 5/5 everyday.","October 31, 2014","true","7.6"," 2 of 5 people (40%) found this review helpful","40","2","5","0","0"
"http://steamcommunity.com/id/geyblade/recommended/18040/","geyblade","Geyblade","http://steamcommunity.com/id/geyblade/","76 products in account","It is  very funny, and a huge disappointment to see EA and a bigger one, to after beating it, seeing Telefilm Canada (opposing it's existence) in the credits, frankly should be a warning label for the liberty minded.  But I didn't get it first run so the dev funding and distribution issues still give it a thumbs up.  On the cheap and second run prices makes it worth it despite all other objections.  It is so good, I was surprised the state funded it.","July 14, 2015","true","27.2"," 2 of 5 people (40%) found this review helpful","40","2","5","0","0"
"http://steamcommunity.com/id/vilemonkey/recommended/18040/","vilemonkey","the Monkey","http://steamcommunity.com/id/vilemonkey/","273 products in account","great game.","November 23, 2015","true","18.9"," 2 of 5 people (40%) found this review helpful","40","2","5","0","0"
"http://steamcommunity.com/id/kamiaishi/recommended/18040/","kamiaishi","Reaver","http://steamcommunity.com/id/kamiaishi/","4 products in account","Cool fun cartoon game.","March 3, 2014","true","18.3"," 1 of 3 people (33%) found this review helpful","33","1","3","0","1"
"http://steamcommunity.com/id/vaagur/recommended/18040/","vaagur","Vaagur","http://steamcommunity.com/id/vaagur/","2091 products in account","Deathspank is best played with a controller, in my opinion, without one the controls are a bit weird and sometimes you move in directions you didin't ask to. It took me about 7 hours to beat the game and I felt bored about 30 minutes during that time, because I had no idea where to go in a certain quest. It's a pretty casual game execpt for 1 or 2 monsters in particular which are quite unbalanced and can cause problems.\n\nThat game is very hard to review, because, while I had alot of fun and didin't see the time go by... The gameplay is very repetitive and there's not enough weapon variation and different ''skills'' in the game, in my opinion. Shoot until the monster gets to you, smash, smash, block, smash, block, smash, monster dead... That's what you do for about half of the time.\n\nI do believe it's worth playing, because of the dumb humor that's just wrong and funny... Though if you're looking for challenging gameplay or have a bad sense of humor, this game is definately not for you!","June 28, 2014","true","7.7"," 1 of 3 people (33%) found this review helpful","33","1","3","0","0"
"http://steamcommunity.com/id/rammsteniako/recommended/18040/","rammsteniako","Rammsteniako","http://steamcommunity.com/id/rammsteniako/","1447 products in account","Great indie hack 'n' slash game with nice humor ;D 8/10","January 19, 2015","true","24.2"," 1 of 3 people (33%) found this review helpful","33","1","3","0","0"
"http://steamcommunity.com/id/Saint_Satan/recommended/18040/","Saint_Satan","Saint Satan","http://steamcommunity.com/id/Saint_Satan/","905 products in account","Decent.","May 2, 2012","true","0.3"," 0 of 1 people (0%) found this review helpful","0","0","1","0","0"
"http://steamcommunity.com/profiles/76561198005523589/recommended/18040/","76561198005523589","moomphas","http://steamcommunity.com/profiles/76561198005523589/","1011 products in account","Surprisingly good.  I was hesitating whether yo buy it or not, as neither the trailer nor screenshots convinced me, but it was $1 so what the heck. And it turned out to be a great investment. Some lines really cracked me up (especially at the beginning of the game), and the game itself has proven to be not only funny, but also very enjoyable. That's a 10 hour journey that will give you some good laughing and smashing. The last 4 hours felt slighlty like grinding though, but still it's a game you should not miss!","October 20, 2013","true","9.9"," 0 of 1 people (0%) found this review helpful","0","0","1","0","0"
"http://steamcommunity.com/id/emix4fun/recommended/18040/","emix4fun",".inc0rporated","http://steamcommunity.com/id/emix4fun/","134 products in account","This game is really funny and you will spend a lots of hours completing quests... Graphic is colorful and animated, voices are OK, so....it worth buying ;)","December 1, 2013","true","16.1"," 0 of 1 people (0%) found this review helpful","0","0","1","0","0"
"http://steamcommunity.com/id/ddiabelekk/recommended/18040/","ddiabelekk","OAZA SPOKOJU","http://steamcommunity.com/id/ddiabelekk/","313 products in account","This game really gives lots of fun, texts are awesome, you gonna laugh entire game (definitely play on the hardest difficulty).","June 25, 2014","true","8.0"," 0 of 1 people (0%) found this review helpful","0","0","1","0","0"
"http://steamcommunity.com/id/datassthefirst/recommended/18040/","datassthefirst","ranGe","http://steamcommunity.com/id/datassthefirst/","396 products in account","Great game,great mechanics and funny as hell! 8/10","November 2, 2014","true","0.9"," 0 of 1 people (0%) found this review helpful","0","0","1","0","0"
"http://steamcommunity.com/profiles/76561198043985490/recommended/18040/","76561198043985490","cocobolo","http://steamcommunity.com/profiles/76561198043985490/","56 products in account","AsalamandrasulafGOTG","November 3, 2013","true","13.8"," 0 of 1 people (0%) found this review helpful","0","0","1","0","0"
