"url","reviewerUsername","reviewerDisplayName","reviewerUrl","reviewerProductsCount","reviewText","date","recommended","hoursPlayed","voteText","helpfulPercent","votesHelpful","votesTotal","votesFunny","commentsCount"
"http://steamcommunity.com/id/DoctorEars/recommended/18040/","DoctorEars","DoctorEars","http://steamcommunity.com/id/DoctorEars/","327 products in account","Better than I had expected. Funny story and dialogue, good gameplay. Definitely recommended.","November 27, 2010","true","11.6"," No ratings yet","0","0","0","0","0"
"http://steamcommunity.com/profiles/76561198002953992/recommended/18040/","76561198002953992","necroWAAAGHicon","http://steamcommunity.com/profiles/76561198002953992/","359 products in account","Probably the most funny game I played for months, honestly!","November 19, 2010","true","17.3"," No ratings yet","0","0","0","0","0"
"http://steamcommunity.com/id/darkin20/recommended/18040/","darkin20","Darkin20","http://steamcommunity.com/id/darkin20/","1426 products in account","Very funny and fun to play game.","March 10, 2014","true","11.9"," No ratings yet","0","0","0","0","0"
"http://steamcommunity.com/id/UltimateBohab/recommended/18040/","UltimateBohab","Blueberrypop","http://steamcommunity.com/id/UltimateBohab/","83 products in account","I love this game so much, I honestly have nothing negative to say about it. It's dirty and funny, exactly my kind of game.","March 17, 2014","true","3.2"," No ratings yet","0","0","0","0","0"
"http://steamcommunity.com/id/shocon/recommended/18040/","shocon","ShoCon","http://steamcommunity.com/id/shocon/","489 products in account","A fun little game that you can do in just under 15 hours if you do all the side quests. So that works out to about $1 per hour of entertainment. Has an interesting art style and some good humor in the dialogue. Works great with a gamepad.","December 18, 2010","true","14.7"," No ratings yet","0","0","0","0","0"
"http://steamcommunity.com/id/angercolumn/recommended/18040/","angercolumn","ambivalence the Meh of Meh","http://steamcommunity.com/id/angercolumn/","737 products in account","This is  a little fun game. No brainer @ $5 on sale. well worth a cup of coffee.","March 20, 2014","true","3.6"," No ratings yet","0","0","0","0","0"
"http://steamcommunity.com/profiles/76561197967619213/recommended/18040/","76561197967619213","Shrike","http://steamcommunity.com/profiles/76561197967619213/","1897 products in account","if you enjoy rpg's and a wide variety of humor this game will be quite entertaining for you.","July 3, 2011","true","15.9"," No ratings yet","0","0","0","0","0"
"http://steamcommunity.com/profiles/76561198032038661/recommended/18040/","76561198032038661","Hound","http://steamcommunity.com/profiles/76561198032038661/","248 products in account","Priceless dialogs. For good laugh and classic action rpg, deffinetly suggesting.","November 14, 2013","true","10.9"," No ratings yet","0","0","0","0","0"
"http://steamcommunity.com/profiles/76561197982565832/recommended/18040/","76561197982565832","Arahmain","http://steamcommunity.com/profiles/76561197982565832/","60 products in account","Its silly, outrageous, down right goofy and does not take itself seriously in the slightest. And thank the heavens it doesnt! In a world where we see nothing but dark, overly pretentious or just trying to be as sesnible as can be its refreshing to play a game that says "hey I'm just here to have fun and a right laugh care to join?". Right up to its very title DeathSpank is nothing more than a bag of goofy jokes, quirky characters, simple clicky combat and a very easy leveling systems (you pick a card at each level that boosts one thing and thats it!) its there for those of you who dont want to have a brain fart over trying to understand overly complicated stories or who for the evening just dont want to have to shiv through the grind to get to the good bits. All that Deathspank is, is fun. Its all it needs to be.","January 12, 2014","true","13.4"," No ratings yet","0","0","0","0","0"
"http://steamcommunity.com/id/niggerdestroyer666/recommended/18040/","niggerdestroyer666","Mr.PoopyButthole","http://steamcommunity.com/id/niggerdestroyer666/","134 products in account","Geniale game met goede humor! Als je de tijd neemt om het te spelen en de dialogen te volgen heb je het spel in 17 tot 20 uur uit. Het is dus zijn 10 euro meer dan waard.","October 24, 2013","true","17.5"," No ratings yet","0","0","0","0","0"
"http://steamcommunity.com/id/Happsen/recommended/18040/","Happsen","Happ","http://steamcommunity.com/id/Happsen/","222 products in account","I downloaded this game hoping that the 2 player aspect would be used in the online world, sadly it is not. I bought it with the hopes I could play with someone near and dear to me. </3","February 2, 2014","true","0.1"," No ratings yet","0","0","0","0","0"
"http://steamcommunity.com/id/ibitato/recommended/18040/","ibitato","Ibitato","http://steamcommunity.com/id/ibitato/","966 products in account","great and funny Action  RPG","May 11, 2012","true","1.6"," No ratings yet","0","0","0","0","0"
"http://steamcommunity.com/id/SykCyn/recommended/18040/","SykCyn","Tag You're Pregnant","http://steamcommunity.com/id/SykCyn/","982 products in account","Amazing game. Makes me laugh all the time. Definitely a game that you have to get and it's not only controller compatible, but it is better with a controller.","December 19, 2010","true","4.6"," No ratings yet","0","0","0","0","0"
"http://steamcommunity.com/id/Maverik770/recommended/18040/","Maverik770","Maverik770","http://steamcommunity.com/id/Maverik770/","1789 products in account","9/10 - Clever, witty, full of charm and tons of fun. I find myself laughing out loud quite a bit while playing DeathSpank. A solid yet simple and memorable Action RPG. While the gameplay is nothing new, the humorous story, characters and stylish graphics are what makes the game unqiue and fun.","December 28, 2010","true","0.3"," No ratings yet","0","0","0","0","0"
"http://steamcommunity.com/id/MommyHitsMe/recommended/18040/","MommyHitsMe","Mommy Hits Me","http://steamcommunity.com/id/MommyHitsMe/","1526 products in account","Deathspank is one of my favorite games of 2010. It combines the mechanics of Zelda and Diablo with the sly humor of Monkey Island's Ron Gilbert. A silly, forgettable, but altogether enjoyable storyline for this first installment of two will run you about 20 hours to fully enjoy. Combat mechanics work great when paired with the X360 controller, as that's what the game was actually designed for.\n\nDeathspank is a must own -- and since it's indie, it's cheap. While it's not your standard $50 experience, it's definitely worth the ~$15 or so it usually sells for. Pick up both Deathspank games for an interesting and humorous gaming experience you may actually enjoy playing.","March 19, 2011","true","17.3"," No ratings yet","0","0","0","0","0"
"http://steamcommunity.com/id/ivory_soul/recommended/18040/","ivory_soul","Ivory_Soul","http://steamcommunity.com/id/ivory_soul/","316 products in account","The Good: Hilarious dialog, great voice acting, charming art style, tons of quests, enemies, weapons, and items, huge open world to explore\n\nThe Bad: Constant healing gets extremely annoying, killing enemies gives you very little XP, gets repetitive after a while, some quests are vague on where to go\n\nDispenser of Justice! Hero of the Downtrodden! Those are just a couple of DeathSpank’s other names in this hilarious action RPG from Hot Head Studios. You play as the silly hero DeathSpank in his quest to find The Artifact and kill the evil king Lord Von Prong. LVP wants DeathSpank’s magical Thong to become more evil, but in the mean time you need to do some saving of the downtrodden.\n\nThe overall story isn’t much, but the banter with NPCs is what really makes you crack up with the obvious stabs at RPGs and other games. It will take different shots at the genre without even saying anything some times like one quest has you pleasing an orphan in the Demon Mines to put in your orphan bag. You must run into town and get everything she needs, but the store just so happens to have everything you need when you get there like a cell phone and a pony! This is an obvious jab at RPGs whose stores always have what you need.\n\nThe game also has some more childish jokes like collecting unicorn poop, finding help letters in dragon poop, and helping villagers make their dirt and stone soup taste better using various animal parts. While this humor may not be funny to all, most will get a kick out of it and DeathSpank is chalk full of it. Of course the gameplay is important to and DeathSpank lets you assign four different weapons at a time to use and there are a ton of weapons, armor, and different types of potions to use. You can even eat various foods to heal up like pizza, fries, magic mushrooms, and root beer. When you whack enough enemies you get to unleash your Justice meter which are power-ups for certain weapons. The game consists of a huge map that you can wander around and travel via outhouses spread throughout the world. There are a ton of quests and you’re looking at about 10-15 hours of gameplay here that is very entertaining.\n\nThe game has two major flaws and this is the fact that no matter how high you level up or how good your armor is you will be guzzling potions and healing items every 5 seconds. Enemies re-spawn when you re-enter an area and you can’t move on to some until you are a higher level or those enemies will kill you quickly. This makes progression slow at first and forces you to complete quests because that’s the only way to really level up. You get very little XP killing enemies even if they are a higher level than you. I found this very frustrating and made the game less enjoyable because of all these weird quirks. I also found that some quests were vague on where to go and using fortune cookies spread around give you hints, but those are just mostly useless.\n\nThe visuals are nice, but technically the game is very simple, but there is a huge variety in enemy types and you really won’t get bored on that end. The best part about DeathSpank is the humor in the dialog and the funny voice actors who over exaggerate voices. Even as an action RPG the game is fun and challenging for anyone looking for something out of the ordinary to play, plus it has co-op play for anyone wanting to share the fun and jokes with a friend.\n\n--Score: 8/10","June 28, 2012","true","9.4"," No ratings yet","0","0","0","0","0"
"http://steamcommunity.com/id/ibitato/recommended/18040/","ibitato","Ibitato","http://steamcommunity.com/id/ibitato/","966 products in account","great and funny Action  RPG","May 11, 2012","true","1.6"," No ratings yet","0","0","0","0","0"
"http://steamcommunity.com/id/SykCyn/recommended/18040/","SykCyn","Tag You're Pregnant","http://steamcommunity.com/id/SykCyn/","982 products in account","Amazing game. Makes me laugh all the time. Definitely a game that you have to get and it's not only controller compatible, but it is better with a controller.","December 19, 2010","true","4.6"," No ratings yet","0","0","0","0","0"
"http://steamcommunity.com/profiles/76561198000112307/recommended/18040/","76561198000112307","[KFDS] Waffles~","http://steamcommunity.com/profiles/76561198000112307/","108 products in account","Pretty straight forward Hack and slash game but with a twist of comedy..Game was pretty epic and i got two words..DeathSpank...Epic name for a hero <3","March 25, 2014","true","13.0"," No ratings yet","0","0","0","0","0"
"http://steamcommunity.com/id/vaderneedsyou/recommended/18040/","vaderneedsyou","Neon - PixelJudge.com","http://steamcommunity.com/id/vaderneedsyou/","413 products in account","A must have all out comedy RPG game.\n\nGreat gameplay, great story, epic humour and decent enough graphics.\n\nAll this at that price tag! A serious must buy!","January 23, 2011","true","2.8"," No ratings yet","0","0","0","0","0"
"http://steamcommunity.com/id/condorcastle/recommended/18040/","condorcastle","Condor Castle","http://steamcommunity.com/id/condorcastle/","1746 products in account","80/100","October 25, 2013","true","13.6"," No ratings yet","0","0","0","0","0"
"http://steamcommunity.com/id/JoNiBoSs/recommended/18040/","JoNiBoSs","JoNiBoSs","http://steamcommunity.com/id/JoNiBoSs/","341 products in account","Es muy bueno y divertido.","October 22, 2013","true","11.0"," No ratings yet","0","0","0","0","0"
"http://steamcommunity.com/id/grimmly/recommended/18040/","grimmly","grimmly","http://steamcommunity.com/id/grimmly/","360 products in account","Great graphics .. Good gameplay .. and Funny ! A must buy at any price ...","October 19, 2013","true","18.1"," No ratings yet","0","0","0","0","0"
"http://steamcommunity.com/profiles/76561198043886393/recommended/18040/","76561198043886393","Pootie Wienerfish","http://steamcommunity.com/profiles/76561198043886393/","173 products in account","Oh boy, where to begin.\n\n\nFor starters, I recommend you know what you're buying before you buy it. The reason is because this game has terrible, drawn out fetch quests, a very strange difficulty curve,  lackluster coop, and meh graphics. So, after all that ♥♥♥♥ I just gave this game, why is it still "Recommended?" I'll tell you why, this is game funny as ♥♥♥♥. The humor is literally the only thing that kept me going, especially the item descriptions. It only makes sense, seeing as it was made the the mind behind "Secret of Monkey Island" Ron Gilbert. Overall, it's pretty fun, but the only reason you'd ever buy it is for some great laughs. Also DeathSpank's voice is great.","December 7, 2013","true","14.0"," No ratings yet","0","0","0","0","0"
"http://steamcommunity.com/profiles/76561197970751024/recommended/18040/","76561197970751024","Sofos","http://steamcommunity.com/profiles/76561197970751024/","721 products in account","Great fun\nEven greater music","April 10, 2011","true","1.2"," No ratings yet","0","0","0","0","0"
"http://steamcommunity.com/id/wmqpun/recommended/18040/","wmqpun","Saitama","http://steamcommunity.com/id/wmqpun/","109 products in account",":D played this game with my little brother in co-op mode. Amazing!","December 16, 2013","true","9.3"," No ratings yet","0","0","0","0","0"
"http://steamcommunity.com/id/niggerdestroyer666/recommended/18040/","niggerdestroyer666","Mr.PoopyButthole","http://steamcommunity.com/id/niggerdestroyer666/","134 products in account","Geniale game met goede humor! Als je de tijd neemt om het te spelen en de dialogen te volgen heb je het spel in 17 tot 20 uur uit. Het is dus zijn 10 euro meer dan waard.","October 24, 2013","true","17.5"," No ratings yet","0","0","0","0","0"
"http://steamcommunity.com/id/thebipman/recommended/18040/","thebipman","The Bipman","http://steamcommunity.com/id/thebipman/","406 products in account","I finished this title eager to play the sequel, worth your time.","December 21, 2013","true","10.1"," No ratings yet","0","0","0","0","0"
"http://steamcommunity.com/id/nightelven/recommended/18040/","nightelven","nightelven","http://steamcommunity.com/id/nightelven/","452 products in account","Amazing and hillarious game, going for the sequel right now!","December 22, 2013","true","12.2"," No ratings yet","0","0","0","0","0"
"http://steamcommunity.com/profiles/76561198051152340/recommended/18040/","76561198051152340","Devin6989","http://steamcommunity.com/profiles/76561198051152340/","98 products in account","13 of the awesomest hours ever Great quests items and Really funny","December 25, 2013","true","13.0"," No ratings yet","0","0","0","0","0"
"http://steamcommunity.com/id/mechaqueen/recommended/18040/","mechaqueen","zuul","http://steamcommunity.com/id/mechaqueen/","172 products in account","Do you like Monkey Island? Do you like Diablo? WELL YOU WILL LOVE THIS!","April 14, 2011","true","11.0"," No ratings yet","0","0","0","0","0"
"http://steamcommunity.com/id/perfidious/recommended/18040/","perfidious","Perfidious","http://steamcommunity.com/id/perfidious/","579 products in account","Good humor, good fun!","December 27, 2011","true","12.6"," No ratings yet","0","0","0","0","0"
"http://steamcommunity.com/id/sawta/recommended/18040/","sawta","Sawta","http://steamcommunity.com/id/sawta/","401 products in account","Funny title, funny dialog, fun game play.","December 18, 2010","true","12.4"," No ratings yet","0","0","0","0","0"
"http://steamcommunity.com/id/eksunhirro/recommended/18040/","eksunhirro","eksunhirro","http://steamcommunity.com/id/eksunhirro/","183 products in account","Szerintem pont annyira butyuta poénos, mint én... :D","July 16, 2013","true","20.6"," No ratings yet","0","0","0","0","0"
"http://steamcommunity.com/profiles/76561198102007925/recommended/18040/","76561198102007925","Andy C.","http://steamcommunity.com/profiles/76561198102007925/","377 products in account","A fun comedy role playing game, I wasn't expecting much from this but I have played it to death. Good arcade style graphics and funny dialogue that just keeps you going back to see what other ridiculous situations Deathspank can get himself into.\n\nI must say thpugh that the title put me off buying this at first, but dont let it do the same to you.","November 26, 2013","true","9.8"," No ratings yet","0","0","0","0","0"
"http://steamcommunity.com/id/nilbot/recommended/18040/","nilbot","Nilbot","http://steamcommunity.com/id/nilbot/","534 products in account","fun and funny arcade styled hack-and-slash.","November 30, 2010","true","12.3"," No ratings yet","0","0","0","0","0"
"http://steamcommunity.com/id/Rowlaz/recommended/18040/","Rowlaz","Rowlaz","http://steamcommunity.com/id/Rowlaz/","459 products in account","Lol!","January 17, 2015","true","11.0"," No ratings yet","0","0","0","0","0"
"http://steamcommunity.com/id/Brandonsgames/recommended/18040/","Brandonsgames","Daz","http://steamcommunity.com/id/Brandonsgames/","20 products in account","great little game easy achievements as no level achievments so all available on easy mode","January 14, 2015","true","10.7"," No ratings yet","0","0","0","0","0"
"http://steamcommunity.com/id/CriticalCupcake/recommended/18040/","CriticalCupcake","Critical Cupcake","http://steamcommunity.com/id/CriticalCupcake/","735 products in account","I had a lot of fun with this game! It was weird odd and the quests were actually fun to do.  The ending was wonderful as well.  I certainly say this game kept me going until I finished it, I was dissapointed however to hear the second game has a major bug they never fixed! :(\n\nSo, long story short, if you want a cartoonishly fun and rude game, I say this is it! So long as you are not looking to get the second game.  I would love to, and I plan to, IF I hear it finally got fixed!","November 27, 2011","true","14.2"," No ratings yet","0","0","0","0","0"
"http://steamcommunity.com/profiles/76561198005770897/recommended/18040/","76561198005770897","Gwendlyn","http://steamcommunity.com/profiles/76561198005770897/","149 products in account","I love this game.  I really enjoy the comments.  It is a no brainer, Escapism from Realityism.  Go DeathSpank","May 9, 2015","true","54.6"," No ratings yet","0","0","0","0","0"
"http://steamcommunity.com/id/cockseverywhere/recommended/18040/","cockseverywhere","Metanoia","http://steamcommunity.com/id/cockseverywhere/","1132 products in account","If you haven't played this yet, you should. Game made me laugh so much, and I also wear a thong 24/7, now.","May 27, 2011","true","8.7"," No ratings yet","0","0","0","0","0"
"http://steamcommunity.com/profiles/76561197971942053/recommended/18040/","76561197971942053","Spectre","http://steamcommunity.com/profiles/76561197971942053/","421 products in account","REALLY REALLY GREAT!   Fun adventure game with isometric world view and movement...also really really funny.   Close as you can get to playing THE TICK.","July 15, 2012","true","4.1"," No ratings yet","0","0","0","0","0"
"http://steamcommunity.com/id/4morirabbit/recommended/18040/","4morirabbit","RaBBiT aka Saponetta","http://steamcommunity.com/id/4morirabbit/","181 products in account","It's all about Justice! This game is a MUST buy! Great hours of fun! Enjoy it","November 26, 2010","true","13.8"," No ratings yet","0","0","0","0","0"
"http://steamcommunity.com/id/donsultan/recommended/18040/","donsultan","Sultan","http://steamcommunity.com/id/donsultan/","235 products in account","Ron Gilbert has been playing too much WoW, and I think it shows. Still p. good, though.","December 27, 2011","true","15.2"," No ratings yet","0","0","0","0","0"
"http://steamcommunity.com/id/crisis66/recommended/18040/","crisis66","Crisis66","http://steamcommunity.com/id/crisis66/","411 products in account","Stoopid chickens.","December 23, 2011","true","169.2"," No ratings yet","0","0","0","0","0"
"http://steamcommunity.com/id/losian/recommended/18040/","losian","Losian Rooke","http://steamcommunity.com/id/losian/","285 products in account","Not a big fan, personally. Way too silly and tongue-in-cheek. The weapon variety is a little stale. This would be a decent purchase if you enjoy exceedingly over-the-top silly, but otherwise there's not much particularly remarkable. The humor was a bit hit or miss at times. Felt similar to Torchlight in terms of camera/controls. The game itself wasn't bad, but there wasn't as much depth as I'd prefer with weapons/abilities/etc., and the humor didn't tickle my fancy much.","August 18, 2011","true","9.1"," No ratings yet","0","0","0","0","0"
"http://steamcommunity.com/profiles/76561197970739339/recommended/18040/","76561197970739339","Captain Chaos","http://steamcommunity.com/profiles/76561197970739339/","320 products in account","I love Deathspank. It's fun, it's witty, and it's so self-aware that it'll make your brain hurt sometimes. This game flows really well. There aren't any clunky or unwieldy elements, and you will move along merrily from quest to quest without having to do many of the annoying dungeon crawler tasks- like selling off vendor trash. The interface is sleek and the combat is intense, and Deathspank himself may be the most awesome cliched hero tough guy ever. The only thing bigger then Deathspank's jawline is how big the dent in the floor will be after you fall over laughing. Oh and play the sequel too, since it's more of a Part 2 to this game then a sequel, per se.","January 3, 2011","true","12.6"," No ratings yet","0","0","0","0","0"
"http://steamcommunity.com/id/difficultmass/recommended/18040/","difficultmass","Rumble Splitscreen","http://steamcommunity.com/id/difficultmass/","200 products in account","Do you like swords? And nerd-humour? And THONGS?\n\nI know you answered yes to all of those questions, so the simple conclusion is that you should by, play (and secretly make love to) DeathSpank. Now.","February 25, 2011","true","11.6"," No ratings yet","0","0","0","0","1"
"http://steamcommunity.com/id/frankcaron/recommended/18040/","frankcaron","Franky","http://steamcommunity.com/id/frankcaron/","320 products in account","Tons of fun, good controls, and smooth play all around. Totally worth the $15 and a definite steal on sale.","November 19, 2010","true","10.0"," No ratings yet","0","0","0","0","0"
"http://steamcommunity.com/id/Rovlemhage/recommended/18040/","Rovlemhage","Rovlemhage","http://steamcommunity.com/id/Rovlemhage/","480 products in account","Hilarity ensued, they could have just used that in the opening cinema. this Diablo like hack and slash has a managed some thing you rarely see today, a beautiful balance of game play, Writing, and graphics. Okay if this was in a contest against Halo Reach, or Eve, and the only thing they were being judged on was graphics this probably wouldn't win. Thats good though because instead of making a game that eats graphic processors alive they made it to look as good as the game needed it. But where this game truly shines is in it's humor, The main villain looks like a wimp, the artifact of ultimate power is called "The Artifact" and to top it off the hero is kicking all of this ♥♥♥♥ while waring No Pants!\n\nNow if you'll excuse me, my chickens and I have some killing to do.","January 12, 2011","true","8.8"," No ratings yet","0","0","0","0","0"
"http://steamcommunity.com/id/slavetothepowerofDeath/recommended/18040/","slavetothepowerofDeath","-Powerslave","http://steamcommunity.com/id/slavetothepowerofDeath/","155 products in account","I remember I downloaded this game from Torrents and I was playing it around 300h+ and I have completed campaign 5 times ^^ I finally bought it for Steam and I must say that it's completely awesome and u cant be bored while playing this.\nAwesome hack'n'slash!\n\n10/10\nP.S. U must buy The Baconing and Thongs of Virue too :) (sequels)","November 9, 2014","true","9.0"," No ratings yet","0","0","0","0","0"
"http://steamcommunity.com/id/sperantia/recommended/18040/","sperantia","Sperantia","http://steamcommunity.com/id/sperantia/","239 products in account","A short, both brilliantly and stupidly FUNNY equipment-based rpg that is perfect for a fun weekend alone or with someone else (coop ftw).","December 7, 2015","true","12.5"," No ratings yet","0","0","0","0","0"
"http://steamcommunity.com/id/cgdestro/recommended/18040/","cgdestro","cg_destro","http://steamcommunity.com/id/cgdestro/","1133 products in account","Great humor, nice graphic and fun to play","December 23, 2015","true","10.8"," No ratings yet","0","0","0","0","0"
"http://steamcommunity.com/id/nklsrh/recommended/18040/","nklsrh","Nick Hill","http://steamcommunity.com/id/nklsrh/","160 products in account","A game like this needs to be funny to work, and DeathSpank does the job well. An otherwise standard top-down action RPG is elevated by some wonderful artwork and humourous writing.","December 29, 2015","true","1.7"," No ratings yet","0","0","0","0","0"
