"url","reviewerUsername","reviewerDisplayName","reviewerUrl","reviewerProductsCount","reviewText","date","recommended","hoursPlayed","voteText","helpfulPercent","votesHelpful","votesTotal","votesFunny","commentsCount"
"http://steamcommunity.com/id/kassan6ra/recommended/18040/","kassan6ra","Kassan6ra","http://steamcommunity.com/id/kassan6ra/","433 products in account","Greetings gamer wench! Or should I just call you Tina? I am DEATHSPANK, vanquisher of evil, dispenser of justice and a hero to the downtrodden. Review this game you say? Who needs reviews when we can have disco night? I, DEATHSPANK slay my enemies with impeccable grace while also looking good in purple (no actual chickens were harmed in the duration of this game). My goal is to find THE ARTIFACT, which I need, because of reasons, while my source of power comes from a special thong as well as a finely maintained dental line. But the most important thing of all is that where DEATHSPANK is involved, justice is served just like my tea: with two sugars, a little lemon, and a splash of milk.","November 26, 2013","true","13.0"," 58 of 70 people (83%) found this review helpful 7 people found this review funny","83","58","70","7","0"
"http://steamcommunity.com/id/cotionofponfusion/recommended/18040/","cotionofponfusion","Dangeresque","http://steamcommunity.com/id/cotionofponfusion/","154 products in account","This is the funniest game I've ever played. Not exaggerating. I read every line of dialogue I could find because I didn't want to miss a single joke.","November 29, 2013","true","8.4"," 30 of 32 people (94%) found this review helpful","94","30","32","0","0"
"http://steamcommunity.com/profiles/76561198021551803/recommended/18040/","76561198021551803","Sir Faulty","http://steamcommunity.com/profiles/76561198021551803/","2699 products in account","Faulty's scorecard :-\n\n1) Essential purchase\n2) Recommended purchase\n3) Recommended purchase during a sale4) Not recommended unless heavily discounted\n5) Not even recommended for Steam game collectors\n\nThong delights\nRon Gilbert is probably best know for being one of the creators (the others being Tim Shafer and Dave Grossman) of the successful Maniac Mansion and Monkey Island series that was wildly popular in the late eighties and early nineties when adventure gaming was king. Both titles combined humor to great effect with the Monkey Island characters being particularly self-aware that they were computer gaming characters.\n\nhttp://steamcommunity.com/sharedfiles/filedetails/?id=351722667\nIn an attempt to re-create the success of Guybrush Threepwood (Monkey Islands main lovable but bumbling buffoon of a wanna-be-pirate hero) we now have Deathspank (another bumbling buffoon of an idiot wanna-be-hero). Swapping out Shafer, the Caribbean and adventure gaming in general, Deathspank introduces us to its titular character and fantasy setting with a combat heavy action role playing focus. But does Deathspank have what it takes to enjoy the same sort of longevity as Guybrush Threepwood?\n\nUnfortunately not. Whilst the game may illicit the odd smile here and there, as a character he is missing the charm that accompanied Guybrush on all of his adventures. With a forced script, the gags don't really tend to flow very well most of the time and Deathspank eventually ends up being more of an irritation than anything else. WIth a stupid and idiotic quip for almost everything you do in game be prepared to have some bad comedy laid down thick and fast throughout your playthrough.\n\nhttp://steamcommunity.com/sharedfiles/filedetails/?id=351723125\nDeathspank is nothing more than a Diablo clone except this time it's dressed up as the court jester. As far as the game goes the gameplay is pretty solid and engaging if it were not for the idiot of a hero unable to shut his trap for a single second. The store page lists the epic humor of Ron Gilbert as one of its main key selling points but to be honest I was totally underwhelmed by this attempt at so called humor. I have gotten more laughs from just staring at a lemon going off in a fruit basket.\n\nGraphically the game looks quite unique with the entire world made to look like card board cut outs and it lasts roughly 10-14hrs hours which is just about right when looking at the games asking price.\n\nhttp://steamcommunity.com/sharedfiles/filedetails/?id=351724563\nWhilst I am a huge fan of Guybrush Threepwood and the Monkey Island series, I definitely am not as ardent a Deathspank fan. Fun in short little bursts and thankfully over quickly I wouldn't recommend paying full price for the title but wait for a sale instead.\n\nIf you enjoyed reading this review please follow my curator group at:-\nCurator Rater","June 13, 2014","true","18.0"," 41 of 55 people (75%) found this review helpful","75","41","55","0","2"
"http://steamcommunity.com/profiles/76561198048587276/recommended/18040/","76561198048587276","รкг๏๏ℓ๏๏รε","http://steamcommunity.com/profiles/76561198048587276/","623 products in account","Deathspank is a comedic RPG where the eponymous Deathspank is on an epic quest to find The Artifact, a mysterious item of mysterious mystery. Armed with both heroic strength and sharp wit, Deathspank is a Dispenser of Justice, a Vanquisher of Evil, and a Hero to the Downtrodden. Battle your way through demons, orcs, chickens, leprechauns and many more while completing your quests and filling your bag with awesome loot (and orphans).\n\nWhether or not this results in a positive experience really depends on your sense of humor. Personally I found the whole game extremely fun, never frustrating and quite consistently hilarious, however I can appreciate silly “potty humor” which this game is overflowing with.(pun intended)\n\nPros:\nWitty jokes\nLampshade hanging\nThongs and orphans\n\nCons:\nNot enough thongs and orphans\nNo orphans in thongs\n\np.s. i will edit with pictures.....WHEN STEAM FIXES THEY'RE @!#$%^&*()","April 21, 2015","true","3.3"," 23 of 27 people (85%) found this review helpful 3 people found this review funny","85","23","27","3","0"
"http://steamcommunity.com/id/jarivera21/recommended/18040/","jarivera21","BeBetterGamer","http://steamcommunity.com/id/jarivera21/","127 products in account","If DeathSpank has anything to offer, it is charm. And orphans. It's a simple action slash RPG game that does all the heavy lifting for you. All the armor and weapons you receive upgrade automatically, and really the only effort you need to maintain your inventory is making sure you have enough space for everything. There are a lot of side-quests but mostly all of them are pretty simple and straightforward, and aren't really necessary in completing the game. This is a funny game with an outrageous plot and wacky characters, so it just wants you to sit back and have a good time. It's not trying to be more than what it is, and it knows that. I recommend playing the game on Hard if you want some sort of challenge, reading every dialogue option to get the most out of the humor in the game, and to take your time. You can get all the achievements in one play through and it's really all you need.","December 23, 2013","true","12.9"," 17 of 18 people (94%) found this review helpful","94","17","18","0","0"
"http://steamcommunity.com/id/headhonchoburnside/recommended/18040/","headhonchoburnside","Headhoncho Burnside","http://steamcommunity.com/id/headhonchoburnside/","1596 products in account","All in all a pretty solid game. The humor is fun if it's your type of humor (ex: She took the "fun" out of orphan). The controls are smooth and easy to use (used a controller - not sure if keyboard/mouse is as good). The overall story is decent. The teleport system could have used a bit more guidance. Big + is the achievements are easy to get -- 100% in about 10 hours of gameplay -- for people who go for achievements. I enjoyed the animation as well. Recommended.","October 29, 2013","true","10.4"," 16 of 18 people (89%) found this review helpful","89","16","18","0","0"
"http://steamcommunity.com/id/vai90/recommended/18040/","vai90","vai90","http://steamcommunity.com/id/vai90/","1032 products in account","When I heard Ron Gilbert was gonna make an Action RPG I was thrilled and, as it turned out, rightly so. I suppose DeathSpank can be best described as the hilarious brother of Diablo. One example for the great humor: "I once slayed a dragon!" "Really? That's amazing!" "Well, I didn't really slay it and it wasn't technically a dragon. What I meant to say is: I once kicked a cat!" My favorite quote of the game!\n\nTook me 16 hours to completely finish it (including all achievements) and I had tons of fun!","October 18, 2014","true","15.9"," 13 of 15 people (87%) found this review helpful","87","13","15","0","0"
"http://steamcommunity.com/id/skaabais/recommended/18040/","skaabais","Skaabais","http://steamcommunity.com/id/skaabais/","502 products in account","Deathspank is Hack and Slash, Action RPGame. It has alot of jokes, references & other fun thing in dialogues. Mostly people who like simple jokes/humor will enjoy it while playing. It has very interesting graphic style, like a cardboard of sorts which cought my attention. Combat in my opinion was bad in entire game i didn't enjoyed it.\nRecommended buying on sale.\n6.5/10 was interesting 12hrs spend.","September 6, 2015","true","12.3"," 8 of 8 people (100%) found this review helpful","100","8","8","0","0"
"http://steamcommunity.com/id/thoma5nator/recommended/18040/","thoma5nator","thoma5nator[ENG]","http://steamcommunity.com/id/thoma5nator/","627 products in account","This fusion of Diablo-esque adventuring and Sierra-style humor is like an immature adult's show that if you just tone your wits down just right, you'll enjoy every stunning-looking moment of. The lead character never misses a chance to drop a funny here or a reference there but it's not the kind that will make you choke on your food. "Well it's no Les Mis, but at least it's better than Cats"\nBest experienced with XBOX Controller.","November 26, 2013","true","10.6"," 13 of 18 people (72%) found this review helpful","72","13","18","0","0"
"http://steamcommunity.com/id/ditzy_doo/recommended/18040/","ditzy_doo","Totally Normal Background Pony","http://steamcommunity.com/id/ditzy_doo/","464 products in account",""Diablo 2 meets Monkey Island?"\nNot so sure about that--but DeathSpank may just be Guybrush's heroic (albeit slightly slow) cousin, sword-spinning his way to defeating evil Lord von Prong. Plenty of bad guys, loot, and, uh, snacks await you on this epic quest.\nEnvironments, items and enemies offer plenty of variety. In terms of replayability, there is not much to be had there--although the game may be worth revisiting after a year or two have passed. Multiplayer feels like an afterthought, but it is actually possible to have an (offline) friend assist you at all times.\nFor your money, you're looking at around 6 to 10 hours of gameplay (depending on how you play it and if you want to do all the side quests). You decide if it's worth it. While you're at it, you might want to buy the sequels (DeathSpank: Thongs of Virtue and The Baconing) along with this game, or else the ending (or lack thereof) may disappoint you.\nFor me, the verdict is clear: It's great.\n\nWorks flawlessly in WINE, too.","November 27, 2015","true","10.0"," 7 of 7 people (100%) found this review helpful 2 people found this review funny","100","7","7","2","0"
"http://steamcommunity.com/id/_toast/recommended/18040/","_toast","Toast","http://steamcommunity.com/id/_toast/","479 products in account","There are no poop jokes in this game. No Siree, none at all.\n\nHonest.\n\n\n\n*whistles*","March 2, 2015","true","8.8"," 8 of 9 people (89%) found this review helpful 8 people found this review funny","89","8","9","8","0"
"http://steamcommunity.com/id/metropolis_1928/recommended/18040/","metropolis_1928","metropolis_1928","http://steamcommunity.com/id/metropolis_1928/","146 products in account","A really great and fun game. Not a very long game (~10 hours approx) but if you like Ron Gilbert's jokes, looting, and fighting against really crazy enemies, this is your game. If you miss laughing with a game, get this one because you will do that during the entire game.","June 29, 2014","true","11.7"," 6 of 7 people (86%) found this review helpful","86","6","7","0","0"
"http://steamcommunity.com/id/Yogo19/recommended/18040/","Yogo19","Yogo","http://steamcommunity.com/id/Yogo19/","146 products in account",""DeathSpank" is a great little RPG/Hack 'n' Slash game with funny and simple yet interesting story. It has nice cartoon style graphics which just fits perfectly with the colorful world. The atmosphere is really pleasent and the soundtrack is pretty enjoyable while killing creatures. The combat system is fun because it's pretty easy, like the game itself, actually. However, there are some difficult quests which will take you a little more time than usual to beat them. The dialogues are interesting and also, there is a plenty of jokes in them. The characters are interesting, well designed and voice-acted good. Also, there are many items to collect, many weapons to fight with and some delicious food to feed your hungry belly and restore some of your health!\n\nOverall, I'd say the game is a little bit childish, but it doesn't matter, because it's super fun. There is also a local co-op and you can invite a friend to play together.\n\n+ Graphics - 10/10 Personally, I really like cartoon graphics.\n+ Story - 7/10 It's kind of a cliche.\n+ Characters - 10/10 They all have their own individuality.\n+ Gameplay - 10/10 A variety of quests, with interesting objectives and many other side-tasks.\n+ World - 10/10 Big map with lots of locations and places to explore. Try to find the cow!","June 18, 2015","true","7.5"," 6 of 7 people (86%) found this review helpful","86","6","7","0","0"
"http://steamcommunity.com/profiles/76561198010018820/recommended/18040/","76561198010018820","[DN] Balgus the 4th","http://steamcommunity.com/profiles/76561198010018820/","187 products in account","Ahh Deathspank! This game is simply wonderfull!\n\nDeathSpank, our hero for this story, is an unstopable dispencing machine of justice and awesome humour!\nHe his THE stereotype hero, defending the weak like orphans and defeating unfair villains like not other.\n\nWhile the game is your typical hack and slash looting game, getting better gear as you go along, the mechanics of combat are solid and fun. Especially when you get special moves type weapons, which allows from stunning all surrounding foes to attacking them while spinning like tornado of blade!!\n\nBut the combat is only one aspect of the fun that is Deathspank! The best part being the humour! There is a lot of it!\nFrom the cheesy or quite witty discussions you have with the different characters from this world to the awesome flavour text on your weapon and armour, very well written text while give you some proper intertainement.\n\nSo with the combat solid, the story interesting and the epic humour of a hero, there not much stopping you into joining DeathSpank the Vanquisher of evil in his rightous quest!\n\n\n","March 17, 2014","true","28.9"," 7 of 9 people (78%) found this review helpful","78","7","9","0","0"
"http://steamcommunity.com/id/divinitas/recommended/18040/","divinitas","diVinitas","http://steamcommunity.com/id/divinitas/","1508 products in account","Totally worth the price!\n\nYou play as Deathspank, a Dispenser of Justice, a Vanquisher of Evil, and a Hero to the Downtrodden, on your journey to get your hands on the "artifact"\nBattle through demons, orcs, chickens, leprechauns and many more while completing your quests and filling your bag with awesome loot.\n\nThe gameplay mechanics are quite basic, but nevertheless fun.\nThe dialogues are really funny, i enjoyed the voices and had to laugh each time the main hero introduces himself by saying "My name is Deathspank!"\n\nThe game is about 7-10 hours long (took me 8h), which is not too bad for that price IMO.\n\n7/10\n","July 22, 2014","true","8.5"," 8 of 11 people (73%) found this review helpful","73","8","11","0","0"
"http://steamcommunity.com/id/fdruid/recommended/18040/","fdruid","Fdruid","http://steamcommunity.com/id/fdruid/","236 products in account","Great graphic style and animations for combat and weapons. Quite funny once you get into the humour, it's quite similar to Monkey Island or The Cave.\nBut in the heart of it lies a solid action RPG/adventure, and when you put it all together, it's a really fun game to play.\nGreatly recommended! :)","January 12, 2014","true","4.1"," 4 of 4 people (100%) found this review helpful","100","4","4","0","0"
"http://steamcommunity.com/id/cocoabine/recommended/18040/","cocoabine","Cocoabine","http://steamcommunity.com/id/cocoabine/","455 products in account","7/10 - Think of a shorter Diablo/Torchlight (about 10 hours playtime) with a sense of humour and you've got DeathSpank.","November 19, 2013","true","10.7"," 5 of 6 people (83%) found this review helpful","83","5","6","0","0"
"http://steamcommunity.com/id/peremptor/recommended/18040/","peremptor","peremptor","http://steamcommunity.com/id/peremptor/","3012 products in account","Boring diablo clone trying way too hard to hold up on its direct approach parody element which wears thin from the start. Don't bother.","November 8, 2013","false","0.5"," 26 of 47 people (55%) found this review helpful 2 people found this review funny","55","26","47","2","0"
"http://steamcommunity.com/profiles/76561198063301812/recommended/18040/","76561198063301812","Luke 10:17-20","http://steamcommunity.com/profiles/76561198063301812/","2654 products in account","Great game.  It's witty, hilarious, fun to play, looks great, sounds great, and the voice acting for DeathSpank is one of the best ever!","July 16, 2012","true","25.1"," 3 of 3 people (100%) found this review helpful","100","3","3","0","0"
"http://steamcommunity.com/id/notworthyourtime/recommended/18040/","notworthyourtime","lord boonekamp","http://steamcommunity.com/id/notworthyourtime/","654 products in account","SPAAAANKKK ITT HAARRDDD IN  THEE AAAASSSSSSS","November 21, 2010","true","10.8"," 3 of 3 people (100%) found this review helpful 6 people found this review funny","100","3","3","6","1"
"http://steamcommunity.com/id/beardedatheart/recommended/18040/","beardedatheart","im a huge plate","http://steamcommunity.com/id/beardedatheart/","150 products in account","WARNING: THIS GAME IS NOT EVEN CLOSE TO AS EROTIC AS IT SOUNDS","January 18, 2014","true","5.5"," 3 of 3 people (100%) found this review helpful 2 people found this review funny","100","3","3","2","1"
"http://steamcommunity.com/id/RPINerd/recommended/18040/","RPINerd","RPINerd","http://steamcommunity.com/id/RPINerd/","470 products in account","Death Spank is a comedic action RPG similar in gameplay to titles like Diablo. While the game has the traditional tropes of equipment upgrades, character skills, loads of loot and lots of button mashing, the depth and complexity of the RPG elements are scaled back to focus more attention on the comedic narrative.\n\nWhether or not this results in a positive experience really depends on your sense of humor. Personally I found the whole game extremely fun, never frustrating and quite consistently hilarious, however I can appreciate silly “potty humor” which this game is overflowing with. There is definitely no challenge in this game once you learn the controls, and while I’ve heard some complaints about this, I feel that it was intentional (and rightfully so) in order to make the game more accessible to people not that into typical aRPG ruthlessness and instead is targeting people looking for a title filled with some great writing and comedy.\n\nI got this game a long time ago in a bundle and after playing it through to 100% I regretted not giving it a chance sooner.","October 9, 2014","true","13.9"," 4 of 5 people (80%) found this review helpful","80","4","5","0","0"
"http://steamcommunity.com/id/c00lizz/recommended/18040/","c00lizz","c00lizz","http://steamcommunity.com/id/c00lizz/","2086 products in account","Deathspank is a cute little Diablo style action RPG that is based entirely at poking fun at RPG stereotypes. Every line of dialog, every character name, every weapon description, hell, every damn thing in the game is an attempt at some form of humor and while most of it falls flat on it's ♥♥♥ some of it will make you chuckle.\n\nArtistically speaking the game is quite nice looking, the graphics are not great but the art style, where everything and everyone is really just a cardboard cutout, fits nicely with the theme of the game. The voice acting is pretty decent although it's hard to judge that in a game where nobody is supposed to sound serious in the first place.\n\nGameplay is where the game is truly lacking though. You click on an enemy to attack with weapon A and right click for weapon B. The weapons and armor is a completely linear progression and rarely require any input from you.\n\nAll in all, it's a fun little game that you will likely enjoy if you don't expect too much from it.","November 3, 2012","true","34.9"," 4 of 5 people (80%) found this review helpful","80","4","5","0","0"
"http://steamcommunity.com/id/kazzmyob/recommended/18040/","kazzmyob","kazz","http://steamcommunity.com/id/kazzmyob/","422 products in account","Really stupidly funny dialog makes up for occasional hiccups that leave your view obscured by scenery. The jump in local co-op option is actually quite awesome if you have someone hanging around that would love to leap in and get you ki.... *cough* I mean leap in a heal and help you! Neverthless whilst reasonably simple it is both fun and very funny.","October 31, 2013","true","14.9"," 2 of 2 people (100%) found this review helpful","100","2","2","0","0"
"http://steamcommunity.com/profiles/76561198008085730/recommended/18040/","76561198008085730","Objection!","http://steamcommunity.com/profiles/76561198008085730/","317 products in account","Time Played: 7 Hours\n100% Achievements\n\nDeathspank is a comedic RPG where the eponymous Deathspank is on an epic quest to find The Artifact, a mysterious item of mysterious mystery. Armed with both heroic strength and sharp wit, Deathspank is a Dispenser of Justice, a Vanquisher of Evil, and a Hero to the Downtrodden.\n\nPros:\nWitty jokes\nLampshade hanging\nThongs and orphans\n\nCons:\nNot enough thongs and orphans\nNo orphans in thongs","May 28, 2014","true","7.4"," 2 of 2 people (100%) found this review helpful","100","2","2","0","0"
"http://steamcommunity.com/id/SHUTUPLETHAN/recommended/18040/","SHUTUPLETHAN","Fazzie","http://steamcommunity.com/id/SHUTUPLETHAN/","342 products in account","You like... Spank Death in this game.\n\n\n\nHumor: 30/10 - It's that funny.\n\n\n♥♥♥♥♥..","June 23, 2011","true","0.4"," 3 of 4 people (75%) found this review helpful 1 person found this review funny","75","3","4","0","0"
"http://steamcommunity.com/id/iamhavok/recommended/18040/","iamhavok","Artyom Havok","http://steamcommunity.com/id/iamhavok/","1098 products in account","Good funny fun! feels very good on a gamepad more devs should look to this making iso-rpgs. Less than 20 hours long (i tend to take my time) all of the achivments are easy to earn in one play through.","March 6, 2015","true","19.9"," 4 of 6 people (67%) found this review helpful","67","4","6","0","0"
"http://steamcommunity.com/id/Frankinot/recommended/18040/","Frankinot","Frankinbot","http://steamcommunity.com/id/Frankinot/","360 products in account",""Is that his real name, or his stripper name?"\n-Deathspank\n\n10/10","March 18, 2014","true","14.0"," 4 of 6 people (67%) found this review helpful 3 people found this review funny","67","4","6","3","1"
"http://steamcommunity.com/profiles/76561198100296080/recommended/18040/","76561198100296080","samschneider.do","http://steamcommunity.com/profiles/76561198100296080/","1 product in account","Really fun game.  Good for the casual gamer.  My 10 year old, who also is an inexperienced gamer, also really liked it.","November 27, 2015","true","35.4"," 5 of 8 people (63%) found this review helpful","63","5","8","0","0"
"http://steamcommunity.com/id/mookiesgroove/recommended/18040/","mookiesgroove","ΜΘΘƘIΣ Mookie","http://steamcommunity.com/id/mookiesgroove/","1035 products in account","This game is so funny and underrated. Do not trust those scores! A mixed of ARPG with a touch of pop culture humor.","October 19, 2013","true","1.2"," 6 of 10 people (60%) found this review helpful 2 people found this review funny","60","6","10","2","1"
"http://steamcommunity.com/id/hairulardi/recommended/18040/","hairulardi","[-A-] Aragorn","http://steamcommunity.com/id/hairulardi/","300 products in account","yea this is a Diablo clone,\nbut actually this game is really fun 7/10.","December 12, 2013","true","13.9"," 1 person found this review helpful","0","1","1","0","0"
"http://steamcommunity.com/id/mfstate/recommended/18040/","mfstate","mana | teamfortress.tv","http://steamcommunity.com/id/mfstate/","835 products in account","A comedy game, which is absolutely rare nowadays. Also quite fun; it's sort of a Diablo-like in terms of action and a little bit so in the items and such. Recommended to play with controller.","December 28, 2010","true","13.0"," 1 person found this review helpful","0","1","1","0","0"
"http://steamcommunity.com/id/Neroxide/recommended/18040/","Neroxide","Neróxide","http://steamcommunity.com/id/Neroxide/","967 products in account","Odd game, but it's pretty decent. Nothing special. 7/10","May 27, 2015","true","10.4"," 1 person found this review helpful","0","1","1","0","0"
