"url","reviewerUsername","reviewerDisplayName","reviewerUrl","reviewerProductsCount","reviewText","date","recommended","hoursPlayed","voteText","helpfulPercent","votesHelpful","votesTotal","votesFunny","commentsCount"
"http://steamcommunity.com/profiles/76561198103219473/recommended/207750/","76561198103219473","Perroxie2K","http://steamcommunity.com/profiles/76561198103219473/","61 products in account","One of the best games of music for me ;3","June 9, 2014","true","3.8"," No ratings yet","0","0","0","0","0"
"http://steamcommunity.com/profiles/76561198056766407/recommended/207750/","76561198056766407","night_angel0589","http://steamcommunity.com/profiles/76561198056766407/","248 products in account","Brings a whole new meaning to experiencing your music. Love it. Recommend for any Galaga or Geometry Wars fan.","August 16, 2012","true","8.6"," No ratings yet","0","0","0","0","0"
"http://steamcommunity.com/profiles/76561197982840388/recommended/207750/","76561197982840388","Mr.Bob","http://steamcommunity.com/profiles/76561197982840388/","81 products in account","Symphony + Lapfoxtrax = AMAZING! This game is so fun with the right kind of music, and I love the ship and weapon customization.\n\nI could suggest a few changes to the UI though. It would be nice to have more sorting options and to know the length of a track before playing it. Also, new color packs for the levels to make this more customizable! Maybe let the user choose which colors to interpolate between.","June 10, 2014","true","10.2"," No ratings yet","0","0","0","0","0"
"http://steamcommunity.com/profiles/76561198075870252/recommended/207750/","76561198075870252","tngreywolf","http://steamcommunity.com/profiles/76561198075870252/","926 products in account","This game ROCKS! I love the fact that it uses your own music library. If you are a fan of shoot'em ups then this is one that you can't miss having.","June 10, 2014","true","1.2"," No ratings yet","0","0","0","0","0"
"http://steamcommunity.com/id/dcommando/recommended/207750/","dcommando","dcommando","http://steamcommunity.com/id/dcommando/","197 products in account","This game is absolutely incredible. Symphony blends rhythm and action together in a seamless and exciting way, creating a bright, exciting and visually stunning experience. If you are looking for new ways to enjoy your music, look no further!","June 10, 2014","true","3.7"," No ratings yet","0","0","0","0","0"
"http://steamcommunity.com/id/darkeco1/recommended/207750/","darkeco1","~DarkEco~","http://steamcommunity.com/id/darkeco1/","221 products in account","Have to say this is probably the best music based game i've played (only others i've played are Audiosurf and Beat Hazard). To start i've found that the game flows with your music much better than the other two. Beat Hazard didn't work the music element very well in my opinion, the screen looked neutrally cluttered on all sections apart from quiet ones, and enemy pattern changes wern't that noticable. In Symphony enemies constantly enter the screen to the beat, the dynamics change the speed and intensity of the enemies and your ship, and the world colour changes from a cool blue to a raging red. I also have to give it credit for having some sort of level progression. While Audiosurf and Beat Hazard were pretty much about picking a song, getting a score and that's that, Symphony has you playing a number of songs to eventually reach a boss battle within that certain artist. On top of this every time you complete a song you unlock a random item or weapon to attach to your ship, and you also have a small chance of unlocking rare and more powerful weapons if you're lucky. These can be upgraded to help you in the higher difficulty levels. Symphony just goes a lot deeper than the other two and is definitely worth a look.","August 28, 2013","true","3.0"," No ratings yet","0","0","0","0","0"
"http://steamcommunity.com/id/deafeningshadows/recommended/207750/","deafeningshadows","Deafening Shadows","http://steamcommunity.com/id/deafeningshadows/","47 products in account","Very simple concept, but amazing & addictive game! The color scheme and change of aggression sends you for a ride that when combined with your music, gives you a whole new listening experience. Overall I give it an 8 to 9 out of 10 and reccomend it to everyone out there! If you love music, it's worth the price!","November 16, 2012","true","23.5"," No ratings yet","0","0","0","0","0"
"http://steamcommunity.com/profiles/76561198040027211/recommended/207750/","76561198040027211","Wonderland","http://steamcommunity.com/profiles/76561198040027211/","183 products in account","If you like listening to music and playing games by yourself then this games for you, if not then it's great to play a song or two while waiting for your buddies to get ready to play something else. The game itself could be better as a bullet hell style game and could be better as a music game. 7.5/10 as a music shooter.","June 12, 2014","true","9.4"," No ratings yet","0","0","0","0","0"
"http://steamcommunity.com/id/seasicksheep/recommended/207750/","seasicksheep","Seasicksheep","http://steamcommunity.com/id/seasicksheep/","71 products in account","Space Invaders with rhythm","June 12, 2014","true","35.1"," No ratings yet","0","0","0","0","0"
"http://steamcommunity.com/id/pupsaz/recommended/207750/","pupsaz","PupsaZ","http://steamcommunity.com/id/pupsaz/","101 products in account","A great game to spend time with, really pretty and fun, has nice progression and unlock system, There's only ONE thing I want, PLEASE oh PLEEEASE ADD A SEARCH BAR, I have a ton of music on my pc and sometimes it takes forever to find a track I want.","June 14, 2014","true","1.8"," No ratings yet","0","0","0","0","0"
"http://steamcommunity.com/id/raxzinator/recommended/207750/","raxzinator","Raxz","http://steamcommunity.com/id/raxzinator/","111 products in account","Makes a lot more sense if you're really big on classical music.\n\nAnyway, I've seen this game compared to Space Invaders, but it's really more like a fast-paced Galaga with more weapons, shooting in more than one direction, and no limit on vertical movement. Oh, and it's music-driven, but the music doesn't seem to do much in non-subtle ways except for affecting the pace of the game and the power of the Subwoofer weapon -- if you're here for the feeling of "playing the music" it's not exactly the absolute best thing, but I wouldn't not get it for that reason.","June 14, 2014","true","11.9"," No ratings yet","0","0","0","0","0"
"http://steamcommunity.com/id/Tinaaz/recommended/207750/","Tinaaz","TINA!","http://steamcommunity.com/id/Tinaaz/","48 products in account","I really enjoy this game, it reminds me of Space Invaders that I used to play as a kid :P\nThis game is based on the music you add. As you jam to your music, you are in a spaceship trying to shoot things while traveling down a journey to retrieve lost souls of musicians by defeating bosses. You are also able to customize and upgrade your spaceship by unlocking new items every time you play a new song.\nUnfortuantly, this game is underrated :c\n8.2873/10 :D","June 14, 2014","true","7.1"," No ratings yet","0","0","0","0","0"
"http://steamcommunity.com/id/rjone/recommended/207750/","rjone","sinbad","http://steamcommunity.com/id/rjone/","32 products in account","Funny and cool game (style 90x)","June 15, 2014","true","0.4"," No ratings yet","0","0","0","0","0"
"http://steamcommunity.com/id/celecis/recommended/207750/","celecis","Celecis","http://steamcommunity.com/id/celecis/","55 products in account","Awesome game :3 very amusing","June 24, 2014","true","2.6"," No ratings yet","0","0","0","0","0"
"http://steamcommunity.com/profiles/76561198061713682/recommended/207750/","76561198061713682","多摩","http://steamcommunity.com/profiles/76561198061713682/","86 products in account","Best way to re-experience your songs","June 25, 2014","true","4.9"," No ratings yet","0","0","0","0","0"
"http://steamcommunity.com/id/zibuddha/recommended/207750/","zibuddha","The Surprise","http://steamcommunity.com/id/zibuddha/","755 products in account","It is a great chilling out game. Essentially Asteroids, but you always face forward. and have to unlock weapons from beating songs and can customize your ship to fire in various direction based on weapon placement on the ship. Death means little, just less kudos at the end.","August 7, 2012","true","5.3"," No ratings yet","0","0","0","0","0"
"http://steamcommunity.com/id/tonnytay60/recommended/207750/","tonnytay60","[FEAR] Summer","http://steamcommunity.com/id/tonnytay60/","362 products in account","This game is like Audiosurf, fast reaction timing and dodging skills required to actually get Overpowered. The only difference between the 2 games is that this game you shoot ♥♥♥♥, and also try to dodge ♥♥♥♥. You can quickly beat this game if you grind on 100+ songs and get level 5 scatter cannons and rare weapons. I dislike how the upgrading works, because you mostly gotta play the song around 20 times to fully get the money needed to level up your weapons. You will see soon enough what I mean if you watch out how much kudos you earned which is money. 8/10","June 25, 2014","true","14.6"," No ratings yet","0","0","0","0","0"
"http://steamcommunity.com/id/awhitesheep/recommended/207750/","awhitesheep","White Sheep","http://steamcommunity.com/id/awhitesheep/","149 products in account","This game is a shoot them up game that plays your music library as bgm and generates levels based on your music. Its graphics looks cool. But its levels are quite repetitive. The connection between how the enemy attack and the music is not strong. It is also frustrating that you get hit without seeing how you get hit. The demon idea is the worst, interrupts the game and makes pointless narratives.","November 3, 2015","false","4.8"," No ratings yet","0","0","0","0","0"
"http://steamcommunity.com/profiles/76561198034316854/recommended/207750/","76561198034316854","120 BPM","http://steamcommunity.com/profiles/76561198034316854/","167 products in account","one of the best rhythm based games - choose your favorite music, customize your ship and play to the beat. The graphics are beautiful and there is even a storyline in the background. couldnt recommend it more :)\n\n🎶🎼📻📀🎻🎶🎹📼🎧🎶🎷🎤🎺🎵🎸🎶","November 5, 2015","true","6.0"," No ratings yet","0","0","0","0","0"
"http://steamcommunity.com/profiles/76561198045927716/recommended/207750/","76561198045927716","Precious Egg","http://steamcommunity.com/profiles/76561198045927716/","85 products in account","Holy ♥♥♥♥ when the ding dong drop thats when you KNOW its real. Do not hit dark balls or you will die instantly!!! PISSES ME OFF!! But I own either way xP","November 7, 2015","true","6.2"," No ratings yet","0","0","0","0","0"
"http://steamcommunity.com/profiles/76561198025508549/recommended/207750/","76561198025508549","AngelicShaft","http://steamcommunity.com/profiles/76561198025508549/","302 products in account","Was Audiosurf fairly fun, but you yearned for more? Symphony delivers.\n\nGoing about the same aspect of taking your music into a game, this game takes a typical space-like shooter and throws in a lot of flashing lights and color to create an ideal playing style. Difficulty ranges high and low, so you almost won't ever feel that it is too easy for the first initial hours played. Weapon customization is very diverse and provides an upgrade system as well.\n\nIf you like your music, and want to play a game while listening or even play a fun space-style shooter, I would strongly recommend this title.","July 17, 2013","true","8.0"," No ratings yet","0","0","0","0","0"
"http://steamcommunity.com/id/BramRHCP/recommended/207750/","BramRHCP","Sikamixoticelixer","http://steamcommunity.com/id/BramRHCP/","122 products in account","This game rocks.\n\nIt's really cheap and is worth every single penny. endless amounts of time can be played here. The only downside however is that it is a pretty repetitive game. But the music will keep you playing ;)","June 20, 2015","true","12.5"," No ratings yet","0","0","0","0","0"
"http://steamcommunity.com/profiles/76561198023461935/recommended/207750/","76561198023461935","Ginger","http://steamcommunity.com/profiles/76561198023461935/","50 products in account","Not your average music game.\n\nSeriously, what you're doing in this game is looking for evil monsters infesting your music. It's a shooter, but with your music.\n\nThere are upgrades for it involved too, you basically make your gunship so that you can fend off the evil monsters within your song, and your song puts you on a time limit for anything that might come up, boss battles, big gunships and the like.\n\nIt's real neat and I'm not sure what else to say, you unlock stuff, you shoot things, and you listen to some good tunes.","June 20, 2015","true","1.7"," No ratings yet","0","0","0","0","0"
"http://steamcommunity.com/id/sergiorcs/recommended/207750/","sergiorcs","FurrySnowflake","http://steamcommunity.com/id/sergiorcs/","251 products in account","A bit buggy, but still a lot of fun.","June 21, 2015","true","3.3"," No ratings yet","0","0","0","0","0"
"http://steamcommunity.com/profiles/76561198079470104/recommended/207750/","76561198079470104","Huge Neutron","http://steamcommunity.com/profiles/76561198079470104/","80 products in account","♥♥♥♥ shit ♥♥♥♥ing ♥♥♥ ♥♥♥♥♥ ♥♥♥♥ dick ♥♥♥♥ing dumb stupid ♥♥♥♥","June 21, 2015","false","0.2"," No ratings yet","0","0","0","0","0"
"http://steamcommunity.com/profiles/76561198075673573/recommended/207750/","76561198075673573","wrygrass","http://steamcommunity.com/profiles/76561198075673573/","134 products in account","I rate the game, Symphony, 3.5/5. Pretty good.\n\nA pretty good 2-D Galaga style shooting game which uses your own mp3 music files to control the number of enemies on screen and the speed with which they move. There are as many levels as you have mp3 files to play but despite that, the game becomes highly repetitive early on as the enemies only have a few patterns to their movement. There are several difficulty levels which help keep the game from becoming frustrating but the game's story kept me wanting to complete it for no other reason than so that I would not be pestered by the game's random boss fights. The game's goofy story is really more of an encumbrance to this game but it is still quite fun to play in between times. It would be more fun if one could change the game's somber, sad menu music (ironic for a game based on your music files) but the game's neon-saturated graphics are beautiful and impressive and the game runs well with no major bugs and few minor ones. Pretty good overall but not solidly good. The game doesn't seem to know quite what to do with some songs which sometimes makes for odd gaming experiences.","June 21, 2015","true","10.0"," No ratings yet","0","0","0","0","0"
"http://steamcommunity.com/id/vt171/recommended/207750/","vt171","Vt1","http://steamcommunity.com/id/vt171/","495 products in account","It's like my old Truxton game for sega meets my music playlist, I love it :D.","September 15, 2012","true","4.1"," No ratings yet","0","0","0","0","0"
"http://steamcommunity.com/profiles/76561197991936173/recommended/207750/","76561197991936173","eKestrel","http://steamcommunity.com/profiles/76561197991936173/","586 products in account","Fun, but the audio is a little annoying at times. A great way to listen to your music and play.","May 8, 2015","true","2.6"," No ratings yet","0","0","0","0","0"
"http://steamcommunity.com/id/garotte80/recommended/207750/","garotte80","garotte80-cheddarMasochist","http://steamcommunity.com/id/garotte80/","477 products in account","The music played seems to have little or no bearing on what you see on the screen. Maybe shouldn't have used Animals as Leaders. Probably confused it.","May 9, 2015","false","0.2"," No ratings yet","0","0","0","0","0"
"http://steamcommunity.com/id/kellzap/recommended/207750/","kellzap","Kellzap","http://steamcommunity.com/id/kellzap/","469 products in account","Symphony is a game that is powered by yuor music, much like AudioSruf and Beathazard. There are some things that make Symphony stand out.\n\nAt first launch of the game, an "unknown entity" has seized control of your music, and you must liberate your library by defeating 5 bosses. Not only does this game have an arcadey feel like AudioSruf and Beathazard do, but it also incorperates a story, which I think is really cool.\n\nWhen you play a round of one of your songs, you will die, however the song won't end and you'll be able to continue to the end of it (but your score will take a hit). After completing a new song you'll unlock a new weapon, and if you have enough Kudos and Insperation (earned by completing more songs), you can buy it and be able to equip it on your ship. So having a large music library is an advantage. Your ship can hold 4 weapons in any configuration you desire. You can even change the angle these weapons can fire, and the firing mode (fully automatic, semi-automatic, manually etc.), so there is a TON of varation to be experimented with.\n\nThis game supports all the formats you need (.MP3, OGG, FLAC, .WAV, and .AIFF are officially supported). Symphony will not play any song that is less than 1:30 minutes long, but there is no maximum cap.\n\nI love AudioSruf and Beathazard, but IMO this game has a lot more going for it, and I highly recommened it.\n\nFor Linux players, this is a good working port. Thank you Empty Clip Studios for deciding to support Linux :D.","October 4, 2014","true","3.5"," No ratings yet","0","0","0","0","0"
"http://steamcommunity.com/id/HutchyButchy/recommended/207750/","HutchyButchy","HutchyButchy","http://steamcommunity.com/id/HutchyButchy/","125 products in account","Guitar Hero meets Geometry Wars.\nColours dazzle and fly around the screen. You dont know what to focus on either the jumpy and upbeat music or the enermies that flood the screen. With even the addition to add your own music its fantastic. My eyes simply don't know what to make of it.","June 15, 2015","true","20.5"," No ratings yet","0","0","0","0","0"
"http://steamcommunity.com/id/mantinha/recommended/207750/","mantinha","Manta","http://steamcommunity.com/id/mantinha/","417 products in account",".","June 15, 2015","false","8.2"," No ratings yet","0","0","0","0","0"
"http://steamcommunity.com/profiles/76561197977250280/recommended/207750/","76561197977250280","Tommy Wiseau","http://steamcommunity.com/profiles/76561197977250280/","281 products in account","This just isn't the game for me, it lacks purpose.","June 18, 2015","false","0.5"," No ratings yet","0","0","0","0","0"
"http://steamcommunity.com/id/p234cher/recommended/207750/","p234cher","Ω Preacher","http://steamcommunity.com/id/p234cher/","169 products in account","Nice idea, good eye candy, too easy.","May 15, 2013","false","5.1"," No ratings yet","0","0","0","0","0"
"http://steamcommunity.com/id/Cevellaux/recommended/207750/","Cevellaux","Cevellaux","http://steamcommunity.com/id/Cevellaux/","1236 products in account","Waaay better than Audiosurf, if you ask me.\n\nBy killing enemies, you get "inspiration" and "kudos", which you can spend to buy new weapons and upgrade them. To get new weapons, you need to play different songs. Some weapons are rare, so that's one "trick" that increases the game's lifespan.\n\nIn order to get more difficulty levels (and to have some sort of story line, I guess) , you need to collect "composer's souls" to fully restore the Symphony of Souls. There are 5 pages, each page gives you a higher difficulty.\n\nIn order to get these souls, you need to kill the "demon" which randomly pops up in song.\n\nIf you want a game which uses your music library, get this rather than Audiosurf.","August 6, 2012","true","6.5"," No ratings yet","0","0","0","0","0"
"http://steamcommunity.com/id/whatevenareyoulookingatscrubs/recommended/207750/","whatevenareyoulookingatscrubs","RedMageRyan","http://steamcommunity.com/id/whatevenareyoulookingatscrubs/","83 products in account","Symphony is a unique game that is only as enjoyable as the music you use to play it. The default music has nothing on the levels generated with personal music. If you don't have any of your own music, Symphony would be a 6/10. However, with personal music, Symphony gets an 8/10.\n","June 11, 2015","true","3.0"," No ratings yet","0","0","0","0","0"
"http://steamcommunity.com/id/doomslug/recommended/207750/","doomslug","doomslug","http://steamcommunity.com/id/doomslug/","109 products in account","DO you have a big music collection? do you enjoy shooting things? Then this is your game. Easily one of the best values on steam!","June 13, 2015","true","13.1"," No ratings yet","0","0","0","0","0"
"http://steamcommunity.com/id/Calculating_Infinity/recommended/207750/","Calculating_Infinity","Hotcross","http://steamcommunity.com/id/Calculating_Infinity/","166 products in account","Pretty awesome game. Load your favorite tunes, play levels talored to the music you load, and enjoy! 9/10\n\n\nLIBERATE YOUR MUSIC","June 27, 2014","true","0.6"," No ratings yet","0","0","0","0","0"
"http://steamcommunity.com/id/dropdeadhideous/recommended/207750/","dropdeadhideous","DropDeadHideous","http://steamcommunity.com/id/dropdeadhideous/","301 products in account","Holy xxxx this game is FXXKING MENTAL!!! Been playing 3 hours straight and still going!","January 4, 2013","true","6.6"," No ratings yet","0","0","0","0","0"
"http://steamcommunity.com/id/ViperZeroOne/recommended/207750/","ViperZeroOne","ViperZeroOne","http://steamcommunity.com/id/ViperZeroOne/","274 products in account","I'm not sure how to really explain this game.  It's kinda like a top-down space shooter, but takes place on a stationary square area.  You move your ship around with the mouse, shooting enemies on static paths while avoiding being shot or run into yourself.  The game comes with a series of music, which I haven't really listened to, but the best part is you can use your own music library.  Each song is a "level" where you earn 2 different kind of points in order to unlock better weapons and abilities.  The difficulty also incresaes with each level completed, and you can even select various difficulties if your song allows it.  The enemies, who have "infected" your music library, basically react (speed & agressiveness) to the music.  If you're familiar with the songs you can somewhat anticipate when things will get a bit more rough.\n\nGame explaination aside, I find this a pretty fun game to pass the time.  Each level is literally the length of the song, and the occasional "boss duel" breaks up the staleness of doing virtually the same fight over and over again.  The only downside I found to the game is during the enterance and exit of a boss duel when the "eyes" take over the screen but the action isn't stopping in the background.  It's very hard to see what you're doing and stay alive when the voice is exclaiming "Ahhhhh!"...\n\nThat said, because you can use your own standard MP3 music files, I find this game very enjoyable and would honestly recommend it to anyone who loves mixing music with gaming.","June 24, 2014","true","2.1"," No ratings yet","0","0","0","0","0"
"http://steamcommunity.com/id/celecis/recommended/207750/","celecis","Celecis","http://steamcommunity.com/id/celecis/","55 products in account","Awesome game :3 very amusing","June 24, 2014","true","2.6"," No ratings yet","0","0","0","0","0"
"http://steamcommunity.com/profiles/76561198061713682/recommended/207750/","76561198061713682","多摩","http://steamcommunity.com/profiles/76561198061713682/","86 products in account","Best way to re-experience your songs","June 25, 2014","true","4.9"," No ratings yet","0","0","0","0","0"
"http://steamcommunity.com/id/zibuddha/recommended/207750/","zibuddha","The Surprise","http://steamcommunity.com/id/zibuddha/","755 products in account","It is a great chilling out game. Essentially Asteroids, but you always face forward. and have to unlock weapons from beating songs and can customize your ship to fire in various direction based on weapon placement on the ship. Death means little, just less kudos at the end.","August 7, 2012","true","5.3"," No ratings yet","0","0","0","0","0"
"http://steamcommunity.com/id/tonnytay60/recommended/207750/","tonnytay60","[FEAR] Summer","http://steamcommunity.com/id/tonnytay60/","362 products in account","This game is like Audiosurf, fast reaction timing and dodging skills required to actually get Overpowered. The only difference between the 2 games is that this game you shoot ♥♥♥♥, and also try to dodge ♥♥♥♥. You can quickly beat this game if you grind on 100+ songs and get level 5 scatter cannons and rare weapons. I dislike how the upgrading works, because you mostly gotta play the song around 20 times to fully get the money needed to level up your weapons. You will see soon enough what I mean if you watch out how much kudos you earned which is money. 8/10","June 25, 2014","true","14.6"," No ratings yet","0","0","0","0","0"
"http://steamcommunity.com/id/tobi31061/recommended/207750/","tobi31061","Manawyrm","http://steamcommunity.com/id/tobi31061/","28 products in account","♥♥♥♥♥♥♥t. Buggy as hell under Linux, using Arch testing. x64, nvidia GTX 560.\n\nMouse movement issues, hangs, even a segFault while playing.","June 25, 2014","false","0.4"," No ratings yet","0","0","0","0","0"
"http://steamcommunity.com/id/guruknol/recommended/207750/","guruknol","Guruknol","http://steamcommunity.com/id/guruknol/","250 products in account","Good way to listen to you're favorite music and enjoy a good game :)","June 25, 2014","true","0.6"," No ratings yet","0","0","0","0","0"
