"url","reviewerUsername","reviewerDisplayName","reviewerUrl","reviewerProductsCount","reviewText","date","recommended","hoursPlayed","voteText","helpfulPercent","votesHelpful","votesTotal","votesFunny","commentsCount"
"http://steamcommunity.com/profiles/76561198040023375/recommended/207750/","76561198040023375","rhythmicSmasher","http://steamcommunity.com/profiles/76561198040023375/","110 products in account","It's a shooter that changes based on your music library. There are commons and rare weapons to unlock and upgrade, and a range of difficulties that slowly become available as you demolish the bosses. The plot is thin but the game is very fun. No regrets picking it up.","April 2, 2014","true","7.1"," No ratings yet","0","0","0","0","0"
"http://steamcommunity.com/id/damordman/recommended/207750/","damordman","damordman","http://steamcommunity.com/id/damordman/","158 products in account","Ever wondered what it's like to shoot enemies on the rythm of your music? Well that is what Symphony is and gives you, and it is amazing. Pretty tricky sometimes to avoid the countless enemies, they come and go at the rythm of your music, speeding up or slowing down! If you like a challenge, you sure should try this!","February 9, 2014","true","12.4"," No ratings yet","0","0","0","0","0"
"http://steamcommunity.com/profiles/76561198035932416/recommended/207750/","76561198035932416","charlatan7472","http://steamcommunity.com/profiles/76561198035932416/","144 products in account","damntastic\n","January 5, 2013","true","1.5"," No ratings yet","0","0","0","0","0"
"http://steamcommunity.com/id/quickinstinct/recommended/207750/","quickinstinct","quickinstinct","http://steamcommunity.com/id/quickinstinct/","220 products in account","It's a vertical shooter that changes based on your personal music collection. It's like guitar hero except you're shooting instead of strumming to get the music playing, It's like Space Invaders or Asteroid meets Guitar Hero.","January 1, 2014","true","0.5"," No ratings yet","0","0","0","0","0"
"http://steamcommunity.com/id/FZeroRacer/recommended/207750/","FZeroRacer","Takeru Shirogane","http://steamcommunity.com/id/FZeroRacer/","489 products in account","Surprisingly good. It has much better music synchronization compared to Audiosurf or Beat Hazard, great incentive to keep playing (lots of unlockables!) and fun/difficult gameplay. I highly recommend it if you like music games.","August 6, 2012","true","7.7"," No ratings yet","0","0","0","0","0"
"http://steamcommunity.com/id/stonerknot/recommended/207750/","stonerknot","Molochas","http://steamcommunity.com/id/stonerknot/","231 products in account","Very fun and creative I love this game!","August 6, 2012","true","14.9"," No ratings yet","0","0","0","0","0"
"http://steamcommunity.com/id/ExiledClaptrap/recommended/207750/","ExiledClaptrap","Exiled Claptrap","http://steamcommunity.com/id/ExiledClaptrap/","420 products in account","A wonderful shoot'em up experience that uses your music to generate the levels while you play, affecting the enemies and difficulty.  A simple and pleasent visual style and weapon unlocks and upgrades make this a fun game to play.","March 31, 2013","true","8.9"," No ratings yet","0","0","0","0","0"
"http://steamcommunity.com/id/ZuXiXiaXiao/recommended/207750/","ZuXiXiaXiao","[TGSG]ZuXiXiaXiao","http://steamcommunity.com/id/ZuXiXiaXiao/","185 products in account","HOLY ♥♥♥♥!","November 22, 2012","true","5.0"," No ratings yet","0","0","0","0","0"
"http://steamcommunity.com/profiles/76561198008064481/recommended/207750/","76561198008064481","Combustable","http://steamcommunity.com/profiles/76561198008064481/","134 products in account","Clever little game :D Great for killing time","August 28, 2013","true","0.5"," No ratings yet","0","0","0","0","0"
"http://steamcommunity.com/profiles/76561198034013720/recommended/207750/","76561198034013720","Multiverse","http://steamcommunity.com/profiles/76561198034013720/","120 products in account","listened to music 10/10","January 4, 2014","true","3.6"," No ratings yet","0","0","0","0","0"
"http://steamcommunity.com/id/theWatchingShadow/recommended/207750/","theWatchingShadow","The Watching Shadow","http://steamcommunity.com/id/theWatchingShadow/","3745 products in account","Definitely been having fun with this game.  If you like Audiosurf and like the Gummi Ship parts of Kingdom Hearts (or Space Invaders for that matter!) I have a good feeling you'll like this game too.  It's a bit quirky in that you have to set folders and it pulls ALL music from those folders whether or not it meets it's level 'requirement (has to be at least 1:30 long).  The achievements are interesting to try to do and it's amusing trying out new weapons on the ship, their set angle and upgrading them as I try to 'defend' my music.","January 4, 2014","true","14.8"," No ratings yet","0","0","0","0","0"
"http://steamcommunity.com/id/zeekstey/recommended/207750/","zeekstey","Overwatch","http://steamcommunity.com/id/zeekstey/","457 products in account","19:27 - ¡ Casual ВИD ¡: omg, i just realized that i can eat burger and play this game at the same time!!!\n19:27 - MrBalrog: uh\n19:27 - MrBalrog: really\n19:27 - MrBalrog: that's\n19:27 - MrBalrog: okay\n19:27 - ¡ Casual ВИD ¡: Mouse only game!\n19:27 - MrBalrog: left handed\n19:28 - ¡ Casual ВИD ¡: Then use your right hand!\n19:28 - MrBalrog: i see you put a hat on the nightmare inducing logo\n19:28 - ¡ Casual ВИD ¡: not me\n19:28 - MrBalrog: no I don't mean it like that\n19:28 - ¡ Casual ВИD ¡: it was pre-made\n19:28 - MrBalrog: i am not left handed mouse user\n19:28 - ¡ Casual ВИD ¡: then what the hell you meant?\n19:29 - MrBalrog: Ignore it\n19:29 - MrBalrog: i was being dumb\n19:29 - ¡ Casual ВИD ¡: no way, it's my job\n19:29 - MrBalrog: then i took it","August 27, 2012","true","9.3"," No ratings yet","0","0","0","0","1"
"http://steamcommunity.com/id/Skycure/recommended/207750/","Skycure","Skycure","http://steamcommunity.com/id/Skycure/","67 products in account","Rating: 3/5     "A simple, fun, and replayable gaming experience."\n\nSymphony is a simple game with high replay-ability.  Your music is under attack by an unknown viral-like entity, and in order to defend it, you must command and customize a ship and fight off enemies in what I can only describe as a grid-field.  Each song in your computer becomes a level, and each level is generated by analyzing the song chosen: that is to say, a slow song portion will typically yield slow moving enemies, while faster segments will introduce more intense opponents.  Symphony isn't exactly a must-have title, but make no mistake: it certainly makes a good addition to your game collection!","March 14, 2013","true","13.0"," No ratings yet","0","0","0","0","0"
"http://steamcommunity.com/id/jimdiamond/recommended/207750/","jimdiamond","LilChigga","http://steamcommunity.com/id/jimdiamond/","52 products in account","First Indie Game I've ever played. I loved this game because it can enter your songs in it and Change it to Symphony. You can now either listen to your favorite songs and play the game lol !!!!!!","August 29, 2013","true","1.2"," No ratings yet","0","0","0","0","0"
"http://steamcommunity.com/profiles/76561198003190412/recommended/207750/","76561198003190412","hothbeast","http://steamcommunity.com/profiles/76561198003190412/","542 products in account","Interesting Music shooter type game.\n\nWhen i initially picked this game up I expected to unlock the music as you progress.  I was wrong you start with the full song,  No remixes.\n\nYou can import your song library, so basically you can Play this game to your own soundtrack.  A fun and interesting feature.\n\nAs you get further in the game you can unlock different weapons and customize your ships.\n\nWarning:  If you are seizure prone or get panic attacks (like I do)  this game might not be for you.  I often get headaches, and only can play a few songs at a time.\n\nDraw backs:  The price.  It is a fun game,  But wait till it goes on sale.\n\nBottom Line:  fun music game, add your own music,  and enjoy....just when it goes on sale.","January 6, 2014","true","0.3"," No ratings yet","0","0","0","0","0"
"http://steamcommunity.com/profiles/76561198022695250/recommended/207750/","76561198022695250","sal_is_sam","http://steamcommunity.com/profiles/76561198022695250/","15 products in account","I love this game so much. Its like tron galaga with power ups. I love listening to my playlist on this game.","February 1, 2014","true","7.0"," No ratings yet","0","0","0","0","0"
"http://steamcommunity.com/id/why_did_i_type_this/recommended/207750/","why_did_i_type_this","William Anthonio Zeppeli","http://steamcommunity.com/id/why_did_i_type_this/","127 products in account","this is a game worthy of your money if you like old school shooters and music. the basic plot is a demon is trying to take over your music and enslaved the souls of your composers. the graphics are bright and colorful, and there are a verity of enemies that adds replay value. if you are no convensed check out the that one video gamer's(completionist) review of it on youtube.","December 24, 2013","true","17.6"," No ratings yet","0","0","0","0","0"
"http://steamcommunity.com/id/thewookie34/recommended/207750/","thewookie34","thewookie","http://steamcommunity.com/id/thewookie34/","1505 products in account","So much better then Beat Hazard but a little less layed back. The time you fight boss can be so funny seeing as it picks a random song to "Steal the composer soul" for. I had the Souls of Toy-Boy, Aqua and Superbus stolen. I could stop laughing when the cut scene popped up on Playmate to Jesus or Halloween by Aqua. It was great fun.","December 3, 2012","true","6.0"," No ratings yet","0","0","0","0","0"
"http://steamcommunity.com/id/m385/recommended/207750/","m385","mebs","http://steamcommunity.com/id/m385/","202 products in account","I like the concept and the graphics are pretty, but the song selection UI is horrendously clumsy. If only this game was more like Audiosurf.","August 28, 2013","false","4.1"," No ratings yet","0","0","0","0","0"
"http://steamcommunity.com/profiles/76561198015819533/recommended/207750/","76561198015819533","Derpy Hooves","http://steamcommunity.com/profiles/76561198015819533/","93 products in account","Play it or I will eat your hands!","February 15, 2013","true","27.3"," No ratings yet","0","0","0","0","0"
"http://steamcommunity.com/id/yuzumerce/recommended/207750/","yuzumerce","yuzumerce","http://steamcommunity.com/id/yuzumerce/","299 products in account","I Love Music ~","February 18, 2015","true","7.3"," No ratings yet","0","0","0","0","0"
"http://steamcommunity.com/profiles/76561198016549274/recommended/207750/","76561198016549274","Ephany","http://steamcommunity.com/profiles/76561198016549274/","118 products in account","This game is a great way to just sit and relax to your own music while playing a game. It uses your own music library and you can choose the songs that you play. I would like a little better option on how the songs are lsited, but still a great game to just sit and waste a few hours.","November 12, 2014","true","9.1"," No ratings yet","0","0","0","0","0"
"http://steamcommunity.com/id/trekeyus/recommended/207750/","trekeyus","trekeyus","http://steamcommunity.com/id/trekeyus/","181 products in account","much like other games that use your music this one is extremly adictive. the music scanner dose tend to chock on non music files in the folders you teill it to scan so best to keep your folders clean of nasty things like exe etc or expect it to barff when scanning your libary.","November 12, 2014","true","5.8"," No ratings yet","0","0","0","0","0"
"http://steamcommunity.com/id/Seneschul/recommended/207750/","Seneschul","Seneschul","http://steamcommunity.com/id/Seneschul/","1631 products in account","Beautifully fun game. Minimalist story, but well-thought out.\n\nLots of fun (:","November 14, 2014","true","15.5"," No ratings yet","0","0","0","0","0"
"http://steamcommunity.com/id/totinothepizzaboy/recommended/207750/","totinothepizzaboy","Hallo","http://steamcommunity.com/id/totinothepizzaboy/","195 products in account","I'm not much of a music guy, but if you have a large library (like 100+ good songs) and a lot of free time, Symphony is freaking fantastic. The walls are a bit confining, especially as the difficult goes up, but the game is still enjoyable.\n\nAlso: This game runs crazy well. I'm getting consistent 50-60 FPS on a 2010 Macbook Air (bloom OFF). If you have a steam account, you'll probably be able to run the game fine.","November 14, 2014","true","1.3"," No ratings yet","0","0","0","0","0"
"http://steamcommunity.com/id/cakemagic/recommended/207750/","cakemagic","cakemagic","http://steamcommunity.com/id/cakemagic/","121 products in account","Good for casual fun\nThis game is fairly entertaining and good if you want to blow something up while listening to your music. It is really addicting in the beginning, because you'll be playing songs to unlock weapons for your ship and getting points to upgrade them. I really like that you can rotate the weapons around to make them shoot at different angles in the ship customization. The game is pretty easy, since you have infinite lives; so you can't fail. Each death however, does reduce your score and thus earn you less points.\n\nHowever the game does come with many flaws. The first annoyance is that there is no search feature for songs, like in Osu! So if you have a large library of songs, you can't use a search function to find the song you want to play. There is a filter system, but it's not optimal at all.\nAs for actual gameplay, some of the design choices will annoy you, your ship has an amazingly large hitbox and you barely have space to actually manoeuvre around. Enemies will spawn in front and at the side, so sometimes you will have absolutely no room to move at all. Some of the hits can one shot you. There are so many flashy particles on screen that you sometimes can't see the enemies or bullets coming.\nDying is one of the worst feeling ever, not because you lose points, but it feels like an eternity. When you die, you want to jump back right in, but instead you have to wait for quite some while before you respawn. When you respawn, you don't clear the screen of enemies, so if there are a lot of enemies left on screen, you'll end up dying again.\nAs you progress further into the game, it only goes downhill from there. At higher difficulty, more enemies spawn with higher hitpoints, making it frustrating to move around and survive. It does give you more points, but by the time you unlock the final difficulty, you would already have unlocked the normal weapons and upgrades you want. The only motivation for you to play the songs after 7 hours of playtime is to either hope for a rare weapon (which is just a more powerful version of the normal weapons you can unlock) or to progress the 'story' of the game.\n\nOveral I did had some fun with the game, but it comes with many annoyances. If you don't have a lot of music or don't like to listen to music, I wouldn't recommend the game; you need over 100 songs at least to fully enjoy the game. Also if you a hardcore Shoot 'Em Up player (like TouHou), you probably won't enjoy this game either. The game isn't 'challenging', but it is fun to shoot at stuff and get better weapons.\n\nI rate this game 63 out of 100 points.","November 19, 2014","true","9.9"," No ratings yet","0","0","0","0","0"
"http://steamcommunity.com/profiles/76561197980955939/recommended/207750/","76561197980955939","Bangermsuk","http://steamcommunity.com/profiles/76561197980955939/","79 products in account","great little indie game, added your own music.and blast those aliens","August 17, 2012","true","5.0"," No ratings yet","0","0","0","0","0"
"http://steamcommunity.com/id/ChaseCromwell/recommended/207750/","ChaseCromwell","chaseacromwell","http://steamcommunity.com/id/ChaseCromwell/","5 products in account","I love this game. I love music and I love games. What better combination than these two right? If you get the chance you should check out Hardstyle music, download some tracks and see how you like it. I'm going to be playing this game a lot. 5 stars.","November 28, 2014","true","8.5"," No ratings yet","0","0","0","0","0"
"http://steamcommunity.com/profiles/76561198066892685/recommended/207750/","76561198066892685","Calcifer9000","http://steamcommunity.com/profiles/76561198066892685/","144 products in account","BUY absolutly this game because if you love music and scroll beat m up and you wanna choice the music this is the perfect game for you","September 27, 2012","true","4.8"," No ratings yet","0","0","0","0","0"
"http://steamcommunity.com/id/ExiledClaptrap/recommended/207750/","ExiledClaptrap","Exiled Claptrap","http://steamcommunity.com/id/ExiledClaptrap/","420 products in account","A wonderful shoot'em up experience that uses your music to generate the levels while you play, affecting the enemies and difficulty.  A simple and pleasent visual style and weapon unlocks and upgrades make this a fun game to play.","March 31, 2013","true","8.9"," No ratings yet","0","0","0","0","0"
"http://steamcommunity.com/id/ZuXiXiaXiao/recommended/207750/","ZuXiXiaXiao","[TGSG]ZuXiXiaXiao","http://steamcommunity.com/id/ZuXiXiaXiao/","185 products in account","HOLY ♥♥♥♥!","November 22, 2012","true","5.0"," No ratings yet","0","0","0","0","0"
"http://steamcommunity.com/profiles/76561198008064481/recommended/207750/","76561198008064481","Combustable","http://steamcommunity.com/profiles/76561198008064481/","134 products in account","Clever little game :D Great for killing time","August 28, 2013","true","0.5"," No ratings yet","0","0","0","0","0"
"http://steamcommunity.com/profiles/76561198034013720/recommended/207750/","76561198034013720","Multiverse","http://steamcommunity.com/profiles/76561198034013720/","120 products in account","listened to music 10/10","January 4, 2014","true","3.6"," No ratings yet","0","0","0","0","0"
"http://steamcommunity.com/id/theWatchingShadow/recommended/207750/","theWatchingShadow","The Watching Shadow","http://steamcommunity.com/id/theWatchingShadow/","3745 products in account","Definitely been having fun with this game.  If you like Audiosurf and like the Gummi Ship parts of Kingdom Hearts (or Space Invaders for that matter!) I have a good feeling you'll like this game too.  It's a bit quirky in that you have to set folders and it pulls ALL music from those folders whether or not it meets it's level 'requirement (has to be at least 1:30 long).  The achievements are interesting to try to do and it's amusing trying out new weapons on the ship, their set angle and upgrading them as I try to 'defend' my music.","January 4, 2014","true","14.8"," No ratings yet","0","0","0","0","0"
"http://steamcommunity.com/id/jimdiamond/recommended/207750/","jimdiamond","LilChigga","http://steamcommunity.com/id/jimdiamond/","52 products in account","First Indie Game I've ever played. I loved this game because it can enter your songs in it and Change it to Symphony. You can now either listen to your favorite songs and play the game lol !!!!!!","August 29, 2013","true","1.2"," No ratings yet","0","0","0","0","0"
"http://steamcommunity.com/profiles/76561198003190412/recommended/207750/","76561198003190412","hothbeast","http://steamcommunity.com/profiles/76561198003190412/","542 products in account","Interesting Music shooter type game.\n\nWhen i initially picked this game up I expected to unlock the music as you progress.  I was wrong you start with the full song,  No remixes.\n\nYou can import your song library, so basically you can Play this game to your own soundtrack.  A fun and interesting feature.\n\nAs you get further in the game you can unlock different weapons and customize your ships.\n\nWarning:  If you are seizure prone or get panic attacks (like I do)  this game might not be for you.  I often get headaches, and only can play a few songs at a time.\n\nDraw backs:  The price.  It is a fun game,  But wait till it goes on sale.\n\nBottom Line:  fun music game, add your own music,  and enjoy....just when it goes on sale.","January 6, 2014","true","0.3"," No ratings yet","0","0","0","0","0"
"http://steamcommunity.com/id/zeekstey/recommended/207750/","zeekstey","Overwatch","http://steamcommunity.com/id/zeekstey/","457 products in account","19:27 - ¡ Casual ВИD ¡: omg, i just realized that i can eat burger and play this game at the same time!!!\n19:27 - MrBalrog: uh\n19:27 - MrBalrog: really\n19:27 - MrBalrog: that's\n19:27 - MrBalrog: okay\n19:27 - ¡ Casual ВИD ¡: Mouse only game!\n19:27 - MrBalrog: left handed\n19:28 - ¡ Casual ВИD ¡: Then use your right hand!\n19:28 - MrBalrog: i see you put a hat on the nightmare inducing logo\n19:28 - ¡ Casual ВИD ¡: not me\n19:28 - MrBalrog: no I don't mean it like that\n19:28 - ¡ Casual ВИD ¡: it was pre-made\n19:28 - MrBalrog: i am not left handed mouse user\n19:28 - ¡ Casual ВИD ¡: then what the hell you meant?\n19:29 - MrBalrog: Ignore it\n19:29 - MrBalrog: i was being dumb\n19:29 - ¡ Casual ВИD ¡: no way, it's my job\n19:29 - MrBalrog: then i took it","August 27, 2012","true","9.3"," No ratings yet","0","0","0","0","1"
"http://steamcommunity.com/id/Skycure/recommended/207750/","Skycure","Skycure","http://steamcommunity.com/id/Skycure/","67 products in account","Rating: 3/5     "A simple, fun, and replayable gaming experience."\n\nSymphony is a simple game with high replay-ability.  Your music is under attack by an unknown viral-like entity, and in order to defend it, you must command and customize a ship and fight off enemies in what I can only describe as a grid-field.  Each song in your computer becomes a level, and each level is generated by analyzing the song chosen: that is to say, a slow song portion will typically yield slow moving enemies, while faster segments will introduce more intense opponents.  Symphony isn't exactly a must-have title, but make no mistake: it certainly makes a good addition to your game collection!","March 14, 2013","true","13.0"," No ratings yet","0","0","0","0","0"
"http://steamcommunity.com/id/keksfabrik/recommended/207750/","keksfabrik","BLAZZIN","http://steamcommunity.com/id/keksfabrik/","123 products in account","Great Game, does so much fun with our own music","December 1, 2013","true","6.5"," No ratings yet","0","0","0","0","1"
"http://steamcommunity.com/id/samuraijackin/recommended/207750/","samuraijackin","<M.o.K>Samurai Jack-ing Off","http://steamcommunity.com/id/samuraijackin/","566 products in account","What could have been a really fun music-based SHMUP turned into a droll plod.\n\nThe difficulty levels are locked until you beat the bosses. The bosses show up at random. You therefore must either grind the "main game" songs, or your own library waiting for a random encounter.\n\nLeveling up weapons takes a long time, and there is no way to sell back purchased levels/weapons if you've spent the points.\n\nDecently fun, fairly good music recognition engine, but not amazing.","October 13, 2013","true","5.7"," No ratings yet","0","0","0","0","0"
"http://steamcommunity.com/profiles/76561198001561633/recommended/207750/","76561198001561633","W3t4X","http://steamcommunity.com/profiles/76561198001561633/","278 products in account","Very good game! Its simple but always fun to play, good graphics, good gameplay, and, depending on you, good songs! Recommend it 10/10","December 2, 2013","true","4.5"," No ratings yet","0","0","0","0","0"
"http://steamcommunity.com/id/hippowalrus/recommended/207750/","hippowalrus","hippowalrus","http://steamcommunity.com/id/hippowalrus/","324 products in account","Fun","January 4, 2013","true","5.4"," No ratings yet","0","0","0","0","0"
"http://steamcommunity.com/id/YUNO_DIE/recommended/207750/","YUNO_DIE","Yuno","http://steamcommunity.com/id/YUNO_DIE/","491 products in account","If you like music games (like audiosurf) you will really enjoy this. Bought this for 4€ so its totally fine. 7.5/10","December 7, 2012","true","3.8"," No ratings yet","0","0","0","0","0"
"http://steamcommunity.com/profiles/76561198025075164/recommended/207750/","76561198025075164","RudeBot","http://steamcommunity.com/profiles/76561198025075164/","570 products in account","Bullet Hell game driven by your music. Gaming and listening to your favourite music at the same. It's really cool how music affects what's going on the screen. It gets extremely difficult during crazy guitar solos :D\nBut it's mostly for fans of bullethell. Rest of the people might not find it all that interesting.","January 5, 2013","true","7.4"," No ratings yet","0","0","0","0","0"
"http://steamcommunity.com/id/leogrey/recommended/207750/","leogrey","Leo Gray","http://steamcommunity.com/id/leogrey/","557 products in account","I like all kind of musical games, but this one amazed me. If you like music and plataform ship games, this is the perfect game for you.","May 29, 2013","true","4.7"," No ratings yet","0","0","0","0","0"
