"url","reviewerUsername","reviewerDisplayName","reviewerUrl","reviewerProductsCount","reviewText","date","recommended","hoursPlayed","voteText","helpfulPercent","votesHelpful","votesTotal","votesFunny","commentsCount"
"http://steamcommunity.com/id/ayavaron/recommended/207750/","ayavaron","Cy Parker","http://steamcommunity.com/id/ayavaron/","561 products in account","This game gets boring quickly. The integration of gameplay and music is there but not terrifically easy to feel. The general style of the game's presentation is sort of lame. (Demons? Classical music terms? I feel like I'm at a Christian rock concert.) The bloom and flashy whatnot of the art style make it difficult to follow the action and it just ends up feeling, before any time has passed at all like a bad bullet hell game.","May 30, 2014","false","0.4"," 1 of 2 people (50%) found this review helpful","50","1","2","0","0"
"http://steamcommunity.com/id/Dingolicious/recommended/207750/","Dingolicious","Dingo","http://steamcommunity.com/id/Dingolicious/","128 products in account","Audiosurf meets... some sort of 2d shooter from the 90s, with Geometry Wars graphics. Why the hell have I never heard of it before now?!\n\nIf you're reading this, just click buy. It's awesome and looks like it's flown completely under the radar which is a huge shame considering the quality of the game.","May 27, 2014","true","0.8"," 1 of 2 people (50%) found this review helpful","50","1","2","0","0"
"http://steamcommunity.com/id/1337wizard/recommended/207750/","1337wizard","Justice of The Unicorn","http://steamcommunity.com/id/1337wizard/","136 products in account","This game is really fun. It's like Audiosurf and Geometry Wars had a baby.","May 30, 2014","true","3.9"," 1 of 2 people (50%) found this review helpful","50","1","2","0","0"
"http://steamcommunity.com/id/strange_horizon/recommended/207750/","strange_horizon","Zephram☼","http://steamcommunity.com/id/strange_horizon/","157 products in account","Tired of enemies shooting giant waves of bullets at you? Wanna BE the GUY that SHOOTS those waves? Wanna know what Shooby Taylor's "Stout Hearted Men" would be like if it were turned into a music-based shoot-'em-up? Buy this game and find out.","June 2, 2014","true","15.5"," 1 of 2 people (50%) found this review helpful","50","1","2","0","0"
"http://steamcommunity.com/profiles/76561198069116198/recommended/207750/","76561198069116198","Bubble Butt","http://steamcommunity.com/profiles/76561198069116198/","90 products in account","Very addicting game. I enjoy all the different things that they put in the game. I would recommend getting this game. It is a very good time waster","May 29, 2014","true","3.5"," 1 of 2 people (50%) found this review helpful","50","1","2","0","0"
"http://steamcommunity.com/id/skipperio/recommended/207750/","skipperio","Skipperio","http://steamcommunity.com/id/skipperio/","617 products in account","I love it.","October 2, 2015","true","5.0"," 1 of 2 people (50%) found this review helpful 1 person found this review funny","50","1","2","0","0"
"http://steamcommunity.com/id/ReaddyEddy/recommended/207750/","ReaddyEddy","[EcG] Solo","http://steamcommunity.com/id/ReaddyEddy/","158 products in account","i love this game.\nI love to listen to eurobeat (extremely high BPM)...\nand especially when you're drunk, this game becomes nearly impossible.\nand when you play at night, the visual lights are amazing...\nso to sum it up.\n\nplay at night + get drunk + have some insanely high BPM music and play on normal/hard.","October 20, 2015","true","3.7"," 1 of 2 people (50%) found this review helpful","50","1","2","0","0"
"http://steamcommunity.com/profiles/76561198041654594/recommended/207750/","76561198041654594","Zack the Legendary Super Saiyan","http://steamcommunity.com/profiles/76561198041654594/","56 products in account","This game is just really great it's very similar to a regular fps with the player always using a ship and to add to that it turns your music into a big part of the theme of  the game what's not to like you get to listen to music, and play a game depending on the difficulty setting you set it to and the length and type of music will determine how hard the game is, otherwise it's fun as hell in my personal opinion.","September 23, 2015","true","13.5"," 1 of 2 people (50%) found this review helpful","50","1","2","0","0"
"http://steamcommunity.com/id/cannibals/recommended/207750/","cannibals","Narcissistic Cannibal","http://steamcommunity.com/id/cannibals/","128 products in account","Basically this game is your music being played in a Galaga/Space Invaders style shooter. Pretty fun to play if you are bored. Needs more boobs.","April 24, 2015","true","7.7"," 1 of 2 people (50%) found this review helpful 6 people found this review funny","50","1","2","6","2"
"http://steamcommunity.com/id/DeltaTech/recommended/207750/","DeltaTech","Deltatech","http://steamcommunity.com/id/DeltaTech/","438 products in account","ːLaserBeamː ːLaserBeamːːLaserBeamːːLaserBeamːːLaserBeamːːLaserBeamːːLaserBeamːːLaserBeamːːLaserBeamːːLaserBeamːːLaserBeamːːLaserBeamːːLaserBeamːːLaserBeamːːLaserBeamːːLaserBeamːːLaserBeamːːLaserBeamːːLaserBeamːːLaserBeamːːLaserBeamːːLaserBeamːːLaserBeamːːLaserBeamːːLaserBeamːːLaserBeamːːLaserBeamːːLaserBeamːːLaserBeamːːLaserBeamːːLaserBeamːːLaserBeamːːLaserBeamːːLaserBeamːːLaserBeamːːLaserBeamːːLaserBeamːːLaserBeamːːLaserBeamːːLaserBeamːːLaserBeamːːLaserBeamːːLaserBeamːːLaserBeamːːLaserBeamːːLaserBeamːːLaserBeamːːLaserBeamːːLaserBeamːːLaserBeamːːLaserBeamːːLaserBeamːːLaserBeamːːLaserBeamːːLaserBeamːːLaserBeamːːLaserBeamːːLaserBeamːːLaserBeamːːLaserBeamːːLaserBeamːːLaserBeamːːLaserBeamːːLaserBeamːːLaserBeamːːLaserBeamːːLaserBeamːːLaserBeamːːLaserBeamːːLaserBeamːːLaserBeamːːLaserBeamːːLaserBeamːːLaserBeamːːLaserBeamːːLaserBeamːːLaserBeamːːLaserBeamːːLaserBeamːːLaserBeamːːLaserBeamːːLaserBeamːːLaserBeamːːLaserBeamːːLaserBeamːːLaserBeamːːLaserBeamːːLaserBeamːːLaserBeamːːLaserBeamːːLaserBeamːːLaserBeamːːLaserBeamːːLaserBeamːːLaserBeamːːLaserBeamːːLaserBeamːːLaserBeamːːLaserBeamː\n\nThis is a great shmup that plays your music.\nEach song in your music folder is a level.\nGood graphics.\nGood sound.\n\nI'll come back and write more on this title later.\nHighly suggested.\n\nːLaserBeamː ːLaserBeamːːLaserBeamːːLaserBeamːːLaserBeamːːLaserBeamːːLaserBeamːːLaserBeamːːLaserBeamːːLaserBeamːːLaserBeamːːLaserBeamːːLaserBeamːːLaserBeamːːLaserBeamːːLaserBeamːːLaserBeamːːLaserBeamːːLaserBeamːːLaserBeamːːLaserBeamːːLaserBeamːːLaserBeamːːLaserBeamːːLaserBeamːːLaserBeamːːLaserBeamːːLaserBeamːːLaserBeamːːLaserBeamːːLaserBeamːːLaserBeamːːLaserBeamːːLaserBeamːːLaserBeamːːLaserBeamːːLaserBeamːːLaserBeamːːLaserBeamːːLaserBeamːːLaserBeamːːLaserBeamːːLaserBeamːːLaserBeamːːLaserBeamːːLaserBeamːːLaserBeamːːLaserBeamːːLaserBeamːːLaserBeamːːLaserBeamːːLaserBeamːːLaserBeamːːLaserBeamːːLaserBeamːːLaserBeamːːLaserBeamːːLaserBeamːːLaserBeamːːLaserBeamːːLaserBeamːːLaserBeamːːLaserBeamːːLaserBeamːːLaserBeamːːLaserBeamːːLaserBeamːːLaserBeamːːLaserBeamːːLaserBeamːːLaserBeamːːLaserBeamːːLaserBeamːːLaserBeamːːLaserBeamːːLaserBeamːːLaserBeamːːLaserBeamːːLaserBeamːːLaserBeamːːLaserBeamːːLaserBeamːːLaserBeamːːLaserBeamːːLaserBeamːːLaserBeamːːLaserBeamːːLaserBeamːːLaserBeamːːLaserBeamːːLaserBeamːːLaserBeamːːLaserBeamːːLaserBeamːːLaserBeamːːLaserBeamːːLaserBeamːːLaserBeamːːLaserBeamː","November 29, 2014","true","1.5"," 3 of 7 people (43%) found this review helpful 2 people found this review funny","43","3","7","2","0"
"http://steamcommunity.com/id/officialrichard/recommended/207750/","officialrichard","excess","http://steamcommunity.com/id/officialrichard/","710 products in account","","March 26, 2014","false","29.8"," 3 of 7 people (43%) found this review helpful","43","3","7","0","0"
"http://steamcommunity.com/id/Zintix/recommended/207750/","Zintix","Zintix","http://steamcommunity.com/id/Zintix/","572 products in account","If it didn;t neet to keep re-adding/indexing your whole music library this game might have been some fun to play instead of a boring wait ....","January 20, 2014","false","4.5"," 2 of 5 people (40%) found this review helpful","40","2","5","0","0"
"http://steamcommunity.com/id/Farmuhan/recommended/207750/","Farmuhan","☆☭ General Far ☭☆","http://steamcommunity.com/id/Farmuhan/","865 products in account","Symphony is one of the few titles of the music-driven genre. To those not yet familiarized with this style, it consists of procedurally generated levels, and this procedure utilizes songs chosen by the user to create the levels. If you use the same song, it will always create the same level (if the difficulty chosen is the same, obviously).\n\nThe game is superb. The graphics and level of content in this game will keep you busy for a LOT of time. There is a lot to unlock and do in this game: you beat songs to get items, then you need to collect Kudos and Inspiration to unlock and upgrade these items. There are a lot of unlockables in this game and each song will unlock something;\n\nAn extremely enjoyable gameplay that is relaxing at earlier difficulties, but also can be very challenging at the hardest ones. The leaderboard system is awesome, it takes into consideration every aspect of your performance, including your ship power (the higher the power the less points you get). You can (and should) make ship builds in this game using the weapons and upgrades for optimal performance when beating songs.\n\nControls are straight-forward, you can even put auto-fire on separate weapons in your ship meaning it will fire without the need to press the left mouse button.\n\nThere is a bug which causes the game to crash when analyzing any MP3 songs, I have never seen anyone else with this issue though. All other music file extensions run just fine.\n\nLast but not least, another cool aspect of the game: To unlock difficulties you need to beat "demons" which randomly invade your songs. Those are pretty cool to fight (and challenging, too).\n\nRecommended!","June 14, 2014","true","4.0"," 1 of 3 people (33%) found this review helpful","33","1","3","0","0"
"http://steamcommunity.com/profiles/76561197997818855/recommended/207750/","76561197997818855","FalleNxRegret","http://steamcommunity.com/profiles/76561197997818855/","89 products in account","Great game! Visually stunning, fun, challenging, and let's you enjoy your own music while gaming. Arcade-style fun while rocking out to your own tunes. ♪/10, would buy again.","June 21, 2014","true","2.5"," 1 of 3 people (33%) found this review helpful","33","1","3","0","2"
"http://steamcommunity.com/profiles/76561197970384883/recommended/207750/","76561197970384883","FHDA","http://steamcommunity.com/profiles/76561197970384883/","1166 products in account","58%","October 5, 2013","true","15.7"," 1 of 3 people (33%) found this review helpful","33","1","3","0","0"
"http://steamcommunity.com/profiles/76561198026392162/recommended/207750/","76561198026392162","vulture 210","http://steamcommunity.com/profiles/76561198026392162/","164 products in account","Syphony is a load of crap it is suppose to start easy then get harder but no they had to put far too much flashing in this game and me being eperleptic dosent do me any favours this game gets my 100% vote for being a  verry poorly layed out game boy what a load of ♥♥♥♥ this game realy is.","January 25, 2014","false","4.9"," 1 of 3 people (33%) found this review helpful","33","1","3","0","0"
"http://steamcommunity.com/profiles/76561198028473035/recommended/207750/","76561198028473035","Naeun","http://steamcommunity.com/profiles/76561198028473035/","113 products in account","Pretty fun game","November 10, 2014","true","12.5"," 1 of 3 people (33%) found this review helpful","33","1","3","0","0"
"http://steamcommunity.com/profiles/76561198000722022/recommended/207750/","76561198000722022","Mr. Mayhem","http://steamcommunity.com/profiles/76561198000722022/","2239 products in account","This game is similar to Beat Hazard but nowhere near as good or fun.","January 18, 2015","false","0.2"," 1 of 3 people (33%) found this review helpful 2 people found this review funny","33","1","3","2","0"
"http://steamcommunity.com/id/elBenyo/recommended/207750/","elBenyo","elBenyo","http://steamcommunity.com/id/elBenyo/","369 products in account","This game gave my music a virus? Would play again!","June 21, 2015","true","1.7"," 1 of 3 people (33%) found this review helpful 1 person found this review funny","33","1","3","0","0"
"http://steamcommunity.com/id/Alisae/recommended/207750/","Alisae","Alisae","http://steamcommunity.com/id/Alisae/","388 products in account","1/10\n\nLooked cool at first but that's all there is to it.","April 18","false","0.2"," 1 of 3 people (33%) found this review helpful","33","1","3","0","0"
"http://steamcommunity.com/id/rodriqu/recommended/207750/","rodriqu","Rodriqu","http://steamcommunity.com/id/rodriqu/","95 products in account",":)))))","April 19","true","2.9"," 1 of 3 people (33%) found this review helpful","33","1","3","0","0"
"http://steamcommunity.com/id/tgzeus/recommended/207750/","tgzeus","TheGZeus","http://steamcommunity.com/id/tgzeus/","428 products in account","I can recommend this, with caveats.\n\nFirst of all, the algorithm they use to create the levels seems best suited to electronic music, but works well with anything with multiple changes of instrumentation and arrangement (prog rock, new wave, the more 'epic' metal styles).\n\nThe boss battles are tedious and stupid. I said it. The dialogue interrupts the music (seriously?), the bosses are spammy and/or cheap, and the sounds they make are never in the same key or rhythm as the music.\n\nThere's no way to set up a playlist, or sort music by artist+album etc. Makes this feel less like a game than a tool or a toy.\n\nYou need to sign in to something for the leaderboards. I never looked into it, because I can't be RSed.\n\n\nOn to the good things: it's a simple shmup that's nice to look at, you get to listen to whatever music you like while you play it, and the game will fit the music, for the most part. The permanent, swappable upgrades are cool, too.\nThere's no need to go too wordy on what's good here.\nDid you like Galaga but wanted _more_ and wanted to listen to, say, Erasure or Slayer and actually have it work? Well, then get this.\n\nThere are better games for free, but they don't make a shmup level out of Legendary Pink Dots songs for you!\nPut simply: fun toy.","July 18, 2014","true","3.1"," 0 of 1 people (0%) found this review helpful","0","0","1","0","0"
"http://steamcommunity.com/profiles/76561198095197017/recommended/207750/","76561198095197017","Smuggler","http://steamcommunity.com/profiles/76561198095197017/","97 products in account","Great game with powerful engine.","July 6, 2014","true","8.1"," 0 of 1 people (0%) found this review helpful","0","0","1","0","0"
"http://steamcommunity.com/id/nkata_del_gormo/recommended/207750/","nkata_del_gormo","My internet succs","http://steamcommunity.com/id/nkata_del_gormo/","256 products in account","Pew! Pew! MUSIC!\nI recomend Dubstep","July 27, 2014","true","3.4"," 0 of 1 people (0%) found this review helpful","0","0","1","0","0"
"http://steamcommunity.com/id/MrSangi/recommended/207750/","MrSangi","Q_Q__More(MrCoke)","http://steamcommunity.com/id/MrSangi/","601 products in account","Very Music, Much Spaceship, Wow Effects.","December 30, 2013","true","2.8"," 0 of 1 people (0%) found this review helpful","0","0","1","0","0"
"http://steamcommunity.com/id/Maocoholic/recommended/207750/","Maocoholic","Ticallion Stallion","http://steamcommunity.com/id/Maocoholic/","749 products in account","Imagine listening to music in the bath and every so often feeling an urge to duck your head under water to distort the music. Combine this with a fairly boring shooter and you have Symphony. From developers who don't seem to grasp that actually listening to your music is part of why music games can be so good.\n\nGo play Audiosurf or Melody's Escape.","August 16, 2014","false","3.8"," 0 of 1 people (0%) found this review helpful","0","0","1","0","2"
"http://steamcommunity.com/profiles/76561198028543359/recommended/207750/","76561198028543359","Leife","http://steamcommunity.com/profiles/76561198028543359/","895 products in account","Simple, yet fun shump game that was able to play for hours. Well worth the price\n\nMake sure you have a big music library :D","July 21, 2014","true","26.3"," 0 of 1 people (0%) found this review helpful","0","0","1","0","0"
"http://steamcommunity.com/profiles/76561197999392491/recommended/207750/","76561197999392491","EvilDrW","http://steamcommunity.com/profiles/76561197999392491/","63 products in account","savage.","June 9, 2014","true","9.3"," 0 of 1 people (0%) found this review helpful","0","0","1","0","0"
"http://steamcommunity.com/profiles/76561197999045336/recommended/207750/","76561197999045336","unknowngamer","http://steamcommunity.com/profiles/76561197999045336/","127 products in account","For every one thing this game gets right, it does two wrong. Implementing random drops make players want to try new songs, but rare drops are too few and far between to want to keep trying for them, and buying upgrades makes getting new weapons pointless. Pre-scanning your music collection (I imagine, since you can't play the game otherwise) takes some of the load times out of the game, but not using the directories that the music is saved to makes finding songs more difficult than it needs to be. The game is beautiful, but enemies will always attack in the same patterns, and most of the music and tempo based game mechanics are incredibly superficial. The story feels entirely tacked on, with finding the symphony pieces utterly inconsequential to gameplay. Boss battles completely disrupt the flow of playing through songs, and are not the least bit fair to fight in later levels.\n\nThis game certainly has potential, but as it is now, it feels too in-cohesive to be great.","June 24, 2014","false","8.5"," 0 of 1 people (0%) found this review helpful","0","0","1","0","0"
"http://steamcommunity.com/id/Tokri/recommended/207750/","Tokri","Tokri","http://steamcommunity.com/id/Tokri/","421 products in account","Fun game.","September 27, 2014","true","3.6"," 0 of 1 people (0%) found this review helpful","0","0","1","0","0"
"http://steamcommunity.com/id/Dharcindustries/recommended/207750/","Dharcindustries","Saitama","http://steamcommunity.com/id/Dharcindustries/","146 products in account","absolutly amazing. best thing to happen to my computer since cs:go. love it","February 12, 2014","true","4.0"," 0 of 1 people (0%) found this review helpful","0","0","1","0","0"
"http://steamcommunity.com/id/ewokonfirepi/recommended/207750/","ewokonfirepi","Ewokonfire","http://steamcommunity.com/id/ewokonfirepi/","244 products in account","Beat Hazard is better.","February 16, 2015","false","5.5"," 0 of 1 people (0%) found this review helpful","0","0","1","0","0"
"http://steamcommunity.com/id/7Dust/recommended/207750/","7Dust","[ENTER] the [RHINO]","http://steamcommunity.com/id/7Dust/","277 products in account","MORE LIKE MICAHEL ABY-TOVAN WITH ALL THESE EXPLSOIOSNZ","November 1, 2012","true","5.7"," 0 of 1 people (0%) found this review helpful","0","0","1","0","1"
"http://steamcommunity.com/id/nkata_del_gormo/recommended/207750/","nkata_del_gormo","My internet succs","http://steamcommunity.com/id/nkata_del_gormo/","256 products in account","Pew! Pew! MUSIC!\nI recomend Dubstep","July 27, 2014","true","3.4"," 0 of 1 people (0%) found this review helpful","0","0","1","0","0"
"http://steamcommunity.com/id/Dharcindustries/recommended/207750/","Dharcindustries","Saitama","http://steamcommunity.com/id/Dharcindustries/","146 products in account","absolutly amazing. best thing to happen to my computer since cs:go. love it","February 12, 2014","true","4.0"," 0 of 1 people (0%) found this review helpful","0","0","1","0","0"
"http://steamcommunity.com/id/Tokri/recommended/207750/","Tokri","Tokri","http://steamcommunity.com/id/Tokri/","421 products in account","Fun game.","September 27, 2014","true","3.6"," 0 of 1 people (0%) found this review helpful","0","0","1","0","0"
"http://steamcommunity.com/id/youneedatreasureroomtostoregold/recommended/207750/","youneedatreasureroomtostoregold","The Dungeon Keeper","http://steamcommunity.com/id/youneedatreasureroomtostoregold/","205 products in account","It is like galaga and Fantasia had a beautiful baby that would play my favorite songs.","June 7, 2014","true","3.8"," 0 of 1 people (0%) found this review helpful 1 person found this review funny","0","0","1","0","0"
"http://steamcommunity.com/id/ewokonfirepi/recommended/207750/","ewokonfirepi","Ewokonfire","http://steamcommunity.com/id/ewokonfirepi/","244 products in account","Beat Hazard is better.","February 16, 2015","false","5.5"," 0 of 1 people (0%) found this review helpful","0","0","1","0","0"
"http://steamcommunity.com/profiles/76561198179624186/recommended/207750/","76561198179624186","katelinmetadata","http://steamcommunity.com/profiles/76561198179624186/","37 products in account","Good: levles depend on your music\nBad: THE SOUND, AND THIS IS A BLOODY MUSIC GAME FOR PEAT SAKE. After less the five minuets the audio breaks and makes a weird sound and it is not ffmpeg it is your game,","February 18, 2015","false","14.3"," 0 of 1 people (0%) found this review helpful","0","0","1","0","0"
"http://steamcommunity.com/id/DangerZone36/recommended/207750/","DangerZone36","DangerNoodle","http://steamcommunity.com/id/DangerZone36/","243 products in account","Doesn't matter what music you are into this game will suit it, I've played everything from CCR to Dido to In Flames and it's awesome. Recommend it to everyone.","November 25, 2014","true","0.3"," 0 of 1 people (0%) found this review helpful","0","0","1","0","0"
"http://steamcommunity.com/id/industrialangel/recommended/207750/","industrialangel","IndustrialAngel","http://steamcommunity.com/id/industrialangel/","651 products in account","I highly recommend getting Symphony, Its a lot of fun and keeps you entertained for hours.","February 1, 2013","true","13.2"," 0 of 1 people (0%) found this review helpful","0","0","1","0","0"
"http://steamcommunity.com/id/kiwix91/recommended/207750/","kiwix91","kiwix","http://steamcommunity.com/id/kiwix91/","378 products in account","Beat hazard is more fun.","May 12, 2015","false","2.0"," 0 of 1 people (0%) found this review helpful","0","0","1","0","1"
"http://steamcommunity.com/id/davidlopan/recommended/207750/","davidlopan","Lo Pan","http://steamcommunity.com/id/davidlopan/","288 products in account","eh it's alright for a few minutes, but the sound effects really only work with early Daft Punk or other electronic groups.","July 24, 2014","false","0.9"," 0 of 1 people (0%) found this review helpful","0","0","1","0","0"
"http://steamcommunity.com/id/SpecialTurska/recommended/207750/","SpecialTurska","Special Rito","http://steamcommunity.com/id/SpecialTurska/","260 products in account","Way too easy with higher difficulty levels locked behind a good amount of grind. The level creation based on your music doesn't seem that accurate either (f.ex. consistently fast paced songs may be really slow in actual gameplay) and the lack of proper filtering options makes finding the songs you want to play a real hassle and the game apparently also has a problem showing Japanese character, displaying bunch of unreadable squares instead.\n\nI googled about a possibility of "Filter by Folder" option and the last mention from devs was 29 Aug, 2013 as\n"The folder-filtering option is on our list but we don't have an ETA since it's a pretty involved fix"\n\nThere didn't seem to be that many types of enemies either and at least the first two boss fights were laughably easy.","June 21, 2014","false","1.4"," 0 of 1 people (0%) found this review helpful","0","0","1","0","0"
"http://steamcommunity.com/id/kamidragon/recommended/207750/","kamidragon","Dragon / Kami Ryu","http://steamcommunity.com/id/kamidragon/","248 products in account","If you're fan of retro games, if u used to like vertical scroll spaceshooters, if you're an audiophile, this game is FOR YOU!\n\nA game where you can shoot to the beat of your favorite songs stored on your computer with TRON graphics.\nThe main story may be the weakest point of this game: just playing songs till randomly you find a level BOSS to retrieve back parts of a Symphony. When you got every part, the main story is over and you can just keep playing songs without finding more "evil devils".\n\nPros:\n\n-Playing with your favorite songs.\n-No songs length limit (since last patch) but at least 90 s.\n-Some Hard Steam Achievements.\n-Retro & Indie Game (for lovers).\n-Variety of difficulties.\n\nCons:\n\n-A Weak Argument/Story.\n-Sometimes INSANELY HARD (it may not be a con for someone).\n-Some pretty-impossible achievements.\n\nOne of the best indie games i've played.\nMy score: 7.5/10","July 19, 2013","true","33.6"," 0 of 1 people (0%) found this review helpful","0","0","1","0","0"
