"url","reviewerUsername","reviewerDisplayName","reviewerUrl","reviewerProductsCount","reviewText","date","recommended","hoursPlayed","voteText","helpfulPercent","votesHelpful","votesTotal","votesFunny","commentsCount"
"http://steamcommunity.com/id/MrStamper/recommended/207750/","MrStamper","Mr.Stamper!","http://steamcommunity.com/id/MrStamper/","374 products in account","It's like audiosurf and asteroids had a baby.\n\nand it was beautiful.","March 22, 2014","true","2.5"," 79 of 91 people (87%) found this review helpful 1 person found this review funny","87","79","91","0","0"
"http://steamcommunity.com/id/senppuu/recommended/207750/","senppuu","Senppuu","http://steamcommunity.com/id/senppuu/","1220 products in account","Symphony is a must have if you are a music games fan. It allows you to enjoy your favorite musics while shooting stuff, you can also find new weapons to customize you ship according to your play style. Very relaxing! :)","May 23, 2014","true","10.8"," 37 of 40 people (93%) found this review helpful","93","37","40","0","1"
"http://steamcommunity.com/id/rezinhf/recommended/207750/","rezinhf","r9ziη","http://steamcommunity.com/id/rezinhf/","194 products in account","This game is amazing. Not many words to describe it on its own, so I'll take two games and put them together to describe it. Space invaders and AudioSurf. Nuff said go have fun!","November 2, 2014","true","3.8"," 33 of 38 people (87%) found this review helpful","87","33","38","0","0"
"http://steamcommunity.com/id/aussiedroid/recommended/207750/","aussiedroid","Aussiedroid","http://steamcommunity.com/id/aussiedroid/","744 products in account","Fun little Shoot 'Em Up that uses your own music to generate the waves of incoming enemies. You only have a small play zone to maneuver, with enemies coming in from the sides & top of your screen making for some intense close combat game play. The responsivness of your ship with the mouse is great giving you minute control over your position & graphically the enemies & weapons fire is easy to distinguish even when there is a lot going on, on-screen.\n\nEach song completed will grant you a random weapons upgrade drop, with a chance of a rare drop. These can be purchased (& upgraded) to increase your firepower of the four weapons slots on your ship & you can even change the angle of fire for each slot to customise your layout further which is cool. This is needed as you progress up the difficulty levels & to kill the random bosses needed to complete the story mode. Scoring is combo based, so the more you can kill in sequence (with less enemies escaping), will grant higher scores but stay nimble as each death will cost you a score penalty. Each kill also drops a bonus '♫' to pickup, granting health, power-ups & score increases so you need to be quick & get them all before they disappear for the best scores.\n\nI found all but the top two difficulty levels relatively easy; each difficulty level unlocks after killing three bosses. This can take some time making the start of the game feel rather dull to grind out the first few bosses, but if you stick with it, it becomes far more enjoyable later. For me, I just got a little tipsy off a few ciders, cranked up the volume & enjoyed some of my favorite tracks which certainly helped make the initial grind pass by much quicker :p .\n\nAlthough your music generates the enemies, you don't really get a sense of any pattern to the beat which would have been nice. For example, sometimes it goes into 'hardcore mode' in parts of songs you wouldn't expect & this seems to increase in frequency the higher the difficulty you go. It's not a big issue though, as you do get the feeling of randomness in the waves so each run feels different.\n\nRegardless of the few shortcomings, if you love your music & your shoot 'em ups it is very easy to waste away a few hours in ♪ Symphony ♪ liberating your music!\n\n\nIf you enjoyed reading this review, please follow True Blue Reviews for more recommendations!","June 7, 2014","true","9.6"," 23 of 23 people (100%) found this review helpful","100","23","23","0","0"
"http://steamcommunity.com/id/Kysimir/recommended/207750/","Kysimir","Shortlived","http://steamcommunity.com/id/Kysimir/","202 products in account","This is another one of those games that I picked up on sale with a little bit of apprehension, but was pleased with the overall enjoyment of the game.  It combines your music with a fast paced, challenging, customizeable, and enjoyable gameplay where you progress through an admittedly sketchy storyline.\n\nIf you like music and frequently have a handful of minutes that isn't enough to invest in a "real" game, but too much to let idle, then this is a fantastic game for you.  Caution, after about three songs, you will start to cry -- blinking is a gift.  Don't over estimate it.","October 10, 2013","true","6.8"," 27 of 30 people (90%) found this review helpful","90","27","30","0","1"
"http://steamcommunity.com/id/nyvaos/recommended/207750/","nyvaos","خانوس","http://steamcommunity.com/id/nyvaos/","290 products in account","Symphony is another way of enjoying your music. This addictive and engaging casual shooter uses your music to configure the levels which you play. The game on itself is not very long... the story mode, at least, but as long as you want to just shoot something without complications and good challenge (do not forget the point of having your music integrated in the game), this little jewel will make wonders, so the real life of symphony is as long as big is your music library.\n\nThe mechanical is quite simple. You choose one song, and then, depending of its characteristics it throws to you to beat (and to strike you down mercilessly) one thing or other, and while you shoot and dodge cool lights you must collect inspiration points which raise your marker and at the same time repair your.... spaceship ?\n\nI bought it just for experimenting and i'm far beyond than pleased with it.","December 8, 2013","true","36.5"," 26 of 29 people (90%) found this review helpful","90","26","29","0","0"
"http://steamcommunity.com/id/jadziatuvok/recommended/207750/","jadziatuvok","Nicholas","http://steamcommunity.com/id/jadziatuvok/","763 products in account","Symphony is an example of an interesting concept let down by poor execution.\n\nThe idea of a shoot 'em up influenced by your music is a good one, and the plot conceit of fighting to rescue the composers of your music is neat.\n\nUnfortunately, it is let down by basic elements. Gameplay is simply not good. Everything is pretty much the same colour and the screen can get very full. Audiosurf's stark contrasts made for gorgeous visuals. This is just a chaotic mess.\n\nYou can unlock and equip a variety of weapons but little information is given about them and the strategy seems to be mostly just holding down the mouse button and moving around.\n\nThere doesn't feel like a lot of gameplay difference in the songs. It seems to go from low intensity to high intensity and back with nothing in between, and often not in places you'd expect.\n\nThe interface is quite clunky, and so badly designed that in some places text actually overlaps. How that is still happening after multiple patches is beyond me, but it certainly doesn't leave a good impression.\n\nIt's not outright awful, and there's some nice ideas in there, but it just hasn't come together.","June 15, 2014","false","3.9"," 27 of 33 people (82%) found this review helpful","82","27","33","0","0"
"http://steamcommunity.com/profiles/76561197997899183/recommended/207750/","76561197997899183","Zaron X","http://steamcommunity.com/profiles/76561197997899183/","427 products in account","Symphony is a solid idea marred by bad design decisions, from the unlocking of weapons and adjustment of difficulty to simple tasks like song sorting.  The visuals are frequently a confusing mess thanks to lack of contrast and effects overkill, and the deaths this causes are typically more of a frustration than actual punishment.  The play area is regularly overcrowded, with your ship being relatively huge, your hit box fairly large, and the consequences for mistakes being inconsistent (and typically leaving you wishing you'd just died instead with how crippled your weapons can become).\n\nI went in really wanting to enjoy the experience, but in the end I can't recommend this to anybody, especially on the same platform that brings so many people Audiosurf and Beat Hazard, either of which will give you a superior experience at a similar price.","November 27, 2013","false","6.6"," 35 of 47 people (74%) found this review helpful 1 person found this review funny","74","35","47","0","3"
"http://steamcommunity.com/id/curseknight/recommended/207750/","curseknight","ĸawaιι σνєяρσωєяє∂   (づ｡◕‿‿◕｡)づ","http://steamcommunity.com/id/curseknight/","374 products in account","Symphony is one of the few titles of the music-driven genre. To those not yet familiarized with this style, it consists of procedurally generated levels, and this procedure utilizes songs chosen by the user to create the levels. If you use the same song, it will always create the same level (if the difficulty chosen is the same, obviously).\n\nThe game is superb. The graphics and level of content in this game will keep you busy for a LOT of time. There is a lot to unlock and do in this game: you beat songs to get items, then you need to collect Kudos and Inspiration to unlock and upgrade these items. There are a lot of unlockables in this game and each song will unlock something;\n\nAn extremely enjoyable gameplay that is relaxing at earlier difficulties, but also can be very challenging at the hardest ones. The leaderboard system is awesome, it takes into consideration every aspect of your performance, including your ship power (the higher the power the less points you get). You can (and should) make ship builds in this game using the weapons and upgrades for optimal performance when beating songs.\n\nControls are straight-forward, you can even put auto-fire on separate weapons in your ship meaning it will fire without the need to press the left mouse button.\n\nThere is a bug which causes the game to crash when analyzing any MP3 songs, I have never seen anyone else with this issue though. All other music file extensions run just fine.\n\nLast but not least, another cool aspect of the game: To unlock difficulties you need to beat "demons" which randomly invade your songs. Those are pretty cool to fight (and challenging, too).\n\nRecommended!\n\n\nMy scores:\n\nGraphics: 10/10\nControls: 10/10\nContent: 10/10\nStory: 8/10\nReplayability: 10/10\nBugs: -1\n\nOverall: 47/50","January 7, 2014","true","11.2"," 21 of 25 people (84%) found this review helpful","84","21","25","0","0"
"http://steamcommunity.com/id/Mibani/recommended/207750/","Mibani","donny","http://steamcommunity.com/id/Mibani/","94 products in account","An absouletly fabulous game-- beautiful and well made-- easy to pick up, difficult to master... etc. There are a lot of things I could say about the experience that is Symphony, but it really is hard to put into words. If you're farmiliar with musical lingo, and fluent in reading sheet music, then this game will become one of the most entertaining and musically stimulating experiences.\n\nHave you noticed I've been refering to it as an experience? Well, I mean, this is one of the only titles I know in which you can import in speedcore techno and rock out while going through a horribly difficult bullet hell, and immediately swap over to something calm and classical while stil destroying interesting and yet heavily frustrating enemy types.\n\nPros:\nCan import ALMOST any song and play it to your difficulty level\nAwesome menu music\nFun upgrades and weapons\nReplayibility\nAuto fire options\n\nCons:\nYou cannot import songs longer than 10 minutes\nCan get painfully difficult\nBosses are spontainious and impossible to predict their encounters\nEnemies can be unforgiving if you lose a ship part\nUpgrading ship parts gets really expensive\n\nOverall 8/10.  Buy it if you like bullet hell shooters, or even just arcade style games.","December 11, 2014","true","15.7"," 15 of 16 people (94%) found this review helpful 1 person found this review funny","94","15","16","0","0"
"http://steamcommunity.com/profiles/76561198065820494/recommended/207750/","76561198065820494","[LiterallyABurningBaby] Skotty8","http://steamcommunity.com/profiles/76561198065820494/","259 products in account","I have to hand it to these guys. At first I thought it would be a game you play in short bursts then move onto the next game, but no. They made it extremely fun with customization of your ship and being able to play any song. Then there is the different difficulties. At one difficulty you may feel like "Man I barely made it through that last level! How am I gonna beat the higher difficulties?!?!" but you improve as you play more and challenge yourself more. I LOVE THIS GAME!!!!! <3\n10/10 - still play over and over even after beating the symphony.","June 18, 2015","true","12.1"," 14 of 15 people (93%) found this review helpful 2 people found this review funny","93","14","15","2","0"
"http://steamcommunity.com/id/demonslayer2222/recommended/207750/","demonslayer2222","demonslayer2222","http://steamcommunity.com/id/demonslayer2222/","720 products in account","Well i kinda like this game and a great addition is the demon bosses trying to steal your music, i still would say overall that beat hazard is the better music game out of all i have played but this is not boring and is fun to play, does it keep you interested for hours upon hours like beat hazard i would say no but if your can get it on sale then its worth a chance if you like music games like beat hazard, audiosurf and turba.","April 20, 2014","true","6.8"," 11 of 11 people (100%) found this review helpful","100","11","11","0","0"
"http://steamcommunity.com/profiles/76561198046184992/recommended/207750/","76561198046184992","BadFeungShui","http://steamcommunity.com/profiles/76561198046184992/","408 products in account","Symphony has an interesing premise; similar to Audiosurf, the experience changes based on what kind of music you have on your hard drive. The game's framing device involves an interdimensional demon that consumes music, but this is really just an excuse for me to blow up little Vertex graphics space ships while I listen to Iron Maiden (Not that anyone should need an excuse for that kind of activity).\nAt its heart, Symphony is basically a bullet-hell shooter. The ship is customizable, with four spaces for weapons and numerous different firing patterns to unlock and upgrade to even the playing field. Each song is deconstructed by the game and translated into patterns of enemies and intensity levels based on the changes in tempo and harmony.\nUnfortunately, a number of flaws continually gnaw at me while I play; firstly, several of the enemies can absorb an absolutely obnoxious amount of damage before breaking, meaning that the game's feature to aim weapons in different directions is largely an exercise in frustration. On just medium difficulty, even the fast-moving triangle shaped foes are hard to take down without several direct hits from high-powered weapons. Assuming you do manage to break several foes in a row, enemies swarm the screen in rhythmic patterns, each one in a wave flying in the same path. This means that picking up dropped notes for score means you have to fly into the next enemy in the wave, as it'll take the same path as the one you just shot down. Meanwhile, enemies entering the screen will fire projectiles that can be very hard to distinguish from the pulsing colors of the background.\nThe game allows players to acquire copies of weapons they like and upgrade them for higher power, but then punishes the player for upgrading by penalizing your score while using stronger weapons. Higher difficulty levels allow for stronger weapons and a better score bonus, but the scaling is slanted sharply, with enemies gaining far more strength than the player.\nI'm still issuing a reccomendation, because Symphony still has a lot going for it in the creative department, but there some definite shortcomings that prospective players should be aware of.","August 2, 2015","true","2.6"," 11 of 11 people (100%) found this review helpful 1 person found this review funny","100","11","11","0","2"
"http://steamcommunity.com/id/UNSC_Marshy/recommended/207750/","UNSC_Marshy","Marshy","http://steamcommunity.com/id/UNSC_Marshy/","464 products in account","The gameplay in Symphony isn't really impressive and the way the bosses come in with my music doesn't really match up. Honestly, every level feels the same. I can play some insane Techno and it's pretty lame most of the way through. I play something soothing and it's the same deal. This game is overrated in my opinion.\n\nThe vertical scrolling is a let down because your ship will move as fast as your mouse does, you level up and expand your ship, which is a big let down because it's basically just a game to grind with no skill involved, and there are little to no enemies that make the gameplay unique on any situation unless you're fighting a boss!\n\nThis game is not impressive.","April 3, 2015","false","1.1"," 30 of 47 people (64%) found this review helpful 1 person found this review funny","64","30","47","0","1"
"http://steamcommunity.com/id/tastytoast83/recommended/207750/","tastytoast83","TastyToast","http://steamcommunity.com/id/tastytoast83/","1075 products in account","Cool shoot em up that goes along to your own music library. i prefered Beat Hazard, but this game was still pretty cool.\n\nEdit: I have this game on my phone also, ive played it a ton more on the phone than on steam.","December 3, 2015","true","2.6"," 10 of 11 people (91%) found this review helpful","91","10","11","0","0"
"http://steamcommunity.com/id/EvilRapunzel/recommended/207750/","EvilRapunzel","Evelynn","http://steamcommunity.com/id/EvilRapunzel/","375 products in account","WARNING 1:\n\nThis game is causing hateness to favourite songs and addiction.\n\nWARNING 2:\n\nIf you are listening to heavy fast music = dont use it in game.\nTutorial in legendary mode is not that fun lol","October 24, 2014","true","5.9"," 17 of 24 people (71%) found this review helpful 3 people found this review funny","71","17","24","3","0"
"http://steamcommunity.com/id/488Inferno/recommended/207750/","488Inferno","Inferno","http://steamcommunity.com/id/488Inferno/","46 products in account","best euphoric experience to listen music with","October 7, 2015","true","2.8"," 11 of 13 people (85%) found this review helpful 4 people found this review funny","85","11","13","4","0"
"http://steamcommunity.com/id/JourneyThroughTheVictory/recommended/207750/","JourneyThroughTheVictory","Inception.","http://steamcommunity.com/id/JourneyThroughTheVictory/","69 products in account","This game is visually beautiful. As for auditorily? Well, my friend, that is entirely up to you. This is a game where, to the rhythm of your own music, you blast your way through waves of enemies in a grand show of beautiful colours. There is indeed nothing quite like it.\n\nI love it.","June 19, 2015","true","20.0"," 12 of 15 people (80%) found this review helpful","80","12","15","0","0"
"http://steamcommunity.com/id/Lord_Of_The_Flies/recommended/207750/","Lord_Of_The_Flies","LordOfTheFlies","http://steamcommunity.com/id/Lord_Of_The_Flies/","1088 products in account","+ Clearly made by music lovers\n+ Visually appealing\n+ Blends well with a large library of music\n\n- A bit repetitive in the later difficulty levels","June 17, 2013","true","10.1"," 8 of 8 people (100%) found this review helpful","100","8","8","0","0"
"http://steamcommunity.com/id/UnforgivenCaleb/recommended/207750/","UnforgivenCaleb","UnforgivenCaleb","http://steamcommunity.com/id/UnforgivenCaleb/","768 products in account","I thought Beat Hazard was an awesome music-drive shooter... and then I came across Symphony. And al l Ican say is... Why didn't I get this game earlier? While it's not as intense (or hard on the eyes) as Beat Hazard, it's just as deep. Unlocking new weapons and upgrades, playing through your own music collection, amazing visuals... all of these make for an amazing shooter driven by your music. You'll enjoy this game as much as you enjoy your music (unless you don't listen to music, then you're on your own).","December 22, 2014","true","3.4"," 9 of 10 people (90%) found this review helpful","90","9","10","0","0"
"http://steamcommunity.com/id/captainstardog/recommended/207750/","captainstardog","Fireballs of the Eucharist","http://steamcommunity.com/id/captainstardog/","161 products in account","I enjoyed playing this game but have concerns about security issues and dev attitude(s). Here's the thing. Some time after installing this game, I noticed that someone had installed a user named "Matt" on my system. I couldn't see this from my own computer, but from another computer on my LAN it was all too apparent. Google ultimately led me to a Steam thread regarding this game identifying the issue in January, 2013. I discovered the hidden user over my Lan in December, 2013. In at least one entire year's time, it had not been fixed and no attempt had been made to inform customers before, during, or after purchase. Since the dev had not been forthcoming with a fix, an explanation, and an apology right there on the store page or the forums over the course of an entire year, I can only presume a. the dev does not really care about his customers or his image, b. the dev has done it intentionally for some unexplained reason, or c. both. In any event, I uninstalled it from my computer and advise you to skip it.\n\nCorrection: The dev finally did post an explanation and an apology in the forums after my complaint in December, but I have to say I agree with user Bloodshed regarding the impact of the dev's error in judgment. I enjoyed playing the game, but I'm still bothered by the way that players have been impacted, and as Bloodshed states (http://steamcommunity.com/app/207750/discussions/0/630799905146964256/) I can imagine a good number of people may never discover the cause of the problem or may have spent money trying to get it resolved. Hopefully, none of those people were taken in by the increasingly popular tech scams out there.\n\nSo there you have it--fun game, but a grievous error in judgment. I will never reinstall this game on my system. Whether you trust the dev or not is entirely up to you. I appreciate the effort that the dev is making, but I'm not sure I enjoyed the game enough to risk restoring trust. How would you feel if you were having family computer time and someone asked you who this Matt was that is on the home network? If the original message(s) regarding this issue hadn't been posted on the Steam forums by other customers and if I hadn't been lucky enough to discover it, I might never have resolved this issue. I can see the potential of this creating a very frustrating experience for average casual gamers.","March 14, 2014","false","13.8"," 11 of 14 people (79%) found this review helpful","79","11","14","0","4"
"http://steamcommunity.com/id/01805666/recommended/207750/","01805666","Kokoloko","http://steamcommunity.com/id/01805666/","267 products in account","Whenever I see a game that tries to be a "music" game that reacts to what the song is like and so on, I compare it with the glorious audiosurf, and most games can´t stand the comparison, neither can Symphony. I just expect more, enemies that spawn on the bass, levels that differ, and Symphony just can´t convince me in that regard.","August 6, 2014","false","0.6"," 7 of 7 people (100%) found this review helpful","100","7","7","0","0"
"http://steamcommunity.com/id/lucew87/recommended/207750/","lucew87","[VOF]Luce87","http://steamcommunity.com/id/lucew87/","476 products in account","Space invaders meets Guitar Hero in this strange yet completely absorbing lil indie number!\nLoad up your music library (if your like me just pick a few folders as the first time I attempted my entire music collection I think I killed the game!)\n\nShoot the baddies! they are f**king everywhere in all shapes and sizes! this is your main perogative, rack up those points whilst bopping along to your favourite tracks or discover that album you randomly accquired but have never listened too.\nThen whilst you're happily playing general red face comes along and tells you how much of a b*llend hes been and how his minions are trying to steal your music soul! Destroy that m*therf**ker and rescue those composers!\n\nSeriously, this game is addictive, you dont need to think you just need to do. excellent relaxation game, fast paced (depending on your music taste!) awesomely bright visuals and good look trying to figure out why those birds are there amongst tadpoles and triangles!\n\nGet this game, its f**king crazy :D","February 9, 2015","true","2.8"," 8 of 9 people (89%) found this review helpful","89","8","9","0","0"
"http://steamcommunity.com/id/samheinwow/recommended/207750/","samheinwow","Slade Wilson","http://steamcommunity.com/id/samheinwow/","316 products in account","Symphony is like cool lights and spaceships and blowing up things and music and stuff. Cool stuff.","December 16, 2013","true","7.5"," 19 of 30 people (63%) found this review helpful","63","19","30","0","0"
