"url","reviewerUsername","reviewerDisplayName","reviewerUrl","reviewerProductsCount","reviewText","date","recommended","hoursPlayed","voteText","helpfulPercent","votesHelpful","votesTotal","votesFunny","commentsCount"
"http://steamcommunity.com/profiles/76561198153834327/recommended/212580/","76561198153834327","Captain TryHardian","http://steamcommunity.com/profiles/76561198153834327/","29 products in account","When it first appeared, i loved this reboot of the Spiderman games. And I still love it now. There was one major game breaking inconvinient: Every 2 hours or so, the game crash, independent of what you do, and you have to restart it. However, during my playtime, no saves were corrupted, so don't worry. On with the review then:\n\nGraphics: The Graphics are nice for a 2012 game, Spiderman's character model being the prettiest looking thing in the game, as well as the other Spiderman Suits.\n\nAudio: The Voice acting is really nice, and the music is perfect for each situation. When you are in combat, the music is adequate, and a big plus is the free roam music (8 different tracks which all feel fresh).\n\nStory: While the story is predictable, it is very well tied in and doesn't feel bland and boring. The Ending is also nice and the intro is also fine. All the different cross-species and robots you fight feel very suited for the mission.\n\nGameplay: The Combat is basically punch - dodge - evade - retreat, taken from the Batman games, but it is nice, and the acrobatic moves which Spidey does keep the battle satisfying and it doesn't get boring very fast. The Free Roam is very nice, the new Web-Rush ability lets you go from point to point very easy and fast, making you in control of Spidey's every move. The Web-Swing, some complain that Spidey ''swings from the sky'' which is true, but if you're not a perfectionist, you won't mind it too much. You also have different web abilities, like web shoot, web grab, the standard spidey moves. There is also a menu where you can customize Spiderman, or his web abilites, which is kind of rewarding. The Boss Battles are pattern-like, every boss has around 3 type of attacks which you will learn REALLY fast. This is a minus from me. By doing several activites (like collecting comic books, finishing the game) you will unlock 5 to 10 Spiderman Suits which are surprisingly eye-appealing and nice. A complain from me would be that most of the main mission take place in Oscorp, or the Sewers, only 2-3 taking place in New York. This was a minus from me. At street level, there isn't much to do, but once you get in the air, the fun begins (because swinging in New York is fun).\n\nLast Impression: I recommend this game to everybody. While it isn't a game changer or some sort of Game of The Year, it is nonetheless a nice experience, and i would play this game again at any time. So, what are you waiting Web-Heads? New York is your playground!","May 1","true","25.6"," 4 of 4 people (100%) found this review helpful 1 person found this review funny","100","4","4","0","0"
"http://steamcommunity.com/id/autastical/recommended/212580/","autastical","Autastic オタスティク","http://steamcommunity.com/id/autastical/","122 products in account","Fun swingin' and beatin' up ♥♥♥♥, but the since it's ported it needs to be better optimized.","March 6, 2015","true","6.7"," 5 of 6 people (83%) found this review helpful","83","5","6","0","0"
"http://steamcommunity.com/id/TheOnionKnight/recommended/212580/","TheOnionKnight","Grey Seer Campbell","http://steamcommunity.com/id/TheOnionKnight/","433 products in account","Had to delete a file just so I could click launch game from the graphics settings.\n\nResolution wouldn't change. Looked for fix, found 5 different ways to try, none worked.\n\nIf I wanted to play this game on the resolution of a calculator screen, I'd turn it upside down and spell out "boobs" with numbers instead.\n\nnvidia users beware.\n\n[TL;DR]\nSpend your money on a calculator.","May 15, 2015","false","0.2"," 10 of 16 people (63%) found this review helpful 7 people found this review funny","63","10","16","7","3"
"http://steamcommunity.com/profiles/76561197976950117/recommended/212580/","76561197976950117","Zombie Beer","http://steamcommunity.com/profiles/76561197976950117/","455 products in account","The Amazing Spider Man.  Not exactly amazing, yet it is lighthearted and easy to play.  Addictive although riddled with crashes.   Repetitive indoor scenes that make you yearn to swing around the city again.  It lacks the depth and story telling that the Batman series has despite the amount of attention this superhero has had over the last decade.  I would put this as slightly better than average game with a reasonable amount of content for a sale price.  Don't expect it to have much in the way for replay value even if you're trying to earn the achievements.  The annoying crashes and ridiculous amount of comic book pages strewn throughout the city and indoor maps won't have you drinking your favorite energy/caffeinated beverage and threatening to miss an important event.  I give it a 6.5/10 for fun with flair despite obvious shortcomings.\n\nUpdate:  The story does seem a little less hokey once complete, but I still feel empty for having finished the normal difficulty.  The achievements on Steam only update when the game decides you can finish a certain number of achievements.  It's not a fully open & live world.  Things become available for you to do as chapters unlock so in a sense it's really a forced linear progression with optional challenges.  There aren't random wandering villains doing things on their own for you to take a break from the story.","April 11, 2014","true","17.1"," 5 of 7 people (71%) found this review helpful","71","5","7","0","0"
"http://steamcommunity.com/id/liverpoop/recommended/212580/","liverpoop","[C.H.U.D.]","http://steamcommunity.com/id/liverpoop/","711 products in account","I wish I could play this game but it crashes to desktop everytime I try to run it on a setting higher than "low". I would have tried playing it on the low setting but it chugs like I'm trying to play this on a wimpy computer. From what I've read it's an issue with AMD cards. So I guess avoid this game if you have an AMD.","April 9, 2014","false","0.3"," 6 of 9 people (67%) found this review helpful 1 person found this review funny","67","6","9","0","0"
"http://steamcommunity.com/id/bubblesplaygames/recommended/212580/","bubblesplaygames","☠ Bubs ☠","http://steamcommunity.com/id/bubblesplaygames/","204 products in account","This game is wicked fun! I am and always have been a huge marvel fan spidey being my favorite. I have played every imaginable game possible that includes spider-man. I dunno about the bad reviews, I guess not a game for them. I like the story, the voice acting is great and I quite enjoyed the missions. Some state the game crashes all the time... get a new computer or something, cause it never crashes for me. And I mean never!\n\nThe free roaming is awesome, but like ANY free roaming game it will get boring, just normal. The graphics are great in my opinion and this does not feel like a bad port at all, I have seen much much worse. I think it handles the Keys and Mouse very well, if not the controller will work too.\n\nMy only disappointment was some of the DLCs. I like the Stan Lee pack (king of cameo). But The other ones were meh! SImple chanllenges and can'T really do anything more than that.\n\nAnyways AMAZING GAME! 8/10","January 4, 2014","true","20.6"," 7 of 11 people (64%) found this review helpful","64","7","11","0","0"
"http://steamcommunity.com/id/superpayne/recommended/212580/","superpayne","SuperPayne","http://steamcommunity.com/id/superpayne/","158 products in account","I have an AMD processor, and this game was nearly unplayable. If you have an AMD processor, make very sure that Amazing Spider Man will run on your processor before you buy","January 6, 2014","false","1.0"," 7 of 11 people (64%) found this review helpful","64","7","11","0","0"
"http://steamcommunity.com/profiles/76561198097996169/recommended/212580/","76561198097996169","Jasonic Godia","http://steamcommunity.com/profiles/76561198097996169/","12 products in account","NOW IT IS MISSING EXECUTABLE, WHAT IS THAT? WHY IS THIS HAPPENING, IT IS SO STUPID I WANT MY MONEY BACK!!! >:(","April 9, 2014","false","3.3"," 8 of 13 people (62%) found this review helpful","62","8","13","0","0"
"http://steamcommunity.com/id/76561198008724226/recommended/212580/","76561198008724226","Kron","http://steamcommunity.com/id/76561198008724226/","905 products in account","Kind of interesting game, but optimization ruins all fun you can get from it. Regular crashes approximately every 30 minutes make game almost impossible to play. Typical for Activision, try to sell a game without even testing it. "Of course, why should we fix our game? Let's make more DLC. And then we will make an Amazing Spider Man 2! And then we will make even more DLC. We need more money! That's all that matters!". I've bought it with 75% sale and still it's too much for this crap.","February 16, 2015","false","17.6"," 29 of 54 people (54%) found this review helpful 5 people found this review funny","54","29","54","5","0"
"http://steamcommunity.com/profiles/76561197980479037/recommended/212580/","76561197980479037","General Blue","http://steamcommunity.com/profiles/76561197980479037/","204 products in account","The Amazing Spider-Man?  More like the Amazing Spider-TURD.  This game is bad.  I wasted so much on this and it's insulting, too.  You literally go around beating up mental patients.  They aren't even demon possessed or anything.  They are just people with mental illness that you beat up with a sort of Batman Arkham action gameplay, but much less smooth.  I was excited for this game because the boss battles looked great and I thought that it was going to be like the great Batman games only with Spider-Man.  Nope.  Game is frustating and somewhat buggy.  It's crashed on me so many times during the game.  There is no style to it and the plot is very stock.  I guess it would be alright if it was like 5-10 bucks but it's overpriced and lame.\n\nStay away from this game.  Save your money and buy much cheaper and much better games.  You could get 4 games that are far superior to this for the same price.","January 6, 2014","false","2.3"," 16 of 29 people (55%) found this review helpful","55","16","29","0","3"
"http://steamcommunity.com/profiles/76561197964682472/recommended/212580/","76561197964682472","cajun","http://steamcommunity.com/profiles/76561197964682472/","262 products in account","The "Amazing" part: You get to play as Spider-Man!\n\nThe "Awful" part: Virtually everything else!\n\nSeriously, this game is just bad, bad, bad. The story is terrible. (The premise? Gwen Stacey is giving outsider Peter Parker a tour of Oscorp's most secret labs during business hours, revealing all of the monsters they have hidden away from the public. She tells you to sneak down the hallway as Oscorp employees walk next to you. Laugh out loud bad.)\n\nThe voice acting is terrible. Peter Parker and Gwen Stacey sound nothing like their counterparts in the movie that spawned this game.\n\nThe fight mechanics: Swing, swing swing, swing -- Now press the attack key! Swing, swing, swing, swing -- now press the attack key!\n\nThe graphics look fairly dated for a game that came out in 2012, and that's with my graphics settings set to (yes) "Amazing".\n\nLike some of the Spider-Man games that preceded it, this game was obviously nothing more than a quick cash grab, attempting to ride on the coat tails of the ASM movie. It could have been a lot more. If you must have this game, I strongly suggest you wait for the next Steam sale.","February 16, 2015","false","0.7"," 18 of 33 people (55%) found this review helpful 6 people found this review funny","55","18","33","6","0"
"http://steamcommunity.com/profiles/76561198115722358/recommended/212580/","76561198115722358","Bobbobfunnypants","http://steamcommunity.com/profiles/76561198115722358/","209 products in account","the launch game button doesnt work after the stupid graphics setup, so i cant even play it!!","May 4, 2015","false","21.2"," 3 of 4 people (75%) found this review helpful 1 person found this review funny","75","3","4","0","2"
"http://steamcommunity.com/id/TheLegendofJ/recommended/212580/","TheLegendofJ","TheLegend","http://steamcommunity.com/id/TheLegendofJ/","408 products in account","there is fix that worked in the past but now it no longer does for me and some others link below. I have an HD7970ghz 3GB amd fx-8350, and 16gb of ram. And now the "The Amazing Spiderman 2" is out but there still has been no patch to fix this..... considering that I'm not the only one that this game doesn't work for and it would seem to be centered around ATI GPU. There really should be a warning on the games page at the least that this game is not supported on ATI cards not a "Hey it works on those cards" ie "Recommended: Graphics: NVidia 8800GT / AMD ATI Radeon HD4830" . yeah you will lose some money I get that but this is false advertisement the game doesn't work. I have half a mind to submit a class action lawsuit for this issue it's pure negligence. even if it's to show game developers that you can't just release a game that doesn't function I mean even games in alpha and beta on steam warn you and are like "hey were not promising anything". I shouldn't have to use a third party work around to just get the game running. (that now doesn't even work for my card and others I see.) considering now the game simply crashes the instant I click to start the game. I mean seriously that game has been out since 6/26/2012 and it's now 5/7/2014 that almost two years that it's been broken even going to activision for support gets you nothing. they just tell me to do things I though and did a dozen times before ever contacting them about this in attempt to fix it to no avail.\n\nhttp://steamcommunity.com/app/212580/discussions/0/828923944451182618/#p2","May 7, 2014","false","14.6"," 5 of 8 people (63%) found this review helpful","63","5","8","0","0"
"http://steamcommunity.com/id/fuckoffspankydotcom/recommended/212580/","fuckoffspankydotcom","jiminy neutral","http://steamcommunity.com/id/fuckoffspankydotcom/","433 products in account","Lags like hell on AMD cards, unplayable. You may have better luck if you're not using one, however.","April 9, 2014","false","7.0"," 5 of 8 people (63%) found this review helpful","63","5","8","0","0"
"http://steamcommunity.com/profiles/76561198060203956/recommended/212580/","76561198060203956","Metsakurat","http://steamcommunity.com/profiles/76561198060203956/","948 products in account","CAUTION!The game is broken and unplayable.\n\nCouldn't play the game when it came out because of bad optimisation. My last PC used to be crap but it was able to run Battlefield 3 and even Witcher 2.\nThe PC was crap but it should have been powerful enough to run THIS game on medium settings at the very least.\nBut bad optimisation is the least of it problems.\n\nThe following is 100% true for Windows 8/8.1/10\n\nFast forward to 2016. I have a new PC now and I finally decided to give The "Amazing" Spider-Man a go.\nAs a first surprise the launcher told me that I don't have enough memory to play this game. This is of course a filthy lie. I have more memory than I need.\nAfter looking around for a bit I found a solution: Delete the VideoDetection.dll file and you're good to go.\nI did that, the game did launch...It launched in 640x480. No ingame video/graphics options to change that.\nThe only place you can change your video options is the launcher.\n\nThe fix might work for Windows 7 users.\n\nI tried deleting the file, launching, changing video settings on the launcher, putting the file back into the folder - Still 640x480\nTried deleting the file, launching, putting the file back, changing video settings - Still 640x480\n\nI tried just deleting the file and not putting it back. I screwed around with different compatibility modes, changing file names, giving admin rights to the game.exe and launcher files.\nThere is no fix for this mess.\n\nYou either play the game in 640x480 or not play it at all.","April 17","false","0.9"," 8 of 14 people (57%) found this review helpful 2 people found this review funny","57","8","14","2","0"
"http://steamcommunity.com/profiles/76561198048857994/recommended/212580/","76561198048857994","Kira","http://steamcommunity.com/profiles/76561198048857994/","618 products in account","Stan Lee calls you and tells you you live in "some kind of Amazing Fantasy". Stan Lee/10","September 28, 2015","true","14.9"," 12 of 22 people (55%) found this review helpful 10 people found this review funny","55","12","22","10","0"
"http://steamcommunity.com/profiles/76561198090847167/recommended/212580/","76561198090847167","Magicman","http://steamcommunity.com/profiles/76561198090847167/","103 products in account","Better than The Amazing Spider-Man 2 thats for sure","June 6, 2015","true","14.3"," 1 person found this review helpful 1 person found this review funny","0","1","1","0","0"
"http://steamcommunity.com/id/pkryuzaki/recommended/212580/","pkryuzaki","Peter Parker","http://steamcommunity.com/id/pkryuzaki/","486 products in account","This game is the best of the spidy games ever. I compare to the previous franchise of this game. I really love swinging the webs through the city. The combats are very amazing and you can use many combos like the spidy in the movies. The graphics are very nice but there are some frame rate problem. However, it's good for the fans of the spidy and I'd recommend this game to those people. I love this game and this franchise.","May 9, 2014","true","4.2"," 1 person found this review helpful","0","1","1","0","0"
"http://steamcommunity.com/profiles/76561198119426268/recommended/212580/","76561198119426268","Demon Dog","http://steamcommunity.com/profiles/76561198119426268/","20 products in account","its awsome its cool it will blow your mind\n","May 3, 2014","true","14.3"," 1 person found this review helpful","0","1","1","0","0"
"http://steamcommunity.com/id/MastaTGT/recommended/212580/","MastaTGT","MastaTGT","http://steamcommunity.com/id/MastaTGT/","746 products in account","I honestly did not expect myself to enjoy this game as much as I did. I've only played one other spider man game and I believe it was the one on the Nintendo 64. Of course the controls for swinging takes getting use to but its not too bad and the controls are actually very comfortable to use. The story was fine, Kinda got a little bored with it and left it alone, but I'm eager to get back to the game and finish it. The graphics are standard, they're not too bad for the year it came out.","November 26, 2014","true","26.8"," 1 person found this review helpful","0","1","1","0","0"
"http://steamcommunity.com/profiles/76561198001349376/recommended/212580/","76561198001349376","Jedi","http://steamcommunity.com/profiles/76561198001349376/","93 products in account","Наверное это самая лучшая игра о Человеке-пауке, в которую мне доводилось поиграть! Безумные полёты на паутине, захватывающие битвы, разнообразные комбо удары и способности. Сюжет классический, но он не портит всего удовольствия от игры. Единственное, что не очень понравилось, так это однообразие побочных миссий, надо было придумать побольше интересных заданий, тогда игре бы цены не было. А так твёрдая 9 из 10!!! Всем поклонникам и тем, кто неравнодушен к Спайди рекоммендую поиграть)","November 8, 2013","true","41.9"," 1 person found this review helpful","0","1","1","0","0"
"http://steamcommunity.com/id/HardHittingHero/recommended/212580/","HardHittingHero","HardHittingHero","http://steamcommunity.com/id/HardHittingHero/","183 products in account","Nostalgic web swinging at it's finest\n-------------------------------------\n\nThe best spiderman game out there since the early console versions.\nThe story is action packed and there is plenty to do and see.\nI completed the story in quite a short time but enjoyed my time in the city that little bit more when I just went for\nIdol city swings and beat up bad guys.\n\n+ Great graphics and animations.\n+ Large explorable city.\n+ Awesome boss fights.\n+ Plenty of content to work through.\n","June 20, 2014","true","15.0"," 2 of 3 people (67%) found this review helpful","67","2","3","0","0"
"http://steamcommunity.com/profiles/76561197997941900/recommended/212580/","76561197997941900","xxx RIP xxx","http://steamcommunity.com/profiles/76561197997941900/","469 products in account","Reminds me of tomb raider but definitely not as good as tomb raider...but nevertheless it is a neat little action adventure game.....Only part i don't like is the saving of infected people and crazy people...the web slinging action gets kind of overly redundant and boring after some time....Nevertheless people should definitely give this game a try...:)","June 23, 2014","true","16.7"," 2 of 3 people (67%) found this review helpful","67","2","3","0","0"
"http://steamcommunity.com/id/TheWiseau/recommended/212580/","TheWiseau","Me","http://steamcommunity.com/id/TheWiseau/","312 products in account","I would say, this is the better of Free Roam Spider-Man games, following Spider-Man 2. No, his web doesn't attach to buildings. If you can get over that, and the fact it's a game made because of the movie release, you can definitely find enjoyment in this Spidey game. More so, if you're a Web Head.","May 1, 2014","true","3.3"," 2 of 3 people (67%) found this review helpful","67","2","3","0","0"
"http://steamcommunity.com/id/Westdog01/recommended/212580/","Westdog01","Westdog01","http://steamcommunity.com/id/Westdog01/","31 products in account","Good game! The only problem is framerate issues... Even people with the best computers have the framerate issues... VSync doesn't help.","April 20","true","8.2"," 2 of 3 people (67%) found this review helpful 1 person found this review funny","67","2","3","0","0"
"http://steamcommunity.com/profiles/76561198082873410/recommended/212580/","76561198082873410","andyfan1","http://steamcommunity.com/profiles/76561198082873410/","141 products in account","Amazing graphics and great game play. Lots of parkour and action.","August 6, 2015","true","39.8"," 2 of 3 people (67%) found this review helpful","67","2","3","0","0"
"http://steamcommunity.com/profiles/76561198281004012/recommended/212580/","76561198281004012","B Boy Ultimate","http://steamcommunity.com/profiles/76561198281004012/","2 products in account","MAKE SURE YOU READ THIS BEFORE BUYING!\nDon't buy this game, It's truley aweful and the poorest game I've ever played on Steam. The graphics are terrible and it has lots of crashes/bugs. Thats's not all though, you'll be happy to know its barley even compatible with Windows 10 so anyone  planning on buying this that has Windows 10; save your money! The developers have messed the game up so badly, they leave it for you to fix! When you start up the launcher it will tell you that your memory is full. This stops you from starting the game so you have to go into the game file and delete a part of it just so you can play it. But the worst part for Windows 8/8.1/10 players...you cant change the resolution! This game should literrally be taken down!!! It stays on one resolution that doesn't fit your screen. I tried fixing the resolution problem and I have come to a conclution after an hour that it is impossible to fix. They don't even give you a Bmgame file so you can't change it in the games code. So I beg you, If you have any sense, don't buy this game! Its only compatible for Windows 7.","April 17","false","1.5"," 2 of 3 people (67%) found this review helpful","67","2","3","0","0"
"http://steamcommunity.com/profiles/76561197970550574/recommended/212580/","76561197970550574","Jonofwrath","http://steamcommunity.com/profiles/76561197970550574/","332 products in account","This game is broken.\n\nAfter editing my registry in order to get it to run at a resolution other than 800x600 the game threw up more stumbling blocks at which point I have to say that I no longer wanted to waste my evening fixing this broken game.\n\nI WANT MY MONEY BACK!\n\nSteam REALLY needs to make it easier to get a refund!!!!","April 9, 2014","false","1.0"," 3 of 5 people (60%) found this review helpful","60","3","5","0","0"
