"url","reviewerUsername","reviewerDisplayName","reviewerUrl","reviewerProductsCount","reviewText","date","recommended","hoursPlayed","voteText","helpfulPercent","votesHelpful","votesTotal","votesFunny","commentsCount"
"http://steamcommunity.com/profiles/76561198077025018/recommended/212580/","76561198077025018","The Grotesque Abomination","http://steamcommunity.com/profiles/76561198077025018/","234 products in account","I love Spiderman. He was the first superhero comic I ever picked up as a kid. I own more Spiderman comic books than any other series in my collection and have been reading them for eighteen years (5 yrs-23 yrs). I've also played every single Spiderman video game since back in the early 90's and i'm here to tell you...\n\nI went out on launch day to buy this game for PS3.  I beat it with my brother in law after only two sessions of playing - about 8 hours total. Mind you I was playing around a lot of that time and just exploring the city. I thought maybe I was just too hype on the game and it didn't meet my expectations...So I decided to give it another go on the PC.\n\nNow keep in mind this is an open world game, but there is little to nothing to do! The city just doesn't feel like a real complete city. I still play the older titles and compared to this they all have way more to do and a lot more diversity in their levels, which is sad considering you're supposed to progress. Almost every single main mission takes place somewhere underground. Which at first is real cool...until you realize all of the missed potential that's just sitting there above you. Laughing at you. Mocking you. There are a few missions above ground but they are seldom.\n\nThere are plenty of side missions - Like crimes to solve which are inanely repetitive and overtly mundane, nothing like they used to be. I'm not even trying to be that guy that's just stuck on the past nostalgia, but if i'm still playing those games today (which I am) over the new titles they're dishing out...somethin' ain't right. Sure the missions in those games were all repetitive too, but at least more diverse and way more fun than "Stop that car!" "Catch that runner!" "Stop that gang!" "Now stop that getaway car!" "Catch that mugger!" "There's a gang on the loose!"\n\nNo matter how you clothe a sheep it is still a sheep.\n\n"Oh, i'm sure that guys being dramatic. I heard there are little collectibles to 100% the game."\n\nYes, you can collect comic book pages to read comics on the game...which is such an awesome concept and to be honest one of the things I spent most time doing, but there are only a few issues and the time it takes to do this isn't really worth the end result. You could cut the time out completely and look up those issues online. However, there are tons of costumes...which are really cool and groovy...but also purely cosmetic, which is like building a really really nice car and never installing an engine. Cool car, bro...but...does it do anything?\n\nDefinitely not worth 39.99 OR the sale price of 27.49 that I am currently writing this review during. If the 27.49 price tag included all DLC and you're a hardcore Spidey fan THEN i'd say it is worth it.\n\nIn other words, do yourself a big favor and pick up any of these Spiderman titles for the PC instead:\n\nSpiderman Web of Shadows (Best Open World Spiderman Game Hands-Down & the Darkest)\nUltimate Spiderman (Best Open World Spiderman Game That Emulates A Live Comic Book)\nSpiderman Shattered Dimensions (Linear Level Design with Refreshing Changes in Gameplay)\nSpiderman 3 (Best Open World of the Movie-Themed)\n\nYE BE WARNED. WASTE YOUR MONEY AT YOUR OWN RISK.\n\n4.5/10","May 23, 2015","false","7.5"," 109 of 134 people (81%) found this review helpful 8 people found this review funny","81","109","134","8","21"
"http://steamcommunity.com/id/radagast89/recommended/212580/","radagast89","Greg","http://steamcommunity.com/id/radagast89/","83 products in account","This is my review of The Amazing Spider-Man. I found this game to be <<CRASH>>\n\nThis is my review of The Amazi<<CRASH>>\n\nThis is my review of The Amazing Spider-Man. I found t<<CRASH>>\n\nAnnoying, right?","March 19","false","4.0"," 161 of 212 people (76%) found this review helpful 195 people found this review funny","76","161","212","195","5"
"http://steamcommunity.com/profiles/76561198009420039/recommended/212580/","76561198009420039","JonnyRenegade","http://steamcommunity.com/profiles/76561198009420039/","412 products in account","This game was so terrible I beat it very shortly that includes getting all 700 comics.. Only a person who is really bad at gaming. ...who isn't a real gamer.... has low expectations would love this game. Their is no challenge to it that is the very definition of what a game is the challenge. Since it didn't have a challenge I don't consider this to be a true game. The game is also broken on a technical level. It has glitches, bugs, and will have you restarting your pc or it will just flash out and close itself. Notice the people below who try to discredit me. Some of these people wrote reviews only one hr of playing a game and not completing them. I'm sorry kiddies I was born in the era of NES and Atari and been gaming way longer than you peons. My experience makes me better than you new generation spoonfed gamers where every task is given to you. The AI in this game is dumb. The bosses are all the same and offer no challenge what so ever. They don't learn or do any new strategy from the next.\n\nWhen you look at this game it seems to have potential but looks are decieving. Lets start off with the kick they did to pc gamers as a punishment to not buying the game on console, and waiting for pc. So instead of snapping 7 spider signals to get the suits you are made to collect 700 comics, and complete tasks. You get most of the new suits when beating the game. Its like why after that.\nThe suits also offer no stat differences or powers.\n\nTechnical issues. Aside from webbing through the city, running up walls, and climbing them is a glitchfest, the webbing doesn't feel as fun as in past spiderman games. It also feels inorganic and articficial as you can just hold bottom R trigger to keep webbing. You'll be using the first r1 button because its more responsive and accurate. This also has its flaw as the indicator to where your travelling is only slightly more golden or yellowish.\n\nThe game constantly crashes on you. No bug fixes or patched have yet to be released. Making the game even more painful to play through its glitchness and instability.  People with rigs like mine that are up to date, and high end memory, and gpu's have had the similar painstaking problems, I have had. If I wasn't a power user I swear the ordinary user must have a real bad day troubleshooting this piece of hellborn spawn. The lack of support for this game, and no more added content, plus all the problems make it a no buy. Until they fix all the problems and make it playable I do not recommend buying this game.\nIts a shame Marvel let this bad pc port over like this without testing it fully, and fixing it up.\n\nAll of us Spiderman fans are waiting for all the other games to come to PC. Marvel you're losing money not investing, and properly investing in us.\n\nAgain it looks decent, but no because it doesn't function properly. My biggest complaint comes with they came out with dlc fast but not with the patches the games needs so drastically.\n\nJust look at these Steam Forums\nhttp://steamcommunity.com/app/212580/discussions/0/864951657868730063/\nhttp://steamcommunity.com/app/212580/discussions/0/864947149145868507/\n\n\nThoughts after finishing the game. It still is a mess. The controls are bad, the story is lack luster,\nand the boss battles are repetitive, and feel like a cluster of organized randomness. They did not port this at all well for pc, and never fixed any bogs, released patches. It could have been a great game, but all of these combined make it a fail of a choice. You won't regret buying this particular spiderman game trust me. The games combat system is super easy, and you will get to it too quickly. People who have no gaming skill will love this very easy game filled with glitches.","January 18, 2014","false","37.5"," 375 of 535 people (70%) found this review helpful 7 people found this review funny","70","375","535","7","13"
"http://steamcommunity.com/id/cometgamer/recommended/212580/","cometgamer","comet","http://steamcommunity.com/id/cometgamer/","57 products in account","I had fun but it's not worth the regular price.  PROS- Looks cool, nice unlockables, and an okay story. CONS- Repetitive gameplay, awkward camera (stealth), crashing, and lag for ATI/AMD users (I'm not the only one).\n\nTHE REPETITIVE PARTS:\nThe missions have the same formula: beating up generic thugs/guards, going through vents, and using stealth. All bosses (except the Rhino) can be just defeated by spamming the combat button and dodging. New York does not have many things to do except chasing the same cars and fighting the same crime scenarios. All thugs dissappear after you defeat them all.\n\nOnly get it on sale, if you really want it.","December 29, 2013","false","25.6"," 127 of 171 people (74%) found this review helpful 2 people found this review funny","74","127","171","2","3"
"http://steamcommunity.com/id/erbkaiser/recommended/212580/","erbkaiser","Erbkaiser ♔","http://steamcommunity.com/id/erbkaiser/","4510 products in account","I'd like to begin with a little song.\n\n♫ Crash again, Crash again,\nIt crashes to desktop whenever it can.\nLoads a cutscene, or just a level part.\nDoesn't like it, it's too hard\nLook Out!\nHere comes a crash again. ♫\n\nAt its best, Amazing 1 is a game that reminds me a lot of the Arkham games. Spider-man controls smoothly and combat can feel very satisfying with striking from behind, retreating to the ceiling, and then quickly moving to a new spot to strike again.\nThe open world (Manhattan) is nicely detailed and is filled with collectables so you always have something to do while web-slinging from mission to next mission or random crime event.\n\nUnfortunately there are a lot of points where Amazing 1 stops being fun. Despite Spider-Man's strengths lying in jumping away and being able to use high ceilings to his advantage a lot of the missions put you in a tiny, enclosed space where this is not possible so you have to rely on the combat. The combat tries to be Arkham with combos and smooth flowing from one enemy to the next, but this doesn't always work.\n\nThe web-slinging isn't as nice as it could be either, which I think is mainly due to the game's locked FOV. You simply lose track of where you are headed. When I first started playing this and got to Manhattan, I actually got a bit nauseous at first until I got more used to it. Fortunately there is an alternative by web-rushing using the R2 bumper everywhere, which basically automatically picks a good spot to get to.\n\nAnd then there's the absolute biggest issue... the game is horribly optimised. It crashes at least once each half hour for no good reason, and while the game does autosave, you can get unlucky enough to have this occur during a boss fight so you have to redo a part of the level and the fight again.\n\nVoice acting is okay, not good but not cringe-worthy either, and graphics are passable.\n\nIf you can pick this up for less than €/$ 10, I'd recommend it. Skip the DLC though, that's all based on more combat and therefore not really fun.\nIt does NOT get a recommendation at its current full price of %/$ 30 or even the 50% discount which is still up as I write this.","June 21, 2015","true","29.6"," 54 of 60 people (90%) found this review helpful 66 people found this review funny","90","54","60","66","1"
"http://steamcommunity.com/profiles/76561198113590474/recommended/212580/","76561198113590474","Skallolf","http://steamcommunity.com/profiles/76561198113590474/","455 products in account","Ok, I do recommend that you buy this game but I would say only buy it if it is on sale for about £7.99/$9.99. I really do not think it is worth more than that and I will tell you why.\n\nFirst the bad...\n\nThis game crashes a lot. This is well known at this point and all of the "fixes" that have been discussed simply did not work for me. I am a Windows 10 user, and I have a system that has 32gb of memory and a 4gb GTX 980. Even with those specs, my game would crash usually after about an hour to an hour and a half of play. It made no difference what you were doing in game, and It made no difference what changes you made to the exe file or system settings. Personally, I believe that the game has some sort of memory leak/issue as the more you play, the more graphical glitches you will encounter. My system defaults to the highest settings for the game and I could play for about 45 minutes with no noticeable graphical issues, but after that time it really became a game of chance as to what would happen. Usually, you would see flickering textures on sky scrapers or Spidermans eyes during game play and as both of these surfaces are mirrored it leads me to believe that the game has a rendering issue that ties in to memory. The longer you play, these textures have less resources to use and so it becomes corrupted. After all, you are swinging through a pretty large world space and even with frequent level breaks, you are asking your machine to render a lot of mirrored surfaces on a pretty quick timescale as you play. I got to the point where I would set a timer and at 45 mins I would prepare to close the game down and restart it. This ensured that I had minimal graphical issues and I saw less frequent crashes as I was "flushing" out the memory as I played. Basically, do not buy this game if you have zero patience when it comes to crashes.\n\nSecondly, some of the sidequests and boss fights are pretty repetitive. It is great that they have given you smaller crimes to help with, but at times you feel like you are spending all of your time doing the same things. What is worse is that there is no real variation at all in these crimes either. If you take a car chase mission, you will see the same car in every car chase mission after that as well. Basically, the car is always an Orange and Black car. A little texture variation would have gone a long way. The mechanics for the missions are always the same as well. Once you know how to complete it, you can pretty much do every mission that is the same in less than a minute afterwards which leads them to feel like they are just time wasters. Some of the (secondary) boss fights are the same as well. There is a set pattern to defeat them and once you know it, every one of the secondary bosses can be beaten quickly and with ease.\n\nThirdly, the animations can be annoying at times too. Swinging through the city is as easy as holding down a button *which is a little bit of a let down) and spidey will do a somersault after every swing. He will either flip sideways, or head over heels. This is okay some of the time, but at others it just seems way over the top and ostentatious. The real annoyance for me here was that when you are swinging with someone on your back, you still do these annoying somersaults. This makes zero sense, especially when you are transporting a sick or injured person. It is also really annoying to hear one of these people pleading for you to go slower and suddenly hear spiderman shout "yeahhhh!" as he does a triple somersault flip with the poor soul clinging to his back. It really makes him looks like a bit of a jerk to be honest. As far as the swinging goes as well, when you apprehend a mental patient or criminal, they too hold on to you the same way as a sick or injured person which just looks silly. Why would they willingly climb on to your back with no restraints so you can take them to jail? A little animation of spidey tying them up would have been nice.\n\nThat being said, here is the good...\n\nThe story itself is a pretty good one. It is set immediatleuy after the events of the first Andrew Garfield film and it follows on quite nicely. As an original story, I think they did a very good job of giving you a serious conflict to resolve as well as allowing you to get a feel of being Spiderman. The game and graphics arent as polished as some other Superhero games (like the Batman Arkham series) but what they do offer is a good effort of utilising modern day shaders on an older texture setup. The City as well is pretty well done, and there is the constant hustle and bustle of New York going on beneath you as you swing from skyscraper to skyscraper to get from A to B. You can get from one side of the map to the other pretty quickly, but there is pretty much always a reason to take a detour thanks to the constant side quests that pop up on every level. The side missions can get a bit samey, but there is a pretty good variety as there are police shootouts, car chases, mental patients and sick people who need to get to the hospital, smaller infected bosses that are usually in a sewer somewhere, photography missions, Oscorp Lab takedowns and some timetrial challenges to partake in. There is quite a lot to keep you busy as you play, and it took me approx 11 hours to complete all side quests (except for the time trials) and the main story. I managed to unlock 7 of the spiderman suits as I played which also gave me some variation as I progressed. It is nice to have the option to change suit too as you will find your current suit is regularly torn to shreds as you take damage, and if you are like me you like to look your best as you fight crime!\n\nAs I said at the start, I do recommend buying this game but not at the full price listed on Steam. I would recommend it being worth no more than £7.99/$9.99 as it is a game that has a lot of issues and until the developer or Steam fixes those issues, it will never be worth the £24.99 they are listing it as. I played this game as a casual superhero fan and I did enjoy the story and game despite some repetitive gameplay. Buy it if you have low expectations and I think you will enjoy it.","March 28","true","18.4"," 46 of 51 people (90%) found this review helpful 6 people found this review funny","90","46","51","6","0"
"http://steamcommunity.com/id/p5yKo/recommended/212580/","p5yKo","PsyCHo","http://steamcommunity.com/id/p5yKo/","1851 products in account","Kinda feels like cheap Batman-Arkham-games imitation, but:\na) it has it's charm\nb) it's Activision, so it won't be cheap.\n\nWhile I recommend it for being playable and fun, Batman feels like better game.","December 20, 2014","true","26.0"," 59 of 77 people (77%) found this review helpful 16 people found this review funny","77","59","77","16","6"
