"url","reviewerUsername","reviewerDisplayName","reviewerUrl","reviewerProductsCount","reviewText","date","recommended","hoursPlayed","voteText","helpfulPercent","votesHelpful","votesTotal","votesFunny","commentsCount"
"http://steamcommunity.com/id/Grzechuj/recommended/212580/","Grzechuj","ScReAm","http://steamcommunity.com/id/Grzechuj/","73 products in account","Well, i recommend that game if you are Spider-Man fan such as me.. He's my fav superhero since i saw first cartoon with him, i really like storyline, gameplay and fights. I didnt have any problems such as other people with crashs game was smooth and without any bad FPS drops :D","April 20","true","12.7"," 1 of 3 people (33%) found this review helpful 2 people found this review funny","33","1","3","2","0"
"http://steamcommunity.com/id/martianolucky/recommended/212580/","martianolucky","LuckyPowder","http://steamcommunity.com/id/martianolucky/","184 products in account","Bad port\nnothing to say\njust bad port","May 15","false","1.2"," 1 of 3 people (33%) found this review helpful","33","1","3","0","0"
"http://steamcommunity.com/profiles/76561197979928405/recommended/212580/","76561197979928405","jmjjkk","http://steamcommunity.com/profiles/76561197979928405/","110 products in account","sadly this is yet another steaming pile of crap that is so darn buggy it really makes it impossible to play. To bad it has such potential but the bugs make it suck bad.  Steam/Valve is a Terrrible company.","January 18, 2013","false","18.7"," 0 of 1 people (0%) found this review helpful","0","0","1","0","0"
"http://steamcommunity.com/id/andymisandry/recommended/212580/","andymisandry","AND•E•MO•TION","http://steamcommunity.com/id/andymisandry/","735 products in account","A free-roaming superhero action game in the vein of previous Spider-Man titles, this tie-in to the Amazing Spider-Man movie ticks a lot of boxes by expanding the film instead of merely reiterating it, by giving the player lots of Spider-Man stuff to do, and by throwing a lot of bones to Spider-Man afficionados by way of easter eggs and unlockables that harken back to Spider-Man's long and storied history (in particular, DLC in which you play as Stan Lee, "king of cameos," for the Spider-Man 50th anniversary).\n\nThe problem is that this PC port is dead in the water. Indoors sections handle perfectly, while outdoor sections chug and lag like it's in season. I believe this could be an AMD-isolated issue, but when a game works perfectly on systems like Xbox 360 - which, I should remind you, is actually built with an AMD GPU - and barely functions on a high-end PC, there's not much reason to support the developer or publisher. It's a perfectly serviceable tie-in game for Spider-Man fans... but, sadly, only on consoles. It's a shame.","September 26, 2014","false","8.3"," 0 of 1 people (0%) found this review helpful","0","0","1","0","0"
"http://steamcommunity.com/profiles/76561197970718513/recommended/212580/","76561197970718513","SuperCabbageThruster","http://steamcommunity.com/profiles/76561197970718513/","156 products in account","DO notbuy this if you use an AMD card.  it is awful and the frame skips will likely give you a pretty knarly headache. what will make your headache worse is Steam's unwillingness to give you a refund.","May 3, 2014","false","1.8"," 0 of 1 people (0%) found this review helpful","0","0","1","0","0"
"http://steamcommunity.com/id/Brokenkangeroo/recommended/212580/","Brokenkangeroo","Deedaw","http://steamcommunity.com/id/Brokenkangeroo/","739 products in account","♥♥♥♥","May 18, 2014","false","22.6"," 0 of 1 people (0%) found this review helpful","0","0","1","0","0"
"http://steamcommunity.com/profiles/76561198052343023/recommended/212580/","76561198052343023","Pramienjager","http://steamcommunity.com/profiles/76561198052343023/","131 products in account","I am enjoying the game enough for what I paid for it. (I got a sale, like 9 bucks, I don't remember). But I keep asking myself, "How does a big name like Activision and Spiderman have a game that cannot even run?" I have multiple computers, one an i7 4770K with a GTX 770 and one a AMD FX8350 with a 280X none of that even matters though. I have to turn off Anti-aliasing and V-sync just to get the game to run at all and then I still get random crashes and freeze ups.\n\nThis game has been out for almost 2 years. I think companies should be held accountable. Either fix the game or return our money. Thi sis why people pirate, why pay for buggy, broken, unplayable games that crash so often.","May 7, 2014","false","16.0"," 0 of 1 people (0%) found this review helpful","0","0","1","0","0"
"http://steamcommunity.com/id/OFark/recommended/212580/","OFark","O Fark","http://steamcommunity.com/id/OFark/","485 products in account","♥♥♥♥ poor game. Camera controls are so frustrating. You'll keep turning your head to look at stuff even if you really don't want to. Except it doesn;t follow your target/enemy when you do want it to. Really annoying.\n\nAlthough it's a little weak the story does tie in with the first film.\n\nPerformance wise this crashed on me at least a dozen times, and no matter what settings I have the city enviroment is always lagging.","July 3, 2014","false","20.4"," 0 of 1 people (0%) found this review helpful","0","0","1","0","0"
"http://steamcommunity.com/profiles/76561198022088312/recommended/212580/","76561198022088312","intimidator 404","http://steamcommunity.com/profiles/76561198022088312/","180 products in account","Pretty fun game","August 29, 2014","true","78.5"," 0 of 1 people (0%) found this review helpful","0","0","1","0","27"
"http://steamcommunity.com/id/Rivent/recommended/212580/","Rivent","Rivent","http://steamcommunity.com/id/Rivent/","749 products in account","The best super hero game ever and I didn't even like Spider man before playing this. Web rushing, swinging and climbing mechanics are so much fun and even walking on the street is made wonderful as civilians applaud or record you on their mobile phones. Normally hate side missions but in this I was left wanting more car chases, civilian rescues, escapee hunting, thug fighting, racing, video recording, photographing and comic collecting. Combat consists of combos, dodging, finishing moves, fancy attacks, web firing and throwing anything heavy all done in a fluent kick ♥♥♥ style with the web shooters and there can be sneaking tactics too if done right. Levels are great to crawl around in with collectables everywhere, boss fights are either crazed monsters or gigantic robots that really do feel humongous and the story pieces it all together so nothing feels out of place.","February 18, 2013","true","24.8"," 0 of 1 people (0%) found this review helpful","0","0","1","0","0"
"http://steamcommunity.com/id/iwem_xo/recommended/212580/","iwem_xo","iwem.xo","http://steamcommunity.com/id/iwem_xo/","1247 products in account","Average as Spider-man games go. Pretty good swinging mechanics, even though the camera is a little too zoomed in and web attaches to thin air. The sense of speed is much better than previous efforts, and the combat is a sort-of-okayish ripoff of the Batman games. Get this if you're in it for the swinging like I am.","December 25, 2012","true","17.5"," 0 of 1 people (0%) found this review helpful","0","0","1","0","0"
"http://steamcommunity.com/id/wysiwyg_1977/recommended/212580/","wysiwyg_1977","Wysiwyg","http://steamcommunity.com/id/wysiwyg_1977/","495 products in account","Game seriously unoptimized for PC, specifically ATI Graphics Cards.\n\nThis will fix the framerate. I run a Radeon 6970 and found this on YouTube.\nhttp://modsreloaded.com/alternate-d3d9-fix-for-ati-plus-d3d9gen\n\n1. Go to your C:\Program Files (x86)\Steam\steamapps\common\The Amazing Spider-Man and 2. Click ASMLauncher.exe\n3. Then once the menu comes up drag & drop the d3d9.dll file into the folder and then launch the game.\n\nIf you try to drop the file in and then launch the game via your Steam Library the game will crash. So yes, until they fix this you'll have to repeat those steps each time by removing the d3d9.dll from the folder, launching ASMLauncher.exe, redragging the .dll etc...","November 27, 2012","true","16.1"," 0 of 1 people (0%) found this review helpful","0","0","1","0","1"
"http://steamcommunity.com/profiles/76561198080999777/recommended/212580/","76561198080999777","n.caroline74","http://steamcommunity.com/profiles/76561198080999777/","3 products in account","great fun,great action,great hero .Spiderman we love you.","December 17, 2013","true","129.8"," 0 of 1 people (0%) found this review helpful","0","0","1","0","0"
"http://steamcommunity.com/profiles/76561198058967969/recommended/212580/","76561198058967969","Sirbrad1570","http://steamcommunity.com/profiles/76561198058967969/","232 products in account","This is the resurrection of all the things that made the Spiderman 2 game great...only I'm not sure the recommended system requirements are accurate.  My system exceeds that and my FPS still plummets when in the city.   Not their problem though.","December 19, 2013","true","3.6"," 0 of 1 people (0%) found this review helpful","0","0","1","0","0"
"http://steamcommunity.com/id/kapitankrunch/recommended/212580/","kapitankrunch","KapitanKrunch","http://steamcommunity.com/id/kapitankrunch/","61 products in account","Just like playing Spiderman 2 and 3 as a kid. Love it!","December 20, 2013","true","12.9"," 0 of 1 people (0%) found this review helpful","0","0","1","0","0"
"http://steamcommunity.com/id/PikaGraphics/recommended/212580/","PikaGraphics","UnfocusedKiwi","http://steamcommunity.com/id/PikaGraphics/","123 products in account","People Who Are A fan on Spiderman you should invest in your money to GET THIS GAME\n\n*great Graphics\n*Great Story\n*Great Gameplay","December 21, 2013","true","10.3"," 0 of 1 people (0%) found this review helpful","0","0","1","0","0"
"http://steamcommunity.com/id/OFark/recommended/212580/","OFark","O Fark","http://steamcommunity.com/id/OFark/","485 products in account","♥♥♥♥ poor game. Camera controls are so frustrating. You'll keep turning your head to look at stuff even if you really don't want to. Except it doesn;t follow your target/enemy when you do want it to. Really annoying.\n\nAlthough it's a little weak the story does tie in with the first film.\n\nPerformance wise this crashed on me at least a dozen times, and no matter what settings I have the city enviroment is always lagging.","July 3, 2014","false","20.4"," 0 of 1 people (0%) found this review helpful","0","0","1","0","0"
"http://steamcommunity.com/profiles/76561198052343023/recommended/212580/","76561198052343023","Pramienjager","http://steamcommunity.com/profiles/76561198052343023/","131 products in account","I am enjoying the game enough for what I paid for it. (I got a sale, like 9 bucks, I don't remember). But I keep asking myself, "How does a big name like Activision and Spiderman have a game that cannot even run?" I have multiple computers, one an i7 4770K with a GTX 770 and one a AMD FX8350 with a 280X none of that even matters though. I have to turn off Anti-aliasing and V-sync just to get the game to run at all and then I still get random crashes and freeze ups.\n\nThis game has been out for almost 2 years. I think companies should be held accountable. Either fix the game or return our money. Thi sis why people pirate, why pay for buggy, broken, unplayable games that crash so often.","May 7, 2014","false","16.0"," 0 of 1 people (0%) found this review helpful","0","0","1","0","0"
"http://steamcommunity.com/id/Rivent/recommended/212580/","Rivent","Rivent","http://steamcommunity.com/id/Rivent/","749 products in account","The best super hero game ever and I didn't even like Spider man before playing this. Web rushing, swinging and climbing mechanics are so much fun and even walking on the street is made wonderful as civilians applaud or record you on their mobile phones. Normally hate side missions but in this I was left wanting more car chases, civilian rescues, escapee hunting, thug fighting, racing, video recording, photographing and comic collecting. Combat consists of combos, dodging, finishing moves, fancy attacks, web firing and throwing anything heavy all done in a fluent kick ♥♥♥ style with the web shooters and there can be sneaking tactics too if done right. Levels are great to crawl around in with collectables everywhere, boss fights are either crazed monsters or gigantic robots that really do feel humongous and the story pieces it all together so nothing feels out of place.","February 18, 2013","true","24.8"," 0 of 1 people (0%) found this review helpful","0","0","1","0","0"
"http://steamcommunity.com/id/iwem_xo/recommended/212580/","iwem_xo","iwem.xo","http://steamcommunity.com/id/iwem_xo/","1247 products in account","Average as Spider-man games go. Pretty good swinging mechanics, even though the camera is a little too zoomed in and web attaches to thin air. The sense of speed is much better than previous efforts, and the combat is a sort-of-okayish ripoff of the Batman games. Get this if you're in it for the swinging like I am.","December 25, 2012","true","17.5"," 0 of 1 people (0%) found this review helpful","0","0","1","0","0"
"http://steamcommunity.com/id/wysiwyg_1977/recommended/212580/","wysiwyg_1977","Wysiwyg","http://steamcommunity.com/id/wysiwyg_1977/","495 products in account","Game seriously unoptimized for PC, specifically ATI Graphics Cards.\n\nThis will fix the framerate. I run a Radeon 6970 and found this on YouTube.\nhttp://modsreloaded.com/alternate-d3d9-fix-for-ati-plus-d3d9gen\n\n1. Go to your C:\Program Files (x86)\Steam\steamapps\common\The Amazing Spider-Man and 2. Click ASMLauncher.exe\n3. Then once the menu comes up drag & drop the d3d9.dll file into the folder and then launch the game.\n\nIf you try to drop the file in and then launch the game via your Steam Library the game will crash. So yes, until they fix this you'll have to repeat those steps each time by removing the d3d9.dll from the folder, launching ASMLauncher.exe, redragging the .dll etc...","November 27, 2012","true","16.1"," 0 of 1 people (0%) found this review helpful","0","0","1","0","1"
"http://steamcommunity.com/profiles/76561198080999777/recommended/212580/","76561198080999777","n.caroline74","http://steamcommunity.com/profiles/76561198080999777/","3 products in account","great fun,great action,great hero .Spiderman we love you.","December 17, 2013","true","129.8"," 0 of 1 people (0%) found this review helpful","0","0","1","0","0"
"http://steamcommunity.com/profiles/76561198058967969/recommended/212580/","76561198058967969","Sirbrad1570","http://steamcommunity.com/profiles/76561198058967969/","232 products in account","This is the resurrection of all the things that made the Spiderman 2 game great...only I'm not sure the recommended system requirements are accurate.  My system exceeds that and my FPS still plummets when in the city.   Not their problem though.","December 19, 2013","true","3.6"," 0 of 1 people (0%) found this review helpful","0","0","1","0","0"
"http://steamcommunity.com/id/kapitankrunch/recommended/212580/","kapitankrunch","KapitanKrunch","http://steamcommunity.com/id/kapitankrunch/","61 products in account","Just like playing Spiderman 2 and 3 as a kid. Love it!","December 20, 2013","true","12.9"," 0 of 1 people (0%) found this review helpful","0","0","1","0","0"
"http://steamcommunity.com/id/PikaGraphics/recommended/212580/","PikaGraphics","UnfocusedKiwi","http://steamcommunity.com/id/PikaGraphics/","123 products in account","People Who Are A fan on Spiderman you should invest in your money to GET THIS GAME\n\n*great Graphics\n*Great Story\n*Great Gameplay","December 21, 2013","true","10.3"," 0 of 1 people (0%) found this review helpful","0","0","1","0","0"
"http://steamcommunity.com/id/76561197982122828/recommended/212580/","76561197982122828","8ace69","http://steamcommunity.com/id/76561197982122828/","104 products in account","Highly Recommended better than Arkham city, loads of side missions after the game is completed, a big thumbs up","February 18, 2013","true","14.1"," 0 of 1 people (0%) found this review helpful","0","0","1","0","0"
"http://steamcommunity.com/profiles/76561198108229039/recommended/212580/","76561198108229039","AlexTyu","http://steamcommunity.com/profiles/76561198108229039/","76 products in account","Enter the life of Peter Parker.....Spider-man!!!","April 23, 2014","true","12.5"," 0 of 1 people (0%) found this review helpful","0","0","1","0","0"
"http://steamcommunity.com/id/benjonic12/recommended/212580/","benjonic12","Benjonic12 Gaming","http://steamcommunity.com/id/benjonic12/","12 products in account","So i just go the time to play The Amazing Spider-Man,and i think that it is a pretty decent Spider-Man.It dosen´t have that much of a good story and the gameplay is cool.It is the Arkham games for Spider-man(just not story-wise).The voice actors are good too.8/10.","April 28, 2014","true","50.2"," 0 of 1 people (0%) found this review helpful","0","0","1","0","0"
"http://steamcommunity.com/id/ragelly/recommended/212580/","ragelly","Jack Nyght","http://steamcommunity.com/id/ragelly/","267 products in account","Set after * the amazing spider-man movie*  this game is pretty fun, the story was very interesting,  its fun to just BS around the city at times though.","February 26, 2013","true","52.6"," 0 of 1 people (0%) found this review helpful","0","0","1","0","0"
"http://steamcommunity.com/id/SirAcid/recommended/212580/","SirAcid","SirAcid","http://steamcommunity.com/id/SirAcid/","443 products in account","Not a bad take on Spidey. I'm not familiar at all with the recent reboot (the MORE recent reboot of the two recent reboots, I sould say). Making the game open-world was a great development decision.\n\nThe webswinging dynamics are very well done, and, for the most part, the controls are intuitive. I highly recommend a gamepad; this game is almost impossible to play with a mouse and keyboard.","March 28, 2014","true","8.8"," 0 of 1 people (0%) found this review helpful","0","0","1","0","0"
"http://steamcommunity.com/id/dooboyRISES/recommended/212580/","dooboyRISES","The Doobster","http://steamcommunity.com/id/dooboyRISES/","86 products in account","10/10! Must Get! It was worth the money! And the strory is great! Combat is great! Swing Physics are AMAZING! < pun  Boss Fights are soo much fun! Graphics are Awesome!!! I give it a 10/10","April 15, 2014","true","33.2"," 0 of 1 people (0%) found this review helpful","0","0","1","0","0"
"http://steamcommunity.com/id/SwitchRE/recommended/212580/","SwitchRE","Mepo","http://steamcommunity.com/id/SwitchRE/","204 products in account","I had a ton of fun with this game.  Swinging through the city and using signature  moves in combat was great.  The story isnt super compelling and there are some awkward moments with gwen but the open world and "batman style combat" is great.  I wouldnt recommened it at $50 but on sale is definatly worth it","April 21, 2014","true","50.1"," 0 of 1 people (0%) found this review helpful","0","0","1","0","0"
"http://steamcommunity.com/profiles/76561197970718513/recommended/212580/","76561197970718513","SuperCabbageThruster","http://steamcommunity.com/profiles/76561197970718513/","156 products in account","DO notbuy this if you use an AMD card.  it is awful and the frame skips will likely give you a pretty knarly headache. what will make your headache worse is Steam's unwillingness to give you a refund.","May 3, 2014","false","1.8"," 0 of 1 people (0%) found this review helpful","0","0","1","0","0"
"http://steamcommunity.com/profiles/76561198022088312/recommended/212580/","76561198022088312","intimidator 404","http://steamcommunity.com/profiles/76561198022088312/","180 products in account","Pretty fun game","August 29, 2014","true","78.5"," 0 of 1 people (0%) found this review helpful","0","0","1","0","27"
"http://steamcommunity.com/profiles/76561198094779456/recommended/212580/","76561198094779456","AlphaKing123","http://steamcommunity.com/profiles/76561198094779456/","11 products in account","Payed the money for game but did not work. :(","May 2, 2014","false","1.4"," 0 of 1 people (0%) found this review helpful","0","0","1","0","0"
"http://steamcommunity.com/id/Brokenkangeroo/recommended/212580/","Brokenkangeroo","Deedaw","http://steamcommunity.com/id/Brokenkangeroo/","739 products in account","♥♥♥♥","May 18, 2014","false","22.6"," 0 of 1 people (0%) found this review helpful","0","0","1","0","0"
"http://steamcommunity.com/profiles/76561198094779456/recommended/212580/","76561198094779456","AlphaKing123","http://steamcommunity.com/profiles/76561198094779456/","11 products in account","Payed the money for game but did not work. :(","May 2, 2014","false","1.4"," 0 of 1 people (0%) found this review helpful","0","0","1","0","0"
"http://steamcommunity.com/profiles/76561197977956521/recommended/212580/","76561197977956521","Jaragoondoo","http://steamcommunity.com/profiles/76561197977956521/","104 products in account","I've tried this game on two builds. The first of which is an AMD (I've heard there's problems with this game and AMD) build:\n\nAMD 3.2Ghz Quad Core\n6950 HD GFX\n16GB RAM\n250gb SSD\n\nThe game would run, but it would chug badly (get very low FPS). I thought no biggie, I'll just try on a Intel/nVidia build at some point in the future.\n\nNew gaming laptop build:\nI7 2.5GHZ Quad Core\nGTX 970M\n8GB RAM\n250GB SSD\n\nThe game will not run (something to do with "insufficient memory", even though reccomended specs are 3GB RAM and I have 8GB). There is a fix to make it run, but it results in the game launching in a stupid 600x400 resolution (or something like that) and I cannot fix this.\n\nSo all in all I have not been able to enjoy this game even though I have two systems that should be able to more than run it. I guess this would be the definition of "crappy console port"!","January 29, 2015","false","2.3"," 0 of 1 people (0%) found this review helpful","0","0","1","0","0"
"http://steamcommunity.com/id/iclefirefly12/recommended/212580/","iclefirefly12","iclefirefly","http://steamcommunity.com/id/iclefirefly12/","87 products in account","This game is pretty good actually, it certainly exceeded my expectations. However I felt it didn't have enough pace and suspense to keep me interested for long enough and the more breaks between story line to finish the open world missions(which were all exactly the same) just made the game drag for me. I feel the combat is very similar to the Arkham games so In my opinion unless you are the biggest Spidey fan out there and wouldn't be seen dead with a Batman game, get Arkham Asylum instead.","February 12, 2015","false","14.7"," 0 of 1 people (0%) found this review helpful","0","0","1","0","0"
"http://steamcommunity.com/id/ShXIII/recommended/212580/","ShXIII","ShXIII","http://steamcommunity.com/id/ShXIII/","401 products in account","The Amazing Spiderman (PC): Just finished this around 9 hours, story only no side missions. This is the first Spiderman game I have played since Maximum Carnage on SNES and its very meh. It looked OK but the default FOV and mouse acceleration are ♥♥♥♥ing terrible with no fixes available. Swinging around the city felt pretty cool though. I had no desire to play any of the side missions and this game was lacking any attention to detail like that Batman Arkham games, of course those are now the standard for good comic book games. Combat was also lacking any real fun, just mash the attack button. I didn't hate the game but it’s a pass in my opinion","March 14, 2015","false","9.1"," 0 of 1 people (0%) found this review helpful","0","0","1","0","0"
"http://steamcommunity.com/id/MLGTI/recommended/212580/","MLGTI","$ℙÅℜky(Broken computer)","http://steamcommunity.com/id/MLGTI/","35 products in account","it is one of the best games i have played i really recommend it. it is so fun to play i have really enjoyed it thx Activision!!!!!!","January 17, 2015","true","192.3"," 0 of 1 people (0%) found this review helpful","0","0","1","0","0"
"http://steamcommunity.com/id/camulyana/recommended/212580/","camulyana","Uchiha","http://steamcommunity.com/id/camulyana/","229 products in account","nice one , I'll play it until the end XD","May 2, 2015","true","11.2"," 0 of 1 people (0%) found this review helpful","0","0","1","0","0"
"http://steamcommunity.com/profiles/76561198084819958/recommended/212580/","76561198084819958","HerePeet","http://steamcommunity.com/profiles/76561198084819958/","133 products in account","bad game I ever play","June 5, 2015","false","3.6"," 0 of 1 people (0%) found this review helpful","0","0","1","0","0"
"http://steamcommunity.com/id/skypernyper/recommended/212580/","skypernyper","buttermanstewart","http://steamcommunity.com/id/skypernyper/","13 products in account","What's going on? It won't load. If no one tell me I want y money back on MY STEAM ACCOUNT","January 2, 2015","false","17.2"," 0 of 1 people (0%) found this review helpful","0","0","1","0","0"
"http://steamcommunity.com/profiles/76561197992067871/recommended/212580/","76561197992067871","NSAisGOINGafterMEseriously","http://steamcommunity.com/profiles/76561197992067871/","392 products in account","WORST GAME i EVER pLAYED\n\nI play this just bcs I like Batman game and this has the same control (exact copycat)....... but thats all\n\nHey guys TERRIBLE realy TERRIBLE graphics especially for year 2012 (first batman is from 2009 and , well you can not simply compare its 100ˇ% better graphics)\n\nAnd yeah its worth only on cheap sale, dont bother to pay full price its not worth it","May 9, 2015","false","17.2"," 0 of 1 people (0%) found this review helpful","0","0","1","0","4"
