"url","reviewerUsername","reviewerDisplayName","reviewerUrl","reviewerProductsCount","reviewText","date","recommended","hoursPlayed","voteText","helpfulPercent","votesHelpful","votesTotal","votesFunny","commentsCount"
"http://steamcommunity.com/profiles/76561198047232713/recommended/212580/","76561198047232713","[VRZ0]JordanBelfort","http://steamcommunity.com/profiles/76561198047232713/","37 products in account","This is by the far the funnest Spiderman game I have played. I just spend hours swinging across Manhattan collecting all the suits and achievements. It has a great, open-spaced atmosphere and the missions get you involved as the real Spiderman. The DLC's definately make the game even more enjoyable and the 'Stan Lee Adventure Pack' is by far my favourite DLC out of many games as you become the man himselfseriosuwith all Spiderman's powers\n\nI don't normally pay for games like this but I saw it was on special and said "HELL YEAAAA". The price may seem steep but just keep an eye on the price of it as I got it on Friday night (Australian) for $20\n\nI would definately recommend this game and anyone who has the money and likes open-minded superhero games I would buy this if i was you","May 5, 2014","true","30.1"," No ratings yet","0","0","0","0","0"
"http://steamcommunity.com/profiles/76561198099752884/recommended/212580/","76561198099752884","GamersUnitedRL","http://steamcommunity.com/profiles/76561198099752884/","15 products in account","it wont even play the launcher it saidlauncher not workin try agian later ive tried every thing turned it off restarted steam every thing it still wont work","May 5, 2014","false","37.7"," No ratings yet","0","0","0","0","0"
"http://steamcommunity.com/id/steve-nc-/recommended/212580/","steve-nc-","tN|Steve-nC-","http://steamcommunity.com/id/steve-nc-/","373 products in account","The game crashes during cutscenes. Bad load times. Bad fighting mechanics.","May 5, 2014","false","14.8"," No ratings yet","0","0","0","0","0"
"http://steamcommunity.com/id/SirWool/recommended/212580/","SirWool","Sir Wool","http://steamcommunity.com/id/SirWool/","31 products in account","Bought the game a few days ago. All i can say is AWESOME. The graphics are pretty realistic, characters are pretty complex, storyline is very interesting, and the combat is well made. This game is my favourite Spider-Man game, (the only one actaully) and I love it. 1,000/1,000","May 6, 2014","true","19.8"," No ratings yet","0","0","0","0","0"
"http://steamcommunity.com/profiles/76561198034302149/recommended/212580/","76561198034302149","blueberryshade","http://steamcommunity.com/profiles/76561198034302149/","141 products in account","Constantly crashes. The controls are garbage, especially the jump button and camera which makes certain points of the game nearly impossible to play. Also apparently it won't run if you have an AMD video card, but I didn't have that particular problem.","May 7, 2014","false","47.4"," No ratings yet","0","0","0","0","0"
"http://steamcommunity.com/id/XBdvolcano02/recommended/212580/","XBdvolcano02","XBdvolcano02","http://steamcommunity.com/id/XBdvolcano02/","4 products in account","Amazing game, with good graphics, storyline and gameplay. One of my favorite games so far.","February 24, 2014","true","21.1"," No ratings yet","0","0","0","0","0"
"http://steamcommunity.com/profiles/76561198009767990/recommended/212580/","76561198009767990","LordDoom","http://steamcommunity.com/profiles/76561198009767990/","195 products in account","This game is simply stunning and so much fun to play if you love the comics this is a must have game. Lovely graphics easy to get into game play and you feel like a real hero! :o)","December 30, 2012","true","14.8"," No ratings yet","0","0","0","0","0"
"http://steamcommunity.com/profiles/76561198021791540/recommended/212580/","76561198021791540","Abekat","http://steamcommunity.com/profiles/76561198021791540/","24 products in account","Bad optimization, you can't geet over 20 FPS outside.","February 10, 2014","true","30.7"," No ratings yet","0","0","0","0","0"
"http://steamcommunity.com/profiles/76561198021704599/recommended/212580/","76561198021704599","TheStamp10","http://steamcommunity.com/profiles/76561198021704599/","56 products in account","This game is awesome!!!","March 25, 2014","true","56.3"," No ratings yet","0","0","0","0","0"
"http://steamcommunity.com/id/261311/recommended/212580/","261311","YoungZM","http://steamcommunity.com/id/261311/","175 products in account","Asbsolutely ridiculous port. Frames per second so ridiculously low on any settings with a recommended rig. See forums for details.","June 26, 2014","false","2.2"," No ratings yet","0","0","0","0","0"
"http://steamcommunity.com/profiles/76561198034302149/recommended/212580/","76561198034302149","blueberryshade","http://steamcommunity.com/profiles/76561198034302149/","141 products in account","Constantly crashes. The controls are garbage, especially the jump button and camera which makes certain points of the game nearly impossible to play. Also apparently it won't run if you have an AMD video card, but I didn't have that particular problem.","May 7, 2014","false","47.4"," No ratings yet","0","0","0","0","0"
"http://steamcommunity.com/id/shadowberserk/recommended/212580/","shadowberserk","Punished Serge [AJSA]","http://steamcommunity.com/id/shadowberserk/","217 products in account","This is quite an unexpected surprise... Let me explain. I bought this game because of the sale, and because I'm a HUGE Spider-Man fan. I've played Spider-Man games since PS1 (I never played the ones from the Mega Drive) and since Spider-Man 3 my experience with sandbox Spider-Man games was unexistent (I played Shattered Dimensions but doesn't count as a sandbox). So I've given a try to this Amazing Spider-Man... And not regrets given. Playing with a controller is mandatory to enjoy this game and as a Nvidia user the crashes were frequent, but I really recommend this game when is in sale.\n\nDespite It's flaws (there are few, but really noticeable) overall is a decent game and hours of fun...\n\nPS: I have all Arkham games, so I know what a good superhero game is.","May 7, 2014","true","24.9"," No ratings yet","0","0","0","0","0"
"http://steamcommunity.com/profiles/76561198075253197/recommended/212580/","76561198075253197","Arieswar","http://steamcommunity.com/profiles/76561198075253197/","213 products in account","PLEASE READ THE REVIEW: this is a like and dislike one so read on.\n\nWhen u finally get the game to run, its awsome i love the fighting mechanic and the voice acting however. the game feals short and the side quests are just there to more or less anoy you, so all i can say i can recommend this game for the short 11 chapters of real gameplay. as you can see it did not take many hours for me to play it threw but i must say the story is ok to say the least.\n\n5/10\nWould had been a 6 if the bugs had been patched away especially the anoying CTD bug\nWould had been a 8 if the side quests actully did not feal like a filler(Even doh some debate that you get new skills from one of them, yepp labs and those missions boore u to death since they are almost exactly the same)\n\nI can recommend it to any spider-man fan but i dont think its worth 30€ asking price even doh its an awsome game its a short one and i would not even pay half the price for this game.","May 7, 2014","true","8.6"," No ratings yet","0","0","0","0","0"
"http://steamcommunity.com/profiles/76561198105094236/recommended/212580/","76561198105094236","CheezBugga","http://steamcommunity.com/profiles/76561198105094236/","21 products in account","best game ever invented\n","May 10, 2014","true","24.0"," No ratings yet","0","0","0","0","0"
"http://steamcommunity.com/profiles/76561198050739356/recommended/212580/","76561198050739356","ARC","http://steamcommunity.com/profiles/76561198050739356/","247 products in account","A decent game if you can stand random game crash , web not attract to building and random FPS drop even if you have a good pc spec.","May 10, 2014","true","20.2"," No ratings yet","0","0","0","0","0"
"http://steamcommunity.com/profiles/76561198047358431/recommended/212580/","76561198047358431","adamequalsgreat","http://steamcommunity.com/profiles/76561198047358431/","148 products in account","Clumsily made","January 12, 2015","false","0.4"," No ratings yet","0","0","0","0","0"
"http://steamcommunity.com/profiles/76561198037623843/recommended/212580/","76561198037623843","rustamfk","http://steamcommunity.com/profiles/76561198037623843/","235 products in account","what can I say, it's fun for about an hour as you swing around the city.  But then once you try to do anything else it feels stale and repetitive.","January 16, 2015","false","1.9"," No ratings yet","0","0","0","0","0"
"http://steamcommunity.com/profiles/76561198082332467/recommended/212580/","76561198082332467","ajg202120","http://steamcommunity.com/profiles/76561198082332467/","176 products in account","If you have a laptop Nvidia GPU I would advise against getting this game. I have an NVidia GTX 850M. The video card detection system did not recognize it. The best fix you can do if this happens to you is remove the video detection file, In which case (at least as it went for me) you will be stuck at an 800X600 resolution and unable to change it even through the registry editor. Many others are having this same problem.","May 2, 2015","false","4.7"," No ratings yet","0","0","0","0","0"
"http://steamcommunity.com/profiles/76561198153900392/recommended/212580/","76561198153900392","FaZeMAGIK","http://steamcommunity.com/profiles/76561198153900392/","5 products in account","its a good game i love it so far","May 2, 2015","true","6.5"," No ratings yet","0","0","0","0","0"
"http://steamcommunity.com/id/knighttraviis/recommended/212580/","knighttraviis","knighttraviis","http://steamcommunity.com/id/knighttraviis/","640 products in account","A surprisingly good movie tie in game. The game is very similar to the Batman Arkham series, just a little more rough around the edges and no real gadgets. There are multiple side missions to do, though each one is very short. The only technical issues I ran into was pop in textures, a few glitches, and the game crashed on me three times within 13-14 hours of play time.\n\nIf you enjoyed the Batman games and like Spider Man as well, you'll really have fun with this title.","November 28, 2014","true","14.1"," No ratings yet","0","0","0","0","0"
"http://steamcommunity.com/id/davy405/recommended/212580/","davy405","Davy405","http://steamcommunity.com/id/davy405/","191 products in account","Dis is wank lad, it ain't amazin at all, it's probably a bit below sound like","May 27, 2014","true","1.0"," No ratings yet","0","0","0","0","0"
"http://steamcommunity.com/profiles/76561198021704599/recommended/212580/","76561198021704599","TheStamp10","http://steamcommunity.com/profiles/76561198021704599/","56 products in account","This game is awesome!!!","March 25, 2014","true","56.3"," No ratings yet","0","0","0","0","0"
"http://steamcommunity.com/profiles/76561197985704187/recommended/212580/","76561197985704187","Michael Fassbender","http://steamcommunity.com/profiles/76561197985704187/","715 products in account","IT'S NO SPIDER-MAN 2","May 16, 2014","false","11.9"," No ratings yet","0","0","0","0","0"
"http://steamcommunity.com/profiles/76561198021791540/recommended/212580/","76561198021791540","Abekat","http://steamcommunity.com/profiles/76561198021791540/","24 products in account","Bad optimization, you can't geet over 20 FPS outside.","February 10, 2014","true","30.7"," No ratings yet","0","0","0","0","0"
"http://steamcommunity.com/profiles/76561197971284838/recommended/212580/","76561197971284838","Jay","http://steamcommunity.com/profiles/76561197971284838/","116 products in account","Runs very poorly on my ATI 4gb R9 series rig. Very expenisve, very poor port, if you really want to play this the way it was intended to be played get the console version, the framerate is flawless on the PS3","May 1, 2014","false","2.7"," No ratings yet","0","0","0","0","0"
"http://steamcommunity.com/id/Grognack/recommended/212580/","Grognack","Frapers","http://steamcommunity.com/id/Grognack/","381 products in account","The ultimate spider man game for gamecube was better than this.","May 2, 2014","false","1.0"," No ratings yet","0","0","0","0","0"
"http://steamcommunity.com/id/RageGreeny/recommended/212580/","RageGreeny","Mr Green","http://steamcommunity.com/id/RageGreeny/","175 products in account","Unplayable on AMD cards.","May 2, 2014","false","0.4"," No ratings yet","0","0","0","0","0"
"http://steamcommunity.com/profiles/76561198105094236/recommended/212580/","76561198105094236","CheezBugga","http://steamcommunity.com/profiles/76561198105094236/","21 products in account","best game ever invented\n","May 10, 2014","true","24.0"," No ratings yet","0","0","0","0","0"
"http://steamcommunity.com/profiles/76561198050739356/recommended/212580/","76561198050739356","ARC","http://steamcommunity.com/profiles/76561198050739356/","247 products in account","A decent game if you can stand random game crash , web not attract to building and random FPS drop even if you have a good pc spec.","May 10, 2014","true","20.2"," No ratings yet","0","0","0","0","0"
"http://steamcommunity.com/profiles/76561197970992716/recommended/212580/","76561197970992716","mitu662004","http://steamcommunity.com/profiles/76561197970992716/","209 products in account","This game will absolutely ot run. On a second system, it crashes after 10 minutes and there are no fixes. Be careful if you have an AMD video card; check the other users responses. Currently there are no fixes and no refunds available.","May 10, 2014","true","0.5"," No ratings yet","0","0","0","0","0"
"http://steamcommunity.com/id/Joiner95/recommended/212580/","Joiner95","Joiner95","http://steamcommunity.com/id/Joiner95/","304 products in account","I played for a solid few hours and think I got a decent feel for the game before I would judge it....but after the opening intro level, I knew that I was fighting the controls and simplicity of the game. The controls didn't work like I think they should have and it wasn't as fluid as you'd expect from a spiderman game.  I unfortunately will not further my progress in this game and will instead wish anyone else who owns this game to play it yourself and see what you think.  :)","August 24, 2014","false","1.7"," No ratings yet","0","0","0","0","0"
"http://steamcommunity.com/profiles/76561198103824155/recommended/212580/","76561198103824155","Nobody","http://steamcommunity.com/profiles/76561198103824155/","36 products in account","this is a good game just make shor you have a good graphics card if not you will have a bad lage","February 25, 2014","true","75.2"," No ratings yet","0","0","0","0","0"
"http://steamcommunity.com/profiles/76561198063232380/recommended/212580/","76561198063232380","ArTeM2005","http://steamcommunity.com/profiles/76561198063232380/","36 products in account","супер","March 30, 2013","true","52.9"," No ratings yet","0","0","0","0","0"
"http://steamcommunity.com/profiles/76561198066013242/recommended/212580/","76561198066013242","Fox-A-Rizzle™","http://steamcommunity.com/profiles/76561198066013242/","79 products in account","If you r a big fan of spiderman i would get this game, its amazing just like the name its self. The game has you swinging around the awesome city of newyork and fighting bad guys its just amazing (i would buy this game if i were u) you won't feel bed for it too","January 1, 2014","true","45.0"," No ratings yet","0","0","0","0","0"
"http://steamcommunity.com/profiles/76561198204983044/recommended/212580/","76561198204983044","Captain Lemon-fried rice","http://steamcommunity.com/profiles/76561198204983044/","38 products in account","Although it has a severe syncing issue which almost ruined my gameplay, the story and character development was excellent and the swinging mechanic was better than most","May 22, 2015","true","21.3"," No ratings yet","0","0","0","0","0"
"http://steamcommunity.com/id/uplayisgreat/recommended/212580/","uplayisgreat","Gojira raids","http://steamcommunity.com/id/uplayisgreat/","95 products in account","really fun, exciting and great for everyone","January 2, 2013","true","22.4"," No ratings yet","0","0","0","0","0"
"http://steamcommunity.com/profiles/76561198117241811/recommended/212580/","76561198117241811","thomasabakah11","http://steamcommunity.com/profiles/76561198117241811/","63 products in account","cool game, love it","February 15, 2015","true","20.5"," No ratings yet","0","0","0","0","0"
"http://steamcommunity.com/id/Ripp_Torn/recommended/212580/","Ripp_Torn","Ripp Torn","http://steamcommunity.com/id/Ripp_Torn/","498 products in account","Constantley crashes.","February 17, 2015","false","3.4"," No ratings yet","0","0","0","0","0"
"http://steamcommunity.com/profiles/76561198176514894/recommended/212580/","76561198176514894","MB_GAMES_","http://steamcommunity.com/profiles/76561198176514894/","9 products in account","has amazing graphics but lags","February 17, 2015","true","5.3"," No ratings yet","0","0","0","0","0"
"http://steamcommunity.com/id/kevvio/recommended/212580/","kevvio","Kevvio","http://steamcommunity.com/id/kevvio/","71 products in account","I am marvel comic fan, and i am fan of all marvel comic superhero, this game is the transformation from comic into movie then into the game, this game extend the story from the The Amazing Spiderman Movie. I like the story inside of this game, continue the epic of the spiderman from movie.","February 17, 2015","true","1.4"," No ratings yet","0","0","0","0","0"
"http://steamcommunity.com/id/nc595/recommended/212580/","nc595","Nitrocide595","http://steamcommunity.com/id/nc595/","132 products in account","I haven't finished the game yet but there's some things I already like and some things I don't.  For now, I'm rating "Do not recommend" for any of the fans of the old spiderman games on Gamecube.  We know Spiderman 2 was the strongest of the series so I'll stick with that.\n\nHonestly, I enjoyed the old gamecube "Spiderman 2" a hell of a lot more.  In comparison, this game is missing a lot that the first one had.  First and foremost Bruce Campbell as the narrator... but in all seriousness, there's no real push or draw to the free roam aspect.\n\nIn spiderman 2, the city was pretty much the ENTIRE city of New York, Roosevelt Island, and Statue of Liberty included.  Now?  It's a way scaled down map shrunken to the size of a small town.  We're talking about 1/16 the size of GTA V's map.  the city looks bland with no real land marks or distinct features.  The environment looks cheap with boxy cars and people always running in fear from nothing, moving exactly the same as one another.  Windows are just pasted JPEG files that look disgusting.  I could swear that I'm playing on "Low Quality", but everything is set for, what they call, "Amazing" (What a Punn...)\n\nI like the "stealth attacks" and the introduction of the stealth system compared to older spiderman games.  It gives a sneaky and useful feel to battle and it's not just "Run in and throw punches" all the time.\n\nThe story line is alright so far and fills in some gaps between the movies, so no major complaints there.\n\nThe game feels as though it's on rails most of the time, again, with no real draw to the free roam that IS available.  I find myself saying "Alright, screw it, next mission".\n\nMy major complaint is within game mechanics, specifically movement.  Compared to the Gamecube Spiderman 2, Movement is a chore.  In the old game, you had several different methods of swinging, web-zipping for height, and acrobatic stunts that made moving fun, clear cut, and exciting.  In this game, although the acrobatics have been improved (visually), you hold 2 buttons and point where you want to go and the game does the rest.  Half the time, you're slinging webs into the sky and swinging off nothing.  In the gamecube game, you anchored to buildings and swung from those points, logically.  The game just feels sloppy to say the least.  You can't even jump on top of a car like the other game.  Jumping up on a ledge can be a chore hen your jump falls just short and you have to sling a web for that extra 2 feet...\n\nFinal complaint is this new fangled feature where you see through Spiderman's eyes and spot a point to jump to.  It's essentially auto-pilot as if they knew their movement mechanics were crap to begin with.\n\n\nI can't say it's the worst game I've ever played (*Cough* Ghost Rider *Cough*), but it's playing runner up to quite a few games as far as awards go.","February 18, 2015","false","3.3"," No ratings yet","0","0","0","0","0"
"http://steamcommunity.com/profiles/76561198077690383/recommended/212580/","76561198077690383","Mare444","http://steamcommunity.com/profiles/76561198077690383/","11 products in account","9/10\n","March 5, 2013","true","90.1"," No ratings yet","0","0","0","0","0"
"http://steamcommunity.com/profiles/76561198060725227/recommended/212580/","76561198060725227","OuY","http://steamcommunity.com/profiles/76561198060725227/","37 products in account","Can be fun or frustrating.\nPros : + Awesome looking costumes + The original cast  was involved + Nice OST + Good story + Nostalgic villains.\nCons : - Bad performance that can ruin your fun - Repetitive secondary missions - Another Spider-Man game with glitches.\nDespite all the cons , it has a lot of fun to offer. It's a decent Spider-Man game but it doesn't deserve it's price. If you like Spider-Man and see this game on sale take it.","February 19, 2015","true","18.0"," No ratings yet","0","0","0","0","0"
"http://steamcommunity.com/id/ginsan21/recommended/212580/","ginsan21","Ginsan21","http://steamcommunity.com/id/ginsan21/","191 products in account","The combat is too good , plot is pretty interesting, and the city feels alive.If you like batman you will like this game. This gets a 10 /10 .","February 20, 2015","true","16.6"," No ratings yet","0","0","0","0","0"
"http://steamcommunity.com/profiles/76561198060052971/recommended/212580/","76561198060052971","DJ Pon 3","http://steamcommunity.com/profiles/76561198060052971/","162 products in account","this is the best game ever i loved it wen i was little.\n","February 21, 2015","true","68.0"," No ratings yet","0","0","0","0","0"
"http://steamcommunity.com/id/GirPlaysGames/recommended/212580/","GirPlaysGames","Baron von Arthur","http://steamcommunity.com/id/GirPlaysGames/","519 products in account","Video game sequel to a fairly decent film adaptation that disgraces the comic in many ways. But this game (like X-Men Origins Wolverine's game) makes up for the bad film. This game is a lot of fun and brings comic book canon to the game while still retaining the bullcrap from the film. The game still has lots of bad things like Rhino and Scorpion being cross species but cool things like Iguana being a boss battle villain. Beenox loves Spider-Man and it shows in this great game.\nPurchase skills with skill points and tech points, get new costumes to use in the story, take pictures of enemies and challenges to unlock concept art and character bios; really a great game to make up for the film. Totally worth it.\nPROS: Better than the movie, chronilogically after the film instead of interpreting the film into a game, good combat, good graphics, Beenox is great with Spider-Man, Spider-Man feels more like Spider-Man than in the Sam Raimi films, cool webbing effects, fun to webswing around the NYC.\nCONS: Takes place in the same universe as the movie, changes some villains too much, The Lizard still has that same, stupid face, not enough costumes to collect, voice-actors instead of the actors of the film, nothing done in this game will be reflected upon in the sequel film.","September 13, 2013","true","20.9"," No ratings yet","0","0","0","0","0"
"http://steamcommunity.com/id/Origen0/recommended/212580/","Origen0","Origen","http://steamcommunity.com/id/Origen0/","859 products in account","Lot of flash, not a lot of substance.  Controls are flakey, keybinding is flawed.  Also having an issue where the game seems to crash about once an hour.","February 24, 2015","false","2.7"," No ratings yet","0","0","0","0","0"
"http://steamcommunity.com/profiles/76561197972709313/recommended/212580/","76561197972709313","ssmiff","http://steamcommunity.com/profiles/76561197972709313/","65 products in account","Terrible.  Bad voice acting, silly story line even for a comic, and the gameplay isboring.  played the first mission and fell asleep.  This game suck soooooooo soooooo sooooo bad.  Avoid at all costs.","February 24, 2015","false","5.9"," No ratings yet","0","0","0","0","0"
"http://steamcommunity.com/profiles/76561198153900392/recommended/212580/","76561198153900392","FaZeMAGIK","http://steamcommunity.com/profiles/76561198153900392/","5 products in account","its a good game i love it so far","May 2, 2015","true","6.5"," No ratings yet","0","0","0","0","0"
"http://steamcommunity.com/profiles/76561198087879303/recommended/212580/","76561198087879303","Stew","http://steamcommunity.com/profiles/76561198087879303/","96 products in account","I've played alot of spiderman games they brought back swinging from the ceilings (where nothing existists). Here i was hoping the negative reviews were wrong. Truth be told i've seen lifetime movies with better played out. Hardcore Spiderman games if you must by this by it on sale. You will be crying the first web swing like WTF was that he floated straight across that gap not swung. That's after i modded the game file just to get the game to launch so sad.","May 3, 2015","false","0.6"," No ratings yet","0","0","0","0","0"
