"url","reviewerUsername","reviewerDisplayName","reviewerUrl","reviewerProductsCount","reviewText","date","recommended","hoursPlayed","voteText","helpfulPercent","votesHelpful","votesTotal","votesFunny","commentsCount"
"http://steamcommunity.com/id/italyprayer/recommended/214340/","italyprayer","Italyprayer","http://steamcommunity.com/id/italyprayer/","528 products in account","If I could marry a game developer it would be Daedalic.\nTheir love for the small things is without comparison.\nBut not only the setting is overwhelming beautiful (just by the way it's drawn). The story mixes everything they've done right in edna, the whispered world and the night of the rabbit into a perfect game and a fantastic start into a wonderful journey to deponia.\nThere's no better way to start a trilogy.\n\nLovelines: 	  9/10 (do you feel the developer's love for the game)\nCreativity: 	  8/10 (is it something overwhelmingly creative)\nThrill: 		  9/10 (do you want to know how it continues)\nMusic:		10/10 (pays the music tribute to the game or is it just boring?)\nStory:		10/10 (Does it have a story and is it great?)\nBugfree:		10/10 (Does it have any bugs? is it an enjoyable playthrough?)\n\nTotal:		9.3/10\n\nTo put it in a nutshell:\nA great Adventure for rainy days ( and sunny days) and the whole trilogy is perfect for a great weekend of bingegaming.\nHave a nice play\n\nItalyprayer\n","October 13, 2014","true","6.4"," No ratings yet","0","0","0","0","0"
"http://steamcommunity.com/id/prytcn64/recommended/214340/","prytcn64","regret","http://steamcommunity.com/id/prytcn64/","327 products in account","play hotheaded rufus, as he follows his goals to get goal's approval.\n\nI played this point and click game before any of the Telltale games. This is the game that got me into point and click games. The game starts off really quickly, and things are explained/taught to the audience really quickly. I liked the 2D animation of this game, as well as the horizontal AND vertical movement that existed.\n\nThe humor in this game was really funny, and well done, and the cinematics were great. I found the length of this game to be just right, and the puzzles hard, but not hard enough that I had to resort to a guide.\n\nThe only downfall to this game is the price. I have been waiting and eagerly watching the other 2 Deponia games to go on sale so I can continue my story. Buy at sale price only, $20 for a point and click (that's not telltale) is ridiculous.","October 13, 2014","true","9.2"," No ratings yet","0","0","0","0","0"
"http://steamcommunity.com/id/timska/recommended/214340/","timska","𝓣𝓲𝓶𝓼𝓴𝓪","http://steamcommunity.com/id/timska/","255 products in account","i saw it, loved it, bought it     no regrets <3  only sometimes a few fps dips under 20 fps even though i have a great gaming pc     9/10","October 15, 2014","true","2.3"," No ratings yet","0","0","0","0","0"
"http://steamcommunity.com/profiles/76561198104309751/recommended/214340/","76561198104309751","Kirhit","http://steamcommunity.com/profiles/76561198104309751/","69 products in account","Game is quite log and has interesting story with few unexpected twists. Puzzles range from obvious to very hard which is great.","November 14, 2014","true","16.3"," No ratings yet","0","0","0","0","0"
"http://steamcommunity.com/id/windedman48/recommended/214340/","windedman48","WINDEDMAN48","http://steamcommunity.com/id/windedman48/","469 products in account","I highly recommend this if you're a fan of classic Lucasarts point and click games.  The game really shines with its beautiful enviornments, memorable characters(especially the main character, Rufus), entertaining story, and overall good sense of humor.  However, just like a lot of other point and click adventures it suffers from a lack of conveyance.  The puzzles can be vague and even downright nonsensical at times, while others can be somewhat rewarding.  If you're not sure about it try the demo, it gives you a good sense of what the game and it's puzzles are like.","May 18, 2013","true","10.9"," No ratings yet","0","0","0","0","0"
"http://steamcommunity.com/id/RumRogers/recommended/214340/","RumRogers","Rum Rogers","http://steamcommunity.com/id/RumRogers/","231 products in account","Absolutely astonishing old-school-point-and-click!\nDefinitely as good as the old LucasArts classics.\nPlay it again and again and again!","September 3, 2012","true","23.0"," No ratings yet","0","0","0","0","0"
"http://steamcommunity.com/id/AusSkiller/recommended/214340/","AusSkiller","AusSkiller","http://steamcommunity.com/id/AusSkiller/","874 products in account","A great point and click adventure game, very much like the old ones I used to play like Monkey Island, Simon the Sorcerer and the Discworld games, but with higher resolution graphics and slightly more sane solutions (but only slightly ;) ).","September 17, 2013","true","9.1"," No ratings yet","0","0","0","0","0"
"http://steamcommunity.com/id/Coccigirl/recommended/214340/","Coccigirl","Cocci","http://steamcommunity.com/id/Coccigirl/","166 products in account","Loved it.\nHad a few bugs where the game kept dropping out on me but they had work-arounds so I got to finish it.\nSure was some interesting ways of doing things that were pretty hard to get my head around but that was the challenge I was looking for :)","October 6, 2014","true","10.6"," No ratings yet","0","0","0","0","0"
"http://steamcommunity.com/id/mattway/recommended/214340/","mattway","Mattway","http://steamcommunity.com/id/mattway/","50 products in account","Great game! If you like point and click adventures you will love it!","November 3, 2014","true","20.9"," No ratings yet","0","0","0","0","0"
"http://steamcommunity.com/id/Nova503/recommended/214340/","Nova503","Sethyr","http://steamcommunity.com/id/Nova503/","490 products in account","This series.\n\nWhat can I say.\n\nThis ♥♥♥♥♥♥♥ series. Has. EVERYTHING that makes a point-and-click adventure game work. Fantastic puzzles, insane and colorful characters, a story that simulateously makes you laugh and cry with Rufus at the same time.\n\nSpeaking of our egotistical main character, never before have I wanted to give a fictional game character a slap and a hug at the same time. The dude is unbelieveably self-centered, but at the same time he tried his best to keep his shenanigans from harming people. He wants to leave Deponia, but he can't just let people call Deponians trash. The planet? Yeah it's trash, but the people mean well and are just trying to get by, and are in no way trash.\n\nThis character. This world.\n\nTHIS SERIES. IS. AMAZING.\n10/10\nGET ALL THREE GAMES IT'S AMAZING.","September 28, 2014","true","10.3"," No ratings yet","0","0","0","0","0"
"http://steamcommunity.com/profiles/76561198025267880/recommended/214340/","76561198025267880","TheDContinuum","http://steamcommunity.com/profiles/76561198025267880/","116 products in account","A great adventure game in the footsteps of the Monkey Island.  Great humor, interesting puzzles, good story, fun characters.  Silly madcap fun.  (Looking forward to the sequels).","September 29, 2014","true","8.0"," No ratings yet","0","0","0","0","0"
"http://steamcommunity.com/id/rubiksage/recommended/214340/","rubiksage","Rubiksage","http://steamcommunity.com/id/rubiksage/","110 products in account","sdaklfigyuKLUFYBVLIushgdflukyahsd;fiahbsdfukghz.dkf;vhbsldyuihg;ziodcvhusldiufhjxfzdfgzlkfujfcjidjf<3","August 25, 2014","true","27.0"," No ratings yet","0","0","0","0","0"
"http://steamcommunity.com/id/zubrowkabison/recommended/214340/","zubrowkabison","Zubrowka Bison","http://steamcommunity.com/id/zubrowkabison/","82 products in account","Oh dear.  Whispering World was awesome and I love PnC but this felt like it was written and designed by 12 year old boys with a chip on their shoulder.  It's like they were going for South Park and failed miserably.  The characters are terrible tropes and so horribly annoying I cannot bring myself to play the second one - and it's such a shame as the art style and animation is great.  It's so rare to find nicely done point n clicks that this seems such a waste.\n\nI'm putting this down as a non recommend - my first (and I hope only) PnC negative review.","August 27, 2014","false","13.2"," No ratings yet","0","0","0","0","0"
"http://steamcommunity.com/profiles/76561198099741541/recommended/214340/","76561198099741541","Mantoux","http://steamcommunity.com/profiles/76561198099741541/","105 products in account","Great game!","August 27, 2014","true","14.1"," No ratings yet","0","0","0","0","0"
"http://steamcommunity.com/profiles/76561198002513096/recommended/214340/","76561198002513096","crisis","http://steamcommunity.com/profiles/76561198002513096/","81 products in account","definitly better than i thought it would be. i wouldnt spend 20 bucks on the game.... so its a good game to get on sale.","August 28, 2014","true","19.9"," No ratings yet","0","0","0","0","0"
"http://steamcommunity.com/profiles/76561198130866880/recommended/214340/","76561198130866880","alifaan","http://steamcommunity.com/profiles/76561198130866880/","6 products in account","interesting and funny game, quite promising for a casual point and click adventure --- however was not able to play after a certain point. when reaching the tower on top of the Post Office to get the headphones from the 'frazzled' guy. couldnt go back down the ladder afterwards. pretty much tried everything possible, yet no luck. read about a lot of other people facing the problem and some solutions are apparently out there but no way to fix it through having it on Steam. :(","August 29, 2014","true","3.9"," No ratings yet","0","0","0","0","0"
"http://steamcommunity.com/id/marcelohcortez/recommended/214340/","marcelohcortez","MasterBaite","http://steamcommunity.com/id/marcelohcortez/","449 products in account","Excellent game. One of the best 'point-and-click' I ever played. Funny, hard puzzles sometimes, nice story, nice art.\nActually I recomend any game from Daedalic.\nAlready have the other 2 parts of Deponia, and I know i'll love it just the same as this one.","August 29, 2014","true","12.8"," No ratings yet","0","0","0","0","0"
"http://steamcommunity.com/profiles/76561197998427709/recommended/214340/","76561197998427709","DalsuN","http://steamcommunity.com/profiles/76561197998427709/","143 products in account","Good Series.","August 30, 2014","true","15.3"," No ratings yet","0","0","0","0","0"
"http://steamcommunity.com/id/krieghofgames/recommended/214340/","krieghofgames","Krieghof@Linux[AUT]","http://steamcommunity.com/id/krieghofgames/","84 products in account","Great Game.","August 15, 2014","true","9.3"," No ratings yet","0","0","0","0","0"
"http://steamcommunity.com/profiles/76561197998913630/recommended/214340/","76561197998913630","super-banana-man-jr","http://steamcommunity.com/profiles/76561197998913630/","67 products in account","this game has some very good humor, aesthetics and is very intertaining. but the puzzels can be a bit confusing and nonsensical. but still for all its confusing bits im glad I got this. but the ending wouls have ♥♥♥♥♥♥ me off if not for the knowlage that there was a seqile ready to go.","March 26, 2013","true","10.1"," No ratings yet","0","0","0","0","0"
"http://steamcommunity.com/profiles/76561197984737819/recommended/214340/","76561197984737819","No_SuRReNDeR","http://steamcommunity.com/profiles/76561197984737819/","98 products in account","Its pretty good...short but good.","September 11, 2012","true","11.8"," No ratings yet","0","0","0","0","0"
"http://steamcommunity.com/profiles/76561198082463593/recommended/214340/","76561198082463593","doocane","http://steamcommunity.com/profiles/76561198082463593/","100 products in account","SO FUN.","September 24, 2014","true","8.8"," No ratings yet","0","0","0","0","0"
"http://steamcommunity.com/id/h3llf1re1000/recommended/214340/","h3llf1re1000","H3llF1re1000","http://steamcommunity.com/id/h3llf1re1000/","249 products in account","Not my thing but it looks funnt xD","September 16, 2014","true","1.3"," No ratings yet","0","0","0","0","0"
"http://steamcommunity.com/id/silverwhite/recommended/214340/","silverwhite","Evranu","http://steamcommunity.com/id/silverwhite/","669 products in account","Beautiful point and click adventure game. The main character is not a typical hero, he's rather rude and ego centered, but he eventually changes a bit. I highly recommend the whole trilogy to people who like drawn adventure games and are ready to help Rufus in his quest despite his bad character.","September 17, 2014","true","3.5"," No ratings yet","0","0","0","0","0"
"http://steamcommunity.com/id/mrsboring/recommended/214340/","mrsboring","Annika","http://steamcommunity.com/id/mrsboring/","91 products in account","I've never been a fan of point-and-click games, I picked up Deponia since "uh-it's-cheap-I*ll-give-it-a-go" and then kind of forgot about it for months. Until recently, when I decided to sit down and actually see what it's all about. I instantly fell inlove with the atmosphere, I love the graphic scenery and the dump that is Kuvaq, the little village on Deponia. Rufus is the kind of guy that himself claims to be master of everything, but as far as others are concerned, he's master of disaster. Still, he manages to assemble the most peculiar things in his inventory - the very first struggle I had was "how the heck do I get a hold of that TOOTHBRUSH????" - it takes a good amount of thinking before getting used to the whole "pick up everything you can and if you can't use it instantly, try to combine it with something else in the inventory". Needless to say, I don't play puzzle games on a daily basis but I do have a tendency to explore everything in one area before proceeding to the next - which is basically what you want to do in this game too. Otherwise, it's easy to miss picking up something or miss an important clue given from some of the characters while speaking to them.\n\nThe minigame puzzles aren't obvious on how they should be solved, and even if patiently listening through a whole conversation with clues both once and twice, I had my fair share of problems when trying to solve them. Nonetheless, they are amusing and once succeeded, you'll probably feel a bit "ha-HA! There ya go!" - until you encounter the next one..\n\nAs for the story, it's pretty straightforward. Rufus desperatly wants to leave Deponia and will do anything in order for that to happen - when encountering the beautiful Elysian girl Goal he sees his new opportunity rising - he manages to get her into trouble but from his point of view that's excellent news, now he can help her and claim a reward for doing so - to get off Deponia! The road to success isn't all straight and narrow though, but bumpy and grindy - with loads of obstacles along the way.\n\nI like the characters, Rufus especially - his well-meaning intentions aren't always apparent, though. I like the story, it has all elements in it - a bit of action, love, humor, betrayal, villains and of course the old conscience acting up - "what's best for not me alone, but for everybody?". To me, the game is exactly as long as it has to be, in the end it actually feels like "Oh, come on already, aren't we through yet?" *but* it also left me with a feeling of "Now I want to play the next part of this trilogy, I want to know what happens next!". I understand those who thinks the game is quite short, but to me it was sufficent.\n\nWhat I don't like about this game is the tedious multiple choices you have to go through in order to obtain certain items. It's okay when playing on normal mode but when unlocking Droggeljug mode (after finishing the game) they don't make sense anymore. Even if I instantly replayed the game in Droggeljug mode, I couldn't remember how to obtain a certain item from Hannek and it left me extremely frustrated.\n\nI didn't play through the whole game in Droggeljug mode to get the achievement for doing so, I had a saving quite close to the end and played from there on (even then, it was a bit tedious as it's quite much conversations happening near the end) - when every option in multiple choices is replaced with DROGGELJUG, you need to remember which number of the options is the right one - and if the question is branched into several pieces, you can easily lose your temper. I had to mute the game because I got tired of hearing "Droggeljug" constantly :P\n\nI recommend the game if you like humorous point-and-click games with catchy soundtrack, clever puzzles, wacky characters and a good story. To each their own, if you don't like those things, don't buy the game.","September 15, 2014","true","17.4"," No ratings yet","0","0","0","0","0"
"http://steamcommunity.com/profiles/76561198139869605/recommended/214340/","76561198139869605","Kyranisaurus","http://steamcommunity.com/profiles/76561198139869605/","14 products in account","A beautiful looking game with an ugly personality.\n\nWhile this game looks amazing it is blatantly misogynistic, full of bugs and rarely funny. Many of the puzzles don't make sense and the main character is just annoying. Why do I want to play as this jerk?\n\nThe game is visually polished with high production values, but non of that matters once you start reading the sexist and misogynistic dialogue.\n\nI played the whole game through to the end and it only gets worse as the game progresses, more bugs, more crashes and more misogyny.\n\nI love adventure games, but I hate this one.","September 20, 2014","false","7.1"," No ratings yet","0","0","0","0","0"
"http://steamcommunity.com/id/541256325896/recommended/214340/","541256325896","RAID Noir.","http://steamcommunity.com/id/541256325896/","890 products in account","Auction Winner Game - 4800 gems on a Bundle - WORTH IT!!!!!!!\n10 Hours to complete 1 playthrough.\n9/10 rating\n\nThis game was my first adventure game. I had no idea how to play this type of game. The "small" tutorial isnt really enough to know everything.\n\nThe game is awesome. Nice visuals(Toni!) and art style and Music. Story is top notch. I will have to FORCE myself not to get the next 2 games on the series.(Since I still have 4 more games in my bundle)\n\n\n\nCons - Needs hints and not the "out of context" types. I litterally had to click every item just to find which can be joined\n\nDue to the only con. I had to use the walkthrough in Chapter one. as see below\n\n1. On where to place magnets\n\n2. The postage","December 22, 2014","true","10.5"," No ratings yet","0","0","0","0","0"
"http://steamcommunity.com/profiles/76561197984431354/recommended/214340/","76561197984431354","Terminator","http://steamcommunity.com/profiles/76561197984431354/","175 products in account","Rufus is a strange guy indeed, but nevertheless, among all the inhabitans he was the only one to really care about Goal along with the Deponia itself! And however strange it sounds, he finally decided to sacrifice personal interests for the welfare of others. So, after all, he's a hero. Just a little bit nuts...\n\nExcellent game, used a walkthrough only a few times when bumped serious snags.\nSome achievements didn't count, though.\n\nP.S. Toni is so patient and hot! She's got it all, classic shape!","December 18, 2014","true","13.9"," No ratings yet","0","0","0","0","0"
"http://steamcommunity.com/id/mrwaterbear/recommended/214340/","mrwaterbear","PAL","http://steamcommunity.com/id/mrwaterbear/","670 products in account","Gorgeous graphics, clever to clunky puzzle design, unlikable protagonist, irritating music and a very “German” sense of humor that doesn't always translate that well.\nNot my bag, but might be worth your time if you get it for cheep.","December 27, 2014","false","6.4"," No ratings yet","0","0","0","0","0"
"http://steamcommunity.com/id/IMHoRuS/recommended/214340/","IMHoRuS","HoRuS","http://steamcommunity.com/id/IMHoRuS/","210 products in account","Wow !!!! fantastic","December 28, 2014","true","2.2"," No ratings yet","0","0","0","0","0"
"http://steamcommunity.com/profiles/76561198014754649/recommended/214340/","76561198014754649","Csesium Gaming","http://steamcommunity.com/profiles/76561198014754649/","239 products in account","Humor fell flat for me. Didn't find it terribly interesting so I stopped playing and uninstalled after a short time.","November 30, 2014","false","0.9"," No ratings yet","0","0","0","0","0"
