"url","reviewerUsername","reviewerDisplayName","reviewerUrl","reviewerProductsCount","reviewText","date","recommended","hoursPlayed","voteText","helpfulPercent","votesHelpful","votesTotal","votesFunny","commentsCount"
"http://steamcommunity.com/id/drmircow/recommended/214340/","drmircow","Dr. Mircow","http://steamcommunity.com/id/drmircow/","677 products in account","Deponia is a traditional point–and-click (P&C) adventure game which revolves around the protagonist trying to escape from Deponia and ends up saving a mysterious princess. Boasting a charming setting supported by beautifully drawn backgrounds, solid voice acting  and an interesting soundtrack, at its core it is plagued by one of the most insufferable casts and puzzles seen in an adventure game in years.\n\nIf the aim of the game was to represent the most insufferable protagonist, something which is fundamentally a backbone of the genre, then it passed with flying colours. Rufus, the protagonist, is quintessentially the pretentious and brainless (at times) jerk every individual should respectfully hate and gives little reason for any sympathy throughout most of the story, even when his act of saving the princess is noble to an extent. Not only is the protagonist ultimately unlikeable, but almost every single support character faces the same setback: being painfully unmemorable, unfunny or annoying.\n\nThe humour in Deponia is by and large hit-and-miss. There are a few genuine moments which spark a giggle such as a robot’s guilty obsession with popping bubble-wraps or a transvestite’s fake womanly voice (the best it can get), but these are overshadowed by the blatant misogynistic remarks and uninspiring jokes by poorly written characters.\n\nThe puzzles are not great either. They start off fairly easy but eventually end up suffering from a typical syndrome in this genre -- illogicality. Because of this a guide must be acquired, otherwise too much time will be frustratingly spent figuring out what to do next, and there are a few moments where you will ask yourself how were you supposed to know that or why that particular action was required. The game does not give too many hints when it comes to solving its relatively tiresome puzzles.\n\nAll of the things mentioned above slowly turn a potentially decent storyline at best into a dreary one. Even now, personally I am not completely sold on the whole damsel in distress approach the story takes when Rufus meets the princess, who spends mostly the entire game unconscious from a fall caused by no one else but Rufus earlier in the game. Regardless, there is also a sense of not much engagement in the story either, all thanks to poor writing. After a few hours sank into the game, everything starts to be a big fat chore.\n\nFrom a technical standpoint, it is shocking to realise that after almost two years since launch a particular game-breaking glitch in a puzzle, which was also encountered by others (albeit not all), is still present in the game. This glitch stops a particular cutscene to play, preventing any possibility of continuing the game just when you were so close to the end. After some research, a way to overcome this unforgiveable misfortunate is to get access of a save file from someone else who owns the game and got passed this point. At the time of writing this review, I still do not know how the game actually ends. Moreover, reported by others as well is the awful framerate even for high-end computers which can inexplicably drop to as low as 10FPS even at the lowest settings. Deponia is a game which should not require a lot of resources to run smoothly considering it looks like a 2D game done in Flash, and this implies poor coding and optimization.  Lastly, the animations can be a bit clunky at times but passable.\n\nConclusively, Deponia is kind of a mess, much like its planet. Poor writing, unlikeable characters, illogical puzzles and unfixed glitches simply make it a chore or potentially unplayable and degrade anything interesting the story has to offer.  Its visual charm might be its only selling point for anyone curious about Deponia (mainly the reason I got it), but its flaws in almost everything that is supposed to make a top-notch adventure P&C sadly suck out any enjoyment Deponia could offer to an avid, yet old-school, adventure fan like myself. I cannot recommend this game to any adventure fanatic expecting an overall quality on par to Monkey Island, Gabriel Knight, Broken Sword and other classics. Instead, Deponia should also take an example from a recent modern game like The Book Of Unwritten Tales.\n\nLastly, if you can actually ignore all its flaws, then it is passable at best. But I would be in awe by how you could ignore such obvious flaws.","July 7, 2014","false","8.2"," 3 of 7 people (43%) found this review helpful","43","3","7","0","0"
"http://steamcommunity.com/id/08217/recommended/214340/","08217","Dr. Doc","http://steamcommunity.com/id/08217/","24 products in account","The protagonist will steal everything he sees, flood his friend's house, poison his former girlfriend with dart(who is supporting him economically), frame a mayor, and abuse animals.\n\nAlso, the post office of this town makes cats work by literally shocking them with electricity. Yes, really.\n\nAll these small details might be funny to some people, but it was very bizarre to me, even unpleasant. Not only Rufus, the protagonist(I would never use a word 'hero' on this guy), but the atmosphere of this game also doesn't give a shxt about all these madness he's making everywhere, as if it's just some kind of a joke.\n\nTo me, it was a very ill-humored joke. Giving it red for that reason.\n\np.s.Surprisingly, there's a good reason for his attitude, which is revealed at Deponia 3. Well, it's a review for Deponia 1 though. If you are going to play all Deponia titles, ignore this review. If you are not, beware that the main charater might let you down.","May 7","false","8.5"," 3 of 7 people (43%) found this review helpful 1 person found this review funny","43","3","7","0","0"
"http://steamcommunity.com/id/Edonen/recommended/214340/","Edonen","Erith","http://steamcommunity.com/id/Edonen/","171 products in account","Obnoxious prtagonist, way too much point and click "logic"","May 1","false","0.7"," 3 of 7 people (43%) found this review helpful","43","3","7","0","0"
"http://steamcommunity.com/id/Agrobal/recommended/214340/","Agrobal","Agrobal","http://steamcommunity.com/id/Agrobal/","657 products in account","The Deponia series is very eccentric and not for anyone in my opinion. It feels reminiscent to that of old point and click adventure games. It has a lot of good jokes and a lot of bad ones too. It was the kind of comedy that I am not used to. It was definitely worth the experience for me but not worth the money. Deponia also exploits how some adventure games are ridiculous with their puzzles and plots and quadruples that. Would I recommend it to any player? No. Would I recommend it to hardcore adventure gamers? Maybe. Tread at your own risk and preference to comedy.","September 13, 2014","false","9.3"," 2 of 5 people (40%) found this review helpful","40","2","5","0","0"
"http://steamcommunity.com/profiles/76561198042045821/recommended/214340/","76561198042045821","Meganomic","http://steamcommunity.com/profiles/76561198042045821/","354 products in account","The main dude is a ♥♥♥♥ing ♥♥♥♥♥♥♥. If wanted to see an ♥♥♥♥♥♥♥ do stupid ♥♥♥♥ I'd look in the mirror. 4/10","July 22, 2015","false","0.9"," 2 of 5 people (40%) found this review helpful","40","2","5","0","0"
"http://steamcommunity.com/profiles/76561197999165958/recommended/214340/","76561197999165958","Kana","http://steamcommunity.com/profiles/76561197999165958/","23 products in account","What I liked about it:\n- funny graphics\n- quirky music\n\nWhat put me off by a mile:\n- the cruel humour of the whole story: basically, you advance the storyline by hurting others, causing damage and being obnoxious or ignorant\n- the protagonist... I could have strangled him\n- had a few pretty annoying puzzles\n- the plot itself seemed flat to me\n\nI only played this game to the end because it came in a game bundle, cheap.\n\n2/10, left a bad taste in my mouth. Definitely not my kind of game.","May 4","false","7.7"," 2 of 5 people (40%) found this review helpful","40","2","5","0","0"
"http://steamcommunity.com/profiles/76561198058342938/recommended/214340/","76561198058342938","Kuchiki","http://steamcommunity.com/profiles/76561198058342938/","182 products in account","Boring story with illogical puzzles and unlikeable main character. Artwork is great though.","March 28","false","2.5"," 2 of 5 people (40%) found this review helpful","40","2","5","0","0"
"http://steamcommunity.com/id/wolfspider1183/recommended/214340/","wolfspider1183","God Dogs","http://steamcommunity.com/id/wolfspider1183/","453 products in account","This is a fantastic point-n-click adventure game. If you've played any of the old LucasArts or Sierra adventure games from the 90's, you'll feel right at home with Deponia. It's art style and sense of humor is reminiscient of Monkey Island or Day of the Tentacle, and its puzzles are definitely challenging without being outlandishly obscure. It's a perfect balance of logic and wackiness.\n\nThe story and characters are also well done, though it took a little bit for the main character, Rufus, to grow on me (he's obnoxious and grating at first). Since this is part 1 of a trilogy, the ending will leave you hanging and wanting more. However, don't let that fool you into thinking it cuts short. I finished this in 12 hours, which is unheard of for point-n-click games in this day and age.\n\nIf you loved the adventure games in the 90's from LucasArts or Sierra, this is definitely worth your time and money, and I can't wait to play the sequels.","October 18, 2014","true","12.4"," 1 of 3 people (33%) found this review helpful","33","1","3","0","0"
"http://steamcommunity.com/id/DarkAngelCaptain/recommended/214340/","DarkAngelCaptain","*rd* DarkAngel","http://steamcommunity.com/id/DarkAngelCaptain/","111 products in account","This game reminds me of all the great adventure games of the past. Its got a great sense of humour. I would recommend it and the two sequels to anyone.","October 5, 2014","true","23.1"," 1 of 3 people (33%) found this review helpful","33","1","3","0","0"
"http://steamcommunity.com/profiles/76561198116065359/recommended/214340/","76561198116065359","KillerKoala","http://steamcommunity.com/profiles/76561198116065359/","1060 products in account","some weird ♥♥♥♥ right here","October 1, 2014","true","1.8"," 1 of 3 people (33%) found this review helpful","33","1","3","0","0"
"http://steamcommunity.com/id/PrinceNeptune/recommended/214340/","PrinceNeptune","Neptune","http://steamcommunity.com/id/PrinceNeptune/","366 products in account","Rub everything on everything else!  This woefully uninspired point-and-click does nothing to solve the problem of not being able to think exactly like the developers.  The most progress made through the game only happens after you've performed every possible rub-things-on-other-things permutation.  The unplayablility of the game is only exacerbated by the annoying voice acting and cliche dialouge.  I get the nostalgia feels because a lot of games in the 90's were like that, but that in and of itself is especially telling.","August 4, 2014","false","0.6"," 1 of 3 people (33%) found this review helpful","33","1","3","0","0"
"http://steamcommunity.com/id/LtLabcoat/recommended/214340/","LtLabcoat","Lt. Labcoat","http://steamcommunity.com/id/LtLabcoat/","1680 products in account","You''ve played Secret Of Monkey Island, right? Of course you have, everyone has! Well this is basically EXACTLY as good! So yes, I recommend!","November 12, 2013","true","0.7"," 1 of 3 people (33%) found this review helpful","33","1","3","0","0"
"http://steamcommunity.com/id/SunRiseLand/recommended/214340/","SunRiseLand","飘落的雪花","http://steamcommunity.com/id/SunRiseLand/","130 products in account","I Wont Really Recommend the Game But you should get it!!!! This game is Like Really to solve I Couldnt Even finish the game i Had to go watch gameplay on youtube to help me But its still a really fun game and i love the story! But Rufus is a big ♥♥♥♥","January 10, 2014","true","5.2"," 1 of 3 people (33%) found this review helpful","33","1","3","0","0"
"http://steamcommunity.com/id/mildr/recommended/214340/","mildr","Mildr","http://steamcommunity.com/id/mildr/","146 products in account","The game has his moments but it's too short and the ending is a disapointment... to bad :/ Not worth the price at this moment.","February 27, 2014","false","8.5"," 1 of 3 people (33%) found this review helpful","33","1","3","0","0"
"http://steamcommunity.com/profiles/76561198009337503/recommended/214340/","76561198009337503","SHA33","http://steamcommunity.com/profiles/76561198009337503/","311 products in account","I loved this game. A great point and click.","October 16, 2014","true","8.0"," 1 of 3 people (33%) found this review helpful","33","1","3","0","0"
"http://steamcommunity.com/id/nateface/recommended/214340/","nateface","Bappohmeet","http://steamcommunity.com/id/nateface/","52 products in account","I've fallen in love with the Deponia series, I really have. It's a magnificent series and well worth playing if you're the point & click gamer type who loves to see character development and an incredibly engaging storyline.\n\nHowever, I can really only give this game a 9/10 because no matter how many times I've tried I cannot get the damn Drogglejug achievement. I'm seriously really butthurt about it. Majorly.\n\nWould not recommend for completionists unless you're feelin' lucky.","January 2, 2015","true","9.8"," 1 of 3 people (33%) found this review helpful","33","1","3","0","0"
"http://steamcommunity.com/id/brandonblythe/recommended/214340/","brandonblythe","brandonblythe","http://steamcommunity.com/id/brandonblythe/","22 products in account","wonderful little game cant wait to play the other 2","December 8, 2014","true","7.4"," 1 of 3 people (33%) found this review helpful","33","1","3","0","0"
"http://steamcommunity.com/id/0_Zero_0/recommended/214340/","0_Zero_0","0_Zero_0","http://steamcommunity.com/id/0_Zero_0/","40 products in account","A good looking, point-'n-click with some unique puzzles. The "hotspot view" (press space bar) takes away the frustrating pixel hunt other adventure games (I'm looking at you, Beneath a Steel Sky). It also has one of the best inventory system and user interface.","December 25, 2014","true","9.9"," 1 of 3 people (33%) found this review helpful","33","1","3","0","0"
"http://steamcommunity.com/id/hydroniummc/recommended/214340/","hydroniummc","Hydronium","http://steamcommunity.com/id/hydroniummc/","144 products in account","Best game I've ever played.","January 5, 2015","true","2.2"," 1 of 3 people (33%) found this review helpful","33","1","3","0","0"
"http://steamcommunity.com/profiles/76561198038552111/recommended/214340/","76561198038552111","Phruler","http://steamcommunity.com/profiles/76561198038552111/","74 products in account","Very good game","March 19, 2015","true","8.9"," 1 of 3 people (33%) found this review helpful","33","1","3","0","0"
"http://steamcommunity.com/id/sgt-scorpion/recommended/214340/","sgt-scorpion","Takila!","http://steamcommunity.com/id/sgt-scorpion/","50 products in account","Nice game i enjoyed playin' it have a fine Graphic , but i don't like the fact that doesn't have hints\nBTW it's still good 'n' nice game","April 10, 2015","true","8.7"," 1 of 3 people (33%) found this review helpful","33","1","3","0","0"
"http://steamcommunity.com/id/LtLabcoat/recommended/214340/","LtLabcoat","Lt. Labcoat","http://steamcommunity.com/id/LtLabcoat/","1680 products in account","You''ve played Secret Of Monkey Island, right? Of course you have, everyone has! Well this is basically EXACTLY as good! So yes, I recommend!","November 12, 2013","true","0.7"," 1 of 3 people (33%) found this review helpful","33","1","3","0","0"
"http://steamcommunity.com/profiles/76561197990778958/recommended/214340/","76561197990778958","[SiF] T3QU1L4","http://steamcommunity.com/profiles/76561197990778958/","167 products in account","The game might be fun for kids at the age of 6 and below.","December 23, 2013","false","0.2"," 1 of 3 people (33%) found this review helpful","33","1","3","0","0"
"http://steamcommunity.com/profiles/76561198042222473/recommended/214340/","76561198042222473","choowie","http://steamcommunity.com/profiles/76561198042222473/","737 products in account","Not everyone can be Lucas Art. Everything is here for this point and click adventure game except it just does not work.\n\nThe enigma make no sense so you end up trying every object in your inventory with everything.","December 27, 2013","false","14.4"," 1 of 3 people (33%) found this review helpful","33","1","3","0","0"
"http://steamcommunity.com/id/pan_azej/recommended/214340/","pan_azej","<default>","http://steamcommunity.com/id/pan_azej/","68 products in account","This game is not hard, it's just impossible.\n\nThe level of difficulty doesn't come from the puzzles being hard, they are just illogical, scattered around a map and sometimes you can hardly tell you can use something because it looks like it's a part of background.","January 22, 2014","false","4.6"," 1 of 3 people (33%) found this review helpful","33","1","3","0","0"
"http://steamcommunity.com/id/0_Zero_0/recommended/214340/","0_Zero_0","0_Zero_0","http://steamcommunity.com/id/0_Zero_0/","40 products in account","A good looking, point-'n-click with some unique puzzles. The "hotspot view" (press space bar) takes away the frustrating pixel hunt other adventure games (I'm looking at you, Beneath a Steel Sky). It also has one of the best inventory system and user interface.","December 25, 2014","true","9.9"," 1 of 3 people (33%) found this review helpful","33","1","3","0","0"
"http://steamcommunity.com/id/hydroniummc/recommended/214340/","hydroniummc","Hydronium","http://steamcommunity.com/id/hydroniummc/","144 products in account","Best game I've ever played.","January 5, 2015","true","2.2"," 1 of 3 people (33%) found this review helpful","33","1","3","0","0"
"http://steamcommunity.com/profiles/76561198038552111/recommended/214340/","76561198038552111","Phruler","http://steamcommunity.com/profiles/76561198038552111/","74 products in account","Very good game","March 19, 2015","true","8.9"," 1 of 3 people (33%) found this review helpful","33","1","3","0","0"
"http://steamcommunity.com/id/sgt-scorpion/recommended/214340/","sgt-scorpion","Takila!","http://steamcommunity.com/id/sgt-scorpion/","50 products in account","Nice game i enjoyed playin' it have a fine Graphic , but i don't like the fact that doesn't have hints\nBTW it's still good 'n' nice game","April 10, 2015","true","8.7"," 1 of 3 people (33%) found this review helpful","33","1","3","0","0"
"http://steamcommunity.com/profiles/76561198097980229/recommended/214340/","76561198097980229","2b2bff","http://steamcommunity.com/profiles/76561198097980229/","7 products in account","Great start of the triology. I liked every part of the series..","October 23, 2014","true","12.2"," 1 of 3 people (33%) found this review helpful","33","1","3","0","0"
"http://steamcommunity.com/id/supargamir000/recommended/214340/","supargamir000","Gosep Lebnanki","http://steamcommunity.com/id/supargamir000/","869 products in account","HUZZAH Droggeljug","January 7, 2015","true","12.4"," 1 of 3 people (33%) found this review helpful","33","1","3","0","0"
"http://steamcommunity.com/id/fallimar/recommended/214340/","fallimar","fallimar","http://steamcommunity.com/id/fallimar/","146 products in account","Pros: Amazingly beautiful artwork\nOld-school bizarre puzzle solving\nInteresting world\n\nCons: Horrible main character\nOn-the-nose cringe-worthy writing\nGoal. Really? Really?\n\nThis could have been a really fun game if the main character wasn't a complete and utter waste of space who learns nothing. I hear it's much worse in the other games too. It's a no from me. Seriously - keep the art department from this, mix with writers who have a sense of humour that doesn't feel like it came out of a seedy frat house and you'd have a winning title.","May 28, 2015","false","5.5"," 1 of 3 people (33%) found this review helpful","33","1","3","0","0"
"http://steamcommunity.com/id/Nygarda/recommended/214340/","Nygarda","Nygaard","http://steamcommunity.com/id/Nygarda/","120 products in account","This game is greate. I definitely recommend it to other point and click lover out there. Def greate: good voice acting, art style, humor and more.","January 19, 2015","true","8.3"," 1 of 3 people (33%) found this review helpful","33","1","3","0","0"
"http://steamcommunity.com/profiles/76561197998212178/recommended/214340/","76561197998212178","Shadibadoo","http://steamcommunity.com/profiles/76561197998212178/","61 products in account","A lovely and nostalgic distraction, with relatively simple puzzles, pleasant characters, and many entertaining one-liners.  The story is cute.\n\nThe only thing lacking in Deponia is moral choices or branching storylines.  That's become a staple of some of the more recent point-and-click games.","April 21, 2014","true","20.1"," 1 of 3 people (33%) found this review helpful","33","1","3","0","0"
"http://steamcommunity.com/profiles/76561198142726747/recommended/214340/","76561198142726747","BeGud","http://steamcommunity.com/profiles/76561198142726747/","76 products in account","So far I HATE this game...\n\n- The actions you have to take to advance in the game are counter intuitive, make no sense, and feels like they've been put together randomly; for example, a lock pick that can only pick one specific lock in the game, OH you wanna pick another lock ??! WELL TOO BAD THIS AINT IN THE SCRIPT.\n\n- The characters are f*cking stupid and annoying, especially the main charachter which on top of his r*tardedness, has the most annoying voice in video game history.\n\n- Some obstacles and setbacks are just annoyingly stupid, if you hated Prison Break, you'll probably hate this game too.\n\n- zzzZZzZZZZzzzZz\n\n- The advancement of this game is so unintuitive, I can't progress into the game without reading the walkthroug every 5 minutes.\n\nHow in the universe did this piece of sh*t get a "Very Positive" rating ?!!","December 27, 2015","false","6.4"," 1 of 3 people (33%) found this review helpful","33","1","3","0","0"
"http://steamcommunity.com/profiles/76561198142726747/recommended/214340/","76561198142726747","BeGud","http://steamcommunity.com/profiles/76561198142726747/","76 products in account","So far I HATE this game...\n\n- The actions you have to take to advance in the game are counter intuitive, make no sense, and feels like they've been put together randomly; for example, a lock pick that can only pick one specific lock in the game, OH you wanna pick another lock ??! WELL TOO BAD THIS AINT IN THE SCRIPT.\n\n- The characters are f*cking stupid and annoying, especially the main charachter which on top of his r*tardedness, has the most annoying voice in video game history.\n\n- Some obstacles and setbacks are just annoyingly stupid, if you hated Prison Break, you'll probably hate this game too.\n\n- zzzZZzZZZZzzzZz\n\n- The advancement of this game is so unintuitive, I can't progress into the game without reading the walkthroug every 5 minutes.\n\nHow in the universe did this piece of sh*t get a "Very Positive" rating ?!!","December 27, 2015","false","6.4"," 1 of 3 people (33%) found this review helpful","33","1","3","0","0"
"http://steamcommunity.com/id/certifiablygeeky/recommended/214340/","certifiablygeeky","certifiablygeeky","http://steamcommunity.com/id/certifiablygeeky/","95 products in account","If you're looking for a fun point-and-click game, then look no further. You should buy this game now. If you enjoy comedy even a little bit, then why haven't you bought this game yet? "Deponia" has some easy achievements, if that's your thing. If you get stuck on some of the puzzles there are guides on Steam and on YouTube. I found those very helpful. "Deponia" is the first game in the Deponia trilogy, which includes "Deponia", "Chaos on Deponia", and "Goodbye Deponia". I would recommend starting with this game, since the second game, "Chaos on Deponia", picks up close to where this one ends.","May 29, 2015","true","23.9"," 1 of 3 people (33%) found this review helpful","33","1","3","0","0"
"http://steamcommunity.com/profiles/76561198042872946/recommended/214340/","76561198042872946","PsychoLilly","http://steamcommunity.com/profiles/76561198042872946/","332 products in account","Racist, misogynist, transphobic garbage. Gameplay is a terrible example of the adventure genre and the main character is a stain.\n\nThere are so many excellent adventure titles, please avoid this trash.","March 3","false","0.4"," 1 of 3 people (33%) found this review helpful 1 person found this review funny","33","1","3","0","0"
