"url","reviewerUsername","reviewerDisplayName","reviewerUrl","reviewerProductsCount","reviewText","date","recommended","hoursPlayed","voteText","helpfulPercent","votesHelpful","votesTotal","votesFunny","commentsCount"
"http://steamcommunity.com/id/hojusimpson81/recommended/214340/","hojusimpson81","hojusimpson81","http://steamcommunity.com/id/hojusimpson81/","399 products in account","An adventure game that looks like a LucasArts one but, at least in terms of the puzzles, occasionally feels like a Sierra one.\n\nThe story is pretty simple: A loser wants to escape his garbage dump of a home, and leave for someplace better.  The captions have some spelling errors, the voice acting occasionally falls flat, and the puzzles both halt the game's pacing, and sometimes serve to frustrate the player. Not many times, mind you, but there are a few that will make you ask, "Really?"\n\nSo, why do I like the game? Well, I love adventure games, and Deponia is a nice throwback to the 90s halcyon days. Even the lead character, Rufus, feels like Guybrush Threepwood (Monkey Island). Actually, he feels more like a mix of Futurama's Fry and Bender, if that makes any sense.\n\nOf course, Deponia fans know what Rufus is really like: Herpes. Or, should I say, "a cooler version of herpes."\n\nThe trilogy goes on sale fairly often, so I'd say wait for a deal and scoop up all three. Happy gaming!","July 14, 2015","true","7.7"," 1 person found this review helpful","0","1","1","0","0"
"http://steamcommunity.com/profiles/76561197970509434/recommended/214340/","76561197970509434","Dr. Acula","http://steamcommunity.com/profiles/76561197970509434/","386 products in account","Go watch Yahtzee's Zero Punctuation review of "The Walking Dead". Stop the video at one minute in. This game embodies the entirety of what he said in that first minute. Intentionally. Entertaining? Yes. Trying too hard? Probably. Filled with Guide-Dangit moments as well.","September 27, 2012","true","7.0"," 1 person found this review helpful","0","1","1","0","0"
"http://steamcommunity.com/id/hade3/recommended/214340/","hade3","Offline","http://steamcommunity.com/id/hade3/","413 products in account","Deponia is a good little point and click adventure game. It has its share of tedious puzzles but most of them are good and makes sense (not a la Discworld). The story is good enough although very linear (we can argue a story is always linear :p ) in my opinion. We are far from games or stories such as the Longest Journey or Monkey Island.\n\nThe recommended inventory system using the mouse wheel is extremely good and works very well, you can also hit the space bar at anytime to highlight every clickable objects in an area and the hand drawn graphics are really fantastic.\n\nI noticed a few bugs here and there, some of the clickable objects would eventually become non-clickable, and sometimes, the dialogue options are sometime off screen (probably not optimized for my resolution ?). The dialogues are well written and the actors did a great work in my opinion but the sound is not normalized very well making it sometime an inaudible mess.\n\nFinally, I want to mention that Rufus (the hero) goofiness only worked halfway for me. He is very one dimensional and his lines became very repetitive quickly. Some other characters such as Toni, Kuvac's mayor or Lotti are just more interesting making the world of Deponia a very believable one.\n\nIf you can go through all the above, then yes, I think you will like Deponia.","April 29, 2014","true","11.7"," 1 person found this review helpful","0","1","1","0","0"
"http://steamcommunity.com/id/Thanaderp/recommended/214340/","Thanaderp","Thanatar","http://steamcommunity.com/id/Thanaderp/","731 products in account","If you're looking at this game when it's going for 2$ get the damn game. If it's going for 20$ as usual... maybe only if you're really into point-and-click games, and have tried other ones. It's a solid enough buy nonetheless. (just my opinion)\n\nA fantastic game with a unique cast of characters and beautifully drawn sceneries. The story itself, beneath the cartoonish appearance, was actually quite intriguing and compelling at times, though admittedly hindered by tedious game pacing (a good example being spending easily 30+ minutes simply making a espresso.). Playing while reading a walkthrough is probably a good idea unless you intend to be in it for the long haul.\n\nThe voice acting I particularly enjoyed; I did notice it did not always sync (particularly in the earlier parts of the game), something which bothered me- but it was nonetheless enjoyable to listen to the voiced dialogue anyways. Even for "supporting" characters I found the voice acting to be rather spot-on.\n\nContent-wise the game seemed rather sparse, but it was consistently enjoyable from beginning to end.","September 1, 2014","true","5.4"," 1 person found this review helpful","0","1","1","0","0"
"http://steamcommunity.com/profiles/76561198198273202/recommended/214340/","76561198198273202","kindred_spirit80","http://steamcommunity.com/profiles/76561198198273202/","40 products in account","This game is a trilogy. Deponia is the 1st part. To play this egocentric character, Rufus,  and watch him grow through the entire journey was worth it. Initially I felt omg what an annoying character but it was quite important aspect of the storyline. Soon i appreciated it. Poor guy. Well, I get bored easily but dialogue was witty and humorous. Really good at times.\n\nThe puzzles arent always easy and they made sense. Pretty witty puzzles in my opinion. Again, I get very bored easily if things seem too easy or illogical but Deponia series was a great experience. Goodbye Deponia (3rd part) had a thought provoking ending. Each part was better than the next. Every ending was somewhat - pretty beautiful. Nice story nice game. Happy I played it.","August 28, 2015","true","13.8"," 1 person found this review helpful","0","1","1","0","0"
"http://steamcommunity.com/profiles/76561198091338934/recommended/214340/","76561198091338934","Handsome Jack","http://steamcommunity.com/profiles/76561198091338934/","53 products in account","If you like one one-time 2D click-and-action puzzles, Deponia is that's, what you needed. If not, well, skip this game.\n\nI think, to avoid spoilers and plot twists, that's all I can say about Deponia. All the trilogy.\n\nWait, it's not! Be ready for jokes - they can be homerically funny, or complitly frustrating, depends of your mind position.\n\nNow, that's all, folks. I wish there's button "passive" in recomendation of games. So, I can't deny I favor this game a bit, so I recommend  it, but with great caution.","August 7, 2015","true","10.5"," 1 person found this review helpful","0","1","1","0","0"
"http://steamcommunity.com/id/pixtar/recommended/214340/","pixtar","pixtar","http://steamcommunity.com/id/pixtar/","225 products in account","'Deponia' is a humorous point and click adventure, which is near to 'The Books of Unwritten Tales' where you can feel the world and want to be part of it. *Hussa!*\n\nDesc:\nYou play as 'Rufus' who is a egomaniac, prides himself on being the best and who wants to leave his scrap home planet Deponia to Elysium with a vengeance. On his mission he meets 'Goal' the love of his life. He is willing to do everything for her to win her heart AND to get to Elysium.\n\nPros:\n+ Really nice painted graphics and animations\n+ Strong audio speakers\n+ Funny as hell (sometimes very rude humor)\n+ Tutorial is available\n+ Skippable mini-games\n+ References to previous Daedalic games\n+ Demo available\n(+ Sequels for continuing fun)\n(+ Achievements [easy to collect] )\n\nCons:\n- Annoying Droggeljug achievement (no shortcut)\n\nRecommended, even if it's not on sale, because of the great story and the awesome trappings playing on a planet/world full of scrap.\n\n9/10","July 13, 2015","true","23.7"," 1 person found this review helpful","0","1","1","0","0"
"http://steamcommunity.com/id/bucketofowls/recommended/214340/","bucketofowls","f r a n k","http://steamcommunity.com/id/bucketofowls/","311 products in account","An amazing little game, a fun tale with quirky turns that no one expects. I sat down and beat it within the span of about six hours, which felt like no time at all. Very immersive, but not a game I would call intuitive. Some of the puzzles are just bizarre - but that's what makes it fun.\n\nDroggeljug.","October 27, 2015","true","9.1"," 1 person found this review helpful","0","1","1","0","0"
"http://steamcommunity.com/profiles/76561198021677425/recommended/214340/","76561198021677425","manos426f","http://steamcommunity.com/profiles/76561198021677425/","391 products in account","Πρόκειται για ένα φανταστικό adventure game, που ενσωματώνει ορισμένους πολύ επιτυχημένους γρίφους που απαιτούν καλή σκέψη και συγχρόνως διαθέτει μία όμορφη ιστορία, εξελισσόμενη σε έναν κόσμο διαφορετικό εκείνων που μας δίνουν τα περισσότερα παιχνίδια. Μαζί με τα Resonance και Dark Eye-Chains of Satinav συνθέτουν μία πολύ δυνατή τριάδα περιπετειών για το 2012, με τη συγκεκριμένη να καταφέρνει να προσπεράσει τις άλλες δύο και να βρίσκεται στην κορυφή της σχετικής λίστας. Δείτε το οπωσδήποτε, δείχνει με τον καλύτερο τρόπο πώς πρέπει να είναι ένα απολαυστικό adventure game τη σήμερον ημέρα.","January 17, 2014","true","1.4"," 1 person found this review helpful","0","1","1","0","0"
"http://steamcommunity.com/profiles/76561198033802030/recommended/214340/","76561198033802030","sdanond","http://steamcommunity.com/profiles/76561198033802030/","1101 products in account","Yay, after many years, I get to play another humor adventure game. So how does Deponia measure up?\n\nTo begin with I very much like the art style. It's got 2D fully animated characters with some pretty nice painted backgrounds. Everything's easy to move around and interact with. Thankfully you can double click to instant-move to a location.\n\nMusic is serviceable. I like to think of it as elevator music. It's there, and you notice it, but it won't stick, may irritate after a while, and you'd probably rather listen to your own music.\n\nThe story is all right. The main character is perhaps a little too genuinely self-centered, but he gets better... somewhat... I think...\n\nThe game's humor falls a bit on the flat side, which is a shame. I don't think I had a laugh out loud moment, just some grins here and there. I was willing to ignore it though, in order to find out what happens next. I admit I'm more than curious as to what is going on with Elysian physiology, but that wasn't answered in the first game, so I guess I'll have to play through the next (two?).\n\nNow for the meat and potatoes of the game - the puzzles. This is where I feel the game was lacking. There are several areas where you are just bombarded with random items you pick up, and very poor clues as to where to go or what to do. Ordinarily I do my best to avoid guides, but I ended up using one for this game. It didn't even feel rewarding for the stuff I DID manage to figure out on my own.\n\nI guess I'd rate this game a 7/10. It's no King's Quest, it's certainly no Monkey Island.","April 4, 2013","true","11.1"," 1 person found this review helpful","0","1","1","0","0"
"http://steamcommunity.com/id/minicosmicgirl/recommended/214340/","minicosmicgirl","minicosmicgirl","http://steamcommunity.com/id/minicosmicgirl/","144 products in account","Well done! Great graphics! Nice history! Personages are marvelous! I love it! Trilogy is amazing! :)","February 4, 2014","true","13.1"," 1 person found this review helpful","0","1","1","0","0"
"http://steamcommunity.com/id/wormsbuh/recommended/214340/","wormsbuh","wormsbuh","http://steamcommunity.com/id/wormsbuh/","425 products in account","really nice point'n'click! old school 2D gameplay, cool modern cartoonish graphics, good storyline, charismatic characters and funny dialogues. there you have all the ingredients to enjoy a great adventure game! on the cons side the game still has a few minor bugs and I found it out to be a little light on the dialogues, lots of repetitions and unnecessary dialogue-ending sentence coming over and over again, except that perfect!","February 4, 2014","true","17.5"," 1 person found this review helpful","0","1","1","0","0"
"http://steamcommunity.com/profiles/76561198049521836/recommended/214340/","76561198049521836","the.simon22","http://steamcommunity.com/profiles/76561198049521836/","73 products in account","Love this game, love main character. It remembered myself games like Goblins :) Buy it and go on the jurney!","February 7, 2014","true","14.7"," 1 person found this review helpful","0","1","1","0","0"
"http://steamcommunity.com/profiles/76561198006553071/recommended/214340/","76561198006553071","Worldspawn","http://steamcommunity.com/profiles/76561198006553071/","232 products in account","When I was a kid I played Monkey Island and Indiana Jones and the Fate of Atlantis so when I spotted this game on Steam and saw the fun, easy going attitude I simply couldn't resist it.\n\nYou're playing the local celebrity(?) Rufus who's dreaming about reaching Elysium, the city in the sky and, being the genious you are there's nothing that's gonna stop you.\n\nThe game got a nice sense of humor that I found very amusing and all the dialogues have voice actors who did a really nice job. In addition to the normal adventure clicker you also get to test your wits in some mini-puzzle games in order to progress (they're optional though so if you're not into that then there's a skip button although you won't get achievement for it).\nThe controls were easy since they were just point and click, the mouse-pointer showing you the options available and the scroll-down inventory was a nice touch as well.\nAs far as difficulty goes I'd say it's a little bit easier than the Monkey Island games while still hard enough to keep it interresting.\n\nCons: Low replay value (since you already know where to go, what to do etc) and I also felt as if the game was a bit short compared to for example the Monkey Island games.\n\nHaving trouble deciding weither to give it a 4 or a 3 due to the low replay value but I'm guessing that, based on the genre, nobody really expects that to be high anyway so... *drum roll*... 4 it is!\n\n1 - Crap, don't buy\n2 - Fun for an evening\n3 - It's an alright game\n4 - Great game\n5 - One of the best I've ever played","February 9, 2014","true","13.1"," 1 person found this review helpful","0","1","1","0","0"
"http://steamcommunity.com/id/WaRc3n/recommended/214340/","WaRc3n","WaRc3n","http://steamcommunity.com/id/WaRc3n/","115 products in account","I like it because it's different and i liked the story though it's really hard and i wouldn't have passed it without some guides out there.","February 2, 2014","true","7.5"," 1 person found this review helpful","0","1","1","0","0"
"http://steamcommunity.com/id/lumrandir/recommended/214340/","lumrandir","lumrandir","http://steamcommunity.com/id/lumrandir/","328 products in account","This game would be just another horrible adventure with stupidest puzzles... if not for Rufus.","January 29, 2014","true","20.6"," 1 person found this review helpful","0","1","1","0","0"
"http://steamcommunity.com/profiles/76561198035369834/recommended/214340/","76561198035369834","ashitaka1986","http://steamcommunity.com/profiles/76561198035369834/","196 products in account","If you like monkey island then you will like this!","December 31, 2013","true","0.3"," 1 person found this review helpful","0","1","1","0","0"
"http://steamcommunity.com/id/meririm/recommended/214340/","meririm","meririm","http://steamcommunity.com/id/meririm/","178 products in account","This game is a gem. Great humor, nice story, great art style, and an absolutely unbearble hero (this is a good thing). I considered my money well spent about in the middle of the tutorial.\n\nThis is also the first point and click that I don't ragequit halfway through, I'm not a patient person, I need to be extremely interested by the story not to give up.","December 21, 2013","true","17.0"," 1 person found this review helpful","0","1","1","0","0"
"http://steamcommunity.com/profiles/76561198111540864/recommended/214340/","76561198111540864","taren.leblanc","http://steamcommunity.com/profiles/76561198111540864/","28 products in account","if you don't own this game you're missing out!","December 27, 2013","true","16.2"," 1 person found this review helpful","0","1","1","0","0"
"http://steamcommunity.com/id/drearyAve/recommended/214340/","drearyAve","DrearyAve","http://steamcommunity.com/id/drearyAve/","623 products in account","A wonderful point and click adventure game with a lovely art style to match.","December 29, 2013","true","16.6"," 1 person found this review helpful","0","1","1","0","0"
"http://steamcommunity.com/profiles/76561198095941559/recommended/214340/","76561198095941559","candiceb","http://steamcommunity.com/profiles/76561198095941559/","1760 products in account","A fun point & click adventure... not quite up to the Lucas Arts glory days, but still fun.\n\nYou play as Rufus - oxygen thief pretty much sums him up, but so much so that he ends up being likeable.  The other characters are amusing and the world is interesting - a trash heap planent, a city in the sky & hints of class warfare:  I want to know more, so guess I'm going to have to play the other 2 games in the trilogy.\n\nFor the most part, the puzzles make sense.  Where they don't & other characters don't give you helpful hints, you generally have few enough inventory items & interaction options to go through the trial & error grind without having too many murderous thoughts.  A nice touch to bypass any frustrating pixel hunting - pressing the spacebar shows you all the objects you can interact with.\n\nOverall, a nice diversion.  Not going to blow you away, but still worthwhile.","March 4, 2014","true","18.0"," 1 person found this review helpful","0","1","1","0","1"
"http://steamcommunity.com/id/electromistress/recommended/214340/","electromistress","Electromistress","http://steamcommunity.com/id/electromistress/","144 products in account","It's a fun little adventure with likeable characters and an interesting world, as long as you don't think too deep about it. If you do, the amount of nonsense beneath its surface might make your head hurt.\nPuzzles and tasks vary from very sensibile and logical to ones that just make you go through every item in your inventory to see if it works, and every now and then you'll encounter a minor bug.\nOverall a decent way to fill a boring afternoon but I don't think I'll be playing it again. If you want to buy it, wait for a sale. The 20€ price tag is ridiculous.","February 24, 2014","true","9.0"," 1 person found this review helpful","0","1","1","0","0"
"http://steamcommunity.com/id/metraf/recommended/214340/","metraf","Metraf","http://steamcommunity.com/id/metraf/","509 products in account","Nice point & click !","December 26, 2013","true","6.2"," 1 person found this review helpful","0","1","1","0","0"
"http://steamcommunity.com/profiles/76561198043279637/recommended/214340/","76561198043279637","Bruvah Noah","http://steamcommunity.com/profiles/76561198043279637/","222 products in account","Ok. I never played a lot of point-and-click adventure games in my lifetime, so its possible that my judgement isnt the best, but to me, Deponia is a just a great game. It has everything i could ever want from the genre (exept a walk-speed dial, but double clicking while the mouse is over a new area does just as well) humor, adventure, and, well, just being damn pretty to look at in some parts. yes, sometimes the animation looks a tad budgeted, it never takes away from enjoying the adventure, unless your the kind of person who cares about DEM GRAPHICS (ECK!) more than the game. 10/10 would buy again.","April 11, 2014","true","13.3"," 1 person found this review helpful","0","1","1","0","0"
"http://steamcommunity.com/id/fejsik/recommended/214340/","fejsik","fejsik","http://steamcommunity.com/id/fejsik/","725 products in account","Play time about 6h, worth to buy.\nGood old time adventure like Monkey Island or Discworld but more logical tasks.\nHumor included.","January 1, 2014","true","8.2"," 1 person found this review helpful","0","1","1","0","0"
"http://steamcommunity.com/id/pradlik/recommended/214340/","pradlik","稻草人SKⒶ®℮C®OW.cze","http://steamcommunity.com/id/pradlik/","160 products in account","I never was a big fan of point and click adventures but lately after spending few hours with Deponia or Walking Dead I really changed mind about this genre. Deponia is nicely animated game with brilliant humour and lots of challenging puzzles. Rufus himself is a pain in the ♥♥♥ for the Deponian community but you'll get to love his character and will enjoy his adventure. Can't wait to try Chaos on Deponia! 9/10","May 5, 2013","true","11.8"," 1 person found this review helpful","0","1","1","0","0"
"http://steamcommunity.com/id/meririm/recommended/214340/","meririm","meririm","http://steamcommunity.com/id/meririm/","178 products in account","This game is a gem. Great humor, nice story, great art style, and an absolutely unbearble hero (this is a good thing). I considered my money well spent about in the middle of the tutorial.\n\nThis is also the first point and click that I don't ragequit halfway through, I'm not a patient person, I need to be extremely interested by the story not to give up.","December 21, 2013","true","17.0"," 1 person found this review helpful","0","1","1","0","0"
"http://steamcommunity.com/profiles/76561198111540864/recommended/214340/","76561198111540864","taren.leblanc","http://steamcommunity.com/profiles/76561198111540864/","28 products in account","if you don't own this game you're missing out!","December 27, 2013","true","16.2"," 1 person found this review helpful","0","1","1","0","0"
"http://steamcommunity.com/id/ararat/recommended/214340/","ararat","Ararati$he","http://steamcommunity.com/id/ararat/","325 products in account","It is a very very very very very interesting quest ever!!! Different, not borring missions made us to love this game!!\nSo 10/10","July 17, 2014","true","14.8"," 1 person found this review helpful","0","1","1","0","0"
"http://steamcommunity.com/id/ElPresidente-/recommended/214340/","ElPresidente-","El Presidente","http://steamcommunity.com/id/ElPresidente-/","361 products in account","Great game with decent and difficult puzzles.","June 22, 2014","true","5.2"," 1 person found this review helpful","0","1","1","0","0"
"http://steamcommunity.com/profiles/76561198025649395/recommended/214340/","76561198025649395","Jemiide","http://steamcommunity.com/profiles/76561198025649395/","87 products in account","I really liked this game. It was funny, not too hard and not too easy with great graphics. Great way to chill out for 2 or 3 evenings. I'm on my way to 2nd part.","February 6, 2014","true","10.6"," 1 person found this review helpful","0","1","1","0","1"
"http://steamcommunity.com/id/ricotez/recommended/214340/","ricotez","Ricotez","http://steamcommunity.com/id/ricotez/","336 products in account","Beautiful artwork and a funny story. Most of the puzzles are tricky enough to have you think for a good while about what you should do next, but I've only once gotten in the situation where I could not think of anything other than trying every combination of items and actions in the hopes that one of them advances the story.\n\n\nHere's a tip: if you need something that's under another character's nose and they won't let you take it, you often need to distract them for a short while so you can snatch it.","November 1, 2012","true","10.2"," 1 person found this review helpful","0","1","1","0","0"
"http://steamcommunity.com/id/JustAGirlTX/recommended/214340/","JustAGirlTX","JaG","http://steamcommunity.com/id/JustAGirlTX/","328 products in account","If you are looking for a puzzle game, this one can be good.\nThe illustrations are nice and visually it is a great game.  Some of the interactions with objects are a little harder to find,some of the puzzles are a little confusing and the storyline is a little basic but overall it is an appealing game.\n","April 8, 2014","true","1.4"," 1 person found this review helpful","0","1","1","0","0"
"http://steamcommunity.com/id/metraf/recommended/214340/","metraf","Metraf","http://steamcommunity.com/id/metraf/","509 products in account","Nice point & click !","December 26, 2013","true","6.2"," 1 person found this review helpful","0","1","1","0","0"
"http://steamcommunity.com/profiles/76561198043279637/recommended/214340/","76561198043279637","Bruvah Noah","http://steamcommunity.com/profiles/76561198043279637/","222 products in account","Ok. I never played a lot of point-and-click adventure games in my lifetime, so its possible that my judgement isnt the best, but to me, Deponia is a just a great game. It has everything i could ever want from the genre (exept a walk-speed dial, but double clicking while the mouse is over a new area does just as well) humor, adventure, and, well, just being damn pretty to look at in some parts. yes, sometimes the animation looks a tad budgeted, it never takes away from enjoying the adventure, unless your the kind of person who cares about DEM GRAPHICS (ECK!) more than the game. 10/10 would buy again.","April 11, 2014","true","13.3"," 1 person found this review helpful","0","1","1","0","0"
