"url","reviewerUsername","reviewerDisplayName","reviewerUrl","reviewerProductsCount","reviewText","date","recommended","hoursPlayed","voteText","helpfulPercent","votesHelpful","votesTotal","votesFunny","commentsCount"
"http://steamcommunity.com/id/pkboy93/recommended/214770/","pkboy93","Pk Boy","http://steamcommunity.com/id/pkboy93/","144 products in account","you can transform into a chicken.. 20/10","March 18, 2014","true","11.0"," 1 of 2 people (50%) found this review helpful","50","1","2","0","0"
"http://steamcommunity.com/id/shady_lane/recommended/214770/","shady_lane","Pierce Ruane","http://steamcommunity.com/id/shady_lane/","440 products in account","If you love jumping puzzles and an abhorrent level of difficulty, you are in for a truly great 5-7 hours. Me, not so much.","January 3, 2014","false","4.7"," 19 of 38 people (50%) found this review helpful","50","19","38","0","0"
"http://steamcommunity.com/id/bruce_h/recommended/214770/","bruce_h","Bruce_H","http://steamcommunity.com/id/bruce_h/","166 products in account","It's a very good platform game, with an interesting and funny story, Pretty straightforward, with creative mechanics/gameplay. The game develops as you obtain new powers/moves that increase your fighting ability (beat-em-up) and also allow you to access some new areas, by breaking a block or reaching a higher platform.\n\nThis game will please the ones who don't have much pacience for hardcore enemies and puzzles, but is challenging enough for the more hardcore gamer to feel satisfied in solving a way to cross a river, climb a wall or beating a boss.\n\nI definetely recommend this game! 9 out of 10 for a casual platform game.\n\nNot sure about the price, though. I bought it on a bundle.","March 21, 2014","true","8.2"," 1 of 2 people (50%) found this review helpful","50","1","2","0","0"
"http://steamcommunity.com/profiles/76561197999131152/recommended/214770/","76561197999131152","Symbiotic","http://steamcommunity.com/profiles/76561197999131152/","395 products in account","Combo controls are very ♥♥♥♥ing unresponsive kept spamming up + d to do the uppercut and it would only work 10% of the time (with full stamina ofc).","February 20, 2014","false","0.5"," 2 of 4 people (50%) found this review helpful","50","2","4","0","0"
"http://steamcommunity.com/id/zamah5000/recommended/214770/","zamah5000","zamalazama","http://steamcommunity.com/id/zamah5000/","199 products in account","metroidvania wannabe\n\n7/10","April 21, 2014","true","9.3"," 1 of 2 people (50%) found this review helpful","50","1","2","0","0"
"http://steamcommunity.com/id/blackshark64/recommended/214770/","blackshark64","blackshark64","http://steamcommunity.com/id/blackshark64/","1207 products in account","Score: 6/10\n\nI wanted to like this game. I just can't. The art and music is great. It's metroidvania. It has good humor. It has high reviews. Yet I don't like it. I'm guessing these things wrecked it for me.\n\nControls weren't tight enough.\nI didn't care at all about the story or characters.\nThe platforming seemed somewhat punishing especially on the later jumps which involve move combos to make them.\nEventually enemies get shields that come off annoying instead of like an interesting gameplay change up.","May 25, 2014","false","4.3"," 1 of 2 people (50%) found this review helpful","50","1","2","0","0"
"http://steamcommunity.com/id/youcancleanyourkitchenbaby/recommended/214770/","youcancleanyourkitchenbaby","Mangonelson","http://steamcommunity.com/id/youcancleanyourkitchenbaby/","163 products in account","This game is awesome. It's a really fun beat'em up combined with a solid, challenging platform. One of 2013's greatest indie games!","January 18, 2014","true","9.8"," 1 of 2 people (50%) found this review helpful","50","1","2","0","0"
"http://steamcommunity.com/id/adk606/recommended/214770/","adk606","ADK","http://steamcommunity.com/id/adk606/","339 products in account","Best Side Scroller in loong time , too many easter eggs","January 21, 2014","true","11.6"," 1 of 2 people (50%) found this review helpful","50","1","2","0","0"
"http://steamcommunity.com/id/kanegreyfeather/recommended/214770/","kanegreyfeather","Stea.mPunk Bob","http://steamcommunity.com/id/kanegreyfeather/","587 products in account","https://www.youtube.com/watch?v=2bzpRc-GBd4\n\nYES. GET THIS GAME.\n\nIt's got intense platforming challenges, post game content, solid Metroidvania action. Almost all of your abilities have movement and combat utility, lots of variety in the action... it's just fantastic overall.","January 23, 2014","true","27.1"," 1 of 2 people (50%) found this review helpful","50","1","2","0","0"
"http://steamcommunity.com/id/blankachu/recommended/214770/","blankachu","blankachu","http://steamcommunity.com/id/blankachu/","107 products in account","exciting gameplay with loads of fun and different moves to unlock .","December 30, 2013","true","1.3"," 1 of 2 people (50%) found this review helpful","50","1","2","0","0"
"http://steamcommunity.com/id/rock1m1/recommended/214770/","rock1m1","Rock1m1","http://steamcommunity.com/id/rock1m1/","149 products in account","Guacamelee! is a great game mixing platforming, brawler with very pleasant visual aesthetic and quirky sense of humor. The game does well introducing you to new powers and combos on regular basis and gradually increasing your repertoire of moves, which comes to use during both: platforming and combat.\n\nI really liked most of the game, however, there are just moments of huge difficulty spikes. Most of them were due to the level design expecting way too much from the player to solve some very very tedious platforming. A good portion of the frustration was to due to that fact the controls aren't just tuned to such precision platforming required. These issues were few and far between, but enough for many players to rage quite. I hope the developers take note and make alterations for future games to avoid such bumps down the road.\n\nLucky for me, I finish my games no matter what, and I got to play through this otherwise fantastic game.","May 17, 2014","true","12.0"," 1 of 2 people (50%) found this review helpful","50","1","2","0","0"
"http://steamcommunity.com/id/stumperman/recommended/214770/","stumperman","☠Stumperman☠","http://steamcommunity.com/id/stumperman/","272 products in account","Booster from Super Mario RPG is in this game\n\n10/10","August 29, 2014","true","15.6"," 1 of 2 people (50%) found this review helpful","50","1","2","0","0"
"http://steamcommunity.com/profiles/76561198089951875/recommended/214770/","76561198089951875","man får inte vara naiv","http://steamcommunity.com/profiles/76561198089951875/","107 products in account","Pros:\n\nReferences\n\nCons:\n\nStill not enough references","April 16, 2014","true","5.9"," 2 of 4 people (50%) found this review helpful","50","2","4","0","0"
"http://steamcommunity.com/id/blackshark64/recommended/214770/","blackshark64","blackshark64","http://steamcommunity.com/id/blackshark64/","1207 products in account","Score: 6/10\n\nI wanted to like this game. I just can't. The art and music is great. It's metroidvania. It has good humor. It has high reviews. Yet I don't like it. I'm guessing these things wrecked it for me.\n\nControls weren't tight enough.\nI didn't care at all about the story or characters.\nThe platforming seemed somewhat punishing especially on the later jumps which involve move combos to make them.\nEventually enemies get shields that come off annoying instead of like an interesting gameplay change up.","May 25, 2014","false","4.3"," 1 of 2 people (50%) found this review helpful","50","1","2","0","0"
"http://steamcommunity.com/id/AveryWhite/recommended/214770/","AveryWhite","♥Retro♥","http://steamcommunity.com/id/AveryWhite/","67 products in account","Might not be much of a recommendation but, THIS GAME IS ONE OF THE BEST WITH COOL ART.AWESOMELY COOL PEOPLE MADE THIS GAME.","January 31, 2014","true","3.1"," 2 of 4 people (50%) found this review helpful","50","2","4","0","0"
"http://steamcommunity.com/profiles/76561198000215894/recommended/214770/","76561198000215894","Parrises²","http://steamcommunity.com/profiles/76561198000215894/","92 products in account","Really not what I had hoped for or expected. The only game in my steam library I regret buying.\n\nThe Good: This game is unique in that it is to my knowledge the only 2D Mexican-themed metroidvania beat-em-up in existence. For the first 1/3 of the game, you'll be thinking "wow, I've never played anything quite like this". Almost everything meshes really tightly (more on that "almost" later).\n\nSuperficially, the game is great. I am usually critical of vector/Flash art in indie games (Ed McMillan's style is ugly and unappealing to me) but this game's style is beyond well done and beautifully drawn. It really captures the luchador aesthetic, and it's refreshing to see an indie game with an art style that isn't pixel art (or Ed McMillan's John K-esque gross-out shock-art style). One aspect of this game's art that really impressed me was that it uses its bold and flamboyant colour palette to its advantage: not only do the colours highlight the setting and theme, but bright and vivid contrasts make it very easy to not lose track of your character in the brawls, even in multiplayer. A++ to the art department. Colour me impressed.\n\nThe Bad: This game's music is repetitive and unmemorable. While what there is sounds very authentic and fitting, this is a game whose music will become muted very, very quickly. It feels there should be more, but there just… isn’t.\n\nUnfortunately, beneath its shiny exterior Guacamelee! sports some very flawed game mechanics. Fighting becomes bland quickly, and about 1/3 of the way through things start to get baaad. The game tries to stave off the samey-samey-ness of the combat in ways that ultimately fall flat. Instead of increasing the (very limited) variety of enemies, the game introduces gimmicky limitations to combat that feel broken, frustratingly arbitrary, and poorly thought-out with respect to the way the characters control. They also artificially increase the difficulty to levels that border the “completely unfair / broken game design” line.\n\nA fair challenge tests mastery of game mechanics and rewards player skill. Fair challenges are not a part of the latter 2/3 of this game. In fact, some parts of this game are so stupidly difficult (the insta-death fast-spawning exploding bomb enemies for example) that I almost stopped playing. These parts of the game do not test skill; they test patience (in the worst way) and temper. Failure during these parts is almost entirely out of player control. And I do mean literally out of player control because there is virtually no damage-invincibility or ability to recover from a mistake before your character becomes a pingpong ball. And this will happen, again and again and again…\n\nThe Ugly: Good writing can be to bad game design as is brown sugar to porridge. It can make something bland into something modestly enjoyable. Unfortunately, Guacamelee!’s writing is more like finding a hair in that bowl of porridge. Sure, it might be your own hair, so there's nothing wrong with it per se, but now you really don’t want to eat any more of that porridge because ewww.\n\nOutside of combat, this game’s story is overrun by a certain style of humour. Take a long sigh out of your nose. That's really the best summary. There are a few actual jokes (setup/payoff) that did make me laugh. Unfortunately they are buried in a sea of dated and cringe-worthy internet memes (???), "references" to movies, and "call-outs" to popular videogames. Yes, that last sentence did indeed say “memes", as in "injokes" with no purpose or amusing qualities beyond "hey I know what that is lololol".\n\nFinally, the ending is an absolute joke.\n\nAnd when I say the ending is an absolute joke, I mean both that it is an out-of-nowhere, context-blind, poorly-integrated reference, and also that it is abrupt, stupid, and ultimately unsatisfying.\n\nConclusion: I really wanted to recommend this game. After playing, I felt let-down and disappointed. Give it a pass.","September 23, 2014","false","5.6"," 5 of 10 people (50%) found this review helpful","50","5","10","0","0"
"http://steamcommunity.com/id/taarpinsh/recommended/214770/","taarpinsh","Tarps","http://steamcommunity.com/id/taarpinsh/","90 products in account","Amazing and funny game.  9/10","April 22, 2014","true","0.7"," 1 of 2 people (50%) found this review helpful","50","1","2","0","0"
"http://steamcommunity.com/id/blankachu/recommended/214770/","blankachu","blankachu","http://steamcommunity.com/id/blankachu/","107 products in account","exciting gameplay with loads of fun and different moves to unlock .","December 30, 2013","true","1.3"," 1 of 2 people (50%) found this review helpful","50","1","2","0","0"
"http://steamcommunity.com/id/rock1m1/recommended/214770/","rock1m1","Rock1m1","http://steamcommunity.com/id/rock1m1/","149 products in account","Guacamelee! is a great game mixing platforming, brawler with very pleasant visual aesthetic and quirky sense of humor. The game does well introducing you to new powers and combos on regular basis and gradually increasing your repertoire of moves, which comes to use during both: platforming and combat.\n\nI really liked most of the game, however, there are just moments of huge difficulty spikes. Most of them were due to the level design expecting way too much from the player to solve some very very tedious platforming. A good portion of the frustration was to due to that fact the controls aren't just tuned to such precision platforming required. These issues were few and far between, but enough for many players to rage quite. I hope the developers take note and make alterations for future games to avoid such bumps down the road.\n\nLucky for me, I finish my games no matter what, and I got to play through this otherwise fantastic game.","May 17, 2014","true","12.0"," 1 of 2 people (50%) found this review helpful","50","1","2","0","0"
"http://steamcommunity.com/id/HexieLambent/recommended/214770/","HexieLambent","Hexie Lambent","http://steamcommunity.com/id/HexieLambent/","899 products in account","Let's just shove as many forced memes and as much internet lingo into a game as we can, make combat a bunch of button mashing (with no penalty instant respawns upon death), sprinkle in some boring dialogue for literally every character, and top it all off with a very pointlessly executed light and dark world system.  Add a side of simple but not unique visuals, and serve lukewarm.\n\nTarget audience: Reddit.  I think i counted the word "awesomesauce" at least 4 times now, along with oh... 12 epic maymay pictures ranging from GENTLEMEN to grumpy cat.  Stylized, of course.  Oh, can't forget the references like when you kill a dragon thing Super Mario Bros. style (cutting the bridge over lava with a golden axe thing) and the villain says "your princess is in another castle".\n\nEh, it's kinda fun.  The in-level music is probably the best part out of everything (and probably the most original content...).","November 16, 2013","false","1.8"," 2 of 4 people (50%) found this review helpful","50","2","4","0","0"
"http://steamcommunity.com/id/stumperman/recommended/214770/","stumperman","☠Stumperman☠","http://steamcommunity.com/id/stumperman/","272 products in account","Booster from Super Mario RPG is in this game\n\n10/10","August 29, 2014","true","15.6"," 1 of 2 people (50%) found this review helpful","50","1","2","0","0"
"http://steamcommunity.com/id/pretentiouswutangratz/recommended/214770/","pretentiouswutangratz","Me","http://steamcommunity.com/id/pretentiouswutangratz/","182 products in account","Let's do it\nLet's do it\nLet's do it\nLet's do it\n\noo-ooh, baby\nLet's do it\nTake your time\nLet's do it\noo-ooh\n\nCome on, baby\nLet's do it\nTake your time\nLet's do it\n\nYou know you ought to slow down\nYou been working too hard and that's a fact\nSit back and relax a while\nTake some time to laugh and smile\n\nLay your heavy load down\nSo we can stop and kick back\nIt seems we never take the time to do\nAll the things we want to, yeah\n\nNow, baby we can do it\nTake the time, do it right\nWe can do it, baby\nDo it tonight\n\nBaby, we can do it\nTake the time, do it right\nWe can do it, baby\nDo it tonight\n\nBaby, we can do it\nTake the time, do it right\nWe can do it, baby\nDo it tonight\n\nBaby, we can do it\nTake the time, do it right\nWe can do it, baby\nDo it tonight\n\nThe love I feel for you\nYou feel for me\nOne life is all we have to live\nOur love is all we have to give, yeah\n\nThere are so many things for us\nTo do and see, yeah\nLet's take some time to be alone\nLock the door pull out the phone, yeah\n\nAnd baby we can do it\nTake the time, do it right\nWe can do it, baby\nDo it tonight\n\nBaby, we can do it\nTake the time, do it right\nWe can do it, baby\nDo it tonight\n\nBaby we can do it\nTake the time, do it right\nWe can do it, baby\nDo it tonight\n\nBaby, we can do it\nTake the time, do it right\nWe can do it, baby\nDo it tonight\n\nTake your time\nTake the time\nTake the time\nTake the time\n\nTake your time\nTake your time\nTake your time\n\nTake your time\nOoh baby, take your time\nIf it takes all night\n\nYou can do it, you can do it\nYou can do it, alright\nYou can do it, you can do it\nTo the early morning light\n\nYou can do it, come on baby\nYou can do it all night\nTake your time, come on baby\nLet's do it tonight\n\nTake your time, baby\nAnd take all night\nYou can do it, you can do it\nCome on let's do it, do it right\n\nTake your time, ooh baby\nCome on let's do, let's do, let's do\nDon't mind, ooh baby\nYou can do it, do it right\n\nTake your time, let's do it\nIf it takes all night\nCome on baby let's do it\nTo the early morning light\n\nLet's do it, let's do it\nLet's do it, do it right\nCome on baby let's do it\nIf it takes all night\n\nCome on baby, let's do it\nLet's do it, do it right\nCome on honey let's do it\nIf it takes all night\n\nLet's do it, let's do it\nLet's do it, do it right\nCome on baby let's do it\nIf it takes all night\n\nCome on honey, let's do it\nLet's do it tonight\nWe can do it, we can do it\nLet's do it, do it right\n\nBaby we can do it\nTake the time, do it right\nWe can do it, baby\nDo it tonight\n\nBaby we can do it\nTake the time, do it right\nWe can do it, baby\nDo it tonight\n\nBaby we can do it\nTake the time, do it right\nWe can do it, baby\nDo it tonight\n\nBaby we can do it\nTake the time, do it right\nWe can do it, baby\nDo it tonight\n\nBaby we can do it\nTake the time, do it right\nWe can do it, baby\nDo it tonight\n\nBaby we can do it\nTake the time, do it right\nWe can do it, baby\n\nSongwriters\nHARRIS, JAMES SAMUEL III/LEWIS, TERRY/KNOTT, ALICIA RENEE\n\nPublished by\nLyrics © Sony/ATV Music Publishing LLC","December 19, 2015","true","2.8"," 3 of 6 people (50%) found this review helpful 3 people found this review funny","50","3","6","3","2"
"http://steamcommunity.com/id/Zelter/recommended/214770/","Zelter","Zelter","http://steamcommunity.com/id/Zelter/","206 products in account","DO YOU LIKE MEMES? WELL HERE'S A BUNCH, THEY'RE FUNNY RIGHT!?!\n\nHave fun doing the same 3 hit combo over and over, because it's all you can do.\n\nMusic and visuals weren't as bad, but that's not saying much.\n\nIt's not even Metroidvania. It's a clear path, with a pretty obvious side path here and there. That's like saying Bioshock Infinite was Metroidvania. Just because it has a map and a TINY amount of backtracking and a few optional rooms, doesn't mean it's Metroidvania. Wanna see Metroidvania? Go play Metroid or Castlevania: SotN.\n\nGame is terrible. 2/10.","August 4, 2014","false","11.0"," 2 of 4 people (50%) found this review helpful 1 person found this review funny","50","2","4","0","0"
"http://steamcommunity.com/id/cocade/recommended/214770/","cocade","Sprout","http://steamcommunity.com/id/cocade/","94 products in account","Aesthetically, Guacamelee is an excellent game. The art and music are tantilizing and fun and the game story line is clever. Unfortunately, everything disolves into a series of unforgivingly difficult jumping puzzles. I'm sure a handheld controller would make life so much simpler, but I don't have that luxury. Instead, I'm stuck with THE WORST mouse and keyboard controlled game ever. Especially for Macs. The more moves you learn, the more hysterically complex and meddening maneuvering in this game becomes. The puzzles aren't hard to figure out, but they incredibly frustrating to execute.","July 15, 2014","false","0.6"," 3 of 6 people (50%) found this review helpful","50","3","6","0","0"
"http://steamcommunity.com/id/zarigis/recommended/214770/","zarigis","Zarigis","http://steamcommunity.com/id/zarigis/","322 products in account","I had an enjoyable first 2 hours of gameplay, however with a color-coded combat mechanic introduced halfway through I was no longer able to continue playing due to being red-green colorbind.\nDisappointing and frustrating, developers really need to get their act together on this sort of thing.","March 1, 2014","false","1.5"," 10 of 20 people (50%) found this review helpful","50","10","20","0","0"
"http://steamcommunity.com/id/twobrothersinavan/recommended/214770/","twobrothersinavan","SCBD (♥)","http://steamcommunity.com/id/twobrothersinavan/","518 products in account","I have never been one for Metroidvania games. That genre has always been too punishing and bland for me. I see the appeal, but for me, it never lasts.\n\nGuacamelee is firmly in that genre, and somehow I love it. Maybe it's the prevalence of save points. Maybe it's the fighting system that rewards variety and reflexes instead of perfect aim and conservation of ammo. Maybe it's just the amazing luchadores. I have never played a game in a world of luchadores, and I'm not sure one has ever been made before this.\n\nThere's a well-told story in a unique setting, an engaging combat system, a high level of difficulty, and a couple hundred in-jokes. There are also tons of secrets to find, dozens of challenges to beat, and a bevy of achievements with varying levels of impossibility. All told, this is a great game for fighter/platformers with a good deal of reward for those who like exploring.","January 31, 2014","true","17.4"," 1 of 2 people (50%) found this review helpful","50","1","2","0","0"
"http://steamcommunity.com/profiles/76561198089951875/recommended/214770/","76561198089951875","man får inte vara naiv","http://steamcommunity.com/profiles/76561198089951875/","107 products in account","Pros:\n\nReferences\n\nCons:\n\nStill not enough references","April 16, 2014","true","5.9"," 2 of 4 people (50%) found this review helpful","50","2","4","0","0"
"http://steamcommunity.com/id/taarpinsh/recommended/214770/","taarpinsh","Tarps","http://steamcommunity.com/id/taarpinsh/","90 products in account","Amazing and funny game.  9/10","April 22, 2014","true","0.7"," 1 of 2 people (50%) found this review helpful","50","1","2","0","0"
"http://steamcommunity.com/profiles/76561198028253012/recommended/214770/","76561198028253012","Ghin","http://steamcommunity.com/profiles/76561198028253012/","327 products in account","In this game you play as a mexican wrestler superhero who suplexes chupacabras. Do I really need to say more than that? The only bad thing about this game is that there isn't more of it.","August 14, 2013","true","30.0"," 1 of 2 people (50%) found this review helpful","50","1","2","0","0"
"http://steamcommunity.com/id/frostytsb/recommended/214770/","frostytsb","Frostytsb","http://steamcommunity.com/id/frostytsb/","304 products in account","if you like 2d side-scrolling beatem ups, then Guacamelee! is for you. it's graphics and overall designe has a nice charm that not many games have now a days, i personaly recomend picking this game up","August 10, 2013","true","2.1"," 1 of 2 people (50%) found this review helpful","50","1","2","0","0"
"http://steamcommunity.com/id/ValterPussyCat/recommended/214770/","ValterPussyCat","Válter <PussyCat>","http://steamcommunity.com/id/ValterPussyCat/","434 products in account","Guacamelee is a  platformer side scroll - a genre that i really enjoy - here in play the role of Mexican fighter, and he will save his sweetheart, and fight against some weird but fun enemies.\n\nGuacamelee is very enjoyable game but is bit hard to play, the combos sometimes don't do well also the controls don't respond on exact time. Also i HIGHLY recommend you play this game with a controller, because with keyboard and mouse you will get a though time.\n\nStory is very typical, hero saving the day, rescuing is girl and all bad guys are defeated, but is still fun to play, also this game have a really good jokes between the main charterer and is "mentor".\n\nThe combat system is the highlight for me, very good very nice combos, also during the story mode you will get new techniques and ability to help during your journey. Best of all, if you have friend in your house at any time he can join you - yes because this game doesn't support online COOP - and help you on your journey.\n\nBoth OST and scenarios are great, the OST really fits the gameplay in general, Mexican and stuff and scenarios are full of colors and well design. About the replay value on this game, you have two choices: after beating the final boss you can collect the rest of the mask and do the side quests witch are few, about 5/6 or you can try the hard mode, witch can be a good challenge.\n\nWell that it, with no doubt Guacamelee deserve every cents that you spend on it. Totally recommend it.\n\n~ 9/10","December 28, 2013","true","7.8"," 2 of 4 people (50%) found this review helpful","50","2","4","0","0"
