"url","reviewerUsername","reviewerDisplayName","reviewerUrl","reviewerProductsCount","reviewText","date","recommended","hoursPlayed","voteText","helpfulPercent","votesHelpful","votesTotal","votesFunny","commentsCount"
"http://steamcommunity.com/id/GenC/recommended/214770/","GenC","General Chaøs™","http://steamcommunity.com/id/GenC/","630 products in account","This game is a very well done game that was ported over from the consoles to the pc. The controls are very fluid,the graphis are easy on the eyes, the combat is fun and the adventuring keeps you wanting to play.Game runs very smoothly at all sections in it and the music keeps up with the pace of the game.The story is not great but not bad, is something kids might find more entertaining than adults,but better than nothing at all.\n\nThe combat in the game works like a beatem up where you can do combo's and after unlocking, use various skills which become part of your arsenal to take down mobs.There are boss fights which are a lot of fun and entertaining and though out quite well. Outside of the combat moves you can unlock there are different outfits which give different stats when you wear them.The adventuring is fun because all of the locations are unique to one another including the other dimension versions of each.Great care was done to the enivornments and locations to make them not reptitive in looks ,feel and play styles.\n\nThe only thing and I mean the only thing about this game they I cannot stand are the very few , and I mean very few puzzle-platform areas that will keep you doing them over and over again. I encountered three areas in the game that thanks to my patience I manged to do but two of the area's took me 30-45min to do soley because of constantly messing up. The third area is an area in which the puzzle is a long vertical jump,run,jump,climb,etc portion.After trying my hand at it for literally 5 hours of total gameplay time I decided I had enough with the game and uninstalled it.\n\nAside from the three area's I ran into I loved the game, but I will say this as a warning about those areas.\n\nFinal Thoughts\nIf you want to play a very actiony beatem up, platform puzzle game,can deal with a few sections you will have to try and try again to do, you will enjoy the game. I got about 2/3 the way finished before I had enough of the 3rd puzzle are that had me at bay and uninstalled. Enjoy my time with the game and it was lots of fun. You will have a blast.\n\n","February 15, 2014","true","17.0"," 2 of 2 people (100%) found this review helpful","100","2","2","0","0"
"http://steamcommunity.com/id/Levyne/recommended/214770/","Levyne","Levyne","http://steamcommunity.com/id/Levyne/","141 products in account","Fun little game. It has a decent mix of combat, platforming, music, and visuals. None of these things on their own is super exceptional, but as a whole it comes together pretty damn well, and it has an aesthetic that is pretty damn unique. It's also fairly  challenging at times, and short enough to encouraged re-plays or speed runs, which is cool if you are into that sort of thing.\n\nIf you recently got it from a bundle, I encourage you to spend a couple sessions giving it a go. It's a complete enough package that I think most people will find something about it that they enjoy!","March 6, 2014","true","9.5"," 2 of 2 people (100%) found this review helpful","100","2","2","0","0"
"http://steamcommunity.com/id/kavonhazo/recommended/214770/","kavonhazo","dumbuni","http://steamcommunity.com/id/kavonhazo/","51 products in account","I love this game because of it's creative level design, great controls, awesome combos, many collectables, and earning new abilities as you progress through the game. This version of the game even allows you to develop your own character if you have Flash.","March 12, 2014","true","48.0"," 2 of 2 people (100%) found this review helpful","100","2","2","0","0"
"http://steamcommunity.com/id/alankarnil/recommended/214770/","alankarnil","dasturdly_frog","http://steamcommunity.com/id/alankarnil/","233 products in account","Great looking game, fun music and art style.\nYou will love playing this until the hardcore\nplatforming which will make you want to throw your\ncomputer out of the window.\n\n10/10 Not Bad - IGN","February 20, 2014","true","5.9"," 2 of 2 people (100%) found this review helpful","100","2","2","0","0"
"http://steamcommunity.com/id/drdraino/recommended/214770/","drdraino","Blood_Wraith","http://steamcommunity.com/id/drdraino/","681 products in account","A pretty challenging and colorful game with interesting bosses and a great combat system.","May 13, 2014","true","6.5"," 2 of 2 people (100%) found this review helpful","100","2","2","0","0"
"http://steamcommunity.com/id/pepinko/recommended/214770/","pepinko","pEpinko","http://steamcommunity.com/id/pepinko/","228 products in account","Great Metroidvania! I think games should be challenging, but not too difficult and frustration. Except for one boss fight (yes, I mean Jaguar), this game nailed it. Some parts are hard, but with every try you make little progress and it is satisfying to finally beat it. Music and visual art are fantastic, they are original and really work with overall Mexican theme.","April 29, 2014","true","19.8"," 2 of 2 people (100%) found this review helpful","100","2","2","0","0"
"http://steamcommunity.com/id/Lordandkingofcheesyinsanity/recommended/214770/","Lordandkingofcheesyinsanity","Chillin Chocolate","http://steamcommunity.com/id/Lordandkingofcheesyinsanity/","50 products in account",""Chickens are some cocky motherf*ckers"\n- Me when I was beating up the chickens (pun is intended)\n\nGuacamelee! is about a mexican agave farmer named Juan Aguacate, who becomes a luchador and sets out to save the world when El Presidente's Daughter is kidnapped by an evil charro skeleton named Carlos Calaca. Though the strong point in this game is the combat. But as I always do, I'll start off with the story.\n\nStoryline:\nIt's alright and other than that there's nothing else to say about it. It's not special, but not bad. And that's all what I can say about the story.\n\nCharacters:\nThey 'aight. There's also is a goat/guy who I would be alright with if he was my dad......but then I would be Daniel Bryan.......Nevermind then.\n\nPlatforming:\nIt's hard and it challenges you how to beat it. It could be simple as jumping to small floating platforms to changing dimensions and dashing herpderping, rooster uppercutting, double jumping, goat climbing, goat flying, turning into a chicken, jumping, and then landing on the checkpoint. Hard, rewarding, and good at the same time.\nGG, Drinkbox Studios, GG.\n\nWham! Bam! And Slam! Combat:\n(They dont actually call the call the combat "Wham! Bam! And Slam! Combat", but I just thought of it and had to put it in)\nAnyways, the combat is just awesome. Grabbing my enemies and piledrivering them to rocks was more fun than I imagined. And booting them off a cliff to their deaths. You just have to see how good the combat is. Fun and hard enough that's it's not a breeze.\n\nAbilties:\nFun to do and usefull in combat. Goat flying into a skeleton's skull has never been more satisfying.\n\nEaster Eggs:\nThis game has alot of them. If you want to see some just go into my Guacamelee! screenshots and see them, but if you're thinking of getting this game. Dont spoil all of them for yourself. I loved each and every references this game had in it.\n\nEnding statements:\nThis game is fun, hard, challenging, rewarding, and good game to play through in your spare time. So If you're looking for a small game where you're a luchador in a 2D world that can bashing skeleton's head in a f#cking wall. Then this is your game, senoir.\n\n6.8/10\n*Mexican Gaben voice*\nGracias! y divertirse!","May 2, 2014","true","19.0"," 2 of 2 people (100%) found this review helpful","100","2","2","0","0"
"http://steamcommunity.com/id/derkbeefhammer/recommended/214770/","derkbeefhammer","Derk Beefhammer.","http://steamcommunity.com/id/derkbeefhammer/","183 products in account","Awesome Metroid-vania style action platformer with a great Mexican cultural background!","May 4, 2014","true","2.6"," 2 of 2 people (100%) found this review helpful","100","2","2","0","0"
"http://steamcommunity.com/id/SpruceBruce/recommended/214770/","SpruceBruce","SpruceBruce","http://steamcommunity.com/id/SpruceBruce/","175 products in account","Simply put, this game is really freaking fun.  The humor throughout the game is great, the play mechanics are well designed, and you always have a sense of accomplishment playing the game.  They do a good job of constantly pushing both the story and your powerset along.\n\nIf you enjoy the Metroid-esque play style at all, you should buy this game.","January 31, 2014","true","12.7"," 2 of 2 people (100%) found this review helpful","100","2","2","0","0"
"http://steamcommunity.com/id/wyldw3st/recommended/214770/","wyldw3st","Wyldw3st","http://steamcommunity.com/id/wyldw3st/","1575 products in account","This is one of the most fun, and at times quite intense, platformers I have played, ever.  I have seen this game on sale numerous times and have passed on it, and after playing it, I want to go back and punch myself for not picking it up sooner.  The beat-em-up gameplay was quite refreshing, and the Mexican setting and tone of the game was also quite different, yet very nice, especially the music.  There are at times some very tricky parts that require quite a bit of paying attention and timing to get through, and that goes double for most of, if not all, the boss fights.  Overall, this is a very fun, refreshing, and rewarding game.  Definitely worth the full price.","February 20, 2014","true","6.4"," 2 of 2 people (100%) found this review helpful","100","2","2","0","0"
"http://steamcommunity.com/id/jigamufenuf/recommended/214770/","jigamufenuf","Jigamufenuf","http://steamcommunity.com/id/jigamufenuf/","56 products in account","This game... Jesus Christ this game! What can I say? This is the ♥♥♥♥. Amazing art, funny characters, well-written plot, beautiful soundtrack, custom skins, an a crap load of refrences to video games and memes. This is defenently a game you should try out.","June 3, 2014","true","12.0"," 2 of 2 people (100%) found this review helpful","100","2","2","0","0"
"http://steamcommunity.com/id/blakyle/recommended/214770/","blakyle","Blackyle","http://steamcommunity.com/id/blakyle/","177 products in account","Diamond in the Rough, this is the best phrase I can come up with to describe this game. Stylish, fast paced, tight controls, difficulty, appealing characters, a good sense of humor, and a great sountrack are only some of what this game brings to the table, which is a lot. This game grabed me in its' steely luchador grasp and didn't let go until it had played out its story in full glory. The tight control scheme is the ground work for this awesome action side scrolling title. The easy-to-pull-off combos and simplicity of linking them together makes this games fight sequences not only enjoyable to play, but also to watch. The controls don't only extend to the fighting, the platforming is also top notch. Coming from a platforming background, I was pleasantly surprised with the difficulty in some of the optional areas. It definietly put my skills to the test, but fear not, the controls are such that any mistake is on the player and it's pretty obvious when you make an error. From the comical characters and their interactions, to the endgame battles and platforming, the only thing this game doesn't nail, is it's name. Other than that, do yourself a favor and buy this game. You won't be disapointed!!!","July 6, 2014","true","15.7"," 2 of 2 people (100%) found this review helpful","100","2","2","0","0"
"http://steamcommunity.com/id/Shubnigg/recommended/214770/","Shubnigg","Shub-niggurath","http://steamcommunity.com/id/Shubnigg/","434 products in account","I can't count yet how many easter eggs this game have, the one from journey was hilarious!","April 14, 2014","true","9.5"," 2 of 2 people (100%) found this review helpful","100","2","2","0","0"
"http://steamcommunity.com/id/yossarianlives/recommended/214770/","yossarianlives","Yossarian","http://steamcommunity.com/id/yossarianlives/","328 products in account","I used to see this game advertised on Steam and think it couldn't be any good. Boy, was I wrong.\n\nThis is truly a little gem. I got it from a humble bundle and decided to try it out just for the hell of it. Ten minutes later, I was hooked. The game plays extremely well, and it's just a LOT of fun. Combat is very satisfying, controls are responsive, artwork is lovely and full of references and humor that'll constantly put a smile on your face.\n\nI started playing with my girlfriend, an aspiring gamer, and Guacamelee proved an immersive, delightful, and easy enough experience (the simple parts at least) that she REALLY enjoyed, and so did I. Even when the game got quite tricky - which it does - and she couldn't help, she stood there, rooting for Juan. Truth be told, we actually ended up going to a mexican restaurant after a playing session, that's how much addicted we were (and still are!) to the whole setting, almost immediately after starting the game.\n\nI also don't think I've ever felt interested enough in getting all the achievements before Guacamelee. They are not too many, and are quite feasible, which I find a very smart strategy: it makes me want to come back again and again after having finished it, instead of putting me off because of the sheer impossibility of completion.\n\nThis is one of the best gaming experiences I've ever had.","March 8, 2014","true","22.6"," 2 of 2 people (100%) found this review helpful","100","2","2","0","0"
"http://steamcommunity.com/id/Steele1234123121/recommended/214770/","Steele1234123121","~~~~~~~~~~~","http://steamcommunity.com/id/Steele1234123121/","742 products in account","Guacamelee, without a doubt, is the best Metroidvania I've ever played, excluding any Metroid or Castlevania games. From the get go you're presented with a cool Luchadore theme, and tight controls. The game picks up heat pretty fast, and soon you transform from average farm worker to a luchadore, a hero of the people. This game follows the metroidvania tradition very well. You have areas to revisit, powerups unlockble through the game, and a 2D world to explore. The game is so much fun, you'll lose hours jumping and punching enemies. This game also has a great sense of humor, and has tons of references, like nods to Castle Crashers, Mario, Metroid, Mega Man, and even TF2. It also references a bunch of memes, which kinda get on my nerves, seeing things like Insanity Wolf or Me Gusta staring back at you.\n\nHowever, every game has faults, and this game is chock full of them. First of all, the platforming will frustrate you to no end. Some of the platforming requires a lot of timing and fast reflexes. There were many times I almost went insane doing it. The game is short, but the time you get to have is great. I recommend using a controller for this, as a keyboard can really frustate you. I mapped all my keyboard controls to odd things, whicvh made the combat harder and the platforming as hard as well. Some things, like the sparring bot, just get ridiculous to use when you have your keyboard controls mapped to wild locations.\n\nDespite its flaws, this game is very enjoyable, and easy to play. I'm looking forward to whatever this company puts out next. It may be hard to believe, but this is easily one of the most fun games I've played this year.","December 29, 2013","true","5.6"," 2 of 2 people (100%) found this review helpful","100","2","2","0","0"
"http://steamcommunity.com/profiles/76561198034289354/recommended/214770/","76561198034289354","StayPuftMarshMan","http://steamcommunity.com/profiles/76561198034289354/","120 products in account","WHERE HAVE YOU BEEN??????????","December 27, 2013","true","2.6"," 2 of 2 people (100%) found this review helpful","100","2","2","0","0"
"http://steamcommunity.com/id/killerpain71/recommended/214770/","killerpain71","Killerpain71","http://steamcommunity.com/id/killerpain71/","172 products in account","You play as juan. a humble agave farmer who is in love with El Presidente's Daughter. When an evil charro skeleton named Carlos Calaca attacks the village and kidnaps El Presidente's Daughter, Juan is killed during his attempt to stop him and winds up in the land of the dead. There, a mysterious wrestler named king gives Juan a mysterious mask that transforms him into a powerful wrestler and brings him back to the world of the living. Now you must use the spirit and power of the mighty wrestler king to win the King of the Iron Fist Tournament but also beating Carlos Calaca and rescueing the El Presidente's Daughter.\n\n(But seriously, the game is good. Go get it if you have the money.)","June 25, 2014","true","4.6"," 2 of 2 people (100%) found this review helpful","100","2","2","0","0"
"http://steamcommunity.com/id/BlazeOrangeDeer/recommended/214770/","BlazeOrangeDeer","BlazeOrangeDeer","http://steamcommunity.com/id/BlazeOrangeDeer/","246 products in account","Best platformer I've played in a long time. Metroid-style exploration and upgrades are awesome and the combat is very fun. The hidden levels are challenging but rewarding, the art style is amazing and it gives the whole game a lot of personality. 5/5","January 4, 2014","true","13.0"," 2 of 2 people (100%) found this review helpful","100","2","2","0","0"
"http://steamcommunity.com/id/chimleys/recommended/214770/","chimleys","BlizzardKilla","http://steamcommunity.com/id/chimleys/","67 products in account","Holy ♥♥♥♥ so good i bought it twice (maybe more)","December 27, 2013","true","2.2"," 2 of 2 people (100%) found this review helpful","100","2","2","0","0"
"http://steamcommunity.com/id/darkin20/recommended/214770/","darkin20","Darkin20","http://steamcommunity.com/id/darkin20/","1426 products in account","I really liked ths game. Has a lot to offer and lots of bonus things you can do. It really ramps up the difficulty in some areas but most of those are optional. It also has hidden tribute to many other games along the way.","May 23, 2014","true","10.3"," 2 of 2 people (100%) found this review helpful","100","2","2","0","0"
"http://steamcommunity.com/id/unitedkhanate/recommended/214770/","unitedkhanate","METALFIRTINA","http://steamcommunity.com/id/unitedkhanate/","135 products in account","Ne varsa bağımsız yapımcıda var harika oyun humble bundledan 1 dolara alın oynayın","April 15, 2014","true","2.1"," 2 of 2 people (100%) found this review helpful 1 person found this review funny","100","2","2","0","2"
"http://steamcommunity.com/id/albertrayon/recommended/214770/","albertrayon","albertrayon","http://steamcommunity.com/id/albertrayon/","1581 products in account","Guacamelee is an action platform, of the Metroidvania variety. You play a Mexican Luchadore, fighting the forces of evil to save your love and the world. Along the way you will explore varied areas, learn new abilities, and fight a multitude of enemies.\n\nGuacamelee is a game that is just oozing style. Everything from the artwork, to the sound, the writing, the characters and the world at large mesh so well together. You will want to spend time exploring the world and talking to its inhabitants. The towns are packed with humor and things to find.\n\nThe controls are as tight as they need to be for an action platformer. I played using a 360 pad, and would recommend using a gamepad. After learning new abilities, you will have to combine all your powers to advance in the later stages. I was really amazed at the combinations I could pull off toward the endgame.\n\nI do have one complaint, which falls under performance and controls. Originally it felt like the game moved super fast, and I was having trouble pulling off basic combos and fighting some of the early enemies. One sequence in particular, where you must run in sidescroller fashion from a destructing environment, felt like it was moving way too fast. I was only able to pass it after about 20 attempts. Later I learned that there can be a bug with the vsync that basically doubles the speed of the game. Turning off vsynce solves the problem, however it will lead to some graphical glitches along the way. I found it a small price to pay for a playable game. After playing about the first quarter of the game at double speed, later platforming sections felt pretty easy in comparison.\n\nBeyond my one small complaint above, I was enamored by everything else in Guacamelee. It was fun to explore, fun to see what was next, fun to fight the enemies, and just plain fun overall. I would welcome a sequel, since it feels like there are so many places for this series to go. I see that a rerelease just came out with some new levels, and while I would prefer an entirely new game, eventually I may give that a shot as well.\n\nI completely recommend Guacamelee. While it has received heavy praise so it wasn't a complete surprise, it really exceeded my expectations. At this point you may want to purchase the newer version if you haven't played it yet, but if this game is already sitting in your backlog, move it to the front of the list.\n\nGrade: A","September 8, 2014","true","12.7"," 2 of 2 people (100%) found this review helpful","100","2","2","0","0"
"http://steamcommunity.com/id/brianhaskell/recommended/214770/","brianhaskell","HD Brian","http://steamcommunity.com/id/brianhaskell/","207 products in account","Amazing game! If you like any Metroidvania game, you'll love this game.","October 19, 2014","true","43.2"," 2 of 2 people (100%) found this review helpful","100","2","2","0","0"
"http://steamcommunity.com/id/TheAlmightyBant/recommended/214770/","TheAlmightyBant","Banty Oakley","http://steamcommunity.com/id/TheAlmightyBant/","247 products in account","Very good game. Some of the enemies are a bit of a pain, but I'm sure that that was intended. Also a bit of the platforming was difficult. Overall I thought it was very fun and rewarding. 100% on my first playthrough, and I'd reccomend doing the same. I'd say its a solid 9/10","October 30, 2014","true","10.2"," 2 of 2 people (100%) found this review helpful","100","2","2","0","0"
"http://steamcommunity.com/id/philomory/recommended/214770/","philomory","philomory","http://steamcommunity.com/id/philomory/","229 products in account","What can I say? It's a charming, engaging Metroidvania that controls like a brawler and looks like a fiesta. Buy it. Play it. Live it. Love it.\n\nSeriously, it's amazing.","October 31, 2014","true","42.5"," 2 of 2 people (100%) found this review helpful","100","2","2","0","0"
"http://steamcommunity.com/id/carahyba/recommended/214770/","carahyba","Carahyba ☭","http://steamcommunity.com/id/carahyba/","111 products in account","I really really love Guacamelee! It's perfect in every single piece.\n\nGraphics - 10/10\nSounds - 10/10\nMusic - 10/10\nEntertaining - 10/10\nChallenging - 10/10\nStory - 10/10","December 1, 2014","true","13.2"," 2 of 2 people (100%) found this review helpful","100","2","2","0","0"
"http://steamcommunity.com/profiles/76561198114471386/recommended/214770/","76561198114471386","Bobbysan","http://steamcommunity.com/profiles/76561198114471386/","69 products in account","Best chicken simulator 2014, 10/10","October 1, 2014","true","17.0"," 2 of 2 people (100%) found this review helpful","100","2","2","0","0"
"http://steamcommunity.com/id/tenshi_BLA/recommended/214770/","tenshi_BLA","Tenshi [BLA]","http://steamcommunity.com/id/tenshi_BLA/","542 products in account","So far it's great... analogies to the old metroid, great graphics!\n\nCan't wait to try multiplayer!","October 16, 2014","true","0.5"," 2 of 2 people (100%) found this review helpful","100","2","2","0","0"
"http://steamcommunity.com/id/Gru02/recommended/214770/","Gru02","Gruu","http://steamcommunity.com/id/Gru02/","911 products in account","Fun theme/game. Though platforming may be a bit frustrating for some ;>","October 11, 2014","true","16.1"," 2 of 2 people (100%) found this review helpful","100","2","2","0","0"
"http://steamcommunity.com/id/ignos55/recommended/214770/","ignos55","Ignos","http://steamcommunity.com/id/ignos55/","1397 products in account","in my oppinion this is one of the best indie games ever, great gameplay, good difficult and awesome art","November 28, 2013","true","19.2"," 2 of 2 people (100%) found this review helpful","100","2","2","0","0"
