"url","reviewerUsername","reviewerDisplayName","reviewerUrl","reviewerProductsCount","reviewText","date","recommended","hoursPlayed","voteText","helpfulPercent","votesHelpful","votesTotal","votesFunny","commentsCount"
"http://steamcommunity.com/profiles/76561198108092454/recommended/214770/","76561198108092454","MrBonev","http://steamcommunity.com/profiles/76561198108092454/","41 products in account","OUTSTANDING art style!\nGameplay can get a bit BORING after a while.\nUnless it's on sale, buy another game!","April 3, 2014","true","1.4"," 1 person found this review helpful","0","1","1","0","0"
"http://steamcommunity.com/profiles/76561197997506993/recommended/214770/","76561197997506993","Charha","http://steamcommunity.com/profiles/76561197997506993/","506 products in account","Me gusta guavas! Guacamelee is the most fun I've had in a co-op platformer/beat 'em up in a very long time. This game is genuinely funny, a little insane, hard enough for a couple of ragequits and what's best, it's full of juicy internet meme references. If you like the genre, this one is definitely worth your time.\n\nIt's recommended to use a controller, but it's fine with a keyboard as well. If the game feels hard, bring a friend. You'll have fun activating your chicken powers together.","June 7, 2014","true","41.6"," 1 person found this review helpful","0","1","1","0","0"
"http://steamcommunity.com/id/ActuallyHex/recommended/214770/","ActuallyHex","Actually Hex","http://steamcommunity.com/id/ActuallyHex/","193 products in account","muy bueno","August 30, 2014","true","11.6"," 1 person found this review helpful","0","1","1","0","0"
"http://steamcommunity.com/id/bigjmcnasty/recommended/214770/","bigjmcnasty","Big J McNasty","http://steamcommunity.com/id/bigjmcnasty/","258 products in account","I'm actually buying an UPDATED version of the same game. That pretty much sums up how good it is.","August 27, 2014","true","13.5"," 1 person found this review helpful","0","1","1","0","0"
"http://steamcommunity.com/profiles/76561198026882262/recommended/214770/","76561198026882262","SnapemOne","http://steamcommunity.com/profiles/76561198026882262/","209 products in account","I love the mexican-ness in this game... it makes me want to make a fat tray of nachos and enjoy some mucho relaxo","August 25, 2014","true","14.4"," 1 person found this review helpful","0","1","1","0","0"
"http://steamcommunity.com/id/BiggNife/recommended/214770/","BiggNife","BiggNife","http://steamcommunity.com/id/BiggNife/","363 products in account","This game is an underrated gem.  The visuals are fantastic and fluid, the combat is juuuuust deep enough to keep things interesting, and the solid controls/jump physics make platforming fun.  The only complaints I have are that 1) the humor is very hit-or-miss (I could really do without the outdated meme references), and 2) the post-game content can get brutal - like, Super Meat Boy Dark World brutal.  Still, highly recommended and the best Metroidvania I've played in ages.","November 25, 2013","true","6.1"," 1 person found this review helpful","0","1","1","0","0"
"http://steamcommunity.com/id/bingostar826/recommended/214770/","bingostar826","bingostar826","http://steamcommunity.com/id/bingostar826/","668 products in account","Really fun with tight controls! a "metroidvania" game that isn't afraid to make you laugh at the subtle (and not so subtle) jokes!\n","August 11, 2013","true","9.8"," 1 person found this review helpful","0","1","1","0","0"
"http://steamcommunity.com/id/immaeatyofaec/recommended/214770/","immaeatyofaec","Spooky Boogie","http://steamcommunity.com/id/immaeatyofaec/","374 products in account","I must say I am plesantly surprised here. I went out on a limb and picked this up because it was on sale and came with another game in the bundle. What I didn't expect was for the game to have a very well done plot, fluid and responsive controls, beautiful visuals, numerous game references, and interesting characters. I'm still only a few hours in, but I am already hooked and I believe it was well worth the 13 dollars and change.","August 9, 2013","true","2.1"," 1 person found this review helpful","0","1","1","0","0"
"http://steamcommunity.com/id/febel/recommended/214770/","febel","Febel","http://steamcommunity.com/id/febel/","571 products in account","Old school beat-'em-up with strong, STRONG overtones of metroidvania style gameplay and backtracking. Generally speaking it's loads of fun and it looks absolutely gorgeous because the aesthetic is drenched in mexican culture, primarily the Dios de las Muertos. The only downsides are it basically requires you to have a controller as some of the later fights are damn  near impossible with keyboard controls alone. There are also some extremely demanding platforming/jump timing sections in order to get life/stamina expansions that are possible to get early on but are so incredibly difficult to do so that you'll likely end up saying "Screw it, I'll come back later" and when you do with later upgrades you'll find them to be incredibly easy. Overall one of the best metroidvania games on steam and unquestionably one of the most stylish. If you have a controller to use with your PC then I can't recommend this enough, if not you may want to give this a pass. 8/10","November 12, 2013","true","3.5"," 1 person found this review helpful","0","1","1","0","0"
"http://steamcommunity.com/id/meepus/recommended/214770/","meepus","meepus","http://steamcommunity.com/id/meepus/","262 products in account","This game is like Viewtiful Joe meets Zelda 2 in the best way possible. The aesthetics are all top notch, the control is fantastic with the xbox 360 gamepad, and the folksy Mexican humor is charming. It is viscerally satisfying to be an undead luchador dressed up in a chicken suit, beating the crap out of bandito skeletons. Drop-in co-op makes this an excellent game to enjoy with a friend.","November 25, 2013","true","2.8"," 1 person found this review helpful","0","1","1","0","0"
"http://steamcommunity.com/id/nitronack369/recommended/214770/","nitronack369","Mr. Sideburns","http://steamcommunity.com/id/nitronack369/","29 products in account","With a mix of Beat 'Em Up brawler and Metroidvania, Guacamelee is incredibly fun to play. Finding upgrades is exciting, but using those upgrades to find secrets is very rewarding. Chaining combos is very fun, and boss fights are just challenging enough to make you keep playing until you've beat them. The story is enjoyable to watch, and each character brings their own personality to the table, making dialogue very fun to read. With a headboppin' soundtrack to boot, Guacamelee is a purchase you won't regret!","June 21, 2014","true","18.4"," 1 person found this review helpful","0","1","1","0","0"
"http://steamcommunity.com/id/legitdk/recommended/214770/","legitdk","LegitDK","http://steamcommunity.com/id/legitdk/","127 products in account","Really fun game overall! Great art style and the music really fits the theme of the game overall. Controls are pretty clunky if you're going to play on a keyboard. Controller is highly recommended.\n\n10/10 would beat Mexican virgin sacrificer again.","June 18, 2014","true","6.0"," 1 person found this review helpful","0","1","1","0","0"
"http://steamcommunity.com/id/GamerMcbaggin/recommended/214770/","GamerMcbaggin","Gamer "I have No Shame" McBaggin","http://steamcommunity.com/id/GamerMcbaggin/","426 products in account","Great side scroller beat them up. The combat feels really good and responds well. Dodge mechanic takes some getting used too. Platforming may be tough some times but is fun. Lots of secrets to uncover. Story is entertaining and the humor is okay at times. Very fun and I do reccomend. Short game tho , do not buy over $10\nAlso you can play as bayonetta and thats cool.\n","July 1, 2014","true","10.3"," 1 person found this review helpful","0","1","1","0","0"
"http://steamcommunity.com/id/damngary/recommended/214770/","damngary","damngary","http://steamcommunity.com/id/damngary/","72 products in account","Friend,\nGrab a luchador mask, a bunch of avocados, chips, and dig into this Guacamelee!!","July 4, 2014","true","9.0"," 1 person found this review helpful","0","1","1","0","0"
"http://steamcommunity.com/profiles/76561198082125675/recommended/214770/","76561198082125675","bonsai","http://steamcommunity.com/profiles/76561198082125675/","314 products in account","me gusta 10/10","March 4, 2014","true","9.0"," 1 person found this review helpful","0","1","1","0","0"
"http://steamcommunity.com/profiles/76561198031441562/recommended/214770/","76561198031441562","Cracknaces","http://steamcommunity.com/profiles/76561198031441562/","61 products in account","I can't think of a way to describe this game that will do it any justice. It's almost as if Super Mario and Super Meat Boy had a baby? Picked this up for a couple bucks during the Steam summer sale and played it more than all the AAA titles I have picked up....  Highly recommended!","June 29, 2014","true","15.8"," 1 person found this review helpful","0","1","1","0","0"
"http://steamcommunity.com/id/treeves2011/recommended/214770/","treeves2011","Nicolas"Nic'TheCage'Cage"Cage","http://steamcommunity.com/id/treeves2011/","146 products in account","This game was nonstop fun from start to finish. Currently playing through the game a second time, and the excitement is still as strong as ever!","January 20, 2014","true","10.2"," 1 person found this review helpful","0","1","1","0","0"
"http://steamcommunity.com/id/happymellon/recommended/214770/","happymellon","happymellon","http://steamcommunity.com/id/happymellon/","293 products in account","Love this game, it is a blast from the past in the style of platformers that have long since gone. Now if only you died more easily.","June 11, 2014","true","48.5"," 1 person found this review helpful","0","1","1","0","0"
"http://steamcommunity.com/id/cjmauney/recommended/214770/","cjmauney","cjmauney0511","http://steamcommunity.com/id/cjmauney/","137 products in account","Very entertaining platformer.  Gameplay is solid and the side quests help add to the re-playability.  The slighly offbeat comical nature and loads of hidden easter eggs are a refreshing touch.  Recommended if you're looking for an old school platform experience with a modern feel.","June 8, 2014","true","54.9"," 1 person found this review helpful","0","1","1","0","0"
"http://steamcommunity.com/profiles/76561197998825270/recommended/214770/","76561197998825270","The Dorf","http://steamcommunity.com/profiles/76561197998825270/","273 products in account","Guacamelee! is a Mexican-themed beat em’ up platformer with puzzle solving elements and a very silly sense of humor. I don’t usually dig beat em’ up games, but I’m glad checked this game out, it’s pretty awesome. You play as Juan Aguacate, a Mexican farmer who dons a magical luchador mask to become a superpowered wrestler in order to save his kidnapped girlfriend.\n\nThe game can be played solo or co-op, a second player can assume the role of the female wrestler “Tostada”. I played through the game both solo and co-op. The co-op makes the platforming sections a bit more frantic, but makes the beat em’ up sections and boss fights quite a bit easier.\n\nThe game has some Metroidvania elements as well: as you progress through the game and unlock new wrestling moves, you’ll gain access to areas you previously unable to reach. As mentioned before, Guacamelee! also has a very silly sense of humor. It’s chock full of “nerd jokes”, internet humor and direct references to other video games. It was kind of a fun “can you spot them all?” subgame within Guacamelee!; trying to catch some of the more subtle video game references. There was even a Zelda II reference in there! How many people are really going to get that one?\n\nGuacamelee! is a bit on the short side, but it’s quite good. Check it out.\n\nFor more game reviews, check out http://whatisjamesplaying.blogspot.com/","January 24, 2014","true","2.0"," 1 person found this review helpful","0","1","1","0","0"
"http://steamcommunity.com/profiles/76561198025203313/recommended/214770/","76561198025203313","thochan","http://steamcommunity.com/profiles/76561198025203313/","101 products in account","challenging and fun metroid-esque game. integrates well done melee moves. All powers that are earned are actually useful.","September 12, 2013","true","12.1"," 1 person found this review helpful","0","1","1","0","0"
"http://steamcommunity.com/id/tool311/recommended/214770/","tool311","Merkaba311","http://steamcommunity.com/id/tool311/","146 products in account","Without a doubt, one of the best games ever made.  I could try to describe what sets this game apart from so many other platformers, but you have to experience it to understand.  These days, there are a lot of games that pay homage to games of the past, but Guacamelee takes everything from the past and builds on it.  Sure, it isn't the first "Metroidvania" game, but in my opinion, it is by far the best and most creative.  Everything from amazing animation and visuals, tight controls, and an awesome sound track, make this the best game I've played in the last five years.\n\nIf you are wondering whether you should get it, get it.  The only thing that might disappoint you is when the game is over.","January 16, 2014","true","18.7"," 1 person found this review helpful","0","1","1","0","0"
"http://steamcommunity.com/id/Xec050/recommended/214770/","Xec050","SS Fat Guy (HAM-44)","http://steamcommunity.com/id/Xec050/","146 products in account","this game is awesome. very attractive art, funny, luchadors. a must if you love the classic super mario side scroller style. also very challenging. first game to make my palms sweat in a long time","January 8, 2014","true","7.0"," 1 person found this review helpful","0","1","1","0","0"
"http://steamcommunity.com/id/HALFZOMBIEMAN/recommended/214770/","HALFZOMBIEMAN","HalfZombieMan","http://steamcommunity.com/id/HALFZOMBIEMAN/","365 products in account","Beautiful and fun to play.  I've you like Metroid, you'll love this game.  If you hate Metroid, you should seek thearapy.  It's just a game, it never did anything to you.","January 12, 2014","true","7.7"," 1 person found this review helpful","0","1","1","0","0"
"http://steamcommunity.com/profiles/76561197994640832/recommended/214770/","76561197994640832","arroyjose","http://steamcommunity.com/profiles/76561197994640832/","210 products in account","This is the only game this year where I couldn't put the controller down.  All I wanted to do was to play more when I was away from my computer. Guacamelee has superb game mechanics and extremely responsive controls.  Although you can fail a lot of times at a given mission, there is zero frustration.  Best way I can describe Guacamelee's gameplay is that it has a "flow" and once you are in the zone it's a joy to play.  There is no point where the game cheats, and every error is due to the player not mastering the controls.  Being Mexican, this game had me smiling at a lot of things, the humor, the surprisingly authentic portrayal of a lot of Mexican folklore, the subtle way that is was playing with telenovelas tropes. Drinkbox clearly did their homework. It is also by far the funniest game since Psychonauts.","January 5, 2014","true","10.4"," 1 person found this review helpful","0","1","1","0","1"
"http://steamcommunity.com/profiles/76561198057953038/recommended/214770/","76561198057953038","Manos","http://steamcommunity.com/profiles/76561198057953038/","94 products in account","Good game. A must for metroidvania fans","February 2, 2014","true","14.3"," 1 person found this review helpful","0","1","1","0","0"
"http://steamcommunity.com/id/wogasm/recommended/214770/","wogasm","ironic meme name","http://steamcommunity.com/id/wogasm/","359 products in account","Absolutely excellent","February 2, 2014","true","10.7"," 1 person found this review helpful","0","1","1","0","0"
"http://steamcommunity.com/id/marukyutofu/recommended/214770/","marukyutofu","MarukyuTofu","http://steamcommunity.com/id/marukyutofu/","400 products in account","Overall, this game is pretty alright. Not very long by this genre's standards, but it's still a good 9-10 hours if you want to do everything. I'd give it a solid 8/10, but something bugs me.\n\nHard mode is complete and utter trash. I don't usually complain about hard difficulties, hell, I love hard difficulties, but this game wanted to be special. You want a hard mode that smooths out the game's uneven difficulty? ♥♥♥♥ you! Instead, you get a game with even worse difficulty jumps, horribly unbalanced enemy combinations, and a game that, honestly, isn't very entertaining on a second playthrough.\n\nBut hey, if that's your thing, go right ahead hombre. The game is fun enough on its initial playthrough to warrant the $3.75 price tag I bought it at.\n\n6/10","February 4, 2014","true","18.3"," 1 person found this review helpful","0","1","1","0","0"
"http://steamcommunity.com/id/meximac/recommended/214770/","meximac","MexiMac","http://steamcommunity.com/id/meximac/","302 products in account","This game is a solid mix of light hearted humor and great gameplay. If you’re a casual gamer you may give up in certain areas of the game as it definitely becomes very challenging. Overall, the game difficulty does scale appropriately and is a lot of fun to play. Perfect game if you grew up in the 80s and miss the pixel perfect jumps.","February 6, 2014","true","25.4"," 1 person found this review helpful","0","1","1","0","0"
"http://steamcommunity.com/id/fbb7/recommended/214770/","fbb7","bad at battleborn","http://steamcommunity.com/id/fbb7/","213 products in account","An amazing Metroid-like platformy thing. So ♥♥♥♥♥♥♥ed great, but you really need a controller to pull off some of the moves you need to advance. Such a good game and great reference to older games that you really should check it out. I'd recommend it on console first though unless you have a good controller.","January 24, 2014","true","6.9"," 1 person found this review helpful","0","1","1","0","0"
"http://steamcommunity.com/id/flegmatica/recommended/214770/","flegmatica","fleg_","http://steamcommunity.com/id/flegmatica/","393 products in account","I have no words to describe how AWESOME this game is, especially with a friend. Please, buy it NOW and support the devs for this EPIC masterpiece!","May 18, 2014","true","6.6"," 1 person found this review helpful","0","1","1","0","0"
"http://steamcommunity.com/profiles/76561198056292200/recommended/214770/","76561198056292200","Grandpa Seth","http://steamcommunity.com/profiles/76561198056292200/","142 products in account","Awesome fun and challenging game.\nWould recommend to everyone. The art style and music is simply superb, unique and captures the Mexican theme very well.","May 17, 2014","true","10.8"," 1 person found this review helpful","0","1","1","0","0"
"http://steamcommunity.com/id/ryokashooter/recommended/214770/","ryokashooter","Azeraph","http://steamcommunity.com/id/ryokashooter/","117 products in account","Best luchador simulator ever.\nYou'll feel as if you're actually in Mexico fighting as a luchador.\n\nPros:\n-Able to turn into a chicken\n-Different outfits\n\nCons:\n-Doesn't let me turn into a chicken in real life.","May 11, 2014","true","15.5"," 1 person found this review helpful","0","1","1","0","1"
"http://steamcommunity.com/id/cybernetic/recommended/214770/","cybernetic","Cybernetic","http://steamcommunity.com/id/cybernetic/","370 products in account","Guacamelee is Metroid... if Samus Aran were a luchador. It even features Chozo statures.","December 20, 2013","true","4.0"," 1 person found this review helpful","0","1","1","0","0"
"http://steamcommunity.com/id/thatbloodywoman/recommended/214770/","thatbloodywoman","thatbloodywoman","http://steamcommunity.com/id/thatbloodywoman/","43 products in account","You get to play as a hot Mexican in a chicken suit - need I say more?","November 30, 2013","true","1.4"," 1 person found this review helpful","0","1","1","0","0"
"http://steamcommunity.com/id/whoota/recommended/214770/","whoota","[T-A!] Whoota","http://steamcommunity.com/id/whoota/","307 products in account","I'll let you in on a little secret: my favourite game is Metroid Prime. Prime 2 and 3 probably rank second and third respectively, but before I get longwinded: I love Metroid games.\n\nAs such I also have the poor habit of buying Super Metroid every time Nintendo rehashes it just to get some more of that sweet exploration action. Consequentially, I also love the Castlevania series...basically for being Metroid. Enter Guacamelee, an indie game that basically is Metroidvania, but dipped in taco sauce and smothered in chili's. You are Juan, a agave farmer who one day finds his town in peril and recovers a mask that gives him mystic Luchador powers. Along the way he learns new moves from peculiar looking statues and supplexes baddies into the ground to save the woman he, supposedly, loves. I don't know, the game doesn't care much about the whole love story. It wants you to play Metroid. And it does. Really well. In fact, the number of references to Metroid (and any other game for that matter) are so abundant, you might consider the developers lazy for not trying harder themselves.\n\nI'm poking holes now, cause Guacamelee is hilarious and fast and it certainly is excellent while it lasts. It channels that old-school spirit very well. Ugh, now I want to play some more Metroid.","March 4, 2014","true","7.9"," 1 person found this review helpful","0","1","1","0","0"
"http://steamcommunity.com/id/yuurei042/recommended/214770/","yuurei042","_yuurei_","http://steamcommunity.com/id/yuurei042/","279 products in account","Insanely fun Metroidvania action.","March 3, 2014","true","3.6"," 1 person found this review helpful","0","1","1","0","0"
"http://steamcommunity.com/profiles/76561198080641965/recommended/214770/","76561198080641965","Chani","http://steamcommunity.com/profiles/76561198080641965/","64 products in account","do NOT buy this game unless you have a controller. you'll hit infuriating keyboard bugs halfway through. :(\n\nthat said, it's an awesome game. looking forward to finishing it if I ever do buy a compatible controller.","March 4, 2014","true","3.3"," 1 person found this review helpful","0","1","1","0","0"
"http://steamcommunity.com/id/ihatemybrain/recommended/214770/","ihatemybrain","Canis Lupus","http://steamcommunity.com/id/ihatemybrain/","320 products in account","Not feel Hard enuff? play it with keyboard!!!\n\nAwesome art, needless for me to say. Awesome community and with workshop items its became "awesome-er". Kinda confuse me with mapping for a while(but eventually will get used to it). Great level design for side scroll games, need combo just to explore areas. And most of the problem are on controller, People with controller be like "meh, ez game". but people with keyboard "aawwww, ♥♥♥♥ man. thats close, better go to hell then try to do it again".\n\nAnd on the bombshell, buy it!!! it awesome!!! totally worth every penny.\n","March 4, 2014","true","16.6"," 1 person found this review helpful","0","1","1","0","0"
"http://steamcommunity.com/profiles/76561197994067727/recommended/214770/","76561197994067727","Indie Nightmare","http://steamcommunity.com/profiles/76561197994067727/","143 products in account","This games is awesome and a must have for platformer fans, it really takes you back to Mario (especially Mario World) and all that good stuff. The gameplay is terrific, an excellent combat system, fun challenges and hidden secrets in a vast and diverse world, will keep you playing the game long after it's bitten.","March 2, 2014","true","42.1"," 1 person found this review helpful","0","1","1","0","0"
"http://steamcommunity.com/profiles/76561198125751587/recommended/214770/","76561198125751587","wakerglass","http://steamcommunity.com/profiles/76561198125751587/","106 products in account","This game is more or less the best Metroidvania game I've played since Metroid: Fusion for the GBA. The game guides you to your next objective more than I'd like but the combat system is really tight, the art is gorgeous, and the music is evocative of the right moods. This is a really phenomenal game.","March 11, 2014","true","18.8"," 1 person found this review helpful","0","1","1","0","0"
"http://steamcommunity.com/id/yolorekceb/recommended/214770/","yolorekceb","[YOLO]Rekceb","http://steamcommunity.com/id/yolorekceb/","318 products in account","This is easily one of the finest metroidvania style games I've played on steam. The onlyshameful thing about it is how short it is (~6hrs).","March 12, 2014","true","8.6"," 1 person found this review helpful","0","1","1","0","0"
"http://steamcommunity.com/profiles/76561197993431247/recommended/214770/","76561197993431247","Sangdoo","http://steamcommunity.com/profiles/76561197993431247/","318 products in account","An all-around awesome game! Coming from a Street Fighter fan, the combo system in this game was so much fun. The platforming was challenging but rewarding. The graphics and sounds were top notch. Great easter eggs hidden throughout the game. I replayed on hard mode and was never bored. I hope it gets updated!","March 13, 2014","true","20.8"," 1 person found this review helpful","0","1","1","0","0"
"http://steamcommunity.com/id/SleeperKC/recommended/214770/","SleeperKC","Sleeper","http://steamcommunity.com/id/SleeperKC/","267 products in account","a really good Metroidvania game","August 27, 2013","true","7.0"," 1 person found this review helpful","0","1","1","0","0"
