"url","reviewerUsername","reviewerDisplayName","reviewerUrl","reviewerProductsCount","reviewText","date","recommended","hoursPlayed","voteText","helpfulPercent","votesHelpful","votesTotal","votesFunny","commentsCount"
"http://steamcommunity.com/id/Hybird45/recommended/2200/","Hybird45","i dont even fuck with quas no mo","http://steamcommunity.com/id/Hybird45/","113 products in account",".ã€€ã€€ã€€ã€€ã€€ã€€ã€€ã€€/ï¿£ï¿£ï¿£ï¼¼\n/|ã€€ã€€ ã€€ã€€ ï½œ\n/ã€€| ã€€ | âˆ©ã€€ ã€€ï¼¼\nâˆ«ã€€ ã€€|ã€€| | | ï¼¼ã€€ã€€ï¿£ï¿£ï¼¼ ã€€âˆ§ã€€ âˆ§ã€€ã€€ï¼ï¿£ï¿£ï¿£ï¿£ï¿£ï¿£ï¿£ï¿£ï¿£ï¿£ï¿£ï¿£ï¿£ï¿£\n| / ã€€| |ã€€ã€€ï¼¼ï¼¿ï¼¿ ã€€(ã€€Â´ âˆ€ï½€)ã€€<ã€€áµá¶¦Ë¡Ë¡ Ê¸áµ’áµ˜Ê³ áµ–áµƒÊ³áµ‰á¶®á¶µá¶³ áµƒá¶®áµˆ play cpm[my.mixtape.moe]\n/ / ã€€| |ã€€ã€€ã€€ã€€ã€€ /ã€€/ / /ã€€ã€€ã€€ã€€ ï¼¼ï¼¿ï¼¿ï¼¿ï¼¿ï¼¿ï¼¿ï¼¿ï¼¿ï¼¿ï¼¿ï¼¿ï¼¿ï¼¿ï¼¿\n/ /ã€€ã€€| | ã€€ã€€ã€€ã€€ï¼ˆ ï¼ˆ / /\n/ /ã€€ã€€ã€€| | ã€€ã€€ã€€ã€€ã€€ ï¼¼ï¼¼\nUã€€ã€€ ã€€U ã€€ã€€ã€€ã€€ã€€âŠ‚ / âˆª","August 3, 2015","true","160.0"," 6 of 10 people (60%) found this review helpful 1 person found this review funny","60","6","10","0","0"
"http://steamcommunity.com/id/TheEphraim/recommended/2200/","TheEphraim","Eph","http://steamcommunity.com/id/TheEphraim/","89 products in account","Nothing beats the classics, or well the semirecent classics.","May 23, 2014","true","3.8"," 1 person found this review helpful","0","1","1","0","0"
"http://steamcommunity.com/id/nrek/recommended/2200/","nrek","nrek [IgA]","http://steamcommunity.com/id/nrek/","125 products in account","I still play this game to death. Still one of the best replay value games for the buck, and holds true to what FPS arena frag-fests should like, better than TF2, better than MW3 - in my humble opinion, but only in that you can hop into a match, get some frags on as a break from work, and hop out, in less than 10 minutes flat.","April 16, 2014","true","35.2"," 1 person found this review helpful","0","1","1","0","0"
"http://steamcommunity.com/id/MarbleMayhemFragileBall/recommended/2200/","MarbleMayhemFragileBall","cliffordpie","http://steamcommunity.com/id/MarbleMayhemFragileBall/","353 products in account","Oh yeah you guys remember that perfect multiplayer shooter? Well this is it.","August 15, 2013","true","5.7"," 1 person found this review helpful","0","1","1","0","8"
"http://steamcommunity.com/id/theopposingforce/recommended/2200/","theopposingforce","Mounting Dread","http://steamcommunity.com/id/theopposingforce/","419 products in account","You definitely don't want to miss this game! It is wicked fast and requires skill as the main factor of doing well. No cheap tricks and very enjoyable single player against the bots that are challenging, but also fun to play against, unless it's on Nightmare, because bots will then look through walls. Ugh. Online multiplayer is stable and also still has a playerbase, although it seems very small.\n\n10/10 - Very enjoyable, pick it up.","August 1, 2012","true","18.9"," 1 person found this review helpful","0","1","1","0","0"
"http://steamcommunity.com/id/Ozkabot51/recommended/2200/","Ozkabot51","OZKABOT","http://steamcommunity.com/id/Ozkabot51/","90 products in account","One of the most (if not the most) raw, hardcore, adrenaline fueled and oldschool online FPS ever created. I grew up playing this game religiously, even 15 years after release Quake III Arena still a masterpiece forged by the gods of FPS. Its still just as insanely fun and fast paced as it was back in 1999. This is a timeless, hardcore FPS that'll never cease to be one of the greats of the genre.","December 26, 2013","true","30.3"," 1 person found this review helpful","0","1","1","0","0"
"http://steamcommunity.com/profiles/76561197970298473/recommended/2200/","76561197970298473","-Heimdal-","http://steamcommunity.com/profiles/76561197970298473/","102 products in account","This game just never stops being awesome! 10/10!","June 22, 2014","true","3.3"," 1 person found this review helpful","0","1","1","0","0"
"http://steamcommunity.com/id/bites/recommended/2200/","bites","sndrec in new brunswick","http://steamcommunity.com/id/bites/","120 products in account","BUUUUUYYYYYY\nTHIIIIISSSSSS\nGAAAAAAMMMMEEEEE\n\neven if you aren't particularly into shooters check this out. its a legendary â™¥â™¥â™¥â™¥ing classic and deserves your attention","June 22, 2014","true","5.8"," 1 person found this review helpful","0","1","1","0","1"
"http://steamcommunity.com/id/westarcher/recommended/2200/","westarcher","General Stonewall Jackson","http://steamcommunity.com/id/westarcher/","226 products in account","Mental timer simulator: The game","June 23, 2014","true","1.1"," 1 person found this review helpful","0","1","1","0","0"
"http://steamcommunity.com/profiles/76561197991919198/recommended/2200/","76561197991919198","OugaBooga","http://steamcommunity.com/profiles/76561197991919198/","614 products in account","LOVE this game, still fun to play 13yrs later & there's Still LOTS of servers running.\nOver 1000 servers.\nIf your new to q3 then you might have a hard time since the players that have stuck with the game are very good.","August 2, 2013","true","5.4"," 1 person found this review helpful","0","1","1","0","0"
"http://steamcommunity.com/id/wiredsonic/recommended/2200/","wiredsonic","what the fuck","http://steamcommunity.com/id/wiredsonic/","491 products in account","This is where it all began, the birthplace of the Arena Shooter genre. Insanely fast-paced, it pushes your skill to the limit. There's no place for overly complicated tactics or stupid gimmicks here, it's just pure, raw skill. Can you rocket-jump? You better learn quick then.","December 29, 2011","true","0.8"," 1 person found this review helpful","0","1","1","0","0"
"http://steamcommunity.com/id/postgnome/recommended/2200/","postgnome","Gnome","http://steamcommunity.com/id/postgnome/","557 products in account","*Gnome Seal of Approval*\nid Software perfected the classic deathmatch multiplayer in Quake. Here they evolves it further and adds some other less successful modes. This is a pure multiplayer game with no story. The single player mode consists of deathmatch games against bots which can be set to a difficulty where they are deadly accurate.\nI've spent hours on end in this game in the past.","November 27, 2011","true","0.1"," 1 person found this review helpful","0","1","1","0","0"
"http://steamcommunity.com/id/mcmillanfixxxer/recommended/2200/","mcmillanfixxxer","McMillanFixXxeR","http://steamcommunity.com/id/mcmillanfixxxer/","402 products in account","The Quake Series -  These games focus on Gameplay and they do it well.  Fun weapons, fast gameplay, rocket jumping, and mosters from knights to demons.  Always focused on speed and Mutiplayer Gaming.\n\nQuake III - in my opinion shares the same space as Counter Strike, Golden Eye, and Unreal Tournament.  This was hands down one of these best mutiplayer combat games ever made.  Tight controls, fun weapons, fun maps, good graphics.  I was so amazed by this game and playing it at a Lan Party one weekend... I dreamed about it in my sleep.  I sometimes wish I could fall in love with another game like this.  If you have freinds and you guys want to try some old school mutiplayer games together... buy copies of this and play against each other... youll love it!!\n\nThat being said:  This game and some of the other Quake games really pushed the FPS genre into mainstreme and as a competetive sport.","December 20, 2011","true",""," 1 person found this review helpful","0","1","1","0","0"
"http://steamcommunity.com/id/m-rad/recommended/2200/","m-rad","Dripik","http://steamcommunity.com/id/m-rad/","441 products in account","Quad Damage","April 29, 2012","true","15.8"," 1 person found this review helpful","0","1","1","0","0"
"http://steamcommunity.com/profiles/76561197972309696/recommended/2200/","76561197972309696","Slag220","http://steamcommunity.com/profiles/76561197972309696/","42 products in account","One of my all time favs from years ago. Still fun to play. Fast action fun.","December 1, 2013","true","0.8"," 1 person found this review helpful","0","1","1","0","0"
"http://steamcommunity.com/profiles/76561198039237710/recommended/2200/","76561198039237710","FrankinFingerz","http://steamcommunity.com/profiles/76561198039237710/","259 products in account","This was one of the earliest games I ever played, I remember dad showing me he picked it up on the way home from school. Some of my fondest gaming experiences are playing some of the space arenas and facing off against Xero and his damn railgun.\n\nA great purchase and cannot suggest this game enough!","December 1, 2013","true","0.7"," 1 person found this review helpful","0","1","1","0","0"
"http://steamcommunity.com/id/nanakired/recommended/2200/","nanakired","Nanaki","http://steamcommunity.com/id/nanakired/","623 products in account","It's Quake....","July 7, 2011","true","5.9"," 1 person found this review helpful","0","1","1","0","0"
"http://steamcommunity.com/id/SGTADMAN/recommended/2200/","SGTADMAN","ADMAN","http://steamcommunity.com/id/SGTADMAN/","725 products in account","To this day, the best multiplayer game ever made.","January 27, 2013","true","1.2"," 1 person found this review helpful","0","1","1","0","0"
"http://steamcommunity.com/id/theopposingforce/recommended/2200/","theopposingforce","Mounting Dread","http://steamcommunity.com/id/theopposingforce/","419 products in account","You definitely don't want to miss this game! It is wicked fast and requires skill as the main factor of doing well. No cheap tricks and very enjoyable single player against the bots that are challenging, but also fun to play against, unless it's on Nightmare, because bots will then look through walls. Ugh. Online multiplayer is stable and also still has a playerbase, although it seems very small.\n\n10/10 - Very enjoyable, pick it up.","August 1, 2012","true","18.9"," 1 person found this review helpful","0","1","1","0","0"
"http://steamcommunity.com/id/nrek/recommended/2200/","nrek","nrek [IgA]","http://steamcommunity.com/id/nrek/","125 products in account","I still play this game to death. Still one of the best replay value games for the buck, and holds true to what FPS arena frag-fests should like, better than TF2, better than MW3 - in my humble opinion, but only in that you can hop into a match, get some frags on as a break from work, and hop out, in less than 10 minutes flat.","April 16, 2014","true","35.2"," 1 person found this review helpful","0","1","1","0","0"
"http://steamcommunity.com/id/Ozkabot51/recommended/2200/","Ozkabot51","OZKABOT","http://steamcommunity.com/id/Ozkabot51/","90 products in account","One of the most (if not the most) raw, hardcore, adrenaline fueled and oldschool online FPS ever created. I grew up playing this game religiously, even 15 years after release Quake III Arena still a masterpiece forged by the gods of FPS. Its still just as insanely fun and fast paced as it was back in 1999. This is a timeless, hardcore FPS that'll never cease to be one of the greats of the genre.","December 26, 2013","true","30.3"," 1 person found this review helpful","0","1","1","0","0"
"http://steamcommunity.com/id/Trogue12/recommended/2200/","Trogue12","Trogue12","http://steamcommunity.com/id/Trogue12/","475 products in account","My friends response to me gifting it to him:\n\nApplejuice724: OMFG quake! :D\n\nI think if he likes it you will.....","June 30, 2014","true","7.1"," 1 person found this review helpful","0","1","1","0","1"
"http://steamcommunity.com/id/MarbleMayhemFragileBall/recommended/2200/","MarbleMayhemFragileBall","cliffordpie","http://steamcommunity.com/id/MarbleMayhemFragileBall/","353 products in account","Oh yeah you guys remember that perfect multiplayer shooter? Well this is it.","August 15, 2013","true","5.7"," 1 person found this review helpful","0","1","1","0","8"
"http://steamcommunity.com/id/danyukhin/recommended/2200/","danyukhin","danyukhin (idling)","http://steamcommunity.com/id/danyukhin/","1016 products in account","COME JOIN QIII SO I CAN PWN YOUR PUNY BUTTOCKS","November 20, 2010","true","9.9"," 1 person found this review helpful","0","1","1","0","2"
"http://steamcommunity.com/id/arleas/recommended/2200/","arleas","arleas","http://steamcommunity.com/id/arleas/","1379 products in account","This is one of those classic games that defines the standard for a generation.  It's kind of a shame that they don't make em like this anymore.  I had high hopes for Rage when that came out, but aside from both being first person shooters, they have nothing in common.\n\n","April 24, 2014","true","0.8"," 1 person found this review helpful","0","1","1","0","1"
"http://steamcommunity.com/profiles/76561197980295125/recommended/2200/","76561197980295125","aidynphoenix","http://steamcommunity.com/profiles/76561197980295125/","98 products in account","Greatest Competitive Shooter Of All Time.  Quake3 is the most challenging and difficult game of all time. it is truly the benchmark for judging a player's gaming ability. my game time doesn't reflect my experience with quake3, i have been a diehard quake3 fan since i was a kid. If you like a challenge, or think you are good at first person shooters, give quake3 a try.","December 11, 2014","true","3.4"," 1 person found this review helpful","0","1","1","0","0"
"http://steamcommunity.com/id/Moon420Blazeit/recommended/2200/","Moon420Blazeit","Formosity","http://steamcommunity.com/id/Moon420Blazeit/","4 products in account","Really fun and bloody game. I come from QL and decided to give Q3 a try. I will play both now, QUAKE 4 LYFE!  :D","December 19, 2014","true","4.2"," 1 person found this review helpful 1 person found this review funny","0","1","1","0","0"
"http://steamcommunity.com/id/lukaskoz/recommended/2200/","lukaskoz","poopfeast420","http://steamcommunity.com/id/lukaskoz/","262 products in account","best arena FPS ever made, still very populated.\nno babbys allowed.","December 29, 2013","true","0.5"," 1 person found this review helpful","0","1","1","0","0"
"http://steamcommunity.com/id/scarebb/recommended/2200/","scarebb","sc4r4b","http://steamcommunity.com/id/scarebb/","147 products in account","Quake for lyfe!","July 10, 2011","true","0.0"," 1 person found this review helpful","0","1","1","0","0"
"http://steamcommunity.com/profiles/76561198019046630/recommended/2200/","76561198019046630","â˜¢ ï½·iï¾šï½²ã‚“ï¾˜ â˜¢","http://steamcommunity.com/profiles/76561198019046630/","929 products in account","The game that brought me to online-gaming... Old-skool, cult-classic...\n","January 28, 2015","true","5.8"," 1 person found this review helpful","0","1","1","0","1"
"http://steamcommunity.com/id/MySpeciesIsDead/recommended/2200/","MySpeciesIsDead","WizBit","http://steamcommunity.com/id/MySpeciesIsDead/","40 products in account","I love playing this but lots of people are saying it's glitching on the main menu but go to the local files and launch it from there and it wont glitch it might not work but it worked for me . This is an update on this review sometimes it'll glitch still but only once it glitched lauching from files for me","August 30, 2014","true","1.4"," 1 person found this review helpful","0","1","1","0","0"
"http://steamcommunity.com/id/q3railgun/recommended/2200/","q3railgun","q3.railgun","http://steamcommunity.com/id/q3railgun/","536 products in account","In my eyes, possibly the greatest skill FPS ever created. Aim, reflex, map knowledge and trickjumping are all important factors in having the upper hand in this game. QuakeLive added a Duel mode which is a 1v1 DM mode. This game has been around for so long and yet still people play even at a competitive level.","October 5, 2011","true","1.6"," 1 person found this review helpful","0","1","1","0","0"
"http://steamcommunity.com/id/zb0t/recommended/2200/","zb0t","[^1HD^7]^6SuperPorky â¤ ðŸ·","http://steamcommunity.com/id/zb0t/","424 products in account","Because everything else is â™¥â™¥â™¥â™¥.","December 21, 2012","true","0.1"," 1 person found this review helpful 1 person found this review funny","0","1","1","0","2"
"http://steamcommunity.com/id/uberpwner88/recommended/2200/","uberpwner88","Spot Enemy Boats","http://steamcommunity.com/id/uberpwner88/","117 products in account","A manly game for manly men.\n\nFast paced action, big guns and no modern gameplay gimmics. Long live arenas shooters!","February 4, 2015","true","5.6"," 1 person found this review helpful","0","1","1","0","0"
"http://steamcommunity.com/profiles/76561197961976844/recommended/2200/","76561197961976844","Marsk8","http://steamcommunity.com/profiles/76561197961976844/","88 products in account","The best.\nThe game which launched me into multiplayer stuff, since '99!","January 31","true","0.2"," 1 person found this review helpful","0","1","1","0","0"
"http://steamcommunity.com/id/danyukhin/recommended/2200/","danyukhin","danyukhin (idling)","http://steamcommunity.com/id/danyukhin/","1016 products in account","COME JOIN QIII SO I CAN PWN YOUR PUNY BUTTOCKS","November 20, 2010","true","9.9"," 1 person found this review helpful","0","1","1","0","2"
"http://steamcommunity.com/id/arleas/recommended/2200/","arleas","arleas","http://steamcommunity.com/id/arleas/","1379 products in account","This is one of those classic games that defines the standard for a generation.  It's kind of a shame that they don't make em like this anymore.  I had high hopes for Rage when that came out, but aside from both being first person shooters, they have nothing in common.\n\n","April 24, 2014","true","0.8"," 1 person found this review helpful","0","1","1","0","1"
"http://steamcommunity.com/id/uberpwner88/recommended/2200/","uberpwner88","Spot Enemy Boats","http://steamcommunity.com/id/uberpwner88/","117 products in account","A manly game for manly men.\n\nFast paced action, big guns and no modern gameplay gimmics. Long live arenas shooters!","February 4, 2015","true","5.6"," 1 person found this review helpful","0","1","1","0","0"
"http://steamcommunity.com/id/q3railgun/recommended/2200/","q3railgun","q3.railgun","http://steamcommunity.com/id/q3railgun/","536 products in account","In my eyes, possibly the greatest skill FPS ever created. Aim, reflex, map knowledge and trickjumping are all important factors in having the upper hand in this game. QuakeLive added a Duel mode which is a 1v1 DM mode. This game has been around for so long and yet still people play even at a competitive level.","October 5, 2011","true","1.6"," 1 person found this review helpful","0","1","1","0","0"
"http://steamcommunity.com/id/zb0t/recommended/2200/","zb0t","[^1HD^7]^6SuperPorky â¤ ðŸ·","http://steamcommunity.com/id/zb0t/","424 products in account","Because everything else is â™¥â™¥â™¥â™¥.","December 21, 2012","true","0.1"," 1 person found this review helpful 1 person found this review funny","0","1","1","0","2"
"http://steamcommunity.com/id/ThatZelousGuy/recommended/2200/","ThatZelousGuy","Zelousmarine","http://steamcommunity.com/id/ThatZelousGuy/","55 products in account","This is THE purest of Online multiplayer Shooters: It even tops Call of Duty (any of them) when it comes to frantic pace, extreme precision, awesome adreniline rushes, & al round fun & enjoyablity.\n\nGet over the fact that the Graphics are dated, because you'll be so focused on trying to get that mega armour that you won't care.\na MUST play, masterpiece.\n\nOR because people nowadays must have a review score:\n5 frags/5","April 25, 2014","true","8.6"," 1 person found this review helpful 1 person found this review funny","0","1","1","0","0"
"http://steamcommunity.com/id/despicabledamo/recommended/2200/","despicabledamo","DespicableDamo","http://steamcommunity.com/id/despicabledamo/","37 products in account","Used to play this on my dads computer all the time when I was a kid, along with Quake 4\nStill one of the best shooters around in my opinion\n\n","May 27","true","8.1"," 1 person found this review helpful","0","1","1","0","0"
"http://steamcommunity.com/id/fur1ak/recommended/2200/","fur1ak","KaiÑOs","http://steamcommunity.com/id/fur1ak/","218 products in account","El mejor deatmatch de la historia, desde el 2005 lo empece a jugar, hasta el 2008, ahora lo retome en steam, nunca como en esos aÃ±os, pero lo retome, es un juegazo.","September 7, 2013","true","448.1"," 2 of 3 people (67%) found this review helpful","67","2","3","0","0"
"http://steamcommunity.com/id/One-FISH-/recommended/2200/","One-FISH-","One-FISH-","http://steamcommunity.com/id/One-FISH-/","129 products in account","More of my life than I'd like to admit.","March 16, 2014","true","2.5"," 2 of 3 people (67%) found this review helpful","67","2","3","0","0"
"http://steamcommunity.com/id/Scorch_/recommended/2200/","Scorch_","Twitch.tv/Scorch__","http://steamcommunity.com/id/Scorch_/","364 products in account","THE BEST GAME EVER MADE PART 3\n\nC O O L L E R\nO\nO\nL\nL\nE\nR","February 12, 2014","true","0.3"," 2 of 3 people (67%) found this review helpful","67","2","3","0","2"
"http://steamcommunity.com/id/fistoblitzkrieg/recommended/2200/","fistoblitzkrieg","FistoBlitzkrieg","http://steamcommunity.com/id/fistoblitzkrieg/","309 products in account","https://www.youtube.com/watch?v=8CydB8Y5ips","March 20, 2013","true","0.5"," 2 of 3 people (67%) found this review helpful","67","2","3","0","0"
"http://steamcommunity.com/id/SirRail/recommended/2200/","SirRail","TwistedRail â™ ","http://steamcommunity.com/id/SirRail/","114 products in account","No BS. This is the game. THE game. No camping â™¥â™¥â™¥â™¥â™¥â™¥â™¥t, or sniping, just get in their and hope to get out.","January 6, 2014","true","1.1"," 2 of 3 people (67%) found this review helpful","67","2","3","0","0"
"http://steamcommunity.com/profiles/76561198160802795/recommended/2200/","76561198160802795","{BG} THE CHOSEN ONE","http://steamcommunity.com/profiles/76561198160802795/","27 products in account","i have problems in excessive mode...my lightning gun bounces i hate this bug it was fixed automatically but now it bugged again..well how to fix it","February 22, 2015","true","14.5"," 2 of 3 people (67%) found this review helpful","67","2","3","0","0"
"http://steamcommunity.com/profiles/76561198041746894/recommended/2200/","76561198041746894","ktulhu_nir","http://steamcommunity.com/profiles/76561198041746894/","194 products in account","oh yes","February 22, 2014","true","38.2"," 2 of 3 people (67%) found this review helpful","67","2","3","0","0"
"http://steamcommunity.com/profiles/76561198159801548/recommended/2200/","76561198159801548","P3","http://steamcommunity.com/profiles/76561198159801548/","21 products in account","Instantly fell in love with it.","March 12","true","11.3"," 2 of 3 people (67%) found this review helpful","67","2","3","0","0"
"http://steamcommunity.com/id/justinthepie/recommended/2200/","justinthepie","Justin (Â´ãƒ»Ï‰ãƒ»`)","http://steamcommunity.com/id/justinthepie/","552 products in account","It looks good for 2009\n10/10","August 4, 2013","true","1.1"," 3 of 5 people (60%) found this review helpful","60","3","5","0","0"
"http://steamcommunity.com/id/frenchfrywasp/recommended/2200/","frenchfrywasp","I get mo' ass den da toilet seat","http://steamcommunity.com/id/frenchfrywasp/","132 products in account","best fps game ever simulator","March 26","true","0.2"," 3 of 5 people (60%) found this review helpful","60","3","5","0","0"
"http://steamcommunity.com/profiles/76561198044140048/recommended/2200/","76561198044140048","=(e)= Spat856","http://steamcommunity.com/profiles/76561198044140048/","170 products in account","So much blood everywhere!!","November 15, 2014","true","5.4"," 4 of 7 people (57%) found this review helpful","57","4","7","0","0"
"http://steamcommunity.com/id/cstrikezplayer/recommended/2200/","cstrikezplayer","63457","http://steamcommunity.com/id/cstrikezplayer/","79 products in account","ÐšÐ»Ð°ÑÑÐ¸ÐºÐ°","October 10, 2014","true","16.7"," 4 of 7 people (57%) found this review helpful","57","4","7","0","0"
"http://steamcommunity.com/id/dokartist/recommended/2200/","dokartist","dokartist","http://steamcommunity.com/id/dokartist/","4168 products in account","Ð›ÐµÐ³ÐµÐ½Ð´Ð°Ñ€Ð½Ð°Ñ Ð¸Ð³Ñ€Ð° !!!","August 1, 2013","true",""," 5 of 9 people (56%) found this review helpful 2 people found this review funny","56","5","9","2","1"
"http://steamcommunity.com/id/styltbralla/recommended/2200/","styltbralla","SCHWANZLUTSCHER","http://steamcommunity.com/id/styltbralla/","22 products in account","10/10 would play again","November 3, 2014","true","2.8"," 8 of 15 people (53%) found this review helpful 1 person found this review funny","53","8","15","0","2"
"http://steamcommunity.com/profiles/76561198040483408/recommended/2200/","76561198040483408","[ç«ãƒã‚¦]-Ù¾Ù†Ø¬Ù‡Ú†ÛŒÙ†Ú¯ Ù‡","http://steamcommunity.com/profiles/76561198040483408/","52 products in account","Try quake live. If you like it, you'll like the original, just get the team arena bundle on top of it.\n","October 23, 2014","true","14.0"," 1 of 2 people (50%) found this review helpful","50","1","2","0","0"
