"url","reviewerUsername","reviewerDisplayName","reviewerUrl","reviewerProductsCount","reviewText","date","recommended","hoursPlayed","voteText","helpfulPercent","votesHelpful","votesTotal","votesFunny","commentsCount"
"http://steamcommunity.com/profiles/76561198000307368/recommended/2200/","76561198000307368","[DFC] -ko-","http://steamcommunity.com/profiles/76561198000307368/","157 products in account","I'd recommend the original version, to be honest im not sure if its the steam version giving me so many problems or my OS but i cannot get the game to work which is sad. I cant honestly say i can be bothered to try and fix it either but in all this game is the godfather of arena shooters and does its job very well! If you're looking for something more hectic than CoD and other Tatic based shooters the best place to start is well...where it all started!","February 14, 2014","true","0.2"," No ratings yet","0","0","0","0","0"
"http://steamcommunity.com/id/CA9000/recommended/2200/","CA9000","J.HellstrÃ¶m -[CRy0n]-","http://steamcommunity.com/id/CA9000/","144 products in account","I strongly reccomend this game beacuse it is the best FPS shooter game ever created, it requires that you have a very good aim and vey good reflexes and overall its incredible fun to play, its a real classic game if you ask me. The only downfall with this game is that the resolution doesnÂ´t support the latest hardware so you cant use a resolution that is for widescreens like 1920 x 1080 for example, but there are many guides in the workshop that describes how you can fix it trough the cfg file.\nAnyway with this game, you will have loads of fun and like me, i dont think you will get enough of it! ill give it a 10/10!!","April 8, 2013","true","37.6"," No ratings yet","0","0","0","0","0"
"http://steamcommunity.com/id/andredude/recommended/2200/","andredude","SpÃ¤ceCÃ¤det","http://steamcommunity.com/id/andredude/","344 products in account","Steam told me to write a Recomendation, but I don't really want to, so Im going to give you the weather forecast for the next couple of days instead:\n\nCloudy skies expected in Western Europe this Wednesday. Minor thermal variations foreseen for tommorrow, with Northern winds increasing along the Westernmost regions, with sustained winds to 40 MPH and gusts to 70 MPH by late night. The strong winds will continue through Thursday morning with high possibility of Rain. Partly sunny by late afternoon.","December 27, 2011","true","5.6"," No ratings yet","0","0","0","0","0"
"http://steamcommunity.com/id/fabianzaf/recommended/2200/","fabianzaf","fabianv","http://steamcommunity.com/id/fabianzaf/","517 products in account","Still one of the best shooters out there","October 5, 2013","true","0.4"," No ratings yet","0","0","0","0","0"
"http://steamcommunity.com/profiles/76561198060381881/recommended/2200/","76561198060381881","B2211.","http://steamcommunity.com/profiles/76561198060381881/","161 products in account","A classic game, very fun.","February 10, 2014","true","2.5"," No ratings yet","0","0","0","0","0"
"http://steamcommunity.com/id/SoulFire916/recommended/2200/","SoulFire916","Soul Fire","http://steamcommunity.com/id/SoulFire916/","182 products in account","This version might be dead but google Quake Live, its an online version of quake III arena, also add me I'm SoulFire916, anyway on with my review:\n\nThis game is great, not only because it pretty much started the FPS craze, but because its so fast paced. No time to relax and smell the flowers, this demands your full attention. But it wont give you a headache from so many tactics because there are not really many to begin with. But if you are an adrenaline gamer like myself this game is for you. Be sure to drink your favorite sugary drink and turn on some speed metal because you'll have the thrill of your summer! 9/10","June 29, 2012","true","0.3"," No ratings yet","0","0","0","0","0"
"http://steamcommunity.com/profiles/76561197979211360/recommended/2200/","76561197979211360","Yarr! Master Phi","http://steamcommunity.com/profiles/76561197979211360/","401 products in account","I have made friends from this game that I'm still friends with even after 13 years. And what still binds us is the fact that this game set the standard for what a multiplayer game is all about. We cried together when we lost, we celebrated together when we were victorious, we laughed together sharing experiences and we loved each other when we get that kill. It is to frag or be fragged the times this game has made my heart scream in excitement of joy, of fear, of bloodthirst and of love.","June 14, 2012","true","0.0"," No ratings yet","0","0","0","0","0"
"http://steamcommunity.com/id/link68759/recommended/2200/","link68759","Link Satonaka","http://steamcommunity.com/id/link68759/","429 products in account","Fun. I personally like the vogon servers which run the game about 5x faster, but I can't recommend that really- everyone I've ever shown it to thinks it's too fast to play. For *you*, maybe.\n\nDon't buy the steam version- cloud sync breaks it. Or something breaks it. Idk. I generally use the ioquake 3 engine. It's based on the quake 3 engine (which is open source) but it doesn't include the game textures (which are obviously not open source). If you buy this game off steam, I'd recommend just moving the textures to ioquake 3 and delete the steam install. Instructions for how to do this are on their site.\n\nIn fact, I recommend not buying any of the following from steam: doom 1-2, Quake 1-3. Steam ruins these games, all of them are open source, and you only need the texture files to play the game from the improved engines.","November 25, 2012","true","0.5"," No ratings yet","0","0","0","0","0"
"http://steamcommunity.com/id/PimTH/recommended/2200/","PimTH","Pim GO Watch Dogs 2","http://steamcommunity.com/id/PimTH/","857 products in account","I can play this and unreal tournament all day 10 stars :)","March 31, 2014","true","0.9"," No ratings yet","0","0","0","0","0"
"http://steamcommunity.com/id/123098546/recommended/2200/","123098546","Disruptor","http://steamcommunity.com/id/123098546/","88 products in account","i blew up your face 10/10","March 31, 2014","true","3.6"," No ratings yet","0","0","0","0","0"
"http://steamcommunity.com/profiles/76561198000307368/recommended/2200/","76561198000307368","[DFC] -ko-","http://steamcommunity.com/profiles/76561198000307368/","157 products in account","I'd recommend the original version, to be honest im not sure if its the steam version giving me so many problems or my OS but i cannot get the game to work which is sad. I cant honestly say i can be bothered to try and fix it either but in all this game is the godfather of arena shooters and does its job very well! If you're looking for something more hectic than CoD and other Tatic based shooters the best place to start is well...where it all started!","February 14, 2014","true","0.2"," No ratings yet","0","0","0","0","0"
"http://steamcommunity.com/id/andredude/recommended/2200/","andredude","SpÃ¤ceCÃ¤det","http://steamcommunity.com/id/andredude/","344 products in account","Steam told me to write a Recomendation, but I don't really want to, so Im going to give you the weather forecast for the next couple of days instead:\n\nCloudy skies expected in Western Europe this Wednesday. Minor thermal variations foreseen for tommorrow, with Northern winds increasing along the Westernmost regions, with sustained winds to 40 MPH and gusts to 70 MPH by late night. The strong winds will continue through Thursday morning with high possibility of Rain. Partly sunny by late afternoon.","December 27, 2011","true","5.6"," No ratings yet","0","0","0","0","0"
"http://steamcommunity.com/id/sturryz/recommended/2200/","sturryz","Sturryz","http://steamcommunity.com/id/sturryz/","580 products in account","This multiplayer focused FPS is pretty good overall, Lots of modes, lots of maps. but is generally inferior to other multiplayer titles of it's day, like Unreal Tournament or Starsiege: Tribes. Pretty easy to pick up and play, but it may take some players awhile to get use to it's really fast style of gameplay. Was nothing special back in it's day either. Has some great mods, but what Quake game doesn't? Atleast it's better then Quake 2.","March 14, 2011","true","2.4"," No ratings yet","0","0","0","0","0"
"http://steamcommunity.com/id/captcatalina/recommended/2200/","captcatalina","capt.catalina","http://steamcommunity.com/id/captcatalina/","33 products in account","idSoftware created pinnacle of deathmatch, where this title delivered with top notch gameplay, and endless modding.","September 1, 2014","true","7.0"," No ratings yet","0","0","0","0","0"
"http://steamcommunity.com/profiles/76561198153070297/recommended/2200/","76561198153070297","helge","http://steamcommunity.com/profiles/76561198153070297/","135 products in account","Had overlay problem with the menu in the beginning, but found help for it on Steam Community. Now it works great. Had to enable Vextor graphics though, to make it run smooth enough, but don't mind that.\n\nHere's what helped my with the menu problem:\nIn order to fix this, first you must disable the Steam Overlay for the time being, you can do this by going to Quake III properties in Steam (right click Quake III Arena and click "Properties") and unchecking "Enable Steam Community In-Game"","September 20, 2014","true","3.8"," No ratings yet","0","0","0","0","0"
"http://steamcommunity.com/id/BloodyAwesome/recommended/2200/","BloodyAwesome","FireFly","http://steamcommunity.com/id/BloodyAwesome/","84 products in account","I've been playing this game since 2001, this work of art is a fast-paced oldschool shooter gem and should be played. However the latest 1.32 build isn't my favorite, I prefer 1.16/1.11 as it's full with freeze tag servers (http://www.youtube.com/watch?v=90xMs158L28) *Watch the video*\n\nThis game definately has its benifits, and disaventages.\ncons:\n- Outdated game engine\n- Incompatible with some video cards (Try using win7's compability mode)\n- Terrible single-player, as it's just matches against bots.\n\npros:\n- Fast-paced oldschool shooter\n- Vast variety of maps, weapon models, player models/skins, server mods etc\n- Very easy to create amazing custom maps using GTKRadiant (compared to Vavle's Hammer editor)\nExample of a Q3A Custom map *Watch the video* : http://www.youtube.com/watch?v=QrRwmvLNFGw\n\n- Amazing multi-player with a lot of game modes try out\n\n\nI also highly recommend a free game called World of Padman (made using Quake 3 Arena engine)\nhttp://worldofpadman.net/website/news\n\nBest regards,\n\nAlex.","August 5, 2011","true","10.1"," No ratings yet","0","0","0","0","3"
"http://steamcommunity.com/id/El_Bristow/recommended/2200/","El_Bristow","El_Bristow","http://steamcommunity.com/id/El_Bristow/","443 products in account","This was the game that made me realise i was getting too old for this â™¥â™¥â™¥â™¥. I was an awsome bunny hopping maniac of an fps player back in the day. Now when i try a game this fast paced i get cold sweats and heart palatations. Shame, damn shame...","July 15, 2012","true","0.6"," No ratings yet","0","0","0","0","0"
"http://steamcommunity.com/id/Slvrbuu/recommended/2200/","Slvrbuu","Silverbuu","http://steamcommunity.com/id/Slvrbuu/","480 products in account","Quake 3 is the best FPS I have ever played (for its time). There are no perks, no amazing flashlight and laser sights to blind you, no time to sit around a snipe, no vehicles to spawn camp. This game is fast, explosive and fun. The graphics may not be much to look at, but the gameplay is so much better and more rewarding than most fps coming out these days.\n\n+Quake 3 Arena to your list of games and enjoy this gem.","April 10, 2012","true","0.8"," No ratings yet","0","0","0","0","0"
"http://steamcommunity.com/id/Ghozian/recommended/2200/","Ghozian","GHAZI","http://steamcommunity.com/id/Ghozian/","225 products in account","the king of FPS games","July 20, 2012","true","4.9"," No ratings yet","0","0","0","0","0"
"http://steamcommunity.com/id/ZessF/recommended/2200/","ZessF","Zess","http://steamcommunity.com/id/ZessF/","330 products in account","quack arena","July 4, 2011","true","0.2"," No ratings yet","0","0","0","0","0"
"http://steamcommunity.com/profiles/76561198005103526/recommended/2200/","76561198005103526","BXNT","http://steamcommunity.com/profiles/76561198005103526/","266 products in account","Still my favourite and all time classic Arena Deathmatch game.","December 8, 2013","true","1.3"," No ratings yet","0","0","0","0","0"
"http://steamcommunity.com/id/Throatte/recommended/2200/","Throatte","Throat","http://steamcommunity.com/id/Throatte/","115 products in account","bad game if you like bad games","September 20, 2011","true","7.0"," No ratings yet","0","0","0","0","2"
"http://steamcommunity.com/profiles/76561197966469082/recommended/2200/","76561197966469082","Homo_erectus","http://steamcommunity.com/profiles/76561197966469082/","255 products in account","There is no more perfect FPS. It's the zen rock garden of shooters.","July 30, 2012","true","9.2"," No ratings yet","0","0","0","0","0"
"http://steamcommunity.com/id/Niotex/recommended/2200/","Niotex","Niotex","http://steamcommunity.com/id/Niotex/","317 products in account","Nothing beats the classics.\n\nYou simply can't go wrong with one of, if not the all time best arena shooter.","December 28, 2013","true","24.2"," No ratings yet","0","0","0","0","0"
"http://steamcommunity.com/id/XeCuT1oNR/recommended/2200/","XeCuT1oNR","XeCuTioNR","http://steamcommunity.com/id/XeCuT1oNR/","594 products in account","One of my top videogames and FPS's of all time! Wasted hours apond hours of time in high school with this game. Just awesome work by the guys at iD software.","July 9, 2012","true","3.5"," No ratings yet","0","0","0","0","0"
"http://steamcommunity.com/id/arthurmarino/recommended/2200/","arthurmarino","Arthur M.","http://steamcommunity.com/id/arthurmarino/","158 products in account","An old-school shooter; a must-have for every FPS lovers. Don't hesitate on buying it on the next Steam sale.","August 7, 2012","true","11.1"," No ratings yet","0","0","0","0","0"
"http://steamcommunity.com/id/Swerto/recommended/2200/","Swerto","Swerto","http://steamcommunity.com/id/Swerto/","348 products in account","Probably the first shooter made purely for multiplayer. This predates Unreal Tournament, and invented a lot of the gametypes you enjoy in your shooters to this day .","August 12, 2011","true",""," No ratings yet","0","0","0","0","0"
"http://steamcommunity.com/id/zioralsa/recommended/2200/","zioralsa","ZioRalsa","http://steamcommunity.com/id/zioralsa/","293 products in account","Still one of the greatest "pure" FPS games.","December 16, 2013","true","2.3"," No ratings yet","0","0","0","0","0"
"http://steamcommunity.com/id/ray_juped/recommended/2200/","ray_juped","ray","http://steamcommunity.com/id/ray_juped/","798 products in account","use the icculus engine http://ioquake3.org/","May 16, 2012","true","1.0"," No ratings yet","0","0","0","0","0"
"http://steamcommunity.com/id/SajorX/recommended/2200/","SajorX","Sajor","http://steamcommunity.com/id/SajorX/","156 products in account","Classic FPS. Though it may have lost some of its shine over the years, you really should own this one.","December 18, 2013","true","1.1"," No ratings yet","0","0","0","0","0"
"http://steamcommunity.com/id/jegerdrood/recommended/2200/","jegerdrood","Danil","http://steamcommunity.com/id/jegerdrood/","178 products in account","Epic, just.. EPIC!.","December 30, 2011","true","1.5"," No ratings yet","0","0","0","0","0"
"http://steamcommunity.com/id/madwarren/recommended/2200/","madwarren","madwarren","http://steamcommunity.com/id/madwarren/","49 products in account","Hands down one of the best FPS games around. I still play this game today (and I got it brand new in '99!)","April 20, 2014","true","1.0"," No ratings yet","0","0","0","0","0"
"http://steamcommunity.com/id/SoulFire916/recommended/2200/","SoulFire916","Soul Fire","http://steamcommunity.com/id/SoulFire916/","182 products in account","This version might be dead but google Quake Live, its an online version of quake III arena, also add me I'm SoulFire916, anyway on with my review:\n\nThis game is great, not only because it pretty much started the FPS craze, but because its so fast paced. No time to relax and smell the flowers, this demands your full attention. But it wont give you a headache from so many tactics because there are not really many to begin with. But if you are an adrenaline gamer like myself this game is for you. Be sure to drink your favorite sugary drink and turn on some speed metal because you'll have the thrill of your summer! 9/10","June 29, 2012","true","0.3"," No ratings yet","0","0","0","0","0"
"http://steamcommunity.com/id/vendrium/recommended/2200/","vendrium","Vendrium","http://steamcommunity.com/id/vendrium/","688 products in account","Classic multiplayer FPS! Must-buy! Nuff said.","October 30, 2011","true","6.2"," No ratings yet","0","0","0","0","0"
"http://steamcommunity.com/id/CA9000/recommended/2200/","CA9000","J.HellstrÃ¶m -[CRy0n]-","http://steamcommunity.com/id/CA9000/","144 products in account","I strongly reccomend this game beacuse it is the best FPS shooter game ever created, it requires that you have a very good aim and vey good reflexes and overall its incredible fun to play, its a real classic game if you ask me. The only downfall with this game is that the resolution doesnÂ´t support the latest hardware so you cant use a resolution that is for widescreens like 1920 x 1080 for example, but there are many guides in the workshop that describes how you can fix it trough the cfg file.\nAnyway with this game, you will have loads of fun and like me, i dont think you will get enough of it! ill give it a 10/10!!","April 8, 2013","true","37.6"," No ratings yet","0","0","0","0","0"
"http://steamcommunity.com/profiles/76561197976025336/recommended/2200/","76561197976025336","ohhh noes","http://steamcommunity.com/profiles/76561197976025336/","116 products in account","you will die a lot and be fine with it.\n\n10/10","December 21, 2014","true","0.4"," No ratings yet","0","0","0","0","0"
"http://steamcommunity.com/id/Cyberfraud/recommended/2200/","Cyberfraud","STITCHES","http://steamcommunity.com/id/Cyberfraud/","217 products in account","Nothing like the old school.","December 27, 2011","true","20.5"," No ratings yet","0","0","0","0","0"
"http://steamcommunity.com/id/jwibbs/recommended/2200/","jwibbs","Joey","http://steamcommunity.com/id/jwibbs/","139 products in account","Stood the test of time. I love it","December 27, 2014","true","4.1"," No ratings yet","0","0","0","0","0"
"http://steamcommunity.com/id/mlrutherford/recommended/2200/","mlrutherford","michaelrutherford","http://steamcommunity.com/id/mlrutherford/","92 products in account","Quake III is the arena-fps that made me love games again. 10/10","January 1, 2015","true","9.7"," No ratings yet","0","0","0","0","0"
"http://steamcommunity.com/id/mrelusive603/recommended/2200/","mrelusive603","Mr Elusive","http://steamcommunity.com/id/mrelusive603/","364 products in account","One of my top FPS games of all time, I recall the days when I used to hand out â™¥â™¥â™¥-whoopin's on a blazing fast 56K dial-up connection, back in the good ol' days of 1999. The best Quake since...well, Quake :)","March 30, 2012","true","2.2"," No ratings yet","0","0","0","0","1"
"http://steamcommunity.com/id/gompers/recommended/2200/","gompers","Nadir","http://steamcommunity.com/id/gompers/","212 products in account","id released Q3A a little over 15 years ago. It's still the gold standard for first-person shooters as far as I'm concerned.","January 8, 2015","true","0.1"," No ratings yet","0","0","0","0","0"
"http://steamcommunity.com/id/9071770/recommended/2200/","9071770","OMPA","http://steamcommunity.com/id/9071770/","150 products in account","Classic","January 18, 2011","true","14.1"," No ratings yet","0","0","0","0","0"
"http://steamcommunity.com/id/intct/recommended/2200/","intct","^6 æ¡ˆ è¿Ž æ˜¯^7","http://steamcommunity.com/id/intct/","348 products in account","wryyyyyyyyyy","August 5, 2011","true","21.9"," No ratings yet","0","0","0","0","0"
"http://steamcommunity.com/id/FramesPreSecond/recommended/2200/","FramesPreSecond","FramesPerSecond","http://steamcommunity.com/id/FramesPreSecond/","39 products in account","John Romero's about to make you his â™¥â™¥â™¥â™¥â™¥","August 2, 2013","true","5.0"," No ratings yet","0","0","0","0","0"
"http://steamcommunity.com/profiles/76561198060381881/recommended/2200/","76561198060381881","B2211.","http://steamcommunity.com/profiles/76561198060381881/","161 products in account","A classic game, very fun.","February 10, 2014","true","2.5"," No ratings yet","0","0","0","0","0"
"http://steamcommunity.com/id/madwarren/recommended/2200/","madwarren","madwarren","http://steamcommunity.com/id/madwarren/","49 products in account","Hands down one of the best FPS games around. I still play this game today (and I got it brand new in '99!)","April 20, 2014","true","1.0"," No ratings yet","0","0","0","0","0"
"http://steamcommunity.com/id/snoman1/recommended/2200/","snoman1","Snoman","http://steamcommunity.com/id/snoman1/","95 products in account","Still the best Arena style combat in existence. With no fancy gameplay mutators and no meaningless achievements to distract the player, it's all about high speed tactics and resource domination.","July 20, 2012","true","26.4"," No ratings yet","0","0","0","0","0"
"http://steamcommunity.com/profiles/76561198007171272/recommended/2200/","76561198007171272","Swade","http://steamcommunity.com/profiles/76561198007171272/","408 products in account","Epic. Use to play this alot round a mates when i was a wee kid.Quake is one of the old fps that is still very fun to play. If only fps nowdays followed this same style of game play instead of giving everyone perks (to make them win even more) and unlocks. One of the best games in gaming :)","February 23, 2013","true","4.3"," No ratings yet","0","0","0","0","0"
"http://steamcommunity.com/profiles/76561197973669178/recommended/2200/","76561197973669178","Corpsefool","http://steamcommunity.com/profiles/76561197973669178/","238 products in account","Better then all CoD games combined, CoD copied Quake!","May 29, 2012","true","3.5"," No ratings yet","0","0","0","0","0"
"http://steamcommunity.com/id/plea2213123/recommended/2200/","plea2213123","cameron","http://steamcommunity.com/id/plea2213123/","84 products in account","quake in the 3","August 19, 2014","true","1.7"," No ratings yet","0","0","0","0","0"
"http://steamcommunity.com/id/vendrium/recommended/2200/","vendrium","Vendrium","http://steamcommunity.com/id/vendrium/","688 products in account","Classic multiplayer FPS! Must-buy! Nuff said.","October 30, 2011","true","6.2"," No ratings yet","0","0","0","0","0"
"http://steamcommunity.com/id/CA9000/recommended/2200/","CA9000","J.HellstrÃ¶m -[CRy0n]-","http://steamcommunity.com/id/CA9000/","144 products in account","I strongly reccomend this game beacuse it is the best FPS shooter game ever created, it requires that you have a very good aim and vey good reflexes and overall its incredible fun to play, its a real classic game if you ask me. The only downfall with this game is that the resolution doesnÂ´t support the latest hardware so you cant use a resolution that is for widescreens like 1920 x 1080 for example, but there are many guides in the workshop that describes how you can fix it trough the cfg file.\nAnyway with this game, you will have loads of fun and like me, i dont think you will get enough of it! ill give it a 10/10!!","April 8, 2013","true","37.6"," No ratings yet","0","0","0","0","0"
"http://steamcommunity.com/id/Niotex/recommended/2200/","Niotex","Niotex","http://steamcommunity.com/id/Niotex/","317 products in account","Nothing beats the classics.\n\nYou simply can't go wrong with one of, if not the all time best arena shooter.","December 28, 2013","true","24.2"," No ratings yet","0","0","0","0","0"
"http://steamcommunity.com/id/alleycat_the/recommended/2200/","alleycat_the","Alleycat","http://steamcommunity.com/id/alleycat_the/","301 products in account","NO PLACE TO HIDE, NO ROOM FOR ERROR, FAST AND FURIOUS FPS MP MAYHEM. The one and only Quake without a proper campaign that blends the Strogg universe with the original Quake medieval fantasy setting. The bots in the single player are good practice for MP and Quake LIVE where most of the players are. Kinda makes you wonder...Will Id ever come back to this series and make Quake 5 after Doom 4 is out?","January 22, 2015","true","6.1"," No ratings yet","0","0","0","0","0"
"http://steamcommunity.com/id/sqook/recommended/2200/","sqook","Nik","http://steamcommunity.com/id/sqook/","332 products in account","A true classic, finally on Steam. Sadly, Steam cannot know how many hours I spent playing Q3A in my youth. Maybe that's actually a good thing, because frankly I'd rather not know how much of my teenage years were spent in this game. :)","January 6, 2015","true","10.9"," No ratings yet","0","0","0","0","0"
"http://steamcommunity.com/id/SajorX/recommended/2200/","SajorX","Sajor","http://steamcommunity.com/id/SajorX/","156 products in account","Classic FPS. Though it may have lost some of its shine over the years, you really should own this one.","December 18, 2013","true","1.1"," No ratings yet","0","0","0","0","0"
"http://steamcommunity.com/id/fuckfromsoft/recommended/2200/","fuckfromsoft","Toxic Paramite","http://steamcommunity.com/id/fuckfromsoft/","87 products in account","Oh baby, dem frags. Mhmmm. Dem frags.","December 10, 2012","true","6.2"," No ratings yet","0","0","0","0","0"
