"url","reviewerUsername","reviewerDisplayName","reviewerUrl","reviewerProductsCount","reviewText","date","recommended","hoursPlayed","voteText","helpfulPercent","votesHelpful","votesTotal","votesFunny","commentsCount"
"http://steamcommunity.com/id/Admeia/recommended/2200/","Admeia","Admeia","http://steamcommunity.com/id/Admeia/","180 products in account","My sister and I used to play this all the time. She isn't here anymore and just having this installed on my Steam library is the most absolute important thing in my mental state.  I'm not giving a sad story however, what I'm telling you is this game will leave you with memories. Out of all the things my sister and I did, this is the strongest memory. This game is legendary and I know not many people play it at all anymore. Though this game is worth every cent put into it ever. to anyone who has played this, I know you have tons of memories too.","January 22, 2015","true","1.4"," 454 of 472 people (96%) found this review helpful 22 people found this review funny","96","454","472","22","18"
"http://steamcommunity.com/id/InXaIn/recommended/2200/","InXaIn","InXaIn","http://steamcommunity.com/id/InXaIn/","686 products in account","No screaming 12 year olds. No noobtubers or 360 noscopers. No "I f**ked your mother last night". And no campers.\nOnly rocket jumps, strafing, rail gunz and 100% pure skills.\n\n11/10 - Would play again.... for real.","October 12, 2014","true","3.5"," 513 of 545 people (94%) found this review helpful 136 people found this review funny","94","513","545","136","14"
"http://steamcommunity.com/id/marcodegammo/recommended/2200/","marcodegammo","MarcoDeGammo","http://steamcommunity.com/id/marcodegammo/","1673 products in account","I shoplifted this game from a K-Mart when it came out (its been over a decade i think the statute of limitations is up on that).The point is that this game was good enough to lie, cheat, and steal for. Ive since bought it several times over, so i feel better about it.","December 17, 2013","true","0.1"," 223 of 245 people (91%) found this review helpful 3 people found this review funny","91","223","245","3","8"
"http://steamcommunity.com/profiles/76561198074868338/recommended/2200/","76561198074868338","Shion","http://steamcommunity.com/profiles/76561198074868338/","123 products in account","Let's be honest; we all bought it for the nostalgia.","October 27, 2015","true","9.7"," 167 of 182 people (92%) found this review helpful 47 people found this review funny","92","167","182","47","3"
"http://steamcommunity.com/id/sukotv/recommended/2200/","sukotv","Durukan","http://steamcommunity.com/id/sukotv/","213 products in account","Love is...\nTier 1 Training: Ranger, Phobos, Mynx, Orbb, Sarge.\nTier 2 Skill: Bitterman, Grunt, Hossman, Daemia, Hunter.\nTier 3 Combat: Gorre, Wrack, Angel, Slash, Klesk.\nTier 4 Warrior: Lucy, Tank Jr, Biker, Patriot, Anarki.\nTier 5 Veteran: Visor, Razor, Stripe, Keel, Uriel.\nTier 6 Master: Bones, Cadavre, Doom, Sorlag, Major.\nFinal Tier Elite (Also known as Tier Z): Xaero..\n\n1999 - âˆž\nhttp://steamcommunity.com/sharedfiles/filedetails/?id=423256890","June 18, 2015","true","38.0"," 135 of 143 people (94%) found this review helpful 32 people found this review funny","94","135","143","32","0"
"http://steamcommunity.com/id/zZataro/recommended/2200/","zZataro","Zatara","http://steamcommunity.com/id/zZataro/","386 products in account","â™¥â™¥â™¥â™¥ing. Hell. Yes. The Arena is a cruel, cruel Mistress - she will build you up, only to break you, & just when you think you're rid of her, she'll drag you back into her clutches.\n\nIn short, for those of you who are woefully unaware, Quake 3 is hands down the pinnacle of the "Old School" '90s FPSs designed by the original id Software team, using an entirely different Gameplay model than the Modern FPSs of CoD & BF. A more common term for it is "Twitch Gaming" due to the extreme level of reaction time required to truly match up against not only other players, but also the Bots. To quote Dark Souls - "Prepare to Die", because you will, over, & over, & over.\n\nSeriously, buy it. Once you do, get ioQuake 3 (Google it), & the Quake 3 Widescreen Fixer Mod.\n\nAs far as the Online Multiplayer portion (which is arguably 95% of the Game) fear not, for the MP Community is still extremely active, & if you're of the ultra-competitive nature, the CPMA Mod (Challenge Pro Mode Arena - the Standard in Q3 Competitive Play since nearly the very beginning) ups the ante by making an already difficult Game even harder (works both Online (PvP) & Offline (Bots).\n\nSee you in the Arena, challenger.... If you dare ;D\n\nP.S. You're also going to want to check out "Defrag" at some point or another, if for nothing else then to just learn more about THE most insane Mod of all time, hands down.","June 25, 2014","true","111.5"," 123 of 130 people (95%) found this review helpful 1 person found this review funny","95","123","130","0","4"
"http://steamcommunity.com/id/OrdinaryFarcide/recommended/2200/","OrdinaryFarcide","OrdinaryFarcide","http://steamcommunity.com/id/OrdinaryFarcide/","211 products in account","There are no classes, no leveling up, no iron sight aiming, no vehicles, no killstreaks, no regenerating health, no cover system, no overpowered weapons, no always online DRM, no weapon skins, no pay 2 win, and no microtransactions\n\nThere is only you and what skill you have. You either build your skill or suffer death over and over and over again\n","March 18","true","10.6"," 103 of 104 people (99%) found this review helpful 10 people found this review funny","99","103","104","10","0"
"http://steamcommunity.com/id/SuperSexyLlama/recommended/2200/","SuperSexyLlama","SuperSexyLlama","http://steamcommunity.com/id/SuperSexyLlama/","216 products in account","For me this game is the best multiplayer shooter of all time. And yes multiplayer still works after 16 years. Take that EA.","January 12, 2015","true","23.0"," 97 of 98 people (99%) found this review helpful 17 people found this review funny","99","97","98","17","0"
"http://steamcommunity.com/profiles/76561198025912541/recommended/2200/","76561198025912541","Baby Wolf","http://steamcommunity.com/profiles/76561198025912541/","481 products in account","Pros: quake3\nCons: ...","October 31, 2014","true","13.8"," 204 of 248 people (82%) found this review helpful 93 people found this review funny","82","204","248","93","0"
"http://steamcommunity.com/id/saraquake/recommended/2200/","saraquake","Athena","http://steamcommunity.com/id/saraquake/","83 products in account","This is the best the game in the world.","November 12, 2015","true","429.6"," 109 of 118 people (92%) found this review helpful 11 people found this review funny","92","109","118","11","0"
"http://steamcommunity.com/id/free-man/recommended/2200/","free-man","Wile E. Weavile","http://steamcommunity.com/id/free-man/","342 products in account","A true classic. This game will probably live forever in the hearts and minds of its fans. It is THE definitive FPS arena deathmatch game. I fear to imagine how many hours I have in my old CD version of this game.\n\nFraggin' since 1999. Excellent/10\n","January 15, 2015","true","7.6"," 86 of 88 people (98%) found this review helpful 10 people found this review funny","98","86","88","10","0"
"http://steamcommunity.com/id/foxchild666/recommended/2200/","foxchild666","FoxChild666","http://steamcommunity.com/id/foxchild666/","250 products in account","Lost my job\nLost my girlfriend\nMy mom kicked me out\nBut that's all okay because I have taken the lead\n69/10 destroyed my life <3","May 8","true","23.5"," 112 of 124 people (90%) found this review helpful 117 people found this review funny","90","112","124","117","2"
"http://steamcommunity.com/id/Pasta_Pillows/recommended/2200/","Pasta_Pillows","PastaPillows","http://steamcommunity.com/id/Pasta_Pillows/","285 products in account","I got called a nerd by one of the NPC's...\n\n10/10 would nerd rage again.","July 29, 2015","true","8.8"," 121 of 138 people (88%) found this review helpful 74 people found this review funny","88","121","138","74","0"
"http://steamcommunity.com/id/NekoAyakashi/recommended/2200/","NekoAyakashi","Neko Ayakashi","http://steamcommunity.com/id/NekoAyakashi/","372 products in account","Quake III Arena is a true Arena Shooter classic and one of the best first person shooter games of all time. Quake III Arena will always be one of my most favorite FPS games, and it's fun never stops.\n\n10/10 A true FPS Classic. :D","October 25, 2014","true","302.5"," 101 of 111 people (91%) found this review helpful 6 people found this review funny","91","101","111","6","4"
"http://steamcommunity.com/id/phrygianhpc/recommended/2200/","phrygianhpc","PhrygianHPC","http://steamcommunity.com/id/phrygianhpc/","108 products in account","This game will never die.  From 1999 to the present, this game has been at the heart of Esports throughout.  After Challenge Pro Mode Arena (CPMA) was released the competitive community divided.  Since then, the game's popularity has seen a steady decline.  Currently, there is only a small crowd of hardcore fans that still enjoy this game.\n\nAround 2007-2008 a new iteration of this game came along as a free-to-play web version named QuakeLive.  Download QLPrism (standalone browser made specifically to run QuakeLive) to fully enjoy.  As a pro-subscriber in Quakelive you can spawn servers to run all kinds of fun gameplay from simple duels to team based games and now Quakelive even includes Race mode (Quake3 DeFRaG Mod).  Quakelive is constantly updated with new content (gametypes, maps, custom options) making it the most comprehensive Quake ever.\n\nQuake 3 is one of the most enduring games in all of FPS history.  The gameplay is dynamic, engaging and unique.  If you are a fan of fast-paced, deathmatch style gameplay, Quake3/Quakelive is the ONLY game for you.  Takes years to master, takes seconds to become addicted.\n\nCurrently, there is some debate over whom the G.O.A.T. (Greatest Of All Time) of QuakeLive is.  The greatest contenders for the title include the two finalists of Dreamhack Winter 2013, the Belarussian "Cypher" or the American "Rapha."  Other names through the years include American "Zero4", the Swedish aim master "Toxjq", and the notorious Russian "Cooller".\n\nIn the end, I see the competition for this title always coming back to the two:  Cypher or Rapha!  After the latest Quakecon and Dreamhack tournaments in 2013 you can see why!!","August 7, 2013","true","267.3"," 77 of 79 people (97%) found this review helpful","97","77","79","0","0"
"http://steamcommunity.com/id/dankfingers/recommended/2200/","dankfingers","ð•¿ð•³ð•° ð–‚ð•´ð–…ð•¬ð•½ð•¯","http://steamcommunity.com/id/dankfingers/","219 products in account","Basically best FPS","January 23, 2014","true","14.9"," 93 of 105 people (89%) found this review helpful 1 person found this review funny","89","93","105","0","0"
"http://steamcommunity.com/id/CorrosionSting/recommended/2200/","CorrosionSting","{=Corrosion=}","http://steamcommunity.com/id/CorrosionSting/","421 products in account","This used to be one of my all time favorites and guess what... it still is.","August 15, 2015","true","8.8"," 101 of 118 people (86%) found this review helpful 21 people found this review funny","86","101","118","21","0"
"http://steamcommunity.com/id/poros1ty/recommended/2200/","poros1ty","poros1ty","http://steamcommunity.com/id/poros1ty/","362 products in account","Probably put in well over 3,000 hours into this game over the past 15 years.","February 18, 2015","true","579.1"," 68 of 74 people (92%) found this review helpful 12 people found this review funny","92","68","74","12","0"
"http://steamcommunity.com/id/SArais/recommended/2200/","SArais","S'Arais (EDF?)","http://steamcommunity.com/id/SArais/","278 products in account","You call that AK 47 a gun? PAH\n\nSee this? This is a railgun. It fires DEPLETED URANIUM SLUGS at a speed unpresidented and uncalculatable by any means. It is capable of smashing through your bullet and carrying on through you and all of your buddies behind you. It will leave all of you as a useless pile of flesh. This thing has no recoil. no spread, and no limit to its range. It's only downside is the refire rate, but that doesn't matter if the target's dead.\n\nStep up to my level.","July 9, 2013","true","3.6"," 85 of 100 people (85%) found this review helpful 5 people found this review funny","85","85","100","5","0"
"http://steamcommunity.com/id/420enabled/recommended/2200/","420enabled","DirtyBongWater","http://steamcommunity.com/id/420enabled/","56 products in account","Eat, Sleep, Quake, Repeat. <3","January 10","true","70.0"," 60 of 64 people (94%) found this review helpful 29 people found this review funny","94","60","64","29","0"
"http://steamcommunity.com/id/Foxysen/recommended/2200/","Foxysen","Foxysen","http://steamcommunity.com/id/Foxysen/","1172 products in account","Quake 3 Arena isn't really an expected sequel of Quake franchise. It actually throws off single-player portion fully and focuses on mutliplayer part, which was quite wise as of that time. Arena-styled Deathmatch was still hot and at the peak of interest, you see. It came out in 1999. It's notable that in same year Unreal pulled off same trick, coming out with Unreal Tournament.\nIt also had ports to Dreamcast and PS2. Dreamcast is awesome, supporting keyboard+mouse, 4-player split-screen, had online multiplayer and had new awesome music that PC doesn't have. PS2 version didn't had online part, but had improved single-player, with some story, from what I know. Didn't check out that one yet, but it has different final boss.\n\nAs you expect, it has usual technical problems nowdays.\nGame doesn't support widescreen by default. But you can look up Community Guide on Steam, one explains how to set it up easily.\nSteam Overlay is conflicting with this game as well. If you try to immeditly play at default setup, you will be horrified by all the graphical flickers and glitches. You have to go to game's system options and disable "GL Extension", after that it should be fine.\nThough, some computers will still experience crashes here and there. In this case you will have to disable whole Steam Community for this game. Bai bai overlay.\nI think that auto save from Team Arena expansion may erase Quake 3 Arena save. Goes both ways. So be careful with that one.\n\nAs for multiplayer community, it's somewhat alive. There are some servers with some players. Most often you will meet servers full of bots. Other times it will be pro players who will rip you apart.\n\nSo, what can I say. Q3 is a classic arena, where you spawn, you stock up, you encounter, you restock. Or respawn. While strafejumping and bunnyhopping like a chicken. Everybody starts the same, they spawn in random spot with no good weapons. After that you have to grab all the goodies on the map. Weapons, ammo, health, armor and powerups. Stocking and restocking is quite important, having more armor and health than opponent will put you into superior position. If you are good at shooting and maneuvering, that is. Health and armor over 100 slowly drop down, so you want to make use of it. You also want to be the first to grab the respawning powerup, which is announced by subtle sound. Pro players time it in mind. Remaining powerups drop from defeated players.\nAnd when it comes to duel, you should make sure that opponent will not get to timed powerups and big bonuses. It's called "Arena Control". It'a also wise to sometimes not to encounter the opponent.\n\nIt also has some physics exploits like bunnyhopping and harder to pull off strafejumping. Thankfully, bots don't use them.\n\nWeapons are designed to be balanced with each other and to be useful in each own situation. It's mostly a tried and classic combination weapon set, of rocket launchers, shotgungs, railguns and such, so people who wanted a gun that ricochets around walls and turns enemies into ice cream critized them heavily. They work really nicely though. Railgun requires at least two hits on a row for average opponent, which is always better than usual instakill of sniper rifles in other games. Shotgun is good even for medium distance and just gives off a nice hitscan punch. Rocket Launcher is universal, good for splash damage with huge direct hit damage. Good for rocketjumps too. Really, it's great to see that the game took more balanced weapon approach of Quake 2 and tried to combine it with faster pace of Quake 1.\n\nLevel design is great too, with nice astethic. It's either sci-fi base or more of gothic-hellish red style. Like Quake 1 style, but more careful and even more evil at times, it's great. Has enough verticality. Just nicely done, with all the curves and corners. It also has some interesting "platforms in black space" levels, though those are the worse bunch as far as balance goes. Too much open space, railfun users be happy. Gets even worse on the level which has many lift-platforms, making it all look quite messy. Otherwise, nice layouts with nice looks.\nSoundtrack is also nice too, being ambient-like at times and more actiony techno at others. Somewhat unique.\n\nIt has Free-For-All Deathmatch, Team Deathmatch, Duel and Capture the Flag modes. And bots are pretty bad at Capture the Flag for some reason. Expect to see them running with machine gun, failing to defend and failing to retrive the flag.\n\nNow, as far single-player, well, it's pretty much a bunch of bot matches with some progression. The in manual says that mysterious race Vadrigar teleported the greatest warrior of all time into arenas for their own amusement and they can't be fooled by Death, combatants just respawn. in the end you will beat current champion Xaero, who's spirits will leave the body and it will turn into statue. And errrr, I guess you will be still stuck in Arena. Yep, story is quite an excuse. You will not see any kind of story in game itself, just means that it has many different skins with no bio. Like Id All-Stars, including Doom, Grunt and Ranger. But hey, some skins are cool, check out huge eyeball on two hands.\n\nYou should play on Hardcore if you are a good player. Normal and lower ones handicap bots actually.\n\nAnd yea, it's just a bunch of Deathmatch matches with boss-like duel match for each Tier. In Deathmatch you will be hunting the weakest and spamming, in Duel you better be controlling spawn of bot's favourite weapon if you want to survive. Final boss really requires it, being Railgun auto-bot pro. This "campaign" will fly past quickly. Oh well, at least it has some feeling of progression, better than just leaving player with skirmish only.\nDid I tell you that bots actually have a bit of behavior personality and favourite weapons?\n\nAnd if you want to go online, then as said, it doesn't have as many players. More of bots. And it has really bad server browser that no one ever liked. Can't even categorize by amount of players.\n\nTo be honest, with Quake Live around, there is almost no reason to get Quake 3 for online, most of players went to Live. Quake 3 does have gibs, blood and it has Campaign of sorts, so maybe it's better for offliners who don't want to be beaten by pros.\nAnd yea, this is old game with classic DM rules. Most modern gamers will not dig it for long. No leveling or such, more duel-based than team-based. But at least it was nice at the time, even if didn't try to be as original as UT, instead giving players more of classic set.","August 9, 2015","true","4.4"," 53 of 57 people (93%) found this review helpful 5 people found this review funny","93","53","57","5","0"
"http://steamcommunity.com/id/gaspletroller/recommended/2200/","gaspletroller","omegapixel (Lagsalot VI)","http://steamcommunity.com/id/gaspletroller/","196 products in account","THIS > QUAKE LIVE\nBY FAR\nThe ONLY time I would EVER go back to QL is if they rolled back the DISGUSTING update.","November 12, 2014","true","21.6"," 90 of 114 people (79%) found this review helpful 13 people found this review funny","79","90","114","13","0"
"http://steamcommunity.com/id/blood-star/recommended/2200/","blood-star","Sherry Birkin","http://steamcommunity.com/id/blood-star/","145 products in account","I fired this up, bringing back a flood of nostalgia from the late 90's early 2000's FPS scene, when it was all about the frags! Fast paced arcade style action, and Quake 3 had some of the most finely tuned of this, with maps that were fast paced, as well as with their own pitfalls, camping spots, and high-risk items. My favorite part about this game was the customization, I have custom skins, models, weapon paks, maps, everything, and something about "shaders" makes me thrilled to see!  All and all, a fantastic game if you have a hankering for nostalgia of the time, and even if you dont, fast paced old school arcade action, with none of that regenerating health and realistic physics bogging down the gameplay. I miss these kinds of games!","June 21, 2014","true","8.4"," 48 of 51 people (94%) found this review helpful","94","48","51","0","0"
"http://steamcommunity.com/profiles/76561197993270833/recommended/2200/","76561197993270833","Max80-7","http://steamcommunity.com/profiles/76561197993270833/","139 products in account","You've taken the lead!\nYou've lost the lead!\nYou've taken the lead!\nYou've lost the lead!\nHumiliation!\n"â™¥â™¥â™¥â™¥!"\n\nRating: 8 out of 10, this game, despite its age, offers a thriving multiplayer community and an  EXTREMELY competitive shooter experience. However, due to its age, server stability bounces from great to dogshit in a matter of seconds.","January 4","true","7.4"," 44 of 45 people (98%) found this review helpful 9 people found this review funny","98","44","45","9","0"
"http://steamcommunity.com/id/MFNhomtanks/recommended/2200/","MFNhomtanks","ï¼¡ï¼¥ï¼³ï¼´ï¼¨ï¼¥ï¼´ï¼©ï¼£ ã‚¢","http://steamcommunity.com/id/MFNhomtanks/","652 products in account","HUMILIATION.","August 20, 2014","true","3.1"," 54 of 61 people (89%) found this review helpful 33 people found this review funny","89","54","61","33","0"
"http://steamcommunity.com/id/Hyp3rX/recommended/2200/","Hyp3rX","[RSA] Hyp3rX","http://steamcommunity.com/id/Hyp3rX/","266 products in account","A Classic, a true FPS game, unlike other games that runs dead,\nthis game have been running for the past 14 years, and will for the next 14 years,\n\n10/10","December 2, 2013","true","10.2"," 42 of 44 people (95%) found this review helpful","95","42","44","0","0"
"http://steamcommunity.com/profiles/76561198028086019/recommended/2200/","76561198028086019","zais","http://steamcommunity.com/profiles/76561198028086019/","853 products in account","Must have classic. And you dont need fancy GPU to max it out ;)","December 30, 2014","true","2.0"," 46 of 51 people (90%) found this review helpful 3 people found this review funny","90","46","51","3","0"
"http://steamcommunity.com/id/zero557/recommended/2200/","zero557","zero557","http://steamcommunity.com/id/zero557/","392 products in account","Buy this damn game right now. Then play multiplayer with me. Do it. Now. Go.","July 19, 2013","true","8.3"," 41 of 45 people (91%) found this review helpful 2 people found this review funny","91","41","45","2","2"
"http://steamcommunity.com/id/how2noscope/recommended/2200/","how2noscope","??","http://steamcommunity.com/id/how2noscope/","38 products in account","The bots know how to world peace.\n\n11/10","September 19, 2015","true","27.0"," 33 of 33 people (100%) found this review helpful 12 people found this review funny","100","33","33","12","1"
"http://steamcommunity.com/id/RainbowDashandJudyHopps/recommended/2200/","RainbowDashandJudyHopps","Officer Monster 64","http://steamcommunity.com/id/RainbowDashandJudyHopps/","136 products in account","This game will suddenly give you an ego such as "I am the best player in the world!" and then it just smashes any ego that you've developed right in front of your face.\n10/10, buy it. NOW.","August 12, 2014","true","9.5"," 38 of 43 people (88%) found this review helpful 12 people found this review funny","88","38","43","12","0"
