"url","reviewerUsername","reviewerDisplayName","reviewerUrl","reviewerProductsCount","reviewText","date","recommended","hoursPlayed","voteText","helpfulPercent","votesHelpful","votesTotal","votesFunny","commentsCount"
"http://steamcommunity.com/profiles/76561198077737533/recommended/2200/","76561198077737533","Sharp299","http://steamcommunity.com/profiles/76561198077737533/","497 products in account","One of the Old School multiplayer games Still Alive. A ton of servers and a lot of people are playing this game every day. say hail to true Rival of Unreal tournnament 99 baby.\n\n- A really quick Gameplay. the speed is extreme, if you plays Cod, Halo, battlefied or any New Game stylish, you will see this.\n- Complete Arsenal. if you enjoy porwerfull weapons to crash your enemies this is your game.\n- violent. yes, you will see your enemy explode (literally) in front of your eyes.\n- Quake III arena gives a totally freedom to enjoy it, you can play an infinite quantity of mods, skins, etc. Rocket arena,   instagib are some exelent mods you can download and enjoy for free.\n\nIn short if you enjoy fast action, you can not miss this classic multiplayer.","November 27, 2013","true","21.5"," 12 of 12 people (100%) found this review helpful","100","12","12","0","0"
"http://steamcommunity.com/id/fatalframerate/recommended/2200/","fatalframerate","Fatal Framerate","http://steamcommunity.com/id/fatalframerate/","409 products in account","Install OSP. The instructions suck, but all you need to do is take 4 of the files that start with "zz" and put them in q3base. Not the one with "server" in the name, that one will make it so single player games don't work. Now if you open console with ~ you can type "/ch_crosshaircolor 1" for example. I think names work too, like Red or Blue. Some servers don't like OSP. If you want to play on one that kicks you, take those files out. Keep the entire OSP folder in your main Q3 folder.\n\nOther important settings:\n\rate 25000\n\snaps 40\n\cl_maxpackets 125\n\com_maxfps 125\n\com_hunkMegs 128\n\cg_drawTeamOverlay 1\n\cg_noProjectileTrail 1\n\n\cg_enemyModel "keel/pm"\n\cg_enemyColors "iiii"\n\cg_trueLightning 1\n\nMake sure your mouses polling rate is 500 or less or your gun will get stuck firing sometimes, or not fire at all occasionally.\n\nIf it keeps forcing your Game Key to Upper Case go into the games directory in Q3base and edit the key file with a text editor. Make it lowercase - save it - then right click the file and go to properties - make it read only. It may still ask for your key after a match but it's just a glitch, ignore it. As long as it doesn't do it BEFORE a match it makes no difference.","December 30, 2014","true","13.7"," 13 of 14 people (93%) found this review helpful 5 people found this review funny","93","13","14","5","0"
"http://steamcommunity.com/profiles/76561197961161199/recommended/2200/","76561197961161199","Arnold Geddon","http://steamcommunity.com/profiles/76561197961161199/","237 products in account","I just bought this again. After not been playing it for like 6-7 years.\n\nAnd oh boy was i surprised. The game is still extremely good. And also looks good, 15 years after it was made.\nYou got to wonder how John Carmack pulled this off. The man is a genious.\n\nDo not let the 1999 year of release scare you, this game is still extremely impressive, and highly competative.\nActually one of the most competastive shooters of all time. And one of the games that created Fatal1ty :)\n\n10/10","December 27, 2014","true","1.6"," 11 of 11 people (100%) found this review helpful 3 people found this review funny","100","11","11","3","0"
"http://steamcommunity.com/profiles/76561197993257199/recommended/2200/","76561197993257199","Ufas toxic demon 30000","http://steamcommunity.com/profiles/76561197993257199/","195 products in account","No1 fps shooter, best ever, speed, adrenaline, old school feel <3","September 10, 2014","true","34.6"," 11 of 11 people (100%) found this review helpful","100","11","11","0","0"
"http://steamcommunity.com/id/0skulock/recommended/2200/","0skulock","Oskulock","http://steamcommunity.com/id/0skulock/","988 products in account","Pure deathmatch goodness, i personally prefer Unreal Tournament over Q3A for various reasons but i still respect the speed and purity of this game.\n\nThe master server in this version is long gone and i really can't recommend it for any other than collecting or LAN play purposes. (Or obviously the single player, which is, well, what it is.) If you wan't to play the game online i would recommend you to move over to Quake Live which has been stripped of it's F2P status and is now a purchasable game for 10 bucks and a ton of content and updates that have been made to the game over the years.","May 8","true","1.6"," 11 of 11 people (100%) found this review helpful","100","11","11","0","0"
"http://steamcommunity.com/id/hoppimike/recommended/2200/","hoppimike","Hoppimike","http://steamcommunity.com/id/hoppimike/","318 products in account","Still my #1 deathmatch FPS, in my opinion better than Quake Live and any Unreal Tournament. No game in my point of view has ever matched the impact, precision and adrenaline rush of Quake III Arena!\n\nShame it isn't really optimised for modern hardware though - it runs in standard resolutions only and appears quite dark currently on my monitor, not sure why.\n\nBut still a tremendous game and I still think it's the best in the genre even all these years later (it's from 1999!).\n\nYou can't improve on perfection :)","April 10","true","1.7"," 11 of 11 people (100%) found this review helpful","100","11","11","0","0"
"http://steamcommunity.com/id/increasing/recommended/2200/","increasing","General Increasing","http://steamcommunity.com/id/increasing/","316 products in account","Quality video game, one of the best MP-only ones.","November 1, 2015","true","2.8"," 12 of 13 people (92%) found this review helpful","92","12","13","0","1"
"http://steamcommunity.com/id/IdGaF1111/recommended/2200/","IdGaF1111","Ret_Pally","http://steamcommunity.com/id/IdGaF1111/","3 products in account","This is how the first day of this game went-\n\nFirst i found a railgun, fell of the platform.\n\noverall  11/10","December 23, 2015","true","11.8"," 13 of 15 people (87%) found this review helpful 6 people found this review funny","87","13","15","6","0"
"http://steamcommunity.com/id/toxingames/recommended/2200/","toxingames","TÃ˜XIN","http://steamcommunity.com/id/toxingames/","452 products in account","An Awesome and Highly Addictive Arena FPS That will Test & Develop Your FPS Skills!\nQuake III Arena is an awesome fast-paced arena-styled multiplayer FPS game. A pure deathmatch game at it's best. The controls are perfect, the vanilla graphics are still good today, and the gameplay... â™¥â™¥â™¥â™¥ing awesome! One of my favorite features is the ability to play against bots with friends. Very fun if you just want to co-op in the game.\n\nI will say one thing. This game will test your skills and even help you improve your aim and reaction time as the combat is fast and fierce. After playing this game, I can say I am better at FPS games, especially ones with rocket launchers ;). This is one thing I cannot say you will get from most FPS games. This gives it another reason why this game kicks so much a$$! Not only are you having fun, but you are excersising your hand-to-eye coordination.\n\nEasy To Mod\nThis game is also very easy to mod. All you need to do is open the .pk3 files in a program like WinZip or WinRar and you can replace the game's sound effects, graphics, and models with custom ones you either downloaded or made yourself.\n\nTalking about mods, I highly recommend downloading ioQuake3 ( http://ioquake3.org ). It replaces Quake 3's rendering engine to suit modern machines giving you better net code and the ability to match your computer's native resolution. You can also download other mods for ioQuake3 to improve the game. Some other mods I recommend is the high res texture pack ( http://ioquake3.org/extras/replacement_content ) and the Metal-Tech v2.0 mod that replaces the textures for the weapons with higher res ones ( http://www.moddb.com/mods/metal-tech-v20-revolutions ).\n\nConclusion\nOn final note, this game is pure awesomeness and has a high replay value. If you are interested in playing a fast-paced FPS game to test out or improve upon your twitch skills, this is the game for you!","September 30, 2015","true","49.1"," 10 of 10 people (100%) found this review helpful","100","10","10","0","0"
"http://steamcommunity.com/id/k0pix/recommended/2200/","k0pix","^1q3^7kopix","http://steamcommunity.com/id/k0pix/","3 products in account","Best game I ever played even though it's been a good 7 years. I still bought it for the nostalgia despite knowing there would be almost no one in any server. The noghost community died long ago and with that the last remains of this game. Nevertheless, this is the best game I ever played.","January 2","true","0.1"," 10 of 10 people (100%) found this review helpful 1 person found this review funny","100","10","10","0","0"
"http://steamcommunity.com/id/artur15141/recommended/2200/","artur15141","artur15141","http://steamcommunity.com/id/artur15141/","117 products in account","I don't think I will ever find an action-packed game that will fully compare to this masterpiece. Absolutely amazing.","March 8, 2014","true","66.6"," 11 of 12 people (92%) found this review helpful","92","11","12","0","0"
"http://steamcommunity.com/id/arkanae/recommended/2200/","arkanae","Arkanae","http://steamcommunity.com/id/arkanae/","101 products in account","QIII is justly considered a classic, and is *still*, 15 years later, the best shooter ever made. Its rules, its physics, its weapons are as simple as they are unrealistic. Yet, it is a perfectly oiled mechanism that you will go back to because it works just right.\n\nBecause its simple mechanics give you that sense of satisfaction to have played well (or at least, given your best) against worthy oponents, in a set of rules where only your own skill, not your hardware, achievements, level, buddies, equipment... made the difference.\n\nBecause it is very immersive, despite the unrealism of its setting and dated graphics: its physics, its actions, its pace are just defined by running, jumping and shooting, not encumbered with clunky, over-designed interactions in the name of "realism".\n\nBecause it just works: no bugs, imbalances, lag, slowness, flakiness, choppiness, unresponsiveness, bloated interface, unintuitive design, complexity get in the way of playing.\n\nYou will simply come back to it because it is The Game, stripped of all the un-essential.","August 4, 2014","true","8.2"," 11 of 12 people (92%) found this review helpful 2 people found this review funny","92","11","12","2","2"
"http://steamcommunity.com/id/zkpgdnh/recommended/2200/","zkpgdnh","fijideal","http://steamcommunity.com/id/zkpgdnh/","104 products in account","acquire q3a, disregard live","September 29, 2014","true","9.4"," 10 of 11 people (91%) found this review helpful 3 people found this review funny","91","10","11","3","0"
"http://steamcommunity.com/id/quickinstinct/recommended/2200/","quickinstinct","quickinstinct","http://steamcommunity.com/id/quickinstinct/","220 products in account","A great arena game once you get it properly running on your newer gaming PC. It's like Unreal in many ways which is a compliment to both games.","January 1, 2014","true","0.2"," 10 of 11 people (91%) found this review helpful","91","10","11","0","0"
"http://steamcommunity.com/profiles/76561197960953632/recommended/2200/","76561197960953632","Beef Donair","http://steamcommunity.com/profiles/76561197960953632/","165 products in account","awesome.","April 3","true","7.7"," 12 of 15 people (80%) found this review helpful 7 people found this review funny","80","12","15","7","1"
"http://steamcommunity.com/id/madtownfresh/recommended/2200/","madtownfresh","MadtownFresh","http://steamcommunity.com/id/madtownfresh/","157 products in account","Great game! classic FPS","February 4, 2014","true","3.0"," 15 of 21 people (71%) found this review helpful","71","15","21","0","0"
"http://steamcommunity.com/id/mechfu/recommended/2200/","mechfu","quadro","http://steamcommunity.com/id/mechfu/","110 products in account","good ol classic","October 2, 2015","true","28.8"," 8 of 8 people (100%) found this review helpful","100","8","8","0","0"
"http://steamcommunity.com/id/the_doom_slayer/recommended/2200/","the_doom_slayer","Michaelosaur","http://steamcommunity.com/id/the_doom_slayer/","176 products in account","Quake III is a cornerstone of arena deathmatch gameplay. Fast, fluid, intense, lean, and mean. They don't make shooters like this anymore.","March 6","true","3.3"," 8 of 8 people (100%) found this review helpful","100","8","8","0","0"
"http://steamcommunity.com/id/tripmeister/recommended/2200/","tripmeister","Collision","http://steamcommunity.com/id/tripmeister/","236 products in account","The best game ever made.","December 21, 2013","true","0.8"," 9 of 10 people (90%) found this review helpful","90","9","10","0","0"
"http://steamcommunity.com/id/GingerGalaxy/recommended/2200/","GingerGalaxy","Galaxy","http://steamcommunity.com/id/GingerGalaxy/","27 products in account","Ahhhh the memories.","February 28","true","2.2"," 9 of 10 people (90%) found this review helpful 1 person found this review funny","90","9","10","0","0"
"http://steamcommunity.com/id/Manadono/recommended/2200/","Manadono","Manadono","http://steamcommunity.com/id/Manadono/","510 products in account","Never has this game failed to entertain me. The standard multiplayer bringing its well polished sheen to the table with a balanced range of guns and powerups in some of the most well designed arena levels the world has ever seen. Then the instagib servers quench any thirst left for possibly the fastest twitch shooting out there. Grab your railgun and get gibbing ;3","December 30, 2013","true","7.4"," 7 of 7 people (100%) found this review helpful","100","7","7","0","0"
"http://steamcommunity.com/id/hrhrhr/recommended/2200/","hrhrhr","Sarge[BY]","http://steamcommunity.com/id/hrhrhr/","265 products in account","The Game number 1. Live Classics. The Legendary Game!","September 1, 2013","true","32.7"," 7 of 7 people (100%) found this review helpful","100","7","7","0","0"
"http://steamcommunity.com/profiles/76561198072658824/recommended/2200/","76561198072658824","Dr Dingus","http://steamcommunity.com/profiles/76561198072658824/","86 products in account","Quake III was released in the year of 1999, over ten years ago. So you might be wondering why  pay $20 for a game that is the pre-2000 era? Why pay $20 for a game released in the stone ages of gaming? Well, because you can have a BFG or a mega op rocket launcher! What's more fun than hopping around like a mad man spamming a rocket launcher and blowing people apart and seeing their spine fall on the ground? Nothing! So grab yourself a copy of Quake III and end up in a mental asylum just like I did!\n20/10","October 19, 2015","true","14.3"," 8 of 9 people (89%) found this review helpful 2 people found this review funny","89","8","9","2","0"
"http://steamcommunity.com/id/cobaltbw/recommended/2200/","cobaltbw","CobaltBW","http://steamcommunity.com/id/cobaltbw/","66 products in account","I'm really bad at this.","April 14","true","9.2"," 8 of 9 people (89%) found this review helpful 2 people found this review funny","89","8","9","2","0"
"http://steamcommunity.com/id/fred_zilla/recommended/2200/","fred_zilla","fred_zilla","http://steamcommunity.com/id/fred_zilla/","95 products in account","Welcome to the amazing world of Quake III Arena, where shotguns explode people and rocket launchers are a form of transport. Where futuristic super-guns are a common sight and big symbols with rings around them turn your guns into unholy death machines. Where eyes, space marines and warrior princesses fight each other with railguns and plasma rifles. Where you will kill or be killed.\n\nNo pressure.","January 5, 2014","true","5.3"," 7 of 8 people (88%) found this review helpful","88","7","8","0","1"
"http://steamcommunity.com/id/hare1222/recommended/2200/","hare1222","Nate Jennings","http://steamcommunity.com/id/hare1222/","569 products in account","THE game that got me into First Person Shooters (FPSes)!\nMy Steam review is based on the old CD ROM version and Sega Dreamcast version of Quake III Arena, so my Steam stats don't reflect my actual playtime with it.\n\nPROS:\n+Wicked frenetic gameplay -breakneck speed.\n+LOW hardware requirements: Q3A is netbook friendly.\n+HUGE online community with countless online matches to jump into all the time.\n+Pretty good single player campaign and bot matches, when you can't get online.\n+Tons of user-created maps, mods, and arenas can be found online...for free.\n+User-created content is also compatible with free, legal, open-source Q3 clones (OpenArena, Nexuiz Classic).\n+Runs on Linux and Mac natively, thanks to OpenGL.\n\nCONS:\n-"Old" graphics, given you're a graphics snob.\n-ATI GPUs have issues with GL drivers, but can be fixed via "testapp" and turning off the GL Extension.","July 19, 2014","true","6.0"," 7 of 8 people (88%) found this review helpful","88","7","8","0","2"
"http://steamcommunity.com/id/dwterminator/recommended/2200/","dwterminator","[DW]Terminator","http://steamcommunity.com/id/dwterminator/","1082 products in account","As far as I'm concerned, Quake 3: Arena is the perfection of the deathmatch game mode. Simple (yet elegant), supremely balanced, fast-paced FPS gameplay mixes with excellent maps to create an unparalleled experience that even Unreal Tournament couldn't beat. If you like playing deathmatch, you need to get Quake 3. It's that simple.","May 18, 2012","true","1.5"," 7 of 8 people (88%) found this review helpful 1 person found this review funny","88","7","8","0","0"
"http://steamcommunity.com/id/ravenoriginal/recommended/2200/","ravenoriginal","Correct","http://steamcommunity.com/id/ravenoriginal/","770 products in account","Fantastic, brilliant multiplayer, and the Railgun. This is the only thing you need to know about this game. But regardless, here's some more info.\n\nThis game naturally inherited the smooth and fast-paced gameplay of its predecessor Quake (1996). As the original Quake was THE deathmatch classic in its time, Quake III Arena successfully rose to the throne and became the new king of its own time. Music is simple, yet it does the job very well. All the characters are very nicely voiced and the maps are, as expected from an id Software game, very very good. Oh and let's not forget the Railgun.\n\nThis game might be aging just like the original, but it is also timeless like the original. And just like the original, this is an important milestone in FPS genre, even if only for the multiplayer (that's what the game is about anyway!). By the way, did I mention the Railgun?","December 20, 2013","true","0.2"," 6 of 7 people (86%) found this review helpful","86","6","7","0","0"
"http://steamcommunity.com/id/theheavymedic/recommended/2200/","theheavymedic","Auron Harper","http://steamcommunity.com/id/theheavymedic/","82 products in account","This is one of the first FPS games I ever played, alongside DOOM, Duke Nukem 3D, and NAM. I've beaten it at least 40 times and its still entertaining. I've been playing this game since Windows 95. I highly recommend this game to anyone who loves a good time killer, and plenty of gore.","May 11","true","4.4"," 6 of 7 people (86%) found this review helpful 3 people found this review funny","86","6","7","3","0"
"http://steamcommunity.com/id/Robo_Donut/recommended/2200/","Robo_Donut","Battleship","http://steamcommunity.com/id/Robo_Donut/","139 products in account","The quintessential multiplayer FPS game.  It has much more depth than is immediately obvious.  New players may find it a bit obtuse or frustrating to learn the skills that the more experienced players rely on to give them the edge, but if you stick with it, you'll find it to be more rewarding than any of the 'modern' shooters.\n\nFor online play, QuakeLive probably has a more active community.  It's essentially the same game with physics/balance tweaks, but F2P and played in a browser.","December 3, 2013","true","2.9"," 4 of 4 people (100%) found this review helpful","100","4","4","0","0"
"http://steamcommunity.com/id/SteamHookups/recommended/2200/","SteamHookups","^7(]^1[)^2~=>WarLord<=~","http://steamcommunity.com/id/SteamHookups/","4903 products in account","This game is one of the best online games. It still has a very active community online and its very competative. Ive been playing this game since 99 and it is still thriving with the same players.This game never gets old. I love launching someone into the air with a rocket and then shooting them down with a rail. There are all types of game modes to all weapons, only rail and other mods that people come up. This is a very intense game, it might take some time to get used to the gameplay. The graphics to the game are great! You can customize things in the game to suit your style, for example you can choose a custom character or choose a default in game character, you can choose what your weapons look like and sound when you shoot them, there is just a bunch of things to change with the game. The single player part of the game just helps you practice and get ready when you actually face real people.This is a must have for any First Person Shooter lover. If you get it you wont regret it!","October 25, 2010","true","573.0"," 4 of 4 people (100%) found this review helpful","100","4","4","0","0"
"http://steamcommunity.com/id/fawnc/recommended/2200/","fawnc","st1gma","http://steamcommunity.com/id/fawnc/","278 products in account","10/10\n\nNothing, and I mean â™¥â™¥â™¥â™¥ing NOTHING, can compare to this game.\n\nShow me ONE, ONE â™¥â™¥â™¥â™¥ing FPS, that can compare.\n\nI â™¥â™¥â™¥â™¥ing dare you, â™¥â™¥â™¥â™¥.","December 1, 2012","true","114.2"," 4 of 4 people (100%) found this review helpful","100","4","4","0","4"
"http://steamcommunity.com/id/cavey/recommended/2200/","cavey","Caveman","http://steamcommunity.com/id/cavey/","187 products in account","The perfect deathmatch game with an excellent ballence between speed and accuracy.\n\nThat it still works after 15 years and is good for lower powered laptops makes it almost essential.\n\nAdd to this the thousands of third party mods and you have to say this is one of the best games ever made.","January 1, 2015","true","0.7"," 4 of 4 people (100%) found this review helpful","100","4","4","0","0"
"http://steamcommunity.com/profiles/76561198171975205/recommended/2200/","76561198171975205","Beast Mode","http://steamcommunity.com/profiles/76561198171975205/","17 products in account","A very classic FPS game with a very unusual but interestingly enjoyable selection of both weapons and characters. Stage layouts are fun to play through, good difficulty settings. Very first ever PC shooter I played when I was only a child, still enjoy it now.","July 21, 2015","true","5.2"," 4 of 4 people (100%) found this review helpful","100","4","4","0","0"
"http://steamcommunity.com/id/borgsy2s_account/recommended/2200/","borgsy2s_account","ï½‚ï½ï½’ï½‡ï½“ï½™ï¼’","http://steamcommunity.com/id/borgsy2s_account/","36 products in account","quake 3 is the first person shooter i first played in 2010 which i just recently brought a few years ago in quake 3 you fight aganst 7 tiers of arenas with different characters these tiers include many people and theres also a tier 0 to help u train in with a good view of ur character in a mirror and quake 3s modding is good i got alot of modded models which also improves my experence of fun also the multiplayer is awsome i love it i loved playing with friends and online with other people and this game was also made in 1999 and i dont even care about the graphics this games dlc quake 3 team arena also add in new guns and features 10/10 i  play this game to death i recomend this to everyone who likes fps this game is a master piece","September 19, 2015","true","22.2"," 4 of 4 people (100%) found this review helpful 1 person found this review funny","100","4","4","0","0"
"http://steamcommunity.com/profiles/76561198161554925/recommended/2200/","76561198161554925","Hero Elrond","http://steamcommunity.com/profiles/76561198161554925/","8 products in account","Some simple words of wisdom relating to this game fun, old school, fastpaced, fps, best fps game ever ? This game is a must get if you love fps games. You can mod the game to get diffrent maps. It's very fast paced and don't get this game if you expect slow gameplay beacuse that is not the case. This game is best played in multiplayer. I hope all of you enjoy this as much as I do :)","January 10","true","2.1"," 4 of 4 people (100%) found this review helpful 1 person found this review funny","100","4","4","0","0"
