"url","reviewerUsername","reviewerDisplayName","reviewerUrl","reviewerProductsCount","reviewText","date","recommended","hoursPlayed","voteText","helpfulPercent","votesHelpful","votesTotal","votesFunny","commentsCount"
"http://steamcommunity.com/id/capt_blakhelm/recommended/224460/","capt_blakhelm","Capt_Blakhelm","http://steamcommunity.com/id/capt_blakhelm/","1580 products in account","PLAY Contrast? MAYBE. The world, characters, and story may intrigue you, but game mechanics drove me nuts.\nPros\n+Unique, and smooth art style\n+Jazzy, 1920s art direction\n+Adorable (though, somewhat too talkative) child main character\n+Good Soundtrack\n+References to games and movies\n+Adult "Inside" jokes\n+2560x1080 Resolution Option (Fits Ultra-Wide Monitors) fine\n\nMids\n=Unique shadow platforming mechanic that becomes fustrating\n=Potentially interesting story\n\nCons\n-Parts of level gemotry where you can get stuck\n-Major crashes\n-Terrible Checkpoint system that eventually made me stop playing\n\nOverview\nContrast appears to be a fairly cute story about a daughter born out of wedlock that can speak with a potentially imaginary acrobat, controled by the player that can phase out of reality and into the shadows to platform across the world. There is something else going on in the world than just convienent lighting, as other humans are invisible except for their shadows, only Dororthy can recognize the acrobat and their are strange anomalies in the world, such as a giant chasm of space seperating a road to a town cinema. Unfortunately, I didn't get far enough to see the end as I grew fustrated with the gameplay - so I will probably watch a playthrough. Thankfully, this game is nowhere near as pretentious as Papo y Yo.\n\nFrustrations\nThis is a floaty platformer, much like Trine or Limbo, though there were many times I either missed jumps or fell during platforming because the "Rush" move didn't work or over shot my jump. The game gives an impression of a simple indie platformer, and for the most part it is, but there were so many instant-death moments in the game that wore thin after the 20th time. I got to a point where I had to save "Fred the Knight" in a "shadow story telling" sequence and the game straight up crashed when the dragon's fire hit Fred. I'm not sure if it was supposed to Kill Fred or activate some sequence or cutscene, but the game immediately locked up my PC for a solid 15 seconds (I was sure to need a Hard reboot soon), then Windows came back up and shown that I was disconnected from Steam. Again, I don't know if that disconnect triggered some sort of glitch (maybe it was about to register an achievement, but I was offline and the game crashed),  but thanks to the irritating checkpoint system, the game took me back to the start of the level, requiring me to walk all the way back to the area and replay the entire sequence again. Mind you, there were two other story telling sequences I had to complete before then. Plus, earlier in the game, I got stuck in level geometry and had to restart from my last save. To my surprise, it damn near restarted the whole level and lost all my progress in the part of the circus that I was trying to repair. The death at the dragon was the final straw for me and I lost all interest in playing this.\n\nConclusionI'm sure other, less demanding gamers can get enjoyment out of this, and honestly, I want to see more of the story, so I will watch the remainder on Youtube. Unless you absolutely adore what is going on here, I suggest you do the same. Value your time and money. I bought this on a deep discount for $3.74, but I could have done without doing so.","November 4, 2014","false","1.9"," 5 of 9 people (56%) found this review helpful","56","5","9","0","0"
"http://steamcommunity.com/profiles/76561198010995264/recommended/224460/","76561198010995264","bulbinator2","http://steamcommunity.com/profiles/76561198010995264/","39 products in account","This game is a HUGE disipointment. Watching the trailer and some gameplay made this game look amazing. An incredible looking world that brings the 20's jazz/circus noir look into a hibrid dream/imaginary world, a great gaming concept with a lot of potential for fun, compelling and complex puzzle solving and an interesting plot with the potential for plenty of depth, growth and heart breaking/warming scenes was not nearly enough to save this buggy overly simplistic and mindnumbingly dull game.","October 15, 2014","false","5.2"," 6 of 11 people (55%) found this review helpful","55","6","11","0","0"
"http://steamcommunity.com/id/CoarseGentleman/recommended/224460/","CoarseGentleman","Graeme","http://steamcommunity.com/id/CoarseGentleman/","988 products in account","To put it simply, Contrast is a game that follows a little girl through her beautiful, broken world.\n\nIn Contrast we take on the role of Dawn, the imaginary friend of the character Didi- we go on an adventure with this little girl who is trying ever so hard to just put her family back together.\n\nContrast features a wonderful Jazz soundtrack that really brings a lot to the game as a whole. The voice acting is full of emotions in both the English and French translations of the game. The voice acting is well recorded and well cut. 5/5\n\nThe visuals in Contrast are some of the best to come out of Greenlight. This near unique art style really gives the game some flavor. Contrast has top quality visuals both in it's 3D, and 2D worlds. I have yet to encounter fuzzy or broken models/textures. 5/5\n\nThe story is brilliant and the execution is just as wonderful. Though many complain that the story is "too short" we need to remember that length does not dictate the quality of the story. Contrast's story is about bringing a broken family back together. The story has all elements of a story, a great intro, tense climax, and an interesting conclusion. Watching the world change as the story progresses is simply fantastic. 4.5/5\n\nMechanically, Contrast has a few issues- though the game does contain a brilliant feature where the character has to work through both 2D and 3D worlds, this proves to cause some of the major problems in the game. In the shadow(2D) world, the gameplay is relatively choppy- whether the character will execute commands correctly in this state is hit or miss. We can regularly see the character pop out of the shadow world for no apparent reason what so ever. This is not game breaking, but does cause some frustration when attempting more complex or multi-step puzzles. 3.5/5\n\nI believe that this game could also use some optimization with the keyboard/mouse. For me, it was a little tasking making the settings work with my hardware. This has no impact on the final rating.\n\nFinal rating – 18/20 or 90%   - I would suggest getting this game.","January 16, 2014","true","5.0"," 7 of 13 people (54%) found this review helpful","54","7","13","0","2"
"http://steamcommunity.com/id/cherrn/recommended/224460/","cherrn","Hakkesshu","http://steamcommunity.com/id/cherrn/","961 products in account","This game is not very good. It looks great and has some interesting ideas, but the mechanics and controls feel shoddy and unrefined. Just not worth the frustration.","December 28, 2013","false","1.1"," 8 of 15 people (53%) found this review helpful","53","8","15","0","0"
"http://steamcommunity.com/profiles/76561198041272383/recommended/224460/","76561198041272383","Silathand","http://steamcommunity.com/profiles/76561198041272383/","351 products in account","The game's title perfectly encapsulates my play experience, which alternated between delight and frustration. The story follows a young girl named Didi, and so do we. We step into the shoes of a mysterious young woman called Dawn, who assists Didi on her quest to mend her broken home. The story is generally well executed and the art style and music help sell it beautifully. Steeped in early 20th century vaudeville aesthetics, the game's mood is warm and magical, but the over-the-top theatricality often seeps into the dialogue, at times causing it to come of as trite rather than impactful.\n\nThe main conceit of the game is that Dawn exists in a sort of parallel world, and her only connection to the real world are Didi, who seems to exists in both worlds, and the shadows. Dawn has the ability to literally become a shadow on the wall, and most of the gameplay revolves around using this mechanic to solve puzzles and execute jumping challenges. Shadows are also the only way in which Dawn can see people besides Didi, and the game's most inspired moments combine moments of shadow-puppet storytelling with actual gameplay. Unfortunately, these moments are far and few between, and most of the challenges are fairly mediocre, with the shadow-shift mechanic adding little but a bit of flavor. My biggest disappointment is how often the game interrupts the flow of gameplay with little cutscenes, sometimes wresting away control of your character simply to execute a camera pan and deliver a line from Didi.\n\nThe game shows great potential, but falls short in execution. Aside from the issues already discussed, there are the occasional technical issues, such as graphical glitches, erratic collision detection and at times wonky controls. A more rigorous synthesis of gameplay and storytelling could have elevated this game out of its mediocrity. However, its charming style and rare moments of inspiration make it worth a look should you find it for cheap (e.g. during on of Steam's many sales).","November 26, 2013","false","4.6"," 9 of 17 people (53%) found this review helpful","53","9","17","0","0"
"http://steamcommunity.com/id/nexusproxy/recommended/224460/","nexusproxy","NexusProxy","http://steamcommunity.com/id/nexusproxy/","593 products in account","Noir atmosphere and charismatic characters! <3 Another great indie game!","September 23, 2014","true","1.2"," 2 of 4 people (50%) found this review helpful","50","2","4","0","0"
"http://steamcommunity.com/id/Agrobal/recommended/224460/","Agrobal","Agrobal","http://steamcommunity.com/id/Agrobal/","657 products in account","Contrast was an interesting take when it comes to puzzle platformers. It has an emotional tale that may touch some or leave others wondering if it was worth the journey. I am with the latter. Don't get me wrong, it is not a bad game, just not my cup of tea. I would still recommend it for those that want a short and sweet experience. From a technical perspective, it kept on crashing on me for some reason, but otherwise it is an okay game.","September 21, 2014","true","4.3"," 1 of 2 people (50%) found this review helpful","50","1","2","0","0"
"http://steamcommunity.com/id/SisigWithRicePH/recommended/224460/","SisigWithRicePH","SisigWithRice","http://steamcommunity.com/id/SisigWithRicePH/","182 products in account","Contrast (video game) is a noir atmospheric puzzler set it in the 1920's. You play as Dawn, the imaginary friend to Didi, a 9 year old girl who's step father is trying to put together a circus. Throughout the game, you must help Didi help her father put on a good show.\n\nYou morph in and out of the 3D world and 2D world of shadows, helping Didi by solving various puzzles. The gameplay was okay, there is a little bit of weirdness with the camera, but it wasn't too bad. It's a lot of parkour but the puzzles were pretty simple. The majority of what makes this game so good are the music, art and it's story. If anything, it's what makes the game worthwhile. Should be a quick and easy finish and will make for a good afternoon session.","November 3, 2014","true","3.4"," 1 of 2 people (50%) found this review helpful","50","1","2","0","0"
"http://steamcommunity.com/id/supremedefeat/recommended/224460/","supremedefeat","Supreme Pyrex","http://steamcommunity.com/id/supremedefeat/","409 products in account","TL;DR: Check it out.\n\nTHE GOOD:\n• Gameplay:  Contrast is a truly unique concept; I can't think of anything that does something similar: shifting from a 3D environment to a 2D one using the shadows on the wall.  Shadows can sometimes be manipulated by moving light sources.  It's neat!\n• Story:  The story isn't masterfully told, but it is an interesting one, and I'm glad I stuck around to see it through to the end.\n• Art:  Contrast is beautiful to admire and its music is always a pleasant companion.\n• It's Indie!:  Support your local indie game developer!  Especially when they're doing awesome work like this!\n\nTHE BAD:\n• Game Feel:  As cool as traversing the shadows as a platformer is, Contrast has a tendency to be real finicky.  On some puzzles, I would get so frustrated falling out of the shadows, I would question if I was performing the task correctly; in every case, I was.  It becomes easy to slip out from the 2D world and fall to your death, and not even be sure why it happened.  I managed to finish every puzzle, but I would have had a lot more fun if the mechanics had been fine-tuned a bit more.\n• Acting:  The voice acting could've been a little more convincing, but--  Ehh! What'r'ya gonna do?","November 6, 2014","true","4.5"," 1 of 2 people (50%) found this review helpful","50","1","2","0","0"
"http://steamcommunity.com/id/believe6impossiblethings/recommended/224460/","believe6impossiblethings","believe6impossiblethings","http://steamcommunity.com/id/believe6impossiblethings/","128 products in account","It is an excellent puzzle game. Soundtracks are perfect. However, you cannot save it so you have to finish the mission or you have to find memories. Some chapters are very hard to pass but still excellent.","November 23, 2014","true","7.3"," 1 of 2 people (50%) found this review helpful","50","1","2","0","0"
"http://steamcommunity.com/id/Tupaschoal/recommended/224460/","Tupaschoal","Tupscal","http://steamcommunity.com/id/Tupaschoal/","148 products in account","I started tracking this game back when it was on Greenlight, and it looked amazing back then. It took me some time to start playing it after it was released, but I'm glad to say that it is actually pretty neat, with very interesting and novel mechanics, with a cool story behind. It can be beaten pretty fast and I would actually recommend doing it. The bad parts about the game are: excessive guidance on what you need to do, every cinematic shows you exactly where you need to head, let me explore a bit! Almost all achievements are all very easy as well, with no need to go back to previous chapters once you finish the game to get them.\nI recommend it, but would really like to see the same mechanics developed better in a more polished and longer game, with challenge rating up a bit.","November 16, 2014","true","3.3"," 1 of 2 people (50%) found this review helpful","50","1","2","0","0"
"http://steamcommunity.com/id/orlandirafael/recommended/224460/","orlandirafael","orlandirafael","http://steamcommunity.com/id/orlandirafael/","387 products in account","This game is incredible. Nice ambience, history, soundtrack a gameplay. It remind's me a lot of Tim Shaffer games. There's a dreamy ambience all the time. The puzzles wasn't very creative, but the overall game is pretty enjoyable. The 2D animations and cutscenes are a piece of art. Very recommended!","November 20, 2014","true","3.7"," 1 of 2 people (50%) found this review helpful","50","1","2","0","0"
"http://steamcommunity.com/id/jasmineguimaraes/recommended/224460/","jasmineguimaraes","Jasmine","http://steamcommunity.com/id/jasmineguimaraes/","109 products in account","I spent a long time wanting this game, and when i bought i had no disappointments. Contrast its one of the most beautiful games i ever played, you feel the atmosphere so well that seems that the game just absorbed you. It has some bugs that must be fixed, but that definately doesn't ruin the game. Constrat is a masterpiece that must be polished to achieve perfection.","November 23, 2014","true","3.6"," 1 of 2 people (50%) found this review helpful","50","1","2","0","0"
"http://steamcommunity.com/id/ineluki_stormking/recommended/224460/","ineluki_stormking","Ineluki","http://steamcommunity.com/id/ineluki_stormking/","174 products in account","This is the second worst kind of indie game.\nThe worst kind being cheap ripoffs of whatever's popular right now (see: zombies, survival, crafting).\nThis however is an overly artsy fartsy platformer with one single original idea - which cannot carry a game by itself.\nIn the first hour or act you gain no understanding of your agency or place in the world and you begin to realize that you never will. The game just is way too much in love with its imaginary-friend-perspective of storytelling.\nAnd what do you do? Follow a linear corridor of boring puzzles. Yes the shadow walking gimmik makes them orignal, but the shallow world, fixed camera (starting in act2!), and dodgy controls really remove all joy that might have been had here.\nOh and the "Soundtrack" are 15 tracks that amount to 20 minutes of samey music - and it's not even in FLAC format.\nNot even worth 5 bucks.\n","November 4, 2014","false","0.9"," 5 of 10 people (50%) found this review helpful","50","5","10","0","0"
"http://steamcommunity.com/profiles/76561198065427319/recommended/224460/","76561198065427319","Vex","http://steamcommunity.com/profiles/76561198065427319/","50 products in account","Great concept, poor execution.  It's to repetetive and boring for my taste, and I catch myself just playing to get through it instead of because I enjoy it.","November 3, 2014","false","2.1"," 1 of 2 people (50%) found this review helpful","50","1","2","0","0"
"http://steamcommunity.com/id/lurgenau/recommended/224460/","lurgenau","Lurgen","http://steamcommunity.com/id/lurgenau/","183 products in account","Absolute rubbish. Great soundtrack, exciting trailer, but ♥♥♥♥ gameplay.","June 28, 2014","false","0.6"," 4 of 8 people (50%) found this review helpful","50","4","8","0","0"
"http://steamcommunity.com/profiles/76561198067758778/recommended/224460/","76561198067758778","Crestfallen_Rose","http://steamcommunity.com/profiles/76561198067758778/","280 products in account","I really want to like this game, believe me, I do.\n\nI adore the music and the unique art style and the story is interesting, but the gameplay is so infuriatingly difficult at times that it breaks the immersion and makes me not want to play it.\n\nThe shadow shift ability is very sensitive. If you run into something, or if you're crushed by something, you'll shift out of the walls and you'll have to try again or you just might die altogether. Not only that, but it's very easy to miss jumps when you're trying to jump over certain gaps (most are easy to scale, but there are a few that are just mind boggling). And there are also some puzzles in which you have to reach a platform in a small amount of time - and those kinds of challenges in games are always maddening.\n\nI'll play and I'll be mesmerized by the details and I'll want to find out what happens next in the story but then I reach a roadblock of a challenge and - after being pushed out of the walls, failing to jump over gaps and dying repeatedly - I get increasingly frustrated and then it's not about the story or the gameplay anymore, all the focus has shifted to that one piece that just doesn't seem to give if you don't get it just right. And after all is said and done and I can move on, I just can't relax and enjoy the game anymore and have to shut it off. A game is something that you should be able to enjoy and crave, but if it's frustrating - there's no point in trying; and that's a real shame.\n\nIt's a good game if you're a big fan of challenging puzzles; but if you're looking for a fun game with a sense of ease and flow, you might want to find something else to try.","July 10, 2014","false","5.1"," 1 of 2 people (50%) found this review helpful","50","1","2","0","0"
"http://steamcommunity.com/id/adriansnrub/recommended/224460/","adriansnrub","Adrian Snrub","http://steamcommunity.com/id/adriansnrub/","281 products in account","This game showed off some very cool concepts prior to launch.\n\nUnfortunately there isn't a whole lot more to this game that you can't already get in the trailer.\n\nThe game was buggy, short, poorly written, forgettable and had an extremely limited soundtrack.\n\nOverall: not worth it. Get your oldtimey fix from Bioshock 1 and Bioshock Infinite instead.","September 6, 2014","false","4.2"," 1 of 2 people (50%) found this review helpful","50","1","2","0","0"
"http://steamcommunity.com/id/ryukthecreep/recommended/224460/","ryukthecreep","Xuchilbara","http://steamcommunity.com/id/ryukthecreep/","462 products in account","A nice concept completely ruined by a poor and rushed development. Not only this game is tremendously short (4 hours to get 100% completion, including replaying a chapter to get a thing I missed!), it's also full of glitches and the so called "secrets" are ridiculously easy to find. Moreover, the plot is undermined by a fragmented exposition which is just too rushed and specious to make sense like it should and ends abruptly leaving little to nothing to the player.\n\nThere were many good ideas at the base of this title and It's pretty clear that the developers had issues in the making of it, but even considering that and making an effort to appreciate its aesthetics it's nearly impossible to recommend Contrast to anyone. Not even at a sale price.","October 13, 2014","false","4.5"," 4 of 8 people (50%) found this review helpful","50","4","8","0","0"
"http://steamcommunity.com/id/merilsell/recommended/224460/","merilsell","merilsell","http://steamcommunity.com/id/merilsell/","1655 products in account","*sigh*\n\nI really want to like this game, and I'm sure I would, if I could ever go past the starting screen without it freezing up my Windows. That would be really great to have, as in it being a game that is actually _playable_, but alas it is nothing but a horribly programmed mess. Which is a pity considering how beautiful this game seems to be.\n\n(The hour of "playtime" seen here  was me trying to get it to run and me trying to (unsuccessfully) alt-tab out of it when it crashed in my face btw (which forced me to restart my system)...So, no, there was never any actual playtime happening. Go figure.)","October 16, 2014","false","0.5"," 2 of 4 people (50%) found this review helpful","50","2","4","0","0"
"http://steamcommunity.com/id/pwkfisher/recommended/224460/","pwkfisher","Shark Joe","http://steamcommunity.com/id/pwkfisher/","628 products in account","I did a full review of this game here (http://masterofbacklog.com/game-review/contrast/), but the long and short of it is this:\n\nThe ideas in this game are fantastic, but they simply aren't executed well enough to make them interesting or worth the face value of entry.  I'd love to see these devs do another game using these concepts and make them a little more interesting, but I can't recommend this game as it is right now.\n\n","November 27, 2013","false","2.4"," 8 of 16 people (50%) found this review helpful","50","8","16","0","0"
"http://steamcommunity.com/id/imp3tus/recommended/224460/","imp3tus","slapchop","http://steamcommunity.com/id/imp3tus/","173 products in account","Great concept, but it feels unfinished and rough around the edges. Considering that I am usually looking to be immersed in a game, the gameplay glitches and mediocre character models made Contrast hard to get into.","December 9, 2013","false","1.0"," 7 of 14 people (50%) found this review helpful","50","7","14","0","1"
"http://steamcommunity.com/id/imp3tus/recommended/224460/","imp3tus","slapchop","http://steamcommunity.com/id/imp3tus/","173 products in account","Great concept, but it feels unfinished and rough around the edges. Considering that I am usually looking to be immersed in a game, the gameplay glitches and mediocre character models made Contrast hard to get into.","December 9, 2013","false","1.0"," 7 of 14 people (50%) found this review helpful","50","7","14","0","1"
"http://steamcommunity.com/id/haryor/recommended/224460/","haryor","Haryor","http://steamcommunity.com/id/haryor/","69 products in account","The game is supposedly worth it for it's story, but it's very clear how the developers try to get away with an extremly simple and eventless plot, in which practically nothing happens at all, and is only partially gullible due to it's heavily dramatic scenes - which doesn't make those less cliché; we've seen it all before. Considering this oversimplistic story, the game is overall boring, due to extremly easy and unchallenging puzzles. The gameplay time is barelly 5 hours long, but at least for me, that was mostly due to a very glitchy scenario and overall irresponse controls. I wouldn't say it's horrible, but that's only because of its lovely art direction and sublime soundtrack.","December 27, 2013","false","8.2"," 4 of 8 people (50%) found this review helpful","50","4","8","0","0"
"http://steamcommunity.com/id/PeetDAT/recommended/224460/","PeetDAT","Peet.DAT","http://steamcommunity.com/id/PeetDAT/","541 products in account","Concept and art direction are in the right place but that doesn't make up for the frustrating and unresponsive gameplay. Contrast pretty much encapsulates everything that is bad about 3D platforming.","January 3, 2014","false","2.8"," 1 of 2 people (50%) found this review helpful","50","1","2","0","0"
"http://steamcommunity.com/id/oOWolfieOo/recommended/224460/","oOWolfieOo","Wolfie","http://steamcommunity.com/id/oOWolfieOo/","130 products in account","It only took me 4 hours to complete the game... :-(","January 13, 2014","false","3.6"," 1 of 2 people (50%) found this review helpful","50","1","2","0","0"
