"url","reviewerUsername","reviewerDisplayName","reviewerUrl","reviewerProductsCount","reviewText","date","recommended","hoursPlayed","voteText","helpfulPercent","votesHelpful","votesTotal","votesFunny","commentsCount"
"http://steamcommunity.com/id/reaceneace/recommended/224460/","reaceneace","Reace","http://steamcommunity.com/id/reaceneace/","1125 products in account","Astonishingly beautiful.\n\nThe gameplay is unique. The art directions and music compositions are both fantastic and well used in the game.\n\nThe storyline however, is very typical and does not gives you much of an impact. There is not much replayability value unless you want to replay the short platforming puzzles and unlock all achievements. There's however something special to look forward into at the end of the game.\n\nI can see that this game is going to be a benchmark of something special towards future puzzle/platform games.","January 19, 2014","true","3.5"," 2 of 2 people (100%) found this review helpful","100","2","2","0","0"
"http://steamcommunity.com/id/Wanginator/recommended/224460/","Wanginator","Wanginator!","http://steamcommunity.com/id/Wanginator/","962 products in account","Very clever.  Much better than anticipated.  And the soundtrack is good too!","January 8, 2014","true","0.3"," 2 of 2 people (100%) found this review helpful","100","2","2","0","0"
"http://steamcommunity.com/id/capnberni/recommended/224460/","capnberni","Cap'n Berni","http://steamcommunity.com/id/capnberni/","97 products in account","Just an epic great game, waiting for the sequel","January 12, 2014","true","3.2"," 2 of 2 people (100%) found this review helpful","100","2","2","0","0"
"http://steamcommunity.com/id/zoth-ommog/recommended/224460/","zoth-ommog","Zoth-Ommog","http://steamcommunity.com/id/zoth-ommog/","1473 products in account","This game is beautiful, just beautiful. The setting, the character design, the music, the atmosphere - all are spot-on.\n\nIt's more puzzles than platformers, and the puzzles have a habit of looking terribly difficult at first, but aren't too hard to figure out, and solving them made me feel all smart and smarmy :)\n\nPlatforming gameplay is easy to pick up on, controls are fine, it's good fun.\n\nOnly negative points are it's length (3.5 hours left me craving for more !) and (and this is a minor nitpick really) the fact that the black screen before cutscenes last just a little bit too long.\n\nAll in all, great experience, well worth the money, would absolutely buy again.","January 13, 2014","true","3.7"," 2 of 2 people (100%) found this review helpful","100","2","2","0","0"
"http://steamcommunity.com/id/agroovywalrus/recommended/224460/","agroovywalrus","agroovywalrus","http://steamcommunity.com/id/agroovywalrus/","124 products in account","This game has a lot of potential, from what I have seen it is pretty short, but the gameplay is absolutely amazing. I am very much hoping for some addon levels just for the fun gameplay.","December 30, 2013","true","2.2"," 2 of 2 people (100%) found this review helpful","100","2","2","0","0"
"http://steamcommunity.com/profiles/76561198006667103/recommended/224460/","76561198006667103","Binarybob","http://steamcommunity.com/profiles/76561198006667103/","153 products in account","Pretty fun game overall. Cute story, fun game concept. Gets a bit repetitive over time. Could use a bit more gameplay.","January 3, 2014","true","8.0"," 2 of 2 people (100%) found this review helpful","100","2","2","0","0"
"http://steamcommunity.com/profiles/76561197990539359/recommended/224460/","76561197990539359","gscualo","http://steamcommunity.com/profiles/76561197990539359/","378 products in account","Another beautiful one. Great environment, music and ingenious.","December 30, 2013","true","2.4"," 2 of 2 people (100%) found this review helpful","100","2","2","0","0"
"http://steamcommunity.com/profiles/76561198069603794/recommended/224460/","76561198069603794","jarred303","http://steamcommunity.com/profiles/76561198069603794/","73 products in account","I haven't beaten it yet, but I'll say this. I'm very intrigued by the story!","December 31, 2013","true","1.8"," 2 of 2 people (100%) found this review helpful","100","2","2","0","0"
"http://steamcommunity.com/id/darth_raziel/recommended/224460/","darth_raziel","Tomato Stronk","http://steamcommunity.com/id/darth_raziel/","788 products in account","A really nice, but rather short game. A lot of bizzare wrapped in some stylish graphics and classy jazz.","January 2, 2014","true","3.7"," 2 of 2 people (100%) found this review helpful","100","2","2","0","0"
"http://steamcommunity.com/id/mnemyx/recommended/224460/","mnemyx","☆彡|| Mnemyx","http://steamcommunity.com/id/mnemyx/","522 products in account","I don't know if I *really* recommend the game.\n\nThe concept/story is nice, the artwork is beautiful, but the controls are buggy to the point that I hated the game come Act 3. The weird clipping didn't help, and it's kind of pricey.\n\nOn top of that, it messed up during the last part and wouldn't register when I was lighting up the stage. And I wasn't about to go through the lighthouse puzzle again, even if it meant finishing the game =/","January 1, 2014","true","5.4"," 2 of 2 people (100%) found this review helpful","100","2","2","0","1"
"http://steamcommunity.com/id/broken_mirror/recommended/224460/","broken_mirror","Broken Mirror","http://steamcommunity.com/id/broken_mirror/","131 products in account","Intro:\nWell I first noticed this game shortly after I started playing Bioshock Infinite. It cought my eye because of it's art style. After watching the trailers, I added this to my wishlist and purchased it during Winter Sale.\n\nWell I'm not sure how to rate this game. It's really well done in the visual and aural departments. The atmosphere really transports that 20s France feeling. But there are some things to be improved.\n\nGraphics:\nNot much to rant about. Maybe that's because im easy to plese with graphics, as long as they just fit together. But there are some glitches, especially on movable objects (crates and balls). The puddles on the streets look more like ice than water. That's because there is no added effect if you walk through them.\n\nAudio:\nAlso nothing to really complain. The music is well done and fits the scenery. I really like the track that runs during the menu screen. The voice acting is okay except for Didi. Her lines just sound "strange" every now and then.\n\nControls:\nMy main complaint. It just feels like one of those early cheap 3D games. I often had problems judging how far I could jump. It just doesn't feel right. But I got used to it after a while.\n\nGameplay:\nYou spend a lot of time shifting into the shadows to acomplish your tasks. Sometimes the engine seems to have problems if the surface you are moving on is not even. If there is a corner, that's also a problem sometimes. But at least once the game forces you to go around a corner (which is evenly lit), so it cannot be intentional that the game throws you out of the shadow realm.\n\nSometimes there are new things to consider when solving puzzles. Unlike in many other games you are not shown that those concepts are there. Like shifting certain objects with you or moving objects using spotlights. I'm not really sure if this is a good thing or not. But I really liked finding those things out by myself. Maybe some optional hints would solve this "problem" for both sides.\n\nStory:\nTo make it short: No epicness, no world rescue, no over the top characters, no "only he/she can do it". But nothing that special either... but as there hasn't been a story one could call "groundbreaking" or "has never been done before" in the recent past, I really like that simplicity.\n\nConclusion:\nAn artistically nice game with a few control hiccups that doesn't do handholding and is solvable without the use of walkthroughs or FAQs. Tells a down to earth fantasy story without uneccesary epicness. Buy it if you like artistically interesting games that don't neccessarily appeal to the masses.\n\nEDIT:\nWhat I really forgot:\nIt would've been nice if there was some more interaction with Didi. She often just stands there and does nothing. It only was about two times that she assisted you in one way or the other. For example: the screenshot where she lights the way with a lamp? Never happened.","January 12, 2014","true","3.0"," 2 of 2 people (100%) found this review helpful","100","2","2","0","1"
"http://steamcommunity.com/id/shivars/recommended/224460/","shivars","shivars","http://steamcommunity.com/id/shivars/","484 products in account","Fairly short, and not too hard puzzle-wise - but these are good characteristics in my view.  I found Contrast to be a really nice relaxing jaunt with a nice art style (incl. music), straightforward fun gameplay, and a really endearing story - and the whole shadow thing was pretty neat.  There's not a lot of new ground being trodden, and some technical limitations (no AA, no 3D support), but it was a really enjoyable 3-4 hours.","January 25, 2014","true","3.5"," 2 of 2 people (100%) found this review helpful","100","2","2","0","0"
"http://steamcommunity.com/id/alaric_lemcovich/recommended/224460/","alaric_lemcovich","Decidedly British Alaric","http://steamcommunity.com/id/alaric_lemcovich/","221 products in account","Puzzle-Platforming, Film Noir Style.\n\nContrast is certainly not for action junkies, nor for gamers who aren't all that interested in storytelling, but for me this little gem from Compulsive Games makes for an excellent puzzle-platformer.\n\nThe big mechanic here is the ability to shift into silhouette form and solve problems with shadows.  It's remarkably adept at holding player interest because Contrast gives us so much to do, from simple platforming to complex object manipulation.  The 3D platforming elements are minimal, though there is a fair bit of 2D-3D shifting in certain sections to keep players on their toes.\n\nOur intrepid developers have done very well with the Unreal Engine, bringing a dreamscape 1920s world to life with a unique art style that makes full use of a specially commissioned Jazz n' Blues soundtrack.  This game treats us the way a lot of independent titles should: like intelligent people who don't need a compass pointing towards every objective, or a full explanation for every plot point.\n\nIt isn't Braid or Portal by any stretch of the imagination, but it is an indie game that has been built with careful attention to detail and a clear love for simple ideas that lead into complexity.  A potential downside is that it's too short.  That said, I paid full price for the Special Edition and I'm not regretting it.\n\nSo, action-seekers stay away.  Thoughtful types who enjoy their puzzles with a twist of atmosphere - welcome!\n\nStill not sure which way you're swinging?  Watch my full video review here:\n\nhttp://store.steampowered.com","January 28, 2014","true","3.4"," 2 of 2 people (100%) found this review helpful","100","2","2","0","0"
"http://steamcommunity.com/profiles/76561197967367030/recommended/224460/","76561197967367030","MainframeMouse","http://steamcommunity.com/profiles/76561197967367030/","91 products in account","Beautifully crafted story in a very clever game.\n\nWhat it lacks in game time, it makes up with emotion and story telling. Great work guys.","February 10, 2014","true","11.1"," 2 of 2 people (100%) found this review helpful","100","2","2","0","0"
"http://steamcommunity.com/id/darth_raziel/recommended/224460/","darth_raziel","Tomato Stronk","http://steamcommunity.com/id/darth_raziel/","788 products in account","A really nice, but rather short game. A lot of bizzare wrapped in some stylish graphics and classy jazz.","January 2, 2014","true","3.7"," 2 of 2 people (100%) found this review helpful","100","2","2","0","0"
"http://steamcommunity.com/id/mnemyx/recommended/224460/","mnemyx","☆彡|| Mnemyx","http://steamcommunity.com/id/mnemyx/","522 products in account","I don't know if I *really* recommend the game.\n\nThe concept/story is nice, the artwork is beautiful, but the controls are buggy to the point that I hated the game come Act 3. The weird clipping didn't help, and it's kind of pricey.\n\nOn top of that, it messed up during the last part and wouldn't register when I was lighting up the stage. And I wasn't about to go through the lighthouse puzzle again, even if it meant finishing the game =/","January 1, 2014","true","5.4"," 2 of 2 people (100%) found this review helpful","100","2","2","0","1"
"http://steamcommunity.com/id/broken_mirror/recommended/224460/","broken_mirror","Broken Mirror","http://steamcommunity.com/id/broken_mirror/","131 products in account","Intro:\nWell I first noticed this game shortly after I started playing Bioshock Infinite. It cought my eye because of it's art style. After watching the trailers, I added this to my wishlist and purchased it during Winter Sale.\n\nWell I'm not sure how to rate this game. It's really well done in the visual and aural departments. The atmosphere really transports that 20s France feeling. But there are some things to be improved.\n\nGraphics:\nNot much to rant about. Maybe that's because im easy to plese with graphics, as long as they just fit together. But there are some glitches, especially on movable objects (crates and balls). The puddles on the streets look more like ice than water. That's because there is no added effect if you walk through them.\n\nAudio:\nAlso nothing to really complain. The music is well done and fits the scenery. I really like the track that runs during the menu screen. The voice acting is okay except for Didi. Her lines just sound "strange" every now and then.\n\nControls:\nMy main complaint. It just feels like one of those early cheap 3D games. I often had problems judging how far I could jump. It just doesn't feel right. But I got used to it after a while.\n\nGameplay:\nYou spend a lot of time shifting into the shadows to acomplish your tasks. Sometimes the engine seems to have problems if the surface you are moving on is not even. If there is a corner, that's also a problem sometimes. But at least once the game forces you to go around a corner (which is evenly lit), so it cannot be intentional that the game throws you out of the shadow realm.\n\nSometimes there are new things to consider when solving puzzles. Unlike in many other games you are not shown that those concepts are there. Like shifting certain objects with you or moving objects using spotlights. I'm not really sure if this is a good thing or not. But I really liked finding those things out by myself. Maybe some optional hints would solve this "problem" for both sides.\n\nStory:\nTo make it short: No epicness, no world rescue, no over the top characters, no "only he/she can do it". But nothing that special either... but as there hasn't been a story one could call "groundbreaking" or "has never been done before" in the recent past, I really like that simplicity.\n\nConclusion:\nAn artistically nice game with a few control hiccups that doesn't do handholding and is solvable without the use of walkthroughs or FAQs. Tells a down to earth fantasy story without uneccesary epicness. Buy it if you like artistically interesting games that don't neccessarily appeal to the masses.\n\nEDIT:\nWhat I really forgot:\nIt would've been nice if there was some more interaction with Didi. She often just stands there and does nothing. It only was about two times that she assisted you in one way or the other. For example: the screenshot where she lights the way with a lamp? Never happened.","January 12, 2014","true","3.0"," 2 of 2 people (100%) found this review helpful","100","2","2","0","1"
"http://steamcommunity.com/id/shivars/recommended/224460/","shivars","shivars","http://steamcommunity.com/id/shivars/","484 products in account","Fairly short, and not too hard puzzle-wise - but these are good characteristics in my view.  I found Contrast to be a really nice relaxing jaunt with a nice art style (incl. music), straightforward fun gameplay, and a really endearing story - and the whole shadow thing was pretty neat.  There's not a lot of new ground being trodden, and some technical limitations (no AA, no 3D support), but it was a really enjoyable 3-4 hours.","January 25, 2014","true","3.5"," 2 of 2 people (100%) found this review helpful","100","2","2","0","0"
"http://steamcommunity.com/id/alaric_lemcovich/recommended/224460/","alaric_lemcovich","Decidedly British Alaric","http://steamcommunity.com/id/alaric_lemcovich/","221 products in account","Puzzle-Platforming, Film Noir Style.\n\nContrast is certainly not for action junkies, nor for gamers who aren't all that interested in storytelling, but for me this little gem from Compulsive Games makes for an excellent puzzle-platformer.\n\nThe big mechanic here is the ability to shift into silhouette form and solve problems with shadows.  It's remarkably adept at holding player interest because Contrast gives us so much to do, from simple platforming to complex object manipulation.  The 3D platforming elements are minimal, though there is a fair bit of 2D-3D shifting in certain sections to keep players on their toes.\n\nOur intrepid developers have done very well with the Unreal Engine, bringing a dreamscape 1920s world to life with a unique art style that makes full use of a specially commissioned Jazz n' Blues soundtrack.  This game treats us the way a lot of independent titles should: like intelligent people who don't need a compass pointing towards every objective, or a full explanation for every plot point.\n\nIt isn't Braid or Portal by any stretch of the imagination, but it is an indie game that has been built with careful attention to detail and a clear love for simple ideas that lead into complexity.  A potential downside is that it's too short.  That said, I paid full price for the Special Edition and I'm not regretting it.\n\nSo, action-seekers stay away.  Thoughtful types who enjoy their puzzles with a twist of atmosphere - welcome!\n\nStill not sure which way you're swinging?  Watch my full video review here:\n\nhttp://store.steampowered.com","January 28, 2014","true","3.4"," 2 of 2 people (100%) found this review helpful","100","2","2","0","0"
"http://steamcommunity.com/id/Jragghen/recommended/224460/","Jragghen","Jragghen","http://steamcommunity.com/id/Jragghen/","965 products in account","This is a solid puzzle platformer, if a little short and rough around the edges. Primary mechanics feature the protagonist moving into and back from the wall, as a shadow. There is an interesting motif associated with this which ties into the story of the game which I'll leave for the user to find out, but it's done in a way that I've not seen in a game before.\n\nThe controls are a *little* loose, and there seems to be a little edge detection problems when it comes to the shadow movement. However, it's rarely overly frustrating. I will say that (with one or two exceptions), the puzzles seem rather straightforward, and even devolve into box puzzles despite the short length of the game - so some folks might find that a little disappointing.\n\nThe one thing that the player should probably be aware of going in, though, is that the story is rather weighty, dealing with some rather serious topics (abandonment issues, deadbeat parents, etc). When I first booted up the game I was looking for something a little more whimsical, so it caught me off guard. Please note that this is not a mark against the game - simply something that I was not expecting, and which other players might want to know going in.\n\nOverall, I'd recommend it for folks who are looking for a short, stylistic puzzle platformer.","February 15, 2014","true","3.6"," 2 of 2 people (100%) found this review helpful","100","2","2","0","0"
"http://steamcommunity.com/profiles/76561198037735346/recommended/224460/","76561198037735346","Thunder Chunky","http://steamcommunity.com/profiles/76561198037735346/","406 products in account","Over flowing with charm, originality and heart. Contrast offers stunningly beautiful visuals with a soundtrack to match, complemented by compelling and innovative puzzles. Easily one of the most important games I've ever played and one of my absolute favorites of all time","March 21, 2014","true","4.1"," 2 of 2 people (100%) found this review helpful","100","2","2","0","0"
"http://steamcommunity.com/id/Astorica/recommended/224460/","Astorica","Astorica","http://steamcommunity.com/id/Astorica/","163 products in account","It's great. Kind of short, but worth it\n\nSlightly buggy at points, but nothing that should ruin gameplay (this has probably been fixed)\nUnique mechanic with the shadow platforming, and changing back and fourth between 2D and the 3D world.\nIt's open world is kind of linear, as there isnt really anywhere to explore other than story areas or dark alleys for collectibles.\nThe environment is beautiful as well as stylized.\nThe story is great and leaves on a cliffhanger, so I'm hoping we'll have some sort of sequel?","November 22, 2013","true","6.7"," 2 of 2 people (100%) found this review helpful","100","2","2","0","1"
"http://steamcommunity.com/profiles/76561198101364465/recommended/224460/","76561198101364465","The Trooper","http://steamcommunity.com/profiles/76561198101364465/","178 products in account","Great concept with beautiful graphics\nThe game is a work of art. The noir theme set in France with soothing jazz sets a great stage.\n\nI found some puzzles very difficult with the glitchy controls. Sometimes it is difficult to solve puzzles because the way to do it is unintuitive. Limiting abilities was a pain such as not being able to grab a ledge because the game doesn't want you to.\n\nThe story wasn't exceptional but it was enjoyable.","December 31, 2014","true","4.1"," 2 of 2 people (100%) found this review helpful","100","2","2","0","0"
"http://steamcommunity.com/id/ImpalaPUA/recommended/224460/","ImpalaPUA","Impala","http://steamcommunity.com/id/ImpalaPUA/","261 products in account","My Impression:\nI heard about this game from watching the trailer of another game from the creators of this (We Happy Few). The artwork of Contrast depicts a Tim Burton movie with sex appeal; a seductive world of light and darkness. Contrast adds a unique feature that allows one to shift between the striking 3D fantasy world and the mysterious 2D shadowscape. I was intrigued...\n\nPositive:\n+ Amazing artwork accompanied with amazing voice acting\n+ The story compliments the artwork with a jazzy soundtrack that is a pleasure to experience\n+ Fun puzzles that are challenging but not impossible, fun for everyone\n+ Shifting between 2D and 3D is a fun new feature introduced to platformers\n\nCons:\n- Too Short\n- Story seems rushed\n- Awkward save features\n- A little too linear\n\n(a lot of the negative reviews are from 2013-2014 and complain about bugs, most if not all seem to be fixed)\n\nI purchased this game in a bundle and really enjoy it. I don't think I would pay $14.99 for it because of the length of the game, but if you can get it in a sale or bundle, it's a must try. Simply put, Contrast is a simple, yet poetic game of shadows and light.\n\n8/10","January 30","true","7.0"," 2 of 2 people (100%) found this review helpful","100","2","2","0","0"
"http://steamcommunity.com/id/TheOnlyLeviathan/recommended/224460/","TheOnlyLeviathan","Alzrael","http://steamcommunity.com/id/TheOnlyLeviathan/","107 products in account","A near perfect game. The concept of using shadows as part of a puzzle is a brilliant idea, that was a perfect fit to the story. The music and level design worked wonderfully together, giving a slight feeling of melancholy. The odd time, you could jump on a shadow if you got too close to the wall without being a shadow yourself, but apart from that a near perfect experience. Short but sweet. 9/10","February 22","true","2.8"," 2 of 2 people (100%) found this review helpful","100","2","2","0","0"
"http://steamcommunity.com/id/TiagoRocha1989/recommended/224460/","TiagoRocha1989","Tiago Rocha","http://steamcommunity.com/id/TiagoRocha1989/","135 products in account","Contrast is small, but it makes big in our hearts.\n\nWe take the roll of Dawn, a shadow presence only seen by a small girl named Didi. The youngster is curious about the world, and has a dream; bring her family together.\nWhile we use the shadows to solve puzzles and protect Didi, we get ourselves wrapped in a plot to help Didi's family, or what's left of it. A father who is involved in shady mob-business, a mother who sings at a club, and a strange magician who is somehow related to Didi. A beautiful plot within an even gorgeous 1920's atmosphere, full of hopes and dreams disguised in the deadly shadows of the alleys.\n\nAlthough the puzzles start on an easy way, it soon requires you do make use of your grey cells, and when you’re really enjoying, it ends...!\nCollecting achievements is fun, and will maybe give you a reason to go back a second time.\nOverall the game presents a nice experience, with a nice soundtrack that take you back several decades to an era of glamour.\n\nI give it a 7/10. It's amazing, but short. Twice the length, and it would be a solid 9!","July 17, 2015","true","5.3"," 2 of 2 people (100%) found this review helpful","100","2","2","0","0"
"http://steamcommunity.com/profiles/76561198044665919/recommended/224460/","76561198044665919","Asti","http://steamcommunity.com/profiles/76561198044665919/","217 products in account","Shorter than I expected, but still amazing.\nInteresting gameplay, nice art and designs for both characters and areas, and if the story doesn't catch your interest at the begining of the game - the final Act might change that, too.\n10/10","January 11, 2014","true","4.5"," 2 of 2 people (100%) found this review helpful","100","2","2","0","0"
