"url","reviewerUsername","reviewerDisplayName","reviewerUrl","reviewerProductsCount","reviewText","date","recommended","hoursPlayed","voteText","helpfulPercent","votesHelpful","votesTotal","votesFunny","commentsCount"
"http://steamcommunity.com/profiles/76561197965252024/recommended/224460/","76561197965252024",":TF: SDA","http://steamcommunity.com/profiles/76561197965252024/","464 products in account","Very enjoyable game mechanics - huge potential - way too short.","January 20, 2015","true","2.7"," No ratings yet","0","0","0","0","0"
"http://steamcommunity.com/id/L-san/recommended/224460/","L-san","Eliza-ism","http://steamcommunity.com/id/L-san/","107 products in account","A really cool concept and I liked the story... Sort of. Didn't play all the way through but the puzzles were pretty cool. Nothing too hard, nothing too easy. Worth £3-6 maybe, I dunno.","January 21, 2015","true","1.2"," No ratings yet","0","0","0","0","0"
"http://steamcommunity.com/profiles/76561198037146748/recommended/224460/","76561198037146748","John Doe","http://steamcommunity.com/profiles/76561198037146748/","296 products in account","I love the aesthetics of this games. It feels so refreshing and at the same time old. The music is very good too. The gameplay itself is simple... It's easier to get stuck on some plataform section than not figuring out the solution to a given puzzle. I got a little bore with the gameplay near the end, because of the simplicity of the puzzles, but the rest kept me going.\n\nThe animation of the models feels a little like a 1990's game but get pass that and you have a (short) good experience.\n","January 21, 2015","true","2.5"," No ratings yet","0","0","0","0","0"
"http://steamcommunity.com/id/xDiamondXDestinyx/recommended/224460/","xDiamondXDestinyx","DiamondXDestiny","http://steamcommunity.com/id/xDiamondXDestinyx/","688 products in account","An awesome unique fast-paced game :)\nCompletely worth the buy! Especially on sale! There is Nothing bad about this game!! Believe me, you don't want to pass this one up!\n\nDawn the main character is exciting with her shadow abilities & I enjoyed being in her shoes very much~ looking forward to cosplaying as her in the near future.  The timeline "Around 50's Era" & artwork/graphics is so much fun! & the story is good.. which is always a great thing at least for me. I <3 games with awesome storylines!!  Very Enjoyable.","January 23, 2015","true","4.2"," No ratings yet","0","0","0","0","0"
"http://steamcommunity.com/profiles/76561198008550930/recommended/224460/","76561198008550930","Waffle Sorter","http://steamcommunity.com/profiles/76561198008550930/","94 products in account","This is a fun game. Think Portal, if Portal were also Psychonauts.\n\nYou play as Dawn, an acrobat with the ability to merge into her own shadow - and a curious inability to directly see or be seen by anyone other than Didi. This at first seems like simply an odd quirk, until the ending draws attention to it and refuses to actually offer explanation.\n\nThe controls are good, if a little more responsive on the camera than I expected. The shadow-merging mechanic could use a little more polish - I often found myself popping out of the wall without being able to figure out why, and occasionally ended up across the room from where I had been a moment prior.\n\nThe story is simple, which simply leaves more room to showcase the central mechanic and the world. Most characters (seen via projected shadows) talk with their hands a lot, presumably so you can tell who's talking as lips' shadows are very small.","December 30, 2014","true","6.7"," No ratings yet","0","0","0","0","0"
"http://steamcommunity.com/id/aaronthepuglord/recommended/224460/","aaronthepuglord","AaronThePugLord","http://steamcommunity.com/id/aaronthepuglord/","144 products in account","Contrast is like Bioshock Infinite, but a lot shorter.\n\nIt revolves around that you as a player can fuse into shadows and move around in it, and by doing so clearing obstacles. You can mess around with objects and light sources to help you with the puzzles, and its a very interesting concept. But in some parts I feel the platforming in the shadows are a little bit clunky, and I have no idea why I would just jump out of the shadows sometimes without hitting any obstacles (well I assume i didnt hit anything).\n\nMusic is great, voice acting is great, story can be better, controls are a bit awkward at times for both keyboard and controller,\n\nGood game overall, short but worth it. No brainer if its on discount.","December 30, 2014","true","4.0"," No ratings yet","0","0","0","0","0"
"http://steamcommunity.com/profiles/76561198097950958/recommended/224460/","76561198097950958","d_","http://steamcommunity.com/profiles/76561198097950958/","125 products in account","A really nice an enjoyable little game. I recommend it to anyone interested in solving puzzles in a surreal world of a little girl's imagination.","December 30, 2014","true","3.6"," No ratings yet","0","0","0","0","0"
"http://steamcommunity.com/profiles/76561198039948975/recommended/224460/","76561198039948975","Bladebrent","http://steamcommunity.com/profiles/76561198039948975/","36 products in account","Game was really short, not too difficult, and maybe a bit glitchy.\n\nIt had an interesting concept but the puzzles aren't that difficult to figure out once you figure out all the items at your disposal.  You could do alot with the game but it didn't really last long enough to really amaze me with a whole lot.  Phasing into the shadows is fun but its annoying getting kicked out of the shadows when it seems like you should be fine.  At one point during the Merry-go-round, there was clearly open space that kept kicking me out of the shadows for no reason, and after going around and taking another route, it stopped doing it.  There's far more that could be done than simply putting boxes into the shadows, then moving the spotlight around.  Outside of getting kicked out of the shadows at random sometimes, the puzzles aren't overall too difficult to figure out once you pick out every option at your disposal.  The last stage introduces the idea to focus the spotlight but you cant keep it focused and is only used to raise a box higher and its only used once.  Its fairly useless to introduce something out of nowhere just to solve one puzzle, especially since you need to tell the player the controls so you're basically telling them what to do\n\nOn top of getting forced out of the shadows at odd times, the models for the shadows are clearly screwed up.  Johnny's hat is often floating half off of his head, the character's limbs seem to disconnect, and you can see glitches like this even with Dawn in the shadows.  It was most noticable when you had to float down on an umbrella and it disappeared whenever I faced a specific direction.\n\nThe game overall seemed a bit like Vincenzo's act in the end.  His act seemed cool but I could only see the shadows of it, and it was also over very quickly.  In fact, he seems to hint that there may be monsters in the Shadows that could prove to be an obstacle for Dawn but its never followed up on cause all thats left to do in the game is follow Didi then its over.  The game was very interesting, especially for the concept, but again, it only took 2 hours to complete.  Judging from the other reviews, it seems I may have gotten it down quickly, but in order to get 10 hours of gameplay, you would have to be looking for every luminary and every collectable, or have played through the game multiple times.  The game does have some good music and a good story, but its far too short and gameplay wise, not interesting enough to be worth the $17 (canadian) it costs normally.  I got it during a sale but even then, there's other games you could spend your money on instead","December 30, 2014","false","2.0"," No ratings yet","0","0","0","0","0"
"http://steamcommunity.com/profiles/76561197989161035/recommended/224460/","76561197989161035","emoticon","http://steamcommunity.com/profiles/76561197989161035/","195 products in account","Its a unique game, the shifting into the shadows gameplay is it's major selling point but it also has quite nice art, music and storyline.\n\nAs some of the other reviews hinted - everything in this game is really good but it's lacking some tiny bit of extra wowfactor which would really make it amazing.\n\nI didn't find any terrible bugs.  But it does have issues, sort of like you would expect an infinite possibility sandbox environment to have issues.  It uses the dynamic shadows cast by the graphics engine as part of the gameplay, and sometimes that isn't going to work out right as there's just too many possible shadows that can be created.  I imagine it's damn near impossible to test properly as shadows can be different in a thousand ways.\n\nThe shadow play can be a bit annoying as you fall out of the shadows and back into the 3D world a little too easily.  And once (spoiler!) I shifted an item with me into the shadows and managed to lose it completely somewhere.. take care of your precious metal balls! :)\n\nBut anyway, the game is short and sweet, play it if you like unusual games.\n","December 31, 2014","true","6.2"," No ratings yet","0","0","0","0","0"
"http://steamcommunity.com/profiles/76561198024127846/recommended/224460/","76561198024127846","..","http://steamcommunity.com/profiles/76561198024127846/","175 products in account","The game is so beautiful with a very nice story.The puzzles are smart and the things you can do with the shadows are so clever.The only thing is that the story is short to my opinion.Anyway i liked that game very much that's why i wanted more of it!!!","December 31, 2014","true","8.6"," No ratings yet","0","0","0","0","0"
"http://steamcommunity.com/id/Axess89/recommended/224460/","Axess89","Xellece","http://steamcommunity.com/id/Axess89/","57 products in account","Contrast is a really short game. But if you love puzzles music and art you'll love this game. If you got it I would say got after it during a sale, this is only due to the fact that it is a short game so I wouldnt recommend spending too much on it.","December 31, 2014","true","3.8"," No ratings yet","0","0","0","0","0"
"http://steamcommunity.com/profiles/76561198053328506/recommended/224460/","76561198053328506","khzmk","http://steamcommunity.com/profiles/76561198053328506/","244 products in account","","December 31, 2014","true","7.0"," No ratings yet","0","0","0","0","0"
"http://steamcommunity.com/profiles/76561198066166311/recommended/224460/","76561198066166311","Theballisticmystic","http://steamcommunity.com/profiles/76561198066166311/","100 products in account","Ok I will make this quick and concise. This is a beautiful game, with great writing, solid ideal mechanics and a fun asthetic. But the coding is so bad. This game is not a puzzle game, often times you will figure out the puzzle then retry it 10-30 times because it's actually a near pixle perfect platformer, has completely unreliable physics which is what makes it maddening. I want to get involved with this story I dont want to try a jump 20 times in a row where it takes 10 times to figure out exactly when I have to jump to not drop out of shadow then another 10 to figure out what rotating object I have to get on that will get to the top. So if you are a patient person who loves old school platfpormers, you will like this game, if you are a story based person who likes solving puzzles this game will drive you crazy.","December 31, 2014","false","2.8"," No ratings yet","0","0","0","0","0"
"http://steamcommunity.com/profiles/76561198048863064/recommended/224460/","76561198048863064","Nepeta Noodle","http://steamcommunity.com/profiles/76561198048863064/","86 products in account","I love the story and the game is beautiful but it seems very short, would have liked a little more, especially for the price!","December 31, 2014","true","3.8"," No ratings yet","0","0","0","0","0"
"http://steamcommunity.com/profiles/76561198006086031/recommended/224460/","76561198006086031","‡ The Man With The Hat  ‡ [SWE]","http://steamcommunity.com/profiles/76561198006086031/","138 products in account","Although a bit over-priced considering it being so short (I didn't stress through the game what-so-ever and still beat it in three hours) I recommend this game, but I would advice picking it up when it's on sale, since three hours for 14 euro is a bit on the expensive side. A beutifully designed game, with an engaging and sad little story about a young girl. Filled with economical issues, romantic affairs, mafia-involvement and drama.  With heavy elements of film noir, and with a graphic style that in many ways resembles a german expressionist silent film, with a touch of Tim Burton-esque quirkiness as the beutiful cherry on top. The humoristic elements such as hidden mature jokes really made me happy and sometimes I even laughed out loud. The puzzles are interesting, all though not that hard if you're used to puzzle-solving in games. But I still feel this game brought something new to the puzzle-genre. The gameplay mechanics are very well scripted and you quickly forget what buttons you have to click and just do it on impulse, immersed in the quirky little world that the game takes place in. Overall I really enjoyed this game, but it's far too short.","December 4, 2014","true","3.8"," No ratings yet","0","0","0","0","0"
"http://steamcommunity.com/id/MmePonzilla/recommended/224460/","MmePonzilla","Mme Ponzilla","http://steamcommunity.com/id/MmePonzilla/","72 products in account","Controls feel akward (keyboard+mouse).  There is no way to save the game when you want to (this, really in 2014, should not be allowed in any game).","December 5, 2014","false","0.3"," No ratings yet","0","0","0","0","0"
"http://steamcommunity.com/profiles/76561198120479238/recommended/224460/","76561198120479238","Technotic Prophecy","http://steamcommunity.com/profiles/76561198120479238/","32 products in account","Very amazing and intriguing. At the time when I had bought it, I bought the collectors edition on sale for five dollars. I think that the price is good but the game is a bit short, probably in total of about six hours. I personally am not the best a games whatsoever, so while others may complain, it was a MAJOR help that the game held my hand all the way through. I absolutley love it, and would recomend it. It is a bit on the adult side rather than a childs game, but it's quite easy to understand. The only downside is how unique it is, because playing it again would be tiring. I say this because you can't just let the game blend in with others in your mind, if that makes any sense, making it difficult to forget your first experience with it.","December 5, 2014","true","6.9"," No ratings yet","0","0","0","0","0"
"http://steamcommunity.com/id/Scottjr123/recommended/224460/","Scottjr123","Scottjr123","http://steamcommunity.com/id/Scottjr123/","46 products in account","One of my favorite games played it on PS4 & PS3, and now I got it for PC All I can say is it's one of the best games I've play in a long time so glad I can play it on my PC now!","October 11, 2014","true","2.7"," No ratings yet","0","0","0","0","0"
"http://steamcommunity.com/id/cuppscakes/recommended/224460/","cuppscakes","Moo Sleech","http://steamcommunity.com/id/cuppscakes/","817 products in account","Contrast gets a hesitant thumbs up. It's a game that I'm dying to love, and while I completed it and did enjoy parts of it... it's hard to say I loved it. But it might be worth your time and money. Read on...\n\nOn its surface, the game has a lot going for it: the art style is superb, the "phase shift" gimmick is really neat, and the storyline is decently interesting. The game, for a short experience, builds a nice little world and it does a solid job of make you invested in the characters. Also, the music is fantastic.\n\nHowever, a couple minor issues and one major issue gum up the experience. First, the game took me just over three hours (which included a few chunks of paused game) to complete, in its entirety. That means every achievement. I think I spend more time hunting down Easter eggs in Gone Home, frankly.\n\nSecondly, while the story segments are good, there's seemingly as much or more of them than gameplay. Especially early on, when the story is trying to establish itself, you walk ten feet and cutscene. Walk ten more, cutscene. Walk outside, another cutscene. I wanna play!\n\nAlso, and this may just be me, but the "phase shift" gimmick was never used to its full potential. There are a few moments where you do something really cool, and everything falls in place, and it feels great. But those moments are more rare than they ought to be. Most of the puzzles or silly in their simplicity, which some of the tougher ones being more about fighting the way shadows work rather than being brain benders.\n\nAnd lastly, this is the big one. The controls... aren't great. If you're in shadow and run out of a space, you pop out. But it doesn't always work consistently. And collision detection is off at times. Also, I died a number of times when I didn't phase in like it was supposed to.\n\nAt a couple of the later puzzles (the rotating wall in particular), I felt like I spent more time fighting the controls and shadow detection, as opposed to the puzzles. And felt myself pulled out of the story due to frustration.\n\nNow I know, that's a laundry list of problems. But most of them are because the premise and setting were so good... I wanted more. I wanted more puzzles, more areas to explore and more stuff to do. I got it on sale for just a couple bucks, and frankly am glad I'd waited. For a few bucks, it was a nice diversion over the weekend that left me ultimately satisfied.\n\nBut for full price, for those easily frustrated or for those expecting a long, polished experience. Maybe watch a Let's Play and pass. So as stated above, I give this one a very cautious thumbs up, with a big ol' asterisk next to it.","October 11, 2014","true","3.3"," No ratings yet","0","0","0","0","0"
"http://steamcommunity.com/id/korarii/recommended/224460/","korarii","korarii","http://steamcommunity.com/id/korarii/","74 products in account","Contrast’s story is engaging, fun, and well-executed. The 3D/2D switching is great, making puzzles interesting.","October 11, 2014","true","6.4"," No ratings yet","0","0","0","0","0"
"http://steamcommunity.com/profiles/76561198050601102/recommended/224460/","76561198050601102","Jincks","http://steamcommunity.com/profiles/76561198050601102/","75 products in account","A short but brilliant, multi-layered game.  Not too hard, not too easy, with a beautiful soundtrack and very good voice acting.  I dont want to spoil anything for you, so suffice to say, even if you miss the sale, you should pick up this enchanting, hauntingly strange little number.","October 11, 2014","true","5.2"," No ratings yet","0","0","0","0","0"
"http://steamcommunity.com/profiles/76561198094323568/recommended/224460/","76561198094323568","LionWanderer","http://steamcommunity.com/profiles/76561198094323568/","158 products in account","It's been a pleasure playing this game, but it has its flaws.\nFirst, the bad notes: there are many tiny imperfections in the game that could be removed with little work, but in the context sound like a bad note in the symphony. Many times while moving in the shadows I was pushed out with no reason, like when passing over a semi-column in the lab; in many sections you can catch Didi in a T-pose, and even Dawn's position when using the umbrella is clearly a T-pose with an umbrella, and that really ruined the atmosphere.\nBut the game itself, especially for being a small production, is really good and enjoyable. The story is fascinating and, even if not the most suspence-filled noir plot, keeps you playing even just to know what's gonna happen. Deep characters and very nice voice-acting, the light-shadow system has it's flaws but its overall is quite good and fun. I bought the collector edition and I'm happy I did so, because the OST is very very nice. Finally, the way the game slowly shifts in a surrealist note is, at least for me, simply beautyful.\nMaybe €15 are too many, but I recommend this game. You'll learn eventually that, if you stop demanding for extreme graphics and gory shootings, and start enjoying the little things, this game has a lot to offer.","October 11, 2014","true","4.2"," No ratings yet","0","0","0","0","0"
"http://steamcommunity.com/profiles/76561198037461108/recommended/224460/","76561198037461108","crchan23","http://steamcommunity.com/profiles/76561198037461108/","387 products in account","I love the atmosphere, the art style, the music, the characters.  The core game mechanical is interesting, but did get annoying at times.  The story is interesting, but never really pays off.  Great setup, subpar finish.  Anyway, it's a small developer.  So, I definitely cut them some slack.  You can tell there were several iterations of the story and they included pieces that don't entirely work together.  That said, the story is pretty good, if a bit disjointed.  Overall, I would recommend this game.  It definitely held my interest while I was playing it.","October 11, 2014","true","3.6"," No ratings yet","0","0","0","0","0"
"http://steamcommunity.com/profiles/76561198067420779/recommended/224460/","76561198067420779","Rezorathor","http://steamcommunity.com/profiles/76561198067420779/","199 products in account","This was a surprisingly good game with a strong enough story and a fun mechanic. The puzzle bits don't feel super fluid but aside from that this game is a pretty fun piece of art with some very apparent talent behind its making. 9/10","October 11, 2014","true","4.2"," No ratings yet","0","0","0","0","0"
"http://steamcommunity.com/id/strategymaster/recommended/224460/","strategymaster","General Kysieran","http://steamcommunity.com/id/strategymaster/","308 products in account","A quaint little story with a intruiging game mechanic. The music is awesome!!!!!! But note it is very short.\n\nWith a mouse and keyboard the controls were a bit annoying at times, but it is still completable with the devices.","December 7, 2014","true","3.4"," No ratings yet","0","0","0","0","0"
"http://steamcommunity.com/profiles/76561197989278072/recommended/224460/","76561197989278072","Sufinator","http://steamcommunity.com/profiles/76561197989278072/","370 products in account","This was a really nice game, nice artwork and story but unfortunately too short.","December 10, 2014","false","3.5"," No ratings yet","0","0","0","0","0"
"http://steamcommunity.com/profiles/76561197984986380/recommended/224460/","76561197984986380","Captain McScruffy Pants","http://steamcommunity.com/profiles/76561197984986380/","216 products in account","Very short game, however, awesome.  I love the originality of it and the story is very interesting and intruiging.  The puzzles are sufficiently complex without being too hard or too easy.","December 12, 2014","true","3.7"," No ratings yet","0","0","0","0","0"
"http://steamcommunity.com/id/Lexietekie/recommended/224460/","Lexietekie","Lexie_tekie","http://steamcommunity.com/id/Lexietekie/","52 products in account","I like this game for a few reasons. The first is the you can use the keyboard and mouse or a controller.\nAlso, the story and the characters move along at a reasonible pace.\n\nI would like to recommend that if you like this you will like Alice: Maddness Returns\nOther puzzle games with the same vibe at Psychonaughts and Beyond Good and Evil.","December 7, 2014","true","2.7"," No ratings yet","0","0","0","0","0"
"http://steamcommunity.com/profiles/76561198052361340/recommended/224460/","76561198052361340","Oubliette","http://steamcommunity.com/profiles/76561198052361340/","105 products in account","A very fun, if equally short, puzzle game that reminds me of Alice: Madness Returns.","January 1, 2015","true","4.9"," No ratings yet","0","0","0","0","0"
"http://steamcommunity.com/id/xthequiet1x/recommended/224460/","xthequiet1x","/RaWr/ xTheQuiet1x","http://steamcommunity.com/id/xthequiet1x/","149 products in account","Thoroughly enjoying this game. It is very creative in its gameplay, puzzles, and graphics.","January 2, 2015","true","2.6"," No ratings yet","0","0","0","0","0"
"http://steamcommunity.com/id/pachipie/recommended/224460/","pachipie","PugPaladin","http://steamcommunity.com/id/pachipie/","207 products in account","Great game, really beautiful, and a really interesting concept. The gameplay is a little sensitive, and I had a much harder time playing without a gamepad. My advice is get it- only if it's on sale. It doesn't have much replay value, and the game is over so quickly that it's a little shocking- right when you think things are really going to set off- they're ending. Overall, great game, unique characters, fun gameplay, just far too short.","January 2, 2015","true","3.6"," No ratings yet","0","0","0","0","0"
"http://steamcommunity.com/id/mecart/recommended/224460/","mecart","mecart","http://steamcommunity.com/id/mecart/","58 products in account","Great idea, so-so execution.\nThe story starts a little mysterious but quite interesting... then you get like 3 or 4 fill-in levels that go a little off the storyline for the sake of gameplay... then the story gets interesting again, you feel like you're at the middle of the story and see things that hint that the mysteries will be solved towards the end... and then the game ends.\nTook 6 hrs to finish it, and I found almost all the collectibles. It's worth about 7USD, not more.","January 2, 2015","true","5.9"," No ratings yet","0","0","0","0","0"
