"url","reviewerUsername","reviewerDisplayName","reviewerUrl","reviewerProductsCount","reviewText","date","recommended","hoursPlayed","voteText","helpfulPercent","votesHelpful","votesTotal","votesFunny","commentsCount"
"http://steamcommunity.com/id/writermon/recommended/264360/","writermon","Emariel","http://steamcommunity.com/id/writermon/","15 products in account","I didn't feel representated in this game as a human being.","October 23, 2015","false","0.2"," 0 of 2 people (0%) found this review helpful","0","0","2","0","0"
"http://steamcommunity.com/id/nomannm/recommended/264360/","nomannm","Nomannm","http://steamcommunity.com/id/nomannm/","201 products in account","I guess I was probably hoping too much when i tried this game out, it could be strongly because im biased. I found the controls/gameplay to be lacking in a way, the combat animations are great, however with the current camera view it can somewhat be difficult to actually know where it's going to hit.","December 21, 2015","false","0.5"," 0 of 2 people (0%) found this review helpful","0","0","2","0","0"
"http://steamcommunity.com/profiles/76561198084466058/recommended/264360/","76561198084466058","Aretia","http://steamcommunity.com/profiles/76561198084466058/","16 products in account","In a way this game is good, but on the downside when wanting to purchase in-game items you need to have an OGPlanet account since the link its completed through Steam.  So when you go to buy Astros, you get an error and when trying to login to the main site with the Steam created account, you're told that "This is a Steam-only account - please create a new OGPlanet account to play!".  So on that note i'll recommend playing it...just not from Steam.","July 20, 2015","false","202.4"," 0 of 2 people (0%) found this review helpful","0","0","2","0","0"
"http://steamcommunity.com/id/hulawife/recommended/264360/","hulawife","hulawife","http://steamcommunity.com/id/hulawife/","136 products in account","Pretty much Maplestory.\nStill good though.","June 20, 2015","true","8.2"," 0 of 2 people (0%) found this review helpful","0","0","2","0","0"
"http://steamcommunity.com/id/Danmurkkkkkk/recommended/264360/","Danmurkkkkkk","Olivia_Harmonia","http://steamcommunity.com/id/Danmurkkkkkk/","18 products in account","I tried to play this game but everytime I got to the tutorial it crashed. I can't do anything without it crashing, I shall try one more time but so far this game has been a waste of space","February 3, 2015","false","0.5"," 0 of 2 people (0%) found this review helpful","0","0","2","0","0"
"http://steamcommunity.com/profiles/76561198090332034/recommended/264360/","76561198090332034","Auraneko","http://steamcommunity.com/profiles/76561198090332034/","8 products in account","GMs who have nothing to do due to the lack of players, search your account to ban you for any reason, from arguing with P2W players to use dual accounts in login events.\n\nThe movement is poor plus slow response to commands, Quest system is confusing, gold spammers in-game and in the forum, events are reserved for gacha users. Basically even the most powerful equipments in-game are useless without cash stuff like being inferior to a level 30 weapon overcashed(I'm not joking).\nAnd after you get your armor and weapon with nice enchants, worry not because you have to enchant 9 gems plus badges, necklaces and ETC.\n\nOnce you get lv. 200, it becomes even harder to level than Ragnarok and Tibia (i'm not joking either).\n\nLet's see... People often do personal fights in the global chat and you can't block it, you're obligued to see they argue about who is more virgin.\n\nThe previous dungeon system were quite good actually, but they ruined it in the other expansions.\n\nOnce you log-in you'll see no newbies along you, so follow their example and don't play this game. If you want an anime MMORPG try Tree of Savior while Nexon didn't ruined it with cash stuff.","May 24","false","28.9"," 0 of 2 people (0%) found this review helpful","0","0","2","0","0"
"http://steamcommunity.com/profiles/76561198106146603/recommended/264360/","76561198106146603","( ͡° ͜ʖ ͡°)","http://steamcommunity.com/profiles/76561198106146603/","40 products in account","Decent enough game similar to MapleStory,really good community from what i've seen,although the game is quite repetitive and the quests are really generic,which is not a problem for me personaly.\nI guess it's decent if you want to have some fun but for a longer run,i dont think it's worth your time,you are better off playing MapleStory anyways","June 29, 2015","false","16.0"," 21 of 45 people (47%) found this review helpful 1 person found this review funny","47","21","45","0","2"
"http://steamcommunity.com/id/paleknight1/recommended/264360/","paleknight1","Silver Blight","http://steamcommunity.com/id/paleknight1/","233 products in account","Already have an account, but won't let me log in and also keeps asking me to register yeah great service my ♥♥♥.","June 18, 2014","false","0.1"," 17 of 37 people (46%) found this review helpful","46","17","37","0","2"
"http://steamcommunity.com/id/classydoctor/recommended/264360/","classydoctor","Classy","http://steamcommunity.com/id/classydoctor/","20 products in account","Awkard keyboard settings, ridiculously slow movement, and though the art is great, I'm afraid it's a rip-off of some other things (especially Maplestory). I wasn't immediately absorbed into it, and I don't think I'll ever play it again. Just stating my opinion, and here it is.","July 1, 2014","false","0.5"," 11 of 25 people (44%) found this review helpful","44","11","25","0","3"
"http://steamcommunity.com/id/MasterOfLazyness/recommended/264360/","MasterOfLazyness","MasterOfLazyness","http://steamcommunity.com/id/MasterOfLazyness/","270 products in account","La Fail - A Broken Unplayable Mess.\n\nThis game is down right unplayable. If you even try to use the Keyboard and mouse to play, it will CRASH on you.\nIf you try to use the Gamepad, you will notice that you're playing an MMO solo as you can absolutely NEVER chat to anyone. Because the moment you do, the game will crash. Doesn't matter when you hit a button either.\n\nIf you're an old player coming back to it because it's on Steam now, avoid the steam version as you will be forced to make a new account anyway.\n\nOther than the broken unplayable mess, La Tale is an simply another attempt at a MapleStory knock off (otherwise known as a Clone). However, it has slower gameplay and more sluggish feeling attacks. While I do enjoy the Combo-like system it has and can make for great burst kills, that's pretty much all there is to it. There is more open ended character choices as some characters can have 4 different ways to be built; ultimately they will be lackluster as they aren't made solely with one thing in mind.\n\nIt's better than Wind Slayer but far from being better than MapleStory. 5.5/10","April 6, 2015","false","1.9"," 4 of 11 people (36%) found this review helpful 5 people found this review funny","36","4","11","5","0"
"http://steamcommunity.com/profiles/76561198019404398/recommended/264360/","76561198019404398","Ken-oh","http://steamcommunity.com/profiles/76561198019404398/","203 products in account","What unbelievable garbage, it's like Maple Story coded in 1989.\n\nWhat sort of sane adult man could play this ♥♥♥♥?","July 2, 2015","false","0.3"," 4 of 11 people (36%) found this review helpful 2 people found this review funny","36","4","11","2","0"
"http://steamcommunity.com/id/trustsuperjail/recommended/264360/","trustsuperjail","Trust Superjail","http://steamcommunity.com/id/trustsuperjail/","155 products in account","What a disaster. Menus and dialogue don't make sense and the shop system is impossible to navigate. I couldn't tell if I was selling, buying, equipping; it's all an unlabeled, jumbled mess. And you still can't figure it out with help because the tutorials are incomprehensible word salad by someone who clearly doesn't speak English. Some buttons straight up don't work when clicked. Unintuitive controls that for some reason make you juggle both hands on the keyboard and also the mouse during the same menu tree. The only thing that isn't completely broken is the cute art. Someone please, correct me if I'm somehow wrong about this insane excuse for an MMO.","June 29, 2014","false","0.6"," 4 of 11 people (36%) found this review helpful","36","4","11","0","0"
"http://steamcommunity.com/id/popcorncolonel69/recommended/264360/","popcorncolonel69","Popcorn Colonel","http://steamcommunity.com/id/popcorncolonel69/","39 products in account","Absolute trash. Initally, the deep, cool, dramatic piano music in the background of the character creation screen left me with a good impression audio-wise. After creating my character, smart-assily named "ainsleyharriott", the game transitioned into a cutscene. There were no moving objects during the cutscene, but characters talking to one another, with speech bubbles and such, manga style. Poorly written English left me with little to understand about the initial conflict.\n\nThe beginning attack tutorial prompted me to press "z" for basic attack, for which I did. The character in the tutorial appeared to be fighting an immortal creature, exiled from both heaven and hell, apparently. Another character prompted the bow-wielding character (the character that you try to attack with "z" with) to leave the battle with the immortal creature. The game prompted me to tap the right arrow key twice in order to leave, for which I did. Twice. Nothing happened. Pressing the key did absolutely nothing, preventing me from advancing in the tutorial.\n\nGiving this 2/10 for the cool music at the beginning. Stick with Aura Kingdom, Mabinogi or Maple Story for good anime/chibi MMOS.","June 7, 2015","false","2.5"," 4 of 11 people (36%) found this review helpful","36","4","11","0","0"
"http://steamcommunity.com/id/Flutty149/recommended/264360/","Flutty149","TwinkiiKitty","http://steamcommunity.com/id/Flutty149/","241 products in account","Very good Game!!, I love it <3","December 1, 2014","true","89.1"," 4 of 11 people (36%) found this review helpful 3 people found this review funny","36","4","11","3","0"
"http://steamcommunity.com/profiles/76561198126475856/recommended/264360/","76561198126475856","Mr.death","http://steamcommunity.com/profiles/76561198126475856/","10 products in account","its a great game that offers somthing for everyone","October 19, 2014","true","3.0"," 3 of 9 people (33%) found this review helpful","33","3","9","0","0"
"http://steamcommunity.com/id/olivail/recommended/264360/","olivail","Vail","http://steamcommunity.com/id/olivail/","20 products in account","worst game eu","January 20, 2015","false","0.6"," 3 of 9 people (33%) found this review helpful 1 person found this review funny","33","3","9","0","0"
"http://steamcommunity.com/id/yotatata/recommended/264360/","yotatata","AYA HOW BOUT NO","http://steamcommunity.com/id/yotatata/","10 products in account","Product received for free\n\nFIX IT ^Q^) / .","May 12","false","1.1"," 3 of 9 people (33%) found this review helpful 1 person found this review funny","33","3","9","0","1"
"http://steamcommunity.com/profiles/76561198042891132/recommended/264360/","76561198042891132","Gawthyc","http://steamcommunity.com/profiles/76561198042891132/","39 products in account","La Tale is really cute and really fun at first, but it has a few major flaws.\n\nFirst of all, the combat is quite entertaining. All of the abilities and attacks look appealing and feel satisfying to use.\n\nCustomization is limited, but you can still come up with something super kawaii.\n\nThe player base feels small, but you can still find people and likely make a few friends to queue up with for dungeons.\nI've never actually completed a dungeon, however, since I could not find the appropriate number of people; therefore, I can't talk about that much. What I can say, though, is that they are challenging and likely equivalent to your typical WoW dungeon.\n\nBut now flaws...\n\nFirst of all, there's this whole "you can only keep this item for x days" thing which is kinda disappointing when the item is a good weapon that you were given for completing a quest.\n\nSpeaking of which, quests are repetitive fetch quests and are the exact same in each zone. Collect special drops from x, y, and z monsters twice, rinse, repeat.\n\nThe game is also rather glitchy in that some text is buggy like once I had a staff that basically had glitchy text as it's name. There are also minor things indicating poor translation or a lack of polish like when your character shouts, "Icicle Fear" when casting Icicle Spear.\n\nWorst of all is that nothing is ever really clear. For instance, you might pick up an item saying that it does nothing when it is actually pretty important or is used in crafting. But you wouldn't know that until you just randomly discover it since there's no information online.\n\nLastly, I got some random virus which only appeared after downloading the game and disappeared after uninstalling, so players beware.\n\nThe game is fun, but if you're looking for a fun, anime RPG, maybe look elsewhere since this is honestly one in a thousand.\n\n5.5/10\n(Minus a few extra points for virus if you want)","June 22, 2015","false","15.3"," 2 of 7 people (29%) found this review helpful","29","2","7","0","0"
"http://steamcommunity.com/id/auBenseiter/recommended/264360/","auBenseiter","Trombe","http://steamcommunity.com/id/auBenseiter/","126 products in account","For 2 hours spent "in-game" I was updating and trying to even log in.\nFor 20 minutes I actually played it and uninstalled due to unbearable lag. Every action takes place a good one second after button is pressed.\nYou can probably play only if you live close to only one of the servers, otherwise don't even bother with it.\n","May 28, 2015","false","2.2"," 2 of 7 people (29%) found this review helpful","29","2","7","0","0"
"http://steamcommunity.com/id/ExtieS/recommended/264360/","ExtieS","Externaline #2015 no.1","http://steamcommunity.com/id/ExtieS/","10 products in account","p2w m8 ;_;\n\nit's laggy\nit's hard to read the lines\nit's hard to fap to\n\nI'm only going to play this if im bored as ♥♥♥,otherwise this game is bad.\nnot recommended by me\n\n","June 7, 2015","false","1.9"," 2 of 7 people (29%) found this review helpful","29","2","7","0","0"
"http://steamcommunity.com/id/OmgItsHel/recommended/264360/","OmgItsHel","IsShiN.","http://steamcommunity.com/id/OmgItsHel/","139 products in account","After spending half a day trying to get this game to work, it just wont.\nDon't bother getting this game on Steam, the steam version has tons of bugs, once you fix one, another will pop up.\nThere also seems to be 0 support for it on Steam, its like the developers threw their game onto Steam and completely forgot about it.","June 14, 2015","false","1.8"," 2 of 7 people (29%) found this review helpful","29","2","7","0","0"
"http://steamcommunity.com/id/EdoMeow/recommended/264360/","EdoMeow","Duckler","http://steamcommunity.com/id/EdoMeow/","175 products in account","that game is like maplestory and maplestory is really fun and you need to download La Tale because if you are a anime lover, you should get this game as soon as possible, KAWAII!!! <3","June 21, 2014","true","93.3"," 2 of 7 people (29%) found this review helpful","29","2","7","0","0"
"http://steamcommunity.com/id/undiscotrap/recommended/264360/","undiscotrap","私はアニメが好きな願","http://steamcommunity.com/id/undiscotrap/","125 products in account","Esse é aquele jogo que você se pergunta: O que eu fiz da minha vida para acabar aqui?\nlogo depois você está na beira da sacada do sétimo andar do prédio prestes a pular e ver se de alguma forma tem salvação em outra vida.","August 7, 2015","false","0.5"," 2 of 7 people (29%) found this review helpful","29","2","7","0","0"
"http://steamcommunity.com/id/SamjW84/recommended/264360/","SamjW84","The Turtle Hermit","http://steamcommunity.com/id/SamjW84/","12 products in account","The game is ok. The problem starts with the inability to change the resolution until after you create a character, but if you cant click "next" you will have a frustrating time trying to figure it out. Sure you can change the resolution on your desktop, but if you are like me, with a wide screen, you will have trouble. But if that wasnt enough of a headache, the tutorial quests are terrible. Very little information, and very little instructions, I found my self lost very quickly, within the first 5 levels. The graphics are "cute" and I would play it if the devs put a little more time into fixing some of the small things with the tutorial quests, as well as the inability to access options in the main menu. As it stands though, I would have to give this game a 4 out of 10, it has potential, but also has problems.","June 27, 2014","false","0.6"," 1 of 5 people (20%) found this review helpful","20","1","5","0","0"
"http://steamcommunity.com/profiles/76561198093531482/recommended/264360/","76561198093531482","✪eduard0S","http://steamcommunity.com/profiles/76561198093531482/","4 products in account","THIS GAME IS SO BAD","June 22, 2014","false","0.1"," 1 of 5 people (20%) found this review helpful","20","1","5","0","0"
"http://steamcommunity.com/profiles/76561198139139389/recommended/264360/","76561198139139389","zak66601","http://steamcommunity.com/profiles/76561198139139389/","7 products in account","This game feels like it ws made by a 10yo kids. Lag, bugs and u can't even move around the map well.  Not even worth the download and try","June 22, 2014","false","6.0"," 1 of 5 people (20%) found this review helpful","20","1","5","0","0"
"http://steamcommunity.com/id/nelfie/recommended/264360/","nelfie","Nelfie","http://steamcommunity.com/id/nelfie/","315 products in account","No.","June 26, 2014","false","0.3"," 1 of 5 people (20%) found this review helpful","20","1","5","0","1"
"http://steamcommunity.com/id/nelfie/recommended/264360/","nelfie","Nelfie","http://steamcommunity.com/id/nelfie/","315 products in account","No.","June 26, 2014","false","0.3"," 1 of 5 people (20%) found this review helpful","20","1","5","0","1"
"http://steamcommunity.com/profiles/76561198040084672/recommended/264360/","76561198040084672","Lathos","http://steamcommunity.com/profiles/76561198040084672/","112 products in account","chunky","September 23, 2014","false","1.3"," 1 of 5 people (20%) found this review helpful","20","1","5","0","0"
"http://steamcommunity.com/id/magnaangemon01/recommended/264360/","magnaangemon01","magnaangemon01","http://steamcommunity.com/id/magnaangemon01/","260 products in account","Total crap. I heard so many good reviews about this game, I thought I would give it a try. Worst mistake ever. The quests are boring, the mechanics are awful, and you can actually die against the first monsters in the game. Do yourself a favor. Play Elsword instead if you want to do a sidescroller. It's 1000 times better.\n\nEdit: After trying a few of their other games, just avoid OGPlanet altogether. I've seen better stuff come out of RPG Makers.","July 15, 2014","false","0.6"," 1 of 5 people (20%) found this review helpful","20","1","5","0","0"
"http://steamcommunity.com/profiles/76561197965959132/recommended/264360/","76561197965959132","Annieannieannie","http://steamcommunity.com/profiles/76561197965959132/","33 products in account","La Tale?\n\nMore like Lagg Tail.\nGot to lvl 25 and at night, the asians would all come out and lag the servers up.\nIt was fun, and i would probably play it more, but the lag is not worth it.","July 18, 2014","false","3.8"," 1 of 5 people (20%) found this review helpful","20","1","5","0","0"
"http://steamcommunity.com/profiles/76561198057949403/recommended/264360/","76561198057949403","ポケモック Poke","http://steamcommunity.com/profiles/76561198057949403/","47 products in account","♥♥♥♥♥ Lag >:c U NEED TO UPGRADE SERVER","July 19, 2014","false","0.3"," 1 of 5 people (20%) found this review helpful","20","1","5","0","0"
"http://steamcommunity.com/id/wall142inator/recommended/264360/","wall142inator","Pepe teh kumit","http://steamcommunity.com/id/wall142inator/","67 products in account","I never got to play the game! It's always unable to connect to the servers for some reason!","August 26, 2014","false","1.6"," 1 of 5 people (20%) found this review helpful","20","1","5","0","0"
"http://steamcommunity.com/id/vuxo_com/recommended/264360/","vuxo_com","Малой_Цыбулька","http://steamcommunity.com/id/vuxo_com/","10 products in account","Fuuuuuuuuuuuu","August 28, 2014","false","7.0"," 1 of 5 people (20%) found this review helpful","20","1","5","0","0"
"http://steamcommunity.com/profiles/76561198133748225/recommended/264360/","76561198133748225","ajjolyn","http://steamcommunity.com/profiles/76561198133748225/","35 products in account","Dafuq?","June 28, 2015","false","0.6"," 1 of 5 people (20%) found this review helpful","20","1","5","0","0"
"http://steamcommunity.com/profiles/76561198186890307/recommended/264360/","76561198186890307","iprettymuchdowork490","http://steamcommunity.com/profiles/76561198186890307/","15 products in account","its a rip off of maplestory.","November 14, 2015","false","18.4"," 1 of 5 people (20%) found this review helpful","20","1","5","0","0"
"http://steamcommunity.com/profiles/76561198101175678/recommended/264360/","76561198101175678","Toy_Cocoa_the_Bunny(hyperactive)","http://steamcommunity.com/profiles/76561198101175678/","65 products in account","awesome classes and weapons and abilitys","November 18, 2014","true","42.9"," 0 of 3 people (0%) found this review helpful","0","0","3","0","0"
"http://steamcommunity.com/profiles/76561198049853285/recommended/264360/","76561198049853285","89587557","http://steamcommunity.com/profiles/76561198049853285/","33 products in account","CAN NOT EVEN REGISTER WTF\n-10/10000000000000000000000","December 27, 2014","false","5.8"," 0 of 3 people (0%) found this review helpful","0","0","3","0","0"
"http://steamcommunity.com/profiles/76561198090746537/recommended/264360/","76561198090746537","thatonenerd","http://steamcommunity.com/profiles/76561198090746537/","105 products in account","No apparnt reason","September 28, 2014","true","19.6"," 0 of 3 people (0%) found this review helpful","0","0","3","0","0"
"http://steamcommunity.com/profiles/76561198101175678/recommended/264360/","76561198101175678","Toy_Cocoa_the_Bunny(hyperactive)","http://steamcommunity.com/profiles/76561198101175678/","65 products in account","awesome classes and weapons and abilitys","November 18, 2014","true","42.9"," 0 of 3 people (0%) found this review helpful","0","0","3","0","0"
"http://steamcommunity.com/id/Gurokun/recommended/264360/","Gurokun","Gurokun","http://steamcommunity.com/id/Gurokun/","","Stupid.","June 25, 2014","false","0.5"," 0 of 3 people (0%) found this review helpful","0","0","3","0","0"
"http://steamcommunity.com/profiles/76561198079355313/recommended/264360/","76561198079355313","BIG BAD BOOTY CONSTANTINE","http://steamcommunity.com/profiles/76561198079355313/","59 products in account","senpai did not notice me 10/10 GOTY","June 21, 2014","false","0.3"," 0 of 3 people (0%) found this review helpful","0","0","3","0","0"
"http://steamcommunity.com/id/LightLament/recommended/264360/","LightLament","LightLament","http://steamcommunity.com/id/LightLament/","20 products in account","Wouldn't let me use my keyboard. Kept crashing everytime I would try and use the arrow keys or follow onscreen commands for button presses. Don't even bother downloading it.","June 23, 2014","false","0.3"," 0 of 3 people (0%) found this review helpful","0","0","3","0","0"
"http://steamcommunity.com/profiles/76561198162507765/recommended/264360/","76561198162507765","Beat","http://steamcommunity.com/profiles/76561198162507765/","2 products in account","Great relaxing game, love the art style and music tho","November 9, 2014","true","14.9"," 0 of 3 people (0%) found this review helpful","0","0","3","0","0"
"http://steamcommunity.com/id/JetUppercut/recommended/264360/","JetUppercut","Jet Uppercut","http://steamcommunity.com/id/JetUppercut/","202 products in account","Unless you live in America, this game is going to lag so horribly fighting more than one enemy will just leave you permanently stunlocked. If they don't plan on adding in servers for other countries they should remove the game from international stores.\nIt really is that bad.","June 20, 2014","false","14.0"," 0 of 3 people (0%) found this review helpful","0","0","3","0","0"
"http://steamcommunity.com/profiles/76561198079209780/recommended/264360/","76561198079209780","Motor Mom™","http://steamcommunity.com/profiles/76561198079209780/","59 products in account","It is not a good game. The graphics look good I'll give it that but everything else is genaric and annoying. It has potental but , at the moment dont get.","June 22, 2014","false","0.3"," 0 of 3 people (0%) found this review helpful","0","0","3","0","0"
"http://steamcommunity.com/id/cajogos/recommended/264360/","cajogos","Carlos [TechNewbs]","http://steamcommunity.com/id/cajogos/","275 products in account","Didn't really get into it the game would just stay in window mode and appears to not have a 1080p option. If it does make it easier to access because I am a reasonably experienced gamer and I did not find the option anywhere.","June 24, 2014","false","0.1"," 0 of 3 people (0%) found this review helpful","0","0","3","0","0"
"http://steamcommunity.com/id/thickice19/recommended/264360/","thickice19","TOG II*","http://steamcommunity.com/id/thickice19/","187 products in account","Controls are awful and the UI is horrid.\nMaybe I'm just not a fan of these types of games.\nI didn't like it.","August 18, 2014","false","0.5"," 0 of 3 people (0%) found this review helpful","0","0","3","0","0"
