"url","reviewerUsername","reviewerDisplayName","reviewerUrl","reviewerProductsCount","reviewText","date","recommended","hoursPlayed","voteText","helpfulPercent","votesHelpful","votesTotal","votesFunny","commentsCount"
"http://steamcommunity.com/profiles/76561198067443494/recommended/264360/","76561198067443494","PerilousLoki","http://steamcommunity.com/profiles/76561198067443494/","8 products in account","good game but very slow gameplay.","August 17, 2014","true","0.8"," No ratings yet","0","0","0","0","0"
"http://steamcommunity.com/id/nickiam/recommended/264360/","nickiam","NickIAm","http://steamcommunity.com/id/nickiam/","311 products in account","Just deleted it without even trying it.\nI am sorry but you should tell people what to do, before they gonna go and register on your website, because client didn't tell that nickname is taken.\nBecause of that someone gonna think that he must go and register and wont be able to login because DUPLICATE ID.","May 27, 2015","false","0.2"," No ratings yet","0","0","0","0","0"
"http://steamcommunity.com/id/YawningPanda/recommended/264360/","YawningPanda","Izzie","http://steamcommunity.com/id/YawningPanda/","52 products in account","La Tale is a great game, but its not very solid in my case.\nI recommend La Tale for all MMORPG lovers but I'm not so I'm much of a reliable source.\n\n5/10 Grabs my interest but is a little repetitive.","May 18, 2015","true","5.6"," No ratings yet","0","0","0","0","0"
"http://steamcommunity.com/id/EneChan/recommended/264360/","EneChan","Lazy Otaku umaru .3.","http://steamcommunity.com/id/EneChan/","7 products in account","Ok I recomend this game ALOT i have played this game ever since i was 6 years old(2006) thanks to my uncle that teahed me how to play the game and the basics so i got into more pc games\n\nThis game has alot of good graphics the desing is just adorable you just cant get enough of Latale.\nI my self is Adicted to this game, nonstop playing the people in the game are really nice\nif you dont want to level by yourself just go and make a party with ramdome people that can help you on your journey\nits fun good luck!\n100/100 <3","May 31, 2015","true","3.9"," No ratings yet","0","0","0","0","0"
"http://steamcommunity.com/id/LoRdOfThEmAnGoEs/recommended/264360/","LoRdOfThEmAnGoEs","xKatn1ss","http://steamcommunity.com/id/LoRdOfThEmAnGoEs/","33 products in account","Weird keyboard settings, reaction time, animation and movement of characters are way too slow. At first I was drawn to this game because of it's art, thinking that it would be similar or even better than Maplestory. Guess I was wrong, though.","May 23, 2015","false","1.6"," No ratings yet","0","0","0","0","0"
"http://steamcommunity.com/id/Astridull/recommended/264360/","Astridull","AssAsian","http://steamcommunity.com/id/Astridull/","20 products in account","10/10 You can knock beatles and bunnies off the side of cliffs and be unable to finish the skill quest. BEST GAHME EVIR!!!!!","May 24, 2015","true","5.7"," No ratings yet","0","0","0","0","0"
"http://steamcommunity.com/profiles/76561198042816801/recommended/264360/","76561198042816801","Jinx","http://steamcommunity.com/profiles/76561198042816801/","222 products in account","Interesting concept, but the execution is rough at best and a failure at the worst. The core of the problem is awful controls, and no obvious way to go and change the controls. The Keyboard works... after you get used to the really bizarre setup, but the USB controller is down right perplexing. Start button is jump? Why? And why is this system using a 1 through 10 power setup? This game is a side scroller, implying fast action with little thought about your three dimensional placement. Turn those into button combo moves, tighten up the control scheme, and you'll have a good game. Right now, because of these major faults, all it manages to do is look neat until you try playing it...","May 25, 2015","false","10.4"," No ratings yet","0","0","0","0","1"
"http://steamcommunity.com/profiles/76561198090115850/recommended/264360/","76561198090115850","VegetableRights","http://steamcommunity.com/profiles/76561198090115850/","16 products in account","Grindy quests that spam you.\n\nThe anime kawaii graphics are good if not for the fact that the UI is clouded with thousands of tabs and high level players have 50 different coloured auras around them.\n\nThe tutorials are of bad quality. Not engaging to me and boring.","May 25, 2015","false","3.0"," No ratings yet","0","0","0","0","0"
"http://steamcommunity.com/profiles/76561198097893872/recommended/264360/","76561198097893872","Pantsu","http://steamcommunity.com/profiles/76561198097893872/","12 products in account","the only mmo that doesnt make me want to bite my nuts off","November 8, 2015","true","91.6"," No ratings yet 1 person found this review funny","0","0","0","0","0"
"http://steamcommunity.com/id/nezziesenpai/recommended/264360/","nezziesenpai","Nezzie Senpai ᕕ( ᐛ )ᕗ","http://steamcommunity.com/id/nezziesenpai/","163 products in account","Can't have  ANYTHING  open in the background or it thinks it is a cheat or hack or something...","August 23, 2015","false","17.0"," No ratings yet 2 people found this review funny","0","0","0","0","0"
"http://steamcommunity.com/id/moonkingdomify/recommended/264360/","moonkingdomify","Moonkingdomify","http://steamcommunity.com/id/moonkingdomify/","130 products in account","Now I've played a few MMOs in my life and this isn't the worst. But it isn't the best. it's just sort of decent. I see the inspiration it took from Maplestory but even then that MMO only really appeals to a very niche audience, as does this game. Well let's get into the aspects of this game.\n\nThe plot, and don't tell me "Oh, it's an MMO plot doesn't matter" because it does, Tera has a good plot and that's an MMO.  The plot is pretty basic, go here, help this npc to stop some big evil force and she's with you as a sort of Navi character. It's decent story but they actually give you the choice to skip the plot, which is a bad idea. I understand it's independently developed but I would rather a slightly mediocre voice over, over just text. And they put some of these text dumps right in the middle of enemy territory, which gets to be annoying.\n\nNow with the gameplay. It's repetitive. So it Tera's, but they at least constantly throw new abilities at you and get you to learn them. And each class plays drastically different from the next. You can pretty much put these classes into three categories. Melee Martial, Ranged Martial, and Magical. And each class within those categories plays the exact same. They advertise over 40 unique classes but they fail to produce much diversity in their gameplay. Not to mention that they just hand you weapons that are decently powerful, it isn't until the first boss that you get a more powerful weapon. The game pretty much holds your hand throughout the experience. I also had a lot of lag and even had the game crash on me during a transition. The only good thing I can say about the gameplay is the respawn function this game has, where you can either decide to respawn in town or in the field.\n\nThe soundtrack is average. It's soothing, I guess that's a good thing.\n\nAnd now, onto the aesthetics. This game has the same chibi anime appeal that Maplestory has. While at the same time you have to play the game windowed in a decently small window, this makes the game itself harder on the eyes, at least for me, and once you get to Elias there are just too many people around and it was really a strain on my eyes to look at the surroundings. The enemies aren't threatening either, even Hyperdemension Neptunia had that problem but at the same time they did have some threatening boss enemies. Even the first boss in this game looks adorable.\n\nAge Rating: E for Cartoon Violence\n\nOverall Rating: 4/10\n\nSo in the end I wouldn't suggest it for most of the gaming community, so it will not get a recommendation from me. Instead I'm going to recommend it to you if you enjoyed Maplestory or Gaia Online. I couldn't suggest this game to most of my friends so I won't recommend it here.","November 17, 2015","false","2.7"," No ratings yet","0","0","0","0","0"
"http://steamcommunity.com/id/majikal_payton/recommended/264360/","majikal_payton","Payton","http://steamcommunity.com/id/majikal_payton/","3 products in account","I would like it more if you made it a fullscreen game. xD","July 17, 2014","true","1.0"," No ratings yet","0","0","0","0","0"
"http://steamcommunity.com/id/taitai38/recommended/264360/","taitai38","おまい の おとさん しんだ","http://steamcommunity.com/id/taitai38/","40 products in account","I like this game .... but i have a lagging problem if u have a asia server i think it'll be best thx XD","July 18, 2014","false","0.7"," No ratings yet","0","0","0","0","0"
"http://steamcommunity.com/id/4hwei/recommended/264360/","4hwei","sloth","http://steamcommunity.com/id/4hwei/","158 products in account","CANNOT RUN IT IN AUSTRALIA WASTE OF 1GB PLS.","July 18, 2014","false","0.1"," No ratings yet","0","0","0","0","0"
"http://steamcommunity.com/id/iloveyouforeverandever/recommended/264360/","iloveyouforeverandever","jssp","http://steamcommunity.com/id/iloveyouforeverandever/","53 products in account","holy shti like if  rely play this game LAMSAO","July 18, 2014","true","0.5"," No ratings yet","0","0","0","0","0"
"http://steamcommunity.com/profiles/76561198040299584/recommended/264360/","76561198040299584","Maul","http://steamcommunity.com/profiles/76561198040299584/","10 products in account","Dropped after the autoloot egg expired.","July 19, 2014","false","74.2"," No ratings yet","0","0","0","0","0"
"http://steamcommunity.com/id/ArnettaTorres/recommended/264360/","ArnettaTorres","@lisi@nn@3000","http://steamcommunity.com/id/ArnettaTorres/","5 products in account","Lovely game, Easy to level up. (counting on how you play it)","July 17, 2014","true","82.7"," No ratings yet","0","0","0","0","1"
"http://steamcommunity.com/profiles/76561198056726980/recommended/264360/","76561198056726980","bingue","http://steamcommunity.com/profiles/76561198056726980/","30 products in account","good","July 19, 2014","true","850.9"," No ratings yet","0","0","0","0","0"
"http://steamcommunity.com/profiles/76561198142882864/recommended/264360/","76561198142882864","deathangelcxc","http://steamcommunity.com/profiles/76561198142882864/","9 products in account","..","June 30, 2014","true","3.1"," No ratings yet","0","0","0","0","0"
"http://steamcommunity.com/id/Cooldrmoney/recommended/264360/","Cooldrmoney","The Calcium Cruncher","http://steamcommunity.com/id/Cooldrmoney/","169 products in account","You know how every MMO has that one quest where you have to go out and kill X creatures until you collect Y amount of Z item drops? Every non-tutorial quest so far has just been that. Granted, it's a little more interesting since it's a platformer format that relies a little more on skill rather than having the best items and grinding like normal MMOs, though La Tale isn't really bringing anything new to the table in that regard. Just go play Maple Story and save yourself the trouble.","June 30, 2014","false","3.0"," No ratings yet","0","0","0","0","0"
"http://steamcommunity.com/profiles/76561198077440151/recommended/264360/","76561198077440151","Kayomi-Nee","http://steamcommunity.com/profiles/76561198077440151/","67 products in account","Baaaaad","June 30, 2014","false","0.5"," No ratings yet","0","0","0","0","0"
"http://steamcommunity.com/id/Wildstride/recommended/264360/","Wildstride","Hollows","http://steamcommunity.com/id/Wildstride/","166 products in account","I blew up dressed as a cat man while air banging random players. 10/10","July 15, 2014","true","81.1"," No ratings yet","0","0","0","0","0"
"http://steamcommunity.com/id/dunafornicator/recommended/264360/","dunafornicator","Dunafornicator","http://steamcommunity.com/id/dunafornicator/","124 products in account","They don't state that European players cannot play without ferocious lag.","July 15, 2014","false","1.6"," No ratings yet","0","0","0","0","0"
"http://steamcommunity.com/id/zaksec/recommended/264360/","zaksec","Zaksec","http://steamcommunity.com/id/zaksec/","9 products in account","I remember this. I played this game since it was originaly published by aeria games. La Tale is a side scrollong MMORPG where you see a tiny bit of backstory of a mysterious woman named Iris. After the optional cutscene you're taken to skippable tutorial with and a refference to the power rangers (The main villians are complete idiots BTW). The classes are the warrior(two handed sword and spears), the knight(one handed swords and clubs), the explorer(cross/bows and daggers), the wizard(staves), engineer(Breif case with large arttilery), and the SOUL BREAKER (monster souls). most classes uses knuckles(warrior,knight, explorer, and wizard)  and two classes uses daggers (explorers adn wizards). however the knight has a class theat specializes in knuckles. B4 the STORM update the requirement to go the next class is level 80 and now its level 50 in the desert. Most classes has 2 classes to play. Like the warrior you can pick the warlord but you'll still use swords and spears but if you choose the blader you can use twin blades. what I like about the game is the variety of classes there including the subclasses. The first 2 towns will be highly populated. my main issuses about La Tale is the deletion limit. once you hit 30 times you can't delete you character anymore. not unlees you're told to submit a ticket in order to rset it. I felt like a dumbass when I was told about it on facebook by the GM's themselves. This game isn't my favorite 2D sidescroller (its wonderking (youtube it). some maplestory may call it a "clone" but why the hell would I care. There is two communities who argue about the simmilarities i still don't care about it","July 15, 2014","true","0.1"," No ratings yet","0","0","0","0","0"
"http://steamcommunity.com/id/sonicman809/recommended/264360/","sonicman809","sonicman809","http://steamcommunity.com/id/sonicman809/","113 products in account","its a good games but i like maplestory","July 16, 2014","true","4.0"," No ratings yet","0","0","0","0","0"
"http://steamcommunity.com/id/ThePersonaZero/recommended/264360/","ThePersonaZero","ThePersonaZero","http://steamcommunity.com/id/ThePersonaZero/","208 products in account","2kawaii4me/10","July 16, 2014","true","22.4"," No ratings yet","0","0","0","0","0"
"http://steamcommunity.com/id/VolcanReva/recommended/264360/","VolcanReva","Akita","http://steamcommunity.com/id/VolcanReva/","58 products in account","buen juego mmorpg de plataformas bueno para pasar el rato, historia interesantes y quest dinamicas","July 16, 2014","true","107.8"," No ratings yet","0","0","0","0","0"
"http://steamcommunity.com/profiles/76561198143980609/recommended/264360/","76561198143980609","Akashima","http://steamcommunity.com/profiles/76561198143980609/","","Good game, pretty funny","July 16, 2014","true","3.3"," No ratings yet","0","0","0","0","0"
"http://steamcommunity.com/profiles/76561198126513968/recommended/264360/","76561198126513968","","http://steamcommunity.com/profiles/76561198126513968/","","Everytime i play it says buy game i press bye and it dosn`t work","July 17, 2014","true","0.3"," No ratings yet","0","0","0","0","0"
"http://steamcommunity.com/id/majikal_payton/recommended/264360/","majikal_payton","Payton","http://steamcommunity.com/id/majikal_payton/","3 products in account","I would like it more if you made it a fullscreen game. xD","July 17, 2014","true","1.0"," No ratings yet","0","0","0","0","0"
"http://steamcommunity.com/id/taitai38/recommended/264360/","taitai38","おまい の おとさん しんだ","http://steamcommunity.com/id/taitai38/","40 products in account","I like this game .... but i have a lagging problem if u have a asia server i think it'll be best thx XD","July 18, 2014","false","0.7"," No ratings yet","0","0","0","0","0"
"http://steamcommunity.com/id/Nyarlaa/recommended/264360/","Nyarlaa","ИYΛГLΛ","http://steamcommunity.com/id/Nyarlaa/","145 products in account","You are stuck in a 4:3 resolution and the font rendering is a bit bad and you cannot make out some of the words. The game however is pretty fun but the quests are repetative. It's good for a f2p.","June 22, 2014","true","3.2"," No ratings yet","0","0","0","0","0"
"http://steamcommunity.com/id/omelette-chan/recommended/264360/","omelette-chan","Roll","http://steamcommunity.com/id/omelette-chan/","218 products in account","I love these quests where you have to kill 15 monsters and then get 10 drops from those monsters and then kill 30 monsters and then get 30 drops from those monsters and then kill 30 of those same monsters again. Over and over and over.\n\nNo really, I do. Nostalgic as ♥♥♥♥.","June 22, 2014","false","13.8"," No ratings yet","0","0","0","0","0"
"http://steamcommunity.com/id/syednekochan/recommended/264360/","syednekochan","SyedNekoChan","http://steamcommunity.com/id/syednekochan/","13 products in account","Yes Its an EPIC MMO for a 2D game and i sipmly love it..its amazing wow","June 22, 2014","true","17.0"," No ratings yet","0","0","0","0","2"
"http://steamcommunity.com/profiles/76561198073825693/recommended/264360/","76561198073825693","¢ÒÓ£ $p0†","http://steamcommunity.com/profiles/76561198073825693/","66 products in account","La Tale... Another massproduced korean anime styled MMORPG. What is to explain? Nothing, if you search something compareable can you take a look to Ragnarok Online 2, Flyff, Florensia and so on. The Game has no inventions, is nothing special. Its a simple 2D Sidescroll MMORPG. Its also a big lie that the Game has more as 40 classes included. Its 6 on every basic class. 5 Classes are now implemtented makes 30 classes. Not over 40!\n\nMy Fazit: La Tale another piece of korean MMORPG Junk and will never get popular on the european market that is what i know deifnitly.\n\nDont download it and expect a nice game. The Game has a crappy game feeling. Hope Wonderking 2 will released soon and with more inventions as the first part was comed to BigPoint in 2008.","June 22, 2014","false","3.6"," No ratings yet","0","0","0","0","0"
"http://steamcommunity.com/profiles/76561198129467590/recommended/264360/","76561198129467590","Mr.Devious","http://steamcommunity.com/profiles/76561198129467590/","2 products in account","wtf how to register i tried but it says duplicated email wtf ???","June 22, 2014","true","0.2"," No ratings yet","0","0","0","0","0"
"http://steamcommunity.com/profiles/76561198036331452/recommended/264360/","76561198036331452","Gigibop","http://steamcommunity.com/profiles/76561198036331452/","67 products in account","Maple but better :D (not run by Nexon.....)","June 23, 2014","true","91.9"," No ratings yet","0","0","0","0","0"
"http://steamcommunity.com/profiles/76561198139559839/recommended/264360/","76561198139559839",".-.","http://steamcommunity.com/profiles/76561198139559839/","","its like maplestory , FUN :D","June 23, 2014","true","50.8"," No ratings yet","0","0","0","0","0"
"http://steamcommunity.com/id/BlakieSs/recommended/264360/","BlakieSs","BlakieSs","http://steamcommunity.com/id/BlakieSs/","3 products in account","i wanna play the game.But the game dont let me to :/.Everything is okay log in my character and here is the problem when i log  you are going at the beginner world right ? there have instructions click right to move or something like that when i click right or any other button its automaticly disconnecting me from the game (crashing)","June 23, 2014","false","0.3"," No ratings yet","0","0","0","0","0"
"http://steamcommunity.com/id/KhaoSBourne/recommended/264360/","KhaoSBourne","kebabking","http://steamcommunity.com/id/KhaoSBourne/","18 products in account","Heres my review for this game.\nIts very anime and would be something I guess is related to sinpie or whatever because it is anime.\n\nThe Good's: +small download\n+good animations and graphics\n+wide selection of classes\n+decent character creation screen\n+fluid combat animation\n+good community\n\nand\n\nThe Bad's: -not really compatable with norton had to set rules for it (around 27 minutes to get it to work)\n-controls take time to get used to\n-(+has gamepad support) but is hard to use in this game\n\nThe game over all is good, has nice music, and for some reason power rangers.\nOh yea you can date to if you're into cyber I guess.","June 21, 2014","true","7.5"," No ratings yet","0","0","0","0","0"
"http://steamcommunity.com/profiles/76561198043983940/recommended/264360/","76561198043983940","Fresh Esh","http://steamcommunity.com/profiles/76561198043983940/","66 products in account","I mean if it actaully worked maybe Id be able to review it","June 23, 2014","false","2.3"," No ratings yet","0","0","0","0","0"
"http://steamcommunity.com/id/hardcorecoder/recommended/264360/","hardcorecoder","CO HCCGaming","http://steamcommunity.com/id/hardcorecoder/","27 products in account","Pros:\n\nThe gameplay is great.\nThe graphics are excellent.\nThe game can be completed thoroughly without paying a penny.\nThe world has something for everyone.\nFor once, stats pay off.\nFor once, HEALING SPELLS pay off.\nWell balanced classes.\nPerfect XP gain rate.\n\nCons:\n\nCan only fullscreen to 3 resolutions.\nThe battle style is good, but not new.","June 28, 2014","true","162.7"," No ratings yet","0","0","0","0","0"
"http://steamcommunity.com/profiles/76561198043786038/recommended/264360/","76561198043786038","Eldskuggan","http://steamcommunity.com/profiles/76561198043786038/","202 products in account","Do you enjoy roleplaying, 2D sidescrolling, beat em up games in the style of Maple Story?  Then you will love this game for what it is!\n\nIt's not exactly like MP, but it takes a lot of elements out of it when it comes to gameplay, characters and combat and that isn't a bad thing!\n\nThere is a lot to do in this game, but I would recommend to bring some friends along the way, or make some ingame!\n\nIf you haven't, you should give this game a fair chance! You might end up loving it!","June 28, 2014","true","0.4"," No ratings yet","0","0","0","0","0"
"http://steamcommunity.com/profiles/76561198028678524/recommended/264360/","76561198028678524","Beck","http://steamcommunity.com/profiles/76561198028678524/","18 products in account","If you like chibi anime, Side scroller combat, and MMOs. This is the game for you!","June 28, 2014","true","27.6"," No ratings yet","0","0","0","0","0"
"http://steamcommunity.com/profiles/76561198061784837/recommended/264360/","76561198061784837","Radar technician","http://steamcommunity.com/profiles/76561198061784837/","44 products in account","this game. so ♥♥♥♥ing deley","June 28, 2014","false","24.6"," No ratings yet","0","0","0","0","0"
"http://steamcommunity.com/profiles/76561198056007571/recommended/264360/","76561198056007571","SSJDan","http://steamcommunity.com/profiles/76561198056007571/","71 products in account","Unplayable for anyone in Australia, spent many hours on this when I lived in the UK. Until they make an Australian dedicated server I will never play this game again as the lag is just too harsh. It is disappointing that such a good game that is available in UK, Korea, Japan, China, Taiwan, and the US doesn't realise the potential in creating an Australian server. I love this game but this is a big turn off for me.","June 29, 2014","false","2.9"," No ratings yet","0","0","0","0","0"
"http://steamcommunity.com/profiles/76561198061293582/recommended/264360/","76561198061293582","Nu Youkai","http://steamcommunity.com/profiles/76561198061293582/","61 products in account","La Tale is a simple side-scrolling game most comparable to Maplestory back in its younger years. You start out by picking one of the classic RPG classes, which then can be advanced into an even better class at level 80. The quests are simple; kill 'x' amount of monsters or get this item from so-and-so or go to this NPC. It isn't that difficult to level up in, and the storyline is easy to understand despite the grammar lost in translation. Despite the massive amount of grinding done, it isn't that painful and the game makes it relaxing. The quirky yet colorful graphics are anime/manga-like, and the colors for equipment and such aren't gender restricted. I highly reccomend that everyone reading this review should try the game for at least five to ten minutes; even if it's not your cup of tea.","June 29, 2014","true","7.7"," No ratings yet","0","0","0","0","0"
"http://steamcommunity.com/profiles/76561197999367576/recommended/264360/","76561197999367576","Kavinksy","http://steamcommunity.com/profiles/76561197999367576/","128 products in account","Very Cute Game. But the lack of control settings is really too bad, being locked to the arrow keys after playing with W,A,S,D for nearly 2 Decades really messes me up when using the arrows. It feels backwards. I wish also that the game wouldnt introduce you to higher level players so fast.","June 24, 2014","false","0.5"," No ratings yet","0","0","0","0","1"
"http://steamcommunity.com/profiles/76561198142521735/recommended/264360/","76561198142521735","L0Lz8","http://steamcommunity.com/profiles/76561198142521735/","","i just dont like this game at all...... it sucks cuz of the play style AND THAT BACKGROUNG MUSIC AHHHHHHHHHHHHHHHHHHHHH!!!!!!!!!!!!!!!!!!!!","June 29, 2014","false","0.4"," No ratings yet","0","0","0","0","0"
"http://steamcommunity.com/id/I_R_Legend/recommended/264360/","I_R_Legend","EXTRAORDINARY LEAGUE OF DICKS","http://steamcommunity.com/id/I_R_Legend/","19 products in account","Great game! Good balanced skills and everything. I love all the classes and jobs. Can't wait for if there will be a Season 3! <3","June 29, 2014","true","44.0"," No ratings yet","0","0","0","0","0"
