"url","reviewerUsername","reviewerDisplayName","reviewerUrl","reviewerProductsCount","reviewText","date","recommended","hoursPlayed","voteText","helpfulPercent","votesHelpful","votesTotal","votesFunny","commentsCount"
"http://steamcommunity.com/id/HardcorePwnagraph/recommended/264360/","HardcorePwnagraph","Pwnagraphic","http://steamcommunity.com/id/HardcorePwnagraph/","81 products in account","I love the game","July 17, 2014","true","350.6"," 1 person found this review helpful","0","1","1","0","0"
"http://steamcommunity.com/id/Valioa/recommended/264360/","Valioa","◄ Valioa the Demon ►","http://steamcommunity.com/id/Valioa/","166 products in account","If you enjoy MMORPG's, this is the game for you.  Don't let the cutesy 2D anime graphics fool you, this game has tons of content that can keep you occupied for hours and hours.  I WILL say that the beginning of this game is quite tedious with the tutorial quest no lie, but after that it gets better as you level.    The thing that stood out in my opinion was the fact that there are so many classes to choose from, some that you would see in a typical mmorpg like Wizard or Warrior, and a few unique classes such as Soul Breaker and Engineer.\n\nEach class also has at most 2 advancements to choose from when you reach level 50, which takes less than a week, don't worry.  Examples of the advancements include Warrior's having a choice of becoming either Warlord, which specializes in the spear or two-handed sword, or Blader, which specializes in dual blades.  Which would you prefer if you were warrior?  Slow, but Powerful?  Or Fast attack speed with damaging combos?  You decide.\n\nI'm only talking about one class here too.  Even after 2nd Job advancements, the game takes it further with 3rd job advancements at lvl 100, then Sub-Class advancements at 140, and finally, the new edition 4th job classes at lvl 190.  Sounds like a long journey right?  It is.  However, with dedication and hard work, you too can gain 3rd job, and even 4th job too!\n\nMy highest level so far is Lvl 117, an Engistar (3rd job class Engineer), and im getting there, not giving up till I get that sub class! :)  Don't get me wrong, I don't play this game 24/7, I think of this game as a "pick up and play it for a bit" one.  Sure, you can just go all out and level to the max, but sometimes its best to take it slow, if you know what I mean.\n\nAND, of course, play with your pals too!  The game is enjoyable to its fullest if you have a full party of friends, heck, even strangers, duking it out on the Instance Dungeon bosses with healing support, tanking, and damage dealing as the perfect team comp.\n\nI Would talk more about La Tale, but, I'd just be going on and on xD.  So, with that in mind, see ya guys in game!\n\nIGNs on La Tale:  Valioa (lvl 140 Soul Lord),  And SacredBelmont (Lvl 123 Engistar)","July 4, 2014","true","123.5"," 1 person found this review helpful","0","1","1","0","0"
"http://steamcommunity.com/profiles/76561198138189868/recommended/264360/","76561198138189868","Biomut3tje","http://steamcommunity.com/profiles/76561198138189868/","1 product in account","It's a funny game","June 20, 2014","true","1.0"," 1 person found this review helpful 1 person found this review funny","0","1","1","0","1"
"http://steamcommunity.com/profiles/76561198057972810/recommended/264360/","76561198057972810","Bot Trevor","http://steamcommunity.com/profiles/76561198057972810/","80 products in account","d","June 26, 2014","true","44.4"," 1 person found this review helpful","0","1","1","0","0"
"http://steamcommunity.com/profiles/76561198130285336/recommended/264360/","76561198130285336","Ƈ♡ĿD ΛS ĪƇƐ","http://steamcommunity.com/profiles/76561198130285336/","11 products in account","Product received for free\n\nAt first, I didn't really like the game. I thought it was too slow and the controls too delayed, but then when I gave it another chance and forged ahead I found an enjoyable experience. Whether your go solo or enjoy this game in a party of friends, you're sure to find yourself playing for longer than you'd think. As a Free to Play game, it isn't a Play to Win. You can put money into it if you enjoy it and have the change, but it isn't necessary at all to make an effective character. If you enjoy Maplestory or other similarly styled game, I highly recommend La Tale, as I personally find it more impacting and better designed than the former.","May 21","true","7.2"," 1 person found this review helpful","0","1","1","0","0"
"http://steamcommunity.com/profiles/76561198030416342/recommended/264360/","76561198030416342","jedskyther","http://steamcommunity.com/profiles/76561198030416342/","6 products in account","Alright guys? Well let me be honest with you, I wouldn't recommend anybody playing this game what so ever.  In such a case i would, it would only be if\n-------------------------------------------\n1. you love reading lots of text at the start of the game.\n2. Perfer visual novels over an actual game.\n3. love Maple Story copies.\n-------------------------------------------\nIf you fall under those three catagories, then go play the game. If not then well like i said its not worth playing something with such a boring intro where you can't even get into the game. I\nThe first 5 mins i was super bored by all the text without any combat. When i did get to the combat it wasn't evne worth it.\n\nGet guildwars 2, its free and much better than this.  Enjoy","June 5","false","0.9"," 1 person found this review helpful","0","1","1","0","0"
"http://steamcommunity.com/profiles/76561198088794067/recommended/264360/","76561198088794067","KiraraFox","http://steamcommunity.com/profiles/76561198088794067/","132 products in account","Most under rated game ever. I absolutly love this game and have met so menny wonderfull people in the LaTale world","October 1, 2014","true","80.7"," 2 of 3 people (67%) found this review helpful","67","2","3","0","0"
"http://steamcommunity.com/id/grim_awakening/recommended/264360/","grim_awakening","Grim_Awakening","http://steamcommunity.com/id/grim_awakening/","223 products in account","Best game I have ever played. 10/10 tentacles","June 22, 2014","true","0.9"," 2 of 3 people (67%) found this review helpful","67","2","3","0","0"
"http://steamcommunity.com/profiles/76561198069626655/recommended/264360/","76561198069626655","yx","http://steamcommunity.com/profiles/76561198069626655/","108 products in account","Fun, pretty game.","June 20, 2014","true","1.7"," 2 of 3 people (67%) found this review helpful","67","2","3","0","0"
"http://steamcommunity.com/profiles/76561198086863106/recommended/264360/","76561198086863106","SLDR","http://steamcommunity.com/profiles/76561198086863106/","72 products in account","i lovvvveee it and i only played it for like 30 min.!","July 12, 2014","true","2.3"," 2 of 3 people (67%) found this review helpful","67","2","3","0","0"
"http://steamcommunity.com/id/shslcutie/recommended/264360/","shslcutie","pinkeich","http://steamcommunity.com/id/shslcutie/","10 products in account","Cute mmo, good to play, is fun..yeah","June 28, 2014","true","5.6"," 2 of 3 people (67%) found this review helpful","67","2","3","0","0"
"http://steamcommunity.com/id/gaypenis/recommended/264360/","gaypenis","WEEB TRASH","http://steamcommunity.com/id/gaypenis/","277 products in account","2fuknkawaii","August 7, 2014","true","56.7"," 2 of 3 people (67%) found this review helpful","67","2","3","0","1"
"http://steamcommunity.com/profiles/76561198117255589/recommended/264360/","76561198117255589","gokihizama","http://steamcommunity.com/profiles/76561198117255589/","17 products in account","If your a fan of side scroller mmos this one is pretty good.  I personaly think that the movement pace is a little slow but they keep you moving pretty good on quests.  The inclusion of being able to buy fashion items with in game money is pretty cool too.  That being said it is plagued with micro transactions altho not nessisary still they are there. I suggest checking it out. i give it 7 1/2 on a 1 to 10 scale. give it a go its pretty fun.","August 15, 2014","true","48.5"," 2 of 3 people (67%) found this review helpful","67","2","3","0","0"
"http://steamcommunity.com/id/kojk0/recommended/264360/","kojk0","kojk0","http://steamcommunity.com/id/kojk0/","344 products in account","Im one of those guys who played when AERIA Games had an european server for Latale.\nI played a ton of Latale back then and i had a lvl 180 blader and a lvl 100 gunslinger but sadly the server was shut down and OGP was the only other one up at that moment.\nI tried it but the server was too laggy (USA) but still i played till a lvl 100 guardian and a lvl 120 duelist.\nIt's just so tempting to get that another lvl up lvl after lvl, grinding is fun (in a party or solo) and there's a lot of customisation options for your character. It does take a while to lvl up but 2nd season has revoked the lvls for job advancement so it doesn't take as long as it used to.\nCons:\n- Good community even tho a little dead at high lvls\n- Grinding is fun and there's a lot of skills ingame\n- catchy songs :D\nBad:\n- most of the coolest customisation clothes require to be bought with IRL money.\n- takes a lot of time to lvl up at higher lvls.\n\nIt's a game you must try if you like 2D platform games or games that are grindy and have a "cutesy theme". The game also works great with controllers but you do have to set that up for a while.","June 19, 2014","true","45.3"," 2 of 3 people (67%) found this review helpful","67","2","3","0","0"
"http://steamcommunity.com/profiles/76561198123496030/recommended/264360/","76561198123496030","General_Pen0r","http://steamcommunity.com/profiles/76561198123496030/","31 products in account","This game, Is probably the best game I could ever play with the kids that i babysit, The gameplay is simple, The controls are easy to learn, And the player base is nice. I may have only put two hours into this, But it is so addicting. This game deserves a 12/10 just for the art. And adding the playability for 9 year olds. it adds a whole 'nuther 10. so all in all, its a 22/10","June 30, 2014","true","8.9"," 2 of 3 people (67%) found this review helpful 2 people found this review funny","67","2","3","2","0"
"http://steamcommunity.com/profiles/76561198131719713/recommended/264360/","76561198131719713","plague dragon","http://steamcommunity.com/profiles/76561198131719713/","230 products in account","good","June 18, 2014","true","10.5"," 3 of 5 people (60%) found this review helpful","60","3","5","0","0"
"http://steamcommunity.com/id/CheatSource/recommended/264360/","CheatSource","Reficul","http://steamcommunity.com/id/CheatSource/","75 products in account","Cool Game....","June 19, 2014","true","19.6"," 3 of 5 people (60%) found this review helpful","60","3","5","0","0"
"http://steamcommunity.com/id/endlesss/recommended/264360/","endlesss","FYÜ | Endless","http://steamcommunity.com/id/endlesss/","152 products in account","If you like stupid kawaii RPGs then pick this game up. Otherwise just play MapleStory or don't play anything at all because they just waste your time and take your soul... and and... s-senpai cannot notice you o////o .. many x and Ds","June 19, 2014","true","0.4"," 4 of 7 people (57%) found this review helpful 1 person found this review funny","57","4","7","0","0"
"http://steamcommunity.com/id/sharosa/recommended/264360/","sharosa","Sharosa","http://steamcommunity.com/id/sharosa/","209 products in account","why is this game SO ADDICTING?!?!?!","June 18, 2014","true","5.1"," 5 of 9 people (56%) found this review helpful","56","5","9","0","0"
"http://steamcommunity.com/id/LavitzDragoon/recommended/264360/","LavitzDragoon","Nightingale","http://steamcommunity.com/id/LavitzDragoon/","51 products in account","10/10 can be squirrel waifu\n\nSeriously though, it's like MapleStory, except good. When you get over the occasional Engrish, anyways.","December 3, 2014","true","74.1"," 5 of 9 people (56%) found this review helpful 2 people found this review funny","56","5","9","2","0"
"http://steamcommunity.com/id/JellybeanDream/recommended/264360/","JellybeanDream","JellybeanDream","http://steamcommunity.com/id/JellybeanDream/","161 products in account","This is laterally the best game ever made.","June 20, 2014","true","5.7"," 6 of 11 people (55%) found this review helpful","55","6","11","0","0"
"http://steamcommunity.com/profiles/76561198094959551/recommended/264360/","76561198094959551","Jay","http://steamcommunity.com/profiles/76561198094959551/","12 products in account","Yes! That is all.","June 20, 2014","true","27.2"," 6 of 11 people (55%) found this review helpful","55","6","11","0","0"
"http://steamcommunity.com/id/Dat0neJay/recommended/264360/","Dat0neJay","Dat0neJay","http://steamcommunity.com/id/Dat0neJay/","79 products in account","It's like Maplestory, but with taller people and with less jumping around.","June 23, 2015","true","11.9"," 7 of 13 people (54%) found this review helpful 3 people found this review funny","54","7","13","3","0"
"http://steamcommunity.com/id/gaming_mode/recommended/264360/","gaming_mode","Luke","http://steamcommunity.com/id/gaming_mode/","2 products in account","Kawaii :3","June 21, 2014","true","14.0"," 10 of 19 people (53%) found this review helpful","53","10","19","0","0"
"http://steamcommunity.com/id/Nahiko/recommended/264360/","Nahiko","Nahiko","http://steamcommunity.com/id/Nahiko/","173 products in account","Not reccomended for Oceanic players, movement delay(lag) makes the game unplayable.\nMethods such as TCPackFrequently and low vid mode do not fix the issue as it is an issue with the OGP servers/client that uses a silly method to send packets for every in game action (including movement) and this generates a delay of about 1-2seconds for simple movement keys.\nThe only way for this to be fixed is either OGP creates a server closer to oceanic players or they recode the game client; both are unlikely.","June 25, 2014","false","0.1"," 15 of 29 people (52%) found this review helpful","52","15","29","0","0"
"http://steamcommunity.com/id/junaid_m_sam/recommended/264360/","junaid_m_sam","ILLUMINATI","http://steamcommunity.com/id/junaid_m_sam/","162 products in account","Huge amount of customization, several classes, player crafting.\n\nMassive library of skills.\n\nGreat music.\n\nInnovative 2D side-scrolling fantasy MMORPG with cute anime-inspired graphics.\n\nAmple amount of quests and innovative gameplay.","July 3, 2014","true","28.5"," 1 of 2 people (50%) found this review helpful","50","1","2","0","0"
"http://steamcommunity.com/id/rustedlion/recommended/264360/","rustedlion","Rustedlion","http://steamcommunity.com/id/rustedlion/","134 products in account","First things first... (I have countless hours in this game being a closed beta player)\nYou will not be using your old accounts with the steam version (Something they will be fixing or figuring out soon [Hopefully]).\nSecond, if you arent in America you will be experiencing lag (It used to be way worse.... even for the American players).\n\nAlright so here we go...\n\nA lot of people will compare this to many similar games, the one best known will be Maplestory but lets stop right there...\nThis game is what maplestory wish it could have been at its core.\nIt is not pay to win.\nThe community is friendly (90% every commnuity has its jerks).\nAn active staff that listens to its players (Seriously, players have made concerns and had OP items nerfed because they felt an unfair advantage to things that were easier to acquire with cash).\n90% of everything is tradeable or farmable (non cash items that is, most cash is tradeable or giftable)\nHackers... I honestly have never seen them and only heard of them in stories..\nBroken economy? No sir.\nBots? A few spam bots but the game has block features which mute players.\n\nNow for a review.\n\nIn short, You are a hero of the game (Not THE HERO... a hero), a young adventurer making your way in the world trying to figure out what happened to "Iris Livier" and her travelers. The story is in parts and along the way you unlock bits and pieces with semi deep quest lines and story telling (It honestly gets REALLY good towards end game). Like most MMORPGS you will be grinding and leveling. Questing and being challenged by dungeons and bosses (even special Time attack dungeons with bad ♥♥♥ music). There's lots of side things to do as well...\nDevelop and perfect your playstyle!\nPVP!\nJoin a guild. (Harvest guild crops and get to know your community!)\nLearn a profession.\nMine your heart out.\nFish forever!\nDig! (Yes dig for items in any map that isnt in towns)\nDance! (There's a dancing mini game!)\nChill out.\nBe a merchant.\nAnd so much more...\n\nThere's so much more freedom in this game than most other 2d MMORPGS...\nIf you truly enjoy 2D MMORPGS then give this game a shot.. A REAL SHOT...","July 6, 2014","true","1.5"," 1 of 2 people (50%) found this review helpful","50","1","2","0","0"
"http://steamcommunity.com/id/ebsrulez/recommended/264360/","ebsrulez","Ebkelley","http://steamcommunity.com/id/ebsrulez/","17 products in account","best game ever","August 2, 2014","true","12.1"," 1 of 2 people (50%) found this review helpful","50","1","2","0","0"
"http://steamcommunity.com/profiles/76561198089598435/recommended/264360/","76561198089598435","Jabengo","http://steamcommunity.com/profiles/76561198089598435/","21 products in account","Pretty cool and fun game. I find this to be better than maplestory 9/10","July 6, 2014","true","5.2"," 1 of 2 people (50%) found this review helpful","50","1","2","0","0"
"http://steamcommunity.com/id/LHNNI-Za8H7-BETR5/recommended/264360/","LHNNI-Za8H7-BETR5","Chara Dreemurr","http://steamcommunity.com/id/LHNNI-Za8H7-BETR5/","14 products in account","Best Action Game Ever","July 30, 2014","true","45.0"," 1 of 2 people (50%) found this review helpful","50","1","2","0","0"
"http://steamcommunity.com/profiles/76561198127213141/recommended/264360/","76561198127213141","xNenmiex","http://steamcommunity.com/profiles/76561198127213141/","37 products in account","Fun when you have friends online. Unless you just like to kill every monster you see. I've been playing it for three years and it's still fun. 10 out of 10","December 23, 2014","true","233.8"," 4 of 8 people (50%) found this review helpful","50","4","8","0","0"
"http://steamcommunity.com/id/ALvl4Ninja/recommended/264360/","ALvl4Ninja","ALvl4Ninja","http://steamcommunity.com/id/ALvl4Ninja/","219 products in account","Closest game to compare this to would of course be Maplestory. But by no means is it an exact copy. Lots of cool features that Maplestory just didnt even have. Love the controller support, makes playing so easy. Game isnt pay2win in my opinion just because there are usually events going on which will easily help you navigate around that aspect to a degree. I will say this though the game is a grind fest with a level cap of 200. So expect hours and hours of non stop grinding.","October 15, 2014","true","80.8"," 3 of 6 people (50%) found this review helpful","50","3","6","0","0"
"http://steamcommunity.com/id/gimmethachocolate/recommended/264360/","gimmethachocolate","mr Fun Boy having OFFICIAL fun!","http://steamcommunity.com/id/gimmethachocolate/","56 products in account","ya sure this games good if youre up for 2d sidescrolling mmorpgs and youre an otaku trash","July 20, 2014","true","1.9"," 1 of 2 people (50%) found this review helpful","50","1","2","0","0"
"http://steamcommunity.com/profiles/76561198106966075/recommended/264360/","76561198106966075","☆Karambit☆","http://steamcommunity.com/profiles/76561198106966075/","14 products in account","Well, I would only (recommend) this because if you want to play something awesome like Maple story and love anime rpg ; Maple story don't work don't bother trying over and over unless you really want to play sometime like Maple story than I (recommend) playing La Tale :D\n","March 31, 2015","true","406.3"," 9 of 18 people (50%) found this review helpful 1 person found this review funny","50","9","18","0","1"
"http://steamcommunity.com/id/BadWolf_909/recommended/264360/","BadWolf_909","BadWolf_909","http://steamcommunity.com/id/BadWolf_909/","6 products in account","If you like playing Dungeons and Dragons, then you will love this game. It is very simialr to D&D, levels, skill levels, weapons, creatures to fight, armour, class and various quests that earn you XP points. I love playing this game and think you will enjoy it too. Its an easy game and fun to play.","June 21, 2014","true","11.7"," 1 of 2 people (50%) found this review helpful","50","1","2","0","0"
"http://steamcommunity.com/id/nennida/recommended/264360/","nennida","Nennida","http://steamcommunity.com/id/nennida/","90 products in account","Pretty fun.  Not a game to be taken seriously.","February 20, 2015","true","12.3"," 2 of 4 people (50%) found this review helpful 1 person found this review funny","50","2","4","0","0"
"http://steamcommunity.com/id/voiceofthepublic/recommended/264360/","voiceofthepublic","Vox","http://steamcommunity.com/id/voiceofthepublic/","311 products in account","Played the game before it came to steam for quite awhile. The new fighting style and map are very fun, as well as having one of the friendliest MMO communities.","December 11, 2014","true","29.5"," 3 of 6 people (50%) found this review helpful","50","3","6","0","0"
"http://steamcommunity.com/id/Ellethwen/recommended/264360/","Ellethwen","Ellethwen","http://steamcommunity.com/id/Ellethwen/","","Ive played this game on and off since its release! I always have enjoyed this game! Its so much fun, definatly when you play with others! Glad to be playing it again! :)","December 5, 2014","true","169.6"," 1 of 2 people (50%) found this review helpful","50","1","2","0","0"
"http://steamcommunity.com/id/doomer/recommended/264360/","doomer","Ivan Carlos","http://steamcommunity.com/id/doomer/","2975 products in account","Useless, old OGPlanet gamers are unable to play, I cannot login using my e-mail and password (and I does not have/want another e-mail to use).\nOnly OGPlanet puts this limit strictly on, all other companies allow you to use an existent account or offer an account convertion to be used exclusively on Steam.","August 23, 2014","false","0.3"," 17 of 34 people (50%) found this review helpful","50","17","34","0","0"
"http://steamcommunity.com/id/samantica/recommended/264360/","samantica","Samantica","http://steamcommunity.com/id/samantica/","30 products in account","=\","July 26, 2014","true","43.1"," 3 of 6 people (50%) found this review helpful 1 person found this review funny","50","3","6","0","0"
"http://steamcommunity.com/profiles/76561198106966075/recommended/264360/","76561198106966075","☆Karambit☆","http://steamcommunity.com/profiles/76561198106966075/","14 products in account","Well, I would only (recommend) this because if you want to play something awesome like Maple story and love anime rpg ; Maple story don't work don't bother trying over and over unless you really want to play sometime like Maple story than I (recommend) playing La Tale :D\n","March 31, 2015","true","406.3"," 9 of 18 people (50%) found this review helpful 1 person found this review funny","50","9","18","0","1"
"http://steamcommunity.com/id/gimmethachocolate/recommended/264360/","gimmethachocolate","mr Fun Boy having OFFICIAL fun!","http://steamcommunity.com/id/gimmethachocolate/","56 products in account","ya sure this games good if youre up for 2d sidescrolling mmorpgs and youre an otaku trash","July 20, 2014","true","1.9"," 1 of 2 people (50%) found this review helpful","50","1","2","0","0"
"http://steamcommunity.com/id/doomer/recommended/264360/","doomer","Ivan Carlos","http://steamcommunity.com/id/doomer/","2975 products in account","Useless, old OGPlanet gamers are unable to play, I cannot login using my e-mail and password (and I does not have/want another e-mail to use).\nOnly OGPlanet puts this limit strictly on, all other companies allow you to use an existent account or offer an account convertion to be used exclusively on Steam.","August 23, 2014","false","0.3"," 17 of 34 people (50%) found this review helpful","50","17","34","0","0"
"http://steamcommunity.com/id/kraxarn/recommended/264360/","kraxarn","Kraxie","http://steamcommunity.com/id/kraxarn/","976 products in account","The maximum resulotion is 1280x800","August 20, 2014","true","1.5"," 2 of 4 people (50%) found this review helpful 1 person found this review funny","50","2","4","0","0"
"http://steamcommunity.com/profiles/76561197977830303/recommended/264360/","76561197977830303","OSAMA IN PYJAMAS","http://steamcommunity.com/profiles/76561197977830303/","7 products in account","after fixing the multiple issues with xtrap , the client for latale is very unstable and stops responding alot your spend most of your time not being able to get into the game not worth the download","April 9, 2015","false","0.6"," 3 of 6 people (50%) found this review helpful","50","3","6","0","0"
"http://steamcommunity.com/profiles/76561198197085322/recommended/264360/","76561198197085322","Zemmy","http://steamcommunity.com/profiles/76561198197085322/","15 products in account","Pretty Gucci","May 22","true","8.3"," 1 of 2 people (50%) found this review helpful","50","1","2","0","0"
"http://steamcommunity.com/profiles/76561198080792442/recommended/264360/","76561198080792442","Jeronimino","http://steamcommunity.com/profiles/76561198080792442/","28 products in account","Love the Music","May 22","true","176.6"," 1 of 2 people (50%) found this review helpful","50","1","2","0","0"
