"url","reviewerUsername","reviewerDisplayName","reviewerUrl","reviewerProductsCount","reviewText","date","recommended","hoursPlayed","voteText","helpfulPercent","votesHelpful","votesTotal","votesFunny","commentsCount"
"http://steamcommunity.com/profiles/76561197970541793/recommended/303590/","76561197970541793","LoveAlotBear","http://steamcommunity.com/profiles/76561197970541793/","447 products in account","Great party game!\nLaughter will ensue.","January 4, 2015","true","9.8"," No ratings yet","0","0","0","0","0"
"http://steamcommunity.com/profiles/76561198009840867/recommended/303590/","76561198009840867","Rock Lobster","http://steamcommunity.com/profiles/76561198009840867/","129 products in account","Great game to play with friends. Lots of game settings can be adjusted to make things more interesting. Only issue is a little balance issues in some game modes. Highly Recommended","January 1, 2015","true","5.5"," No ratings yet","0","0","0","0","0"
"http://steamcommunity.com/profiles/76561197961256114/recommended/303590/","76561197961256114","JOLU","http://steamcommunity.com/profiles/76561197961256114/","68 products in account","Play it with friends!","March 8, 2015","true","1.8"," No ratings yet","0","0","0","0","0"
"http://steamcommunity.com/id/Myre_TEST/recommended/303590/","Myre_TEST","[TEST] Myre","http://steamcommunity.com/id/Myre_TEST/","208 products in account","Take on five different game modes in which you need to blend amongst the AI crowd to fulfil your goal.\n\n-Punch out others blending amongst the crowd in 'Ninja' mode\n-Snipe thieves in a crowded room\n-Keep your cool and suss out your friends as you crawl your way to the finish line past snipers in 'Race' mode\n-Defend the royal family and take out ninjas in 'Knights vs. Ninjas'\n-Seek and snipe assassins in the aptly named 'Assassin' mode\n\n\nWasn't expecting to have such a blast with this game, especially since it wasn't even on sale but took the leap and definitely do not regret it. It's got suspense, bluffing and tension in spades! There was many a moment that had me and my brothers choking with laughter.\n\nUnfortunately for this day and age, It's **Local Multiplayer** only but quite possibly the best damn local game I've played in a while!","June 21, 2015","true","3.6"," No ratings yet","0","0","0","0","0"
"http://steamcommunity.com/profiles/76561198100779393/recommended/303590/","76561198100779393","xXJAYKUBXx","http://steamcommunity.com/profiles/76561198100779393/","27 products in account","simple and yet so fun","September 18, 2015","true","1.5"," No ratings yet","0","0","0","0","0"
"http://steamcommunity.com/profiles/76561198099202834/recommended/303590/","76561198099202834","ThisWhiteMan","http://steamcommunity.com/profiles/76561198099202834/","94 products in account","This game is an absolute blast to play with friends.\nAt first I was Hesitant to pay the 5$ for a game that looks like this, but the purchase totally pays off.\neven people who are not  very game heavy will get into this game.\nIts a must.","August 14, 2015","true","10.1"," No ratings yet","0","0","0","0","0"
"http://steamcommunity.com/id/BattleCat/recommended/303590/","BattleCat","SunBro Solaire","http://steamcommunity.com/id/BattleCat/","247 products in account","Great little game that's hugely enjoyable with 4 players. Plenty of laughs and intense stand offs through several modes. If you don't have any friends give it a miss because nobody wants to hear you complain that it needs online multiplayer.\n\nFor what the developer is asking for, Hidden In Plain Sight is definitely worth a try for awesome local multiplayer games.","May 16, 2015","true","3.7"," No ratings yet","0","0","0","0","0"
"http://steamcommunity.com/id/billychad/recommended/303590/","billychad","Billychad (´･ω･`)","http://steamcommunity.com/id/billychad/","360 products in account","great party game!","May 17, 2015","true","4.7"," No ratings yet","0","0","0","0","0"
"http://steamcommunity.com/id/TheSenpaiThatWillNeverNoticeYou/recommended/303590/","TheSenpaiThatWillNeverNoticeYou","Ernest Tactics","http://steamcommunity.com/id/TheSenpaiThatWillNeverNoticeYou/","381 products in account","Hahaha\n\nThis is actually really fun!\nBought cuz it was like $0.99\n\nMy favorite one is the race!\nand the one where the snipe needs to find the guy who is killing all the guards :D\nand the fluff it I like them all!!","May 18, 2015","true","1.6"," No ratings yet","0","0","0","0","0"
"http://steamcommunity.com/id/TheSenpaiThatWillNeverNoticeYou/recommended/303590/","TheSenpaiThatWillNeverNoticeYou","Ernest Tactics","http://steamcommunity.com/id/TheSenpaiThatWillNeverNoticeYou/","381 products in account","Hahaha\n\nThis is actually really fun!\nBought cuz it was like $0.99\n\nMy favorite one is the race!\nand the one where the snipe needs to find the guy who is killing all the guards :D\nand the fluff it I like them all!!","May 18, 2015","true","1.6"," No ratings yet","0","0","0","0","0"
"http://steamcommunity.com/id/BattleCat/recommended/303590/","BattleCat","SunBro Solaire","http://steamcommunity.com/id/BattleCat/","247 products in account","Great little game that's hugely enjoyable with 4 players. Plenty of laughs and intense stand offs through several modes. If you don't have any friends give it a miss because nobody wants to hear you complain that it needs online multiplayer.\n\nFor what the developer is asking for, Hidden In Plain Sight is definitely worth a try for awesome local multiplayer games.","May 16, 2015","true","3.7"," No ratings yet","0","0","0","0","0"
"http://steamcommunity.com/id/peatymasta/recommended/303590/","peatymasta","peatymasta","http://steamcommunity.com/id/peatymasta/","48 products in account","Absolutely fantastic game. The PC platform often gets flak for less support for couch-coop or party games, but this game breaks the mold completely. Several fun game modes, a totally unique way of having a competitive game without the problem of screen sharing. Prepare for a lot of tense moments between friends, full of swearing, punching, and disowning  family members.","May 19, 2015","true","7.3"," No ratings yet","0","0","0","0","0"
"http://steamcommunity.com/profiles/76561198010348325/recommended/303590/","76561198010348325","bike150","http://steamcommunity.com/profiles/76561198010348325/","125 products in account","Top notch, lots of local multiplayer fun","March 20","true","5.6"," No ratings yet","0","0","0","0","0"
"http://steamcommunity.com/id/BismoFunyunsIV/recommended/303590/","BismoFunyunsIV","The Dirtiest Sanchez","http://steamcommunity.com/id/BismoFunyunsIV/","73 products in account","A fun game to play with friends for about 30 min - 1 hr intervals.   A first choice for small parties.","March 17","true","3.1"," No ratings yet","0","0","0","0","0"
"http://steamcommunity.com/id/spence2000/recommended/303590/","spence2000","ThatThereTim","http://steamcommunity.com/id/spence2000/","430 products in account","Absolutely phenomenal local multiplayer game. The Horse Race mode especially. Just had all 4 of us crying with laughter. :D Brilliant stuff","January 23","true","1.4"," No ratings yet","0","0","0","0","0"
"http://steamcommunity.com/profiles/76561198054680264/recommended/303590/","76561198054680264","ramoz","http://steamcommunity.com/profiles/76561198054680264/","124 products in account","Very cool game!","February 24","true","1.9"," No ratings yet","0","0","0","0","0"
"http://steamcommunity.com/id/XanatharEye/recommended/303590/","XanatharEye","-=LCS=- Arab_Guy","http://steamcommunity.com/id/XanatharEye/","260 products in account","GREAT stealth local multiplayer game, it just requires you have Windows Media Player installed, so that's why I never play it!","February 22","true","0.2"," No ratings yet","0","0","0","0","0"
"http://steamcommunity.com/profiles/76561198080123121/recommended/303590/","76561198080123121","freakingthomas7","http://steamcommunity.com/profiles/76561198080123121/","17 products in account","One of my all time favorite party games. You need 3+ people to really enjoy it and there is no online so make sure you have people to play before purchasing. You don't need to be incredibly fast or accurate to succeed in this game so anyone can play and win. Top down games focused on stealth and teamwork can really get exciting and strategies can vary a lot.","March 24","true","10.8"," No ratings yet","0","0","0","0","0"
"http://steamcommunity.com/id/Dinans007/recommended/303590/","Dinans007","Son of Aghanim","http://steamcommunity.com/id/Dinans007/","46 products in account","funny game","April 5","true","1.4"," No ratings yet","0","0","0","0","0"
"http://steamcommunity.com/profiles/76561197979987597/recommended/303590/","76561197979987597","ampsnotvolts","http://steamcommunity.com/profiles/76561197979987597/","1156 products in account","Find friends and play this game! 4 people playing is the most fun.\n\nSimple but very satisfying gameplay concepts. I would call it masterfully crafted, but others probably cannot get beyond the one-man-aesthetic of the game - but I love it.\n\nFun for the whole family - and most everyone will like it. My ancient parents enjoyed it immensely and it was very nice to just have some wholesome family gaming together.","December 31, 2015","true","5.6"," No ratings yet","0","0","0","0","0"
"http://steamcommunity.com/profiles/76561197967266269/recommended/303590/","76561197967266269","regrat","http://steamcommunity.com/profiles/76561197967266269/","94 products in account","Holy ♥♥♥♥, so much fun, very unique game\n","December 27, 2015","true","6.6"," No ratings yet","0","0","0","0","0"
"http://steamcommunity.com/id/tccristccrist/recommended/303590/","tccristccrist","Detective Late","http://steamcommunity.com/id/tccristccrist/","270 products in account","At least it isn't Decorated Sight","December 26, 2015","true","22.2"," No ratings yet","0","0","0","0","0"
"http://steamcommunity.com/profiles/76561198077097604/recommended/303590/","76561198077097604","Majikthise","http://steamcommunity.com/profiles/76561198077097604/","926 products in account","One of the most FUN 4 player experiences I've ever had in a pc game!\n\nThe gameplay is very quick to learn.  The depth of the gaming experience is incredible.\n\nHighly recommended!\n","January 8","true","3.1"," No ratings yet","0","0","0","0","0"
"http://steamcommunity.com/id/shaymus22/recommended/303590/","shaymus22","Snackrifice","http://steamcommunity.com/id/shaymus22/","598 products in account","Rough - not a lot of polish - but good gameplay. Lots of fun!","January 11","true","0.6"," No ratings yet","0","0","0","0","0"
"http://steamcommunity.com/profiles/76561198075237211/recommended/303590/","76561198075237211","☠Bones☠","http://steamcommunity.com/profiles/76561198075237211/","232 products in account","Extremely fun party game. Makes for a great drinking game as well! Grab some buddies and some brews and make up your own rules.","August 5, 2015","true","4.0"," No ratings yet","0","0","0","0","0"
"http://steamcommunity.com/profiles/76561198100779393/recommended/303590/","76561198100779393","xXJAYKUBXx","http://steamcommunity.com/profiles/76561198100779393/","27 products in account","simple and yet so fun","September 18, 2015","true","1.5"," No ratings yet","0","0","0","0","0"
"http://steamcommunity.com/id/iamsed/recommended/303590/","iamsed","iamsed","http://steamcommunity.com/id/iamsed/","136 products in account","Amazing with 3-4 players. This game provided us amazing value so far and we'll definitely keep coming back to it whenever someone drops by for games&beers evening ;). Simple looks but very good at creating tension :)","July 30, 2015","true","14.5"," No ratings yet","0","0","0","0","0"
"http://steamcommunity.com/profiles/76561198099202834/recommended/303590/","76561198099202834","ThisWhiteMan","http://steamcommunity.com/profiles/76561198099202834/","94 products in account","This game is an absolute blast to play with friends.\nAt first I was Hesitant to pay the 5$ for a game that looks like this, but the purchase totally pays off.\neven people who are not  very game heavy will get into this game.\nIts a must.","August 14, 2015","true","10.1"," No ratings yet","0","0","0","0","0"
"http://steamcommunity.com/profiles/76561197991870894/recommended/303590/","76561197991870894","art.hare","http://steamcommunity.com/profiles/76561197991870894/","90 products in account","Just had a bunch of people over for a couch-gaming session, and this was the hit of the evening!\n\nThe varied game modes really let you keep things fresh, and they're really different strategically from each other.\n\nThe only issue we had was that it took us a while to figure out that in thief mode and assasin mode, the coins don't disappear and people don't appear dead until the sniper scopes actually view the coin/victim.\n\nOne other thing we wished for was a 3v1-type team-swapper, so that we could always have 3 snipers and one thief, but have who is the thief change each round.","August 15, 2015","true","6.9"," No ratings yet","0","0","0","0","0"
"http://steamcommunity.com/profiles/76561198099202834/recommended/303590/","76561198099202834","ThisWhiteMan","http://steamcommunity.com/profiles/76561198099202834/","94 products in account","This game is an absolute blast to play with friends.\nAt first I was Hesitant to pay the 5$ for a game that looks like this, but the purchase totally pays off.\neven people who are not  very game heavy will get into this game.\nIts a must.","August 14, 2015","true","10.1"," No ratings yet","0","0","0","0","0"
"http://steamcommunity.com/profiles/76561197991870894/recommended/303590/","76561197991870894","art.hare","http://steamcommunity.com/profiles/76561197991870894/","90 products in account","Just had a bunch of people over for a couch-gaming session, and this was the hit of the evening!\n\nThe varied game modes really let you keep things fresh, and they're really different strategically from each other.\n\nThe only issue we had was that it took us a while to figure out that in thief mode and assasin mode, the coins don't disappear and people don't appear dead until the sniper scopes actually view the coin/victim.\n\nOne other thing we wished for was a 3v1-type team-swapper, so that we could always have 3 snipers and one thief, but have who is the thief change each round.","August 15, 2015","true","6.9"," No ratings yet","0","0","0","0","0"
"http://steamcommunity.com/id/BismoFunyunsIV/recommended/303590/","BismoFunyunsIV","The Dirtiest Sanchez","http://steamcommunity.com/id/BismoFunyunsIV/","73 products in account","A fun game to play with friends for about 30 min - 1 hr intervals.   A first choice for small parties.","March 17","true","3.1"," No ratings yet","0","0","0","0","0"
"http://steamcommunity.com/id/shaymus22/recommended/303590/","shaymus22","Snackrifice","http://steamcommunity.com/id/shaymus22/","598 products in account","Rough - not a lot of polish - but good gameplay. Lots of fun!","January 11","true","0.6"," No ratings yet","0","0","0","0","0"
"http://steamcommunity.com/id/ToxicDolphin/recommended/303590/","ToxicDolphin","66 Pings; That's Pretty Good","http://steamcommunity.com/id/ToxicDolphin/","54 products in account","Really fun and interesting concept. Simple and hilarious to play with a couple friends at a gathering. The only downside is the required xbox controller.","December 4, 2015","true","8.9"," No ratings yet 1 person found this review funny","0","0","0","0","0"
"http://steamcommunity.com/id/spence2000/recommended/303590/","spence2000","ThatThereTim","http://steamcommunity.com/id/spence2000/","430 products in account","Absolutely phenomenal local multiplayer game. The Horse Race mode especially. Just had all 4 of us crying with laughter. :D Brilliant stuff","January 23","true","1.4"," No ratings yet","0","0","0","0","0"
"http://steamcommunity.com/id/iamsed/recommended/303590/","iamsed","iamsed","http://steamcommunity.com/id/iamsed/","136 products in account","Amazing with 3-4 players. This game provided us amazing value so far and we'll definitely keep coming back to it whenever someone drops by for games&beers evening ;). Simple looks but very good at creating tension :)","July 30, 2015","true","14.5"," No ratings yet","0","0","0","0","0"
"http://steamcommunity.com/id/joycem137/recommended/303590/","joycem137","joycem137","http://steamcommunity.com/id/joycem137/","434 products in account","A great game for parties.  Not a lot of longevity, but fun for a few minutes at a time. :)","August 4, 2015","true","1.2"," No ratings yet","0","0","0","0","0"
"http://steamcommunity.com/id/tccristccrist/recommended/303590/","tccristccrist","Detective Late","http://steamcommunity.com/id/tccristccrist/","270 products in account","At least it isn't Decorated Sight","December 26, 2015","true","22.2"," No ratings yet","0","0","0","0","0"
"http://steamcommunity.com/profiles/76561198077097604/recommended/303590/","76561198077097604","Majikthise","http://steamcommunity.com/profiles/76561198077097604/","926 products in account","One of the most FUN 4 player experiences I've ever had in a pc game!\n\nThe gameplay is very quick to learn.  The depth of the gaming experience is incredible.\n\nHighly recommended!\n","January 8","true","3.1"," No ratings yet","0","0","0","0","0"
"http://steamcommunity.com/id/ToxicDolphin/recommended/303590/","ToxicDolphin","66 Pings; That's Pretty Good","http://steamcommunity.com/id/ToxicDolphin/","54 products in account","Really fun and interesting concept. Simple and hilarious to play with a couple friends at a gathering. The only downside is the required xbox controller.","December 4, 2015","true","8.9"," No ratings yet 1 person found this review funny","0","0","0","0","0"
"http://steamcommunity.com/id/XanatharEye/recommended/303590/","XanatharEye","-=LCS=- Arab_Guy","http://steamcommunity.com/id/XanatharEye/","260 products in account","GREAT stealth local multiplayer game, it just requires you have Windows Media Player installed, so that's why I never play it!","February 22","true","0.2"," No ratings yet","0","0","0","0","0"
"http://steamcommunity.com/id/baliacta/recommended/303590/","baliacta","Harry Adversary","http://steamcommunity.com/id/baliacta/","514 products in account","Really fun local-multiplayer-only game.  A good choice when you've got a mix of players. Regular, casual, and non-gamers will all enjoy this equally.  There are also variants, all well-designed, that you can switch to to keep things interesting.","December 28, 2015","true","1.1"," No ratings yet","0","0","0","0","0"
"http://steamcommunity.com/profiles/76561198098457791/recommended/303590/","76561198098457791","empty silhouette of everything","http://steamcommunity.com/profiles/76561198098457791/","217 products in account","If you want to play this game YOU NEED A CONTROLLER, I ADVISE MORE THAN TWO.\n\nThe game is a really fun party type of game. It's rare to have a local co-op game nowadays,especially one this fun. Get some controllers and some friends and sit down and play the five or so different modes. Tweak the settings for even more fun.","June 4","true","3.8"," No ratings yet","0","0","0","0","0"
