"url","reviewerUsername","reviewerDisplayName","reviewerUrl","reviewerProductsCount","reviewText","date","recommended","hoursPlayed","voteText","helpfulPercent","votesHelpful","votesTotal","votesFunny","commentsCount"
"http://steamcommunity.com/id/thewhiterose000/recommended/303590/","thewhiterose000","Saitama","http://steamcommunity.com/id/thewhiterose000/","478 products in account","-IMPORTANT NOTE-\nThis game is for local co-op only, if you don't got friends who have controllers probably not a good idea then to get this game there is no online multiplayer there is no LAN gameplay either. https://www.youtube.com/watch?v=4j8ZM8pgHds Despite those main flaws this game is highly entertaining and a great party game.\nMaximum of four players can play at a time and it has various game modes to keep\nthings interesting.\nGamers-Haven[www.gamers-haven.org]","July 9, 2014","true","0.7"," 50 of 65 people (77%) found this review helpful","77","50","65","0","4"
"http://steamcommunity.com/id/twistedmango/recommended/303590/","twistedmango","Wacko Prophet","http://steamcommunity.com/id/twistedmango/","359 products in account","I used to scour Steam for local co-op games that could provide a great party experience. This game takes the cake. Hidden in Plain Sight is the single best and most fun local co-op game I've ever played out of over 50 that I've bought and tried.\n\nI've had a room full of people cursing at each other, laughing their asses off to tears, and jumping up and down, while at other times the whole room is silent in concentration and suspense, every set of eyes dead-focused on trying not to be caught by the others' - all caused by this wonderfully simple yet strategically genius video game.\n\nGET IT!","June 18, 2015","true","5.7"," 25 of 27 people (93%) found this review helpful 1 person found this review funny","93","25","27","0","0"
"http://steamcommunity.com/id/synthsequence/recommended/303590/","synthsequence","synthsequence","http://steamcommunity.com/id/synthsequence/","442 products in account","I may only have a small amount of time racked up on here, but rest assured I've sunk many hours into Hidden in Plain Sight on the Xbox 360 version, and man am I glad to see it here on Steam too. Hidden in Plain Sight is a collection of five minigames, all of which are best played with four players, right there at in the same room as you. They all insanely fun (Ninja Party is my favourite) and rely on you keeping your cool as others try to reveal and capture you, while at the same time, you're trying to capture everyone else.\n\nNinja Party, for example, has 2-4 players all as identical ninjas, amongst 30 other identical ninjas. Each player must either be the last one standing by eliminating the other players, or by touching 5 statues scattered around the room, which play a sound each time they're touched. Do you run straight for all the statues, aiming for a quick win but putting yourself in danger of being noticed? Or do you wait for an unsuspecting player to set off the statue, and slay them from behind?\n\nThis is one of the most fun, if not THE most fun local multiplayer games I've ever played, hands down. This is what multiplayer gaming was about: having fun with REAL PEOPLE, before it all became about leaderboards and strangers from halfway across the world. People that you know; friends, family, whoever. Anyone can play this game, from your pro MLG 360 noscopers to your filthy pleb casuals.\n\nAnd it's so refreshing to see local multiplayer games make a comeback, even if most of them are indie titles. Hidden in Plain Sight is a prime example of a simple and brilliant idea with simple and brilliant excecution. It doesn't fall prey to other indie game tropes such an annoyingly pretentious storyline or an obsession with "unique" and overused gimmicks.\n\nYeah, it might not look a treat, but the graphics really, really don't matter. Same goes for the sound, as most of the time you'll be yelling anyway. The gameplay is incredibly unique, tense, and just insanely fun. It's as simple as that. If you're looking for a local multiplayer game, then buy this. At $5 it's an absolute steal. I cannot recommend it enough.\n\n4.5/5","July 17, 2014","true","5.9"," 24 of 27 people (89%) found this review helpful 1 person found this review funny","89","24","27","0","0"
"http://steamcommunity.com/id/theflipside100/recommended/303590/","theflipside100","theflipside100","http://steamcommunity.com/id/theflipside100/","165 products in account","A fantastic 5 dollar game that requires you to actually have friends (I know right?) at your computer. The variety is great, and it's a great package. Pros: Super fun, cool graphics, great soundtrack\nCons: None, except one annoying thing: IF YOU ARE GOING TO PORT A GAME FROM XBOX YOU SHOULDN'T HAVE TO HAVE 2-4 XBOX REMOTES PLUGGED IN AT ALL TIMES! What the heck dude! Heads up, it's a PC, not an XBox. Please add support for one person on keyboard/2 people on keyboard + XBox remote support. Even games like Gang Beasts let you play 2 people on the same keyboard. This is not more complex then Gang Beasts.","November 24, 2014","true","8.4"," 25 of 31 people (81%) found this review helpful 2 people found this review funny","81","25","31","2","2"
"http://steamcommunity.com/id/normhamson/recommended/303590/","normhamson","normhamson","http://steamcommunity.com/id/normhamson/","14 products in account","The most fun local multiplayer game since sliced bread.  Easy to learn, fun to play and watch.  The perfect party game.\n\nI've played this game on another platform mostly, but the gameplay on Steam is identical.","July 16, 2014","true","1.4"," 26 of 34 people (76%) found this review helpful","76","26","34","0","3"
"http://steamcommunity.com/id/peris/recommended/303590/","peris","madbroth","http://steamcommunity.com/id/peris/","172 products in account","Multiple original multiplayer game ideas all packed into on game. Such a simple and beautiful concept. Graphics that perfectly serve the purpose. Definitely recommend getting this if you are ever having friends over for a multiplayer game night. Make sure you have 4 controllers ready!\n\nThis is probably one of the most unique local multiplayer games out there, I wish there was more like this.","October 4, 2014","true","3.0"," 16 of 18 people (89%) found this review helpful","89","16","18","0","0"
"http://steamcommunity.com/id/pugsprofile/recommended/303590/","pugsprofile","Pug","http://steamcommunity.com/id/pugsprofile/","5249 products in account","A "Local Multiplayer Only" Must Buy.\n\nWe've logged some time on this game, and feel it's a fun time filler. You can pick it up and play a few rounds of the mini-game of your choice and play for either a couple of minutes or for long durations.\nThe mini-games are different enough to be interesting, but similar enough that the gameplay controls don't require a lot of extra thought (when playing with casual gamers).\n\nIt's a good game to have if you have a couple of XBox 360 controllers and friends. Simple and entertaining. Watch a gameplay video on YouTube to see if the mini-games are up your alley.","September 16, 2015","true","3.6"," 11 of 13 people (85%) found this review helpful 1 person found this review funny","85","11","13","0","1"
"http://steamcommunity.com/profiles/76561197986801491/recommended/303590/","76561197986801491","Javin","http://steamcommunity.com/profiles/76561197986801491/","327 products in account","Such a simplistic game, but absolutely a riot.  First, figure out which of the "NPCs" on the board is actually you.  Next, make sure nobody else does.  And finally, meet a goal.  Could be killing the other players, touching a series of statues, or running a race while the others have exactly one shot to shoot who they think is you.  Can only be played locally, 2 players, but it's tons of fun.  Highly recommend.  Just a matter of time before you see people making clones of this.  Such a simple premise, but such good gameplay.","September 21, 2015","true","3.7"," 8 of 8 people (100%) found this review helpful","100","8","8","0","1"
"http://steamcommunity.com/id/Katana314/recommended/303590/","Katana314","Katana (PvtLastClass #1424)","http://steamcommunity.com/id/Katana314/","638 products in account","(We are playing Race. One character starts very obviously sprinting ahead.)\nMe: Hah. What an idiot. I got 'im. (I move my crosshair to the "idiot", lining up the shot. No one else bothers to move their crosshairs, not wanting to waste their only rifle shot)\nMe: I got him....I got him......I don't got him....! (The character crosses the finish line before I fire)...It was me.\nOthers: OHH, YOU ♥♥♥♥ING ♥♥♥♥♥♥♥!\n\nGames like HIPS are signalpoints that local multiplayer is dead on consoles, and *more* than alive on PCs. This is a great concept that only works when played in a single room. The amount of double-tricking in some of the more straightforward gamemodes is really fun. I didn't enjoy some of the team-based, asymmetrical modes quite as much, but I'm sure they could become more interesting once people are aware of some of the strategies involved.","May 3, 2015","true","1.5"," 13 of 18 people (72%) found this review helpful 9 people found this review funny","72","13","18","9","1"
"http://steamcommunity.com/id/eduardische/recommended/303590/","eduardische","eduardische","http://steamcommunity.com/id/eduardische/","1215 products in account","I've played this game on Ouya and then the PC version, and everytime it was increadibly easy to get people into playing it and it was a massive amount of fun as well.\n\nAlso, Steam version improves on earlier existing PC version. This has the same customization options as on other platforms now, which I feel is a must-have addition, since I sometimes feel the need to tweak the settings the way we want to play (for example, I occasionally feel that 3 sniper shots is way too much for Catch a Thief, or I want bots to run as well in Death Race). So even if you, like me, have the previously released PC version, I would definitely recommend picking it up.","July 16, 2014","true","7.8"," 10 of 15 people (67%) found this review helpful","67","10","15","0","0"
"http://steamcommunity.com/profiles/76561198047024231/recommended/303590/","76561198047024231","Kony2012","http://steamcommunity.com/profiles/76561198047024231/","415 products in account","If you've got 2-4 controllers and a friend or three, this game will easily become one of the most fun games you can play together. My girlfriend and I play it from time to time, but it's best with 4 players. Great game, lots of fun, only downside is you need controllers, but if you have friends who have them (or have some yourself) you won't have to worry.","November 26, 2014","true","10.8"," 6 of 8 people (75%) found this review helpful","75","6","8","0","0"
"http://steamcommunity.com/id/a1studmuffin/recommended/303590/","a1studmuffin","a1studmuffin","http://steamcommunity.com/id/a1studmuffin/","479 products in account","One of my local multiplayer gaming essentials. The simple game modes make a great warmup for new players and can be clearly explained in a sentence or two. Fun and original gameplay mechanics which result in lots of off-screen tension, provocation and yelling. Invite 3 friends over and you'll have a blast!","March 4","true","2.8"," 3 of 3 people (100%) found this review helpful","100","3","3","0","0"
"http://steamcommunity.com/id/rcphq/recommended/303590/","rcphq","rcphq","http://steamcommunity.com/id/rcphq/","229 products in account","One of the best local (only, no online!) multiplayer experiences i've had with friends. its hard to explain how fun this can be if you like playing games of feint and deceipt!","October 10, 2014","true","1.1"," 5 of 7 people (71%) found this review helpful","71","5","7","0","0"
"http://steamcommunity.com/id/centagon/recommended/303590/","centagon","Cent","http://steamcommunity.com/id/centagon/","423 products in account","Surprising number of metagame layers to this. Probably the most simple, yet enjoyable couch game I've ever played. There are 5 gamemodes, which provide astounding variation. Don't worry about the game's aesthetics, it works well in execution.\n\nDefinitely in the mindgame genre, similar to The Ship, PropHunt or SpyParty.","October 19, 2014","true","1.6"," 5 of 7 people (71%) found this review helpful","71","5","7","0","0"
"http://steamcommunity.com/id/silver102938/recommended/303590/","silver102938","SilverKnight","http://steamcommunity.com/id/silver102938/","230 products in account","This is an easy one, if you have (or sometimes have) someone to play with, GET IT. This has been one of the best buys of my life, while playing the room fills with tension and laughter; a great time for everyone.","August 29, 2015","true","2.5"," 3 of 4 people (75%) found this review helpful","75","3","4","0","0"
"http://steamcommunity.com/id/feuillejaune/recommended/303590/","feuillejaune","Feuille","http://steamcommunity.com/id/feuillejaune/","216 products in account","This game is really great, i've played it many times at some event in my town. 4 players is the best, it's a blast.\nNow i got it at home, parties won't be the same as before. Need a 6 players mode though.\n\nJe recommande ce jeu chaudement, avec 4 manettes, vous allez passer de très très bon moment.","November 14, 2014","true","3.3"," 5 of 8 people (63%) found this review helpful","63","5","8","0","0"
"http://steamcommunity.com/id/bigguyandrusty1/recommended/303590/","bigguyandrusty1","IT'S IN THE BIBLE","http://steamcommunity.com/id/bigguyandrusty1/","141 products in account","Awesome multiplayer game. It's refreshing to find a quality experience on steam","July 20, 2014","true","0.6"," 7 of 12 people (58%) found this review helpful","58","7","12","0","0"
"http://steamcommunity.com/id/eqctentacle/recommended/303590/","eqctentacle","tentacle","http://steamcommunity.com/id/eqctentacle/","560 products in account","Along with Bomberman this is one of the best "local-one-screen-party-games" you could try. Grab four controllers and a bunch of friends and get it on. Thumbs up for easy but addictive gameplay.","October 30, 2015","true","6.8"," 2 of 3 people (67%) found this review helpful","67","2","3","0","0"
"http://steamcommunity.com/id/Flip_45/recommended/303590/","Flip_45","Flip 45","http://steamcommunity.com/id/Flip_45/","324 products in account","Probably the most fun local multiplayer I've had for ages,\n\nThis is accessible enough for people who have never used a controller before, and where being sly and cunning will almost always override pure skill.\n\nTruly recoomended if you want to get a bit of PC gaming into the mix at a party where that might not otherwise the point. Not encountered a person who didn't have fun.. yet!","September 13, 2014","true","4.9"," 3 of 5 people (60%) found this review helpful","60","3","5","0","0"
"http://steamcommunity.com/id/conidium/recommended/303590/","conidium","spore","http://steamcommunity.com/id/conidium/","433 products in account","I played this game alot before it hit Steam. It is such a great party game with its local multiplayer. Get a bunch of friends and controllers and freak out.","July 17, 2014","true","1.5"," 2 of 4 people (50%) found this review helpful","50","2","4","0","0"
"http://steamcommunity.com/profiles/76561197964593026/recommended/303590/","76561197964593026","Nerhael/Sarya","http://steamcommunity.com/profiles/76561197964593026/","334 products in account","Such a great local multiplayer game.  Had a blast playing with some buddies, so much yelling and fun.","July 23, 2014","true","22.7"," 2 of 4 people (50%) found this review helpful","50","2","4","0","0"
"http://steamcommunity.com/profiles/76561198045116846/recommended/303590/","76561198045116846","Man with No Name","http://steamcommunity.com/profiles/76561198045116846/","242 products in account","I love the game, the idea of friends sitting round the same computer. All the game modes are super fun. My only critism would be the amount of game pads needed to play the game. If it were possible to get the wasd or arrow keys to functiom as a controller this would allow a lot more of my friends to play since i only tend to have less that 2 game pads at any one time. Apart from the i absolutly reccomend and love the game. You need friends though. Get some friends first.","July 28, 2014","true","7.8"," 2 of 4 people (50%) found this review helpful 1 person found this review funny","50","2","4","0","0"
"http://steamcommunity.com/profiles/76561197994894093/recommended/303590/","76561197994894093","hypo911","http://steamcommunity.com/profiles/76561197994894093/","204 products in account","Fun game for parties.","November 11, 2014","true","1.3"," 4 of 8 people (50%) found this review helpful","50","4","8","0","0"
"http://steamcommunity.com/id/cerenzio/recommended/303590/","cerenzio","Cerenzio","http://steamcommunity.com/id/cerenzio/","237 products in account","This game is currently $1.24\n\nIt's 4 players, LOCAL Co-op. Meaning, you play on your couch, with your REAL LIFE FRIENDS/FAMILY\n\nIt supports 4 XBOX360 controllers effortlessly. Just turn them on, and your set\n\nIt's a seriese of short games (I won't dare call them Mini-Games), that challenge you to compete against your friends, as a Knight, Monster, Sniper, Theif, etc.\n\nIt's a ton of fun.\n\nIt's $1.24.\n\nSo much WIN. Hard to explain. If you have gamers in your house, this is a must have","February 17, 2015","true","2.8"," 1 of 2 people (50%) found this review helpful","50","1","2","0","0"
"http://steamcommunity.com/profiles/76561198116984380/recommended/303590/","76561198116984380","Exorcismo","http://steamcommunity.com/profiles/76561198116984380/","1091 products in account","excellent game","September 24, 2015","true","2.7"," 1 of 2 people (50%) found this review helpful","50","1","2","0","0"
"http://steamcommunity.com/profiles/76561198002792378/recommended/303590/","76561198002792378","CrazyRobot","http://steamcommunity.com/profiles/76561198002792378/","360 products in account","Fun for a party game session","July 19, 2014","true","0.9"," 7 of 15 people (47%) found this review helpful","47","7","15","0","0"
"http://steamcommunity.com/id/SubJaeger/recommended/303590/","SubJaeger","SubJaeger","http://steamcommunity.com/id/SubJaeger/","802 products in account",":D","September 27, 2015","true","3.3"," 1 of 3 people (33%) found this review helpful","33","1","3","0","0"
"http://steamcommunity.com/id/latvietis/recommended/303590/","latvietis","Jim Moriarty","http://steamcommunity.com/id/latvietis/","544 products in account","A great party game","September 5, 2015","true","9.4"," 1 of 3 people (33%) found this review helpful","33","1","3","0","0"
"http://steamcommunity.com/profiles/76561198073100011/recommended/303590/","76561198073100011","Riuzakie","http://steamcommunity.com/profiles/76561198073100011/","18 products in account","Lauched the first time great. Everytime after that, insta-crash. 0-10. Would like to play again. Can't. ♥♥♥♥ this.","February 26","false","2.5"," 1 of 3 people (33%) found this review helpful","33","1","3","0","0"
"http://steamcommunity.com/profiles/76561198065442202/recommended/303590/","76561198065442202","Derrek_Gillbert2","http://steamcommunity.com/profiles/76561198065442202/","29 products in account","Snitale wagon is my fav game in all new orleans becasue it smells of cheese and whiskers. My fav moment was when the dingle bats at my cheese and then i wrestled him in a wwe boxing ring and pined him for a one count and won. If this game was, however, about to kidnap my family and eat their cheese, i would not be in any hurry to play this game is i would turn into cheese man and rescue the cheese from this dreaded villain and possible kill him with a shoe horn. Also i would continue this reveiw but i have to use the toilet to save new orleans from the rat cheif and get epic loot and save cheeseton. so see you later.","January 4, 2015","true","0.4"," 2 of 7 people (29%) found this review helpful","29","2","7","0","0"
"http://steamcommunity.com/profiles/76561198025703922/recommended/303590/","76561198025703922","jebus2004","http://steamcommunity.com/profiles/76561198025703922/","149 products in account","Buy it","November 7, 2014","true","2.5"," 3 of 12 people (25%) found this review helpful 4 people found this review funny","25","3","12","4","0"
"http://steamcommunity.com/id/iamthegodofthegods/recommended/303590/","iamthegodofthegods","maskedman381","http://steamcommunity.com/id/iamthegodofthegods/","377 products in account","Unplayable without XBOX official controller.\n\nIncredible game. You should pay up to $100 for this game.","November 23, 2014","true","3.6"," 2 of 10 people (20%) found this review helpful","20","2","10","0","0"
"http://steamcommunity.com/id/steric400/recommended/303590/","steric400","Ryan Dorkoski","http://steamcommunity.com/id/steric400/","767 products in account","Played this game with four friends with controllers last night. The concept behind this game is certainly cool, but core gameplay needs more work. While there are many game modes, the game boils down to some portion of friends are trying to blend in with the computer controlled characters, and the other friends are trying to pick the humans out. Usually picking them out is controlling a cross-hair and having only 3 bullets to do so. The main problem is that picking out the humans is almost random - for most modes there is no easy mechanism to tell who your friends are. When we put this to the test with four friends last night, we got bored because of the randomness - it is surprisingly easy to act like a computer-driven character.\n\nPros:\n+There are different modes of gameplay that are fairly distinct\n+Controller support is good, and there are great ways to 'swap' roles each round\n+Its cheap\n\nCons:\n-The game modes and core design need to be worked out more, some way to make it more competitive\n-Graphics look stock from some game-building program - there is no unifying theme (i.e. skeletons, ninjas, snowmen, and then hand-drawn images etc.)\n-Local co-op only, although this would not be fun online\n\nWhen it comes to local co-op, I'd steer away from this one.","August 22, 2015","false","0.6"," 7 of 27 people (26%) found this review helpful 2 people found this review funny","26","7","27","2","5"
"http://steamcommunity.com/id/daronhume/recommended/303590/","daronhume","daron","http://steamcommunity.com/id/daronhume/","176 products in account","It's like Spy Party but you can play it.","December 20, 2014","true","5.1"," No ratings yet","0","0","0","0","0"
"http://steamcommunity.com/profiles/76561197963588013/recommended/303590/","76561197963588013","Ushiri Arrowhell","http://steamcommunity.com/profiles/76561197963588013/","143 products in account","I found it very fun...some where not so fun..like Knights assassins, but you can just adjust it with the tons of settings for each minigame.. It was a blast..and still is.. Its lots of fun and " I killed your sorry ♥♥♥ ! " feeling over it.\nReally recommend it if u got for controllers to your pc.","December 22, 2014","true","14.7"," No ratings yet","0","0","0","0","0"
"http://steamcommunity.com/id/wqfcewafewafewafaw/recommended/303590/","wqfcewafewafewafaw","VAC 1 - 0 ME","http://steamcommunity.com/id/wqfcewafewafewafaw/","32 products in account","The simplicity of the game is what makes it so unique and fun! It's a perfect party game to play with up to 4 friends.","January 12, 2015","true","0.2"," No ratings yet","0","0","0","0","0"
"http://steamcommunity.com/profiles/76561197970186150/recommended/303590/","76561197970186150","Major Konig","http://steamcommunity.com/profiles/76561197970186150/","1178 products in account","Okay I don't usually write a review but OMG best party game ever!! I'm not kidding, this game plus You don't know jack, Samurai Gunn and nidhog are the ultimate party pack games.  but this one honestly is fun as hell and super cost effective.","January 27, 2015","true","6.4"," No ratings yet","0","0","0","0","0"
"http://steamcommunity.com/profiles/76561198009840867/recommended/303590/","76561198009840867","Rock Lobster","http://steamcommunity.com/profiles/76561198009840867/","129 products in account","Great game to play with friends. Lots of game settings can be adjusted to make things more interesting. Only issue is a little balance issues in some game modes. Highly Recommended","January 1, 2015","true","5.5"," No ratings yet","0","0","0","0","0"
"http://steamcommunity.com/id/LiTaiLe/recommended/303590/","LiTaiLe","samort14","http://steamcommunity.com/id/LiTaiLe/","477 products in account","This is an AMAZING party game! I love it! Play local co-op with your friends and have a blast!!!","May 12, 2015","true","2.8"," No ratings yet","0","0","0","0","0"
"http://steamcommunity.com/id/peatymasta/recommended/303590/","peatymasta","peatymasta","http://steamcommunity.com/id/peatymasta/","48 products in account","Absolutely fantastic game. The PC platform often gets flak for less support for couch-coop or party games, but this game breaks the mold completely. Several fun game modes, a totally unique way of having a competitive game without the problem of screen sharing. Prepare for a lot of tense moments between friends, full of swearing, punching, and disowning  family members.","May 19, 2015","true","7.3"," No ratings yet","0","0","0","0","0"
"http://steamcommunity.com/id/Pathat/recommended/303590/","Pathat","Overly Ordained Toast","http://steamcommunity.com/id/Pathat/","261 products in account","Very very fun","February 22, 2015","true","3.1"," No ratings yet","0","0","0","0","0"
