"url","reviewerUsername","reviewerDisplayName","reviewerUrl","reviewerProductsCount","reviewText","date","recommended","hoursPlayed","voteText","helpfulPercent","votesHelpful","votesTotal","votesFunny","commentsCount"
"http://steamcommunity.com/id/hisoandso/recommended/315430/","hisoandso","hisoandso","http://steamcommunity.com/id/hisoandso/","67 products in account","After 100% completing the single-player campaign (including the bonus levels) I do not recommend this game and here's why.\n\n-The puzzle designs are lazy and linear. I wouldn't even classify them as puzzles as they don't really get you thinking.\n-Even though the main mechanic of the game is that you can change your polarity, you suprisngly don't use it that often.\nNot as often as you should. It felt like most of the puzzles used the cubes more than the core mechanic, and that got\nboring fast.\n-Cubes. The physics weren't the best and elevators were the worst. Rising platforms (Elevators) would have a circle pad\nin the middle to put a cube on to raise the platform. However if you fell off the platform you could not get the cube\noff, so you'd have to go back to the beginning and reset the cube back to it's orginal position, and like I said before\nsince the puzzles revolved around them you would have to do whole entire levels again just because you fell.\n-At first I thought the data crytals were supposed to be secret, optional objects you would find in levels. But the hiding\nplaces are so stupid. On one level there's a data crytal in a corner not being blocked by anything, just out in the open.\nAnother level has two of them next to each other. Because of how poorly they are hidden and that the last level requires\nyou to find all of them, I don't think they are optional.\n-The story doesn't make sense. You're a hacker hired by a hacking company. What does that have to do with puzzles?\nDoes the game take place in a computer? It doesn't explain.\n-At the beginning they explain some of the mechanics but later on whenever they introduce a new object they don't\nbother explaining what it does. So good luck trying to find out what to do with a green laser field or a circle ramp.\n-If you thought Portal 1 was short, wait till you play this. I beat all the levels and got all the data\ncrystals in less than 2 hours.\n\nAnd it's sad because the game had so much potenial. The graphics were nice and the polarity mechanic was promising.\nReally, all I have to say about this game is that it is lazy. I give it a 4/10.\n\nIf you still want to get the game after reading my review, wait for it to go on sale.","October 9, 2015","false","1.6"," 2 of 3 people (67%) found this review helpful","67","2","3","0","1"
"http://steamcommunity.com/id/starobeliskz/recommended/315430/","starobeliskz","StarObeliSkZ","http://steamcommunity.com/id/starobeliskz/","18 products in account","i thought it said this game had multiplayer?","October 31, 2015","false","3.0"," 2 of 3 people (67%) found this review helpful","67","2","3","0","0"
"http://steamcommunity.com/id/HexieLambent/recommended/315430/","HexieLambent","Hexie Lambent","http://steamcommunity.com/id/HexieLambent/","899 products in account","There are 3 major factors that keep me from giving this an upvote.\n1)  Relating themselves to or even mentioning Portal in the official description.\n2)  It is 11 dollars.\n3)  This smidgeon of text right here: http://steamcommunity.com/sharedfiles/filedetails/?id=550371588\n\nIf those three things were fixed, I could halfheartedly recommend this as a shallow, brainless diversion for about an hour.  I respect it might have been developed on a low budget, as it VERY heavily presents that fact with its... everything, really.  Sound effects, music, menu, level design, gameplay, all rather amateur.\n\nI used very rudimentary gaming skills and logic to very quickly clear the main campaign, and the bonus levels did not interest me.  Again, that's fine, but riding on the coattails of Portal WITHOUT EVEN HAVING PORTALS IN YOUR GAME while charging what I believe to be more than double the fair asking price and then being cheeky about "fooling" people with screenshots... leaves a very sour taste in my mouth.\n\nAll things considered, I bought this a while back for 19 cents, thankfully.","November 8, 2015","false","1.1"," 2 of 3 people (67%) found this review helpful 1 person found this review funny","67","2","3","0","1"
"http://steamcommunity.com/id/kpjoshi/recommended/315430/","kpjoshi","Mandelbrot","http://steamcommunity.com/id/kpjoshi/","31 products in account","Very short game. Buy when on sale only. Otherwise quite fun.","November 14, 2015","false","1.6"," 2 of 3 people (67%) found this review helpful","67","2","3","0","0"
"http://steamcommunity.com/id/ILiekVudka/recommended/315430/","ILiekVudka","Cripple","http://steamcommunity.com/id/ILiekVudka/","124 products in account","Not a bad game, too short, easy (all maps in 1-2 mins) and remembers me to Portal. It's like a bit worse copy to Portal 1 but I have enjoyed it.","May 14, 2015","true","0.8"," 2 of 3 people (67%) found this review helpful","67","2","3","0","0"
"http://steamcommunity.com/id/claytonzero/recommended/315430/","claytonzero","ClaytonZero","http://steamcommunity.com/id/claytonzero/","10 products in account","not bad","May 7, 2015","true","0.4"," 2 of 3 people (67%) found this review helpful 2 people found this review funny","67","2","3","2","0"
"http://steamcommunity.com/id/LoLLipopss/recommended/315430/","LoLLipopss","drop class database","http://steamcommunity.com/id/LoLLipopss/","35 products in account","Really great game and fun puzzle.\n\nBut my friend lives far away and it would be great to have online co-op instead of just local co-op\n\nOverall, this game is worth buying 10/10","June 15, 2015","true","2.7"," 2 of 3 people (67%) found this review helpful","67","2","3","0","0"
"http://steamcommunity.com/id/TREX_STEAK/recommended/315430/","TREX_STEAK","Trex_Steak","http://steamcommunity.com/id/TREX_STEAK/","331 products in account","nice game","June 19, 2015","true","0.1"," 2 of 3 people (67%) found this review helpful","67","2","3","0","0"
"http://steamcommunity.com/id/HedgehogMikey/recommended/315430/","HedgehogMikey","Shooty The Scooty","http://steamcommunity.com/id/HedgehogMikey/","42 products in account","10/10\n\ni really enjoyed the puzzles\n\nthey were challenging\nand engaging.\nplay this game if you want to take a nap\ngreat game.\nthe vs mode was revolutionary and changed the outlook i had on basketball forever.\nthank you blue butt games for this experience.\nthis game is well worth the 21 cents i paid for it\nactually i might rather buy 1/5 of a burger\ndoot doot\nhey am i asleep\ni am dead","November 13, 2015","false","0.9"," 2 of 3 people (67%) found this review helpful 2 people found this review funny","67","2","3","2","0"
"http://steamcommunity.com/profiles/76561198011965365/recommended/315430/","76561198011965365","Saint Aaron","http://steamcommunity.com/profiles/76561198011965365/","804 products in account","Nice game. The puzzles are great and it took me a while to get pass all of them. Brilliantly constructed game.\n\nPros\n-Pretty challenging, but relaxing puzzles for a cheap price\n-Gorgeous graphics (what pc games should have)\n-Cheap steam trading card sets\n-Simple to understand\n-Beautiful level design\n-A "thank you for playing the game" message after you finish the game\n-Co-op mode\n\nCons\n-Short playability\n-You can finish the main levels only in a matter of hours if you've already played portal","February 23","true","4.1"," 2 of 3 people (67%) found this review helpful","67","2","3","0","0"
"http://steamcommunity.com/profiles/76561198073600298/recommended/315430/","76561198073600298","Legacy","http://steamcommunity.com/profiles/76561198073600298/","89 products in account","Inspired by Portal with its own unique twists.\n\nPolarity is like Portal, but with hidden data around each level for you to find, some simple and others are a lot more tricky. The gameplay has its own unique take on the whole orange portal blue portal. You have red and blue, for negative and positive. You must use them in certain ways to progress maps and not die. Its simple gameplay and can be interesting if your lookin for more casual gameplay.\n\nNo campaign or story, so if you care about that this game isn't for you.\n\nThe game has bonus levels for when your done the main stages. They add some more difficulty and more mechanics to deal with.\n\nThe full game can be completed in around 6 hours, more if your going for the full completion. I personally wouldn't spend 5$ on this game, but if you wait for a sale you can get it for 0.50$. Now thats worth.\n\nPersonal Rating 2/5","February 24","true","2.2"," 2 of 3 people (67%) found this review helpful","67","2","3","0","0"
"http://steamcommunity.com/id/BallagePaul/recommended/315430/","BallagePaul","B a l l a g e","http://steamcommunity.com/id/BallagePaul/","262 products in account","This game is good, but infortunatelly this game is very expensive but you can buy it when this game have a good deal because then it is cheap.\nFun this game when you play with it.\nAnd the achievements are good.","November 14, 2015","true","1.4"," 2 of 3 people (67%) found this review helpful 2 people found this review funny","67","2","3","2","0"
"http://steamcommunity.com/id/TheAboy244/recommended/315430/","TheAboy244","TheAboy244","http://steamcommunity.com/id/TheAboy244/","145 products in account","This game is actually fantastic. I bought it on sale intending to challenge it's self proclaimed brilliance as "The best puzzle game since Portal" After having completed the game I can say that while not as good as any of the Portal games Polarity's clever puzzles and addictive collectables kept my interest. It even has a local co-op mode with more puzzles which were fantastic. The only part of the game where I would say it lacked quality was the story in that it doesn't really exist and when it is there it seems kind of cheesy and out of place. There is also a competitive multiplayer mode that is not worth playing at all, but its inclusion did not hurt the game in my eyes. If you are looking for a brilliantly clever puzzle platformer in the vein of games like portal then look no further. It is absolutely worth the price.","February 26","true","3.9"," 2 of 3 people (67%) found this review helpful","67","2","3","0","1"
"http://steamcommunity.com/profiles/76561197987843932/recommended/315430/","76561197987843932","spessu_sb","http://steamcommunity.com/profiles/76561197987843932/","147 products in account","Dumbed down version of portal. It works as quick way to pass time to complete this but it's not any game a serious puzzle game fan would truly enjoy. Then again the reason for positive review is it's cheap price. You can get it at sales for just even only cents, like how i did..","July 23, 2015","true","0.9"," 2 of 3 people (67%) found this review helpful","67","2","3","0","0"
"http://steamcommunity.com/id/AceAlabama/recommended/315430/","AceAlabama","[PCMR] Ace Alabama","http://steamcommunity.com/id/AceAlabama/","301 products in account","Portal with no portals. Just the cubes. Well worth $0.21.","May 10, 2015","true","5.0"," 2 of 3 people (67%) found this review helpful 1 person found this review funny","67","2","3","0","0"
"http://steamcommunity.com/id/ghoulsushi/recommended/315430/","ghoulsushi","dusty","http://steamcommunity.com/id/ghoulsushi/","44 products in account","mULTIPLAYER HUH","March 19","false","0.1"," 2 of 3 people (67%) found this review helpful 1 person found this review funny","67","2","3","0","1"
"http://steamcommunity.com/profiles/76561198144954557/recommended/315430/","76561198144954557","vankor | TFS","http://steamcommunity.com/profiles/76561198144954557/","68 products in account","Don't buy it, it's a bad game","May 22","false","1.3"," 2 of 3 people (67%) found this review helpful","67","2","3","0","0"
"http://steamcommunity.com/profiles/76561198218765795/recommended/315430/","76561198218765795","JoseGamer102","http://steamcommunity.com/profiles/76561198218765795/","15 products in account","can i share this game with my friends?\n","May 7","true","1.0"," 2 of 3 people (67%) found this review helpful 1 person found this review funny","67","2","3","0","1"
"http://steamcommunity.com/id/xcava86x/recommended/315430/","xcava86x","xcava86x","http://steamcommunity.com/id/xcava86x/","724 products in account","-no 16:10 resolutions, only 16:9\n-bringing up the steam overlay leaves traces of it in the black bars when you close it\n-controls are displayed as xbox buttons\n-the graphic is very outdated\n-the levels are few and there is no reason to go through them again once you have completed them, except if you want speedrun them\n-the versus mode (split screen) mode can offer fun local coop times\n-the sounds and the music are in no way remarkable\n\ngood for 5 bucks","May 31","false","3.1"," 2 of 3 people (67%) found this review helpful","67","2","3","0","0"
"http://steamcommunity.com/id/brokenstitch/recommended/315430/","brokenstitch","brokenstitch","http://steamcommunity.com/id/brokenstitch/","399 products in account","This game is great. No matter what anyone else says, you can complet it 100% by yourself. Granted it's a bit of a challenge when playing co-op solo, I managed to do it; So...you should be able to do it too.","May 15","true","5.8"," 2 of 3 people (67%) found this review helpful","67","2","3","0","0"
"http://steamcommunity.com/profiles/76561198000878346/recommended/315430/","76561198000878346","leemur","http://steamcommunity.com/profiles/76561198000878346/","541 products in account","The game is currently 20 cents. If you can't get 20 cents worth of fun out of this game, you either soulless or braindead.\n\nIt's short enough that I wouldn't bother writing this up if the game was full price, but at this price, buy it.","May 9, 2015","true","2.3"," 3 of 5 people (60%) found this review helpful 1 person found this review funny","60","3","5","0","0"
"http://steamcommunity.com/id/TheFlashFabio/recommended/315430/","TheFlashFabio","Flash","http://steamcommunity.com/id/TheFlashFabio/","411 products in account","Best 19 cents I ever spent, by far.","May 6, 2015","true","3.0"," 3 of 5 people (60%) found this review helpful 1 person found this review funny","60","3","5","0","0"
"http://steamcommunity.com/profiles/76561198084307939/recommended/315430/","76561198084307939","Mega Munchy","http://steamcommunity.com/profiles/76561198084307939/","35 products in account","I hate to be the barren of reviewing games i've played but I was expecting more out of this game. When I first saw this on Greenlight, I thought this could be the perfect alternative towards Portal & QUBE (because they don't work on my current laptop) but then I heard that this game was discounted at 96%! Hearing that must of made the game sound really bad but I ignored it. I read the description of Polarity, claiming that it's the most fun Puzzle game since Portal (I even saw a comment on the greenlight page that the dev(s) don't even know what Portal was). Gameplay was just too simple & it lasted only for an hour on my side, the first time playing Portal brought so much confusion that it was thrilling, this game just wanted me to go to sleep. I also looked around the levels set up & I saw so many flaws that it looked like it was rushed from development just to gain revenue. The worst part about it is that it has no decent story, Portal's story was so fasinating that I want to find out more about its connections with Half-Life 2, Polarity states that your a hacker thats trying to access a virtual vault when these levels don't look anything like a firewall. In conclusion, If you want a better puzzle game at a cheap price, Get something that was made perfectly & looks challenging (even if it has mixed ratings). All that it can be used now is to haul trading cards & allowing a short sleep mode onto yourself.","June 10, 2015","false","2.1"," 3 of 5 people (60%) found this review helpful","60","3","5","0","1"
"http://steamcommunity.com/id/astral_cyborg/recommended/315430/","astral_cyborg","Ⓞⓡⓔⓢⓣⓔⓢ","http://steamcommunity.com/id/astral_cyborg/","819 products in account","Relaxing game. It reminds me of Portal and Q-beh.","January 16","true","11.9"," 3 of 5 people (60%) found this review helpful","60","3","5","0","0"
"http://steamcommunity.com/id/uwontsumfuk/recommended/315430/","uwontsumfuk","Thomas Jarvis","http://steamcommunity.com/id/uwontsumfuk/","79 products in account","its like the fit gf you dont have and will never have, if you spend more than 5 minutes with it without puting your ♥♥♥♥♥ inside it you will kill yourself\n\nGr8 b8, m8. I rel8, str8 appreci8, and congratul8. I r8 this b8 an 8/8. Plz no h8, I'm str8 ir8. Cr8 more, can't w8. We should convers8, I won't ber8, my number is 8888888, ask for N8. No calls l8 or out of st8. If on a d8, ask K8 to loc8. Even with a full pl8, I always have time to communic8 so don't hesit8.\n\n8/8 -IPN\n\n\n\n\n\n\n\n\nm8 im gona fell8 ur nans prost8","May 7, 2015","true","0.1"," 3 of 5 people (60%) found this review helpful 3 people found this review funny","60","3","5","3","1"
"http://steamcommunity.com/id/snakesyafilthyanimal/recommended/315430/","snakesyafilthyanimal","Why Did It Have to be Snakes?","http://steamcommunity.com/id/snakesyafilthyanimal/","185 products in account","Minimalistic Portal imitation - this time it's just basic color-swapping puzzles without challenging the player to think that much. On one hand, it's well-presented and kinda-sorta interesting. On the other hand, this has been done better elsewhere. Too short and far too easy to be worth the price tag - only worth it for a buck (cash-money US $$$ for those unfamiliar with the colloquialism) or two at best.","August 30, 2015","false","1.0"," 3 of 5 people (60%) found this review helpful","60","3","5","0","0"
"http://steamcommunity.com/id/Faeja/recommended/315430/","Faeja","Fae","http://steamcommunity.com/id/Faeja/","357 products in account","I completed the single player game (bonus levels included) very quickly, getting all possible single player achievements along the way. Almost the entire time I was wondering when it would get harder. It never did. I never had to think too hard to solve the rooms, or look in obscure corners to get the data fragments. When I finished the game I was left feeling like it had never really gotten started.\n\nIf you’re after an easy, relaxing puzzler that won’t take all day or require a lot of thought, this is very much for you. I would suggest waiting for it to be on sale (I got it for $0.19, and I can’t express how glad I am I didn’t pay $5 for it).\n\nThe game itself looks decent enough. There are little issues here and there, like some minor Z-fighting in spots, and in one level there is a doorway you have to jump through because you get stuck on the lip of the floor otherwise. Nothing game breaking though.\n\nUnfortunately I don’t have any friends with this game, so I can’t say anything about the co-op side of it. Overall it’s an okay game, it’s just not one I’ll be recommending to people unless they want a really simple and short puzzler.","August 31, 2015","false","1.3"," 3 of 5 people (60%) found this review helpful","60","3","5","0","0"
"http://steamcommunity.com/id/WrongSizeMofo/recommended/315430/","WrongSizeMofo","Pinacho","http://steamcommunity.com/id/WrongSizeMofo/","254 products in account","This is a rather interesting puzzle game and a must-have for fans of the genre, where you get hired by a hacking company to solve a bunch of puzzles and infiltrate a system to obtain some pieces of data, needless to say that the story is trivial but that's normally expected from a puzzle game.\nThe puzzles are mildly difficult and only get a bit tricky in Co-op mode.\n\nIn general, the game's visuals need a bit of polishing alongside some adjustments to the physics involving the player's movement, in addition to that, I had to restart a level from the beginning after dying on the edge of the level because I kept respawning outside of the level.\nAnd not forgetting that this game's store page has a Multiplayer tag when it actually only supports Singleplayer and Co-op modes. So, adding a Multiplayer feature would be great instead of just having the tag...\n\nBut regardless of its flaws and after completing the game, I'd surely recommend it while hoping that the dev/devs will release some updates to both fix the issues mentioned above and to probably add more content to this nice game.\n","January 8","true","4.8"," 3 of 5 people (60%) found this review helpful","60","3","5","0","0"
"http://steamcommunity.com/id/LordMerek/recommended/315430/","LordMerek","Merek","http://steamcommunity.com/id/LordMerek/","55 products in account","Polarity is garbage. I can't emphasize that enough. I played about 2 hours of the game and never made it past the first level. Here's my breakdown of the game:\n\nPros\n+ Polarity has decent graphics\n\nCons\n- Game Levels feel identical\n- No actual 'Multiplayer' exists (Players must use the same computer to play together)\n- Everything else\n\nMy Rating: 2/10 (Not Recommended)","November 11, 2015","false","2.2"," 3 of 5 people (60%) found this review helpful 2 people found this review funny","60","3","5","2","4"
"http://steamcommunity.com/profiles/76561198208733267/recommended/315430/","76561198208733267","♿MR.hated♿","http://steamcommunity.com/profiles/76561198208733267/","13 products in account","two words\nITS FUN\nbuy it\nbut\nits short\nbut\nthrere is co-op levels that make it less short\nbut\nthrere is extra level that make it mediem short\nbut i have to say\n7/10","May 4","true","1.2"," 3 of 5 people (60%) found this review helpful 1 person found this review funny","60","3","5","0","0"
"http://steamcommunity.com/id/ggg666/recommended/315430/","ggg666","GhostsheLL","http://steamcommunity.com/id/ggg666/","156 products in account","Product received for free\n\nThis is a great puzzler; I would say similar to Portal.\n+Good mechanics\n+Fun game play\n+Controller Support\n+Great local co-op!\n\n*This game is currently free if you purchase Revolution Ace for 50 cents.","May 12","true","2.1"," 3 of 5 people (60%) found this review helpful","60","3","5","0","1"
"http://steamcommunity.com/id/jonis221/recommended/315430/","jonis221","Jonis221","http://steamcommunity.com/id/jonis221/","225 products in account","Amazing puzzle game (should to play)","May 16","true","4.6"," 3 of 5 people (60%) found this review helpful 1 person found this review funny","60","3","5","0","0"
"http://steamcommunity.com/profiles/76561198139257259/recommended/315430/","76561198139257259","Sunflower Overlord","http://steamcommunity.com/profiles/76561198139257259/","84 products in account","Bunny Hop Simulator","May 7, 2015","true","0.8"," 4 of 7 people (57%) found this review helpful","57","4","7","0","1"
"http://steamcommunity.com/id/Xandod/recommended/315430/","Xandod","Xandod","http://steamcommunity.com/id/Xandod/","316 products in account","I got it for 0.19 Cents 100% worth it its a pretty tricky game and a bit short but really fun if you are thinking of getting it get it!!!!!!!   10/10","May 4, 2015","true","1.4"," 4 of 7 people (57%) found this review helpful","57","4","7","0","0"
"http://steamcommunity.com/id/a1studmuffin/recommended/315430/","a1studmuffin","a1studmuffin","http://steamcommunity.com/id/a1studmuffin/","479 products in account","This looks like a game with potential, but as it stands I found it pretty unplayable. Jumping simply doesn't work 80% of the time (you hear the jump noise but don't move), which is incredibly frustrating given this is a puzzle platformer. Gamepad sensitivity is also insanely high by default (although this can be turned down in the options thankfully - I had to set it to 0.1 to be usable). Gamepad button prompts are just missing entirely from some tutorial popups. The camera clips as you approach walls in co-op. If these bugs were addressed (and none of them seem like challenging issues) it would be a much more polished experience. I'm happy to change my recommendation if they're fixed in a patch.","June 12, 2015","false","0.3"," 4 of 7 people (57%) found this review helpful","57","4","7","0","0"
"http://steamcommunity.com/id/mythicalgametv/recommended/315430/","mythicalgametv","Joseph Hartness","http://steamcommunity.com/id/mythicalgametv/","88 products in account","Its like minecraft and portal if they had a baby. Sure its fun but i wouldnt recommend if you want to see controller buttons every where when you start the game. 6/10 ~ MythicalGameTv","November 17, 2015","false","1.4"," 4 of 7 people (57%) found this review helpful 3 people found this review funny","57","4","7","3","2"
"http://steamcommunity.com/id/wiismash/recommended/315430/","wiismash","WiiSmash","http://steamcommunity.com/id/wiismash/","255 products in account","No LAN or Online Coop. 0/10","June 19, 2015","false","7.6"," 6 of 11 people (55%) found this review helpful","55","6","11","0","0"
"http://steamcommunity.com/id/dota2fan/recommended/315430/","dota2fan","Aryan Clover","http://steamcommunity.com/id/dota2fan/","40 products in account","Step 1: Buy game on sale for $0.18\nStep 2: Run game in background and collect free trading cards\nStep 3: List trading cards on the Steam Community Market\nStep 4: ?????\nStep 5: PROFIT!!!","May 5, 2015","true","0.8"," 6 of 11 people (55%) found this review helpful 7 people found this review funny","55","6","11","7","0"
"http://steamcommunity.com/id/yaya14/recommended/315430/","yaya14","yaya14","http://steamcommunity.com/id/yaya14/","446 products in account","fun to play and worth to buy it","May 5, 2015","true","1.8"," 8 of 15 people (53%) found this review helpful","53","8","15","0","0"
