"url","reviewerUsername","reviewerDisplayName","reviewerUrl","reviewerProductsCount","reviewText","date","recommended","hoursPlayed","voteText","helpfulPercent","votesHelpful","votesTotal","votesFunny","commentsCount"
"http://steamcommunity.com/id/FFRedRam/recommended/315430/","FFRedRam","[xG] -[FF]- Red Ram (赤い羊)","http://steamcommunity.com/id/FFRedRam/","87 products in account","Polarity in a sentence: Polarity is a first-person puzzle/platforming game where you, well, solve puzzle and... yeah.\nThat was Polarity in a sentence (And a half, I guess). Now, it's time for the real review.\n\nBasic Info:\nPolarity, greatly inspired by Portal, is a first-person puzzle platformer. You can play singleplayer or multiplayer. Either way, they're the same kind of puzzles.\n\nList of Basic Uses:\n-Cubes: Used to activate switches, platforms, laser walls, etc.\n\n-Polarity: You switch your Polarity (Your color, some say) to jump onto colored platforms, or to get through a laser gate without dying.\n\n-Gold Lasers, A.K.A. Color Changing Lasers: These are lasers that you can throw cubes into to change their color from either red to blue, or blue to red.\n\n-Data: These are collected to unlock more levels throughout the game and eventually unlock the bonus stages. There are three per level.\n\nOther Notes:\nThis game is completly Xbox 360 controller compatible without any configuration needed. There is also a split-screen multiplayer that has its own campaign.\n\nStory:\nHonestly, Polarity doesn't really have a story at all. However, you can peice together a basic story from what you're told.\nYou're a hacker trying to break into one of the greatest firewalls in the world, trying to collect data so you get your reward that was promised to you by an unknown person/thing - 10,000,000 Credits.\n\nGameplay:\nPolarity has you jumping from platform to platform, switching your Polarity (Or, some may call, your color) and carrying and throwing cubes everywhere. What I'm trying to say is that you may have to get through a  red  laser gate, so you have to switch your polarity (Which, by default at the begining of every level, is blue) to, obviously, red. That's different with platforms, however. With platforms, you must switch to the  opposite  color to get across, which leads to switching polarity in mid-air. What I'm trying to say is that your Polarity and ablility to work with cubes is all you need to beat the levels.\n\nPolarity has 14 levels in singleplayer that are not too tough at all, but can actually be a bit fustrating for reasons such as "Crap, put the cube in the wrong spot - Oh, there it goes. Bye cube. Just gotta run back to the other side of the map again to get a new one..." Most of the levels are short, but every now and then, you'll notice repeating concepts in the levels. For exaple, you may have just completed a level where you had to through cubes into switches and now, you're throwing cubes into color changing lasers and then putting them in switches. May not  sound  similar, but once you play, you'll know what I mean. That, however, is not too much of an issue.\n\nUpon getting every Data Crystal in the singleplayer campaign, you unlock the 10 bonus levels. These levels are just  barely  harder then the normal campaign, which is easy once you get the hang of how things work.\n\nDifficulty... That's an issue. This game isn't hard by all means. It's just fustrating. Like in my example above, you can easily throw your cube the wrong way or just barely miss the button for it and *POOF*! It's gone. You'll have to go back and get a new one. Anyways, back to difficulty - It's too easy, in my opinion, to be a puzzle game. WAY too easy. The Data Crystals aren't even cleverly hidden at all. You can easily get all of those. You'll also find yourself breezing through this game. For example, if you have even the slightest bit of knowledge as to what you're doing, you can get through levels in 1-2 minutes each. The singleplayer campaign (Bonus levels included) may only take you about an hour and a half. That's how short and quick this game is.\n\nAh, multiplayer... I can't say that I LOVE it, but I like it. You and your buddy are robots (Sound familiar much?) and you must work together to solve puzzles similar to the normal puzzles, except this time, it's even harder. This time I mean it. It's not "I GIVE UP!" hard, it's just... Up there, I guess you could say. The Data Crystals can easily be passed without even knowing it, and they're hidden in better spots and actually take you a minute to get them. I would have to say that the multiplayer is better than the singleplayer just because you have a friend with you and you both get to slove the puzzles together.\n\nConclusion:\nThis is a first-person puzzle game that's highly inspired by Portal. Sure, it's not always fair, but it comes through for sure. I would just get this game while it's on sale, as you'll be glad that you didn't waste $5.00 on this. I'm not saying that this is a bad game, it's just I don't see it being worth $5.00. Not everyone looking for a good puzzle game will be satisfied fully, but I still love this game.\n\nTo conclude this review, I give Polarity a 7/10. It could be better, and it wouldn't be that hard.","June 13, 2015","true","4.5"," 1 person found this review helpful","0","1","1","0","0"
"http://steamcommunity.com/id/I_keeel_U/recommended/315430/","I_keeel_U","HappyClown","http://steamcommunity.com/id/I_keeel_U/","1081 products in account","Pros -\n\n*EXCELLENT PRICE!\n*Clever level design\n*Neat atmosphere\n*Nice shaders\n*Multiplayer\n*Unity game engine so it will probably work on your system!\n\nCONS -\n* Textures are sort of bland and uninteresting.\n* Needs more "outside" ambiance like Portal's GLADOS voice. You really feel all alone.\n*No real explanation or meaning of the "polarity" thing.\n\nFor the price, forget the Cons, and just grab it and see yourself. It really is a decent little game.","June 14, 2015","true","1.2"," 1 person found this review helpful","0","1","1","0","0"
"http://steamcommunity.com/id/zenrain/recommended/315430/","zenrain","Zen Rain","http://steamcommunity.com/id/zenrain/","273 products in account","Do you like Portal? Do you like Ikaruga? Well those two had a baby, and Polarity is that beautiful child.\n\nIn case the trailer didn't give it away, this is a first-person puzzle game where you switch between "polarities" of red and blue to bypass obstacles. If you're the same color as some objects, you pass through. If you're the same color as a laser, it doesn't kill you. You take colored blocks and use them to activate switches and must gather three hidden data shards (glowing green ♥♥♥♥) each level in order to unlock the final one.\n\nI bought this at a ridiculous 96% off, thinking that if I played it for more than a minute I'd have gotten my money's worth. I've played for over an hour now and I'm done with only a small fraction of the content. Likely by the time I'm done with this, I'll have a solid four hours or so assuming I don't bully some people into playing the co-op stuff with me.\n\nThe best part is that outside of the first few levels, there's no handholding. "Oh, you get the mechanics? We can stop giving you the 'Everyone is teh Smart' puzzles now? Fine. Now we can actually make you work to use the game mechanics to solve our puzzles."\n\nBuy this game on sale. Hell, buy this game for full price. It's great,","June 14, 2015","true","1.1"," 1 person found this review helpful","0","1","1","0","0"
"http://steamcommunity.com/profiles/76561198155485743/recommended/315430/","76561198155485743","technojd123","http://steamcommunity.com/profiles/76561198155485743/","5 products in account","Great game for only 19 cents. Storyline is not very good, but hey, 19 cent game here. Very fun, a challenging puzzle, and great for multiplayer (with a handheld control for the second person).\n\n10/10","June 14, 2015","true","2.1"," 1 person found this review helpful","0","1","1","0","0"
"http://steamcommunity.com/profiles/76561198044829876/recommended/315430/","76561198044829876","dragatar42","http://steamcommunity.com/profiles/76561198044829876/","32 products in account","good game","June 14, 2015","true","1.0"," 1 person found this review helpful","0","1","1","0","0"
"http://steamcommunity.com/id/allhailthemidgetking/recommended/315430/","allhailthemidgetking","Midget_King","http://steamcommunity.com/id/allhailthemidgetking/","40 products in account","Best Game. You may rage quit if you can't solve a level.\n10/10","May 30, 2015","true","2.5"," 1 person found this review helpful","0","1","1","0","0"
"http://steamcommunity.com/id/sumemelord/recommended/315430/","sumemelord","SU MemeLord","http://steamcommunity.com/id/sumemelord/","108 products in account","Didn't expect to be a fun game, but is.\nRuns alright on my potato of a computer with an integrated graphics card.","May 26, 2015","true","0.8"," 1 person found this review helpful","0","1","1","0","0"
"http://steamcommunity.com/id/mysteriousman444/recommended/315430/","mysteriousman444","Tha_Mystery_Man","http://steamcommunity.com/id/mysteriousman444/","22 products in account","Basically a ♥♥♥♥♥♥ portal","November 23, 2015","true","1.3"," 1 person found this review helpful 1 person found this review funny","0","1","1","0","0"
"http://steamcommunity.com/id/randomurlatscamdotcom/recommended/315430/","randomurlatscamdotcom","For Years a Slav","http://steamcommunity.com/id/randomurlatscamdotcom/","17 products in account","The game is fun. Its like a poor mans version of portal. Its a great puzzle game.\nBut it doesn't have alot of levels and the tutorial doesnt explain everything.\nOverall this game was worth buying for 0.21 cents.","November 16, 2015","true","2.3"," 1 person found this review helpful 1 person found this review funny","0","1","1","0","0"
"http://steamcommunity.com/id/velickovic/recommended/315430/","velickovic","Cheeki Breeki Veleechki","http://steamcommunity.com/id/velickovic/","28 products in account","Sometimes i ask myself... What the ♥♥♥♥ Alex???","December 6, 2015","true","1.6"," 1 person found this review helpful 1 person found this review funny","0","1","1","0","0"
"http://steamcommunity.com/profiles/76561198091338934/recommended/315430/","76561198091338934","Handsome Jack","http://steamcommunity.com/profiles/76561198091338934/","53 products in account","This is incredible game! At least for this cents I spent to it.\n\nThis is First Person Platformer-puzzle. Just like portal, but without portalgun. Instead of it there's polarity of main character. Red to Red, Blue to Blue, so to say.\n\nAlso, read a Readme file in the game - you'll understand, why I like this game and developer team very much.\n\nWell, the only I can say: Buy it - make for a dev-team a hang-out!!!","August 23, 2015","true","2.7"," 1 person found this review helpful 1 person found this review funny","0","1","1","0","0"
"http://steamcommunity.com/profiles/76561198129366135/recommended/315430/","76561198129366135","harrygwilson","http://steamcommunity.com/profiles/76561198129366135/","26 products in account","Very short game, but with a good artstyle and game mechanics. For the amount I paid for it, it was worth it.","August 30, 2015","true","2.4"," 1 person found this review helpful","0","1","1","0","0"
"http://steamcommunity.com/id/edmy/recommended/315430/","edmy","messing with poop stick","http://steamcommunity.com/id/edmy/","5 products in account","i can't play p2 in co-op campaign with a pc\n\nGG","August 31, 2015","true","5.0"," 1 person found this review helpful","0","1","1","0","0"
"http://steamcommunity.com/id/ZoidbergsSon/recommended/315430/","ZoidbergsSon","[PT] Zoidberg's Son","http://steamcommunity.com/id/ZoidbergsSon/","40 products in account","This is a very good game!\nI highly recommend this game, it may be short but its good!\nI bought in a pack that is in sale but if i had to pay for the full price i wouldnt buy it, but still it is an awesome game","September 1, 2015","true","2.6"," 1 person found this review helpful","0","1","1","0","0"
"http://steamcommunity.com/id/Krokzter/recommended/315430/","Krokzter","Kroky","http://steamcommunity.com/id/Krokzter/","126 products in account","Awesome game, this is the game for you if you have played or like puzzle games of Portal 2 type.","September 1, 2015","true","3.2"," 1 person found this review helpful","0","1","1","0","0"
"http://steamcommunity.com/profiles/76561198156253279/recommended/315430/","76561198156253279","VAC BANNED","http://steamcommunity.com/profiles/76561198156253279/","23 products in account","very nice game but my brain hurts :d","September 1, 2015","true","1.3"," 1 person found this review helpful","0","1","1","0","0"
"http://steamcommunity.com/profiles/76561198048339433/recommended/315430/","76561198048339433","Lupita","http://steamcommunity.com/profiles/76561198048339433/","51 products in account","A good 2 hours of my life was spent on this game completing the single and co-op campain and I don't regret it :D","September 3, 2015","true","2.0"," 1 person found this review helpful","0","1","1","0","1"
"http://steamcommunity.com/profiles/76561198064378233/recommended/315430/","76561198064378233","Saurodocus","http://steamcommunity.com/profiles/76561198064378233/","476 products in account","+Fun puzzle game\n+No rage\n+Original puzzles\n\n-No online co-op\n-Too short\n-Very easy\nIt's a good game, but i wouldn't recommend it for the full price. 96% off now, so the 19 cents are worth the 2 hours of gameplay.","July 9, 2015","true","2.5"," 1 person found this review helpful","0","1","1","0","0"
"http://steamcommunity.com/profiles/76561198147168869/recommended/315430/","76561198147168869","Microphone","http://steamcommunity.com/profiles/76561198147168869/","30 products in account","Great game. A little glitchy but thats always fun :D","July 9, 2015","true","2.3"," 1 person found this review helpful","0","1","1","0","0"
"http://steamcommunity.com/id/JimKongUn/recommended/315430/","JimKongUn","Jim Kong Un","http://steamcommunity.com/id/JimKongUn/","50 products in account","Very fluid engine and polished graphics, even on the low settings. Seems to be built with speedrunning in mind which is awesome.","July 9, 2015","true","1.6"," 1 person found this review helpful","0","1","1","0","0"
"http://steamcommunity.com/id/docsev/recommended/315430/","docsev","Doc","http://steamcommunity.com/id/docsev/","148 products in account","It's short, really short. I mean, even if you want to get all the achievments, you just need about 3 hours.\nThe graphics are ok, and the puzzles aren't too hard, but they could have been.\nI played the singleplayer, the bonus levels and even the local coop. Yes, without any friends, yes, i played the coop alone, it's possible and it's damn easy.\nAt Bonus Level 7 i just glitched through the walls, so i thought, hummm, well, happy i don't need to do this in the right way.\n\nBut hey, it's .19 Pens, so just buy it, it`s great for that Price. You will be entertained for the three hours, or more, dunno.\nAnd don't buy the game, when it's not on sale 5 Bucks are way too much for this game, but thats just my opinion.","July 9, 2015","true","3.4"," 1 person found this review helpful","0","1","1","0","0"
"http://steamcommunity.com/profiles/76561198089268047/recommended/315430/","76561198089268047","Rubin Mehehaw","http://steamcommunity.com/profiles/76561198089268047/","128 products in account","For 19 Cents... Worth It I Guess\n","July 9, 2015","true","0.1"," 1 person found this review helpful","0","1","1","0","0"
"http://steamcommunity.com/id/Th3Ma3lstr0m/recommended/315430/","Th3Ma3lstr0m","Maelstrom","http://steamcommunity.com/id/Th3Ma3lstr0m/","26 products in account","Obligatory warning, I really liked this game, but there is way too little content to justify spending 5 bucks on it. Wait till there is a sale and it drops down to 19 cents. I bought this for 12 cents after using the spare change in my steam wallet, and it was totally worth it then. Anyways, lets get started on the pros and cons.\n\nPros:\n-Graphics look really nice for a game I picked up for 12 cents.\n-Audio, while repetitive at a few moments during the hour and a half singleplayer campaign, was nice and provided a nice atmosphere for the whole digital hacking heist theme.\n\nNot necessarily pro or con:\n-Many reviews mention Portal as what they were thinking of while they were playing. While it had a unique gameplay idea of polarity switching, it really could've used that mechanic way more than the Portal-esque cube on button style gameplay.\n\nCons:\n-SO SHORT! Even with the bonus levels, it only took me about an hour and a half, which is why I recommend it only if it's on sale.\n-Not much of a con, but it was really easy the whole way through. Really could've used a difficulty spike at points.\n\nOverall a 8/10 for a game on sale for 20 cents,\n","July 9, 2015","true","2.7"," 1 person found this review helpful","0","1","1","0","0"
"http://steamcommunity.com/id/jccreszMinecraft/recommended/315430/","jccreszMinecraft","jccreszMC","http://steamcommunity.com/id/jccreszMinecraft/","63 products in account","Decent game that happens to run on unity. I have a few complaints but overall it's nice. My biggest pet peeve on it though is lack of video settings. Can more games incorperate FOV like Minecraft?","July 9, 2015","true","1.1"," 1 person found this review helpful","0","1","1","0","0"
"http://steamcommunity.com/profiles/76561198153005202/recommended/315430/","76561198153005202","AlphaReaper","http://steamcommunity.com/profiles/76561198153005202/","16 products in account","hey can someone help me i played polarity and finished the campaign but i still don't get any polarity cards it says i can get 3 more drops but still got none","July 8, 2015","true","2.6"," 1 person found this review helpful","0","1","1","0","1"
"http://steamcommunity.com/profiles/76561198170177399/recommended/315430/","76561198170177399","Socks McRocks","http://steamcommunity.com/profiles/76561198170177399/","41 products in account","You should be able to create your own levels. but otherwise a fun game","July 8, 2015","true","1.8"," 1 person found this review helpful","0","1","1","0","0"
"http://steamcommunity.com/profiles/76561198109738460/recommended/315430/","76561198109738460","Stormfast","http://steamcommunity.com/profiles/76561198109738460/","11 products in account","The campaign and the bonus levels were great, the graphics were sub par, the puzzles were well thought out, and overall it's pretty fun. The horrible part is that, although it is advertised as multiplayer and local co-op, it is in fact only local co-op. This means that a part of the game was left untouched which is unsatisfying since I paid to enjoy the full game. A step forward for the developers would be an option for players to create their own levels and play with each other over the internet. Overall, good game but needs some fixing.","July 8, 2015","true","2.6"," 1 person found this review helpful","0","1","1","0","0"
"http://steamcommunity.com/id/hr_zug/recommended/315430/","hr_zug","zuGzwanG","http://steamcommunity.com/id/hr_zug/","78 products in account","I bought this game on sale, so taking that into consideration the game is a good choice. However I'd never buy it for its full price. The puzzles are much easier compared to similar games and I managed to complete it in less than 2 hours. Some levels are way too easy and obvious, but it's a fun casual game for when you have nothing to do.","June 21, 2015","true","1.7"," 1 person found this review helpful","0","1","1","0","0"
"http://steamcommunity.com/profiles/76561198080083682/recommended/315430/","76561198080083682","Catscha","http://steamcommunity.com/profiles/76561198080083682/","93 products in account","Portal 3...confirmed, thanks Gabe.","June 20, 2015","true","2.5"," 1 person found this review helpful","0","1","1","0","0"
"http://steamcommunity.com/profiles/76561198139948688/recommended/315430/","76561198139948688","Hex | Abberrancy","http://steamcommunity.com/profiles/76561198139948688/","6 products in account","Bought it for 19 cents.\nPlayed it.\nLoved it.\nPlan on playing more today.\n10/10\nBest Steam Summer Sale Deal Yet.","June 21, 2015","true","0.4"," 1 person found this review helpful","0","1","1","0","0"
"http://steamcommunity.com/profiles/76561198129366135/recommended/315430/","76561198129366135","harrygwilson","http://steamcommunity.com/profiles/76561198129366135/","26 products in account","Very short game, but with a good artstyle and game mechanics. For the amount I paid for it, it was worth it.","August 30, 2015","true","2.4"," 1 person found this review helpful","0","1","1","0","0"
"http://steamcommunity.com/id/edmy/recommended/315430/","edmy","messing with poop stick","http://steamcommunity.com/id/edmy/","5 products in account","i can't play p2 in co-op campaign with a pc\n\nGG","August 31, 2015","true","5.0"," 1 person found this review helpful","0","1","1","0","0"
"http://steamcommunity.com/id/ZoidbergsSon/recommended/315430/","ZoidbergsSon","[PT] Zoidberg's Son","http://steamcommunity.com/id/ZoidbergsSon/","40 products in account","This is a very good game!\nI highly recommend this game, it may be short but its good!\nI bought in a pack that is in sale but if i had to pay for the full price i wouldnt buy it, but still it is an awesome game","September 1, 2015","true","2.6"," 1 person found this review helpful","0","1","1","0","0"
"http://steamcommunity.com/id/Krokzter/recommended/315430/","Krokzter","Kroky","http://steamcommunity.com/id/Krokzter/","126 products in account","Awesome game, this is the game for you if you have played or like puzzle games of Portal 2 type.","September 1, 2015","true","3.2"," 1 person found this review helpful","0","1","1","0","0"
"http://steamcommunity.com/profiles/76561198156253279/recommended/315430/","76561198156253279","VAC BANNED","http://steamcommunity.com/profiles/76561198156253279/","23 products in account","very nice game but my brain hurts :d","September 1, 2015","true","1.3"," 1 person found this review helpful","0","1","1","0","0"
"http://steamcommunity.com/profiles/76561198048339433/recommended/315430/","76561198048339433","Lupita","http://steamcommunity.com/profiles/76561198048339433/","51 products in account","A good 2 hours of my life was spent on this game completing the single and co-op campain and I don't regret it :D","September 3, 2015","true","2.0"," 1 person found this review helpful","0","1","1","0","1"
"http://steamcommunity.com/id/kipofmudd/recommended/315430/","kipofmudd","KipofMudd","http://steamcommunity.com/id/kipofmudd/","155 products in account","Very good puzzle game. I had a few problems with the platforms flinging me when I jumped but for all I know that could actually be a mechanic of the game. I also hate games that have achievements for playing co op splitscreen but that is just one of my pet peeves.\n\nNow, the puzzles aren't super hard and don't require much skill but the graphics are pretty while the actual gameplay is solid and fun. You get to pick up cubes to throw them in what I will call "trigger boxes" which gives a portal feel and that's really neat as well.\n\nOverall this is worth picking up and definitely worth spending some time on if you even mildly enjoy puzzle games.","September 6, 2015","true","4.3"," 1 person found this review helpful","0","1","1","0","0"
"http://steamcommunity.com/id/spectral501/recommended/315430/","spectral501","๖ۣۜSpectral ๖ۣۜKnight","http://steamcommunity.com/id/spectral501/","286 products in account","Nice game to try! Better if you liked Portal. Really worth playing...the game is very good and has lots of features in common with portal.","October 30, 2015","true","1.8"," 1 person found this review helpful","0","1","1","0","0"
"http://steamcommunity.com/id/Wateroee/recommended/315430/","Wateroee","Roee","http://steamcommunity.com/id/Wateroee/","98 products in account","you're just buying this for the trading cards aren't you?","October 3, 2015","true","10.1"," 1 person found this review helpful","0","1","1","0","0"
"http://steamcommunity.com/profiles/76561198129366135/recommended/315430/","76561198129366135","harrygwilson","http://steamcommunity.com/profiles/76561198129366135/","26 products in account","Very short game, but with a good artstyle and game mechanics. For the amount I paid for it, it was worth it.","August 30, 2015","true","2.4"," 1 person found this review helpful","0","1","1","0","0"
"http://steamcommunity.com/id/edmy/recommended/315430/","edmy","messing with poop stick","http://steamcommunity.com/id/edmy/","5 products in account","i can't play p2 in co-op campaign with a pc\n\nGG","August 31, 2015","true","5.0"," 1 person found this review helpful","0","1","1","0","0"
"http://steamcommunity.com/id/ZoidbergsSon/recommended/315430/","ZoidbergsSon","[PT] Zoidberg's Son","http://steamcommunity.com/id/ZoidbergsSon/","40 products in account","This is a very good game!\nI highly recommend this game, it may be short but its good!\nI bought in a pack that is in sale but if i had to pay for the full price i wouldnt buy it, but still it is an awesome game","September 1, 2015","true","2.6"," 1 person found this review helpful","0","1","1","0","0"
"http://steamcommunity.com/id/Krokzter/recommended/315430/","Krokzter","Kroky","http://steamcommunity.com/id/Krokzter/","126 products in account","Awesome game, this is the game for you if you have played or like puzzle games of Portal 2 type.","September 1, 2015","true","3.2"," 1 person found this review helpful","0","1","1","0","0"
