"url","reviewerUsername","reviewerDisplayName","reviewerUrl","reviewerProductsCount","reviewText","date","recommended","hoursPlayed","voteText","helpfulPercent","votesHelpful","votesTotal","votesFunny","commentsCount"
"http://steamcommunity.com/id/TheBrains1001/recommended/315430/","TheBrains1001","Weeaboo Chan","http://steamcommunity.com/id/TheBrains1001/","16 products in account","Hella bugs.\nLevels too easy.\nDefinitely not worth the $12 (I grabbed it on sale for 21 cents), instead buy any of the portals.\n","May 1","false","3.9"," 0 of 1 people (0%) found this review helpful","0","0","1","0","2"
"http://steamcommunity.com/profiles/76561198223267052/recommended/315430/","76561198223267052","-»Anonymous Homing Flechette«-","http://steamcommunity.com/profiles/76561198223267052/","13 products in account","Great and challenging game so far! Some say its easy, some say its short, yet even others say that its annoying. I think that it is the BEST bedroom desined video game ever created! (it is short)","May 1","true","1.9"," 0 of 1 people (0%) found this review helpful","0","0","1","0","0"
"http://steamcommunity.com/id/marlouong/recommended/315430/","marlouong","2 chopsticks","http://steamcommunity.com/id/marlouong/","27 products in account","i buy this game for 6 pesos for nothing because it's cheap game","May 14, 2015","true","0.9"," 0 of 1 people (0%) found this review helpful","0","0","1","0","0"
"http://steamcommunity.com/id/MxSNAKE/recommended/315430/","MxSNAKE",".:!SNAKE!:.","http://steamcommunity.com/id/MxSNAKE/","66 products in account","","April 30","true","0.1"," 0 of 1 people (0%) found this review helpful","0","0","1","0","0"
"http://steamcommunity.com/id/myself/recommended/315430/","myself","MySeLf","http://steamcommunity.com/id/myself/","242 products in account","The concept is nice but the game feels unfinished and unpolished.\n\nIt would be OK as a Early Acess but as a final product is not worth your money.","April 20","false","13.3"," 0 of 1 people (0%) found this review helpful","0","0","1","0","0"
"http://steamcommunity.com/profiles/76561198160048413/recommended/315430/","76561198160048413","PROG","http://steamcommunity.com/profiles/76561198160048413/","64 products in account","Product received for free\n\nAwesome game!\nMany levels,great puzzles ands music :D","May 26","true","1.7"," 0 of 1 people (0%) found this review helpful","0","0","1","0","0"
"http://steamcommunity.com/id/marlouong/recommended/315430/","marlouong","2 chopsticks","http://steamcommunity.com/id/marlouong/","27 products in account","i buy this game for 6 pesos for nothing because it's cheap game","May 14, 2015","true","0.9"," 0 of 1 people (0%) found this review helpful","0","0","1","0","0"
"http://steamcommunity.com/profiles/76561198223267052/recommended/315430/","76561198223267052","-»Anonymous Homing Flechette«-","http://steamcommunity.com/profiles/76561198223267052/","13 products in account","Great and challenging game so far! Some say its easy, some say its short, yet even others say that its annoying. I think that it is the BEST bedroom desined video game ever created! (it is short)","May 1","true","1.9"," 0 of 1 people (0%) found this review helpful","0","0","1","0","0"
"http://steamcommunity.com/id/myself/recommended/315430/","myself","MySeLf","http://steamcommunity.com/id/myself/","242 products in account","The concept is nice but the game feels unfinished and unpolished.\n\nIt would be OK as a Early Acess but as a final product is not worth your money.","April 20","false","13.3"," 0 of 1 people (0%) found this review helpful","0","0","1","0","0"
"http://steamcommunity.com/id/MxSNAKE/recommended/315430/","MxSNAKE",".:!SNAKE!:.","http://steamcommunity.com/id/MxSNAKE/","66 products in account","","April 30","true","0.1"," 0 of 1 people (0%) found this review helpful","0","0","1","0","0"
"http://steamcommunity.com/id/Luigifan111productions/recommended/315430/","Luigifan111productions","Luigifan111","http://steamcommunity.com/id/Luigifan111productions/","48 products in account","I LOVE CUBE!!!!!!!1!!!!one!!!111!!\n\n10 of 10","May 4","true","2.2"," 0 of 1 people (0%) found this review helpful","0","0","1","0","0"
"http://steamcommunity.com/id/whywouldyoutypeallofthis/recommended/315430/","whywouldyoutypeallofthis","DatTacoGuy","http://steamcommunity.com/id/whywouldyoutypeallofthis/","17 products in account","It was okay...","April 28","true","0.4"," 0 of 1 people (0%) found this review helpful","0","0","1","0","0"
"http://steamcommunity.com/id/Link2411/recommended/315430/","Link2411","Link2411","http://steamcommunity.com/id/Link2411/","28 products in account","Portal without cake and well thought-out puzzles.\n\n6.5/10","April 28","true","5.6"," 0 of 1 people (0%) found this review helpful","0","0","1","0","0"
"http://steamcommunity.com/profiles/76561198112632302/recommended/315430/","76561198112632302","Potato 3.0","http://steamcommunity.com/profiles/76561198112632302/","15 products in account","Do not by this game. You would be better off buying something like Portal. Polarity has a lack of content and looks terrible. The co-op is local and that's pretty dumb unless you are playing on a TV. The game was fun but only for a short time. It could easily be finished in a single playthrough. Also, the bonus levels are even easier than the base level which still lacks content. There is honestly no reason to but this game. It is short, way to easy, has a terrible UI, (looks like something the 90's) and it just gets more and more boring. If you want to buy this game, dont expect much. This is not what I thought it would be. Please save up money and buy a better game like Portal 2. I really wanted to like this game, but just couldn't.\n\nScore: 2/5","April 29","false","0.5"," 0 of 1 people (0%) found this review helpful","0","0","1","0","0"
"http://steamcommunity.com/id/The_Ale/recommended/315430/","The_Ale","Ale","http://steamcommunity.com/id/The_Ale/","127 products in account","For what it is, its really fun. However if you compare it to the better deals, it's best to ignore this one. still a fun pickup fo a low price however.","July 28, 2015","true","0.7"," 0 of 1 people (0%) found this review helpful","0","0","1","0","0"
"http://steamcommunity.com/id/maxomaniak/recommended/315430/","maxomaniak","Maxomaniak","http://steamcommunity.com/id/maxomaniak/","164 products in account","Product received for free\n\nGreat game!\nIt's a little short, it needs more difficult maps. Also the user interface sucks a bit, and the "tutorial" was annoying.\nGameplay was awesome, controls are easy. Local co-op is really fun to do.","May 22","true","0.8"," 0 of 1 people (0%) found this review helpful","0","0","1","0","0"
"http://steamcommunity.com/id/supdos/recommended/315430/","supdos","SupDos","http://steamcommunity.com/id/supdos/","81 products in account","Get it while on sale, minimum 5€, more than that its not worth it. I didn't enjoy it, because one you get to the last level, to actually complete it, you have to go through all the older levels to get things to unlock the last one, and I seriously hate games that do that.","April 30","false","2.8"," 0 of 1 people (0%) found this review helpful","0","0","1","0","0"
"http://steamcommunity.com/profiles/76561198283311352/recommended/315430/","76561198283311352","-DMF- The Bot","http://steamcommunity.com/profiles/76561198283311352/","8 products in account","Product received for free\n\nits alright the menu could be a bit modern but good for car trips etc","May 27","true","1.2"," 0 of 1 people (0%) found this review helpful","0","0","1","0","0"
"http://steamcommunity.com/profiles/76561198160048413/recommended/315430/","76561198160048413","PROG","http://steamcommunity.com/profiles/76561198160048413/","64 products in account","Product received for free\n\nAwesome game!\nMany levels,great puzzles ands music :D","May 26","true","1.7"," 0 of 1 people (0%) found this review helpful","0","0","1","0","0"
"http://steamcommunity.com/profiles/76561198106534375/recommended/315430/","76561198106534375","666","http://steamcommunity.com/profiles/76561198106534375/","112 products in account","Portal 2 for sheep. Still good","December 21, 2015","true","0.2"," 0 of 1 people (0%) found this review helpful","0","0","1","0","0"
"http://steamcommunity.com/profiles/76561198090109480/recommended/315430/","76561198090109480","bijzaak","http://steamcommunity.com/profiles/76561198090109480/","172 products in account","Everything about this game feels cheap.\nugly sounds, the running sound is just segments of white noise and keeps going if you bump into a wall\ntext tutorials explaining the mechanics, interrupting gameplay\nvery buggy physics, cubes pass through things\nbad lighting in some places\nugly menus\nuninteresting level design, it's immediately clear what you have to do\ncollectibles are not even hidden or challenging to getMost of the time I fell down because platforms go from zero to top speed instantly, and then I had to walk a long way back up. They have a "read me" section in the main menu in which they literally apologize for this game. They could make this into a reasonable game if they replaced the physics, sounds, levels, and added an actual story. The idea could work.\n\nI paid 19 cents for it, which is about the right price. Don't buy it for anything more than that!","May 6, 2015","false","1.6"," 9 of 20 people (45%) found this review helpful","45","9","20","0","2"
"http://steamcommunity.com/id/CameronDunn/recommended/315430/","CameronDunn","Cameron","http://steamcommunity.com/id/CameronDunn/","169 products in account","no","June 5, 2015","false","0.3"," 3 of 8 people (38%) found this review helpful 3 people found this review funny","38","3","8","3","0"
"http://steamcommunity.com/id/ODDMarket/recommended/315430/","ODDMarket","BlackMarket","http://steamcommunity.com/id/ODDMarket/","175 products in account","plenty of fun so far. can't beat the sale price, i paid 19 cents for it. bought a few for gifts as well.","May 4, 2015","true","2.5"," 2 of 6 people (33%) found this review helpful","33","2","6","0","2"
"http://steamcommunity.com/id/AsdSty/recommended/315430/","AsdSty","QP","http://steamcommunity.com/id/AsdSty/","87 products in account","Nice graphics.Buy it when on sale.\n10/10 bought it for cards.","May 5, 2015","true","2.5"," 2 of 6 people (33%) found this review helpful","33","2","6","0","0"
"http://steamcommunity.com/profiles/76561198077798024/recommended/315430/","76561198077798024","Mr. Mcsandwich","http://steamcommunity.com/profiles/76561198077798024/","102 products in account","Trying too hard to be Portal, not polished enough. ONLY buy if you're really desperate for more first-person platformer puzzling.","May 7, 2015","false","0.1"," 2 of 6 people (33%) found this review helpful","33","2","6","0","0"
"http://steamcommunity.com/id/brucenproductions/recommended/315430/","brucenproductions","dat boi","http://steamcommunity.com/id/brucenproductions/","287 products in account","this looks like some ♥♥♥♥ you could find on kongergate.com i.e. it's ♥♥♥♥. 19 cents however","May 9, 2015","false","0.4"," 2 of 6 people (33%) found this review helpful","33","2","6","0","0"
"http://steamcommunity.com/id/mksss12312/recommended/315430/","mksss12312","DANTE.R","http://steamcommunity.com/id/mksss12312/","8 products in account","+:\n-Good Graphics\n-Very interestin\n-similar to portal (which i like)\n-cards\n\n-:\n-add more stages\n-glitches\n","May 6, 2015","true","0.6"," 2 of 6 people (33%) found this review helpful","33","2","6","0","0"
"http://steamcommunity.com/id/MandatoryAlcatraz/recommended/315430/","MandatoryAlcatraz","MandatoryAlcatraz","http://steamcommunity.com/id/MandatoryAlcatraz/","254 products in account","Clunky, pointless, boring, and easy... What would be the point of reviewing this ♥♥♥♥?","May 13, 2015","false","0.5"," 2 of 6 people (33%) found this review helpful","33","2","6","0","0"
"http://steamcommunity.com/id/companothemuslim/recommended/315430/","companothemuslim","literally rommel","http://steamcommunity.com/id/companothemuslim/","96 products in account","Bought this for me and my friend on sale, thought there was co op, there isnt its only splitscreen.","April 29","false","0.6"," 2 of 6 people (33%) found this review helpful","33","2","6","0","1"
"http://steamcommunity.com/profiles/76561198053422627/recommended/315430/","76561198053422627","Zaxtor99","http://steamcommunity.com/profiles/76561198053422627/","505 products in account","Pretty cool and fun puzzle game that reminds me a lot of Portal minus all of the portals.  Nice level design and solid controls.\n\nI picked this game up on sale for 19 cents.  It's worth a buy all day long when on sale, probably only worth the full $4.99 USD price tag if you like this sorta game.\n\nHere's a video I made that demonstrates the first two levels and how the game plays:\nhttps://www.youtube.com/watch?v=GlqmCwonFFU","May 5, 2015","true","0.4"," 2 of 6 people (33%) found this review helpful 1 person found this review funny","33","2","6","0","0"
"http://steamcommunity.com/profiles/76561198128839955/recommended/315430/","76561198128839955","[Misfit]Epicjoykill","http://steamcommunity.com/profiles/76561198128839955/","33 products in account","Ah polarity what a wierd game but i did not enjoy it as  it felt tomuch like portal  the DATA has no value as it does not unlock and extras or bonus areas it feels just wierd to control(with Xbox button promps insted of PC \9 i can live with out it but it's annioying) at best it looks and feels like a portal rip off  i would not reccomend this to players if they have played portal they have played this","May 8, 2015","false","0.1"," 1 of 4 people (25%) found this review helpful","25","1","4","0","0"
"http://steamcommunity.com/id/Thesidekick/recommended/315430/","Thesidekick","Thesidekick","http://steamcommunity.com/id/Thesidekick/","101 products in account","This game is early access at best. The graphics look like they are straight out of Halo CE and the puzzles are equally poor. Nothing in any level requires much beyond a few seconds of thought most of the time spent is attempting to throw your cube at a plate and missing. This basketball simulator is not worth £0.15, Valve please remove this game.","May 14, 2015","false","0.6"," 1 of 4 people (25%) found this review helpful","25","1","4","0","0"
"http://steamcommunity.com/id/Vinic00kie/recommended/315430/","Vinic00kie","Vinic00kie","http://steamcommunity.com/id/Vinic00kie/","283 products in account","piece of ♥♥♥♥ that says it has online multiplayer but doesn't","July 10, 2015","false","0.1"," 1 of 4 people (25%) found this review helpful","25","1","4","0","0"
"http://steamcommunity.com/id/Goldra/recommended/315430/","Goldra","Goldra","http://steamcommunity.com/id/Goldra/","44 products in account","piece of ♥♥♥♥","July 13, 2015","false","0.8"," 1 of 4 people (25%) found this review helpful","25","1","4","0","0"
"http://steamcommunity.com/id/yella0109/recommended/315430/","yella0109","Yella 🎓","http://steamcommunity.com/id/yella0109/","678 products in account","Polarity is a game that I recommend because:\n- is a method to banish boredom\n- it has a good price\n- is has strategy\n- it is indie\n- it has action & adventure\n- it is a good puzzle game\n- it has trading cards\n\nEnjoy!","May 5","true","3.6"," 1 of 4 people (25%) found this review helpful","25","1","4","0","0"
"http://steamcommunity.com/profiles/76561198067542799/recommended/315430/","76561198067542799","Filthy Frank, Anime Hunter","http://steamcommunity.com/profiles/76561198067542799/","65 products in account","The story and gameplay is lackluster, bringing almost nothing new to the table to keep it fresh. Each level feels similar to the last, and has a hollow sense of accomplishment. It's easy to forget the story even exists by the time you reach the one-note, pointless ending screen. The gameplay itself is god-awful, with incredibly wonky physics that accomplish such things as nearly breaking your screen from a decent fall, or shifting cubes across the stage when it's impossible to do so (rotating a portion of the stage also rotates any cubes that come from it, even if it's not inside said rotated area). The UI is clunky, poorly designed (Can't go to options without quitting everything you're doing), and the game looks ugly overall.\n\nThe only redeeming factors I could think of would be its short length, which made it semi-bearable to finish, and its low price tag.","July 10, 2015","false","1.5"," 0 of 2 people (0%) found this review helpful","0","0","2","0","0"
"http://steamcommunity.com/profiles/76561198059712996/recommended/315430/","76561198059712996","orange","http://steamcommunity.com/profiles/76561198059712996/","57 products in account","I thought it would end up being a Portal or Portal 2 rip-off. But when I got it seemed like a pretty unique and fun game. It's full of great puzzles and I would rate it a 9/10.\n","May 23, 2015","true","1.3"," 0 of 2 people (0%) found this review helpful","0","0","2","0","0"
"http://steamcommunity.com/id/kutsalizm/recommended/315430/","kutsalizm","Fredrik Thordendal","http://steamcommunity.com/id/kutsalizm/","78 products in account","Like Portal. But Easier Puzzles And Short Levels.\nBought 0.30$ And Totally Worth it.","October 29, 2015","true","1.3"," 0 of 2 people (0%) found this review helpful","0","0","2","0","0"
"http://steamcommunity.com/id/Zacroscopic/recommended/315430/","Zacroscopic","Zacroscopic","http://steamcommunity.com/id/Zacroscopic/","132 products in account","Don't like it.","October 29, 2015","false","0.7"," 0 of 2 people (0%) found this review helpful","0","0","2","0","0"
"http://steamcommunity.com/profiles/76561198134678166/recommended/315430/","76561198134678166","lokethecheetah","http://steamcommunity.com/profiles/76561198134678166/","105 products in account","It's a fun game. Its puzzles are similar to Portal, but without any portals. It would be a Portal rip-off if it did. The puzzles are simpler than Portal's too and the game takes only a few hours to complete the main levels and bonus levels. It's a short, simple puzzle game that is frequently on sale and has trading cards.","September 8, 2015","true","2.1"," 0 of 2 people (0%) found this review helpful","0","0","2","0","0"
"http://steamcommunity.com/id/DefinePvP/recommended/315430/","DefinePvP","DefinePvP","http://steamcommunity.com/id/DefinePvP/","36 products in account","yes","September 9, 2015","true","0.8"," 0 of 2 people (0%) found this review helpful","0","0","2","0","0"
"http://steamcommunity.com/id/quodez/recommended/315430/","quodez","Coma","http://steamcommunity.com/id/quodez/","94 products in account","Is this a rocketjumping game for non-tf2 gamers?","December 27, 2015","true","2.7"," 0 of 2 people (0%) found this review helpful","0","0","2","0","0"
"http://steamcommunity.com/profiles/76561198083523024/recommended/315430/","76561198083523024","BlueCat","http://steamcommunity.com/profiles/76561198083523024/","393 products in account","Poor man's Portal with chinese bootleg kind of quality.\nPolarity likes comparing itself to Portal, in places even suggesting that it might be better, but it couldn't be farther from the truth.\nAnd it even tries to sell itself higher than Portal, which is just a bad joke.\n\nI actually feel bad for mentioning both of them in the same sentence.\nJust go play Portal again for the 7th time, it'll be way more fun.","December 27, 2015","false","0.8"," 0 of 2 people (0%) found this review helpful","0","0","2","0","0"
"http://steamcommunity.com/id/Officialc00ld0wn/recommended/315430/","Officialc00ld0wn","♫ c00ld0wn|★","http://steamcommunity.com/id/Officialc00ld0wn/","52 products in account","yesyesyes","May 6, 2015","true","0.4"," 0 of 2 people (0%) found this review helpful","0","0","2","0","0"
"http://steamcommunity.com/id/eilatkin/recommended/315430/","eilatkin","Жора","http://steamcommunity.com/id/eilatkin/","205 products in account","This is surprisingly good.","May 6, 2015","true","1.8"," 0 of 2 people (0%) found this review helpful","0","0","2","0","1"
"http://steamcommunity.com/id/Zacroscopic/recommended/315430/","Zacroscopic","Zacroscopic","http://steamcommunity.com/id/Zacroscopic/","132 products in account","Don't like it.","October 29, 2015","false","0.7"," 0 of 2 people (0%) found this review helpful","0","0","2","0","0"
"http://steamcommunity.com/id/DefinePvP/recommended/315430/","DefinePvP","DefinePvP","http://steamcommunity.com/id/DefinePvP/","36 products in account","yes","September 9, 2015","true","0.8"," 0 of 2 people (0%) found this review helpful","0","0","2","0","0"
"http://steamcommunity.com/id/SuperScore/recommended/315430/","SuperScore","SuperScore (Pentium PC)","http://steamcommunity.com/id/SuperScore/","144 products in account","Good game if you cant afford Portal :^)","November 11, 2015","true","2.6"," 0 of 2 people (0%) found this review helpful 1 person found this review funny","0","0","2","0","2"
"http://steamcommunity.com/id/denyraf/recommended/315430/","denyraf","Vordey","http://steamcommunity.com/id/denyraf/","7 products in account",""you are a hacker"  the game said :D","December 27, 2015","true","4.5"," 0 of 2 people (0%) found this review helpful 1 person found this review funny","0","0","2","0","0"
"http://steamcommunity.com/id/quodez/recommended/315430/","quodez","Coma","http://steamcommunity.com/id/quodez/","94 products in account","Is this a rocketjumping game for non-tf2 gamers?","December 27, 2015","true","2.7"," 0 of 2 people (0%) found this review helpful","0","0","2","0","0"
"http://steamcommunity.com/profiles/76561198083523024/recommended/315430/","76561198083523024","BlueCat","http://steamcommunity.com/profiles/76561198083523024/","393 products in account","Poor man's Portal with chinese bootleg kind of quality.\nPolarity likes comparing itself to Portal, in places even suggesting that it might be better, but it couldn't be farther from the truth.\nAnd it even tries to sell itself higher than Portal, which is just a bad joke.\n\nI actually feel bad for mentioning both of them in the same sentence.\nJust go play Portal again for the 7th time, it'll be way more fun.","December 27, 2015","false","0.8"," 0 of 2 people (0%) found this review helpful","0","0","2","0","0"
"http://steamcommunity.com/id/Phak/recommended/315430/","Phak","Phak | kickback.com","http://steamcommunity.com/id/Phak/","41 products in account","Mainly for the xbox the multiplayer doesn't work including the splitscreen, i got stuck on lv 14 because was dumb","July 28, 2015","false","0.3"," 0 of 2 people (0%) found this review helpful","0","0","2","0","0"
"http://steamcommunity.com/id/koncerN/recommended/315430/","koncerN","tORRA","http://steamcommunity.com/id/koncerN/","21 products in account","I bought this game (well, gifted to me. thx daddy kajen) at 0.29 cents and it was 98% off from $10.99.\n\nI thought hey, if this game is 11$ it sounds like a great deal!\n\nEh, not really. After 3 minutes of playing into the game, I can feel on how this is based off Portal, but worse.\n\nThough I did speak negatively about it, it wasn't honestly that bad. The puzzles are ok and if you're bored and want to spend a few minutes of playing a game, this is worth it ONLY ON SALE\n\ndon't know why the devs would think that 11$ for a game that has graphics made on paint would be worth that much. Portal is worth less than this and it's 10000000000000x better.","April 29","true","2.1"," 0 of 2 people (0%) found this review helpful","0","0","2","0","0"
"http://steamcommunity.com/id/Denniskurama/recommended/315430/","Denniskurama","Dennis Bush Kurama","http://steamcommunity.com/id/Denniskurama/","232 products in account","Nope.\nA complete rip-off from Portal & Portal 2.\nAnd it's graphics doesn't fit in as it should, lamp glitches, laser goes through and looks ugly.\nBut I can run it 60 fps, but still not good.","July 7, 2015","false","0.2"," 0 of 2 people (0%) found this review helpful","0","0","2","0","0"
"http://steamcommunity.com/profiles/76561198081376451/recommended/315430/","76561198081376451","Firelizard44","http://steamcommunity.com/profiles/76561198081376451/","64 products in account","TOTALLY worth it awesome game it is just as fun as portal 2","May 30","true","3.7"," 0 of 2 people (0%) found this review helpful","0","0","2","0","0"
"http://steamcommunity.com/profiles/76561198112669681/recommended/315430/","76561198112669681","TheTerminatorGuy","http://steamcommunity.com/profiles/76561198112669681/","107 products in account","kek","May 29","true","2.2"," 0 of 2 people (0%) found this review helpful","0","0","2","0","0"
"http://steamcommunity.com/profiles/76561198155543901/recommended/315430/","76561198155543901","LewThePredator","http://steamcommunity.com/profiles/76561198155543901/","34 products in account","Product received for free\n\nI received a free code through my emails and decided to check his game out. Honestly It is a great game, the graphics are good and the puzzles are great. I would happily pay the £6.99 for this game","May 22","true","1.7"," 0 of 2 people (0%) found this review helpful","0","0","2","0","0"
"http://steamcommunity.com/id/Tabhul/recommended/315430/","Tabhul","john.rapuskadorgonforz2001","http://steamcommunity.com/id/Tabhul/","66 products in account","you spend more time looking for the pickups called data than you actually spend going through the 'puzzles' that feel more like really bad platforming levels\n\n15$ smh at least i got 2 other games in a bundle for less than a dollar","December 29, 2015","false","0.6"," 2 of 7 people (29%) found this review helpful 1 person found this review funny","29","2","7","0","1"
