"url","reviewerUsername","reviewerDisplayName","reviewerUrl","reviewerProductsCount","reviewText","date","recommended","hoursPlayed","voteText","helpfulPercent","votesHelpful","votesTotal","votesFunny","commentsCount"
"http://steamcommunity.com/id/danfuldan/recommended/372350/","danfuldan","Little Buddy","http://steamcommunity.com/id/danfuldan/","219 products in account","Fun little shooter with decent music and graphics that aren\'t too hard on the eyes. The upgrade system and contracts add a lot of replayability to each level and keep it from getting stale. It\'s cheap and fun enough that I can easily overlook some of the smaller flaws and minor bugs of the game.","May 31","true","2.2"," 1 of 2 people (50%) found this review helpful","50","1","2","0","0"
"http://steamcommunity.com/profiles/76561197998696024/recommended/372350/","76561197998696024","pfizzle108","http://steamcommunity.com/profiles/76561197998696024/","11 products in account","For five dollars you can spend it on that 30 seconds with your favorite prositute. OR you can buy Tumbleweed Express and become a TRAIN GOD #4LYFE. DO YOU WANT TO REVEL IN EXPLOOOSIVE MOTHERF***IN TRAIN GLORY? I MADE MY CHOICE. I AM A TRAIN GOD.","May 31","true","3.9"," 3 of 6 people (50%) found this review helpful 1 person found this review funny","50","3","6","0","0"
"http://steamcommunity.com/id/togetec/recommended/372350/","togetec","Ass2Dad","http://steamcommunity.com/id/togetec/","268 products in account","It sucks that it's only 12 levels but there is enough reason to play each level multiple times. You'll get about a dollar an hour out of it. Genuinely entertaining.\n\nCons:\n-Voice acting. Can be laughably bad sometimes.\n-Story is meh\n-Some game breaking bugs. Last boss would disappear mid fight or become invincible. Had to fight last boss 4 times before he would die.\n-No way to skip in game cutscenes.\n-NO WAY TO SWITCH BETWEEN TURRETS ON CARS BESIDES SELLING AND REBUYING TURRETS. EXTREMELY ANNOYING. PLEASE MAKE AN OPTION TO BUY MORE TURRETS FOR EACH CAR AND SWITCH BETWEEN THEM.\n-No way to just turn of turrets for cars besides selling them. They get in the way of a lot of side missions.\n\nStill fun enough to 100%","May 31","true","5.6"," 2 of 5 people (40%) found this review helpful","40","2","5","0","0"
"http://steamcommunity.com/profiles/76561198061126359/recommended/372350/","76561198061126359","Allistor","http://steamcommunity.com/profiles/76561198061126359/","110 products in account","Fun and cheap. Upgrades are neat and make levels replay-able to earn achievements. The voices are funny and I can only imagine how fun they would have been to script/record. Really cool. Nice job devs. Will def be putting more time into this. Kudos.","May 31","true","0.7"," 1 of 4 people (25%) found this review helpful","25","1","4","0","0"
"http://steamcommunity.com/profiles/76561197994231136/recommended/372350/","76561197994231136","Kaz77","http://steamcommunity.com/profiles/76561197994231136/","124 products in account","Looks like it could be a fun game but I played a few levels and got some pretty bad motion sickness.","June 2","false","0.3"," 1 of 14 people (7%) found this review helpful 4 people found this review funny","7","1","14","4","0"
