"url","reviewerUsername","reviewerDisplayName","reviewerUrl","reviewerProductsCount","reviewText","date","recommended","hoursPlayed","voteText","helpfulPercent","votesHelpful","votesTotal","votesFunny","commentsCount"
"http://steamcommunity.com/profiles/76561197967938517/recommended/372350/","76561197967938517","Cagey","http://steamcommunity.com/profiles/76561197967938517/","254 products in account","Really enjoying this game, but on release there were a few niggly (small, easily fixed) bugs which are now pretty much sorted. I'd consider this to be in the "travel defence" genre, a bit like Space Run.\n\nPro:\n\n-Nice borderlands style graphics.\n-Good music which really ties in well with the atmosphere of the game.\n-Literally, a rail shooter.  But in a good way.\n-Each level can be re-played for more cash and better upgrades.\n-Without giving anything away, some of the upgrades feel really great.\n-Difficulty seems spot on, with a mild curve, but the game is understandable and easy to learn quickly.\n-Developers are friendly and actively encourage feedback.\n\nCon:\n-Voice acting is a little shaky and unbelievable.  Should have got some real Southerners! The main voice (in the intro and trailer) is really quiet due to the "droney" Southern style accent and is hard to hear.\n-Can get stuck on levels if you do too well - killed a boss within seconds and it made the level uncompletable. (Devs looking into this)\n-Although the graphics are nice, some things don't appear until you've already gone past them.  This means you're costantly looking backwards, which seems odd. It's not that big of a deal, but some missions ask you to destroy scenery which may or may not spawn by the time you've gone  past it.  (Found out that this is due to the graphics settings - just turn it up if you can.)\n-Other niggly bugs, like the launcher has an "empty" button which doesn't mean anything. (Fixed)","May 31","true","6.1"," 36 of 37 people (97%) found this review helpful 1 person found this review funny","97","36","37","0","5"
"http://steamcommunity.com/id/TheSpanishInquisition/recommended/372350/","TheSpanishInquisition","The Spanish Inquisition","http://steamcommunity.com/id/TheSpanishInquisition/","652 products in account","A very interesting take on the on-rails shooter genre. What feels initially like the smooth gameplay concept of Star Fox, mixed with the accuracy capabilities of a FPS and the challenge of managing health and damage, is an enjoyable experience. With the ability to jump right in and play, this game requires little learning curve and allows (requires, really) you to jump right into the fray.\n\nIt looks pretty, with graphics that remind me much of Borderlands art style, which is not a detrement at all and fits quite well with the Western layout. And at a cost of $5, this game is a steal. Hopefully the developer continues to develop and releases additional courses, with possibly even a tool to create your own courses and share them online.","May 31","true","1.2"," 16 of 18 people (89%) found this review helpful","89","16","18","0","0"
"http://steamcommunity.com/profiles/76561197978516193/recommended/372350/","76561197978516193","Luvmuchine","http://steamcommunity.com/profiles/76561197978516193/","495 products in account","I spent my last 5 bucks on this game and I don\'t really regret it so that\'s something. Gameplay is fun, graphics could use a bit of polish but the gameplay makes up for it. Dialogue is pretty funny too. This game is definitely worth it\'s price.\n\n\n\nPayday is tomorrow.","June 1","true","2.0"," 6 of 7 people (86%) found this review helpful 2 people found this review funny","86","6","7","2","0"
"http://steamcommunity.com/id/gimmic/recommended/372350/","gimmic","{-o-} Gimmic","http://steamcommunity.com/id/gimmic/","309 products in account","Certainly worth the $5.\n\nPros:\nLiteral implementation of an 'on-rails' shooter.\nHas upgrades and paths similar to an offensive tower-defense game.\nGameplay can be quick, engaging.\n\nCons:\nThe voice acting isn't great.\nSome cutscenes are not skippable.\nNeeds better mouse-capture in full screen for multi-monitors.\n\n\nYou can repeat levels/missions for cash to upgrade your train. It would be nice if there were a procedurally generated terrain mode.","June 3","true","3.6"," 4 of 4 people (100%) found this review helpful 1 person found this review funny","100","4","4","0","0"
"http://steamcommunity.com/profiles/76561197997276199/recommended/372350/","76561197997276199","utpanthro","http://steamcommunity.com/profiles/76561197997276199/","461 products in account","Little short but hella fun. Worth it at $5 for a night of fun","June 1","true","2.3"," 3 of 3 people (100%) found this review helpful","100","3","3","0","0"
"http://steamcommunity.com/profiles/76561197970585058/recommended/372350/","76561197970585058","Varkster","http://steamcommunity.com/profiles/76561197970585058/","379 products in account","This is a game where you shoot stuff, while driving a train along rails. If only there was a name for that sort of thing..\n\nAnyhow, it's pretty much what you'd expect; and that's not a bad thing. In fact, short of the limited nature of the game style itself I really haven't found much wrong with it. Maybe it's a tad too difficult? (But then when a game gets to that stage these days, I generally save my time somewhat by cheating a little.. /cough)\n\nMore than once, I was put in mind of the ground levels of Starfox 64. But without the annoying frog-dude. ("Slippy is ($) hit!") And that can only be a good thing. On both counts.\n\nWell worth it at the low price, and one I'll probably come back to again when I fancy some mindless shooting on railway tracks. (There really should be a name for that.)","June 4","true","1.3"," 3 of 3 people (100%) found this review helpful 2 people found this review funny","100","3","3","2","0"
"http://steamcommunity.com/profiles/76561197961831412/recommended/372350/","76561197961831412","Scout[sS].13","http://steamcommunity.com/profiles/76561197961831412/","96 products in account","Tumbleweed Express is a pretty fun little game. Worth $5 for sure\n\nRail shooter, point, click, and kill\n\nUpgrades are nice. You feel noticeable progression as you get them\n\nOnly had a couple of bugs happen:\n- Once where I was stuck in the train station. Couldn't upgrade my train, start a mission, or view the letters. Had to quit to main menu and restart my game to progress\n- On one particular level (Redoubt Pass) if you kill the last generator in the middle before you enter the middle circle, it would lock you in the switch up part. Had to start the level over a few times, because of it\n\nCame across the game via a post on Reddit and decided to try the game that evening. My expectations were low, but this game surprised me and actually enjoyed it quite a bit","June 1","true","4.0"," 3 of 3 people (100%) found this review helpful","100","3","3","0","1"
"http://steamcommunity.com/profiles/76561198080139829/recommended/372350/","76561198080139829","magicbymccauley","http://steamcommunity.com/profiles/76561198080139829/","23 products in account","Hi, I just played this game and I can't believe it.\n\nPeople are noting that it's "ONLY 7-10 Hours of Gameplay".\n\nOnly? The game is $5. The cheapest McDonalds meal you can buy is $5.69. Have you ever eaten a Mc Donald's meal for 7-10 hours? More like 10 minutes. Have you ever played a pinball game for 10 hours with $5? Have you ever done ANYTHING for 10 hours of entertainment for $5? They are basically charging you .50/hr to play this game.\n\nThe art style is very, VERY good. You are treated to authentic train maps and rotating items in the game during loading screens (like in Skyrim). The voice acting is really cute and amusing, and MAN the music. The music is absolutely phenomenal, it's BETTER than the music in most professionally released games.\n\nThe only cons I would say is that there isn't more of it, more levels, multiplayer, VR, etc, but if your biggest Con is that there isn't more of the game (and what I said about $5) then how can you complain. These guys are indie developers and built this passion project from the ground up. Mad respect.\n\nThis game has extraordinarily fun and engaging gameplay, an original concept (MOVING tower defense) and an intuitive interface so that you don't need instructions on how to do anything in the game, it all is designed to be played without a complicated tutorial or manual.\n\nLET THE TUMBLEWEED ROLL OUT!","June 3","true","5.4"," 3 of 3 people (100%) found this review helpful 2 people found this review funny","100","3","3","2","0"
"http://steamcommunity.com/id/samthecrazy/recommended/372350/","samthecrazy","SamTheCrazy","http://steamcommunity.com/id/samthecrazy/","161 products in account","Ever had an interest in Train Simulator but not have $4,000+ to spend on it and all its DLC?\n\nNo!?!\n\nWell good cause this is all the train you need for only $5. Hell I think its worth more then that honestly. If you like Rail Shooters, well obviously... this is what you are looking for. Difficulty flows well and each upgrade feels worth it. You can replay levels for more $$$ with a few more challenges and some levels even have more then 1 path to take.\n\nAfter upgrading to multiple train cars I do wish there was multiplayer where you and your friends each control one Car and battle for survival and scores.\n\nReally great concept and I hope the developer continues to make more awesome games!","May 31","true","4.3"," 4 of 5 people (80%) found this review helpful","80","4","5","0","0"
"http://steamcommunity.com/profiles/76561197971127055/recommended/372350/","76561197971127055","Sarconic","http://steamcommunity.com/profiles/76561197971127055/","135 products in account","Fun little rail-shooter. Great value. Please hire voice actors next time!","June 2","true","4.4"," 2 of 2 people (100%) found this review helpful","100","2","2","0","0"
"http://steamcommunity.com/profiles/76561197971127055/recommended/372350/","76561197971127055","Sarconic","http://steamcommunity.com/profiles/76561197971127055/","135 products in account","Fun little rail-shooter. Great value. Please hire voice actors next time!","June 2","true","4.4"," 2 of 2 people (100%) found this review helpful","100","2","2","0","0"
"http://steamcommunity.com/id/jeftadoteu/recommended/372350/","jeftadoteu","Jefta","http://steamcommunity.com/id/jeftadoteu/","34 products in account","Great little game","June 2","true","3.8"," 2 of 2 people (100%) found this review helpful","100","2","2","0","0"
"http://steamcommunity.com/id/ltlmacmcg/recommended/372350/","ltlmacmcg","LtlMacMcG","http://steamcommunity.com/id/ltlmacmcg/","295 products in account","https://youtu.be/On9BHB9hSuM\n\nThis really is quite the gem of a game, especially for its price ($5.00 with no sale).\n\nThe artwork is similar to borderlands and the gameplay is a bit like a tower defense in reverse.  The gameplay mechanics all run very smooth, the upgrade system hits the 'just right' mark where you can replay missions for contracts (essentially challenge missions) to fully upgrade as you do along, or you can stick with the normal upgrade pace.  What you choose to do is up to personal preference.\n\nFor  a full review/let's play please see the video above.\n\nFor fullscreen and other videos, please visit:  http://www.youtube.com/c/LittleMacscorner","June 2","true","2.4"," 2 of 2 people (100%) found this review helpful","100","2","2","0","0"
"http://steamcommunity.com/profiles/76561198027183749/recommended/372350/","76561198027183749","Hoppingmad9","http://steamcommunity.com/profiles/76561198027183749/","98 products in account","Really great game!","June 3","true","3.3"," 2 of 2 people (100%) found this review helpful","100","2","2","0","0"
"http://steamcommunity.com/profiles/76561197989212961/recommended/372350/","76561197989212961","[WwG] Gigeran","http://steamcommunity.com/profiles/76561197989212961/","274 products in account","Fun game that is a crossover between an on-rails shooter (pun intended as it is a train) and a tower defense.\n\nI am hoping they will make more levels for it later on even tho I have not reached the end yet, still love replaying old levels just to get a better reward or a missed achievement to get more cash for an upgrade I unlocked.","June 3","true","6.1"," 2 of 2 people (100%) found this review helpful","100","2","2","0","0"
"http://steamcommunity.com/profiles/76561198047794005/recommended/372350/","76561198047794005","dcbrune","http://steamcommunity.com/profiles/76561198047794005/","59 products in account","Fun little game, nice to just be able to blow stuff up without having to hunt around and do quests.","June 3","true","4.2"," 2 of 2 people (100%) found this review helpful","100","2","2","0","0"
"http://steamcommunity.com/id/grizz01/recommended/372350/","grizz01","Grizz01","http://steamcommunity.com/id/grizz01/","291 products in account","The game is't the longest in the world but it's some of the most entertainment I've ever gotten for 5 bucks. Solid variety of weapons and upgrades. Only downside is I didn't want it to end.","June 3","true","5.2"," 2 of 2 people (100%) found this review helpful","100","2","2","0","0"
"http://steamcommunity.com/profiles/76561197985250202/recommended/372350/","76561197985250202","kbforme","http://steamcommunity.com/profiles/76561197985250202/","177 products in account","its a fun game but its INCREDIBLY short, in the 4 hours ive played it i beat every level with a perfect 3 start rating and finished at least 80-85% of the side missions. gameplay is solid, graphics are decent and ive had none of the video issues i see other reviewers talking about, audio is solid, plot is a sidenote(really not a huge problem), voice acting is hammy but not annoying and even funny at times and its not a long game at all. you basically get 12 levels where you can get a 1-3 star rating based on how fast you complete said level and each of these 12 levels has 5 or 6 missions to complete, most of which you can complete on your first run of the level. for a game with just single player it would be nice to see more levels, i dont care enough to check but it does not seem to me the devs are planning on releasing any more levels so dont buy it with hopes it will be extended. lastly like i said this game is very very short(100% complete in about 5 hours) but it is quite fun and you cant go wrong with a $5 price tag. i can reccomend this game but if your money is tight its best spent on another bargin game because this one wont keep you busy for very long.","June 4","true","4.0"," 2 of 2 people (100%) found this review helpful","100","2","2","0","7"
"http://steamcommunity.com/id/Aquila_V/recommended/372350/","Aquila_V","Aquila_V","http://steamcommunity.com/id/Aquila_V/","208 products in account","Very fun little game. The graphics are very borderlands-esque. It it a neat concept and depending on how far the Dev's wanted to go with it, it could become a pretty big game. I will list some pros and cons\n\nPros\n-Reasonably priced. For only $5 it well worth what you get\n-Great graphics, engaging environment.\n-Unique gameplay\n-Fun, levels aren't too long and they do a good job of mixing things up, and integrating new enemies.\n-Story line actually isnt half bad. World is believable in a sort of post apocaliptic meets steam punk-ish world.\n\nCons\n-Short, but again I believe long enough to be worth $5 or more\n-Some levels aren't the best, or just have weird quirks that are annoying. Most are good though. Only 2 come to mind\n-Voice acting is pretty bad.\n-You need to destroy cacti for a few of the challenges, but their spawning is really weird.\n-After you unlock all four train cars and get some guns on them, at normal dificulty, the game kind of plays itself. You really only need to pay attention for switching tracks, lowering bridhes, and clearing road blocks. Not much to worry about after a certain point.\n\nI enjoyed it. It would be fun to be able to customize the look of your train, switch which car you are controlling, add more stuff to the engine, etc. There is tons of potential in this game.\n\nTo the devs: Cheers! Found you via reddit.","June 2","true","3.9"," 3 of 4 people (75%) found this review helpful","75","3","4","0","0"
"http://steamcommunity.com/id/icrontic/recommended/372350/","icrontic","{IC} prime","http://steamcommunity.com/id/icrontic/","342 products in account","A clever, on-rails (literally!), \"reverse tower defense\" game; like a mix of Borderlands meets Spirit Tracks. You control a train with guns, flamethrowers, engineers, and other staff on it; your job is to make it through enemy territory, defend your cargo against bandits, save towns, deliver stuff, and upgrade your train. A simple concept but tons of fun!","May 31","true","3.9"," 5 of 8 people (63%) found this review helpful","63","5","8","0","0"
"http://steamcommunity.com/id/Gibusisfortheweak/recommended/372350/","Gibusisfortheweak","Mr. Fancypants","http://steamcommunity.com/id/Gibusisfortheweak/","555 products in account","This is actually a really fun game!\n\nIt's a railshooter, (no pun intended) and it is a really fun 1 to.\nNow i never play railshooters becouse i don't like the whole '' not walking freely '' thing. But this  game is really good!\nYou can do special objectives to get more money. (like shoot this, or do that within ___ time )\n\nMusic is not exactly in my top 10 best OST of games, but that is ok. A few minor bugs. I got stuck when i came to the first boss battle. But it only happened 1/3 times i played that mission so nothing big.\n\nI recomend this game totally, only missing is the sound of a steam train driving. But do not worry, youtube can solve this for us! https://www.youtube.com/watch?v=jZUXJyDt8ig\n\nPerhaps multiplayer where people can fight each other or defend the same train? Just a idea.","June 1","true","2.6"," 1 person found this review helpful","0","1","1","0","0"
"http://steamcommunity.com/profiles/76561198042235788/recommended/372350/","76561198042235788","Bob Keeper of the Coin","http://steamcommunity.com/profiles/76561198042235788/","108 products in account","Pro's\n-Minimalist but well constructed artwork\n-Great game mechanics\n-Objectives are semi-challenging\n-Decent story writing\nCon's\n-No thomas the tank engine skin\n-Short game","June 1","true","2.7"," 1 person found this review helpful 1 person found this review funny","0","1","1","0","0"
"http://steamcommunity.com/profiles/76561198065213060/recommended/372350/","76561198065213060","MegaMangos","http://steamcommunity.com/profiles/76561198065213060/","124 products in account","Pretty short game.  Only took seven hours of casual play to beat the game 100%.  Was not really a fan of the writing or the voice acting but the gameplay was sweet and I just skipped through the cutscenes.\n\nWIth more content and features, I could see this being a $60 game.  It's got the foundation for it, now lets see what the devs do with that.","June 2","true","7.1"," 1 person found this review helpful","0","1","1","0","0"
"http://steamcommunity.com/profiles/76561198075036956/recommended/372350/","76561198075036956","xCaptainObviousx","http://steamcommunity.com/profiles/76561198075036956/","50 products in account","Well, you DID ask for a comeback for rail shooters.","June 3","true","2.7"," 1 person found this review helpful 1 person found this review funny","0","1","1","0","0"
"http://steamcommunity.com/id/Maniacal_Mikie/recommended/372350/","Maniacal_Mikie","Maniacal_Mikie","http://steamcommunity.com/id/Maniacal_Mikie/","191 products in account","Well done Indie game and well worth the $5.","June 4","true","5.0"," 1 person found this review helpful","0","1","1","0","0"
"http://steamcommunity.com/id/noobstopfeed/recommended/372350/","noobstopfeed","Womb Raider","http://steamcommunity.com/id/noobstopfeed/","231 products in account","Fun game with a combination of tower defense and on-rail-shooting. Not a long game, but its also great at the price. The voice acting is the weakest part of the game for me, but the gameplay makes up for it. If you can get this on a sale its a steal, but if you can justify spending $5 on a simple game its worth it.","June 4","true","2.8"," 1 person found this review helpful","0","1","1","0","0"
"http://steamcommunity.com/id/Xifihas/recommended/372350/","Xifihas","Xifihas","http://steamcommunity.com/id/Xifihas/","490 products in account","Short but enjoyable throughout. The game's not to difficult on it's own but the optional objectives, especially the ones involving specific weapons, can be tricky, especially when trying to three star the mission at the same time. There is an annoying bug on the third mission where you end up getting stuck after the encounter with the boss of that region. Not sure how to get around it, just expect to restart that level a few times. Devs seem to be working on it though. Aside from that I haven't had any major bugs. The game's worth the price.","May 31","true","2.3"," 2 of 3 people (67%) found this review helpful","67","2","3","0","0"
"http://steamcommunity.com/id/movnviol/recommended/372350/","movnviol","!BERT! Master of Disguise","http://steamcommunity.com/id/movnviol/","179 products in account","A cool little indy game that is best described as a mobile tower-defense, with the smallest touch of business sim.","May 31","true","0.6"," 2 of 3 people (67%) found this review helpful","67","2","3","0","0"
"http://steamcommunity.com/profiles/76561198051302161/recommended/372350/","76561198051302161","ZackVixACD","http://steamcommunity.com/profiles/76561198051302161/","342 products in account","This game is pretty much you playing as the Train in the McBeth stage of Star Fox 64.\nIt is fun","May 31","true","4.0"," 2 of 3 people (67%) found this review helpful","67","2","3","0","1"
"http://steamcommunity.com/profiles/76561198067692851/recommended/372350/","76561198067692851","Kvothe's lute","http://steamcommunity.com/profiles/76561198067692851/","133 products in account","(This is my boyfriend's account)  I never play video games and I loved playing this!  So much fun :)","June 3","true","0.5"," 2 of 3 people (67%) found this review helpful","67","2","3","0","0"
"http://steamcommunity.com/profiles/76561197976630398/recommended/372350/","76561197976630398","DirtyDipsy","http://steamcommunity.com/profiles/76561197976630398/","45 products in account","Really fun game and for the price i was suprised at how polished it is. A few bugs are around which the devs have aknowledged but nothing too serious. The art style and overall feel to the game is great, would recommend if you like tower defense games or similar types especially considering the price.","May 31","true","1.2"," 3 of 5 people (60%) found this review helpful","60","3","5","0","0"
"http://steamcommunity.com/id/dimtree/recommended/372350/","dimtree","Dimtree#1124","http://steamcommunity.com/id/dimtree/","210 products in account","Very fun and enjoyable game. An interesting new twist on the traditional tower defence.\n\nPros:\n\nArt style is nice, animations are smooth\nMusic is catchy\nUpgrades and progression is balanced and well done.\n\nCons:\n\nVoice acting isn\'t awesome at times, especially with certain characters. The accents seem a tad forced.\nCompleting certain objectives extremely early seems to break the game sometimes.\nBecomes somewhat of a grind towards end-game. Nothing excessive, but there nonetheless.\n\nOverall, I thoroughly enjoyed the game. Hats off to the dev team for the well-polished and enjoyable experience.","May 31","true","2.2"," 3 of 5 people (60%) found this review helpful","60","3","5","0","0"
"http://steamcommunity.com/profiles/76561198031531926/recommended/372350/","76561198031531926","Fort_master","http://steamcommunity.com/profiles/76561198031531926/","189 products in account","A fun little game that is quick and a good time waster.\n\nMy only problems with it where the voice acting and, speaking as a steam locomotive enthusiest, the locomotive design for the train. Other then that a fun little game!","May 31","true","0.3"," 5 of 9 people (56%) found this review helpful","56","5","9","0","0"
"http://steamcommunity.com/profiles/76561198308354360/recommended/372350/","76561198308354360","nckarch","http://steamcommunity.com/profiles/76561198308354360/","1 product in account","Amazing game!! It's really easy to get the hang of and a fun way to pass time. Would recommend!","May 31","true","3.7"," 2 of 4 people (50%) found this review helpful","50","2","4","0","0"
"http://steamcommunity.com/id/ThelilHoser/recommended/372350/","ThelilHoser","ThelilHoser","http://steamcommunity.com/id/ThelilHoser/","32 products in account","♥♥♥♥in rock on ♥♥♥♥♥es!","June 1","true","0.4"," 1 of 2 people (50%) found this review helpful","50","1","2","0","0"
"http://steamcommunity.com/profiles/76561198028431676/recommended/372350/","76561198028431676","Jeff","http://steamcommunity.com/profiles/76561198028431676/","64 products in account","Definitely worth the money, super fun game!","June 1","true","7.2"," 1 of 2 people (50%) found this review helpful","50","1","2","0","0"
"http://steamcommunity.com/profiles/76561198002657915/recommended/372350/","76561198002657915","HalJ","http://steamcommunity.com/profiles/76561198002657915/","149 products in account","This isn\'t usually my style of game, but I figured I\'d give it a try, and I\'m glad I did. The train upgrading is fun, missions make each level more interesting, and the style is cool.\n\nOn the negative side, I\'d say the boss battles are too easy, but I did also make sure to be fully upgraded before each one.\n\nAlso wanted to add that the linux support is a big plus. I probably wouldn't have bought the game without it.","June 1","true","6.0"," 2 of 4 people (50%) found this review helpful","50","2","4","0","0"
