"url","reviewerUsername","reviewerDisplayName","reviewerUrl","reviewerProductsCount","reviewText","date","recommended","hoursPlayed","voteText","helpfulPercent","votesHelpful","votesTotal","votesFunny","commentsCount"
"http://steamcommunity.com/profiles/76561198034062675/recommended/410210/","76561198034062675","Ky3","http://steamcommunity.com/profiles/76561198034062675/","219 products in account","Huge potential for it's genre >> Falls horribly, horribly flat.  Controls - which I could not find in game either for reference or to remap - are garbage, tracks are glitchy, and the render distance is laughable.  I pray to the game gods that something great can be made from this, but it needs work.  A lot of work.  I mean, seriously, this is bad.  It should be called "Driving Drunk Simulator".  I mean, my gods...\n\nIf you are feeling brave; left and right arrow keys turn.  X is the "gas".  Z activates powerups.  I couldn't find anything else...\n\nDev, if you are going to fix it, please do.  I'll keep an eye on this for updates simply because I love this kind of game and it has POTENTIAL to be good.  It's just NOT.","December 31, 2015","false","0.2"," No ratings yet","0","0","0","0","0"
"http://steamcommunity.com/profiles/76561198022228263/recommended/410210/","76561198022228263","Psymanski","http://steamcommunity.com/profiles/76561198022228263/","363 products in account","Absolute rubbish. Tried the first stage twice encountered numerous bugs and game just doesnt play well.\n\nBought for 14c so was worth it just for the trading cards.","January 1","false","4.1"," No ratings yet","0","0","0","0","0"
"http://steamcommunity.com/id/marcelohcortez/recommended/410210/","marcelohcortez","MasterBaite","http://steamcommunity.com/id/marcelohcortez/","449 products in account","Terrible game. No configuration allowed. It doesn't say the controls. The 'car' doesn't turn, it can make you sick. Bought it to get the cards and earn some money. One of the worst games I ever played.","January 1","false","1.6"," No ratings yet","0","0","0","0","0"
"http://steamcommunity.com/id/DGMpayne/recommended/410210/","DGMpayne","DGM-payne","http://steamcommunity.com/id/DGMpayne/","1174 products in account","A tutorial would be nice...or some kind of in-game menu with control/settings options...or any kind of fun to be had.\n\nPros:\n\nThe ships look kinda cool I guess.\n\nCons:\n\nToo many to list.\n\n\nThe fact that you can 1st place any race in about a minute by moving back and forth over the finish line right from the start of the race is a pretty good indication that this game isn't worth much of your time I think.\n\n\nFinally, I dedicate this review to the fine folks of the review and guide sections who posted the controls - I would have been lost without you.\n\n(I also spent more time typing out this review than I ever wish to waste in this game again.)","January 1","false","1.7"," No ratings yet","0","0","0","0","0"
"http://steamcommunity.com/id/icydreamer/recommended/410210/","icydreamer","TrampledFlower","http://steamcommunity.com/id/icydreamer/","43 products in account","it sucks","January 1","false","3.9"," No ratings yet","0","0","0","0","0"
"http://steamcommunity.com/id/dginio/recommended/410210/","dginio","dginio.fr/l4d2","http://steamcommunity.com/id/dginio/","15 products in account","Nothing good in this.","January 1","false","1.6"," No ratings yet","0","0","0","0","0"
"http://steamcommunity.com/id/SylntCrane/recommended/410210/","SylntCrane","Sylnt Crane","http://steamcommunity.com/id/SylntCrane/","154 products in account","This is easily one of the worst racing games I have ever played. While I can excuse the mediocre graphics and the bland music, the gameplay kills any enjoyment you can have with this game. Your ship constantly accelerates and decelerates on its own while you are holding down the X button. Turning successful is very hard to accomplish. Not even the enemies can turn properly. There are no brakes in this game and the boosts only hurt your chances of making a turn. However, you need to use the boosts in order to win.\n\nTo sum up the gameplay of this game in one word, it is boring. I was fighting the controls and the layout of the track more than I was fighting against the other ships. Speaking of the other ships, I hardly saw them at all during my races. After the 2nd lap or so, everyone moves at a constant pace. No one is passing anyone nor will the 1st place ship give up their lead to me.\n\nOverall, I don’t recommend this game to anyone. There isn’t anything redeemable about it.\n","January 1","false","2.3"," No ratings yet","0","0","0","0","0"
"http://steamcommunity.com/id/Waspinator1998/recommended/410210/","Waspinator1998","Fenraldr Bloodfang","http://steamcommunity.com/id/Waspinator1998/","140 products in account","TL;DR - If the "thumbs up" sign for the recommend option on this review means I can can shove said thumb up the developer's ♥♥♥♥♥♥, then yes, I recommend this game. Otherwise...\n\nGameplay:\nI've only played a solid seventeen minutes of Ampersand; the rest is me idling for trading cards so I can make a profit off of this abortion. It doesn't reveal to you the utterly enigmatic controls: left and right arrow keys to turn, X to boost, and Z to use power-ups. You have to get "points" to advance to the next stage which requires placing in the top-three of a given race...which is impossible thanks to the absolutely sluggish controls. So essentially, you're grinding for points on the same two tracks on the starter grid in order to finally progress. Also, I don't know if you have to use the points to purchase vehicles, but the vehicle selection screen outright does not function. If you do indeed have to use points to unlock vehicles, there is no such indication. Furthermore, the powerups are awful; you get a two-second boost ability that does practically nothing, some lock-on machinegun that does even less in the way of destruction than the Death Star in Return of the Jedi, landmines that are more detrimental to yourself than others, a shield that breaks more quickly than your father's condom, and a rocket launcher that, surprise, launches rockets. Your ship also has some arbitrary health system that gets chipped away by taking damage from volleys of enemy pea shooters and ramming into walls--the later of which is inevitable thanks to the aforementioned wacky controls. Essentially, my most recent encounter with a red light at a main-street intersection was a more action-packed racing experience than Ampersand.\n\nStory:\nYou are a bored 17-year-old male who watches more pr0nz than television and wanted to buy a slipshod racing game as a joke. You come to regret your ill-advised decision until you tap into your inner Jew and realize you can profit off of the transaction by selling Ampersand's trading cards and promptly refunding it.\n\nGraphics:\nThis is a PS1 port. Don't let anyone tell you otherwise.\n\nOverall:\nThis game gave me breast cancer even though I'm a dude.\n2/10","January 1","false","1.7"," No ratings yet","0","0","0","0","0"
"http://steamcommunity.com/profiles/76561198167542006/recommended/410210/","76561198167542006","GoldToonLink","http://steamcommunity.com/profiles/76561198167542006/","11 products in account","Controls are unclear to say the least, handling is awful, and to top it all off, there's no settings whatsoever! Only buy this for the trading cards, and nothing else!","December 30, 2015","false","1.1"," No ratings yet","0","0","0","0","0"
"http://steamcommunity.com/id/KommenMTG/recommended/410210/","KommenMTG","Kommen","http://steamcommunity.com/id/KommenMTG/","112 products in account","This game is only useful as a means of getting cards for badges. There is no menu for the game and no context given at all. When you start up the game it has you select a set of tracks (perhaps difficulty?), an individual track, and a vehicle (although it looked like it only had one vehicle option at first). There were no prompts for controls given at all. If I have to look outside of the game to find out even the most basic of controls... that game shouldn't have made it off the developer's pc. I'm amazed that this is even on Steam.","December 27, 2015","false","5.1"," No ratings yet","0","0","0","0","0"
"http://steamcommunity.com/id/Denkostears/recommended/410210/","Denkostears","Allis","http://steamcommunity.com/id/Denkostears/","154 products in account","I almost feel bad judging this since it's so obviously not a finished product, but then again it's presented as such and so the only option I have is to call it the awful toxic waste that it is. I'd get a refund but I can't be bothered for 0,14€ - which still isn't low enough of a price for the "game" to be worth purchasing.","December 27, 2015","false","0.1"," No ratings yet","0","0","0","0","0"
"http://steamcommunity.com/id/Jumashuggah/recommended/410210/","Jumashuggah","Juma","http://steamcommunity.com/id/Jumashuggah/","310 products in account","This game is terrible. Thank god I got it for free and farm its trading cards :D","February 23","false","5.3"," No ratings yet","0","0","0","0","0"
"http://steamcommunity.com/id/seiroxDDD/recommended/410210/","seiroxDDD","♛ Chuck Norris","http://steamcommunity.com/id/seiroxDDD/","18 products in account","BAD","February 21","false","1.8"," No ratings yet","0","0","0","0","0"
"http://steamcommunity.com/profiles/76561198044883671/recommended/410210/","76561198044883671","HoneyBadger","http://steamcommunity.com/profiles/76561198044883671/","27 products in account","no settings in game to adjust keybindings or any other settings, clunky gameplay and many glitches. Not particularly challenging or enjoyable for long play.","January 2","false","0.1"," No ratings yet","0","0","0","0","0"
"http://steamcommunity.com/id/reinoud/recommended/410210/","reinoud","GlowdUp","http://steamcommunity.com/id/reinoud/","680 products in account","It's not finished in any possible way. It's not fun, it's not fast, it's not fun to play. Menus are missing, textures are taken straight out of 2001. Ugh this game is just terrible. Don't buy it.","January 2","false","0.1"," No ratings yet","0","0","0","0","0"
"http://steamcommunity.com/profiles/76561198141116635/recommended/410210/","76561198141116635","G187","http://steamcommunity.com/profiles/76561198141116635/","10 products in account","Don't get me wrong,the game is TRASH.But the Trading Cards it gave me though,I made an insane profit of 0.01. Only buy it if it's on sale (0.14e).","January 2","true","2.3"," No ratings yet","0","0","0","0","0"
"http://steamcommunity.com/profiles/76561198201658249/recommended/410210/","76561198201658249","BEERBEEROSA","http://steamcommunity.com/profiles/76561198201658249/","273 products in account","Ampersand is my first game I buy on 2016 sale, game is hilarious and is worth all money I give 0,14e, I suggest for all  to buy this game ! I also got 0,30e card drops in total from this AWESOME game !\n\np.s. If you wanna be first always just return back and pass start 5 times, and you always WIN ;)","January 2","true","1.9"," No ratings yet","0","0","0","0","0"
"http://steamcommunity.com/profiles/76561198034625351/recommended/410210/","76561198034625351","5p00k13_5k313t0n","http://steamcommunity.com/profiles/76561198034625351/","10 products in account","You can't beat free money. 10/10 -IGN","January 2","true","1.8"," No ratings yet","0","0","0","0","0"
"http://steamcommunity.com/id/Jesuswithanawp/recommended/410210/","Jesuswithanawp","Squidski","http://steamcommunity.com/id/Jesuswithanawp/","347 products in account","This game really isn't that bad. I mean, I got it for $0.15, and I think it was worth it.\n\nIt's not really good, but it's pretty mediocre.","January 2","true","3.6"," No ratings yet","0","0","0","0","0"
"http://steamcommunity.com/id/Yummyspoot/recommended/410210/","Yummyspoot","Yummyspoot","http://steamcommunity.com/id/Yummyspoot/","490 products in account","Some games come with a tutorial to teach you how to play the game. Others do not. This is one that does not. Paid 14 cents in hopes I could sell the trading cards for a balance of 0 spent.\n\nAudio stopped playing randomly through a racing track.\nNo tutorial. Spent about a minute at starting line trying to find the button.\nNon-existent menu. Just goes straight to game.\nNo indicator of how to get new vehicles.\n\nJust no.","January 3","false","0.2"," No ratings yet","0","0","0","0","0"
"http://steamcommunity.com/id/mrbrazos/recommended/410210/","mrbrazos","Я бухой, блять","http://steamcommunity.com/id/mrbrazos/","308 products in account","This game was so ♥♥♥♥ing bad.","February 11","false","3.1"," No ratings yet","0","0","0","0","0"
"http://steamcommunity.com/id/Blaqwulf/recommended/410210/","Blaqwulf","Blaqwulf","http://steamcommunity.com/id/Blaqwulf/","86 products in account","FOR THE CARDS! ....when its not $1","February 4","false","4.8"," No ratings yet","0","0","0","0","0"
"http://steamcommunity.com/id/KITTvsKARR/recommended/410210/","KITTvsKARR","⎛⎝   KARR   ⎠⎞","http://steamcommunity.com/id/KITTvsKARR/","799 products in account","It's "Wipeout" from the PS1.  But it's a TERRIBLE Wipeout.\n\nYour ship doesn't actually go where you are pointing.  I mean it does, but when you corner and you would expect your ship to point in that direction and momentum slowly moves you that way... it doesn't.   You still point the other way but you move weirdly to the one side.\n\nNo controls page.  No options.  Nothing!    No tutorial.   The first course is incredibly hard, but it's made worse by the bad control systems.\n\nThe only reason i have hours in the game is the cards.","February 6","false","2.6"," No ratings yet","0","0","0","0","0"
"http://steamcommunity.com/profiles/76561198082147294/recommended/410210/","76561198082147294","Proxy-senpai","http://steamcommunity.com/profiles/76561198082147294/","382 products in account","Hey this game is cheap, I can get cards for this.\nDON'T.\nEven that doesn't work. I have over 5 hours in this game and Steam stopped registering at 26 minutes.\nAlso, the controls are terrible and the draw distance is ridiculously short for such an ugly game.\n\nIf you got it already, you can win every race by going backwards a bit and going through the finish line, until the game gets bugged on that part as well. By the way, there is no button that makes you go backwards.\n\nDon't even bother.","February 13","false","2.5"," No ratings yet","0","0","0","0","0"
"http://steamcommunity.com/id/one-big-weed/recommended/410210/","one-big-weed","solid meme cunt","http://steamcommunity.com/id/one-big-weed/","138 products in account","Gameplay\n+  Ultra-realistic racing simulation that has a ton of levels to explore.\n+  Great online multiplayer with servers that never crashes.\n+  A really touching story that lasts at least 40 hours.\n\nGraphics\n+  Stunning next gen graphics like no other game.\n+  Works perfect with VR.\n-  Can lag a bit on older PCs because of the graphics.\n\nMusic and sounds\n+  Truly awesome soundtrack.\n+  Immersive sound effects that makes you feel like you're there.\n\nIn conclusion this game is really bad but you can make money by buying it and selling cards.","January 2","true","1.1"," No ratings yet","0","0","0","0","0"
"http://steamcommunity.com/profiles/76561198038233544/recommended/410210/","76561198038233544","Deivis","http://steamcommunity.com/profiles/76561198038233544/","496 products in account","No options, no information on controls, looks terrible, plays terrible.\nJust one question: Did they even try?","February 11","false","4.9"," No ratings yet","0","0","0","0","0"
"http://steamcommunity.com/id/IBSkittles/recommended/410210/","IBSkittles","[PureZHackeez] Pedro/Tyler","http://steamcommunity.com/id/IBSkittles/","34 products in account","I think this game could have a chance. If they allow controllers, add in multiplayer, ease up the sensitivity (Or allow the user to adjust it) also have a pause menu. Thats really it, a tutorial would also be nice c;","February 15","true","0.7"," No ratings yet","0","0","0","0","0"
"http://steamcommunity.com/profiles/76561198251866452/recommended/410210/","76561198251866452","Howtobecool101","http://steamcommunity.com/profiles/76561198251866452/","11 products in account","I con olny move side to side not forward ar backward","February 14","true","0.2"," No ratings yet","0","0","0","0","0"
"http://steamcommunity.com/profiles/76561198055915632/recommended/410210/","76561198055915632","殺せんせー","http://steamcommunity.com/profiles/76561198055915632/","114 products in account","Steamulator","March 1","false","4.0"," No ratings yet","0","0","0","0","0"
"http://steamcommunity.com/profiles/76561198028307114/recommended/410210/","76561198028307114","gkflyboy","http://steamcommunity.com/profiles/76561198028307114/","136 products in account","Well, it was only 50 cents, so it is essentially an app that you would normally buy on your phone or tablet but for your PC. Looking at it from that perspective, it is great, runs well on my older (but decent) laptop. Really, it is not like Fast Racing Neo for Wii U or Wipeout HD for PS3, but then you didn't pay for one. Great for less than $1.","March 1","true","0.2"," No ratings yet","0","0","0","0","0"
"http://steamcommunity.com/profiles/76561198048637410/recommended/410210/","76561198048637410","PIggy","http://steamcommunity.com/profiles/76561198048637410/","125 products in account","Bad","March 8","false","0.2"," No ratings yet","0","0","0","0","0"
"http://steamcommunity.com/id/RedbeardOfOz/recommended/410210/","RedbeardOfOz","Redbeard.wp","http://steamcommunity.com/id/RedbeardOfOz/","955 products in account","Ampersand is a game where you speed around a race track in a vehicle which looks like a small jet.\nAvoid bumping into walls, and try to collect the bonuses that appear on the track.\n\nThere are no "game options" settings. When you hit "Esc" to go to the main menu, you simply just exit the game.\nThere is nothing to tell you what the game controls are, and certainly nowhere for you to change the controls.\n\nHowever, thanks to the power of the internet, here are the controls for the game:\nx = accelerate\narrow left  = turn left\narrow right = turn right\nz =enable bonus\n\nNot much to it.\nIt might amuse someone who likes racing games; however, there are far better racing games out there.\nIf this game is on special for 20 cents, buy it, play it for half an hour, and then throw it away.","February 20","false","3.7"," No ratings yet","0","0","0","0","0"
"http://steamcommunity.com/profiles/76561198208188047/recommended/410210/","76561198208188047","Coffee cat","http://steamcommunity.com/profiles/76561198208188047/","44 products in account","Definitely not the best wipeout clone out there.  Fun for a few minutes but only if youc an get it for under $1","April 5","true","0.6"," No ratings yet","0","0","0","0","0"
"http://steamcommunity.com/profiles/76561198167542006/recommended/410210/","76561198167542006","GoldToonLink","http://steamcommunity.com/profiles/76561198167542006/","11 products in account","Controls are unclear to say the least, handling is awful, and to top it all off, there's no settings whatsoever! Only buy this for the trading cards, and nothing else!","December 30, 2015","false","1.1"," No ratings yet","0","0","0","0","0"
"http://steamcommunity.com/id/DeeMKrieG/recommended/410210/","DeeMKrieG","DeeM","http://steamcommunity.com/id/DeeMKrieG/","53 products in account","♥♥♥♥ing ♥♥♥♥","December 30, 2015","false","0.2"," No ratings yet","0","0","0","0","1"
"http://steamcommunity.com/id/hobro/recommended/410210/","hobro","Kitster Chanchani Banai","http://steamcommunity.com/id/hobro/","113 products in account","This game is Audiosurf meets F-Zero meets 15 frames a second.","December 30, 2015","false","1.7"," No ratings yet","0","0","0","0","0"
"http://steamcommunity.com/id/lazarow25/recommended/410210/","lazarow25","Lazarow25","http://steamcommunity.com/id/lazarow25/","77 products in account","Gave it a shot and played map  a few times. From that I can say I like the visuals of the game but the controling of the card or whatever it is, is very difficult. best thing about this game is probobly the trading card. Sorry developer, but i do NOT recommend this game to my friends on steam.","December 31, 2015","false","3.1"," No ratings yet","0","0","0","0","0"
"http://steamcommunity.com/profiles/76561198136906425/recommended/410210/","76561198136906425","Arculst","http://steamcommunity.com/profiles/76561198136906425/","52 products in account","The American Dream.\nBuy it, leave it open\nsell cards for profit.\nAll while sitting on your ♥♥♥ doing nothing\n'MURICA!","January 1","true","1.7"," No ratings yet","0","0","0","0","0"
"http://steamcommunity.com/profiles/76561198044883671/recommended/410210/","76561198044883671","HoneyBadger","http://steamcommunity.com/profiles/76561198044883671/","27 products in account","no settings in game to adjust keybindings or any other settings, clunky gameplay and many glitches. Not particularly challenging or enjoyable for long play.","January 2","false","0.1"," No ratings yet","0","0","0","0","0"
"http://steamcommunity.com/id/SylntCrane/recommended/410210/","SylntCrane","Sylnt Crane","http://steamcommunity.com/id/SylntCrane/","154 products in account","This is easily one of the worst racing games I have ever played. While I can excuse the mediocre graphics and the bland music, the gameplay kills any enjoyment you can have with this game. Your ship constantly accelerates and decelerates on its own while you are holding down the X button. Turning successful is very hard to accomplish. Not even the enemies can turn properly. There are no brakes in this game and the boosts only hurt your chances of making a turn. However, you need to use the boosts in order to win.\n\nTo sum up the gameplay of this game in one word, it is boring. I was fighting the controls and the layout of the track more than I was fighting against the other ships. Speaking of the other ships, I hardly saw them at all during my races. After the 2nd lap or so, everyone moves at a constant pace. No one is passing anyone nor will the 1st place ship give up their lead to me.\n\nOverall, I don’t recommend this game to anyone. There isn’t anything redeemable about it.\n","January 1","false","2.3"," No ratings yet","0","0","0","0","0"
"http://steamcommunity.com/id/TobeyM/recommended/410210/","TobeyM","Eric "Eazy-E" Wright","http://steamcommunity.com/id/TobeyM/","293 products in account","No instructions, no nothing. My ♥♥♥♥♥ stuck in the microwave.","December 23, 2015","false","2.8"," No ratings yet","0","0","0","0","0"
"http://steamcommunity.com/profiles/76561198013636526/recommended/410210/","76561198013636526","I`m too FAT to rush","http://steamcommunity.com/profiles/76561198013636526/","175 products in account","Didnt understand the game at all. First of all i couldn found how to fly. There was no control showed. Had to push all the buttons till i find one working.\n","March 18","false","5.4"," No ratings yet","0","0","0","0","0"
"http://steamcommunity.com/profiles/76561198055915632/recommended/410210/","76561198055915632","殺せんせー","http://steamcommunity.com/profiles/76561198055915632/","114 products in account","Steamulator","March 1","false","4.0"," No ratings yet","0","0","0","0","0"
"http://steamcommunity.com/profiles/76561198028307114/recommended/410210/","76561198028307114","gkflyboy","http://steamcommunity.com/profiles/76561198028307114/","136 products in account","Well, it was only 50 cents, so it is essentially an app that you would normally buy on your phone or tablet but for your PC. Looking at it from that perspective, it is great, runs well on my older (but decent) laptop. Really, it is not like Fast Racing Neo for Wii U or Wipeout HD for PS3, but then you didn't pay for one. Great for less than $1.","March 1","true","0.2"," No ratings yet","0","0","0","0","0"
"http://steamcommunity.com/profiles/76561198048637410/recommended/410210/","76561198048637410","PIggy","http://steamcommunity.com/profiles/76561198048637410/","125 products in account","Bad","March 8","false","0.2"," No ratings yet","0","0","0","0","0"
"http://steamcommunity.com/id/RedbeardOfOz/recommended/410210/","RedbeardOfOz","Redbeard.wp","http://steamcommunity.com/id/RedbeardOfOz/","955 products in account","Ampersand is a game where you speed around a race track in a vehicle which looks like a small jet.\nAvoid bumping into walls, and try to collect the bonuses that appear on the track.\n\nThere are no "game options" settings. When you hit "Esc" to go to the main menu, you simply just exit the game.\nThere is nothing to tell you what the game controls are, and certainly nowhere for you to change the controls.\n\nHowever, thanks to the power of the internet, here are the controls for the game:\nx = accelerate\narrow left  = turn left\narrow right = turn right\nz =enable bonus\n\nNot much to it.\nIt might amuse someone who likes racing games; however, there are far better racing games out there.\nIf this game is on special for 20 cents, buy it, play it for half an hour, and then throw it away.","February 20","false","3.7"," No ratings yet","0","0","0","0","0"
"http://steamcommunity.com/profiles/76561198095424346/recommended/410210/","76561198095424346","Neight","http://steamcommunity.com/profiles/76561198095424346/","63 products in account","Just because a game is cheep, does not mean you should buy it. Lesson learned.","January 28","false","0.2"," No ratings yet","0","0","0","0","0"
"http://steamcommunity.com/id/vosich/recommended/410210/","vosich","HazardActivity","http://steamcommunity.com/id/vosich/","7 products in account","Bad","January 4","false","0.1"," No ratings yet","0","0","0","0","0"
