"url","reviewerUsername","reviewerDisplayName","reviewerUrl","reviewerProductsCount","reviewText","date","recommended","hoursPlayed","voteText","helpfulPercent","votesHelpful","votesTotal","votesFunny","commentsCount"
"http://steamcommunity.com/profiles/76561198084910075/recommended/410210/","76561198084910075","ChrominX","http://steamcommunity.com/profiles/76561198084910075/","53 products in account","I simply cannot recommend this game.\n\nThis game, as already pointed out, has too many issues. No tutorial or guide of any sorts, unorthodox and uncustomisable controls, the races are too hard with no adjustable difficulty, and so many game-breaking bugs for such a small game. I like the art style and music, but that's purely personal preference. I bought this because, despite the mixed reviews, I thought it would be fun to farm the trading cards, but if you're planning on doing the same: DON'T, especially if it's not on sale. After 20 minutes and 5 crashes I refunded it instead.","December 24, 2015","false","0.3"," 1 person found this review helpful","0","1","1","0","0"
"http://steamcommunity.com/id/warlockjay99/recommended/410210/","warlockjay99","「warlockjay99」","http://steamcommunity.com/id/warlockjay99/","136 products in account","Seriously, F*ck this game.\nfirst of all, i know this is a cheap game and i bought it on sale, but that doesn't make up for how horrible it is.\n\ncons:>every turn slows you down, but the bots don't slow down.\n>every time you only even TOUCH the border, your speed hits almost 0.\n>with every blue speed trigger on the ground, you will most definetly hit a wall so it only slows you down.\n>don't even get me started on the bugs and glitches...\n>the worst part? the game doesn't even tell you the controlls, you just spawn in the race, with no clue what to to.\n\npros:>bought it for €0,14, got cards\n>€0,08 per card\n>get €0,24 back\n>€0,10 profit\n\nTL;DR: bad game, only buy on sale make profit trough cards","December 28, 2015","false","11.2"," 1 person found this review helpful","0","1","1","0","0"
"http://steamcommunity.com/id/SmileYoureWhite/recommended/410210/","SmileYoureWhite","Daddy Bernie","http://steamcommunity.com/id/SmileYoureWhite/","105 products in account","No menus, no settings, no control listings, vehicles handle in an inconsistent manner.\n0/10, not worth the 14 cents i payed for it.","December 28, 2015","false","0.1"," 1 person found this review helpful","0","1","1","0","0"
"http://steamcommunity.com/id/cjhunter/recommended/410210/","cjhunter","CJ HUNTER","http://steamcommunity.com/id/cjhunter/","401 products in account","Is it that hard to display the key bindings somewhere ? Don't like guessing, so this is not recommended.","December 28, 2015","false","1.6"," 1 person found this review helpful","0","1","1","0","0"
"http://steamcommunity.com/profiles/76561198084050417/recommended/410210/","76561198084050417","Dweligan","http://steamcommunity.com/profiles/76561198084050417/","92 products in account","I DON'T KNOW HOW TO GO WTF WTF WTF WTF!","December 29, 2015","false","3.8"," 1 person found this review helpful 1 person found this review funny","0","1","1","0","0"
"http://steamcommunity.com/id/cheshirezcat/recommended/410210/","cheshirezcat","SUPA HOT FIRE","http://steamcommunity.com/id/cheshirezcat/","169 products in account","its like the opposite of Big Rigs,You cant win this game,even tho if u manage to win,i'm sure its going to take a long time to master,i better play Crash Team Racing than this game,\n\nAnd the MINE its really sucks,you cant see it until you are in front of it and when you already notice it,BOOM,you hit the mine,i have hit the mine and i  get out of the track and i cant do nothing for 30 secs,then suddenly i get back to the track,\n\nonly buy this game for the trading cards","December 29, 2015","false","3.5"," 1 person found this review helpful","0","1","1","0","0"
"http://steamcommunity.com/id/SundownKid/recommended/410210/","SundownKid","SundownKid","http://steamcommunity.com/id/SundownKid/","459 products in account","I will say that the concept of the game has a ton of potential, it feels like a basic clone of F-Zero GX with boosts, boost panels, and weapons.\n\nHowever, the execution is lacking, as it feels more like an early Alpha version than a full game.\n\nSome of the major issues with the game:\n- No controller support, only keyboard controls. Most people use controllers for racing games.\n- No options at all, for binding the controls, etc.\n- Graphics are PS1 level.\n- Very unforgiving, if you hit a wall once it slows you down to nothing and you usually cant regain your place.\n- The physics are wonky, if you hit a boost it goes straight in that direction instead of being able to drift around corners.\n\nIt's a nice proof of concept but it needs a lot more work before it can be a decent game.","December 29, 2015","false","3.3"," 1 person found this review helpful","0","1","1","0","0"
"http://steamcommunity.com/id/marky11/recommended/410210/","marky11","mark is better than u","http://steamcommunity.com/id/marky11/","58 products in account","Pressing escape exits the game instantly with no confirmation. With controls, X and Z each do 3 things: X does thrust, speed up and move forward. Z does booster, close postgame screen and use item. This is confusing at times.\n\nPlus, gthis game is packed with bugs, random teleportations & crashes. The volume can randomly increase massively.\n\nGood for farming cards, however.\n\n2/10\n\nArcade racing game, btw","December 29, 2015","false","4.0"," 1 person found this review helpful","0","1","1","0","0"
"http://steamcommunity.com/id/saucyraichu/recommended/410210/","saucyraichu","Saucy Raichu","http://steamcommunity.com/id/saucyraichu/","159 products in account","Some of the worst controls i've ever seen in the game, not to mention they're never pointed out to you.\n\nSome of the boost pads are really badly designed, they're placed right around corners which means as you're turning, you'll hit the boost pad, slamming into the wall, or you won't hit it at all, which means you can't beat the AI players.","January 5","false","3.7"," 1 person found this review helpful","0","1","1","0","0"
"http://steamcommunity.com/id/jakepw/recommended/410210/","jakepw","PapistPaw","http://steamcommunity.com/id/jakepw/","64 products in account","I was playing on the linear racing track the game gives you. I was on a lap, making a turn, and it suddenly said "Wrong Way".\nSince I was going in the direction of the line, I can only imagine the game was commenting on how I was living my life at that very moment.\n\n& Not enough ampersand.","January 4","false","0.2"," 1 person found this review helpful 1 person found this review funny","0","1","1","0","0"
"http://steamcommunity.com/id/loadsofdosh/recommended/410210/","loadsofdosh","loadsamoney","http://steamcommunity.com/id/loadsofdosh/","70 products in account","shovelware","January 9","false","4.0"," 1 person found this review helpful","0","1","1","0","0"
"http://steamcommunity.com/id/shadowspadeza/recommended/410210/","shadowspadeza","ShadowSpadeZA","http://steamcommunity.com/id/shadowspadeza/","597 products in account","Definitely do not buy!","January 7","false","3.9"," 1 person found this review helpful","0","1","1","0","0"
"http://steamcommunity.com/id/TheNinthMasterOfSquids/recommended/410210/","TheNinthMasterOfSquids","squidmaster9","http://steamcommunity.com/id/TheNinthMasterOfSquids/","35 products in account","Three letters- WTF?! The graphics were glitchy, the menu is crap, the cars are impossible to control. I can understand how I got this game for 14¢.","February 17","false","2.3"," 1 person found this review helpful","0","1","1","0","0"
"http://steamcommunity.com/id/TinyDreamYT/recommended/410210/","TinyDreamYT","Risa-San","http://steamcommunity.com/id/TinyDreamYT/","70 products in account","I want to commit suicide now....thanks.","December 24, 2015","false","4.3"," 1 person found this review helpful","0","1","1","0","0"
"http://steamcommunity.com/id/noobaim1/recommended/410210/","noobaim1","Duane!","http://steamcommunity.com/id/noobaim1/","11 products in account","I really dont like this game, the steering is weird. Also it was hard to find the controls at first","January 15","false","0.9"," 1 person found this review helpful","0","1","1","0","3"
"http://steamcommunity.com/id/Pokenin/recommended/410210/","Pokenin","Pokenin","http://steamcommunity.com/id/Pokenin/","279 products in account","This is just an awful, boring game.\nI hoped that this game would be somewhat decent. Hey, it's cheap, not well known. I wanted to try it out and see if it was at least alright.\nIt's not at all alright. This is worse than most games on early access. You don't even get any controls! I had to go to the community hub on this game just to try and figure out how to accelerate. Eventually I figured out how it's the X button, with left and right arrow keys to move.\nThe graphics aren't good either. Graphics aren't everything, especially for cheaper games. But being a ♥♥♥♥ game and not even having decent graphics? ♥♥♥♥ that. Don't pick up this game unless someone gifts it for you, or if it's on sale for less than 50 cents and you want some cards.\nTL;DR : It ♥♥♥♥ing sucks, don't bother with it.\nHopefully the devs will make a better game. I honestly hate seeing lesser known devs not get the popularity or sales that they deserve. This could've had potential. ♥♥♥♥, if it was an F-Zero Clone I would've bought it! This is just sad though.","February 4","false","2.1"," 1 person found this review helpful","0","1","1","0","0"
"http://steamcommunity.com/id/StinkOfDeath/recommended/410210/","StinkOfDeath","StinkOfDeath","http://steamcommunity.com/id/StinkOfDeath/","108 products in account","This game is so great I gave it to my friend as a joke!","January 4","false","0.2"," 1 person found this review helpful 1 person found this review funny","0","1","1","0","0"
"http://steamcommunity.com/id/kikazzez/recommended/410210/","kikazzez","kikazzez ⎝\˚ㄥ˚\⎞","http://steamcommunity.com/id/kikazzez/","33 products in account","If you think of buying it, just don't.","February 18","false","3.4"," 2 of 3 people (67%) found this review helpful","67","2","3","0","0"
"http://steamcommunity.com/profiles/76561198062084173/recommended/410210/","76561198062084173","19te Gosling","http://steamcommunity.com/profiles/76561198062084173/","27 products in account","Bad controls. No tutorial. Bad graphics. Only around two tracks max. You can only play like one vehicle.\n\nBad game is bad.","March 4","false","0.3"," 2 of 3 people (67%) found this review helpful","67","2","3","0","0"
"http://steamcommunity.com/id/animusfurandi/recommended/410210/","animusfurandi","Animus Furandi","http://steamcommunity.com/id/animusfurandi/","1585 products in account","Finally, an answer for all of us who wondered what Wipeout would be like if it were completely mediocre. There are a lot of things missing from Ampersand that should be present in any respectable racing game. Hell, there are a lot of things missing from Ampersand that should be present in any game that involves driving, period. A common complaint I hear about this game is that there's no tutorial or manual explaining the function of the buttons or powerups. This is true, and a very valid concern, but I find it much more concerning that Ampersand eschews basic functions of driving such as braking or reversing. Considering an easy 25% of the speed boosts on these tracks will slam you directly into a wall, these would have been helpful things to include. If there's anything nice to be said about Ampersand, it's that it is at least priced in proportion to its quality.","March 24","false","2.7"," 2 of 3 people (67%) found this review helpful","67","2","3","0","0"
"http://steamcommunity.com/id/maccattack369/recommended/410210/","maccattack369","GARY BUSEY","http://steamcommunity.com/id/maccattack369/","30 products in account","oh HELL NO!\nSeriously dont even consider this game, no options, full of glitches, totally ♥♥♥♥♥♥♥♥ controls (x to slightly accelerate and arrows to slow you down and make you face a different direction). just another 10 minute half developed game that was thrown on steam to get us all to leave and go back to Good Old Games.","April 29","false","0.1"," 2 of 3 people (67%) found this review helpful","67","2","3","0","0"
"http://steamcommunity.com/id/ditzz/recommended/410210/","ditzz","DiTzZ","http://steamcommunity.com/id/ditzz/","307 products in account","This is so bad in every single way possible; not even worth buying on sale, you will have no fun with it! It honestly doesn't even deserve a review.\n\nThe one and only reason to acquire this game would be for the trading cards.","April 4","false","2.4"," 2 of 3 people (67%) found this review helpful","67","2","3","0","0"
"http://steamcommunity.com/id/DorbanDurbawak/recommended/410210/","DorbanDurbawak","The Elusive Dancing Iguana","http://steamcommunity.com/id/DorbanDurbawak/","135 products in account","Oh my god, what an awful game. There is no point to the racing, no real progression or goals, the controls are awful (I didn't know for the longest time how to move forward) The graphics are subpar, the bots are way way better than you, the courses are mundaine. On the upside, when i bought this, the game was cheaper than the total of the trading cards I got, but thats not the case anymore so god, dont buy this game. Unless you like really bad games that is.","May 19","false","1.9"," 2 of 3 people (67%) found this review helpful","67","2","3","0","0"
"http://steamcommunity.com/profiles/76561198135878699/recommended/410210/","76561198135878699","tqwert19","http://steamcommunity.com/profiles/76561198135878699/","126 products in account","I do not recommend this game","April 17","false","3.5"," 3 of 5 people (60%) found this review helpful","60","3","5","0","0"
"http://steamcommunity.com/id/Adrenaline_AddicT/recommended/410210/","Adrenaline_AddicT","AdD!cT","http://steamcommunity.com/id/Adrenaline_AddicT/","320 products in account","I ve played good games\nI ve played bad games\nI ve played worst games\nThis is one of worst games I ever played\nonly good thing is cards, full prize is 0,99 euros, I bought for 0,14 and still to much\nI kinda like race games but this I dunno\nI cant play this game cause everything works fine until I start race then I see distance and black screen\n\n+pros\n+trading cards\n\n-cons\n-no option menu\n-you need time to figure even if you race in blackscreen, how to drive\n-graphic , I see nice black color\n\nIf you wanna buy this game dont\ngame not worth 1 euro, even on sale u need sell trading cards\n","January 2","false","2.3"," 4 of 7 people (57%) found this review helpful","57","4","7","0","0"
"http://steamcommunity.com/id/lazerlord/recommended/410210/","lazerlord","lazerlord","http://steamcommunity.com/id/lazerlord/","442 products in account","Its not good. Got it to crash in the first 10 minutes. It was only 59 cents, but its not worth it.","October 20, 2015","false","0.1"," 6 of 11 people (55%) found this review helpful","55","6","11","0","0"
"http://steamcommunity.com/id/Awsomesuce/recommended/410210/","Awsomesuce","Genknox","http://steamcommunity.com/id/Awsomesuce/","87 products in account","Bought the game for 17 cents then played for 27 mins the got refunded 10/10 would refund agian","December 29, 2015","true","0.5"," 9 of 17 people (53%) found this review helpful 6 people found this review funny","53","9","17","6","0"
"http://steamcommunity.com/id/faris_nyan/recommended/410210/","faris_nyan","DrNYAN","http://steamcommunity.com/id/faris_nyan/","36 products in account","Cards Cards Cards","January 15","false","3.6"," 2 of 4 people (50%) found this review helpful 1 person found this review funny","50","2","4","0","0"
"http://steamcommunity.com/id/Tyler-21k/recommended/410210/","Tyler-21k","Tyler-2k16","http://steamcommunity.com/id/Tyler-21k/","342 products in account","just get the cards","December 30, 2015","false","3.8"," 1 of 2 people (50%) found this review helpful 1 person found this review funny","50","1","2","0","0"
"http://steamcommunity.com/profiles/76561198001139990/recommended/410210/","76561198001139990","SimKim","http://steamcommunity.com/profiles/76561198001139990/","2382 products in account","Trading Card Simulator 2016Would farm for cards again 0/10","January 14","false","3.4"," 1 of 2 people (50%) found this review helpful 1 person found this review funny","50","1","2","0","0"
"http://steamcommunity.com/profiles/76561198061694551/recommended/410210/","76561198061694551","Hackcraft","http://steamcommunity.com/profiles/76561198061694551/","49 products in account","The game doesn't even work... Can't get past the first screen because none of the buttons work and it doesn't fit my screen.","January 30","false","3.8"," 1 of 2 people (50%) found this review helpful 1 person found this review funny","50","1","2","0","0"
"http://steamcommunity.com/id/anthonyormerod/recommended/410210/","anthonyormerod","anthony.ormerod","http://steamcommunity.com/id/anthonyormerod/","10 products in account","Oh god, Its bad. Just buy it on sale for the trading cards","April 25","false","7.0"," 2 of 4 people (50%) found this review helpful 1 person found this review funny","50","2","4","0","1"
"http://steamcommunity.com/id/LookyTheDog/recommended/410210/","LookyTheDog","Looky","http://steamcommunity.com/id/LookyTheDog/","68 products in account","Way better then Dota2","January 2","true","5.3"," 2 of 4 people (50%) found this review helpful 1 person found this review funny","50","2","4","0","0"
"http://steamcommunity.com/id/animegirlsarentreal/recommended/410210/","animegirlsarentreal","Novale","http://steamcommunity.com/id/animegirlsarentreal/","23 products in account","♥♥♥♥ you austen for gifting me this\n","March 14","true","0.2"," 4 of 8 people (50%) found this review helpful 1 person found this review funny","50","4","8","0","1"
"http://steamcommunity.com/id/Sticki_/recommended/410210/","Sticki_","The Rarest pepe","http://steamcommunity.com/id/Sticki_/","16 products in account","The most MLG game. I don't know why it has so many haters.","December 29, 2015","true","2.6"," 8 of 17 people (47%) found this review helpful 4 people found this review funny","47","8","17","4","0"
"http://steamcommunity.com/id/TheDreadedAndy/recommended/410210/","TheDreadedAndy","The Dreaded Andy","http://steamcommunity.com/id/TheDreadedAndy/","365 products in account","Never before have I played a game as amazing as this one. It starts off with a clear tutorial that is loads of fun, and then launches into arcade gameplay that sets the bar for every game like it. Not only does this game give F-Zero AX a run for its money, but it also single-handedly made me stop playing every other game I owned. I cannot recommend this game enough. If you only pick up one game during the steam holiday sale, make it this one!","December 29, 2015","true","1.0"," 6 of 13 people (46%) found this review helpful 13 people found this review funny","46","6","13","13","0"
"http://steamcommunity.com/id/SuperJazza/recommended/410210/","SuperJazza","Jazza","http://steamcommunity.com/id/SuperJazza/","55 products in account","Gave me stage 4 cancer before i could even launch the game 10/10. Definitely worth killing my self for.","December 31, 2015","true","0.2"," 5 of 11 people (45%) found this review helpful 8 people found this review funny","45","5","11","8","0"
"http://steamcommunity.com/profiles/76561198122241353/recommended/410210/","76561198122241353","BlueFulcon","http://steamcommunity.com/profiles/76561198122241353/","72 products in account","10/10 can play while paused\n\n( ͡° ͜ʖ ͡°)","December 27, 2015","true","0.2"," 2 of 5 people (40%) found this review helpful","40","2","5","0","0"
"http://steamcommunity.com/id/steamuser2003/recommended/410210/","steamuser2003","C Jay","http://steamcommunity.com/id/steamuser2003/","180 products in account","It's ok, it was good to be free: D","January 5","true","4.0"," 2 of 5 people (40%) found this review helpful","40","2","5","0","0"
"http://steamcommunity.com/profiles/76561198094803808/recommended/410210/","76561198094803808","VahidSlayerOfAll","http://steamcommunity.com/profiles/76561198094803808/","575 products in account","not that bad","January 10","true","4.5"," 2 of 5 people (40%) found this review helpful 1 person found this review funny","40","2","5","0","0"
"http://steamcommunity.com/id/jamiedacow/recommended/410210/","jamiedacow","✪ Jamie ♛","http://steamcommunity.com/id/jamiedacow/","28 products in account","still better than fallout 4","March 30","false","1.4"," 1 of 3 people (33%) found this review helpful","33","1","3","0","0"
"http://steamcommunity.com/profiles/76561198075558542/recommended/410210/","76561198075558542","Sunman","http://steamcommunity.com/profiles/76561198075558542/","73 products in account","Very good for its price, i picked this up for 17 cents on the steam winter sale, it is reminesent of the old game Wipeout As in the futuristic racing game. I would even buy for 99 cents. Great for if you have little money and want something new and innovation. About negative reviews i dont know what people were expecting for 99 cents xD","January 17","true","1.3"," 1 of 3 people (33%) found this review helpful","33","1","3","0","0"
"http://steamcommunity.com/id/EnglishTeacherPlays/recommended/410210/","EnglishTeacherPlays","Mr. Jacobs","http://steamcommunity.com/id/EnglishTeacherPlays/","414 products in account","Hooray for mobile ports that forget to PORT the controls.\nTHis game sucks.\n\nhttps://www.youtube.com/watch?v=1OvJtDXxI4o","December 2, 2015","false","0.1"," 0 of 1 people (0%) found this review helpful","0","0","1","0","0"
"http://steamcommunity.com/profiles/76561198098883940/recommended/410210/","76561198098883940","IMTOOGUD4u","http://steamcommunity.com/profiles/76561198098883940/","26 products in account","Why is this not free?\n\nGet in the game no options or help for controls.\n\nStart games. Bots ALOT faster than you and the the turning in this game is AWFUL.\n\n-10/10000\n\nWell... $2 gone.","December 12, 2015","false","0.1"," 0 of 1 people (0%) found this review helpful","0","0","1","0","0"
"http://steamcommunity.com/profiles/76561198252991578/recommended/410210/","76561198252991578","Bradley","http://steamcommunity.com/profiles/76561198252991578/","4 products in account","Positive","December 11, 2015","false","0.3"," 0 of 1 people (0%) found this review helpful","0","0","1","0","0"
"http://steamcommunity.com/id/AlphaBlad3/recommended/410210/","AlphaBlad3","AlphaBlade|CSGORAIN.US","http://steamcommunity.com/id/AlphaBlad3/","6 products in account","How to make a the worst racing game ever.\n\nStep 1: Put no where in the game, how to play it\nStep 2: Put absouletly terrible controls\n\nGuess what? Ampersand achieved those two steps.","December 23, 2015","false","4.7"," 0 of 1 people (0%) found this review helpful","0","0","1","0","0"
"http://steamcommunity.com/id/Inponity/recommended/410210/","Inponity","White","http://steamcommunity.com/id/Inponity/","204 products in account","I had to 'WAIT' 5 ♥♥♥♥ing minutes to write this review.","January 1","false","0.1"," 0 of 1 people (0%) found this review helpful","0","0","1","0","0"
"http://steamcommunity.com/id/fussbodenschliefmaschinenever/recommended/410210/","fussbodenschliefmaschinenever","Beavernuts","http://steamcommunity.com/id/fussbodenschliefmaschinenever/","188 products in account","the trading cards were good","March 18","true","14.0"," 0 of 1 people (0%) found this review helpful","0","0","1","0","0"
"http://steamcommunity.com/profiles/76561198079567054/recommended/410210/","76561198079567054","NoelTheSizzler","http://steamcommunity.com/profiles/76561198079567054/","86 products in account","Bought as a card machine and still don't have any trading cards. There is literally no reson to play it...","December 26, 2015","false","1.3"," 0 of 1 people (0%) found this review helpful","0","0","1","0","0"
"http://steamcommunity.com/id/ruben_eduardo/recommended/410210/","ruben_eduardo","ruben_eduardo","http://steamcommunity.com/id/ruben_eduardo/","118 products in account","Don't bother, the controls are all messed up,they give you no information or even a good main menu.\nCould be alot better, and also the addtion of achivements might attract more attention.\n\n4/10","January 12","false","6.7"," 0 of 1 people (0%) found this review helpful","0","0","1","0","0"
"http://steamcommunity.com/profiles/76561198079653699/recommended/410210/","76561198079653699","Moo Dog.Jpeg","http://steamcommunity.com/profiles/76561198079653699/","120 products in account","Well hard to explain\nthe game doesnt tell you the controls so\nx is forward and z is for items\nbut this game give you the joy of when you beat the bots due to the fact it seam to like to walls a little to much\nrating 3/10 not ign","January 7","true","0.6"," 0 of 1 people (0%) found this review helpful","0","0","1","0","0"
"http://steamcommunity.com/id/RDash5001/recommended/410210/","RDash5001","RDash5001","http://steamcommunity.com/id/RDash5001/","54 products in account","best game i've ever played","January 29","false","1.0"," 0 of 1 people (0%) found this review helpful","0","0","1","0","0"
"http://steamcommunity.com/id/AlphaBlad3/recommended/410210/","AlphaBlad3","AlphaBlade|CSGORAIN.US","http://steamcommunity.com/id/AlphaBlad3/","6 products in account","How to make a the worst racing game ever.\n\nStep 1: Put no where in the game, how to play it\nStep 2: Put absouletly terrible controls\n\nGuess what? Ampersand achieved those two steps.","December 23, 2015","false","4.7"," 0 of 1 people (0%) found this review helpful","0","0","1","0","0"
