"url","reviewerUsername","reviewerDisplayName","reviewerUrl","reviewerProductsCount","reviewText","date","recommended","hoursPlayed","voteText","helpfulPercent","votesHelpful","votesTotal","votesFunny","commentsCount"
"http://steamcommunity.com/id/murderizor/recommended/410210/","murderizor","Oga","http://steamcommunity.com/id/murderizor/","209 products in account","controls Because the game tells you exactly how to control your ship I tought I'd post it here\nX = Thrust / Speed up / Forward\nZ = Booster / Use Item / Close postgame screen\nArrow Left = Left\nArrow Right = Right\nEscape = Exit / Quit (no confirmation)\n\nIt looks like a nice arcade racing game, until you actually start.\nThe game is filled with bugs, crashes and random teleportations, the soundtrack might change and the volume might quadriple while this happens VOLUME WARNING\n\nOnly buy the game when on discount to sell/farm trading cards, no other reason to buy it.\n\n2/10 Horrible game","December 21, 2015","false","2.7"," 124 of 131 people (95%) found this review helpful 17 people found this review funny","95","124","131","17","0"
"http://steamcommunity.com/profiles/76561198077385864/recommended/410210/","76561198077385864","MaitreFraisier","http://steamcommunity.com/profiles/76561198077385864/","1514 products in account","*Holiday Sales 2015*\n\n-Buy it\n-Farm Cards\n-Sell Cards\n\nEarn more than 0,14€","December 23, 2015","true","2.1"," 163 of 207 people (79%) found this review helpful 105 people found this review funny","79","163","207","105","8"
"http://steamcommunity.com/profiles/76561198108148057/recommended/410210/","76561198108148057","Mongoloid Mike","http://steamcommunity.com/profiles/76561198108148057/","1033 products in account","What is wrong with these people at PiGravity?  Another game from them with no menu, escapeis the same as Alt-F4, no explanation of the controls anywhere, and no tutorial.  So you press start, the race starts, and you just sit there not knowing what button to press to make the car move.","December 5, 2015","false","11.3"," 99 of 119 people (83%) found this review helpful 6 people found this review funny","83","99","119","6","3"
"http://steamcommunity.com/id/Hamstring95/recommended/410210/","Hamstring95","Runescape is my favourite anime","http://steamcommunity.com/id/Hamstring95/","126 products in account","Don't even buy it as a joke","December 21, 2015","false","0.4"," 68 of 83 people (82%) found this review helpful 34 people found this review funny","82","68","83","34","6"
"http://steamcommunity.com/id/Asa4/recommended/410210/","Asa4","BnN","http://steamcommunity.com/id/Asa4/","109 products in account","Still trying to win the first race :C","December 21, 2015","false","2.9"," 60 of 73 people (82%) found this review helpful 37 people found this review funny","82","60","73","37","4"
"http://steamcommunity.com/id/wangholes/recommended/410210/","wangholes","Wangholes","http://steamcommunity.com/id/wangholes/","60 products in account","It wouldnt really be worth writing a review if it worked, but it doesn't work if you have a keyboard/mouse set up. Graphics are sub par and not even tweakable at all, for there isn't an options menu. Just a heads up since im the first dude reviewing this. I won't go off on losing 60 cents, this game is cheap but infinitely too expensive in theory, seeing as it doesn't work. It looks kind of fun but maybe I'm just stupid. Good luck and hopefully the dev can come up with something.","October 19, 2015","false","0.2"," 51 of 64 people (80%) found this review helpful 6 people found this review funny","80","51","64","6","5"
"http://steamcommunity.com/id/shinryu_steam/recommended/410210/","shinryu_steam","Shinryu","http://steamcommunity.com/id/shinryu_steam/","909 products in account","This game is not worth the purchase. Even at the 0.59c I bought it for it's not worth it! There is absolutely no options menu so you cannot check controls, or change display settings or turn off the god awful music. Steering is all over the place and there is no controller support either, just the letters X and Z on your keyboard and the left/right arrow keys to move. If it was an early access game I'd say ok, it needs more work, but since this is the final product...I cannot recommend it at all. I can't believe Steam allow games like this to exist on the platform. For the love of god, run fast, run far, stay away from this game!","October 19, 2015","false","0.1"," 35 of 41 people (85%) found this review helpful 2 people found this review funny","85","35","41","2","0"
"http://steamcommunity.com/profiles/76561198143248797/recommended/410210/","76561198143248797","C_Mill24","http://steamcommunity.com/profiles/76561198143248797/","83 products in account","Move along. There's nothing here but a racing game with terrible controls, poor graphics, terrible user interface, and devoid of fun.","November 27, 2015","false","0.1"," 31 of 35 people (89%) found this review helpful 1 person found this review funny","89","31","35","0","0"
"http://steamcommunity.com/id/Momni/recommended/410210/","Momni","Romni","http://steamcommunity.com/id/Momni/","34 products in account","This is the most insulting gift i've ever received.\n","December 30, 2015","false","0.1"," 23 of 24 people (96%) found this review helpful 19 people found this review funny","96","23","24","19","0"
"http://steamcommunity.com/id/devl5180/recommended/410210/","devl5180","Mikey","http://steamcommunity.com/id/devl5180/","19 products in account","I would have rather spent my 16 cents on black licorice","December 21, 2015","false","0.2"," 19 of 21 people (90%) found this review helpful 19 people found this review funny","90","19","21","19","0"
"http://steamcommunity.com/profiles/76561198218094865/recommended/410210/","76561198218094865","PennyReviews","http://steamcommunity.com/profiles/76561198218094865/","49 products in account","This is not a good game and should be avoided.\n\nThe initial artwork makes you think this would be a decent title.  I loved the Wipeout games, is this a modern take on it?  Sadly not even close.\n\nThe first problem I encountered is that there are no insturctions on how to play.  I selected the first of what appears to be 3 stages, got in a match against three other racers... and sat there.  The other ships zoomed off, and I was pressing my keyboard and mouse trying to figure out how to move.  I quit out of the game and looked for help, tutorial, anything.  In the end trial and error by pressing every key on my keyboard I discovered "X" was the magic key I needed to press to figure out how to go forward.\n\nAlright, so no controls are posted.  That isn't a great sign.  Still, now I finally know how to play.  Get ready world.... Wipeout clone here I come.\n\nOh, no, wait.  You only can choose from one ship.  The controls are sluggish.  The tracks are boring.  Wipeout used the vertical element in its track design to great effect.  This game has only a few race tracks to try, and they are bland and no fun to race on.  And at all times I felt like I was fighting poor controls.\n\nThe worst part though in this generic knockoff tragedy, worse than the lack of instructions, the poor controls, the bland music and the boring race tracks.... is that even once you take the time to really master the game it isn't fun or satisfying.  Hitting an enemy ship with a weapon does not have any sort of satisfying impact.  Hitting boost arrows never leads to those "breakneck speed chains" you would expect in a title like this.  In fact, at the end of the day you don't seem to be able to go very fast at all.... in a racing game.\n\nI liked some of the particle effects, and it about ends there.  This game is a chore to learn how to play, and even once you do there is no fun waiting to be had in the mastery of the mechanics.\n\n1/10","May 14","false","3.3"," 16 of 17 people (94%) found this review helpful","94","16","17","0","0"
"http://steamcommunity.com/id/TheMysticBanana/recommended/410210/","TheMysticBanana","TheMysticBanana","http://steamcommunity.com/id/TheMysticBanana/","49 products in account","My favorite part was uninstalling it","December 29, 2015","false","0.1"," 12 of 12 people (100%) found this review helpful 20 people found this review funny","100","12","12","20","0"
"http://steamcommunity.com/profiles/76561198156808864/recommended/410210/","76561198156808864","tqwert21","http://steamcommunity.com/profiles/76561198156808864/","336 products in account","Terrible","December 24, 2015","false","2.2"," 16 of 20 people (80%) found this review helpful","80","16","20","0","0"
"http://steamcommunity.com/id/VinationJonttu/recommended/410210/","VinationJonttu","Jonttu","http://steamcommunity.com/id/VinationJonttu/","65 products in account","Pretty cheap game... But not that good.\n4/10","December 24, 2015","false","11.9"," 11 of 12 people (92%) found this review helpful 7 people found this review funny","92","11","12","7","0"
"http://steamcommunity.com/id/odanrc/recommended/410210/","odanrc","Itohiro","http://steamcommunity.com/id/odanrc/","182 products in account","It looks like a N64 game, but it has terrible controls and the ship just slips around. Besides, there are no tutorials, whatsoever, so you have to go through all buttons and reviews to find out their unusual controls selection.","December 21, 2015","false","7.5"," 10 of 11 people (91%) found this review helpful 1 person found this review funny","91","10","11","0","0"
"http://steamcommunity.com/id/MasterJakeStudios/recommended/410210/","MasterJakeStudios","MasterJakeStudios","http://steamcommunity.com/id/MasterJakeStudios/","81 products in account","i don't wanna talk about it","December 30, 2015","false","0.1"," 10 of 11 people (91%) found this review helpful 5 people found this review funny","91","10","11","5","0"
"http://steamcommunity.com/id/monsieur_owly/recommended/410210/","monsieur_owly","Monsieur-Owly","http://steamcommunity.com/id/monsieur_owly/","860 products in account","Easily the worst WipEout-clone that came out from Steam Greenlight's but*hole since a while!\n\nMy comment sounds really harsh I admit it and I'm sorry if I offended some of you but Ampersand really needs more work!\n\nFirst of all, the game features no option menu. Simply a minimalistic white background with triangles and numbers. I had to figure out by myself what I was looking at. There's absolutely nothing intuitive in the game. Not to mention the fact that we're obliged to sign up on the devs website before even thinking about starting a race... in a game that doesn't even features multiplayer. But the worst is yet to come...\n\nSince there is no option menu I also had figure out the controls by myself. Left arrow and Right arrow are for changing direction but what about acceleration? Isn't it the Up arrow? No it's not! Why would you use the Up arrow in the first place!? Thanks to Shinryu's review on Steam I've been able to start a race without wasting too much time looking for the acceleration key (which is "X" by the way).\n\nThe two first races I played simply look bland, short and repetitive (be careful not to race out of the map). Thanks to the very narrow track there is simply no way to complete the 5 laps without hitting the wall every 5 seconds. Here, the steering would need some tweaking.\n\nThe visuals are minimalistic at best but at least they fit with the sci-fi setting. During the race I experienced some framerate drops which is unacceptable for a game that looks like a game made in the late 90's (the early 3D cards era). But since it's using the Unity engine, what was I expecting? Also, if you use video capture software the game will freeze during recording.\n\nOverall, I would only recommend this game if you're a masochist that promote "no taste gaming" like me.\n\nI dare you to watch this 3 minutes video to the end!\n\nhttps://www.youtube.com/watch?v=wcMBeg7KRZ4\n\nRating:\n2.0","October 21, 2015","false","2.6"," 15 of 21 people (71%) found this review helpful 2 people found this review funny","71","15","21","2","4"
"http://steamcommunity.com/id/pedroknoller/recommended/410210/","pedroknoller","pedroknoller","http://steamcommunity.com/id/pedroknoller/","243 products in account","This game is a ♥♥♥♥, i just open because it's have cards. The nave moves like a ♥♥♥♥ in a\n♥♥♥♥♥house! (out of control!!)","February 21","false","7.7"," 7 of 7 people (100%) found this review helpful","100","7","7","0","1"
"http://steamcommunity.com/profiles/76561198133769938/recommended/410210/","76561198133769938","Snake Plissken","http://steamcommunity.com/profiles/76561198133769938/","1094 products in account","what?\n\n\n\n\nin the flying ♥♥♥♥\n\n\n\n\n\nis this complete and UTTER BS of a game??\n\n♥♥♥♥ you dev","December 25, 2015","false","3.1"," 9 of 11 people (82%) found this review helpful 4 people found this review funny","82","9","11","4","1"
"http://steamcommunity.com/id/canarslan12/recommended/410210/","canarslan12","CanArslan12","http://steamcommunity.com/id/canarslan12/","175 products in account","I can open but I can't play :(","December 18, 2015","false","4.0"," 9 of 11 people (82%) found this review helpful","82","9","11","0","0"
"http://steamcommunity.com/id/bogsleypig/recommended/410210/","bogsleypig","sadb☹y","http://steamcommunity.com/id/bogsleypig/","122 products in account","This game has all the charm an Auschwitz Disco, the repetative and loud disco tunes echo the pain and suffering that it took to make this unholy pile of dog turds. No controls, no tutorial, no options. It really makes me sick to my stomach playing this game, I truly have no idea what is going on in this trippy mess. It took me 15 minutes to find out how to make my badly designed polygonal craft even propel itself off the of start line. After that it was a sloppy mess of no control and driving through random orbs to try and gain some kind of advantage of your opponents. I was unlucky enough to have this mess gifted to me but I beg of you do not even give this mess as a joke even to your worst of enemies, nothing is evil enough to have to endure this fever dream.","December 23, 2015","false","1.3"," 9 of 11 people (82%) found this review helpful 8 people found this review funny","82","9","11","8","0"
"http://steamcommunity.com/id/Inthechat/recommended/410210/","Inthechat","Roll.EXE  ロール","http://steamcommunity.com/id/Inthechat/","72 products in account","A friend gifted me this game. We are not friends anymore.","May 19","true","0.2"," 10 of 13 people (77%) found this review helpful 13 people found this review funny","77","10","13","13","0"
"http://steamcommunity.com/id/idontknowwhatodoasmyURLhelpme/recommended/410210/","idontknowwhatodoasmyURLhelpme","Dank Meme Generator","http://steamcommunity.com/id/idontknowwhatodoasmyURLhelpme/","34 products in account","1.Buy Ampersand during sale\n2.Open it and stay AFK\n3.Earn Steam Trading Cards\n4.Sell Steam Trading Cards\n5.$$$$$$$\n","December 29, 2015","true","12.0"," 18 of 29 people (62%) found this review helpful 7 people found this review funny","62","18","29","7","2"
"http://steamcommunity.com/id/milkycoffee/recommended/410210/","milkycoffee","Agent Milky Coffee","http://steamcommunity.com/id/milkycoffee/","262 products in account","The game bugs on second track, I go through textures or get a green screen... which cancels any chance for winning the race. The bug is unpredictible, sometimes I get a pause menu after alt-tabing back and forth to the game, sometimes it breaks for good.\n\nThere is no information about controls. You have to run through all usual keys used in games to figure it out.\n\nThis is a mobile port. They didn't even change the words like "tap here" etc. You have to use the mouse to navigate through the menu but even that is bad as you have to click very precisely on a predefined spot and not the whole shape.\n\nThere is no options menu. Can't change controls, graphics, resolution or adjust sound or music.\n\nThe only cool thing is an overall look and feeling to the game. It's not that bad, in fact I liked it but the glitches made it impossible for me to win, get points and advance in the game. The graphics are ok, some say they are ugly or outdated but to me it doesn't matter at all, I really like them. It's like a simple, old silly racing game and it's ok, but nothing more than ok. The glitches and the developers' lack of any will to at least make a decent port makes this game not worth recommending (or buying). I got it in a bundle 👍","December 6, 2015","false","1.9"," 5 of 5 people (100%) found this review helpful 1 person found this review funny","100","5","5","0","0"
"http://steamcommunity.com/id/mercenaries2009/recommended/410210/","mercenaries2009","Mercenaries2009","http://steamcommunity.com/id/mercenaries2009/","333 products in account","Imagine Mario Kart. Get that Mario Kart and start stepping in it, punching it, burning it, and then dancing on it. Whatever comes out is this game.\n\n=============================\n\nRemember when the developers said:\n"★A variety of craft to choose from, with varying stats and abilities. "\nThere's only one.\n\n"★Race on futuristic tracks with ultra realistic vehicles. "\nSo ultra realistic that your so called 'vehicles' don't even apply to physics.\n\n"★Furiously fast paced racing with awesome vehicles designed with unprecedented precision. "\nYup, so fast paced that you don't even have brakes! I mean who needs brakes anyways???\n\n"★Unlock new tracks as you progress through the game. "\nCan you even go past the first level???\n\n"★Collect different power-ups and use them to win. "\nOh sure, like 4 or 5 power-ups on the entire game and you can't even hit sh*t with 'em.\n\n"★High resolution screen support."\nAt least that is true.\n\n=============================\n\nPROS+You can profit selling cards\nCONS- Everything about this game\n\n=============================\nACTUAL REVIEW\nATTENTION: THIS GAME CAN CAUSE BUT IT IS NOT LIMITED TO THE FOLLOWING EFFECTS:\n\n> Severe Dumbness;\n> Tumors;\n> Coughing;\n> Suicidal Thoughts;\n> Headache\n\nIf you are suffering from these effects please, save your money and do not buy it... Unless you wanna profit some pennies on your Steam Wallet by selling some cards.","December 29, 2015","false","2.7"," 4 of 4 people (100%) found this review helpful 1 person found this review funny","100","4","4","0","0"
"http://steamcommunity.com/id/jibbermaster/recommended/410210/","jibbermaster","jibbermaster","http://steamcommunity.com/id/jibbermaster/","65 products in account","Ok racing game. Controls seem a little clunky, and the helath system is weird. Pickup items are hard to see what the effect will be. Level selection is not intutitive and there is not tutorial / menu options to see or customize controls.","December 6, 2015","false","2.7"," 5 of 6 people (83%) found this review helpful","83","5","6","0","0"
"http://steamcommunity.com/profiles/76561198051907568/recommended/410210/","76561198051907568","Killua #99","http://steamcommunity.com/profiles/76561198051907568/","79 products in account","The game is your basic racing game with speed boosts on track and futuristic city graphics and sound. Controls are arrow keys to steer, x to accelerate, and z to use item. It still has tap to continue on end screens from mobile port. If they added new features I'd recommend but this game is unfinished and sparse.","December 21, 2015","false","1.7"," 5 of 6 people (83%) found this review helpful","83","5","6","0","0"
"http://steamcommunity.com/id/einstein2000/recommended/410210/","einstein2000","🎶 𝓮𝓶𝓲𝓷𝓮𝓶 🎶","http://steamcommunity.com/id/einstein2000/","28 products in account","i just can say . this game sucks","December 30, 2015","false","0.1"," 5 of 6 people (83%) found this review helpful","83","5","6","0","0"
"http://steamcommunity.com/profiles/76561198025627633/recommended/410210/","76561198025627633","Heretic","http://steamcommunity.com/profiles/76561198025627633/","425 products in account","It's graphics will remind you of F-Zero X on the N64, but it plays like F-Zero: Maximum Velocity on the GBA.","October 19, 2015","false","0.1"," 20 of 35 people (57%) found this review helpful 17 people found this review funny","57","20","35","17","0"
"http://steamcommunity.com/id/RevanDaDragon/recommended/410210/","RevanDaDragon","✪Revan The Dragon✪","http://steamcommunity.com/id/RevanDaDragon/","218 products in account","This game is a huge let-down and waste of time. The controls are unlisted in the game (and they're dreadful anyway, who the ♥♥♥♥ uses Z to drive and arrows to steer?), and the actual vehicle controls are clunky as all hell. And you can't even brake!\n\nEven worst, the game's description lies!\n\n"★A variety of craft to choose from, with varying stats and abilities."\nThere's only 4, and they all feel almost exactly the same, except one just doesn't turn very fast.\n\n★Race on futuristic tracks with ultra realistic vehicles.\nI didn't know "ultra realistic vehicles" didn't have brakes.\n\n★Furiously fast paced racing with awesome vehicles designed with unprecedented precision.\nIsn't fast at all, because even when you do hit a good speed, there's a crazy-♥♥♥ sharp turn which you can't even slow down to pass well enough. And you won't even see it coming because this game has the render distance of a Nintendo DS Lite. In fact, screw that, it's got worse render distance than short-sighted person. You can barely see a few feet infront of you.\n\nAll in all... No. Just no.","December 29, 2015","false","4.0"," 6 of 8 people (75%) found this review helpful 1 person found this review funny","75","6","8","0","0"
"http://steamcommunity.com/id/Spectra________/recommended/410210/","Spectra________","9/11 Enthusiast","http://steamcommunity.com/id/Spectra________/","19 products in account","After completing the ENTIRE game, i can now give a review.\n\nSo the game starts off with Samuel D Jenson a long time mechanic who has always wanted to race. He was so sick of being in the pits of the race instead of actually racing. Well, this all changes.  On Febuary 26th 2094 Sam gets his big break. in the middle of the Spacetona 500, sponsored by Sprint and Can-Am, the driver experiences some heartbreaking tragedy as his grandmother passes away and is announced over the comms inside the ship. Feeling undetermined he pulls into the pits and resignes as driver for the m&m's car number 18. As the crew and managers scramble to find someone you volenter as the driver, and is accepted. Now the game starts when you are thrown into the race and you end up winning. 3 weeks later you find out the driver has killed himself.\n\nAfter the amazing proformance you are premoted to the driver of the m&m's car, the most laughed at and least winning car. As you do more races and earn a reputation as the saviour of m&m's, you start to get new cars and even get invited to the Sprint Galactic Cup, the most prestigious racing championship of them all.\n\nOverall the controls are well explained and well mapped, the graphics made me think i was actually there, and finally the story was so well written it was the first game to ever make me cry.\n\nOverall rating 9/11 Loved it.\n\n\n\n\nNone of this actually happens however and this game is ♥♥♥♥ 9/11","January 31","true","7.4"," 6 of 8 people (75%) found this review helpful 8 people found this review funny","75","6","8","8","0"
"http://steamcommunity.com/id/SamuLEL/recommended/410210/","SamuLEL","SamuLEL ᕦ(ò_óˇ)ᕤ","http://steamcommunity.com/id/SamuLEL/","96 products in account","This game is broken. The control scheme is very weird\nThere are no settings/options to change anything\n5 minutes into this game my screen turns green o_O http://steamcommunity.com/sharedfiles/filedetails/?id=592920369\nThe graphics are badIt could have been good... but it's not\nI rate it 2/10\n\nPS:Trotzdem danke Darki","January 4","false","0.6"," 3 of 3 people (100%) found this review helpful 3 people found this review funny","100","3","3","3","1"
"http://steamcommunity.com/id/PlasticRebel/recommended/410210/","PlasticRebel","twitch.tv/PlasticRebel","http://steamcommunity.com/id/PlasticRebel/","220 products in account","This game is not a great game. There are no controls page and there is no tutorial. Every time you get a boost and even nudge the wall slightly you lose it. When I started the game, I just was clicking around until it started a race, I still don't completely understand the main menu. When I started the game I pressed every key on my keyboard until I found out that x is to go forwards. Then it was a matter of pressing every other key on the keyboard to figure out that the left and right arrows are left and right and z is to use powerup. If there are other controls or special features, I did not discover them in my first three matches of the game. If you want to spend 14 cents on a good game, buy the 12 Labours of Hercules II: The Creten Bull, it's a much better game.","December 25, 2015","false","9.5"," 3 of 3 people (100%) found this review helpful","100","3","3","0","0"
