"url","reviewerUsername","reviewerDisplayName","reviewerUrl","reviewerProductsCount","reviewText","date","recommended","hoursPlayed","voteText","helpfulPercent","votesHelpful","votesTotal","votesFunny","commentsCount"
"http://steamcommunity.com/id/SuperGameLiam/recommended/410210/","SuperGameLiam","LiamM8","http://steamcommunity.com/id/SuperGameLiam/","135 products in account","Profit","January 3","true","2.3"," 0 of 1 people (0%) found this review helpful","0","0","1","0","0"
"http://steamcommunity.com/profiles/76561198127374444/recommended/410210/","76561198127374444","I AM NOT DANNY DEVITO","http://steamcommunity.com/profiles/76561198127374444/","42 products in account","I didn't know games could be this bad\n\n\npros-\n...\noh wait, theres nothing here\n\ncons-\n♥♥♥♥ framerate\n♥♥♥♥ graphics\n♥♥♥♥ controls\n♥♥♥♥ directions\n♥♥♥♥ maps\n♥♥♥♥ concept, really","May 8","false","2.0"," 0 of 1 people (0%) found this review helpful 2 people found this review funny","0","0","1","2","0"
"http://steamcommunity.com/id/siddnullus/recommended/410210/","siddnullus","siddNullus","http://steamcommunity.com/id/siddnullus/","3383 products in account","Game works fine using the left and right arrows for movement, z to launch powerups and x to accelerate.  Works great with a Steam controller, and I do recommend using one with the game.  Control does take some getting used to, as the game is really a mastery left and right twitch movement while not keeping the acceleration pegged constantly.","November 3, 2015","true","1.0"," 7 of 16 people (44%) found this review helpful 1 person found this review funny","44","7","16","0","0"
"http://steamcommunity.com/id/The-Network/recommended/410210/","The-Network","The Network","http://steamcommunity.com/id/The-Network/","44 products in account","Wannabe version of Wipeout. You can resell the cards you get from this and profit of them 6/10","December 25, 2015","true","7.2"," 6 of 14 people (43%) found this review helpful 3 people found this review funny","43","6","14","3","0"
"http://steamcommunity.com/id/steammemelight/recommended/410210/","steammemelight","Rogue","http://steamcommunity.com/id/steammemelight/","73 products in account","It's ok. The steering is a bit complicated and hitting the wall gats annoying, but overall its a pretty meh game, I don't see why it's getting so many negative reviews. Oh and I also bought it for 14 cents and sold the trading cards. But yeah, in summary, it's meh I guess.","December 21, 2015","true","2.5"," 4 of 10 people (40%) found this review helpful","40","4","10","0","0"
"http://steamcommunity.com/profiles/76561198023731524/recommended/410210/","76561198023731524","Grumblecorn","http://steamcommunity.com/profiles/76561198023731524/","78 products in account","If you buy it for $0.14 you can sell the cards.","December 21, 2015","true","1.7"," 3 of 8 people (38%) found this review helpful","38","3","8","0","0"
"http://steamcommunity.com/id/phaselaser/recommended/410210/","phaselaser","PhaseLaser","http://steamcommunity.com/id/phaselaser/","132 products in account",">buys game for 14 cents\n>waits until steam cards dropped\n>uninstalls the game\n>sells cards for 18 cents\n>PROFIT!","January 3","true","0.2"," 3 of 8 people (38%) found this review helpful 4 people found this review funny","38","3","8","4","1"
"http://steamcommunity.com/id/bacteriphage/recommended/410210/","bacteriphage","Bacteriophage","http://steamcommunity.com/id/bacteriphage/","136 products in account","BUY THIS ON A SALE\nFARM FOR CARDS TO SELL\n*POOF*\nEXTRA MONEY FOR YOU","December 30, 2015","true","3.7"," 2 of 6 people (33%) found this review helpful","33","2","6","0","0"
"http://steamcommunity.com/id/Removed34341231254/recommended/410210/","Removed34341231254","removed523235","http://steamcommunity.com/id/Removed34341231254/","31 products in account","*Holiday Sales 2015*\n\n-Buy it\n-Earn Badges\n-Sell badges\n\nLevel UP !","December 30, 2015","true","0.6"," 2 of 6 people (33%) found this review helpful 1 person found this review funny","33","2","6","0","0"
"http://steamcommunity.com/id/schzr/recommended/410210/","schzr","schzr","http://steamcommunity.com/id/schzr/","71 products in account","a car hit my car, that was my first move in the game *there's no tutorial in the game\n\nx for forward\nz to use bonus\n<- turn left\n-> turn right\nesc to quit, hard quit\n\nwith retro music, i was hoping to play something like one game in ps 1 but this thing turns to be harder than drive a car lol\n\nbuy only when discount!\n\nthanks to this game, i can remember the title: n2o! hahaha","December 22, 2015","true","1.9"," 1 of 4 people (25%) found this review helpful","25","1","4","0","0"
"http://steamcommunity.com/id/toxicrhino11/recommended/410210/","toxicrhino11","B Movie","http://steamcommunity.com/id/toxicrhino11/","43 products in account","how the ♥♥♥♥ do i play this game?\n","December 25, 2015","true","0.3"," 1 of 4 people (25%) found this review helpful","25","1","4","0","0"
"http://steamcommunity.com/id/dablow/recommended/410210/","dablow","EPetkov","http://steamcommunity.com/id/dablow/","146 products in account","1. Buy this game on sale for 14 cents.\n\n2. Hit Play.\n\n3. Feel bad about yourself as you can't pass level 1.\n\n4. Start hitting the mines intentionally as this will be the only action you see after all opponents are 1 lap ahead.\n\n5. Feel bad about yourself again as you can't even hit the mines intentionally.\n\n6. Rage ALT+Tab the game.\n\n7. Play (any) Hitman as mass murder to feel better.\n\n8. Sell the trading cards you got from the game while playing Hitman for 5 cents/piece and make 1 cent profit.\n\n9. Feel good about yourself, you achieved a lot today! Now you can rage quit the game.\n\n10. Never play this game again if you don't wanna feel bad about yourself again.\n\nOptional step: Buy another 14-15 cent game with trading cards and repeat the proccess.\n\n10/10 would feel bad about myself again if play it 2nd time\n\nWARNING: Masochists may feel good instead of bad!","December 29, 2015","true","2.7"," 1 of 4 people (25%) found this review helpful 2 people found this review funny","25","1","4","2","0"
"http://steamcommunity.com/id/cosmicapex/recommended/410210/","cosmicapex","Cosmic","http://steamcommunity.com/id/cosmicapex/","110 products in account","Made a 4p profit off of the cards (bought it at 11p).","December 29, 2015","true","2.4"," 1 of 4 people (25%) found this review helpful","25","1","4","0","0"
"http://steamcommunity.com/id/RipeAndWriggly/recommended/410210/","RipeAndWriggly","Saitama","http://steamcommunity.com/id/RipeAndWriggly/","143 products in account","I bought this tragedy game for $0.14 cents during the Holiday Sale.\nI idled and sold the cards for $0.21 cents.\nWith this expert strategy, I will be on the Forbes Billionaires List in roughly 14,285,714,286 years.\n\n+Game/Card flipping simulator\n-Uninstall simulator","January 2","true","2.6"," 1 of 4 people (25%) found this review helpful 1 person found this review funny","25","1","4","0","0"
"http://steamcommunity.com/id/zielwarrior/recommended/410210/","zielwarrior","|-Ziel-|","http://steamcommunity.com/id/zielwarrior/","137 products in account","Trading Card Farming Simulator 2016","January 2","true","3.9"," 1 of 4 people (25%) found this review helpful 2 people found this review funny","25","1","4","2","0"
"http://steamcommunity.com/id/killer33841/recommended/410210/","killer33841","В.И.Ленин","http://steamcommunity.com/id/killer33841/","26 products in account","sfnkdfj","November 26, 2015","false","0.1"," 0 of 2 people (0%) found this review helpful","0","0","2","0","0"
"http://steamcommunity.com/id/Traxadel/recommended/410210/","Traxadel","Traxadel","http://steamcommunity.com/id/Traxadel/","670 products in account","ew","December 6, 2015","false","1.8"," 0 of 2 people (0%) found this review helpful","0","0","2","0","0"
"http://steamcommunity.com/profiles/76561198088633971/recommended/410210/","76561198088633971","Ferrari_Power_User","http://steamcommunity.com/profiles/76561198088633971/","6 products in account","This is the game","December 25, 2015","true","3.2"," 0 of 2 people (0%) found this review helpful","0","0","2","0","0"
"http://steamcommunity.com/profiles/76561198133039092/recommended/410210/","76561198133039092","OuchMyFeelings","http://steamcommunity.com/profiles/76561198133039092/","32 products in account","best game ever 10/10\nit's so conveinent, to close the game use just press esc and there is no other comfirmation","December 23, 2015","true","0.5"," 0 of 2 people (0%) found this review helpful","0","0","2","0","0"
"http://steamcommunity.com/profiles/76561198053611843/recommended/410210/","76561198053611843","Bricav","http://steamcommunity.com/profiles/76561198053611843/","75 products in account","it's not bad. it's tough as hell, and is a lot like wipeout really. in fact i'm fairly certain that's what inspired it.","December 22, 2015","true","1.7"," 0 of 2 people (0%) found this review helpful","0","0","2","0","0"
"http://steamcommunity.com/profiles/76561198136027732/recommended/410210/","76561198136027732","SuperBaiatu`Carne","http://steamcommunity.com/profiles/76561198136027732/","31 products in account","It is a good game\n","December 27, 2015","true","2.9"," 0 of 2 people (0%) found this review helpful","0","0","2","0","0"
"http://steamcommunity.com/id/bakslash/recommended/410210/","bakslash","Bakslash","http://steamcommunity.com/id/bakslash/","23 products in account","8.1/-5 v3ry gud game shud play m0re\n\nh0p3 u engoyd me reveww","December 29, 2015","true","8.8"," 0 of 2 people (0%) found this review helpful","0","0","2","0","0"
"http://steamcommunity.com/id/garlik300/recommended/410210/","garlik300","Garlik300","http://steamcommunity.com/id/garlik300/","12 products in account","If you want earn some cents, let's buy this game!\nIt will give you three cards; let's sell that cards, and earn money :)","December 29, 2015","true","1.8"," 0 of 2 people (0%) found this review helpful","0","0","2","0","0"
"http://steamcommunity.com/id/SoapSudGaming/recommended/410210/","SoapSudGaming","soap:^)","http://steamcommunity.com/id/SoapSudGaming/","60 products in account","gifted to all my friends so that they question their own existances\n10/10","December 24, 2015","true","0.1"," 0 of 2 people (0%) found this review helpful","0","0","2","0","0"
"http://steamcommunity.com/id/Ghosts-Killer/recommended/410210/","Ghosts-Killer","Mr.Boiii","http://steamcommunity.com/id/Ghosts-Killer/","70 products in account","thanks for the trading cards\num...\nand its nice game tho","December 24, 2015","true","3.6"," 0 of 2 people (0%) found this review helpful","0","0","2","0","0"
"http://steamcommunity.com/id/TAGamerica/recommended/410210/","TAGamerica","The Aston Gamer","http://steamcommunity.com/id/TAGamerica/","7 products in account","I could not find the controls plz tell me or add a tutorial or options to show controls","December 25, 2015","true","0.2"," 0 of 2 people (0%) found this review helpful","0","0","2","0","0"
"http://steamcommunity.com/profiles/76561198100195693/recommended/410210/","76561198100195693","Virtual Virus","http://steamcommunity.com/profiles/76561198100195693/","14 products in account","Trading Card profit only :)","December 25, 2015","true","4.0"," 0 of 2 people (0%) found this review helpful","0","0","2","0","0"
"http://steamcommunity.com/id/sleepyasalways/recommended/410210/","sleepyasalways","Sleepy`","http://steamcommunity.com/id/sleepyasalways/","6 products in account","this game is pretty cool and thanks to steam for giving it a discount (y)","December 26, 2015","true","3.3"," 0 of 2 people (0%) found this review helpful","0","0","2","0","0"
"http://steamcommunity.com/id/AxaFin/recommended/410210/","AxaFin","AxaFin","http://steamcommunity.com/id/AxaFin/","136 products in account","What the ♥♥♥♥ is this ♥♥♥♥.","December 26, 2015","true","0.1"," 0 of 2 people (0%) found this review helpful","0","0","2","0","0"
"http://steamcommunity.com/id/Darkness_Dragon/recommended/410210/","Darkness_Dragon","Darkness Dragon","http://steamcommunity.com/id/Darkness_Dragon/","70 products in account","THIS GAME IS SO BAD I LOVE IT\nIts worse then bad rats and lots of other games on steam the tradeing cards are the best to. Anyway the game is buggy no directions are ever given.\nTHE VOLUME IS ON 100/10 so ear r*pe is alwase happening\nCar movement is wonky and impossible.\nIf your poor soul BOUGHT the game here are the controls\n\nX = Thrust / Speed up / Forward\nZ = Booster / Use Item / Close postgame screen\nArrow Left = Left\nArrow Right = Right\nEscape = Exit / Quit (no confirmation)\n\nNo options menu to fix the sound or graphics so modify them BEFORE you launch the game (trust me)\nAnd finally... no im done with this review ill MAKE a better game with free softwhere then play this sh*t ever again.\n-100/10 would never play unless for a joke.","December 28, 2015","true","0.4"," 0 of 2 people (0%) found this review helpful","0","0","2","0","0"
"http://steamcommunity.com/id/qwertgadgb/recommended/410210/","qwertgadgb","✪ RuKha /A/","http://steamcommunity.com/id/qwertgadgb/","141 products in account","not bad!","December 29, 2015","true","3.4"," 0 of 2 people (0%) found this review helpful","0","0","2","0","0"
"http://steamcommunity.com/profiles/76561198092667430/recommended/410210/","76561198092667430","Niflheim","http://steamcommunity.com/profiles/76561198092667430/","411 products in account","Give me the card","December 22, 2015","true","3.9"," 0 of 2 people (0%) found this review helpful","0","0","2","0","0"
"http://steamcommunity.com/id/Skylarjoe/recommended/410210/","Skylarjoe","Skylarjoe","http://steamcommunity.com/id/Skylarjoe/","26 products in account","Honest Review\nThis game...as of now, its 14 cents. It has a cool concept, a racing game, but it doesnt really work out. If their was a option to recommend this to "maybe", I would choose that, I chose "yes" simply because of how cheap it is. Now, I will go over a few of its pro's and con's\n\nPros\n-The price, as I said, currently its 14 cents\n-Cool soundtrack\n-Trading Cards\n\nCons\n-The HORRIBLE controls! x = boost and you use the arrow keys to move!\n-You can't change the controls\n-The lack of content\n-Can't really do much as this game has little to offer other than crafting a game badge for your Steam account.\n-Looks like a game made for the PS2\n\n\nSorry this review is short, the game is honestly very little. Overall, if you have a couple of cents to spend, go ahead and buy this if it's on sale.","December 28, 2015","true","3.5"," 0 of 2 people (0%) found this review helpful","0","0","2","0","0"
"http://steamcommunity.com/id/vitropia/recommended/410210/","vitropia","vitropia","http://steamcommunity.com/id/vitropia/","36 products in account","It's honestly the worst game I've ever had to play, works like it's on an N64, and seems to have no plot or instructions. Still, I was able to profit from card farming, which is really the only reason I bought it in the first place. Do not buy it if it is not on sale for under eighteen cents.","December 29, 2015","true","2.8"," 0 of 2 people (0%) found this review helpful","0","0","2","0","0"
"http://steamcommunity.com/id/HamoCorp/recommended/410210/","HamoCorp","HamoCorp","http://steamcommunity.com/id/HamoCorp/","67 products in account","This game is really cool its really hard im still trying to get to first this game is so fun and im going to keep playing","December 30, 2015","true","1.8"," 0 of 2 people (0%) found this review helpful","0","0","2","0","0"
"http://steamcommunity.com/profiles/76561198128338684/recommended/410210/","76561198128338684","SvrLeo","http://steamcommunity.com/profiles/76561198128338684/","45 products in account","die","May 8","false","3.8"," 0 of 2 people (0%) found this review helpful","0","0","2","0","0"
"http://steamcommunity.com/id/Nikolai_Kalashnikov/recommended/410210/","Nikolai_Kalashnikov","MuffinDude","http://steamcommunity.com/id/Nikolai_Kalashnikov/","198 products in account","Another ♥♥♥♥♥♥ gift...","February 12","false","0.2"," 0 of 2 people (0%) found this review helpful","0","0","2","0","2"
"http://steamcommunity.com/id/TheEmperorOfficialX2/recommended/410210/","TheEmperorOfficialX2","The Emperor Second ♛","http://steamcommunity.com/id/TheEmperorOfficialX2/","260 products in account","Nicee!","December 22, 2015","true","2.8"," 2 of 7 people (29%) found this review helpful","29","2","7","0","0"
"http://steamcommunity.com/id/CDJAndybot/recommended/410210/","CDJAndybot","CDJAndybot","http://steamcommunity.com/id/CDJAndybot/","13 products in account","This game is really cool, but seriously, .14? If a game is .99 and there's a sale, it shouldn't even participate in the sale. People are just buying it to earn steam cards. Developer, think about taking a financial class. Also I didn't have any of the problems everyone else were having, so, it's a great game!\n\nThe fact that they didn't tell you the controls is not a big deal, they are:\nx to accelerate\nz to use item and exit completed track\nleft and right to... well go left and right\nand esc to exit the game or show pause menu\nthe rest of the controls are all left mouse clicks\n\nI rate this game 7/10.\nGraphics- Futuristic world and vehicles looks amazing and cool. No typos or graphical mistakes.\nMusic- Upbeat and fast paced.\nStabilty- Didn't crash or bug out at all.\nProgression- Can play track multiple times to get more points.\nLag- Nope.\nAI- Perfect, much better than me.\nTutorial- No tutorial whatsoever.\nControls- Not that hard to learn, but movement sensitivity is a little too much.\nOriginality- Too many futuristic racer games out on the market.\nPrice- Not saleable but is in a sale for a price that basically gives it away for free.","December 28, 2015","true","0.6"," 2 of 7 people (29%) found this review helpful","29","2","7","0","0"
"http://steamcommunity.com/id/whatdoyoucallamanwithameatylaugh/recommended/410210/","whatdoyoucallamanwithameatylaugh","George Costanza","http://steamcommunity.com/id/whatdoyoucallamanwithameatylaugh/","125 products in account","So apart from the game being nearly unbeatable, it also crashes nearly everytime you almost finish a race.\n\nThere's no options menu, it doesn't tell you the controls and it's render distance is about 4 feet in front of you. It looks like trash and handles the same. It also crashes. A lot. Even if you were to beat the first level, it would probably crash before you cross the finish line. Not to mention when it crashes it flashes black and white and shows scanlines throughout the screen.\n\nSo if you want seizure giving flashing, terrible steering and an unbeatable game, buy Ampersand, after all it's only $0.14.\n\nWorst $0.14 i've ever spent.","December 23, 2015","false","0.1"," 1 of 5 people (20%) found this review helpful","20","1","5","0","0"
"http://steamcommunity.com/id/tehrutretret/recommended/410210/","tehrutretret","mailacc_1","http://steamcommunity.com/id/tehrutretret/","104 products in account","its so goood game","December 5, 2015","true","3.4"," 1 of 5 people (20%) found this review helpful","20","1","5","0","0"
"http://steamcommunity.com/id/korerat/recommended/410210/","korerat","KoreRat","http://steamcommunity.com/id/korerat/","636 products in account","I don't want to put this game down too much, for what it is its an enjoyable game.  It could use some work in places, like handeling and controls.  But I'll let this one ride on its pretty visuals.","December 9, 2015","true","4.4"," 1 of 5 people (20%) found this review helpful","20","1","5","0","0"
"http://steamcommunity.com/id/ForGamezCZ/recommended/410210/","ForGamezCZ","ForGamez CSGOEgg.com CSGOx14.com","http://steamcommunity.com/id/ForGamezCZ/","139 products in account","Totally ♥♥♥♥ed up game.\nI was just idling for cards.\nMy life is complete.","January 24","false","3.4"," 0 of 3 people (0%) found this review helpful","0","0","3","0","0"
"http://steamcommunity.com/id/noriyuke/recommended/410210/","noriyuke","Noriyuke","http://steamcommunity.com/id/noriyuke/","238 products in account","All in all its a very fun and basic version of Wipeout, different tracks, diffferent vehicles, simple controls, neat visuals, it was muted while i played so i dont know about the audio and i have not tried multiplayer in any kind of way. But for a low spec racing game similar to wipeout this is perfect.","December 5, 2015","true","0.6"," 0 of 3 people (0%) found this review helpful 1 person found this review funny","0","0","3","0","0"
"http://steamcommunity.com/profiles/76561198169046660/recommended/410210/","76561198169046660","035Nnoitora","http://steamcommunity.com/profiles/76561198169046660/","145 products in account","Nice","December 23, 2015","true","3.3"," 0 of 3 people (0%) found this review helpful","0","0","3","0","0"
"http://steamcommunity.com/id/TheEmperorOfficial/recommended/410210/","TheEmperorOfficial","The Emperor ♛","http://steamcommunity.com/id/TheEmperorOfficial/","246 products in account","Nice Game!!!","January 31","true","4.7"," 2 of 8 people (25%) found this review helpful","25","2","8","0","0"
"http://steamcommunity.com/id/SuperScore/recommended/410210/","SuperScore","SuperScore (Pentium PC)","http://steamcommunity.com/id/SuperScore/","144 products in account","F-Zero and WipEout for PC. Controls are a bit.. meh","November 3, 2015","true","3.1"," 1 of 6 people (17%) found this review helpful 1 person found this review funny","17","1","6","0","0"
"http://steamcommunity.com/profiles/76561198080280097/recommended/410210/","76561198080280097","EnGethNeer","http://steamcommunity.com/profiles/76561198080280097/","140 products in account","Seriously? What is this "program", because I don't call it a game, a joke? It steers funny, it doesn't even have a menu. Close it after 5 seconds, uninstall.","October 25, 2015","false","0.1"," 1 of 6 people (17%) found this review helpful 2 people found this review funny","17","1","6","2","0"
"http://steamcommunity.com/id/lloydrules/recommended/410210/","lloydrules","Bendy Wendy","http://steamcommunity.com/id/lloydrules/","301 products in account","This game is just to over the top. Blew up my PC while I had my ♥♥♥♥ in the fan. Would play again.","December 22, 2015","true","0.1"," 0 of 4 people (0%) found this review helpful","0","0","4","0","0"
"http://steamcommunity.com/id/badmothafucker/recommended/410210/","badmothafucker","I ♥ Guam","http://steamcommunity.com/id/badmothafucker/","23 products in account","Not kewl m8, is 3mlg5me! bad thumbses down","October 21, 2015","false","0.1"," 1 of 11 people (9%) found this review helpful","9","1","11","0","0"
"http://steamcommunity.com/id/Erichezx0rs/recommended/410210/","Erichezx0rs","E  R  (1)  X  0  R  [+]","http://steamcommunity.com/id/Erichezx0rs/","201 products in account","For $.59 I'm not hard to impress, esp with futuristic  racing vehicles and environments.\n\nIt's worth it for the art If you like this kind of stuff. People who don't recommend can't appreciate this kind of beauty.","October 22, 2015","true","2.1"," 6 of 25 people (24%) found this review helpful 3 people found this review funny","24","6","25","3","1"
"http://steamcommunity.com/id/DGMpayne/recommended/410210/","DGMpayne","DGM-payne","http://steamcommunity.com/id/DGMpayne/","1174 products in account","A tutorial would be nice...or some kind of in-game menu with control/settings options...or any kind of fun to be had.\n\nPros:\n\nThe ships look kinda cool I guess.\n\nCons:\n\nToo many to list.\n\n\nThe fact that you can 1st place any race in about a minute by moving back and forth over the finish line right from the start of the race is a pretty good indication that this game isn't worth much of your time I think.\n\n\nFinally, I dedicate this review to the fine folks of the review and guide sections who posted the controls - I would have been lost without you.\n\n(I also spent more time typing out this review than I ever wish to waste in this game again.)","January 1","false","1.7"," No ratings yet","0","0","0","0","0"
"http://steamcommunity.com/id/icydreamer/recommended/410210/","icydreamer","TrampledFlower","http://steamcommunity.com/id/icydreamer/","43 products in account","it sucks","January 1","false","3.9"," No ratings yet","0","0","0","0","0"
"http://steamcommunity.com/id/dginio/recommended/410210/","dginio","dginio.fr/l4d2","http://steamcommunity.com/id/dginio/","15 products in account","Nothing good in this.","January 1","false","1.6"," No ratings yet","0","0","0","0","0"
"http://steamcommunity.com/id/SylntCrane/recommended/410210/","SylntCrane","Sylnt Crane","http://steamcommunity.com/id/SylntCrane/","154 products in account","This is easily one of the worst racing games I have ever played. While I can excuse the mediocre graphics and the bland music, the gameplay kills any enjoyment you can have with this game. Your ship constantly accelerates and decelerates on its own while you are holding down the X button. Turning successful is very hard to accomplish. Not even the enemies can turn properly. There are no brakes in this game and the boosts only hurt your chances of making a turn. However, you need to use the boosts in order to win.\n\nTo sum up the gameplay of this game in one word, it is boring. I was fighting the controls and the layout of the track more than I was fighting against the other ships. Speaking of the other ships, I hardly saw them at all during my races. After the 2nd lap or so, everyone moves at a constant pace. No one is passing anyone nor will the 1st place ship give up their lead to me.\n\nOverall, I don’t recommend this game to anyone. There isn’t anything redeemable about it.\n","January 1","false","2.3"," No ratings yet","0","0","0","0","0"
