"url","reviewerUsername","reviewerDisplayName","reviewerUrl","reviewerProductsCount","reviewText","date","recommended","hoursPlayed","voteText","helpfulPercent","votesHelpful","votesTotal","votesFunny","commentsCount"
"http://steamcommunity.com/id/Carl625/recommended/418040/","Carl625","Carl625","http://steamcommunity.com/id/Carl625/","42 products in account","GREAT game. This game has brought me more fun than most puzzle games where they are either too simple or mind-numbingly hard. This game is just a fun perception puzzle game that mixes the hard and easy to create that "Ah Ha!" moment right as you finish the levels. The fact that it might get a level editor is just plain amazing, and makes it alone right now is better, in my opinion, than a lot of "Puzzle" games I see on here. The developers are active and listen to the community and the concept is simple, but complex at the same time. It is a type of game that you can play over and over again, and the fact that it is $3 makes that game a pretty good deal. The music is very comforting and relaxing, while the puzzles can sometimes leave you thinking. The animations are pretty smooth and the game is just very pleasing to look at. I Recommend this game for anybody bored and wanting to have maybe hours of fun and complexity for a low price.\n10/10","November 28, 2015","true","1.4"," 2 of 3 people (67%) found this review helpful","67","2","3","0","0"
"http://steamcommunity.com/id/thfx/recommended/418040/","thfx","Threeve","http://steamcommunity.com/id/thfx/","176 products in account","I enjoy this game.  So far it's not terribly complex and I enjoy the MC Escher influenced design as I followed him during my art class days.  A great steam sale value here.","November 29, 2015","true","5.4"," 3 of 5 people (60%) found this review helpful","60","3","5","0","0"
"http://steamcommunity.com/id/thfx/recommended/418040/","thfx","Threeve","http://steamcommunity.com/id/thfx/","176 products in account","I enjoy this game.  So far it's not terribly complex and I enjoy the MC Escher influenced design as I followed him during my art class days.  A great steam sale value here.","November 29, 2015","true","5.4"," 3 of 5 people (60%) found this review helpful","60","3","5","0","0"
"http://steamcommunity.com/profiles/76561198144986170/recommended/418040/","76561198144986170","Mintro","http://steamcommunity.com/profiles/76561198144986170/","38 products in account","This game is very nice and fun is messing up my head. It seems simple, but do not let that confuse you. What is good is that it is not too complicated for me, so I somehow he makes me feel smart (:","January 24","true","4.5"," 3 of 5 people (60%) found this review helpful","60","3","5","0","0"
"http://steamcommunity.com/id/Terrum/recommended/418040/","Terrum","Sunburst (Terrum)","http://steamcommunity.com/id/Terrum/","3973 products in account","A nice, calm puzzle, which has music that makes you feel better after a brain meltdown.\n\nTakes about an average of an hour to complete, nice cheap game to just kill time with - definitely recommend!","January 21","true","1.9"," 3 of 5 people (60%) found this review helpful","60","3","5","0","0"
"http://steamcommunity.com/profiles/76561198210257913/recommended/418040/","76561198210257913","Anime Collector","http://steamcommunity.com/profiles/76561198210257913/","3 products in account","This game is fun, but it is just puzzles","November 20, 2015","true","1.6"," 4 of 7 people (57%) found this review helpful","57","4","7","0","0"
"http://steamcommunity.com/profiles/76561197970475288/recommended/418040/","76561197970475288","Sabbatai","http://steamcommunity.com/profiles/76561197970475288/","186 products in account","I thought this would be like Echochrome, and it is.  Minus the ability to change your perspective.  The puzzles lose a little of the ingenuity that game had... but I had no less fun playing it.","November 24, 2015","true","0.2"," 4 of 7 people (57%) found this review helpful","57","4","7","0","0"
"http://steamcommunity.com/id/2450036061/recommended/418040/","2450036061","8K MMR Player","http://steamcommunity.com/id/2450036061/","20 products in account","It needs great imagination because all the geometrical models in game can't be true. Actually when you success, you can hardly repeat what happened. A good game to waste time.","November 19, 2015","true","0.5"," 5 of 9 people (56%) found this review helpful 1 person found this review funny","56","5","9","0","0"
"http://steamcommunity.com/profiles/76561198014161697/recommended/418040/","76561198014161697","Hyper Light Proxy","http://steamcommunity.com/profiles/76561198014161697/","188 products in account","You play as cube on an geometric acid trip.\n","January 1","true","0.6"," 5 of 9 people (56%) found this review helpful 6 people found this review funny","56","5","9","6","0"
"http://steamcommunity.com/profiles/76561198034607210/recommended/418040/","76561198034607210","avitous","http://steamcommunity.com/profiles/76561198034607210/","67 products in account","Nicely done, even as an obvious mobile port; display is plenty sufficient for its needs (but resizing display would be nice).  Levels are too easy, as I've already solved all of them, and eagerly await new ones and perhaps a level editor.  So it's also quite addictive; highly recommended.","November 19, 2015","true","1.7"," 5 of 9 people (56%) found this review helpful","56","5","9","0","0"
"http://steamcommunity.com/profiles/76561198096720137/recommended/418040/","76561198096720137","ツ [DMC]_VirGiL","http://steamcommunity.com/profiles/76561198096720137/","23 products in account","I dont take the time to write reviews, but in this case, I will send my gratitude to the developer on this visually stunning gem. Its a simple, but brilliant concept to use the Escher-type of perspective illusions as a game surface. It will be a real shame when the levels end, but MY what a great ride it has been!","November 19, 2015","true","0.4"," 5 of 9 people (56%) found this review helpful","56","5","9","0","0"
"http://steamcommunity.com/id/yasiryazici/recommended/418040/","yasiryazici","YNG","http://steamcommunity.com/id/yasiryazici/","183 products in account","finally","November 19, 2015","true","0.4"," 8 of 15 people (53%) found this review helpful 1 person found this review funny","53","8","15","0","0"
"http://steamcommunity.com/profiles/76561197988012862/recommended/418040/","76561197988012862","mendel","http://steamcommunity.com/profiles/76561197988012862/","2675 products in account","Simple labyrinth.\n\nLooks cool, plays meh. The game presents a simple labyrinth that you have to navigate; as should be obvious from the screenshots, there aren't that many branches, so the labyrinths are rather simply structured, if nicely presented. I spent ~2 hours to solve all 65 of these. The problem with this is that this would've taken even less time if the game wasn't so very slow. And I'm not even talking about the 5-second wait as you select a level that is spent watching some simple 2D animation, I'm talking about watching the red cube trundle along with an annoying electronic sound. You see, the cube moves automatically along any leg of the labyrinth once you set it in motion with a swipe of the mouse or a flick of the joystick, because unless it is at a branch it can't go anywhere else anyway, but while you can think 3 turns ahead easily, you have to watch the cube actually complete the journey. Slowly. Which bores me a lot, in fact so much so that I can only take this game in small doses or I'd get the urge to smash things.\n\nI suspect this slowness was introduced to hide the fact that there isn't really a lot to the labyrinths - if you could just swipe the cube along the legs quickly, you'd just as quickly blast through the game, which wouldn't be a problem if it had 200 levels or only cost less than a dollar (which it did in the sale).\n\nSo why would you want to play this? Besides looking cool, the labyrinths are really rather simple (so far, anyway, like I said I've completed 40 of 65), which means there isn't really any feeling of accomplishment that would offset persisting through the annoying slowness of the game which thus becomes its fatal flaw.\nUnless you want to show off by playing something that looks more like modern art than a game, there's no reason to buy this -- and if you do, you really ought to get it for your smartphone, shouldn't you?","December 1, 2015","false","2.7"," 11 of 21 people (52%) found this review helpful","52","11","21","0","3"
"http://steamcommunity.com/profiles/76561198139445185/recommended/418040/","76561198139445185","ROCKY_ToxicKiller321","http://steamcommunity.com/profiles/76561198139445185/","42 products in account","I like  concept of real mide puzzles turned into a solve it puzzle.","November 18, 2015","true","0.2"," 13 of 25 people (52%) found this review helpful 2 people found this review funny","52","13","25","2","0"
"http://steamcommunity.com/id/akleshchev/recommended/418040/","akleshchev","andreykl","http://steamcommunity.com/id/akleshchev/","124 products in account","Mind-breaking) While it does not make you think 'outside of the box' it still is a good challenge for your perception and dimentional thinking.\n\nP.S. At the very least needs timer, move counter and may be profiles.","January 7","true","1.1"," 1 of 2 people (50%) found this review helpful","50","1","2","0","0"
"http://steamcommunity.com/id/tomisha/recommended/418040/","tomisha","tomisha","http://steamcommunity.com/id/tomisha/","26 products in account","Interesting puzzle game :3","January 19","true","0.5"," 3 of 6 people (50%) found this review helpful","50","3","6","0","0"
"http://steamcommunity.com/id/ragnor/recommended/418040/","ragnor","Ragnor","http://steamcommunity.com/id/ragnor/","143 products in account","this is a really elegent puzzle game with levels built with escheresque geometry. it is clearly a mobile port but this doesn't stops you enjoy playing it at your pc. if you like puzzle games i will definitely recommend this one for you.","November 22, 2015","true","0.2"," 3 of 6 people (50%) found this review helpful","50","3","6","0","0"
"http://steamcommunity.com/id/JamJen/recommended/418040/","JamJen","Kudo","http://steamcommunity.com/id/JamJen/","80 products in account","20 minutes of this game and your going insane.","November 27, 2015","true","1.6"," 3 of 6 people (50%) found this review helpful 3 people found this review funny","50","3","6","3","0"
"http://steamcommunity.com/id/DanxerGOD/recommended/418040/","DanxerGOD","Dntn ツ #SAIFILHADAPUTA #13MEMO","http://steamcommunity.com/id/DanxerGOD/","41 products in account","Hocus Pocus, you idiots must Focus","January 22","true","0.2"," 2 of 4 people (50%) found this review helpful 4 people found this review funny","50","2","4","4","0"
"http://steamcommunity.com/id/Roguejedi791/recommended/418040/","Roguejedi791","Ashley","http://steamcommunity.com/id/Roguejedi791/","117 products in account","Goodbye sanity!","January 21","true","1.0"," 1 of 3 people (33%) found this review helpful","33","1","3","0","0"
"http://steamcommunity.com/id/Janimac05/recommended/418040/","Janimac05","Blooper ♥Alina","http://steamcommunity.com/id/Janimac05/","37 products in account","A nice little game that my girlfriend really enjoys :)\nBut I have got one question, is the data saved in the steam cloud?","April 30","true","3.6"," 0 of 1 people (0%) found this review helpful","0","0","1","0","0"
"http://steamcommunity.com/id/070801/recommended/418040/","070801","SuicidalKittens","http://steamcommunity.com/id/070801/","116 products in account","Really boring, and it's just a port from a mobile app thats free.","February 7","false","0.1"," 0 of 1 people (0%) found this review helpful","0","0","1","0","0"
"http://steamcommunity.com/profiles/76561198214631839/recommended/418040/","76561198214631839","BatKika","http://steamcommunity.com/profiles/76561198214631839/","19 products in account","The game play is really slow. I was hoping for more speed from te cube. other than that, its an ok game if you like optical illusion puzzles","February 22","false","0.2"," 0 of 1 people (0%) found this review helpful","0","0","1","0","0"
"http://steamcommunity.com/id/pyraticalventure/recommended/418040/","pyraticalventure","deimosimpact","http://steamcommunity.com/id/pyraticalventure/","76 products in account","The puzzles are simple and repetitive, and ultimately not very fun. The idea is cool for a small time, but not enough to make the game interesting.","February 26","false","0.9"," 0 of 1 people (0%) found this review helpful","0","0","1","0","0"
"http://steamcommunity.com/id/quitjob_playpoker/recommended/418040/","quitjob_playpoker","Makki","http://steamcommunity.com/id/quitjob_playpoker/","1045 products in account","Hocus is a puzzle game whose levels are based on M.C. Escher's optical illusion drawings and all incorporate impossible shapes. They are essentialy 2D mazes that give 3D impression. It is a mobile port, you can play it with mouse or gamepad. You will lose sense of direction playing this, getting dizzy is also not out of question. :) Good thing is that you can always look in which directions you can move by checking circle on top of the screen, without it aimlessly wandering around would be common. Minimalist design will let you focus on puzzles with no other distractions. Ambient music is nice, but you will probably turn it off after a while.\n\nGame has 65 levels, they took me about an hour and a half to solve which is ok, game doesn't overstay its welcome with more of the same.","May 18","true","2.7"," 0 of 1 people (0%) found this review helpful","0","0","1","0","0"
"http://steamcommunity.com/profiles/76561198025494700/recommended/418040/","76561198025494700","Wrothmonk","http://steamcommunity.com/profiles/76561198025494700/","165 products in account","Pros:\nReally interesting puzzle game. The concept is fairly well illistrated in the videos but it gets a LOT more complicated than what they show.\n\nCons:\nThe IOS version is actually cheaper than the steam version and they are exactly the same game in terms of levels. The only difference between this port and the IOS version is the possibility to use a controller and a (sort of) bigger screen. The controlls really don't matter and the screen is still stuck to the odd ratio of an iPhone screen.\n\nBuy this on sale or on the app store.","November 27, 2015","false","0.3"," 3 of 8 people (38%) found this review helpful","38","3","8","0","0"
"http://steamcommunity.com/profiles/76561198148433686/recommended/418040/","76561198148433686","MinerLeagueGamer","http://steamcommunity.com/profiles/76561198148433686/","24 products in account","While I appreciate the Monument Valley-like optical illusions, the puzzles are just way too easy and repetitive. The presentation and music is relaxation, but what was the point? There is just no value to anything I was doing, like I was wasting my time. Even for the 70-some cents I spent on it during the Autum Sale, it wasn't worth the time I used. Save your pennies for a better puzzle game. (Like Portal!)","December 25, 2015","false","0.2"," 1 of 5 people (20%) found this review helpful","20","1","5","0","0"
"http://steamcommunity.com/profiles/76561198014897336/recommended/418040/","76561198014897336","c.Shtirlic","http://steamcommunity.com/profiles/76561198014897336/","198 products in account","very simple game ;(","December 3, 2015","false","0.7"," 0 of 3 people (0%) found this review helpful","0","0","3","0","0"
"http://steamcommunity.com/profiles/76561198241309916/recommended/418040/","76561198241309916","Vlad Lennin","http://steamcommunity.com/profiles/76561198241309916/","26 products in account","Very cool concept but I wouldn't say it's actually fun.  Missing that addictive element that I like in other puzzle games.  Maybe I just have a hard time with the contradictory images but this just isnt doing it for me.  Ill update my review if my op9inion changes.  As others have said, thsi is an obvious mobile port.","November 18, 2015","false","0.6"," 8 of 29 people (28%) found this review helpful 2 people found this review funny","28","8","29","2","0"
"http://steamcommunity.com/id/mthw/recommended/418040/","mthw","mthw","http://steamcommunity.com/id/mthw/","154 products in account","was hoping this would be like Echochrome...\n\nplay EDGE instead.","November 18, 2015","false","0.3"," 3 of 25 people (12%) found this review helpful 2 people found this review funny","12","3","25","2","0"
"http://steamcommunity.com/profiles/76561198199656958/recommended/418040/","76561198199656958","Color Me Albino","http://steamcommunity.com/profiles/76561198199656958/","16 products in account","Hocus is a fantastic game that will have you trying every strategy you can think of to reach what at times appear to be imossible goals.","February 25","true","2.8"," No ratings yet","0","0","0","0","0"
"http://steamcommunity.com/profiles/76561198067073182/recommended/418040/","76561198067073182","JarJarSwag","http://steamcommunity.com/profiles/76561198067073182/","914 products in account","Really nice little game, pretty relaxing too.\n\nYou can take a good look at the puzzle and try to solve it, or you can just wander around for a few minutes until you somehow reach the "end block", however you do it, it's pretty entertaining and relaxing, great for short sessions too.","February 17","true","2.6"," No ratings yet","0","0","0","0","0"
"http://steamcommunity.com/id/moomontroll/recommended/418040/","moomontroll","M00M","http://steamcommunity.com/id/moomontroll/","15 products in account","Fun game to play when you're bored lifts the bordom and adds frustration :D","February 13","true","0.1"," No ratings yet","0","0","0","0","0"
"http://steamcommunity.com/id/ManiacalJackal/recommended/418040/","ManiacalJackal","ManiacalJackal","http://steamcommunity.com/id/ManiacalJackal/","19 products in account","This game, though it is meant to be a mobile game, is very interesting and can be easily compared with Monument Valley. I wouldn't pay the full price, just because of how simple the game really is, but I would definitely nag it during a sale.","April 3","true","1.5"," No ratings yet","0","0","0","0","0"
"http://steamcommunity.com/id/aspre777/recommended/418040/","aspre777","Aspre777","http://steamcommunity.com/id/aspre777/","676 products in account","Really solid game.\n\nDespite it obviously being a mobile port, it really is beautiful. The basic gameplay is the heart of this game. Where something so simple, yet so crafty, can keep playing in frustration. Just to prove to yourself it can be done.\n\n65 levels does seem like a lot for most games. But for Hocus, it is just enough to not get too boring, but plenty enough to provide you with 2 or 3 hours of decent gameplay.\n\nHocus seems pretty well coded, it supported my ultrawide without hassle (the content however remains central to the screen, with grey background filling in the sides) and it has v-sync enabled.\n\nIf it is on sale, I think it is a must buy/must try.\nIf you're into puzzle games and looking to try something with a little bit of a different twist to it, then yeah, full price is all good.\n\nJust needs some achievements, and trading cards and its a true $5 winner.","March 30","true","2.2"," No ratings yet","0","0","0","0","0"
"http://steamcommunity.com/id/KlutzyBubbles/recommended/418040/","KlutzyBubbles","Cheesy McPizzza","http://steamcommunity.com/id/KlutzyBubbles/","76 products in account","Pure 3D impossible shape puzzler... just my style and for anyone else that loves puzzle games they will love this game too! thanks to the fullscreen and scaling it looks a million times better on 1440p and the levels are almost endless, stuck on a level? take a break and come back to refresh your mind and feel like a brand new game has been bought for you, it just never stops. The only thing that annoys me the most is the sound when the cube is moving. Other than that this is a great game for the average(or experienced) puzzler and would be great stream playing from another device if you get bored!","March 20","true","16.0"," No ratings yet","0","0","0","0","0"
"http://steamcommunity.com/profiles/76561198135660261/recommended/418040/","76561198135660261","[CB] MusicalHB","http://steamcommunity.com/profiles/76561198135660261/","222 products in account","A fun little puzzle game. Its a nice mix of easy, hard and some that you solve by accident!","March 11","true","3.2"," No ratings yet","0","0","0","0","0"
"http://steamcommunity.com/id/rog_snm/recommended/418040/","rog_snm","ROG_SNM","http://steamcommunity.com/id/rog_snm/","61 products in account","so good and enjoyable","January 28","true","1.2"," No ratings yet","0","0","0","0","0"
"http://steamcommunity.com/id/patzivota/recommended/418040/","patzivota","patzivota","http://steamcommunity.com/id/patzivota/","68 products in account","Good ♥♥♥♥, manI Any interactive medium based on Escher's works is enough excuse to buy it by itself. I'm not saying make some ♥♥♥♥♥♥ Escher-inspired game that runs worse than a legless grandpa and sell it. You'll be torn to shreds with ♥♥♥♥♥♥ reviews and endless shame. So, don't do that. Actually do it so I can make fun of you and egg your house.\n\nBut this Escher game is pretty sweet and on point. It's simple. It's not perfect (I'd like a 'quit' button in the main menu, and a simplistic view mode that only shows you the puzzle you're currently trying to get through, instead of showing you the previous one you just beat plus the next one on the sides), but it's worth your time.\n\nYou just move a little red cube around some crazy ♥♥♥ designs man that will spin your brain juices around til it hurts. Though this game suggests using a gamepad, just pointing and clicking where you want the cube to go feels absolutly fine. Yet my left hand sits over my WASD keys just craving for some love... she'll be fine though. And keep your Xbox controller in your mom's underwear drawer where it bloody belongs. ♥♥♥♥ that ♥♥♥♥.\n\n60+ puzzles with more to come. Even after completing most of them you still won't know what the ♥♥♥♥ is going on. That's life right there, bro. That's life.\n\nMove on.\n\nAnd if you place Hocus high, well then....\n\nPlus I don't like how this is the only game in my library with the first letter in the title being lowercased. Hurts me eyes. That's such a weak complaint, though. I guess it's alright. Maybe that's just another way they're ♥♥♥♥ing with us. Damn... getting ♥♥♥♥ed with by these guys without even having the game open... come to think of it, I like that.\n\nNice work, fellas. Hocus, I mean hocus, is worth a buy!","January 24","true","2.5"," No ratings yet","0","0","0","0","0"
"http://steamcommunity.com/id/themlgesus/recommended/418040/","themlgesus","TheMLGHayden","http://steamcommunity.com/id/themlgesus/","4 products in account","It's so trippy man. I mean, you'd think you would go behind that column, but you actually end up IN FRONT of it! What kind of witchcraft is in this game, man?","February 9","true","0.5"," No ratings yet","0","0","0","0","0"
"http://steamcommunity.com/id/ianyanian/recommended/418040/","ianyanian","ianyanian","http://steamcommunity.com/id/ianyanian/","145 products in account","no quit game button.\n\n8/10","February 9","true","0.5"," No ratings yet","0","0","0","0","0"
"http://steamcommunity.com/profiles/76561198097675040/recommended/418040/","76561198097675040","Bag1124","http://steamcommunity.com/profiles/76561198097675040/","93 products in account","A fun time killer that will blow your mind with impossible shapes.\n8/10 worth $2.","February 6","true","2.0"," No ratings yet","0","0","0","0","0"
"http://steamcommunity.com/id/ianyanian/recommended/418040/","ianyanian","ianyanian","http://steamcommunity.com/id/ianyanian/","145 products in account","no quit game button.\n\n8/10","February 9","true","0.5"," No ratings yet","0","0","0","0","0"
"http://steamcommunity.com/profiles/76561198135660261/recommended/418040/","76561198135660261","[CB] MusicalHB","http://steamcommunity.com/profiles/76561198135660261/","222 products in account","A fun little puzzle game. Its a nice mix of easy, hard and some that you solve by accident!","March 11","true","3.2"," No ratings yet","0","0","0","0","0"
"http://steamcommunity.com/id/ManiacalJackal/recommended/418040/","ManiacalJackal","ManiacalJackal","http://steamcommunity.com/id/ManiacalJackal/","19 products in account","This game, though it is meant to be a mobile game, is very interesting and can be easily compared with Monument Valley. I wouldn't pay the full price, just because of how simple the game really is, but I would definitely nag it during a sale.","April 3","true","1.5"," No ratings yet","0","0","0","0","0"
"http://steamcommunity.com/id/joe01489/recommended/418040/","joe01489","joe01489","http://steamcommunity.com/id/joe01489/","70 products in account","Really creative and simple. You have to wrap your head around the way the box moves across surfaces.\n\nThe game is easier to play on mobile devices given that movement is based on swiping.\n\nA move counter and "par moves" tracker would be an excellent addition.","May 13","true","1.7"," No ratings yet","0","0","0","0","0"
"http://steamcommunity.com/profiles/76561198118582695/recommended/418040/","76561198118582695","kurtwestermayr","http://steamcommunity.com/profiles/76561198118582695/","35 products in account","Please more of these funny games!","May 2","true","0.9"," No ratings yet","0","0","0","0","0"
