"url","reviewerUsername","reviewerDisplayName","reviewerUrl","reviewerProductsCount","reviewText","date","recommended","hoursPlayed","voteText","helpfulPercent","votesHelpful","votesTotal","votesFunny","commentsCount"
"http://steamcommunity.com/profiles/76561198240304434/recommended/418040/","76561198240304434","Night sky","http://steamcommunity.com/profiles/76561198240304434/","51 products in account","Ok game but I can't recommend mostly due to the fact that it currently sells for less than a dollar on the app store.  THat's fine if the game is upgraded at all but it doesn't even take up the whole screen.  Instead it's a little window in the center as if the game is supposed to be made for an iphone 5 held vertically- which it clearly was.  The screenshots don't make this clear by the way.","November 18, 2015","false","1.2"," 158 of 220 people (72%) found this review helpful 14 people found this review funny","72","158","220","14","6"
"http://steamcommunity.com/id/MaximumPlayer/recommended/418040/","MaximumPlayer","Maximum Player","http://steamcommunity.com/id/MaximumPlayer/","1731 products in account","My mind is confused","December 30, 2015","true","2.9"," 49 of 67 people (73%) found this review helpful 18 people found this review funny","73","49","67","18","0"
"http://steamcommunity.com/id/zockerexe/recommended/418040/","zockerexe","ǝxǝ˙ɹǝʞɔoz","http://steamcommunity.com/id/zockerexe/","754 products in account","An interesting puzzle game - interesting in this way as there are 3 dimensions but also not; not easy to describe and as a picture shows more than a thousand words I just inserted  2 screenshots where you can see very good how this game works:\nhttp://steamcommunity.com/sharedfiles/filedetails/?id=605416550\nhttp://steamcommunity.com/sharedfiles/filedetails/?id=605416601\nI can highly recommend this if you want to make your brain crash!","January 21","true","0.6"," 23 of 28 people (82%) found this review helpful 2 people found this review funny","82","23","28","2","0"
"http://steamcommunity.com/id/SamuraiVader/recommended/418040/","SamuraiVader","Samurai Vader","http://steamcommunity.com/id/SamuraiVader/","4009 products in account","hocus is a small logic game where you control a cube and roll to a target place. The twist in the gameplay is that the whole level design is based on the Penrose triangle[en.wikipedia.org].\n\nYou might get afraid of complex controls in those levels but don't worry, you can use a mouse (click to a place to move to), or a gamepad with analog stick, which I'd recommend. If you ever get lost or you won't know which directions you can move to, there's a circle with arrows on top of the screen that shows you. This can be really helpful at times when you'll be just wandering around the level, unable to find the right path.\n\nThe game has totally 65 levels, and all those have low difficulty. You can track the right way before any movement, or just move randomly until you find the right way in few minutes; it's up to you. This game can be a nice relaxing experience if you don't mind the ubiquitous optical illusion. It took me 98 minutes to beat all levels.\n\nGraphic style is minimalistic, which fits the game perfectly. The aural experience of hocus is made of a tranquil song and a sound for the cube's movement. While the game is ported from mobile platform, it's still a polished experience, I haven't found a single gameplay or visual bug through my playthrough.\n\nConclusion:hocus isn't a game that would make people excited, but it's a sleeper in many people's backlogs that deserves a play. It may be short but it offers you enough to enjoy levels designed with M. C. Escher's optical illusion in mind; you'll be done in about hour and half, and I think it's ok for a unique 2€ game.\n\n\nFor more reviews, join Samurai Vader's Point of View group and follow my curator page, I'm always happy to see feedback about my reviews.","April 29","true","1.6"," 15 of 15 people (100%) found this review helpful","100","15","15","0","0"
"http://steamcommunity.com/id/Kixu/recommended/418040/","Kixu","Tau","http://steamcommunity.com/id/Kixu/","64 products in account","It's a fun game for a low price.  It's obviously a port from mobile, but oh well, it's playable.\n\nThe influence from Monument Valley is obvious, but it manages to do its own thing with the concept.  In fact, I'm enjoying this a bit more than Monument Valley.\n\nThough the graphics are lacking (almost completely), in Hocus, the intrigue of the perspective-twisting mechanic is given more room to breathe, freed from Monument Valley's ham-handed attempts at world-building in this emerging genre that is inherently poorly-suited to real, meaningful world-building.\n\nHocus does one thing and does it well, so I guess you could say it follows the Unix philosophy","November 18, 2015","true","1.8"," 30 of 43 people (70%) found this review helpful 4 people found this review funny","70","30","43","4","0"
"http://steamcommunity.com/id/Bad_Samaritan1/recommended/418040/","Bad_Samaritan1","Bad Samaritan","http://steamcommunity.com/id/Bad_Samaritan1/","95 products in account","it a really interesting game if u can get over the fact its a mobile port but other than than its very well done","November 18, 2015","true","0.7"," 41 of 65 people (63%) found this review helpful 7 people found this review funny","63","41","65","7","0"
"http://steamcommunity.com/id/pogobeta/recommended/418040/","pogobeta","Pogo","http://steamcommunity.com/id/pogobeta/","467 products in account","I usually get grumpy about mobile games getting ported to Steam, but I also have a soft spot for optical illusions and games based on them.\n\nHocus has a simple premise and is easy to start playing. Player input consists only of choosing which direction to move the red cube in an effort to guide it to the exit (or is it the entrance?). Once a direction is chosen, the cube moves until it reaches a junction, where it waits for your next instruction. There is no camera movement, because the fixed perspective is essential to the puzzle.\n\nThe early levels are simplified to get you accustomed to the rules. Later levels are more complex, but not necessarily more difficult. The only real downside with this kind of game is that since movement is necessarily limited to six possible directions, it becomes more of a 3D maze than a puzzle as many would think of it (I am totally fine with this, though). There are a few sections (especially in late levels) wherein many joints have only 2 available directions, and you spend more time moving/waiting than thinking/deciding. Most levels have more than one path to the exit, though the last few steps are usually fairly specific.\n\nThe splash screen states that the use of an analog gamepad is recommended, but I had a much easier time controlling the game by clicking with my mouse.\n\nI've seen a few people get bent out of shape over the price difference between this version and the mobile version. Here are some solutions:\nBuy it through your mobile device's app store\nBuy it through Steam when it is on sale\nShut up\nI've also seen a few complaints about how the actual game takes place in portrait mode (common practice for games that start out as mobile) with wide border sections on the left and right. This is evident to anybody who either watched the video or looked at the screenshots. In the actual game, the "empty" space is taken up by a slightly blurred version of the preceding and subsequent puzzles. This fact has no impact on the gameplay, and I think that using raw screenshots would have confused shoppers, as there would appear to be three puzzles on screen at once. Personally, I would have preferred solid white space on the sides, both for added focus on the puzzle at hand, and to fit in with the minimalist/tranquil aesthetic.\n\nAdditional levels will be added (at least 10 have been announced so far), and I assume they'll be around the same difficulty as the existing late-game levels.\n\nIt's a short, inexpensive puzzle, and I enjoyed it.\n\n₦ out of 10","January 1","true","2.1"," 11 of 12 people (92%) found this review helpful","92","11","12","0","0"
"http://steamcommunity.com/profiles/76561198132618109/recommended/418040/","76561198132618109","toggiee","http://steamcommunity.com/profiles/76561198132618109/","16 products in account","I love this game it is a challange in many of the levels. If you liked Monument Valley, you will like this one.","November 19, 2015","true","0.4"," 16 of 22 people (73%) found this review helpful 1 person found this review funny","73","16","22","0","0"
"http://steamcommunity.com/id/Forest_Penguin/recommended/418040/","Forest_Penguin","Forest_Penguin","http://steamcommunity.com/id/Forest_Penguin/","262 products in account","Great game, great price! if you are into puzzle games you should definetly pick this up. The game is quite short but the price makes up for it and the promise of more levels.","November 18, 2015","true","0.3"," 38 of 63 people (60%) found this review helpful 4 people found this review funny","60","38","63","4","1"
"http://steamcommunity.com/id/fanakartal/recommended/418040/","fanakartal","fanakartal","http://steamcommunity.com/id/fanakartal/","96 products in account","it is a very good game; minimal, relaxing and joyful. i recommend it if you dont have an iphone. we are waiting the new levels eagerly.","November 19, 2015","true","0.6"," 9 of 13 people (69%) found this review helpful","69","9","13","0","0"
"http://steamcommunity.com/profiles/76561198018448357/recommended/418040/","76561198018448357","mevzun","http://steamcommunity.com/profiles/76561198018448357/","84 products in account","Funny casual puzzle game for a very low price","November 19, 2015","true","0.3"," 12 of 19 people (63%) found this review helpful","63","12","19","0","0"
"http://steamcommunity.com/id/Bizink/recommended/418040/","Bizink","ṬṂḤ|Bizink","http://steamcommunity.com/id/Bizink/","21 products in account","This game has a good initial concept of navigating impossible shapes, however lacks any real variation beyond that.\n\nThe game is pretty simple and easy to use, has a clean design and interesting mechanics, however, after playing the first few levels I noticed that no new features are added and gameplay was becoming somewhat tedious. The levels also require zero skill to complete; one could finish every level with enough moving about as there are no puzzles.\n\nBoth the repetitiveness and lack of difficulty could be changed with the addition of new mechanics and features as the game progresses.\n\nI give this game a substandard 3/10 as after very little time the game becomes boring and too easy.\n","November 30, 2015","false","0.3"," 8 of 12 people (67%) found this review helpful 1 person found this review funny","67","8","12","0","0"
"http://steamcommunity.com/id/cyrilpanda/recommended/418040/","cyrilpanda","Cyril","http://steamcommunity.com/id/cyrilpanda/","596 products in account","Pretty simple puzzle game, it's essentially a 3D maze. Based around impossible shapes and the like and the game is basically treated as if everything that looks like it could touch is touching, so the puzzle becomes figuring out which sequence of moves gets you to the goal. It's a fun mechanic for a while, but after 65 levels of it, felt a little tiresome and repetitive. Apparently more levels are planned too, though I doubt I'd revisit this game to play them. Sound is minimal but pleasant. For a low price (a dollar or under) I'd imagine this would be worth the money and apparently it's on the app store so I'd say buy it there unless you can get it really cheap here. But it's a decent enough puzzler, for sure, if not a bit basic.","December 1, 2015","true","1.5"," 4 of 5 people (80%) found this review helpful","80","4","5","0","0"
"http://steamcommunity.com/profiles/76561198079883167/recommended/418040/","76561198079883167","Kutay","http://steamcommunity.com/profiles/76561198079883167/","31 products in account","I do recomment.\n\nI have been waiting for hocus to be greenlit because I don't have an iOS device. If you like mind-bending puzzle games, you will definitely like this one. I like it, becasue I can't see the solution path with one look, and I try a little to find the path.\n\nWith an analog gamepad it is preaty easy to use. I wish I could play with my keyboard but I guess the perspective doesn't allow that. The mouse or touch screen does just fine.\n\nI'd say price is very affordable, considering the hours of puzzles I am getting.\n\nI guess only downfall is that the game doesn't scale when I go fullscreen. I am sure the developer is aware of it and has a pretty good reason not to scale.\n\nCan't wait for expension packs :)","November 19, 2015","true","1.6"," 6 of 9 people (67%) found this review helpful","67","6","9","0","0"
"http://steamcommunity.com/profiles/76561198053422627/recommended/418040/","76561198053422627","Zaxtor99","http://steamcommunity.com/profiles/76561198053422627/","505 products in account","Here is my First Impressions and Review video of this game: (To just see my review scoring, move to 26:40)\nhttps://www.youtube.com/watch?v=hRpYRswBm0g&feature=youtu.be\n\nMain Question:  Is "Hocus" a game YOU will like?\n\nWell, let's ask some questions shall we?  Start at 0, and ask yourself the following questions:\n\nQ #1) What do you think of M.C. Escher's art?\n- If you LOVE it, add +7\n- If you Like his art, add +4\n- If you don't know who M.C. Escher is or don't like his art, add nothing.\n\nQ #2) Do you like casual puzzle games that have simple mouse controls and get more difficult as you progress?\n- If you say "HELL YES!".. then add +12\n- If you say "Ehh, sometimes they are cool".. then add +7\n- If you say "Not really, sometimes but rarely".. then add +3\n- If you say "Naw" or "Hell No!".. then add nothing.\n\nQ #3) Do you enjoy trying to solve fancy labyrinths that get pretty complex the more you solve?\n- If you say "OMG, I LOVE MAZES!" then add +10\n- If you say "Ehh, sometimes they are fun".. then add +6\n- If you say "Not too much but they can be okay".. then add +3\n- If you say "Nope" or "Who the hell wants to solve a dumb maze?".. then add nothing.\n\nSCORING TO DETERMINE IF YOU SHOULD BUY THIS OR NOT:\n\n- Scored 24 or more total points?  .. Then this game is a "MUST BUY!" for you!  ;-)\n- Scored 17-23 total points? ..Then chances are you will really like this game!\n- Scored 11-16 total points? ..Ehh, you might like it for about 10 minutes, but probably not a recommended game for you.\n- Scored 0 to 10 points? - Naw, I'd look for a different game, unless you catch it on like a '90% off' sale or something.\n\nMy personal review score from the video above I posted is a 79%.  Watch my video to see how I scored it.  :-)","November 20, 2015","true","1.3"," 10 of 17 people (59%) found this review helpful 1 person found this review funny","59","10","17","0","0"
"http://steamcommunity.com/id/jonesr/recommended/418040/","jonesr","JonesR","http://steamcommunity.com/id/jonesr/","1280 products in account","hocus is a short and clever puzzle game that can make your head spin if you aren't prepared.","February 3","true","1.7"," 4 of 6 people (67%) found this review helpful","67","4","6","0","0"
"http://steamcommunity.com/profiles/76561198033589326/recommended/418040/","76561198033589326","Rohirrim","http://steamcommunity.com/profiles/76561198033589326/","44 products in account","Wow really nice game..Recommend it for sure!","November 19, 2015","true","0.5"," 5 of 8 people (63%) found this review helpful","63","5","8","0","0"
"http://steamcommunity.com/id/papyrusthepancake/recommended/418040/","papyrusthepancake","Remarkeyable (Jolly Pancake)","http://steamcommunity.com/id/papyrusthepancake/","138 products in account","Fun little game, I'm a sucker for optical illusions so I picked this up right away. Game definitely isn't worth $3, but it is worth the 74 cents I bought it for on the Autumn Sale.","November 29, 2015","true","0.1"," 6 of 10 people (60%) found this review helpful","60","6","10","0","0"
"http://steamcommunity.com/id/civicuva/recommended/418040/","civicuva","dummkopf","http://steamcommunity.com/id/civicuva/","80 products in account","Awesome & enjoy!","November 18, 2015","true","0.3"," 11 of 20 people (55%) found this review helpful","55","11","20","0","0"
"http://steamcommunity.com/id/PYROMANTIC/recommended/418040/","PYROMANTIC","PYROMANT|C","http://steamcommunity.com/id/PYROMANTIC/","438 products in account","Hocus is a great puzzler, one that benefits greatly from the developer’s commitment to the game and the community that has cropped up around it. The minimalistic stylings are a perfect fit for this kind of game, focusing you directly on the challenge at hand. The puzzles themselves are no trifle either and are sure to provide a challenge for even the most non-linear thinkers among us. If you’re looking for another time killer for your phone or just enjoy a good non-Euclidean styled puzzler then Hocus is definitely a title you should check out.\n\nRead my full review here: https://www.therefinedgeek.com.au/index.php/2016/01/08/hocus-you-cant-trust-your-eyes/","January 14","true","1.0"," 1 person found this review helpful","0","1","1","0","0"
"http://steamcommunity.com/id/GEAR4TH/recommended/418040/","GEAR4TH","gear4th","http://steamcommunity.com/id/GEAR4TH/","37 products in account","Simple and lovely, Very enjoyable to play.","January 29","true","2.5"," 1 person found this review helpful","0","1","1","0","0"
"http://steamcommunity.com/id/frzru/recommended/418040/","frzru","vla.","http://steamcommunity.com/id/frzru/","718 products in account","The concept is great but the implementation as a mobile game just doesn't feel good at PC. It only uses 1/6 of a whole screen at best and controls are basically off.\n7/10","January 28","true","1.2"," 1 person found this review helpful","0","1","1","0","0"
"http://steamcommunity.com/id/FluffyFighter667/recommended/418040/","FluffyFighter667","Fluffy | TOXICJACKPOT.COM","http://steamcommunity.com/id/FluffyFighter667/","43 products in account","Worth every penny im accually a bit suprised it dsoent cost more","January 27","true","1.1"," 1 person found this review helpful","0","1","1","0","0"
"http://steamcommunity.com/id/PYROMANTIC/recommended/418040/","PYROMANTIC","PYROMANT|C","http://steamcommunity.com/id/PYROMANTIC/","438 products in account","Hocus is a great puzzler, one that benefits greatly from the developer’s commitment to the game and the community that has cropped up around it. The minimalistic stylings are a perfect fit for this kind of game, focusing you directly on the challenge at hand. The puzzles themselves are no trifle either and are sure to provide a challenge for even the most non-linear thinkers among us. If you’re looking for another time killer for your phone or just enjoy a good non-Euclidean styled puzzler then Hocus is definitely a title you should check out.\n\nRead my full review here: https://www.therefinedgeek.com.au/index.php/2016/01/08/hocus-you-cant-trust-your-eyes/","January 14","true","1.0"," 1 person found this review helpful","0","1","1","0","0"
"http://steamcommunity.com/id/cheetumen52/recommended/418040/","cheetumen52","cheetumen52 |CSGO2x.com|","http://steamcommunity.com/id/cheetumen52/","144 products in account","This game is good! It's hard in some levels but nothing impossible. When cube is behind somethink it will drop fps of cube please repair it and remove fps limit! :)\nReally cool game 9/10","January 21","true","1.6"," 1 person found this review helpful","0","1","1","0","0"
"http://steamcommunity.com/id/AnarchyRises/recommended/418040/","AnarchyRises","The Red Bloody Disaster","http://steamcommunity.com/id/AnarchyRises/","36 products in account","This is one of the most relazing games that i have probably ever played! My favorite one so far is the "Impossible Triangle"!!! this game is worth it if you enjoyed monument valley, and is a nice relaxing game.","January 22","true","0.9"," 1 person found this review helpful","0","1","1","0","0"
"http://steamcommunity.com/profiles/76561198190793941/recommended/418040/","76561198190793941","KADONN_","http://steamcommunity.com/profiles/76561198190793941/","29 products in account","This game is one HUGE mind ♥♥♥♥!","December 4, 2015","true","0.4"," 1 person found this review helpful","0","1","1","0","0"
"http://steamcommunity.com/id/Widdershin/recommended/418040/","Widdershin","SoftShadow","http://steamcommunity.com/id/Widdershin/","59 products in account","pretty neat Idea. interesting gameplay that looks more confusing than it is. my only issue is the music puts me to sleep.\n\n10/10 would sleep again","December 6, 2015","true","1.1"," 1 person found this review helpful","0","1","1","0","0"
"http://steamcommunity.com/profiles/76561198068099933/recommended/418040/","76561198068099933","Kg","http://steamcommunity.com/profiles/76561198068099933/","84 products in account","Pros:\n- The puzzles are really great (for the low price)\n- Good for relaxing\n- Lots of levels\n\nCons:\n- The sound design gets really boring and irritating after a while\n- Animations could/should be better (the walking cube is ugly and awkward)\n\nVerdict: If you like puzzles and Escher, buy it at a discounted price","December 13, 2015","true","2.1"," 1 person found this review helpful","0","1","1","0","0"
"http://steamcommunity.com/profiles/76561198145287892/recommended/418040/","76561198145287892","jazdec ☭","http://steamcommunity.com/profiles/76561198145287892/","26 products in account","great !","April 25","true","1.9"," 1 person found this review helpful","0","1","1","0","0"
"http://steamcommunity.com/profiles/76561198145287892/recommended/418040/","76561198145287892","jazdec ☭","http://steamcommunity.com/profiles/76561198145287892/","26 products in account","great !","April 25","true","1.9"," 1 person found this review helpful","0","1","1","0","0"
"http://steamcommunity.com/id/CaptainSpaceToast/recommended/418040/","CaptainSpaceToast","Space Toast","http://steamcommunity.com/id/CaptainSpaceToast/","42 products in account","Do you want a game to break your brain then here -.- way too many illusions","January 27","true","0.6"," 1 person found this review helpful 2 people found this review funny","0","1","1","2","0"
"http://steamcommunity.com/id/bagofdongs/recommended/418040/","bagofdongs","Giant Dragon Dildos","http://steamcommunity.com/id/bagofdongs/","235 products in account","This is some really clever ♥♥♥♥.\n\n10/10, would get mind♥♥♥♥ed again.","June 3","true","0.5"," 1 person found this review helpful","0","1","1","0","0"
"http://steamcommunity.com/id/Salarn/recommended/418040/","Salarn","Salarn","http://steamcommunity.com/id/Salarn/","2143 products in account","https://youtu.be/owVUOexkIb8\n\nTest your eyes and your mind against these M.C. Escher inspired puzzles while navigating a red cube into a red hole.  Ported from a mobile game with swipe controls unfortunately doesn't map smoothly to a controller and cube movement is often fidgety.\n\nWhile the puzzles are fun to look at they rarely offer any real challenge as the navigation options are so limited at each junction not offer the player much choice.  The slick visuals are just not enough make up for the weak puzzles in this puzzle game.","May 31","false","0.4"," 1 person found this review helpful","0","1","1","0","0"
"http://steamcommunity.com/profiles/76561198096892058/recommended/418040/","76561198096892058","Invisible Explosion","http://steamcommunity.com/profiles/76561198096892058/","68 products in account","My mind will never be the same.","November 26, 2015","true","2.2"," 2 of 3 people (67%) found this review helpful 1 person found this review funny","67","2","3","0","0"
"http://steamcommunity.com/id/foggypebble/recommended/418040/","foggypebble","What Would Spock Do","http://steamcommunity.com/id/foggypebble/","885 products in account","This game made me feel relaxed and also gave me a headache. There's no timer or bosses to kill, it's simply a relaxing puzzle game. No complaints.","December 1, 2015","true","1.6"," 2 of 3 people (67%) found this review helpful","67","2","3","0","0"
"http://steamcommunity.com/profiles/76561198007817556/recommended/418040/","76561198007817556","AaToSMeD","http://steamcommunity.com/profiles/76561198007817556/","1171 products in account","A very well done mobile port that provides a soothing experience as you solve its perspective illusion puzzles. Enjoy a truly relaxing game at a very low price point.","December 16, 2015","true","0.3"," 2 of 3 people (67%) found this review helpful","67","2","3","0","0"
"http://steamcommunity.com/id/shadowmanebrony/recommended/418040/","shadowmanebrony","FracturedShadow","http://steamcommunity.com/id/shadowmanebrony/","27 products in account","it's worth a try if you have time to kill. the music is relaxing and the puzzles are mildly confusing, but definitely get it when it's on sale, this isnt 3 dollars worth of game.","November 30, 2015","true","1.5"," 2 of 3 people (67%) found this review helpful","67","2","3","0","0"
