"url","reviewerUsername","reviewerDisplayName","reviewerUrl","reviewerProductsCount","reviewText","date","recommended","hoursPlayed","voteText","helpfulPercent","votesHelpful","votesTotal","votesFunny","commentsCount"
"http://steamcommunity.com/profiles/76561198090109480/recommended/418040/","76561198090109480","bijzaak","http://steamcommunity.com/profiles/76561198090109480/","172 products in account","Good mobile game, but not a good PC port.\na bit laggy\nunnecessary pauses (fake "loading" animations) between levels\nno reset button\ncontrols could be better (there's no reason why I would want the cube to stop if it's not at a corner or junction)\nThe concept is simple: you roll a cube into a hole over the faces of an impossible-looking structure. It's a kind of maze which you solve by backtracking in your head. It takes a while before you can do it without making mistakes. (Or you can solve the level with trial-and-error, but that's no fun.) None of the levels is hard.","April 30","false","2.1"," No ratings yet","0","0","0","0","0"
"http://steamcommunity.com/id/GandalfLover555/recommended/418040/","GandalfLover555","Gandalflover555","http://steamcommunity.com/id/GandalfLover555/","22 products in account","Gotta love the mind boggling puzzles this game has to offer.\n\n7/10\nI like it but it kinda gets boring after a short while.\n\nWork on that and im sure this game will be better.\nMaybe some color?","April 27","true","0.5"," No ratings yet","0","0","0","0","0"
"http://steamcommunity.com/profiles/76561198066399698/recommended/418040/","76561198066399698","Adun","http://steamcommunity.com/profiles/76561198066399698/","44 products in account","I bought this game for 50ct. Always would buy again.\n\nIt's a fun puzzle game that ♥♥♥♥s your brain.\n10/10 would buy again. (even for 1€)","April 23","true","4.0"," No ratings yet","0","0","0","0","0"
"http://steamcommunity.com/id/NGTMFDSHT/recommended/418040/","NGTMFDSHT","NGTMFDSHT","http://steamcommunity.com/id/NGTMFDSHT/","65 products in account","Addicted within the first minute of play. Great game for relaxing the mind. Great when you just want something to play for a short minute. Love it!","April 19","true","0.2"," No ratings yet","0","0","0","0","0"
"http://steamcommunity.com/profiles/76561198095757860/recommended/418040/","76561198095757860","T0masツ","http://steamcommunity.com/profiles/76561198095757860/","24 products in account","MIND F*CK. This is so good.","April 17","true","1.2"," No ratings yet","0","0","0","0","0"
"http://steamcommunity.com/profiles/76561198090109480/recommended/418040/","76561198090109480","bijzaak","http://steamcommunity.com/profiles/76561198090109480/","172 products in account","Good mobile game, but not a good PC port.\na bit laggy\nunnecessary pauses (fake "loading" animations) between levels\nno reset button\ncontrols could be better (there's no reason why I would want the cube to stop if it's not at a corner or junction)\nThe concept is simple: you roll a cube into a hole over the faces of an impossible-looking structure. It's a kind of maze which you solve by backtracking in your head. It takes a while before you can do it without making mistakes. (Or you can solve the level with trial-and-error, but that's no fun.) None of the levels is hard.","April 30","false","2.1"," No ratings yet","0","0","0","0","0"
"http://steamcommunity.com/profiles/76561198118582695/recommended/418040/","76561198118582695","kurtwestermayr","http://steamcommunity.com/profiles/76561198118582695/","35 products in account","Please more of these funny games!","May 2","true","0.9"," No ratings yet","0","0","0","0","0"
