"url","reviewerUsername","reviewerDisplayName","reviewerUrl","reviewerProductsCount","reviewText","date","recommended","hoursPlayed","voteText","helpfulPercent","votesHelpful","votesTotal","votesFunny","commentsCount"
"http://steamcommunity.com/profiles/76561198044241570/recommended/433350/","76561198044241570","Rorsha","http://steamcommunity.com/profiles/76561198044241570/","477 products in account","Hello everybody,\n\nFor beginning, I am an old player of this game and also an old GM (Game Moderator).\nSo after played a tons of hours (before it releases on Steam ofc) , I can say you that\n\nThe game still have the same mind than before such as :\n\n- There are a lot of bug/glitch never fixed\n- Be Pay2win\n- Europe servers are dead\n- BSC weapons still OP compared to BP weapons\n- The managers of the game don\'t give a fâ™¥â™¥â™¥ on his community...\n\nSo stay far of this game ...","June 1","false","0.7"," 331 of 385 people (86%) found this review helpful 26 people found this review funny","86","331","385","26","2"
"http://steamcommunity.com/id/Cyphus13/recommended/433350/","Cyphus13","Le CyphÃ¼s","http://steamcommunity.com/id/Cyphus13/","13 products in account","I can't believe that this is now "In my library".\n\nHoly BALLS is this bad.  The second I entered my first server, I went out, got maybe one kill, and then had a player (obviously P2W because of cosmetics and such) instantly one shot me with his pistol. "Huh, maybe it was a headshot."  I attempt to get him again, same thing happens.\n\nThis game is about as balanced as a rhino on a balance beam.\n\nI'm being dead serious.\n\nI actually wanted to try something new and interesting, I WANTED it to be good. It's not, it's not good now and never will be.  I knew from the moment I saw the tutorial helper it was going to be bad, but i didn't know it would be "Pay money to kill random players that have an honest interest in your game" bad.  I should've though.\n\nTry it if you want, but it really is unenjoyable.\n\nIf you really want something to shoot people in, go get warface, it's good until level thirteen when everyone is about 40+ levels above you.\n\nUtter waste of time, heck, even some facebook FPS apps are better than this.\n\nMy opinion?\n\nJust no.\n\nno.","June 3","false","0.1"," 119 of 137 people (87%) found this review helpful 30 people found this review funny","87","119","137","30","1"
"http://steamcommunity.com/id/brightel/recommended/433350/","brightel","Ultm8_FgtPenetrator","http://steamcommunity.com/id/brightel/","1046 products in account","I dont know why such hate in this game, Its so easy, just take your credit card and enter it ingame.","June 1","false","0.1"," 171 of 219 people (78%) found this review helpful 156 people found this review funny","78","171","219","156","3"
"http://steamcommunity.com/id/skidrowtrash/recommended/433350/","skidrowtrash","Skid Row Trash","http://steamcommunity.com/id/skidrowtrash/","300 products in account","Worthless garbage.\n\n(Update: I tried it again, redownloaded and installed. No Options confirmed, No resolutions options confirmed. Got thrown out for "hacking" again for no reason. Screen 1 character select, screen 2 server select - no options in either of these screens just a control button which only shows controls, no options inside. This is all I was able to see before being kicked out randomly again, I can't make it past this section.) Review stands.\n\nCONS\nMultiple crashes\nRequires you to set up account and verify by email\nNo Settings Or Options\nRandomly accuses you of hacking and shuts down\n800 x 600 resolution?? No other options.. (Update - actually it's 1024 x 768 resolution)\n\n\nPROS\nFast uninstall time\nDoesn\'t even come with a desktop item - makes for easy cleanup after uninstalling\nGraphics easily rival big budget high end PS1 titles","June 1","false","0.2"," 121 of 148 people (82%) found this review helpful 94 people found this review funny","82","121","148","94","20"
"http://steamcommunity.com/id/luki1669b/recommended/433350/","luki1669b","StorM","http://steamcommunity.com/id/luki1669b/","15 products in account","Create character and \"Game hack has been detected\".. DA FU*K?\n\nThis game is so lowww ;/","June 1","false","0.2"," 108 of 148 people (73%) found this review helpful 39 people found this review funny","73","108","148","39","2"
"http://steamcommunity.com/id/iamchips477/recommended/433350/","iamchips477","Chips","http://steamcommunity.com/id/iamchips477/","80 products in account","Looked promising, I was looking forward to it really but I dont think its that great, I jumped into a TDM match and I kept getting spawn killed constantly by the other team, the maps are far to small and guns are p2w. The only think I enjoyed about it was that hot babe who gave me the tutorial, dayum she was fine.","June 1","false","0.3"," 69 of 98 people (70%) found this review helpful 36 people found this review funny","70","69","98","36","0"
"http://steamcommunity.com/id/hentai4hentai/recommended/433350/","hentai4hentai","Im gay","http://steamcommunity.com/id/hentai4hentai/","35 products in account","Basicly a bad counterstrike and a bad cod put into one, get â™¥â™¥â™¥â™¥ on by people who put money in, looks horrible, pistols are more like bb guns and do nothing so dont even bother. Its has the really cancerous thing where you can only keep guns for 3 hours until you need to rebuy them. Its like if you took csgo took out the recoil of all the guns and made it looks like halflife 1 you would have this game.","June 1","false","1.2"," 43 of 57 people (75%) found this review helpful 6 people found this review funny","75","43","57","6","0"
"http://steamcommunity.com/profiles/76561198104247518/recommended/433350/","76561198104247518","DateWithDestiny","http://steamcommunity.com/profiles/76561198104247518/","42 products in account","-Bugged Hit boxes\n-EU server made from wood\n-Kebabs use macr0 , hax\n-Brazilian laggers shoot by walls\n-cancer community\n-GM team is some sort of joke banning for photoshoped ss :')\n-noobs r kicking u cuz they sux\n-if some disabled low is friend of gm u get ban for nothing ;d\n-graphics like in mario\n-steam version of game works good but if u play buggshot from nonsteam version it laggs\n-3 years ago game was good , today ... sad\n-hackshield is made from 2 potatoes and 1 cable :')\n-melee fight ... bugged as fk disabled lows can kill me by hiring in air :D gl\n\n","June 4","false","1.0"," 43 of 58 people (74%) found this review helpful 15 people found this review funny","74","43","58","15","1"
"http://steamcommunity.com/profiles/76561198035285721/recommended/433350/","76561198035285721","bigh","http://steamcommunity.com/profiles/76561198035285721/","2448 products in account",""I got a Smileyface - but just for 1 hourUsually I don't play PvP. There were only a few exceptions like Sniper:Ghost Warrior MP. It was a sniper fun game but with utterly bad graphics. Blackshot is even worse in graphics. Honestly it looks very outdatet and somewhere was written it's a CS 1.7 mod.\n\nMainly there are other issues you'll encounter:\n- intransparent weaponshop & skilltree,\n- not understandable daily rewards system,\n- secret uplevel system,\n- unbalanced teams,\n- P2W elements and last but not least\n- a lot of cheaters/hackers.\n\nTho there was this overly hot guide Ellie in the beginning but I cannot remember anything ... And the functions are not explained anywhere else.\n\nThe basic concept is that all of your weapons expire in 3 gamehours. Then you can restock them with BSP (Blackshot points) or buy other game contents upto 30 hours endurance with BSC (Blackshot Credits). Mostly last is the reason when you meet ppl with one-shot-kill weapons or enemy pointer system. So the cheating seems to be incorporated into this game with a P2W part. Not to speak of the devs rely just on an useless ACS nProtect Software and don't have mods active kicking the massive cheaters out of sessions.\n\nOnce I got randomly a smileyface mask. I didn't use it but somehow it got expired after 1 hour of gameplay. So what? Is there anymore interest in cosmetical upgrades after that?\n\nIt's a little pity that they do have interesting locations like Rio or Mount St. Michel for example. I also enjoyed gamemodes like "Protect the Commander" or "Running man".\nBut the game lacks entirely in so many points.\n\nHopefully they will not extend the low test achievements. Because if you have rankedup like me servers really got empty and the last in-game achievements promise you a lot of brainless grinding.","June 5","false","17.9"," 23 of 28 people (82%) found this review helpful 1 person found this review funny","82","23","28","0","6"
"http://steamcommunity.com/id/TUN3CH1/recommended/433350/","TUN3CH1","Cylix","http://steamcommunity.com/id/TUN3CH1/","52 products in account","Well atleast this game taught me that I shouldnt take my other games for granted","June 1","false","0.4"," 48 of 73 people (66%) found this review helpful 30 people found this review funny","66","48","73","30","0"
"http://steamcommunity.com/profiles/76561198020277247/recommended/433350/","76561198020277247","Sennbremmel","http://steamcommunity.com/profiles/76561198020277247/","303 products in account","Played it for a few years. I can safely say DO NOT PLAY THIS GAME.\n\nThe community is broken. There is no balance. Basic functions are broken. EU servers are dead or TDM only. A sad joke.","June 3","false","7.8"," 41 of 61 people (67%) found this review helpful 7 people found this review funny","67","41","61","7","7"
"http://steamcommunity.com/profiles/76561198093637028/recommended/433350/","76561198093637028","lazer","http://steamcommunity.com/profiles/76561198093637028/","50 products in account","pay2win game","June 3","false","0.4"," 33 of 48 people (69%) found this review helpful","69","33","48","0","0"
"http://steamcommunity.com/id/TikiMtlcre/recommended/433350/","TikiMtlcre","TikiMtlcre","http://steamcommunity.com/id/TikiMtlcre/","431 products in account","Don't install this game!","June 3","false","0.1"," 38 of 57 people (67%) found this review helpful 2 people found this review funny","67","38","57","2","0"
"http://steamcommunity.com/profiles/76561197994644834/recommended/433350/","76561197994644834","MAJOR_SOLID_SNAKE","http://steamcommunity.com/profiles/76561197994644834/","22 products in account","Sorry but have to give this game a bad rating. So lets begin the game would be a really good PVP game if they get rid of the who has a better weapon then you wins type of deal or what everybody calls pay to win, the weapons skill ranking is cool and would be successful if not for the pay to win weapons for example today i played snipers only i got some kills with my SR but when i kill the guy that kill me so many times and i killed him once so i pick up his SR which is the same SR i have but in a gold skin camo and i went to town with it 10 kills in a row so yes pay to win game die quick because they lack skill based gameplay. All players like skill based games why because skill based is based on the skill of the player and not there wallet. Also pay to win games are unbalanced. So no i think this game is not as good as it should be.","June 3","false","3.1"," 20 of 25 people (80%) found this review helpful","80","20","25","0","0"
"http://steamcommunity.com/id/MacheteMikey/recommended/433350/","MacheteMikey","Machete Mike","http://steamcommunity.com/id/MacheteMikey/","119 products in account","garbage p2w what else do i have to say?","June 3","false","0.4"," 21 of 28 people (75%) found this review helpful 1 person found this review funny","75","21","28","0","0"
"http://steamcommunity.com/id/Gothicdeer/recommended/433350/","Gothicdeer","Moon","http://steamcommunity.com/id/Gothicdeer/","643 products in account","It was good back then....\n\nNeeds to stay back then...","June 1","false","0.3"," 47 of 75 people (63%) found this review helpful 20 people found this review funny","63","47","75","20","6"
"http://steamcommunity.com/profiles/76561198146229139/recommended/433350/","76561198146229139","Killerpk","http://steamcommunity.com/profiles/76561198146229139/","3 products in account","Well lets start with the biggest problem of the game, the shop system, none of the guns are perm in the shop, you have to buy them for a duration, some being 1-30 hours, others being 1-30 days, all the guns are offered in the in-game currency but you can pay real cash for their camo'ed or tuned counterparts that look better and have a increase in stats. Now lets get to the gameplay, the graphics are similar to old CS, but be forewarned don't play the A.I mode, absolute â™¥â™¥â™¥â™¥, most of the A.I come out bugged looking like triangle bodies, seems like a sixth grader did some of the designs in it, but the other modes are what you would expect in a FPS, in my experience in the beginner channel, i had no crashes or "Hack detected" but others have said they have, no clue what caused them to experience it, now mind you this game has tons of bugs, ie weapon switching gets delayed or doesn't even work at times, and grenades hitting you through walls at times. I only saw 2 blatant hackers in the beginners channel while i played. Now we move on to the normal channels, I played 2 games in the channel and it made me want to just dump this game from my library and never touch it again, 1st game their were 8 hackers and in the 2nd it seemed like the entire room besides myself and another were hacking. Now their is no option to report people for hacking, in-game or out, you have to go to their steam profile to report them to steam, so the game devs give absolutely no â™¥â™¥â™¥â™¥â™¥ about the community so long as their making money. GMs will do nothing for you, and will even go to accusing you of tampering with a SS and ban you. So I recommend you look elsewhere for a decent FPS game.","June 4","false","9.5"," 13 of 15 people (87%) found this review helpful","87","13","15","0","0"
"http://steamcommunity.com/id/MrLuckyB/recommended/433350/","MrLuckyB","Mr. Lucky ãƒ„","http://steamcommunity.com/id/MrLuckyB/","1 product in account","Hack hack and hack.....everyone using hack and no one banning! they are contracted with Game Masters and everyone know that.","June 4","false","0.1"," 20 of 28 people (71%) found this review helpful 3 people found this review funny","71","20","28","3","0"
"http://steamcommunity.com/profiles/76561198228724588/recommended/433350/","76561198228724588","Sloria","http://steamcommunity.com/profiles/76561198228724588/","14 products in account","I played this game like 2-3 years, it was sort of enjoyable apart from the annoying community (you get kicked of every room if you're too bad or too good, little kids will call you either hacker or noob). There were especially players of the same clan who played together in a map just to kick out the good players, you weren't able to play a normal match until you found a good room with friendly persons. Another reason I dislike this game is the support team, they ban people for stupid reasons (I didn't use any hacktool, but my account with many hours of gameplay still received a ban). In this game, multi accounts are forbidden if they are linked to different emails, but one can buy a special feature called 'character slot' to play with multiple accounts. I didn't want to buy this slot and created my accounts otherwise, so I got permanently banned. They kinda force you to pay in, because you have many disadvantages without cashed stuff (better stats than the non-cash stuff=> Pay2Win). What is the matter about having several accounts while others play with wallhacks or macros? The Gamemasters can be called clowns, they ignore most of the questions.They are just worth to be answered if you pay for their system. Don't make the same mistake as me by wasting hundreds or maybe even thousands of hours unless you want to feed the pay2win system.","June 1","false","0.3"," 31 of 49 people (63%) found this review helpful 1 person found this review funny","63","31","49","0","1"
"http://steamcommunity.com/profiles/76561198061375904/recommended/433350/","76561198061375904","TacoManRandySausage","http://steamcommunity.com/profiles/76561198061375904/","24 products in account","Cons- Jumping=gravitating up for a sec then falling\n- Found a hacker the first time a played it\n- I couldn't find a way to skip the tutorial\n- Spawnkill or be Spawnkilled\n- The onle time you can get kills is with the AWP\nPros- I can use the AWP so im not overwealmed by the P2Ws","June 5","false","1.4"," 16 of 22 people (73%) found this review helpful 4 people found this review funny","73","16","22","4","0"
"http://steamcommunity.com/id/ir00nek/recommended/433350/","ir00nek","Anaconda â™‚","http://steamcommunity.com/id/ir00nek/","27 products in account","Its pay to win guys that game suck. Lots of cheaters are in this game.","June 5","false","0.2"," 19 of 28 people (68%) found this review helpful","68","19","28","0","0"
"http://steamcommunity.com/profiles/76561198091331612/recommended/433350/","76561198091331612","Der Arrowmort","http://steamcommunity.com/profiles/76561198091331612/","3 products in account","More bugs than on my windscreen!","June 5","false","7.5"," 18 of 27 people (67%) found this review helpful 18 people found this review funny","67","18","27","18","0"
"http://steamcommunity.com/id/pfcjoker1/recommended/433350/","pfcjoker1","Pfc. Joker [1st ID]","http://steamcommunity.com/id/pfcjoker1/","46 products in account","Basically CS Online and COD Online had a baby in the days of half life, this would be it. If it wasn't P2W I'd give a thumbs up","June 5","false","1.7"," 12 of 16 people (75%) found this review helpful 2 people found this review funny","75","12","16","2","0"
"http://steamcommunity.com/id/teboo/recommended/433350/","teboo","'s Ironic Paradox","http://steamcommunity.com/id/teboo/","18 products in account","dirty ping","June 3","false","1.6"," 14 of 20 people (70%) found this review helpful 3 people found this review funny","70","14","20","3","0"
"http://steamcommunity.com/id/Aym211/recommended/433350/","Aym211","Aym0","http://steamcommunity.com/id/Aym211/","16 products in account","Pay to win.","June 1","false","2.5"," 27 of 45 people (60%) found this review helpful 2 people found this review funny","60","27","45","2","0"
"http://steamcommunity.com/id/Chode_Master/recommended/433350/","Chode_Master","Chode Master","http://steamcommunity.com/id/Chode_Master/","126 products in account","â™¥â™¥â™¥â™¥â™¥â™¥â™¥â™¥ GAME, TRASHCAN","June 5","false","0.2"," 12 of 17 people (71%) found this review helpful 1 person found this review funny","71","12","17","0","0"
"http://steamcommunity.com/id/ksquaredgaming/recommended/433350/","ksquaredgaming","kSquared","http://steamcommunity.com/id/ksquaredgaming/","90 products in account","Don't play this...just don't even do it to yourself.\n\nCons\nYou may contract aids, cancer, and/or warts.","June 5","false","1.5"," 12 of 17 people (71%) found this review helpful 10 people found this review funny","71","12","17","10","3"
"http://steamcommunity.com/profiles/76561198012718100/recommended/433350/","76561198012718100","Maverick","http://steamcommunity.com/profiles/76561198012718100/","34 products in account","This is indeed a pay to win style game hit register is horrible cant even shoot threw glass window in alot of maps also lets say you set the bomb in the last 20 sec of the round the game will not go into overtime and your will lose no matter what horrible game i would rate it -10.","June 5","false","4.3"," 14 of 21 people (67%) found this review helpful","67","14","21","0","0"
"http://steamcommunity.com/profiles/76561198007420926/recommended/433350/","76561198007420926","Kaan_26","http://steamcommunity.com/profiles/76561198007420926/","127 products in account","NO","June 1","false","0.2"," 33 of 58 people (57%) found this review helpful 11 people found this review funny","57","33","58","11","0"
"http://steamcommunity.com/id/XideN/recommended/433350/","XideN","Xide","http://steamcommunity.com/id/XideN/","47 products in account","So quick review. THIS GAME\'S COMMUNITY WILL DIE IN ABOUT 3 WEEKS HURRY UP AND ENJOY IT BEFORE THEN. So now that that\'s out of the way.\n-It follows the classic early 2000s Pay to Play model where the user can buy limited time usage guns and ect to get the \"edge\" on other players. Literally EVERYONE knows this doesn\'t work on many levels.\n-The developers of this game seem to be heavily influenced by Counter Strike and wether thats a good thing or a bad thing is up to you.\n+At least the guns have pretty good variety.\n-Graphics obviously look poor and blood highly unrealistic, but hey you could have gotten that from the screenshots.\n+At least the guns have decent graphics.\n+As far as good things I can say about this game is at least it works, surprisingly. I haven\'t ran into any server disconnects and I doubt there will be any lag issues on the game\'s end, considering they only need enough server power for like the 10 people that are going to play this game.\n-Like 10 people will play this game.\nSo to wrap up if you want a game to quickly pick up and drop this is a somewhat good game to do so, waste an afternoon or play for a weekend. Hey its free right?","June 1","true","0.5"," 28 of 49 people (57%) found this review helpful 7 people found this review funny","57","28","49","7","1"
"http://steamcommunity.com/id/vadenvaden/recommended/433350/","vadenvaden","[CMB]SwaySway","http://steamcommunity.com/id/vadenvaden/","290 products in account",""Supply Box Won!",- how to spoken tutorial by this â™¥â™¥â™¥â™¥â™¥â™¥ game.\n\nBlackshot â™¥â™¥â™¥â™¥ing sucks, and it is a great example of a horrible Korean shooter.\n\nCons:\n-Horrible tutorial that treats you like an imbecile\n-Horrible graphics\n-Janky gameplay which takes no skill whatsoever\n-â™¥â™¥â™¥â™¥â™¥â™¥ motion blur\n-â™¥â™¥â™¥â™¥â™¥â™¥ community\n-Populated by chinese, brazillian and other african kids\n\nPros:\n-Breadwinners has more pros than this!\n\n1/10. Gaben, remove this from Steam. Devs, kill yourself.","June 5","false","1.3"," 17 of 28 people (61%) found this review helpful 1 person found this review funny","61","17","28","0","0"
"http://steamcommunity.com/id/DontExpectMuchBro/recommended/433350/","DontExpectMuchBro","[OM] Hydrogen ðŸ‘ŒðŸ»","http://steamcommunity.com/id/DontExpectMuchBro/","5 products in account","This game has potential but right now the game has severe issues.\nLike really bad issues such as the spawn killing the game is rife with that â™¥â™¥â™¥â™¥.\nthe only way i would recomend it is if you have a friend to play it with then you could have fun on your own.\n3/10.\nwould unistall again.","June 5","false","6.3"," 6 of 7 people (86%) found this review helpful","86","6","7","0","0"
"http://steamcommunity.com/profiles/76561198117643316/recommended/433350/","76561198117643316","rhumpunk","http://steamcommunity.com/profiles/76561198117643316/","173 products in account","Played 30 sec ,got kicked or banned ,abnormal activity detected. Game will be terminated.Waste 15min download for a shity game","June 5","false","0.2"," 7 of 9 people (78%) found this review helpful","78","7","9","0","0"
"http://steamcommunity.com/profiles/76561198075486856/recommended/433350/","76561198075486856","Cogz AKA Whitey","http://steamcommunity.com/profiles/76561198075486856/","62 products in account","Played it for a bout 30mins its just like other copy and paste f2p FPS some items u can only play for hours and then buy again so (p2w) Laggy af for australians looks like the original BF for a game thats made in last couple of years NO thanks","June 3","false","0.5"," 12 of 19 people (63%) found this review helpful 3 people found this review funny","63","12","19","3","0"
"http://steamcommunity.com/profiles/76561198091602279/recommended/433350/","76561198091602279","Bob Ross","http://steamcommunity.com/profiles/76561198091602279/","59 products in account","I don\'t mean to hate this game but it is absolutely garbage.\n\n\nTHE UNINSTALL BUTTON IS THE ONLY FUNCTIONING THING !!!!","June 1","false","0.3"," 21 of 37 people (57%) found this review helpful 12 people found this review funny","57","21","37","12","0"
"http://steamcommunity.com/id/DIEKAFIRSCUM/recommended/433350/","DIEKAFIRSCUM","Islamic State Special Forces â˜ª","http://steamcommunity.com/id/DIEKAFIRSCUM/","101 products in account","Must be the 100th Crossfire/CS ripoff.","June 1","false","0.5"," 38 of 70 people (54%) found this review helpful 13 people found this review funny","54","38","70","13","0"
"http://steamcommunity.com/id/Gandvlf/recommended/433350/","Gandvlf","Gandvlf","http://steamcommunity.com/id/Gandvlf/","6 products in account","worst game ive ever played","June 4","false","0.1"," 9 of 14 people (64%) found this review helpful 5 people found this review funny","64","9","14","5","0"
"http://steamcommunity.com/profiles/76561198101139870/recommended/433350/","76561198101139870","{MC} wazza1 â„¢","http://steamcommunity.com/profiles/76561198101139870/","18 products in account","Wow this game is pay to win like Bananas...seriously. Starting as a rookie people shoot you like they\'re killing birds and â™¥â™¥â™¥â™¥. I would advise to not play this game inless you want to shell your cash out right away for the most OP weapons.","June 1","false","1.1"," 21 of 38 people (55%) found this review helpful 1 person found this review funny","55","21","38","0","0"
