"url","reviewerUsername","reviewerDisplayName","reviewerUrl","reviewerProductsCount","reviewText","date","recommended","hoursPlayed","voteText","helpfulPercent","votesHelpful","votesTotal","votesFunny","commentsCount"
"http://steamcommunity.com/id/volnystove/recommended/433350/","volnystove","cameron","http://steamcommunity.com/id/volnystove/","1267 products in account","military obessed anime person tries to kill other military obessed anime person: the game","June 1","false","0.4"," 22 of 40 people (55%) found this review helpful 15 people found this review funny","55","22","40","15","0"
"http://steamcommunity.com/id/eXtraCrunchy/recommended/433350/","eXtraCrunchy","EZ4ME","http://steamcommunity.com/id/eXtraCrunchy/","78 products in account","If you need a ego boost you can download this game and pay to win.","June 5","false","2.0"," 6 of 9 people (67%) found this review helpful","67","6","9","0","0"
"http://steamcommunity.com/id/antychryst/recommended/433350/","antychryst","Kiryu Hanzo","http://steamcommunity.com/id/antychryst/","92 products in account","Lol, facepalming so hard right now.\nPeople calling this one a trash game and all that stuff.\n\nM8's that's a good old mmofps with fancy looking premium stuff and reliable weapons for in-game currency.\nVery much thanks to Vertigo Games for reviving this tittle, I appreciate this. Wish you luck with keeping this game alive as long as you can.\n\nIf the game is making you angry then just take a break instead telling people that this game is P2W, rly!?\n\nGot angry>Take a break>Play again and git gud. (You will learn how to play, just be patient and don't be a ragy flaming kid and don't accuse players of hacking/bugusing when they are just better than you, instead you could just tell them on all chat that they are good)\n\nPS: You will know when someone is hacking/bugusing. It's the only one thing I hate in games and I can understand when people are raging because of them cause they are destroying the fun of playing a game.\n\nYo good people there, play this game and leave a positive review if you like BlackShot, it deserves some thumbs up.","June 6","true","6.1"," 2 of 2 people (100%) found this review helpful","100","2","2","0","0"
"http://steamcommunity.com/id/lockeyeung/recommended/433350/","lockeyeung","CookieS","http://steamcommunity.com/id/lockeyeung/","11 products in account","rubbish\n","June 1","false","0.1"," 23 of 44 people (52%) found this review helpful 2 people found this review funny","52","23","44","2","0"
"http://steamcommunity.com/id/iLLKonfirmed/recommended/433350/","iLLKonfirmed","Chamberz-_-","http://steamcommunity.com/id/iLLKonfirmed/","20 products in account","The game is entertaining. Headshots are difficult to get but can be polished with a little practice and weapon choice. I like it....it reminds me of Soldier Front 2 which i loved. The cheating is really heartbreaking to me though. There are a lot of hackers running around with aimbots and speed hacks etc. If this is not fixed...it will kill the game. Guaranteed.","June 6","true","26.2"," 1 person found this review helpful","0","1","1","0","0"
"http://steamcommunity.com/profiles/76561198149811191/recommended/433350/","76561198149811191","Budamon von Maverick the -X-","http://steamcommunity.com/profiles/76561198149811191/","5 products in account","Okay I played this game for a little bit more then 1 hour probably almost 2, strangly the steam interface doesn't work for me. Well lets keep the long story short! If you don't mind graphics from 2002-2003 the game is solid. I was running around and it didn't happen that I kill traded, guns are easy to master and balanced, snipers are not to OP, and premium weapons only look good because otherwise they are not game changers. Who has the fastest reactions and best aim will always win. Okay some maps are borderline spawn camping sometimes but again if you learn the map you can fix that problem with good aim :). the game modes are fun especially running man. That game mode is reason enough to try this game out!\n\nOnly thing that I could consider as "bad" are the graphics. Now don't get me wrong I'm not a graphics â™¥â™¥â™¥â™¥â™¥ but still I mean they are a little bit btter then CS 1.6. Not as old but not as new aswell. Good thing about that is then it can run on everything from the year 2005 and above :D.\n\nGameplay like said is soild ! :D\nWould give this game a 8/10","June 6","true","2.0"," 3 of 5 people (60%) found this review helpful","60","3","5","0","0"
"http://steamcommunity.com/id/aniss97/recommended/433350/","aniss97","â˜†guardian","http://steamcommunity.com/id/aniss97/","17 products in account","bull â™¥â™¥â™¥â™¥ . played it many years ago . and can't join world serveur ... can't join any serveur\nalso it's pay2win just saying . many bugs . honestly . stay away","June 1","false","0.6"," 4 of 7 people (57%) found this review helpful","57","4","7","0","1"
"http://steamcommunity.com/profiles/76561198111472035/recommended/433350/","76561198111472035","SnIcKeR DoGG","http://steamcommunity.com/profiles/76561198111472035/","42 products in account","Uninstall button works well like for that but i cant start the game","June 3","false","0.2"," 5 of 9 people (56%) found this review helpful","56","5","9","0","0"
"http://steamcommunity.com/profiles/76561198045340051/recommended/433350/","76561198045340051","3 Dog","http://steamcommunity.com/profiles/76561198045340051/","77 products in account","This is awful.","June 3","false","0.4"," 8 of 15 people (53%) found this review helpful 1 person found this review funny","53","8","15","0","0"
"http://steamcommunity.com/profiles/76561198020889705/recommended/433350/","76561198020889705","green_ghost08","http://steamcommunity.com/profiles/76561198020889705/","77 products in account","the Tutorial treats you like you've never played a video game before in your whole life.","June 1","false","0.1"," 19 of 37 people (51%) found this review helpful 20 people found this review funny","51","19","37","20","0"
"http://steamcommunity.com/profiles/76561198063120485/recommended/433350/","76561198063120485","blackwoio","http://steamcommunity.com/profiles/76561198063120485/","233 products in account","P2w m8","June 2","false","1.3"," 14 of 28 people (50%) found this review helpful 4 people found this review funny","50","14","28","4","0"
"http://steamcommunity.com/id/Kagesuta/recommended/433350/","Kagesuta","Kagesuta","http://steamcommunity.com/id/Kagesuta/","203 products in account","It's free to play ... yeah that's true. But you can buy yourself some cool armor and crazy guns to get kills in a much easier way.","June 3","false","0.6"," 7 of 14 people (50%) found this review helpful","50","7","14","0","0"
"http://steamcommunity.com/profiles/76561198273655331/recommended/433350/","76561198273655331","Sammyto","http://steamcommunity.com/profiles/76561198273655331/","9 products in account","this game is bad is just awful i dont even have the right words for it","June 6","false","0.4"," 1 of 2 people (50%) found this review helpful","50","1","2","0","0"
"http://steamcommunity.com/profiles/76561198226269948/recommended/433350/","76561198226269948","Tech4Coke14","http://steamcommunity.com/profiles/76561198226269948/","6 products in account","Not Going to say I hate this game nor would I say I love this game. Plays like CS:GO with shooting style but graphics are terrible even on high def a low spec computer game.","June 1","false","0.2"," 17 of 35 people (49%) found this review helpful","49","17","35","0","0"
"http://steamcommunity.com/profiles/76561198022145804/recommended/433350/","76561198022145804","MONTTi","http://steamcommunity.com/profiles/76561198022145804/","3 products in account","This game wants only your money, if u become a pro player they will ban your acounts after u spent money on it because they just can.\nThe GM TEAM does not accept a "player" whos better then them, so they will ban you for no reason and your gonna loose your money .\nReally, this game is okey , but the GM team is really bad. Trust me, dont play it !","June 2","false","0.3"," 15 of 31 people (48%) found this review helpful 1 person found this review funny","48","15","31","0","0"
"http://steamcommunity.com/id/mistakes07/recommended/433350/","mistakes07","Mistakes","http://steamcommunity.com/id/mistakes07/","24 products in account","HUGE DISSAPOINTMENT ! As a veteran of this game i was really hype for steam version of Blackshot cuz i though it will start from the begging with fresh new ranks and server also with the basic weapons (for the begginng) but steam version of this game is just a portal to the current server which has tons of hackers and macro users. If you want to deal with them you are welcome to download the game","June 1","false","0.3"," 6 of 13 people (46%) found this review helpful 1 person found this review funny","46","6","13","0","0"
"http://steamcommunity.com/profiles/76561198041148162/recommended/433350/","76561198041148162","Its Only Logical","http://steamcommunity.com/profiles/76561198041148162/","95 products in account","This Isnt Even That Good Its A Poor Man's Version Counter strike go saying that is being extremely generous now im about to rip in to it its a pay to win its full of hackers and the pay to win aspect i dont want to get into but this makes combat arms look like a â™¥â™¥â™¥â™¥ing party this one is nothing like it its trying to be something its not the recoil is â™¥â™¥â™¥â™¥ed trust me i know","June 1","false","1.7"," 6 of 13 people (46%) found this review helpful","46","6","13","0","0"
"http://steamcommunity.com/profiles/76561198047922559/recommended/433350/","76561198047922559","Towarzysz Jaruzelski","http://steamcommunity.com/profiles/76561198047922559/","27 products in account","The biggest pay2win game that i played","June 1","false","0.9"," 5 of 11 people (45%) found this review helpful 2 people found this review funny","45","5","11","2","0"
"http://steamcommunity.com/id/irateblackman/recommended/433350/","irateblackman","HUH","http://steamcommunity.com/id/irateblackman/","1120 products in account","just really laggy, bad hit reg, extremely p2w","June 2","false","2.9"," 3 of 7 people (43%) found this review helpful","43","3","7","0","0"
"http://steamcommunity.com/id/lemonisfreedom/recommended/433350/","lemonisfreedom","Fox","http://steamcommunity.com/id/lemonisfreedom/","10 products in account","â™¥â™¥â™¥â™¥ game","June 1","false","2.2"," 3 of 7 people (43%) found this review helpful","43","3","7","0","0"
"http://steamcommunity.com/id/KaiRechy/recommended/433350/","KaiRechy","Kai","http://steamcommunity.com/id/KaiRechy/","155 products in account","the game is â™¥â™¥â™¥â™¥","June 3","false","0.3"," 2 of 5 people (40%) found this review helpful","40","2","5","0","0"
"http://steamcommunity.com/id/DOUBLEK5/recommended/433350/","DOUBLEK5","Ðš.G.R â—¥â–¶_â—€â—¤","http://steamcommunity.com/id/DOUBLEK5/","11 products in account","the dev's deleted my Review . so here's another one","June 2","false","0.2"," 2 of 5 people (40%) found this review helpful","40","2","5","0","0"
"http://steamcommunity.com/profiles/76561198069391931/recommended/433350/","76561198069391931","â™¥IT'S_MUFFIN_TIMEâ™¥","http://steamcommunity.com/profiles/76561198069391931/","3 products in account","The tutorial is bull â™¥â™¥â™¥â™¥! everyone knows how a FPS works i don't need a 5-10 min tutorial for that! I am a old player of this game and it was way more fun without the bull â™¥â™¥â™¥â™¥ tutorial.","June 2","false","0.1"," 2 of 5 people (40%) found this review helpful 1 person found this review funny","40","2","5","0","0"
"http://steamcommunity.com/id/TheKingOfLag/recommended/433350/","TheKingOfLag","King Of Laggy Games","http://steamcommunity.com/id/TheKingOfLag/","25 products in account","lol no","June 6","false","0.2"," 2 of 5 people (40%) found this review helpful 1 person found this review funny","40","2","5","0","0"
"http://steamcommunity.com/profiles/76561198044851677/recommended/433350/","76561198044851677","Hated-Zombie IGYB","http://steamcommunity.com/profiles/76561198044851677/","84 products in account","I love free to play FPS games, but just don't. I'm someone that loves to try fps games and you might be to, but just forget this one.","June 3","false","0.7"," 1 of 3 people (33%) found this review helpful","33","1","3","0","0"
"http://steamcommunity.com/profiles/76561198126887152/recommended/433350/","76561198126887152","|XEROSO|","http://steamcommunity.com/profiles/76561198126887152/","1 product in account","Se Melhorase seria melhor . !","June 2","false","0.2"," 1 of 3 people (33%) found this review helpful 2 people found this review funny","33","1","3","2","0"
"http://steamcommunity.com/id/Yolo_Log/recommended/433350/","Yolo_Log","King of the Blood Crusade","http://steamcommunity.com/id/Yolo_Log/","15 products in account","This game is a total waste of HD space... I joined a random lobby and couldn't kill someone.... I wasted 3 clips on them and couldn't kill them.... they turn to me... 1 shot me.","June 4","false","0.3"," 1 of 3 people (33%) found this review helpful","33","1","3","0","0"
"http://steamcommunity.com/id/antonuuu/recommended/433350/","antonuuu","antonuuu","http://steamcommunity.com/id/antonuuu/","655 products in account","For being free to play it's pretty good!\nIt's not Battlefield, Call of Duty or Counter Strike but an good ol' game with some elements of various games!\nFor example weapon skins (in-game, non tradable) and melee combat!\n\nPlay it for some moments of fun and re-experience the mid 2000 era of FPS games!\n\nYes.","June 5","true","3.5"," 1 of 3 people (33%) found this review helpful","33","1","3","0","0"
"http://steamcommunity.com/id/girmlock/recommended/433350/","girmlock","Nacho Cheese","http://steamcommunity.com/id/girmlock/","135 products in account","Got mixed review about this. I loged in on the second day. But for whatever reason told me I did on the third day... pah","June 3","false","6.6"," 0 of 1 people (0%) found this review helpful","0","0","1","0","0"
"http://steamcommunity.com/profiles/76561198074249382/recommended/433350/","76561198074249382","V2ng","http://steamcommunity.com/profiles/76561198074249382/","59 products in account","After 3.5 years of not playing i decided to play it back but there are some issues that need to be fixed.Most importants re lag, crash and optimizing display resolution.I tried to play it after long time but  i couldnt.In the past the game has proffesional players but now  It seems more like a child game. I dont recommend until those issues get fixed.Also I m thankful to vertigo games.They made me remember good memories.","June 1","false","0.4"," 0 of 1 people (0%) found this review helpful","0","0","1","0","0"
"http://steamcommunity.com/id/MisfitsFiend/recommended/433350/","MisfitsFiend","Thrash","http://steamcommunity.com/id/MisfitsFiend/","82 products in account","I have no idea why I wanted to try it out even though I knew it was bad.","June 5","false","0.4"," 0 of 1 people (0%) found this review helpful 1 person found this review funny","0","0","1","0","0"
"http://steamcommunity.com/id/vellvrosch/recommended/433350/","vellvrosch","vellvrosch","http://steamcommunity.com/id/vellvrosch/","32 products in account","- bugs since years\n- weak performance engine\n- servers need upgrade in performance and connection\n- cheat protection kills logitech software services\n- no way for even competitive rooms\n- p4w chars/weps\n\n+ gfx is so nicely retro","June 6","false","1.3"," 0 of 1 people (0%) found this review helpful","0","0","1","0","0"
"http://steamcommunity.com/id/jater/recommended/433350/","jater","Jater","http://steamcommunity.com/id/jater/","188 products in account","This game is Pure Garbage.\nLaggy Control, Bad Graphic, Expensive Gun, Ugly Map\nBest Uninstall Simulator.","June 2","false","0.4"," 5 of 12 people (42%) found this review helpful 4 people found this review funny","42","5","12","4","1"
"http://steamcommunity.com/id/GGherakul/recommended/433350/","GGherakul","â˜ Burnâ˜ ","http://steamcommunity.com/id/GGherakul/","28 products in account","this game is death.","June 2","false","2.0"," 5 of 12 people (42%) found this review helpful 4 people found this review funny","42","5","12","4","0"
"http://steamcommunity.com/id/TheWalkyrian/recommended/433350/","TheWalkyrian","Walkyr","http://steamcommunity.com/id/TheWalkyrian/","212 products in account","No.","June 1","false","0.5"," 4 of 10 people (40%) found this review helpful 2 people found this review funny","40","4","10","2","0"
"http://steamcommunity.com/id/thegamer420/recommended/433350/","thegamer420","[WatS] SnekkyPikle","http://steamcommunity.com/id/thegamer420/","105 products in account","It tried so hard to be CS:GO... so... damn... hard","June 1","false","4.1"," 4 of 10 people (40%) found this review helpful 1 person found this review funny","40","4","10","0","0"
"http://steamcommunity.com/profiles/76561198032767895/recommended/433350/","76561198032767895","Catalyst","http://steamcommunity.com/profiles/76561198032767895/","352 products in account","Just don't play this badly coded game. Everything sucks there. I play it only to get 100%.","June 2","false","1.6"," 3 of 8 people (38%) found this review helpful","38","3","8","0","0"
"http://steamcommunity.com/id/NAANNOOO/recommended/433350/","NAANNOOO","(((Nano Shinonome)))","http://steamcommunity.com/id/NAANNOOO/","1185 products in account","no","June 2","false","0.2"," 3 of 8 people (38%) found this review helpful","38","3","8","0","0"
"http://steamcommunity.com/profiles/76561198091884702/recommended/433350/","76561198091884702","Derpy","http://steamcommunity.com/profiles/76561198091884702/","302 products in account","i don't like it.\n\nnot much else.","June 2","false","0.3"," 3 of 8 people (38%) found this review helpful","38","3","8","0","0"
"http://steamcommunity.com/profiles/76561198019487904/recommended/433350/","76561198019487904","SickWs6","http://steamcommunity.com/profiles/76561198019487904/","118 products in account","Dontt do itt","June 1","false","0.2"," 3 of 8 people (38%) found this review helpful","38","3","8","0","0"
"http://steamcommunity.com/id/neboh420/recommended/433350/","neboh420","DJ Deja Voodoo","http://steamcommunity.com/id/neboh420/","193 products in account","Meh, another generic Crossfire/Combat Arms game.","June 1","false","0.3"," 2 of 6 people (33%) found this review helpful","33","2","6","0","1"
"http://steamcommunity.com/id/Peraio/recommended/433350/","Peraio","Stutterâ„¢","http://steamcommunity.com/id/Peraio/","85 products in account","Baixei sÃ³ pra desinstalar. Dizer que esse jogo Ã© lixo Ã© um elogio.","June 2","false","0.9"," 2 of 6 people (33%) found this review helpful","33","2","6","0","0"
"http://steamcommunity.com/id/Peraio/recommended/433350/","Peraio","Stutterâ„¢","http://steamcommunity.com/id/Peraio/","85 products in account","Baixei sÃ³ pra desinstalar. Dizer que esse jogo Ã© lixo Ã© um elogio.","June 2","false","0.9"," 2 of 6 people (33%) found this review helpful","33","2","6","0","0"
"http://steamcommunity.com/id/neboh420/recommended/433350/","neboh420","DJ Deja Voodoo","http://steamcommunity.com/id/neboh420/","193 products in account","Meh, another generic Crossfire/Combat Arms game.","June 1","false","0.3"," 2 of 6 people (33%) found this review helpful","33","2","6","0","1"
"http://steamcommunity.com/profiles/76561198210708359/recommended/433350/","76561198210708359","MrDeyveeN - enCRYpti0n","http://steamcommunity.com/profiles/76561198210708359/","2 products in account","First of all, I see a lot of people complaining about the fact that they have a lot of problems to start the game (error codes etc...).\nIf you have any problems with the game, join us on the Blackshot Global official forum > http://nforum.blackshot.com/ , login with your Blackshot account, and ask for help. Your problem will be solved asap.\n\nSecond of all, a lot of people are complaining about the amount of hackers. Of course there are currently some hackers, I'm not going to lie, but this is just a matter of time. The Vertigo team (with the help of the Blackshot GameMasters and with the help of the community) are working on it and are patching every single "hack release" everyday.\n\nAnd third of all, I highly suggest you to play in the "beginner" channels so you can play with players from your level. It will be way easier for you if you play this game for the first time ! I also recommend you to check the Blackshot forum (with the link above) and check the "Tips and Tactics" section of the forum. Some players are giving their opinions about their favorite weapons etc... It can be usefull ! :)\n\nSimply one of the best free-to-play game you can find. Give it a try you won't regret it !","June 6","true","19.1"," 2 of 6 people (33%) found this review helpful","33","2","6","0","0"
"http://steamcommunity.com/id/NozaTrix/recommended/433350/","NozaTrix","NozaTrix","http://steamcommunity.com/id/NozaTrix/","7 products in account","Developers or Developer Please fix the crashes they are really annoying and i cant play the game i would give a rating to this game but i cant, since i havent played it properly now i will wait till they will be fixed so i can have a look at this game so please fix these crashes\nAnd i am not recommending trying to play this game because it crashes every single time i try turning it on, those who played this game already so good for them but those crashes ain\'t gonna fix them selves.","June 1","false","0.4"," 1 of 4 people (25%) found this review helpful","25","1","4","0","0"
"http://steamcommunity.com/profiles/76561198187904166/recommended/433350/","76561198187904166","Hien","http://steamcommunity.com/profiles/76561198187904166/","22 products in account","Hello Friends and other people.\n\nPlz Do NOT for any reason play this game it is not worth your time or money.\nYou can basically kill everyone on the enemy team with melee since there dosen\'t seem to be any spawn protection at all.\nall the BC guns are all pee shoothers while the BCS guns are all god tier and a must have inorder to get a decent play through.\nAnd there is much more but for now the uninstill buttons is there so use it.\n\nPros:\nThe snipers are decent.\n\nCons:\nEverything.\n\n","June 1","false","0.7"," 1 of 4 people (25%) found this review helpful","25","1","4","0","0"
"http://steamcommunity.com/profiles/76561198115930129/recommended/433350/","76561198115930129","Roy Franks","http://steamcommunity.com/profiles/76561198115930129/","137 products in account","Game takes ages to load up. Game hack detected, crashes. Game sucks, it shouldn\'t have been greenlight.","June 1","false","0.1"," 1 of 4 people (25%) found this review helpful 1 person found this review funny","25","1","4","0","0"
"http://steamcommunity.com/profiles/76561198270965462/recommended/433350/","76561198270965462","Snakedog49","http://steamcommunity.com/profiles/76561198270965462/","13 products in account","I find it kind of a poorly made game. The screen occasionaly glitches and moves the barrel away from the enemy whilst shooting. The graphics look like the came from the old team fortress 2. Overall its an ok game. I still prefer Team fortress 2.\nI guess I would only play it when im really bored. Also the menu is really confusing and hard to use.","June 2","false","0.3"," 1 of 4 people (25%) found this review helpful","25","1","4","0","0"
"http://steamcommunity.com/id/hocksmonovits/recommended/433350/","hocksmonovits","Hocksmonovits","http://steamcommunity.com/id/hocksmonovits/","413 products in account","I would rather not have anything to play.","June 1","false","0.4"," 1 of 4 people (25%) found this review helpful 1 person found this review funny","25","1","4","0","0"
"http://steamcommunity.com/id/nutrage5/recommended/433350/","nutrage5","AcApELa*|NuTraGee!","http://steamcommunity.com/id/nutrage5/","13 products in account","Nice Game !","June 6","true","2.4"," 1 of 4 people (25%) found this review helpful","25","1","4","0","0"
"http://steamcommunity.com/id/GamesAmongOtherThings/recommended/433350/","GamesAmongOtherThings","SnowwAxius","http://steamcommunity.com/id/GamesAmongOtherThings/","146 products in account","It seems everyone hates this game. I don't, however.\nYes, servers are hard to get in and sometimes players are far and few between, but the game isn't bad in itself.\nThe connection, at least on my end seemed pretty bad. Reloading was delayed, and not instantaneous, the ironsights are horrific on one of the SMG's, and the players... aren't very talkative. Yes, its also incredibly pay to win.\nBased on these facts, i'll let you guys make your decision about whether or not to install this, but I find it hard to recommend, but hard to not recommend. Almost wish steam had a Eh... button in between Yes and No when recommending games.\nSo I guess, I can't really recommend it.","June 4","false","0.8"," 0 of 2 people (0%) found this review helpful","0","0","2","0","0"
"http://steamcommunity.com/profiles/76561198257225512/recommended/433350/","76561198257225512","FlobN123 (sk)","http://steamcommunity.com/profiles/76561198257225512/","2 products in account","Hello when i buy something in shop and i use it it write:Its not available on this character how can i change my character?","June 6","true","2.8"," 0 of 2 people (0%) found this review helpful","0","0","2","0","0"
"http://steamcommunity.com/id/Airsoftfansss/recommended/433350/","Airsoftfansss","Richado","http://steamcommunity.com/id/Airsoftfansss/","6 products in account","this game is piece of â™¥â™¥â™¥â™¥ it just crashes all the time!!!!!","June 1","false","0.1"," 16 of 35 people (46%) found this review helpful 2 people found this review funny","46","16","35","2","0"
