"url","reviewerUsername","reviewerDisplayName","reviewerUrl","reviewerProductsCount","reviewText","date","recommended","hoursPlayed","voteText","helpfulPercent","votesHelpful","votesTotal","votesFunny","commentsCount"
"http://steamcommunity.com/id/onlyyg/recommended/433350/","onlyyg","SOO","http://steamcommunity.com/id/onlyyg/","16 products in account","At last! BlackShot is on Steam. I'm so happy!!\nBeen playing BlackShot for 5 years now. SEA as well as Global. BlackShot Steam is Global servers so that is that.\n\nFor those that haven't played, you should give it shot and see for yourselves. Yes it is old, yes the korean F2P FPS's are similar. BUT Blackshot has an uniqueness that I can't say in words!\n\nAgain try and give it a shot. I like it, you might too.","June 2","true","0.6"," 3 of 12 people (25%) found this review helpful 1 person found this review funny","25","3","12","0","0"
"http://steamcommunity.com/profiles/76561198216026059/recommended/433350/","76561198216026059","Shamar","http://steamcommunity.com/profiles/76561198216026059/","5 products in account","Good game 8/10.\nBut i keep crashing for some reason","June 4","true","4.1"," 2 of 10 people (20%) found this review helpful 1 person found this review funny","20","2","10","0","0"
"http://steamcommunity.com/id/NAHUEDESIGN/recommended/433350/","NAHUEDESIGN","<DnR> #BAN<3","http://steamcommunity.com/id/NAHUEDESIGN/","54 products in account","BS is needing more fixes... but i like it :D the ranks are normal... 8.5/10","June 5","true","7.5"," 0 of 6 people (0%) found this review helpful","0","0","6","0","0"
"http://steamcommunity.com/id/zlkheil/recommended/433350/","zlkheil","joon","http://steamcommunity.com/id/zlkheil/","72 products in account","Good game, easy to play,\njust a good game to play with low spec PC :)","June 1","true","1.1"," 5 of 17 people (29%) found this review helpful 2 people found this review funny","29","5","17","2","1"
"http://steamcommunity.com/profiles/76561198119879939/recommended/433350/","76561198119879939","kygon","http://steamcommunity.com/profiles/76561198119879939/","2 products in account","Oldie but goodie.\nPretty fun after getting used to. BlackShot was pretty big couple years back. I understand why now.\nI'll update after playing couple days.","June 1","true","3.3"," 2 of 11 people (18%) found this review helpful","18","2","11","0","0"
"http://steamcommunity.com/profiles/76561198205538993/recommended/433350/","76561198205538993","dartenglish","http://steamcommunity.com/profiles/76561198205538993/","30 products in account","Havent Played the game yet cause Vista sucks but I will made Planetside 2 Run like Halo or Planetside 1 on Vista Ran well when I was done All UI got to say is this game WILL NOT be dead in 3 week this game is exactly what people that dont wanna spend 400$ on a pc and another 800$ to run what we have seen so far from the Next Gen.... this game is perfect for low end or straight off the shelves PC's a slight upgrade from CS 1.6 and makes your crappy PC look like it can do so much more when you and I both know chances are pretty slim to none PAY2WIN Simple -Dont you'll get just as good if not better than P2W with 20+ hrs in ANY P2W game I have spent the time to prove this.","June 3","true","0.2"," 2 of 11 people (18%) found this review helpful 2 people found this review funny","18","2","11","2","0"
"http://steamcommunity.com/profiles/76561198058786275/recommended/433350/","76561198058786275","Blackify","http://steamcommunity.com/profiles/76561198058786275/","24 products in account","Sick Game but can u make it possible to Keybind keys from mouse to other keys on game i have 6 button mouse and it won't let me bind them to weopon 1 and 2\n","June 5","true","15.4"," 1 of 9 people (11%) found this review helpful","11","1","9","0","0"
"http://steamcommunity.com/profiles/76561198255474785/recommended/433350/","76561198255474785","-ADAM-","http://steamcommunity.com/profiles/76561198255474785/","1 product in account","very old game. dont wast time its 1980s game","June 1","false","0.3"," 0 of 7 people (0%) found this review helpful","0","0","7","0","0"
"http://steamcommunity.com/profiles/76561198232794864/recommended/433350/","76561198232794864","Undeadsoldier11","http://steamcommunity.com/profiles/76561198232794864/","2 products in account","SWAGSWAGSWAGSWAGSWAGSWAGSWAGSWAGSWAGSWAGSWAGSWAGSWAGSWAGSWAGSWAGSWAGSWAGSWAGSWAGSWAGSWAGWAGW kill me now","June 3","true","9.8"," 0 of 7 people (0%) found this review helpful","0","0","7","0","0"
"http://steamcommunity.com/id/JaxJax69/recommended/433350/","JaxJax69","JaxJax | stonefire.io","http://steamcommunity.com/id/JaxJax69/","29 products in account","Playing this game since years ago\ni still like it ^^","June 1","true","10.9"," 7 of 22 people (32%) found this review helpful 2 people found this review funny","32","7","22","2","0"
"http://steamcommunity.com/id/2573114111/recommended/433350/","2573114111","OveRLoaDED22","http://steamcommunity.com/id/2573114111/","18 products in account","Graphics like CS1.6\nGameplay like CSGO\nModern Guns\nHardscoping\nP2W ( kind of )\nGood game","June 5","true","0.8"," 3 of 14 people (21%) found this review helpful 4 people found this review funny","21","3","14","4","0"
"http://steamcommunity.com/profiles/76561198127715942/recommended/433350/","76561198127715942","gastar95","http://steamcommunity.com/profiles/76561198127715942/","4 products in account","Decent game. BlackShot along with the other korean fps games are several years old. However that doesn\'t mean the game is bad. Should give it a shot and try it out.\nOne thing you must do is change the resolution. Default is 1024 * 768. The game looks so much better at 1900 x 1200.\n\nDefinently worth it considering it\'s free to play. Plently of worse games on steam imho.\n","June 1","true","1.3"," 3 of 14 people (21%) found this review helpful 1 person found this review funny","21","3","14","0","0"
"http://steamcommunity.com/profiles/76561198075134164/recommended/433350/","76561198075134164","â™” SÎ±Ð¼Ï…ÑÎ±Ä± â™š","http://steamcommunity.com/profiles/76561198075134164/","23 products in account","Fun game not a buy to win","June 4","true","2.5"," 2 of 12 people (17%) found this review helpful 2 people found this review funny","17","2","12","2","0"
"http://steamcommunity.com/id/EhEhEbola/recommended/433350/","EhEhEbola","èŽ«å“ˆæœ«-PrinceKilla-èŽ«å“ˆæœ«","http://steamcommunity.com/id/EhEhEbola/","2 products in account","IN MY POINT OF VIEW THIS IS A GREAT GAME TILL NOW I DONT HAVE ANY DISADVANTAGES IN THE GAME IM ENJOYING IT AND I RECOMMEND PEOPLE TO TRY PLAYING IT AND THAT ALOT OF PEOPLE SAY THAT ITS A BAD GAME DURING TO MANY COMPARISIONS FOR THE GAMES GRAPHICS  AND THAT IT IS OLD  BUT THEY MADE IT WORSE BY ITS GAMEPLAY AND WEAPONS IN THE GAME AND IT IS SOMETIMES BAD TO JUST COMMENT AND WRITING SOMETHING CRUEL AND TO TALK ABOUT A GAME THAT CAME 3 DAYS AGO AND THAT YOU STILL DIDNT PLAY IT .","June 4","true","1.8"," 2 of 12 people (17%) found this review helpful 4 people found this review funny","17","2","12","4","4"
"http://steamcommunity.com/profiles/76561198036247281/recommended/433350/","76561198036247281","darkswift","http://steamcommunity.com/profiles/76561198036247281/","10 products in account","yes","June 5","true","9.3"," 0 of 8 people (0%) found this review helpful","0","0","8","0","0"
"http://steamcommunity.com/profiles/76561198089682007/recommended/433350/","76561198089682007","lucasrocha225","http://steamcommunity.com/profiles/76561198089682007/","19 products in account","If your are looking for a fun F2P FPS. That\'s your game!\nOf course you\'ll wont find a AAA graphics and cut scenes.\nBut, the fast passed battle and different variety of weapons will definetely get you hooked.\nI just began, but I feel this is the kind of game that is best played with a group of friends (bringing back that retro feel from playing CS on lan cafes)","June 1","true","3.1"," 5 of 19 people (26%) found this review helpful 1 person found this review funny","26","5","19","0","0"
"http://steamcommunity.com/id/MonkE_Y/recommended/433350/","MonkE_Y","MonkE Y","http://steamcommunity.com/id/MonkE_Y/","23 products in account","Love this game, if you like cs 1.6, and cod 4 get this game, very fun and addictive :)","June 2","true","13.2"," 4 of 17 people (24%) found this review helpful","24","4","17","0","4"
"http://steamcommunity.com/profiles/76561198054492879/recommended/433350/","76561198054492879","shadowgun223","http://steamcommunity.com/profiles/76561198054492879/","103 products in account","i think it is a very gooood game for non-skilled players","June 4","true","0.7"," 0 of 9 people (0%) found this review helpful 1 person found this review funny","0","0","9","0","0"
"http://steamcommunity.com/id/E_Ballard/recommended/433350/","E_Ballard","Etrius","http://steamcommunity.com/id/E_Ballard/","29 products in account","Dead at Spawn Simulator 2016\n\nHoly crap, are we in 2002?\nEven CS is better than this guys... and i mean it!","May 31","false","0.3"," 27 of 68 people (40%) found this review helpful 9 people found this review funny","40","27","68","9","3"
"http://steamcommunity.com/profiles/76561198304672634/recommended/433350/","76561198304672634","Hybrid","http://steamcommunity.com/profiles/76561198304672634/","1 product in account","Let the ban wave begin, for no reason, or for a silly one. You steam will regret this GameMasters â™¥â™¥â™¥â™¥â™¥â™¥â™¥â™¥ team. I promisse!","June 1","false","0.7"," 14 of 40 people (35%) found this review helpful 9 people found this review funny","35","14","40","9","0"
"http://steamcommunity.com/profiles/76561198117674830/recommended/433350/","76561198117674830","MilKeyStorm","http://steamcommunity.com/profiles/76561198117674830/","155 products in account","Good Game","June 3","true","14.4"," 3 of 16 people (19%) found this review helpful 1 person found this review funny","19","3","16","0","0"
"http://steamcommunity.com/profiles/76561198097443979/recommended/433350/","76561198097443979","neowarspawn","http://steamcommunity.com/profiles/76561198097443979/","7 products in account","great game","June 1","true","6.2"," 4 of 19 people (21%) found this review helpful 2 people found this review funny","21","4","19","2","0"
"http://steamcommunity.com/profiles/76561198179519187/recommended/433350/","76561198179519187","mike-vandekamp","http://steamcommunity.com/profiles/76561198179519187/","2 products in account","GOOOD,\n\nAfter playing this for 5 years i still love it.","June 1","true","28.3"," 3 of 17 people (18%) found this review helpful 3 people found this review funny","18","3","17","3","0"
"http://steamcommunity.com/id/SirMistic/recommended/433350/","SirMistic","Soul Eater","http://steamcommunity.com/id/SirMistic/","46 products in account","To be fair, it just came out today (on Steam). The game has a lot of potential, but it lacks..... I\'m not even sure right now.\n\nThis game doesn\'t have to fit everyone\'s standards and the game is fun. Although (to me felt kind of awkward at first) you begin to enjoy the game for what it is. I can\'t complain about a game that just came out, so I don\'t feel as if anything\'s wrong. The game feels like (any)Counter Strike, but has a weird feeling of Metal Gear Solid for some weird reason. But anyways, with time this review may change, it may not, but one things for sure is that the game is free and if you want a cheap Counter Strike knock-off, play this, or spend your money over to the Devs at CS/Valve. If you are going to play this, I would recommend it if you would want to boost your ego then play CSGO afterwards  :P  .","June 1","true","0.7"," 13 of 40 people (33%) found this review helpful 3 people found this review funny","33","13","40","3","1"
"http://steamcommunity.com/id/novoselov6/recommended/433350/","novoselov6","PervKing","http://steamcommunity.com/id/novoselov6/","27 products in account","Fun game , i enjoy it. not p2w. fast paced and fun mods.","May 31","true","10.2"," 21 of 58 people (36%) found this review helpful 2 people found this review funny","36","21","58","2","0"
"http://steamcommunity.com/id/jameelallen/recommended/433350/","jameelallen","âœª JAMEEL24â„¢","http://steamcommunity.com/id/jameelallen/","30 products in account","Don't hate Black lives matter, ROK ON! :D","June 1","true","8.0"," 3 of 18 people (17%) found this review helpful 2 people found this review funny","17","3","18","2","0"
"http://steamcommunity.com/id/ElevenGram/recommended/433350/","ElevenGram","Y SO","http://steamcommunity.com/id/ElevenGram/","37 products in account","Tutorial lady is hot but useless...\nGameplay-wise though, I think it\'s one of the best fast-paced FPS games in the F2P market.\nUI design, controls are simple and it has pretty great sound effects.\n","June 1","true","2.4"," 11 of 36 people (31%) found this review helpful 8 people found this review funny","31","11","36","8","0"
"http://steamcommunity.com/profiles/76561198095820914/recommended/433350/","76561198095820914","bigrevkev55","http://steamcommunity.com/profiles/76561198095820914/","6 products in account","This is probably the best online FPS game I've ever played on PC.","June 3","true","20.0"," 2 of 16 people (13%) found this review helpful 1 person found this review funny","13","2","16","0","1"
"http://steamcommunity.com/id/insaaned/recommended/433350/","insaaned","Subscribed","http://steamcommunity.com/id/insaaned/","6 products in account","Best game ever!!!\nCheck out my Youtube channel:\nhttps://www.youtube.com/channel/UCDTLRoO1MIeWs6Omkjqbo1A?&ab_channel=SubscribedBlackshot","June 5","true","0.1"," 0 of 12 people (0%) found this review helpful","0","0","12","0","1"
"http://steamcommunity.com/profiles/76561198192373319/recommended/433350/","76561198192373319","benyeliminator","http://steamcommunity.com/profiles/76561198192373319/","10 products in account","perfect game for low spec.computers.\n\nvery good gameplay too","June 1","true","6.7"," 12 of 39 people (31%) found this review helpful 5 people found this review funny","31","12","39","5","0"
"http://steamcommunity.com/id/legiongfx/recommended/433350/","legiongfx","LEGION | Kinguin.net","http://steamcommunity.com/id/legiongfx/","41 products in account","Fun game! Gives you free stuff and isn\'t P2W","June 1","true","0.5"," 10 of 35 people (29%) found this review helpful 1 person found this review funny","29","10","35","0","0"
"http://steamcommunity.com/profiles/76561198268982523/recommended/433350/","76561198268982523","smalenN1k","http://steamcommunity.com/profiles/76561198268982523/","5 products in account","ddd","June 5","true","0.5"," 0 of 13 people (0%) found this review helpful","0","0","13","0","0"
"http://steamcommunity.com/id/OfficialShz/recommended/433350/","OfficialShz","=THS= Thorveson [VI]","http://steamcommunity.com/id/OfficialShz/","77 products in account","I used to play this back in the days, loads of fun. Premium or not you can get the items without it, that\'s the point for this game to have a market. But some people just don\'t understand.\nGIT GUD","June 1","true","11.9"," 6 of 27 people (22%) found this review helpful 3 people found this review funny","22","6","27","3","0"
"http://steamcommunity.com/id/kokuchou/recommended/433350/","kokuchou","Ashe AP is OP","http://steamcommunity.com/id/kokuchou/","185 products in account","What\'s this hate? BlackShot is a solid F2P FPS.\nDon\'t want to spend money? Kill other players and grab their shop items weapons.\n","June 1","true","9.5"," 5 of 25 people (20%) found this review helpful 5 people found this review funny","20","5","25","5","0"
"http://steamcommunity.com/id/Arctiq/recommended/433350/","Arctiq","Arctiq","http://steamcommunity.com/id/Arctiq/","578 products in account","This is just a â™¥â™¥â™¥â™¥â™¥ier version of Combat Arms.","May 31","false","0.4"," 8 of 34 people (24%) found this review helpful 1 person found this review funny","24","8","34","0","0"
"http://steamcommunity.com/id/jayyson123/recommended/433350/","jayyson123","Jason","http://steamcommunity.com/id/jayyson123/","374 products in account","these shooting mechanics make no sense to me\nits like they have recoil and then they dont have recoil..?","May 31","false","0.4"," 8 of 34 people (24%) found this review helpful 1 person found this review funny","24","8","34","0","1"
"http://steamcommunity.com/id/sleepydoughboi/recommended/433350/","sleepydoughboi","â„¢SleepyDoughBoiâ˜ ","http://steamcommunity.com/id/sleepydoughboi/","1734 products in account","Ahahaha just don\'t waste your time downloading this.  Gameplay is super slow grenade does not leave your hand until 2-3 seconds after trowing it, hit box is off, Characters all Looks Chubby, Weapon fire rate is not responsive sometimes so yeah Only spent few mins on this game and I already Un-installed it xD.","May 31","false","0.4"," 11 of 41 people (27%) found this review helpful 4 people found this review funny","27","11","41","4","3"
"http://steamcommunity.com/id/shadowmantium/recommended/433350/","shadowmantium","ShadowMantium","http://steamcommunity.com/id/shadowmantium/","2 products in account","just terrbile ! ! !","June 1","false","0.1"," 10 of 39 people (26%) found this review helpful 1 person found this review funny","26","10","39","0","0"
"http://steamcommunity.com/profiles/76561198151943019/recommended/433350/","76561198151943019","DraGon+<3|Miku|Hinata|é¾â™¡","http://steamcommunity.com/profiles/76561198151943019/","4 products in account","Good game, fun to play, not p2w. those who dislikes this game, they just dont know how to play FPS, lol. just a good game to play alone or with friends c:","June 1","true","3.1"," 9 of 38 people (24%) found this review helpful 3 people found this review funny","24","9","38","3","0"
"http://steamcommunity.com/id/SgtSnuggleButt/recommended/433350/","SgtSnuggleButt","SgtSnuggleButt","http://steamcommunity.com/id/SgtSnuggleButt/","188 products in account","Legendary Game. Only true FPS gods should try this game.","June 1","true","0.7"," 6 of 32 people (19%) found this review helpful 7 people found this review funny","19","6","32","7","0"
"http://steamcommunity.com/profiles/76561198187565623/recommended/433350/","76561198187565623","DogHouse","http://steamcommunity.com/profiles/76561198187565623/","21 products in account","It's bad. That's only my opinion.","June 1","false","0.3"," 8 of 39 people (21%) found this review helpful","21","8","39","0","0"
"http://steamcommunity.com/id/jullizijnlulos/recommended/433350/","jullizijnlulos","NoobUitNL","http://steamcommunity.com/id/jullizijnlulos/","46 products in account","BlackShot: Mercenary Warfare FPS\nGameplay 8/10\nMaps 5/10\nGraphics 6/10\nmovement 4/10\nIntrest 9/10\nCould be a good game ? yes\nfor the hole game 8/10","June 1","true","2.9"," 5 of 37 people (14%) found this review helpful 2 people found this review funny","14","5","37","2","3"
"http://steamcommunity.com/id/xreaper300x/recommended/433350/","xreaper300x","OxNEOxO","http://steamcommunity.com/id/xreaper300x/","269 products in account","and just like that I'm gay now...","May 31","false","0.3"," 8 of 57 people (14%) found this review helpful 9 people found this review funny","14","8","57","9","0"
"http://steamcommunity.com/profiles/76561198144225009/recommended/433350/","76561198144225009","Clay","http://steamcommunity.com/profiles/76561198144225009/","36 products in account","This game is really bad. sloopy clunky and pay 2 win. Just another FPS that pops up for a bit then dissapears. its the same old maps reused from other games. the audio is very muddy and awful. with the weapons incredibly unblanced. The shotguns are like SMGs the SMGs are like bb guns the aussault rifles are more like sniper rifles and the sniper rifles are more like aussault rifles. You can only rent guns with the in game currency also. and just like many other shooters the game has over sexualized female models. Its just sad. The graphics would be impressive if it were 2001. But now their they muddy and watery and ugly. even the blood textures are terrible. This game should have never been added to steam at all. This game would be better as a Browser based FPS than a full download.","June 3","false","0.6"," No ratings yet","0","0","0","0","0"
"http://steamcommunity.com/id/757kings/recommended/433350/","757kings","vito 'Al Capwn' Gankster","http://steamcommunity.com/id/757kings/","40 products in account","I played one match of this game.... It is pretty bad, like I mean bad.... The graphics are pretty bad, controls are horrible, there is no "weapon control", you can even zoom in even though your weapon has iron sights and stuff... Takes half a clip of a M4 to kill someone... Its just bad. I wouldnt even waste time or hard drive space downloading/playing this game.. its the bad lol. Like I dont write reviews, I dont. This game is that bad. I would rather play any other F2P FPS over this, like any.","June 5","false","0.2"," No ratings yet","0","0","0","0","0"
"http://steamcommunity.com/id/cylusmchenry/recommended/433350/","cylusmchenry","McHenry","http://steamcommunity.com/id/cylusmchenry/","12 products in account","Easily fixable game, yet still stays â™¥â™¥â™¥â™¥.\nI stick around because its a ghetto CS:GO and can't run â™¥â™¥â™¥â™¥.\nLiterally no one on the closest â™¥â™¥â™¥â™¥ing server at times.","June 5","false","59.9"," No ratings yet 1 person found this review funny","0","0","0","0","0"
"http://steamcommunity.com/id/rickimen111/recommended/433350/","rickimen111","Rickimen","http://steamcommunity.com/id/rickimen111/","53 products in account","Only thing that I could consider as "bad" are the graphics. Now don't get me wrong, the gameplay is as usual as other fps game (Ex: AvA), but anyway i like it.","June 6","true","7.1"," No ratings yet","0","0","0","0","0"
"http://steamcommunity.com/id/neonastral/recommended/433350/","neonastral","neon@stralâ˜¼{BladeRunner}","http://steamcommunity.com/id/neonastral/","11 products in account","DON'T STREAM IT - It will say "Illegal programm or hacking has been found" lfao can't EVEN stream the game what a piece of â™¥â™¥â™¥â™¥","June 6","false","10.0"," No ratings yet","0","0","0","0","0"
"http://steamcommunity.com/profiles/76561198113489474/recommended/433350/","76561198113489474","adogisawesome","http://steamcommunity.com/profiles/76561198113489474/","14 products in account","May be fun at first but will really make you mad when a shotgun cant kill someone at point blank or even the same thing with the most damaging melee weapon that cant kill someone in 1 hit.","June 6","false","3.0"," No ratings yet","0","0","0","0","0"
"http://steamcommunity.com/id/k1dx/recommended/433350/","k1dx","k1d_tv","http://steamcommunity.com/id/k1dx/","16 products in account","old game but fun mechanics!","June 6","true","5.7"," No ratings yet","0","0","0","0","0"
