"url","reviewerUsername","reviewerDisplayName","reviewerUrl","reviewerProductsCount","reviewText","date","recommended","hoursPlayed","voteText","helpfulPercent","votesHelpful","votesTotal","votesFunny","commentsCount"
"http://steamcommunity.com/id/ha/recommended/433350/","ha","Bernard Brothers","http://steamcommunity.com/id/ha/","1923 products in account","Better than Destiny.","June 5","true","0.2"," 14 of 31 people (45%) found this review helpful 16 people found this review funny","45","14","31","16","0"
"http://steamcommunity.com/id/djoowwtn/recommended/433350/","djoowwtn","Dj('o_O')wW [TN]","http://steamcommunity.com/id/djoowwtn/","8 products in account","did it work in tunisia ?????","June 1","false","0.3"," 10 of 23 people (43%) found this review helpful 3 people found this review funny","43","10","23","3","0"
"http://steamcommunity.com/profiles/76561198201753807/recommended/433350/","76561198201753807","tzDâ–³â–½","http://steamcommunity.com/profiles/76561198201753807/","4 products in account","Dont go for it guys this game god","June 1","false","0.2"," 7 of 17 people (41%) found this review helpful","41","7","17","0","0"
"http://steamcommunity.com/profiles/76561198227630496/recommended/433350/","76561198227630496","darksydespencer","http://steamcommunity.com/profiles/76561198227630496/","34 products in account","Hey guys, I haven\'t heard of this game before yesterday. I seen how it was old and immediately had to play it. Usually old school shooters are fun to play and arent as much as a blood bath as COD or BF. But boy was I wrong. This game has blood out the ying yang, and of course the gun selection of CSGO. Here is the pros and cons I have found so far:\nPROS: The Game is fun.\nBlood squirts everywhere\nThe gun sound effects and grenade blasts literally blast my ear off.\nThe visuals are decent for a game that is really old.\n\nCONS: The game stutters\nif you have too high fps, you will experience stuttering. I get around 140-220 fps and it stutters nearly everytime I shoot the shotgun. It may have to do with multiple cores.\nThere are several times the inconsistencies with the aiming and shooting routine within the game. I have shot at a person, and somehow, being up close, still misses them!\nthe game runs at a very low resoultion and at 4:3 aspect ratio.\nand of course, the big one for me, I NEED GRAPHICS OPTIONS!\nHopefully you found this review helpful for you all with gaming pcs that are looking for bloody shooters.","June 1","true","1.8"," 7 of 17 people (41%) found this review helpful 2 people found this review funny","41","7","17","2","1"
"http://steamcommunity.com/id/abouttokill/recommended/433350/","abouttokill","Dodge Charger","http://steamcommunity.com/id/abouttokill/","29 products in account","The game doesn't launch from the launcher. Really disappointing.","June 1","false","0.1"," 5 of 13 people (38%) found this review helpful 1 person found this review funny","38","5","13","0","0"
"http://steamcommunity.com/id/DragonulRed/recommended/433350/","DragonulRed","DragonulRed","http://steamcommunity.com/id/DragonulRed/","888 products in account","-You need to connect to servers to have settings (facepalm)\n-Auto settings 800x600 (WTF)\n-Create your account\n-Bad tutorial,is like i never play any shooter game...my name is DragonulRed â™¥â™¥â™¥â™¥â™¥ GTFO\n\nGreat Uninstall :) Sniper is from MW2(my opinion)","June 2","false","0.7"," 2 of 7 people (29%) found this review helpful","29","2","7","0","0"
"http://steamcommunity.com/profiles/76561198004260110/recommended/433350/","76561198004260110","jx88","http://steamcommunity.com/profiles/76561198004260110/","16 products in account","all sorts of problems\nmaleware detected\nnot worth it","June 1","false","0.3"," 0 of 3 people (0%) found this review helpful","0","0","3","0","0"
"http://steamcommunity.com/profiles/76561198125045423/recommended/433350/","76561198125045423","MY NAME IS JEFF!!","http://steamcommunity.com/profiles/76561198125045423/","6 products in account","HOW TO play it in penang!!!! HOW COMEEEEEEEEEEEE!!!?????","June 3","false","0.3"," 0 of 3 people (0%) found this review helpful 1 person found this review funny","0","0","3","0","0"
"http://steamcommunity.com/profiles/76561198055228223/recommended/433350/","76561198055228223","Oddber","http://steamcommunity.com/profiles/76561198055228223/","3 products in account","I download the game. Clicked play. Had another download. Then clicked play. Took me off it and then never to me to the actual game. Complete waste of time.","June 4","false","0.1"," 0 of 3 people (0%) found this review helpful 1 person found this review funny","0","0","3","0","0"
"http://steamcommunity.com/id/xs4vagexgaming/recommended/433350/","xs4vagexgaming","xS4vAgExGaming","http://steamcommunity.com/id/xs4vagexgaming/","84 products in account","It's ok I guess. Not like you HAVE to spend money to get kills. Just grab and "AWP" or any other sniper and don't miss. Sniping is probably more fun than using "regular" guns anyway. I've played a LOT of "pay 2 win" games my most played being "Blockade 3D" and this really isn't anywhere near that. Sure you can buy guns but you cant keep them unless you wanna pay over and over. Like I said before just get a sniper and you're good to go. Most players are using snipers anyway so im surprised it isn't called "AWP simulator". I personally think this game is ok. Not the best game I've ever played, but much better than lots of other games out there I've played. It's very much like CS:GO in a lot of ways. In fact that's the first game I thought of when I first switched guns. One thing I don't really like is that some maps (I've only played 2 so far) are very much one sided, meaning if you spawned on the other side you'll be sniped very easy since one side is perfect for "head glitching" which I ended up going like 35-5 or something like that. You'll know what im talking about when you play it. Not sure about "matchmaking" or balance issues since I have very little time played but it all really depends on what you're willing to go through in order to become "good" at the game. It's a bit frustrating but it can have it's moments. With all that being said I'd give this game a good 6/10. *Waits for angry replies*","June 3","true","2.3"," 7 of 18 people (39%) found this review helpful 3 people found this review funny","39","7","18","3","0"
"http://steamcommunity.com/profiles/76561198095416381/recommended/433350/","76561198095416381","lasjes","http://steamcommunity.com/profiles/76561198095416381/","9 products in account","Terrible p2p garbage... Avoid at all costs","June 2","false","0.6"," 4 of 12 people (33%) found this review helpful 1 person found this review funny","33","4","12","0","0"
"http://steamcommunity.com/profiles/76561198300780096/recommended/433350/","76561198300780096","|Marksman|","http://steamcommunity.com/profiles/76561198300780096/","2 products in account","This game is so bad, laggy dumb trying to be a cs:go clone but it doesn't even do that okay. everything about it sucks , it is confusing cluttered jittery a big sloppy pile of poo poo","June 2","false","0.6"," 1 of 6 people (17%) found this review helpful","17","1","6","0","0"
"http://steamcommunity.com/profiles/76561198156110945/recommended/433350/","76561198156110945","Daedpul.exe","http://steamcommunity.com/profiles/76561198156110945/","4 products in account","This game won't even connect to a lobby and I have a high-end computer!","June 1","false","0.1"," 1 of 6 people (17%) found this review helpful","17","1","6","0","0"
"http://steamcommunity.com/profiles/76561198284042318/recommended/433350/","76561198284042318","mr. TOILET","http://steamcommunity.com/profiles/76561198284042318/","1 product in account","its HORRIBLE","June 4","false","0.1"," 1 of 6 people (17%) found this review helpful","17","1","6","0","0"
"http://steamcommunity.com/id/ethancknight/recommended/433350/","ethancknight","Kuro m9","http://steamcommunity.com/id/ethancknight/","57 products in account","Unbalanced and boring. If you don\'t buy an awp, you lose.","June 1","false","0.6"," 0 of 4 people (0%) found this review helpful","0","0","4","0","0"
"http://steamcommunity.com/id/MACattackROGI/recommended/433350/","MACattackROGI","MACattackROGI","http://steamcommunity.com/id/MACattackROGI/","969 products in account","I mean ... at least its free","May 31","false","1.1"," 30 of 67 people (45%) found this review helpful 26 people found this review funny","45","30","67","26","3"
"http://steamcommunity.com/id/ltgiuberia/recommended/433350/","ltgiuberia","<"Lt.Giuberia">","http://steamcommunity.com/id/ltgiuberia/","341 products in account","The poor man's CS+CoD hybrid.","June 1","true","0.5"," 6 of 17 people (35%) found this review helpful 5 people found this review funny","35","6","17","5","0"
"http://steamcommunity.com/id/littlegodtaco/recommended/433350/","littlegodtaco","Praise the Sun","http://steamcommunity.com/id/littlegodtaco/","8 products in account","I love and hate this game. Well let me explain the game is lovely, the shooting feels like Cs 1.6 (Counter Strike 1.6) and the general feel and the look of MW2 (Modern Warfare 2). But it still has it cons for example you have to rent guns for a some time like a hour or 7 days or even a month. I really dislike this, but the currency in the game is easily gained. Also another horrible feature that need to be fixed is the jumping it's soooo buggy. All in all this game is fun, dont let renting a gun bring you down because is the toturial you gain 30,000 Bp which is alot and can rent alot of guns.","June 1","true","2.7"," 5 of 15 people (33%) found this review helpful 2 people found this review funny","33","5","15","2","1"
"http://steamcommunity.com/profiles/76561198078446355/recommended/433350/","76561198078446355","Pro' Goko","http://steamcommunity.com/profiles/76561198078446355/","16 products in account","The only thing wrong with this game is some of the maps are not large enough. Btw the game is awesome i've play it before it release :)","June 2","true","9.3"," 5 of 15 people (33%) found this review helpful","33","5","15","0","0"
"http://steamcommunity.com/profiles/76561198120112434/recommended/433350/","76561198120112434","Dr_Sarac","http://steamcommunity.com/profiles/76561198120112434/","114 products in account","Great game, i was playing this before like a maniac then they shutdown the game, now when i saw that is out on steam, i could not belive my eyes :D  i play battlefield ,call of duty, CSGO.. but i love this game, it's fast fps game with many many weapons, customization etc.. just install and try.. dont give up at start, game starts to be amazing when you grove up as a soldier ;)   Pure classic fps","June 2","true","3.6"," 5 of 15 people (33%) found this review helpful","33","5","15","0","2"
"http://steamcommunity.com/id/BenJerkins/recommended/433350/","BenJerkins","BenJerkins","http://steamcommunity.com/id/BenJerkins/","12 products in account","Ive put a short time into this game already, And already all I can say is the only thing wrong with this game is some of the maps are not large enough. But other than that the Gun play is perfect and the mechanics are similar to Couterstrike. Good game for sure","June 2","true","5.1"," 4 of 13 people (31%) found this review helpful","31","4","13","0","0"
"http://steamcommunity.com/id/Ourwida/recommended/433350/","Ourwida","_ N0B1L","http://steamcommunity.com/id/Ourwida/","8 products in account","back the the good old days 2012 ty steam !","June 1","true","4.9"," 3 of 11 people (27%) found this review helpful 1 person found this review funny","27","3","11","0","0"
"http://steamcommunity.com/id/shanarashood/recommended/433350/","shanarashood","Fantasy (Í¡ Â° ÍœÊ– Í¡ Â°)","http://steamcommunity.com/id/shanarashood/","69 products in account","Noobs bashen :D","June 1","true","2.6"," 2 of 9 people (22%) found this review helpful 2 people found this review funny","22","2","9","2","0"
"http://steamcommunity.com/id/ahoskins1/recommended/433350/","ahoskins1","adam.hoskins1","http://steamcommunity.com/id/ahoskins1/","31 products in account","I've been playing this game since it came out this past week. Have made it to Staff Sergeant rank and played multiple maps and game modes. It's not a bad game. It's not a great game, but it just came out and has some bugs to work out. a few of those would be:\n1-Grenades are a little wonky. Sometimes they kill you from fifteen feet away, other times your opponent survives a near direct blast.\n2- Health vs damage/armor. I put this one here because I can empty a clip at times, point blank, and they survive, yet they hit me once with the same weapon and it's instakill.\n3- Movement and cover could be a little better. It tends to be slow to move and turn (I play ith max mouse sensitivity).\n\nWhile some out there will say I'm complaining and should just "get Better," bite me. I'm just pointing out flaws that can be addressed and improved upon.","June 3","true","3.1"," 2 of 9 people (22%) found this review helpful 1 person found this review funny","22","2","9","0","0"
"http://steamcommunity.com/id/AlbinoGoomba/recommended/433350/","AlbinoGoomba","AlbinoGoomba","http://steamcommunity.com/id/AlbinoGoomba/","2 products in account","The game is awesome but I think the matchmaking needs to be tweaked and you should be able to keep guns forever instead of like 2 days because then you will have nothing in 2 days","June 4","true","2.0"," 2 of 9 people (22%) found this review helpful 1 person found this review funny","22","2","9","0","0"
"http://steamcommunity.com/id/_Kazui_/recommended/433350/","_Kazui_","Karistant","http://steamcommunity.com/id/_Kazui_/","4 products in account","This game is an old time fav of mine.\nI love when they give u a starter pack so u wont get rekt by p2w players :/\nSo fk yea I reccommend this game 10/10 :D","June 4","true","3.3"," 2 of 9 people (22%) found this review helpful","22","2","9","0","3"
"http://steamcommunity.com/profiles/76561198045381877/recommended/433350/","76561198045381877","Kodyd194","http://steamcommunity.com/profiles/76561198045381877/","108 products in account","BlackShot: Mercenary Warfare FPS, far from popular opinion I dont think this is even close to the worst shooter I have played. While it is old, has a cash shop, and not very balanced I can at least still enjoy playing it. That being said there are 100's of better alternatives if you are looking for a free to play shooter out there, but dont completely discount Blackshot just because of its age or microtransaction system. I managed fine in what little time I have played so far.","June 4","true","3.2"," 2 of 9 people (22%) found this review helpful","22","2","9","0","0"
"http://steamcommunity.com/profiles/76561198284058347/recommended/433350/","76561198284058347","satizhsaa","http://steamcommunity.com/profiles/76561198284058347/","","how to rate this , when i can't even able to play. everytime i join a server , game crashes. i tried for 30minutes and give up on this. now the 1.5 gb of game files in my hard drive is a joke. not uninstalling for now , hope they fixes it.","June 5","true","0.6"," 1 of 7 people (14%) found this review helpful 1 person found this review funny","14","1","7","0","0"
"http://steamcommunity.com/profiles/76561198047096020/recommended/433350/","76561198047096020","Zakadum","http://steamcommunity.com/profiles/76561198047096020/","99 products in account","Nice old game! Simple and fun! Except Hacking. But if you get a game wothout hackers - then the game is amayzing!","June 5","true","1.5"," 1 of 7 people (14%) found this review helpful","14","1","7","0","0"
"http://steamcommunity.com/profiles/76561198211599455/recommended/433350/","76561198211599455","VANZTEPS -  Special Force","http://steamcommunity.com/profiles/76561198211599455/","","It's kind of not good but i still play it just cause I need\n","June 3","true","1.8"," 1 of 7 people (14%) found this review helpful","14","1","7","0","0"
"http://steamcommunity.com/id/monontonic/recommended/433350/","monontonic","MoNo","http://steamcommunity.com/id/monontonic/","65 products in account","http://steamcommunity.com/groups/BlackshotGO","June 4","true","6.3"," 1 of 7 people (14%) found this review helpful 1 person found this review funny","14","1","7","0","0"
"http://steamcommunity.com/profiles/76561198177165877/recommended/433350/","76561198177165877","Sly Fox","http://steamcommunity.com/profiles/76561198177165877/","12 products in account","GREAT GAME 1.5/10","June 4","true","6.2"," 1 of 7 people (14%) found this review helpful","14","1","7","0","1"
"http://steamcommunity.com/id/KiperTVI/recommended/433350/","KiperTVI","Kiper","http://steamcommunity.com/id/KiperTVI/","32 products in account","This is probably the BEST F2P game I have played. I have not payed for anything in the game and I still manage to stay top fragging and winning. Most of the reviews you see people haven't even played the game at all. Just give it a chance. I love it.","June 4","true","6.7"," 1 of 7 people (14%) found this review helpful","14","1","7","0","0"
"http://steamcommunity.com/profiles/76561198092527140/recommended/433350/","76561198092527140","zhossenbux","http://steamcommunity.com/profiles/76561198092527140/","51 products in account","At first I had doubts about this game thinking that it would suck as much as cod ghosts. But I downloaded it anyway, I started playing and got a meat chopper thing that would 2 hit anyone in the balls. I instantly fell in love with the game.\n\nOn a serious note this game is actually really fun and I would reccomend it to fps lovers. Note: If you hate spawn campers stay away from TDM! :)\n\n\n\nHave Fun! .-. ._. .-.","June 5","true","2.5"," 1 of 7 people (14%) found this review helpful 1 person found this review funny","14","1","7","0","0"
"http://steamcommunity.com/profiles/76561198078947360/recommended/433350/","76561198078947360","CombatRaven01","http://steamcommunity.com/profiles/76561198078947360/","21 products in account","Apart from the graphics this is a fun game. I don't know what else to say so here is a rebirth.\n\nâ˜»/\n/â–Œ\n/\","June 2","true","2.1"," 1 of 7 people (14%) found this review helpful","14","1","7","0","0"
"http://steamcommunity.com/id/mrbriskey/recommended/433350/","mrbriskey","Rocky Briskey","http://steamcommunity.com/id/mrbriskey/","198 products in account","Free ...i mean yeah can't beat that","June 2","true","3.0"," 1 of 7 people (14%) found this review helpful","14","1","7","0","0"
"http://steamcommunity.com/id/becausewecanevrytime/recommended/433350/","becausewecanevrytime","youtube.com/Aiimez â™¥","http://steamcommunity.com/id/becausewecanevrytime/","169 products in account","Started it. A lot of scripts error\'s. joined the main menu . try to join a server and display \"client version invalid reinstall the client or update\" srsly? oh jesus... i want only to try this â™¥â™¥â™¥â™¥ but seems that is a free â™¥â™¥â™¥â™¥ waste of 0.3 hours..","June 1","false","0.3"," 0 of 5 people (0%) found this review helpful","0","0","5","0","0"
"http://steamcommunity.com/id/LyhFlare/recommended/433350/","LyhFlare","ã€ŽLyh Flareã€","http://steamcommunity.com/id/LyhFlare/","1278 products in account","Edited my review from not reccomended to reccomended.\n\nHere's why:\nThe game it self IS old, so bear that in mind whenever you're opening the game, it's not the latest f2p shooter.\n\nThe game mechanics and spray patterns take a little while to get used to but still a lot of fun experimenting.\n\nPros:\nClassic TDM\nClassic CTF\nModerate balance\nYou can win even as F2P (Got a 59k 3D as f2p and won)\n\nCons:\nA little spawncaming, but easy to turn around\nLack of more f2p weapons\nLeased weapons (You only got the weapons at a rented time both f2p and p2p)\n\nOverall gameplay is actually really funny, it's an easy pick up and play game for those rooty tooty point and shooty moment!\n\n*Snipers are op af tho*\n\n8/10","June 1","true","10.5"," 0 of 5 people (0%) found this review helpful","0","0","5","0","0"
"http://steamcommunity.com/profiles/76561198259818684/recommended/433350/","76561198259818684","kennydewulf","http://steamcommunity.com/profiles/76561198259818684/","1 product in account","Before this game came to steam i already played over 500hours on this game, its really a great game to play with friends make your own clan and try to win from the other clans, the competitive side is on my opinion the best side on the game.\na bit paytowin but when the montly events you can get tons of 'pay' weapons for free.","June 3","true","0.3"," 0 of 5 people (0%) found this review helpful","0","0","5","0","0"
"http://steamcommunity.com/id/Miyamoto-Musashi/recommended/433350/","Miyamoto-Musashi","Miyamoto Musashi","http://steamcommunity.com/id/Miyamoto-Musashi/","1121 products in account","The game is fun with good gameplay!\n7/10\nhttps://www.youtube.com/watch?v=6mejfLqIZWs","June 1","true","6.2"," 10 of 26 people (38%) found this review helpful 2 people found this review funny","38","10","26","2","0"
"http://steamcommunity.com/id/Kojiro-Sasaki/recommended/433350/","Kojiro-Sasaki","KojirÅ Sasaki","http://steamcommunity.com/id/Kojiro-Sasaki/","71 products in account","Fun game!\nNota: 7/10\nSniper gameplay:\nhttps://www.youtube.com/watch?v=MxFW4YAEjoU","June 3","true","0.6"," 10 of 26 people (38%) found this review helpful","38","10","26","0","0"
"http://steamcommunity.com/id/Zopak28/recommended/433350/","Zopak28","Zopak the Wise Lizard","http://steamcommunity.com/id/Zopak28/","49 products in account","Best game ever. Better than CS:GO. 9/11","June 6","true","0.8"," 0 of 5 people (0%) found this review helpful 2 people found this review funny","0","0","5","2","1"
"http://steamcommunity.com/id/WPZero/recommended/433350/","WPZero","JNota","http://steamcommunity.com/id/WPZero/","9 products in account","I use to play this game years and years ago and reallly enjoyed then, so it was nice to see it come to steam.\n\nOverall I think that this game is fun in general if you are that hardcore fps player then obviously this is not for you.\nGamemodes are definitely different to other shooters which helps to make them somewhat unqiue but some can as well be annyoing.\nLoading in and out of matches are quick (well at least for me) allowing you to spend more time playing the game than looking at a loading bar\nGameplay feels fast and enjoyable, however I do feel that the movement feels clunky in some areas such as jumping up and down\nCommunity (so far)  is not toxic and you will meet nice friendly players\nThe game rewards you with lots of stuff and even though you can't get weapons permently, using the in-game cash, you will have plenty of good weapons and money (if you dont spend it recklessly) to get cosmetics or even better guns\nHowever, i do feel there is a bit of pay2win as some aspects like gun attachments or items that you can't get with in-game cash advantage you a bit, but not too much that you dont stand a chance\nMatches feel balanced and i havent encoutered any hackers although i'm just gonna say this, a lot of new fps player (thats a kind way of saying stupid little kids) cannot tell the difference between a skilled fps player and a hacker as well sonetimes they might not realise the they or the player has bad ping thus leading to shooting through walls etc.\nHowever, the game is lacking in terms of achievements as they are easy to get and not a lot of them\nGraphics yes are old, but i don't think that it massively effects the gameplay, like we've seen some beautiful games but they play like â™¥â™¥â™¥â™¥ so don't judge the game on looks\n\nAnyways, if you want casual fun with no stress and simple game mechanics as well graphics that can run on any low end pc then this game is for you","June 1","true","15.1"," 9 of 24 people (38%) found this review helpful 1 person found this review funny","38","9","24","0","0"
"http://steamcommunity.com/id/djb92/recommended/433350/","djb92","djb92","http://steamcommunity.com/id/djb92/","45 products in account","Really impressive game especially for just releasing!","June 1","true","7.9"," 7 of 20 people (35%) found this review helpful 1 person found this review funny","35","7","20","0","0"
"http://steamcommunity.com/profiles/76561198165378643/recommended/433350/","76561198165378643","Ash ketchup","http://steamcommunity.com/profiles/76561198165378643/","33 products in account","it\'s good, not pay to win just rentals","June 1","true","2.9"," 6 of 18 people (33%) found this review helpful 1 person found this review funny","33","6","18","0","2"
"http://steamcommunity.com/id/matic_andreas44/recommended/433350/","matic_andreas44","Andreas444","http://steamcommunity.com/id/matic_andreas44/","147 products in account","I thought this game will be a horribile experience but i was wrong,i dont know why almost everybody is calling this game a P2W,just play it for achievements or whatever and ignore that kind of people.\nWell the gameplay kinda reminds me of Counter Strike 1.6 but that is not a problem for me.Also you can play as female character without paying anything unlike CSNZ.You can choose weapons that you like,there is a lot of modes to play as TDM.CF etc.\nI like this game.\nFinal note:8.5/10","June 4","true","2.3"," 6 of 18 people (33%) found this review helpful 1 person found this review funny","33","6","18","0","0"
"http://steamcommunity.com/id/byames/recommended/433350/","byames","EZ, PZ, Lemon Fuckin' Squeezy","http://steamcommunity.com/id/byames/","74 products in account","goodgame cooll","June 2","true","8.2"," 4 of 14 people (29%) found this review helpful 1 person found this review funny","29","4","14","0","0"
