"url","reviewerUsername","reviewerDisplayName","reviewerUrl","reviewerProductsCount","reviewText","date","recommended","hoursPlayed","voteText","helpfulPercent","votesHelpful","votesTotal","votesFunny","commentsCount"
"http://steamcommunity.com/id/elvedril/recommended/444250/","elvedril","elvedril","http://steamcommunity.com/id/elvedril/","148 products in account","Fun and straightforward, Crown and Council is a simple game done in an interesting way. It doesn't try to wow you with graphics, excessive challenge, or bells and whistles. What it will do is give you a straightforward strategy fix that is great for short burst of play. That is more than enough to justify the cost of entry.","April 28","true","1.7"," No ratings yet","0","0","0","0","0"
"http://steamcommunity.com/id/zionviller/recommended/444250/","zionviller","zionviller","http://steamcommunity.com/id/zionviller/","176 products in account","If it weren't for the janky interface (properly clicking is difficult, which results in your current command being ended), it would be a perfect little game!","April 28","true","3.1"," No ratings yet","0","0","0","0","0"
"http://steamcommunity.com/profiles/76561198168384854/recommended/444250/","76561198168384854","Non-Flammable Pyro","http://steamcommunity.com/profiles/76561198168384854/","7 products in account","Amazing Game! Doesnt glitch or any of that stuff. It actually works great. Fun and Challenging 10/10","April 28","true","1.8"," No ratings yet","0","0","0","0","0"
"http://steamcommunity.com/profiles/76561198201421357/recommended/444250/","76561198201421357","raphaelkapra","http://steamcommunity.com/profiles/76561198201421357/","2 products in account","It's a small game, sometimes you click and it deselects what is selected, but for such a small game its good!","April 28","true","2.0"," No ratings yet","0","0","0","0","0"
"http://steamcommunity.com/id/iseeyoupan/recommended/444250/","iseeyoupan","iseeyoupan","http://steamcommunity.com/id/iseeyoupan/","92 products in account","just like europa universalis. the same game","May 3","true","6.2"," No ratings yet","0","0","0","0","0"
"http://steamcommunity.com/id/PaPaGeneralTaco/recommended/444250/","PaPaGeneralTaco","General Taco","http://steamcommunity.com/id/PaPaGeneralTaco/","97 products in account","Luck Oriented Attacks\nworst feeling when you attack about 7 times and fail, while the enemies basically one hit every time in the same circumstance. Although it is true that in risk is somewhat based on luck, risk allows attakes to use up to 3 pieces to defenders 2 pieces, rather than Crown & Council's individual attacks\n\nAI\nThe AI are not the most intelligent, which really dims down the difficulty, they would rather spend more gold on going to an island rather then settling near their home turf for the same income.\n\nBuildings\nI do like the introduction of the buildings, but I found it easier  to win without building(excluding the castle) a single building\n\nUI(User Interface)\nThe user interface is quite a headache, where most interactions wil likely not go through, forcing you to slowly go through the game, making sure each click was processed.\n\nIf anyone wants a great multiplayer/singleplayer Risk  like game they should check out 'Warlight' in browser.","May 3","false","4.7"," No ratings yet","0","0","0","0","0"
"http://steamcommunity.com/id/lejon/recommended/444250/","lejon","Lejon Kills All","http://steamcommunity.com/id/lejon/","78 products in account","Would be great if the RNG wasn't completely wrecking the whole thing. Would give a second chance if the dev updated it to be heavily reduced.","April 29","false","0.4"," No ratings yet","0","0","0","0","0"
"http://steamcommunity.com/id/geomint/recommended/444250/","geomint","geomint","http://steamcommunity.com/id/geomint/","58 products in account","Loved it. Easy and free to play.\n\nPROS:\n- Relaxing game.\n- Free and open source.\n- Compact size.\n- Turn-Round based game","April 29","true","7.7"," No ratings yet","0","0","0","0","0"
"http://steamcommunity.com/id/Four-wings-of-azai/recommended/444250/","Four-wings-of-azai","Kelyaan","http://steamcommunity.com/id/Four-wings-of-azai/","19 products in account","Simple RNG hell - you can spend a good half hour trying to take one single space wasting hundreds of gold for it to fail every time then the AI will steamroll the entire map without a single failure. There's no skill or thinking involved it's just horde gold and hope you get good RNG","May 2","false","0.3"," No ratings yet","0","0","0","0","0"
"http://steamcommunity.com/id/elfelganor/recommended/444250/","elfelganor","Mother Mumu™","http://steamcommunity.com/id/elfelganor/","61 products in account","Fairly easy to understand and play. Liked the game but at one point, I questioned of where is this going? It seems that the maps are randomly generated which kind of makes it endless gameplay. I recommend the game but only for a short while. You might get bored after a few min.\n\nI do hope that in the furture there is a multiplayer option, then it might really get interesting just like any board game :)","May 2","true","1.3"," No ratings yet","0","0","0","0","0"
"http://steamcommunity.com/profiles/76561198211895856/recommended/444250/","76561198211895856","Keaton","http://steamcommunity.com/profiles/76561198211895856/","10 products in account","This new released game is a great time killer. But in a good way. With 75 different maps there is a world to explore and play. You can even do multiplayer! My only complaint about the game is that it's very short.  ( ͡° ͜ʖ ͡° )\n\n","May 2","true","1.5"," No ratings yet","0","0","0","0","0"
"http://steamcommunity.com/profiles/76561197973226299/recommended/444250/","76561197973226299","Ronin","http://steamcommunity.com/profiles/76561197973226299/","41 products in account","It's okay for a game-jam result. The main problem is that the gameplay is way too simple and not well balanced. I've played roughly 40 levels and i haven't been challenged in a single one of them.\n\nShould you expect a polished, well balanced game that offers a challenge? No\nShould you check it out anyway? Definately!","May 2","true","5.9"," No ratings yet","0","0","0","0","0"
"http://steamcommunity.com/profiles/76561198052338908/recommended/444250/","76561198052338908","Zelketh","http://steamcommunity.com/profiles/76561198052338908/","171 products in account","The idea behind the game is fascinating.\n\nHowever, there are bugs that making this simple clicker not playable.\n1. The controls are sometimes unresponsive.\n2. The resolution is unchangable and if your using a screen resolution of 1366x786 or less, you won't see the whole game-window\n3. The game sometimes won't let you click anything, only allowing you to end your turn (the only thing you do by anything other than pointing and clicking).\n","May 2","false","1.0"," No ratings yet","0","0","0","0","0"
"http://steamcommunity.com/id/AaronE215/recommended/444250/","AaronE215","Aaron","http://steamcommunity.com/id/AaronE215/","58 products in account","It's free, so you're not losing anything by giving it a shot. But it certainly seems unfinished. Good to kill some time though.\n\nOnce you get through the tutorial levels, it's a bit more fun. There are a few maps where there are really tiny areas that are about a pixel in size, so if it seems you're stuck you just have to go through pixel by pixel to find the last area. A few bugs, but not bad for a free game.\n\nEventually you get to a point where you finish all the premade levels and it just starts generating the same level over and over when you press "g".","May 3","true","6.3"," No ratings yet","0","0","0","0","0"
"http://steamcommunity.com/id/rekenner/recommended/444250/","rekenner","rk","http://steamcommunity.com/id/rekenner/","304 products in account","All the bad parts of Risk without the part where you're at least hanging out (and hopefully drinking) with friends!","April 25","false","0.5"," No ratings yet","0","0","0","0","0"
"http://steamcommunity.com/profiles/76561198107367257/recommended/444250/","76561198107367257","SleepingViking","http://steamcommunity.com/profiles/76561198107367257/","59 products in account","Definitely worth an hour or two to kill time. It's a simple game, with very little in the way of deep mechanics, however, I don't believe hat's what it was for. It feels more a throwback to the early point and click games, which is really what it is.\n\nAdmittedly, there are bugs, in the way of fullscreen incompatability and touchy hitbox alignment, but overall, I like it.\n\nThe music is soothing and the gameplay is basic in a relaxing way, requiring no true concentration past basic strategy. AAA title it is not, but it's free, it's fun, and it's different. And, well, it's from Mojang, so, bonus.","April 25","true","1.6"," No ratings yet","0","0","0","0","0"
"http://steamcommunity.com/id/seredyna/recommended/444250/","seredyna","seredyna","http://steamcommunity.com/id/seredyna/","19 products in account","Considering that it is written in processing and came out of a game jam, it's pretty good.","April 23","true","1.9"," No ratings yet","0","0","0","0","0"
"http://steamcommunity.com/id/hawklost/recommended/444250/","hawklost","hawk","http://steamcommunity.com/id/hawklost/","10 products in account","Poor implimentation of a game.\n\nComplaints\n- Esc closes the game instead of opening a menu\n- Rebellions random and very annoying, they add less to gameplay and more to annoyance\n- Levels all feel effectively the same once past lvl 10\n- Feels unresponsive a large bit of time\n\nTechnical Issues\n- Clicking doesn't always work\n- Enemies sometimes claim lands that are not clickable and therefore user cannot defeat level.","April 23","false","2.5"," No ratings yet","0","0","0","0","0"
"http://steamcommunity.com/profiles/76561198025026586/recommended/444250/","76561198025026586","DarKarvin","http://steamcommunity.com/profiles/76561198025026586/","184 products in account","Pros: it's free\n\nIf you like this even a little bit, there are probably over a couple hundred of these on Kongregate for free also, most of which are much better implemented, and register mouse clicks.\nThis one is RNG hell at its finest.","April 24","false","0.5"," No ratings yet","0","0","0","0","0"
"http://steamcommunity.com/id/difficult_pronunciation/recommended/444250/","difficult_pronunciation","I'm Difficult","http://steamcommunity.com/id/difficult_pronunciation/","53 products in account","A lot of RNG, or maybe just situations that are predetermined to not work out in your favor. Some times there are just places where you get a real sh***y placement on a crappy map. The base gameplay is okay, and is fun for a few maps.","April 24","false","0.6"," No ratings yet","0","0","0","0","0"
"http://steamcommunity.com/id/shadedjew/recommended/444250/","shadedjew","momentum","http://steamcommunity.com/id/shadedjew/","194 products in account","its fun and free","April 23","true","1.0"," No ratings yet","0","0","0","0","0"
"http://steamcommunity.com/id/Pestycakes/recommended/444250/","Pestycakes","akbar","http://steamcommunity.com/id/Pestycakes/","157 products in account","The game attempts to be similar to the classic board game risk,  Using RNG (Much like dice rolls) to determine battle outcomes as you aim to take over areas on the map.\n\n\nThe game tries to expand by adding a little more depth by adding a couple of different building possible on each area.\n\n\nHowever due to awful game design and clear lack of testing, there is little need for any of these buildings with the current balance.  Each different AI colour seems to favour a certain strategy, all are bad and easy to just steamroll.\n\n\n\nHaving played 1000s of games of risk(lux) online and a load of other board games I thought this would be enjoyable, however due to small maps, bad game balance and bad AI this game is a huge failure and not worth the FREE pricetag which I paid for the game.","April 23","false","1.3"," No ratings yet","0","0","0","0","0"
"http://steamcommunity.com/id/leecottrell/recommended/444250/","leecottrell","Apache","http://steamcommunity.com/id/leecottrell/","10 products in account","Easy to play. Does not hold my interest for long. The random nature of the attack takes away the strategy of the game. It is just you deciding where to 'attack' and hoping the dice roll your way. Glad this was free.","April 23","false","0.4"," No ratings yet","0","0","0","0","0"
"http://steamcommunity.com/id/_trobe_/recommended/444250/","_trobe_","trobe","http://steamcommunity.com/id/_trobe_/","26 products in account","Each battle is just random, sometimes a territory takes 4 goes and sometimes 1 :(","April 23","false","0.3"," No ratings yet","0","0","0","0","0"
"http://steamcommunity.com/profiles/76561198019722246/recommended/444250/","76561198019722246","Wrynfroe","http://steamcommunity.com/profiles/76561198019722246/","223 products in account","Bad mechanics and blatant cheating by the AI","April 25","false","1.0"," No ratings yet","0","0","0","0","0"
"http://steamcommunity.com/id/marbash/recommended/444250/","marbash","Marbash","http://steamcommunity.com/id/marbash/","1 product in account","Fun and casual strategy game. Easy to learn and easy to get hooked. I do feel that the "random" abilities in the game sometimes only hurts the player, but that might be something that gets patched after a while. I'd recommend you to check this out. :)","April 25","true","2.6"," No ratings yet","0","0","0","0","0"
"http://steamcommunity.com/id/rabidpiglet/recommended/444250/","rabidpiglet","Rabid Piglet","http://steamcommunity.com/id/rabidpiglet/","137 products in account","This is a fun little game to pick up and put down when you have time.  It doesn't look like much, but it's quite addictive and fun. I would definitely recommend this to my friends and to other who are just looking for something fun to play.","April 25","true","0.1"," No ratings yet","0","0","0","0","0"
"http://steamcommunity.com/id/Lucretiel/recommended/444250/","Lucretiel","Lucretiel","http://steamcommunity.com/id/Lucretiel/","198 products in account","Surprisingly good. A lot of weird UI stuff, but that should be easy to fix. It's a great, simple, time-killer of a game.","April 25","true","0.9"," No ratings yet","0","0","0","0","0"
"http://steamcommunity.com/profiles/76561197989789822/recommended/444250/","76561197989789822","Clockwork Onion","http://steamcommunity.com/profiles/76561197989789822/","243 products in account","It's a fun and simple game. You can hotseat with up to 4 people using the 1-2-3-4 keys.\nPlaying against the AI isn't very hard though, and there aren't any difficulty settings.\nIt's free and it's perfect to kill like 15minutes while waiting for dinner or before you have to go somewhere but still want to play something!","April 25","true","2.0"," No ratings yet","0","0","0","0","0"
"http://steamcommunity.com/profiles/76561198090804962/recommended/444250/","76561198090804962","Desert Gamer","http://steamcommunity.com/profiles/76561198090804962/","6 products in account","Frustrating game. Clicks do not register. Not ready for prime time.","April 24","false","0.2"," No ratings yet","0","0","0","0","0"
"http://steamcommunity.com/id/Bonaventure/recommended/444250/","Bonaventure","Bonaventure","http://steamcommunity.com/id/Bonaventure/","310 products in account","Crown and Council is a well-balanced, fast-paced little gem. It captures what's fun about the better versions of Risk while abstracting away boring elements like card-drawing and troop shuffling.\n\nThere's a good balance between aggression, research, industry and fortification, and the AI is good enough to provide entertainment, if not a serious challenge. (It'd be far better if it gave up on research...)\n\nDon't be put off by the first few tutorial levels. Until you get access to all your actions, the game comes across as a shallow RNG slog, but the strategy is in there -- you'll just need some options besides "attack" and "fortify."\n\nDon't worry about the low Steam rating either. A lot of players are checking this out because it's "by Mojang!" and not quite getting that it's "a free spare-time project by one of Mojang's artists!"\n\nThe screenshots communicate exactly what you're in for. If you like things like this, you'll like this example of the sort of thing that it is. Why not give it a try? You can always get a Steam refund for your zero bucks.","April 25","true","56.2"," No ratings yet","0","0","0","0","0"
"http://steamcommunity.com/profiles/76561197971319469/recommended/444250/","76561197971319469","smabey","http://steamcommunity.com/profiles/76561197971319469/","71 products in account","Game is very buggy.  Like others I found the controls to be unresponsive most of the time:  It often doesn't register a selection or something that was selected will de-select when issuing a command.  The computer also does not follow consistent rules and you will often find yourself beaten when your opponent suddenly gets tons of gold out of nowhere.  I also found that the odds of conquering a land are blatantly in the favour of the computer making for very frustrating game play.  This strikes me as more of a Beta release as there are some obvious and major flaws that should have already been worked out.\n\nThis game has promise and I'm hoping the developers are reading the reviews to address the issues.  Hopefully there will be some patches soon.\n\n","April 25","false","0.7"," No ratings yet","0","0","0","0","0"
"http://steamcommunity.com/id/ianneub/recommended/444250/","ianneub","IANster","http://steamcommunity.com/id/ianneub/","192 products in account","Too much of this game is up to random rolls. Get infuriating when you can't take a territory for multiple turns on end, and have the CPU take your territory with their first try the next turn.","April 25","false","0.4"," No ratings yet","0","0","0","0","0"
"http://steamcommunity.com/profiles/76561198097520264/recommended/444250/","76561198097520264","dorkyfaceisawsome","http://steamcommunity.com/profiles/76561198097520264/","7 products in account","This game is simple and addictive. It can be booted up on the fly to be at any time. It's challenging, but not enough to stave off anyone who just wants some casual fun, and when I say that it can booted up anytime, I MEAN that. download speed was less than a minute, and I have half-decent internet and I'm on a laptop.\n\nHopefully it will be updated to smooth out the edges, such as having no menu for options for things like the sound and music (which gets dull quite quickly) but otherwise, I've so far had a great time with it.","April 25","true","4.0"," No ratings yet","0","0","0","0","0"
"http://steamcommunity.com/profiles/76561198025037332/recommended/444250/","76561198025037332","gopher65","http://steamcommunity.com/profiles/76561198025037332/","33 products in account","I like games like this. It's like a very simple version of Risk, or maybe even that old "Empire" game... which was a Risk clone, come to think of it. So yeah, Risk without the complexity.\n\nPros:\n- Free.\n- Fun little game to play for 5 minutes while the kids are otherwise occupied.\n\nCons:\n- Buggy: I find that I sometimes have to single click, and sometimes have to double click to perform the same action. That's annnoying. Also, Map 36 is buggy. 2 different "countries" are only 1 pixel large, making it almost impossible to defeat the AIs. The only way around it is to spend a large amount of time clicking all over the place trying to locate the seemingly invisible countries.\n- Lack of "options" menu.\n- Lack of list of what controls do what. Oh, "R" restarts a map, if you're hopelessly losing and want to start over? Gee, it sure would have been nice to know what. "M" shuts off music? Thanks for not telling me. I already muted it in the Windows sound panel.\n- While you can turn off the music via a hidden shortcut ("M"), there is no way to change the volume, or to turn off the very annoying, very load sound effects.\n\nAll in all it feels like the very start of a game. Which is ok, as long as it receives further development. I'm surprised that they released this without a note saying "WARNING: EARLY ALPHA BUILD! PLAY AT YOUR OWN RISK (ahaha)!" If they'd done that one thing I'd be much more forgiving.","April 25","true","9.4"," No ratings yet","0","0","0","0","0"
"http://steamcommunity.com/id/Mikk583d/recommended/444250/","Mikk583d","KongeN_","http://steamcommunity.com/id/Mikk583d/","54 products in account","Nice game, short but fun. completed in 10 hours :D","April 25","true","10.4"," No ratings yet","0","0","0","0","0"
"http://steamcommunity.com/id/lastofavari/recommended/444250/","lastofavari","LastofAvari","http://steamcommunity.com/id/lastofavari/","95 products in account","It still needs some polishing and I wish there was multiplayer, but the game is still very nice, especially considering that it's available free. Turn based gameplay mechanics feels appropriate. Good work, Henrik!","April 30","true","5.4"," No ratings yet","0","0","0","0","0"
"http://steamcommunity.com/profiles/76561198192166007/recommended/444250/","76561198192166007","Nightmare_4_You21","http://steamcommunity.com/profiles/76561198192166007/","6 products in account","When I came into this, I was like,"Oh, another Mojang game," but I'm quite surprised at how much I enjoyed this. Of course, this game has it's problems.(The clicking is a little unresponsive) If you like Risk or Chess, this game is perfect. You get to go around conquering enemies, with different ways to win, either becoming really smart, or just brute forcing. Either way, the game is a blast and will last several hours, but then you can just generate more and more. I do wish they would add online, even though that would cause really long games. Overall, the game is extremely good considering it was made in such a short time, and is a blast.","April 29","true","4.2"," No ratings yet","0","0","0","0","0"
"http://steamcommunity.com/id/lw001/recommended/444250/","lw001","LW001","http://steamcommunity.com/id/lw001/","5 products in account","Sorry Mojang,\nThe game can't properly display for half the people here. You could at least add some start option to help us out here... I have solved the problem myself by putting the taskbar to the right of my screen.\nAfter fixing that problem, I started playing. The first 2 levels were great, but easy. The boat level brought the RNG part to me in a real fashion. I was never able to get any area of the map to myself and then only had one piece of land left to work with. The AI didn't care about that and fought against itself. When I tried attacking their forts (I only had 1 viable boat per turn) I never got any attack to actually destroy anything. But as soon as the AI came to my fort after 5 rounds, it attacked me twice and I was done. The AI had so much money there was no chance for me to stop anything. the realest bull about it then was that the AI just played on for the next 10 minutes, rolling its dices and having repetitive play. I closed the game down to stop it. There is no main menu, there are no settings, there's no way to change the resolution ofthe game to make it compatible with the screen without replacing the taskbar. There are too many flaws for me to give a good rating here.\n\nI know Mojang games are mostly released during development and things can happen there. Before there's a big revamp, putting RNG away, I will rate it down.\n\nI pray to RNGesus.\n\nCome on Mojang, you guys can do better than that!","April 30","false","0.4"," No ratings yet","0","0","0","0","0"
"http://steamcommunity.com/id/dninemfive/recommended/444250/","dninemfive","Metaknight Amish","http://steamcommunity.com/id/dninemfive/","166 products in account","A nice little game to play for a bit. It took >10 seconds to download, which is faster than some mods. I haven't noticed any issues with clicking as some others have.\n\nPROS:\n- Free\n- requires some strategy\n- AI seems reasonable\n- Apparently there's procedural terrain generation\n\nCONS:\n- RNG. Capturing a territory is a random chance, so you can even fail to capture unguarded territory. There are also RNG plagues and rebellions. All together they make the game less strategic, so each should really be replaces with established mechanics (like maybe a defense bar for forts, or an unrest meter in territory).","May 1","true","2.0"," No ratings yet","0","0","0","0","0"
"http://steamcommunity.com/profiles/76561198054004767/recommended/444250/","76561198054004767","WildNova","http://steamcommunity.com/profiles/76561198054004767/","41 products in account","Product received for free\n\nMay be a little addicting. It's so simple, yet feels so rewarding to win (really is akin to Risk/Civ hybrid with simple rules).\nThere are some minor clicking glitches and no resizeability, but free is free, and you can't beat that.\nThanks Mojang!","May 7","true","91.9"," No ratings yet","0","0","0","0","0"
"http://steamcommunity.com/id/adamczech/recommended/444250/","adamczech","Antipode","http://steamcommunity.com/id/adamczech/","198 products in account","Very thin mechanically and next to no depth.","May 7","false","0.2"," No ratings yet","0","0","0","0","0"
"http://steamcommunity.com/profiles/76561198057494647/recommended/444250/","76561198057494647","Zensalin1","http://steamcommunity.com/profiles/76561198057494647/","23 products in account","Product received for free\n\nNot much to say. It's free and great fun, but can sometimes be a little frustrating.","May 8","true","2.3"," No ratings yet","0","0","0","0","0"
"http://steamcommunity.com/id/Sstoyanov/recommended/444250/","Sstoyanov","sstoyanov","http://steamcommunity.com/id/Sstoyanov/","22 products in account","Pretty simple RNG clicker. It's free so It's worth the try I think.","May 9","true","0.1"," No ratings yet","0","0","0","0","0"
