"url","reviewerUsername","reviewerDisplayName","reviewerUrl","reviewerProductsCount","reviewText","date","recommended","hoursPlayed","voteText","helpfulPercent","votesHelpful","votesTotal","votesFunny","commentsCount"
"http://steamcommunity.com/id/roginofacts/recommended/444250/","roginofacts","Drackmore","http://steamcommunity.com/id/roginofacts/","137 products in account","So lets just get this out of the way, yes the game is free, yes its by mojang, no being a free game does not exempt it from being criticized.\n\nThe game is a clone of the old Risk games, you start your turn with a finite number of actions indicated by Gold, every action costs varying amounts of it with basic attacks only costing one and fortification upgrades costing upwards of 6 gold. Now you get more gold by capturing neighboring nations and holding them, in fact it takes a turn before they start producing gold for you.\n\nHowever producing gold is all they do, they confer no bonuses to attack or defense, no price reduction in actions, there is no way to affect the outcome of an action, the game gives you fortifications you can place which supposedly increase one's defensive capabilities, but in a game powered strictly by RNG with no skill involved these fortifications mean little when they can fall in a single action and an empty node can stand the test of time and weather an entire turn worth of actions.\n\nAs I said previously, there is no strategy, there is no thought to this game (either in production or playing), the game is essientially a clicker game, just keep clicking nodes you don't own and eventually you'll win\n\nPros\nNone\n\nCons\n*Terrible Music and repeditive sound effects quickly become irritating within minutes of starting.\n*Terrible controls, yes thats right a mouse driven game with terrible controls. Clicking works whenever it chooses to and seems to be affected by the same RNG that controls the rest of the "game".\n*RNG, literally what the game should had been called. you click tiles to try and capture them, you keep clicking till either A) you run out of gold or ,B) the game decides to give it to you. No way to swing the favor, no way to mitigate risk, or anything.\n\n\nTldr\nFree game that can and should be avoided, only enjoyment one can derive from the game is reviewing the steam reviews and laughing at the people trying to defend this dreck on its sole merit of being f2p. But no really, even in the most heinous of f2p wreckage of games they usually have something going for them  I mean just look at uncrowded, a terrible ♥♥♥ UnitZ asset flip  but this is essientially nothing but a clicker game trying to masquerade as a strategy game.\n","April 26","false","0.2"," 8 of 17 people (47%) found this review helpful 3 people found this review funny","47","8","17","3","0"
"http://steamcommunity.com/profiles/76561198025354609/recommended/444250/","76561198025354609","Flowey the Flower","http://steamcommunity.com/profiles/76561198025354609/","138 products in account","Could have been so much more than that if only one thing had been changed, a freaking RNG. Everytime you attack you have a "chance" to win, its just like playing risk, unfun.","April 26","false","0.2"," 7 of 15 people (47%) found this review helpful 2 people found this review funny","47","7","15","2","0"
"http://steamcommunity.com/id/future10s/recommended/444250/","future10s","FUTURE10S","http://steamcommunity.com/id/future10s/","267 products in account","I really wish I could do a "neither" recommendation because this game is pretty good until the rebellion comes in and then it just becomes RNG hell. No matter how well you try and do the AI will outdo you in some way outside of your control.","April 23","false","0.5"," 5 of 11 people (45%) found this review helpful","45","5","11","0","0"
"http://steamcommunity.com/id/spence2000/recommended/444250/","spence2000","ThatThereTim","http://steamcommunity.com/id/spence2000/","430 products in account","Really confusing and buggy as hell - on the 3rd/4th(?) level where you can cross oceans, some castles take like 28937420983742098347208934742093882 hits before they're destroyed.\n\nThoroughly broken game. Waste of time, even for free.","May 6","false","0.3"," 5 of 11 people (45%) found this review helpful","45","5","11","0","0"
"http://steamcommunity.com/id/kamikazecdn/recommended/444250/","kamikazecdn","KamikaZeCDN","http://steamcommunity.com/id/kamikazecdn/","156 products in account","If it's not the poor clicking its the RNG "combat".\n\nI saw the game and thought I'd give it a shot. The art style didn't bother me in the least, in fact I rather liked it. But that's where my joy and pleasure ended. In the short time I played this game it was clear what it was going to be. About 50% of my clicks didn't register correctly, forcing me to redo certain actions...thus slowing the gameplay down. And when they did work it was pure RNG. There is no actual logic why an attack is a success or failure. What's even more irritating is what could take me 3, 4 or even 5 attacks to take over an enemy tile/space but the computer could do so with single attacks. There are no stats to read. No system of "you have x amount of attack power while this title has x number of defence". There is no strategy to the game. It's just click until you're out of gold. Maybe toss an added tower here and there (which rarely seems to make a difference).\n\nThe combat is simply decided with RNG, an RNG system that seems to favour the computer at all times. You have 20 gold to work with? Enjoy those 3 new spaces. Computer only has 10 gold? Well they get to have 5 new spaces (including the 3 you just took). Logically with double the resources I should be the stronger force. But since this game doesn't have logic built into it...it makes no difference. It's pure luck.\n\nIs it free? Sure, which is cool and all. But free doesn't always equal fun.","April 24","false","0.5"," 4 of 9 people (44%) found this review helpful 1 person found this review funny","44","4","9","0","0"
"http://steamcommunity.com/profiles/76561198010576373/recommended/444250/","76561198010576373","rorykinnear","http://steamcommunity.com/profiles/76561198010576373/","16 products in account","Fun little addictive strategy game, unfortunately it has no way to exit safely, steam still says 'running' and sometimes the background music continues even after I have used the task manager to shut down steam (game doesn't appear in TM though). Very frustrating, no menu with an exit option, no way to exit the game and start it again without using ctl alt dlt.","April 26","false","41.9"," 4 of 9 people (44%) found this review helpful 1 person found this review funny","44","4","9","0","0"
"http://steamcommunity.com/id/Seblor/recommended/444250/","Seblor","Seblor","http://steamcommunity.com/id/Seblor/","155 products in account","Actually, this game is Meh...\nI feel like it should be an early access and/or a Greenlight game.\n\nThere's no menu when you launch it, you end up directly on a game.\nThere's no fullscreen, and the window in small (this is really frustrating).\n\nAnd there is so many little things that mojang should improve :\nThe hitbox\nThe window location on startup\nThe RNG : 1 to 11 (max I got) attacks to take down a castle\nAnyway, I have to admit that it's fun as a free casual "small game" for a few games.\n\nI'd give it a +1 if there was a multiplayer, though.\n\nSo for me, until an update correcting some things or adding multiplayer, this is a No, because the name of Mojang have nothing to do with a game quality.\nBut you should try it. The game is around 150 Mo, and should run on any computer.","April 23","false","7.2"," 4 of 9 people (44%) found this review helpful","44","4","9","0","0"
"http://steamcommunity.com/id/sn0wtrooper/recommended/444250/","sn0wtrooper","Estrangulador Mexeriqueiro","http://steamcommunity.com/id/sn0wtrooper/","123 products in account","RNG hell. This relies too much on luck, no strategy at all.","April 22","false","0.2"," 4 of 9 people (44%) found this review helpful","44","4","9","0","0"
"http://steamcommunity.com/profiles/76561198037315768/recommended/444250/","76561198037315768","Molbac","http://steamcommunity.com/profiles/76561198037315768/","146 products in account","this games RNG made me so mad i couldnt play it anymore ...\nwhen you hit a fort 7 times and it still holds, and the next turn your enemy tramples through 5 of yours, all one hits, you just want to cry.\nand on top of the the game randomly unselects your unit and doesnt take your input when you click on a country, that just helps to make you more salty.\n\ni dont think i will go back to playing this games","April 26","false","0.8"," 3 of 7 people (43%) found this review helpful 2 people found this review funny","43","3","7","2","0"
"http://steamcommunity.com/id/TheSirJackee500/recommended/444250/","TheSirJackee500","Cyborg_Jack","http://steamcommunity.com/id/TheSirJackee500/","62 products in account","The game has no substance, no strategy. You conquer territories and lay down fortresses to protect them, but conquering territories is complete luck. There is no fun to a game about clicking and blind luck. All this game does is make you get mad and annoyed. For instance, an enemy territory could theoretically conquer your entire kingdom in one turn, as its based on a random number generator. I rate the game 3/10.","April 22","false","0.5"," 3 of 7 people (43%) found this review helpful","43","3","7","0","0"
"http://steamcommunity.com/id/kromeboy/recommended/444250/","kromeboy","kromeboy","http://steamcommunity.com/id/kromeboy/","558 products in account","It could be a small funny game if it wasn't for all the dicerolling in the background.","April 22","false","0.2"," 3 of 7 people (43%) found this review helpful","43","3","7","0","0"
"http://steamcommunity.com/id/patisa/recommended/444250/","patisa","patisa","http://steamcommunity.com/id/patisa/","2 products in account","not good","April 22","false","0.2"," 3 of 7 people (43%) found this review helpful","43","3","7","0","0"
"http://steamcommunity.com/id/jadax2000/recommended/444250/","jadax2000","Jadax","http://steamcommunity.com/id/jadax2000/","691 products in account","Nope. Just nope.\nIt's like risk, but replace your strategy with a big dose of RNJebus. A RNJebus that keeps boning you.\nI played this game thinking the rng can't be as bad as some of the others have said in their reviews - boy was I wrong! Don't get me wrong, I love risk, played it on the website, played risk maps in warcraft 3, hell I've even gotten steam games that are similar to risk (concept-wise), but this game is...\n\nPros\n- It's basically risk.\n- It builds on risk by giving you additional 'units' to play with.\n\nCons\n- It's not risk.\n- You're at the mercy of the rng.","April 23","false","1.1"," 2 of 5 people (40%) found this review helpful 1 person found this review funny","40","2","5","0","0"
"http://steamcommunity.com/id/superwizard64/recommended/444250/","superwizard64","Wizard of Oz","http://steamcommunity.com/id/superwizard64/","42 products in account","cant click next turn because there's only one resolution.\nlmao","April 23","false","0.1"," 2 of 5 people (40%) found this review helpful","40","2","5","0","0"
"http://steamcommunity.com/id/chasehammer/recommended/444250/","chasehammer","ChaseHammer","http://steamcommunity.com/id/chasehammer/","186 products in account","horrible, at map 3 or 4 the difficulty jumps so much.\n\ntired of having to click which option im picking after having to click a specific spot on the areas or else it nulls out your selection.","April 23","false","0.2"," 2 of 5 people (40%) found this review helpful","40","2","5","0","0"
"http://steamcommunity.com/id/backgroundnose/recommended/444250/","backgroundnose","Nose","http://steamcommunity.com/id/backgroundnose/","114 products in account","Utter dice fest. No strategy. Dull Dull Dull. And it doesn't register clicks properly.","April 23","false","0.3"," 2 of 5 people (40%) found this review helpful","40","2","5","0","0"
"http://steamcommunity.com/id/ethi0pia/recommended/444250/","ethi0pia","a small Ethiopian village","http://steamcommunity.com/id/ethi0pia/","574 products in account","Too heavily based on RNG, good luck advancing in the game.","April 22","false","0.3"," 2 of 5 people (40%) found this review helpful","40","2","5","0","0"
"http://steamcommunity.com/profiles/76561198014033470/recommended/444250/","76561198014033470","matiki","http://steamcommunity.com/profiles/76561198014033470/","68 products in account","English: This game is very poorly made. Clicks are often not registered which is very frustrating. AI is dumb as it purposely chooses to attack neutral terrains instead of ones that are taken. It leaves vast areas without forts. The game is purely random, there is no strategy to it. After level 20 I got tired with this game and could win on any map without much effort. Good they didn't charge money for it.\n\nPolski: Gra jest bardzo słabo zaprojektowana. Często nie wyłapuje kliknięć co niesamowicie frustruje. SI świadomie wybiera atak na neutralne tereny zamiast zajmować tereny oponentów co jest czystą głupotą. Często zostawie spore obszary bez ochrony w postaci fortów. Gra jest bardzo losowa i brak w niej jakiegokolwiek elementu strategicznego. Mniej więcej po 20 poziomie gra mi się znudziła, szczególnie że byłem w stanie ukończyć kolejne poziomy bez większego wysiłku. Tyle dobrego że gra jest darmowa.","April 23","false","1.8"," 2 of 5 people (40%) found this review helpful","40","2","5","0","0"
"http://steamcommunity.com/profiles/76561198015347358/recommended/444250/","76561198015347358","gomezfreak","http://steamcommunity.com/profiles/76561198015347358/","121 products in account","Very unbalanced AI. What takes multiple strikes for you is one hit for the AI. Glad it was free!","May 14","false","0.3"," 2 of 5 people (40%) found this review helpful","40","2","5","0","0"
"http://steamcommunity.com/id/sw1pz/recommended/444250/","sw1pz","Sw1pz -A-","http://steamcommunity.com/id/sw1pz/","6 products in account","Pros:\n- Fun little game\n- Very addicting game\n\nCons:\n- Controls are a little bit off\n- FPS stuck in 22 :/ increase it to 30 plz\n- Can't resize the window stuck in 800x600 i think...\n- Can't skip the game when died","May 5","false","1.5"," 2 of 5 people (40%) found this review helpful","40","2","5","0","0"
"http://steamcommunity.com/profiles/76561198220705456/recommended/444250/","76561198220705456","jacky8399","http://steamcommunity.com/profiles/76561198220705456/","3 products in account","RNG can actually ruin a game.Good job, Mojang.","May 21","false","1.0"," 2 of 5 people (40%) found this review helpful","40","2","5","0","0"
"http://steamcommunity.com/id/m0nde/recommended/444250/","m0nde","【ツ】","http://steamcommunity.com/id/m0nde/","372 products in account","Surprisingly good, casual, easy to learn, free game which gets harder and more satisfying as you progress with new units and ways to increase turns. At this point, there are many problems with the interface: click area not responding, window sizing, minor Engllish errors, but hopefully Mojang will fix these in an upcoming patch. Though the game saves progress and continues at the highest level you've completed, I don't see a way to reset progress or any interface options to adjust sound or screen size. The only serious drawback is the random level creation which makes some levels either impossibly difficult or incredibly easy.\nThere's no reason to not try this or give it a bad rating since it's free and delivers what it promises.","April 26","true","3.1"," 1 of 3 people (33%) found this review helpful","33","1","3","0","0"
"http://steamcommunity.com/profiles/76561198220306772/recommended/444250/","76561198220306772","Lord Hawk","http://steamcommunity.com/profiles/76561198220306772/","39 products in account","a fun little game.","April 27","true","1.0"," 1 of 3 people (33%) found this review helpful","33","1","3","0","0"
"http://steamcommunity.com/id/WaffleManiak/recommended/444250/","WaffleManiak","WaffleManiak","http://steamcommunity.com/id/WaffleManiak/","6 products in account","the game is not good at all, the game acts like a strategy game but is not is simple luck, is unfair lot of the time and is just a really bad clone of games like Twilight Struggle or Victory and Glory: Napoleon wch are fantastic games. I can only tell you to play it and see what i mean, i think it feels really lazy but thats my opinoin","April 26","false","0.6"," 1 of 3 people (33%) found this review helpful 1 person found this review funny","33","1","3","0","0"
"http://steamcommunity.com/profiles/76561197961638769/recommended/444250/","76561197961638769","Joe Boxer","http://steamcommunity.com/profiles/76561197961638769/","248 products in account","Mouse clicks do not work all the time, so getting a lot of double clicks, or no clicks at all.","April 23","false","0.3"," 1 of 3 people (33%) found this review helpful","33","1","3","0","0"
"http://steamcommunity.com/id/arkseta/recommended/444250/","arkseta","Seta","http://steamcommunity.com/id/arkseta/","7 products in account","Fun to kill time","April 24","true","5.1"," 1 of 3 people (33%) found this review helpful","33","1","3","0","0"
"http://steamcommunity.com/profiles/76561198064525976/recommended/444250/","76561198064525976","=ZEKTOR= SK","http://steamcommunity.com/profiles/76561198064525976/","28 products in account","This game is for specific old school players.If you are more of a modern player, you can surely bypass this game.\nOtherwise try it, it have technical issues, and later boring gameplay, but it is fun for playing when you are bored, and have nothing to play.","April 26","true","0.3"," 1 of 3 people (33%) found this review helpful","33","1","3","0","0"
"http://steamcommunity.com/id/9992332445/recommended/444250/","9992332445","That Weeb","http://steamcommunity.com/id/9992332445/","11 products in account","Honestly, do not play this.\nRNG Hell\nCrappy controls seemingly bug out alot\nAnd seemingly an infinite tutorial\n4/10 for me","May 1","false","1.5"," 1 of 3 people (33%) found this review helpful 1 person found this review funny","33","1","3","0","0"
"http://steamcommunity.com/id/aetherspoon/recommended/444250/","aetherspoon","aetherspoon","http://steamcommunity.com/id/aetherspoon/","247 products in account","Basically, think Risk but even more random. That being the problem - the later levels are basically "did I not get screwed over by the RNG?" rather than any real strategy.\n\nAlso, the game doesn't change its seed, so trying the same thing again would result in things failing in the same way. Perfectly fine for a game like XCOM, not so great when you just die horribly because your first sea invasion fails to take a blank spot on the board.","May 1","false","6.7"," 1 of 3 people (33%) found this review helpful 1 person found this review funny","33","1","3","0","0"
"http://steamcommunity.com/profiles/76561198213974401/recommended/444250/","76561198213974401","Osiris","http://steamcommunity.com/profiles/76561198213974401/","19 products in account","How to beat the game in one second:\nJust press the x in the upper right corner","April 24","true","1.7"," 1 of 3 people (33%) found this review helpful 3 people found this review funny","33","1","3","3","0"
"http://steamcommunity.com/profiles/76561198067493972/recommended/444250/","76561198067493972","DoktorHamster","http://steamcommunity.com/profiles/76561198067493972/","29 products in account","8-Bit Single player Risk.\n\nReally, that's the extent of the game.\n\nIt's a great time-killer if you just want to play a somewhat mindless click game, without waiting for loading screen.\n\nIf you're looking for something with any real strategy behind it, go back to playing Civ V.","April 24","true","0.2"," 1 of 3 people (33%) found this review helpful","33","1","3","0","0"
"http://steamcommunity.com/profiles/76561198079763321/recommended/444250/","76561198079763321","einfach nur Jim","http://steamcommunity.com/profiles/76561198079763321/","47 products in account","like minecraft in good","April 23","true","1.1"," 0 of 1 people (0%) found this review helpful 1 person found this review funny","0","0","1","0","0"
"http://steamcommunity.com/id/LordJellyfish/recommended/444250/","LordJellyfish","LordJellyfish","http://steamcommunity.com/id/LordJellyfish/","275 products in account","Neat little strategy game. It's good for the price.","April 23","true","3.2"," 0 of 1 people (0%) found this review helpful","0","0","1","0","0"
"http://steamcommunity.com/profiles/76561198016482519/recommended/444250/","76561198016482519","Comrade Gerrybae","http://steamcommunity.com/profiles/76561198016482519/","211 products in account","just completed the game (around 76 levels i tought) pretty fun simple strategy game. with easy mechanics\ni see some people say this is an RNG hell, well that is pretty much almost every strategy game, if you use your mind in this game you would have no problem completing the levels. gave me 3.4 hours of fun but that is pretty much the most you can get out of it. try it for yourself. download size is small anyway.","April 23","true","3.4"," 0 of 1 people (0%) found this review helpful","0","0","1","0","0"
"http://steamcommunity.com/id/r3d24liveshere/recommended/444250/","r3d24liveshere","R3D24","http://steamcommunity.com/id/r3d24liveshere/","42 products in account","It's Free. If not I'd say it's worth a good dollar or two.\n\nIt's heavily RNG based but it has a (Read: Local only) multiplayer, otherwise it's fairly easy but heavily RNG based.\n\n- Simple mechanics\n- RNG Based\n- Local Multiplayer\n- Easy to beat with a little luck\n- Free","April 23","true","4.3"," 0 of 1 people (0%) found this review helpful","0","0","1","0","0"
"http://steamcommunity.com/id/murnshaw/recommended/444250/","murnshaw","[EF]MurnShaw","http://steamcommunity.com/id/murnshaw/","120 products in account","It is a simple board control game against the AI, and a significantly more difficult board control game against your friends.","April 23","true","5.1"," 0 of 1 people (0%) found this review helpful","0","0","1","0","0"
"http://steamcommunity.com/profiles/76561197960452481/recommended/444250/","76561197960452481","Grim Fang","http://steamcommunity.com/profiles/76561197960452481/","55 products in account","It's a fun game, and the core of the game is very nice. In the later maps, the upgrades seems a bit waste of money. And also the game seems to get worse and worse at registering clicks, that is extremely annoying.\n\nAssuming the clicking can be fixed, I'm going to recommend it.","April 23","true","3.1"," 0 of 1 people (0%) found this review helpful","0","0","1","0","0"
"http://steamcommunity.com/id/QuantumFractal/recommended/444250/","QuantumFractal","Quantom","http://steamcommunity.com/id/QuantumFractal/","93 products in account","It's pretty good so far. It's a super simple game that I enjoy playing between doing homework or studying.\nArt is good. Only thing that's annoying is the RNG that destroys my villages after I place them ;-;\n\nI recommend it!","April 23","true","49.8"," 0 of 1 people (0%) found this review helpful","0","0","1","0","0"
"http://steamcommunity.com/profiles/76561198018509293/recommended/444250/","76561198018509293","lotuspulse","http://steamcommunity.com/profiles/76561198018509293/","911 products in account","A fun Risk type game for free, yes it has RNG, but so does every board game.","April 23","true","7.5"," 0 of 1 people (0%) found this review helpful","0","0","1","0","0"
"http://steamcommunity.com/id/jachymor/recommended/444250/","jachymor","Hawker Jachymor","http://steamcommunity.com/id/jachymor/","228 products in account","In short: A proof-of-concept Risk game with lacking options. Requires a lot of polish, but is a worthy timesink a the moment.\n\nGood for: Casual strategist with little time at their disposal\n\nBad for: Those who want a fully fleshed out strategy title","April 23","true","0.4"," 0 of 1 people (0%) found this review helpful","0","0","1","0","0"
"http://steamcommunity.com/profiles/76561198143855862/recommended/444250/","76561198143855862","k-19twm","http://steamcommunity.com/profiles/76561198143855862/","46 products in account","RNG issues, could use a menu to replay mission and, maybe multi-player options. Though don't get me wrong the core idea of the game is great.","April 23","true","1.1"," 0 of 1 people (0%) found this review helpful","0","0","1","0","0"
"http://steamcommunity.com/profiles/76561197967214022/recommended/444250/","76561197967214022","SelflessHero","http://steamcommunity.com/profiles/76561197967214022/","339 products in account","Not a game.","April 23","false","0.2"," 0 of 1 people (0%) found this review helpful","0","0","1","0","0"
"http://steamcommunity.com/id/2GDStudio/recommended/444250/","2GDStudio","2GD","http://steamcommunity.com/id/2GDStudio/","20 products in account","Not a bad game. Definitely could use some updates to add more stuff, but hey, it's free!\nPROS\n-It's free.\n-It's a little like Risk and Age of Empires 2 put together and shrunk down to micro-form.\n-It's simple and easy to pick up.\n-Graphics aren't anything from, say, Civ V, but they still look nice.\n-The music isn't bad.\nCONS\n-The music can get repetitive, though.\n-Other than the change in maps, the game feels about the same after getting the fourth AI.\n-More stuff in the game would be nice in, say, a future update.\n\nAll in all, 7/10 stars. Not the best game I've ever played, but it's not half bad.","April 23","true","0.2"," 0 of 1 people (0%) found this review helpful","0","0","1","0","0"
