"url","reviewerUsername","reviewerDisplayName","reviewerUrl","reviewerProductsCount","reviewText","date","recommended","hoursPlayed","voteText","helpfulPercent","votesHelpful","votesTotal","votesFunny","commentsCount"
"http://steamcommunity.com/profiles/76561198024153209/recommended/444250/","76561198024153209","ShotgunPeety","http://steamcommunity.com/profiles/76561198024153209/","589 products in account","I fail to see any real strategy in the game, you just take over a patch of land and skip turns until you are rich then take everyone out. There are no numbers for the chances of how an attack will go or how well protected places are it's just rolling the dice. As it is at the moment it is just dull and broken.\n\nAt least it's free I guess.","April 24","false","0.6"," No ratings yet","0","0","0","0","0"
"http://steamcommunity.com/id/kaesaecracker/recommended/444250/","kaesaecracker","kaesaecracker","http://steamcommunity.com/id/kaesaecracker/","146 products in account","Awesome game, and it's free!","April 24","true","8.8"," No ratings yet","0","0","0","0","0"
"http://steamcommunity.com/profiles/76561198001328072/recommended/444250/","76561198001328072","Raimanojaku","http://steamcommunity.com/profiles/76561198001328072/","1063 products in account","Very nice little strategy game :)\n\nBasically, Crown and Council is a RISK clone featuring neat pixel style graphics.\n\nYes, it has its flaws (like missing fullscreen mode, missing menu, etc)\nbut despite its somewhat unpolished state it already feels more like the original RISK board game than the official Hasbro PC release, at least for me.\n\nAnd don't forget, it's FREE to play.\n\nPS to the devs: Can we has fullscreen mode and (local) multiplayer, please? :3","April 24","true","8.0"," No ratings yet","0","0","0","0","0"
"http://steamcommunity.com/id/tylersnowden/recommended/444250/","tylersnowden","tylersnowden","http://steamcommunity.com/id/tylersnowden/","63 products in account","This game is really fun. I keep catching myself saying, "just one more map".","April 24","true","3.4"," No ratings yet","0","0","0","0","0"
"http://steamcommunity.com/id/Jabeedo/recommended/444250/","Jabeedo","Jabeedo","http://steamcommunity.com/id/Jabeedo/","71 products in account","As a free game its allright. It seems like it would be MUCH better suited as a maobile game. there's nothing complex about it as you essentialy have 5 options and nothing to do on your opponents turns. I'll probably never spend anymore time than the 30 minutes I already have on this game. Not because its BAD its just not GOOD either.","April 24","false","0.5"," No ratings yet","0","0","0","0","0"
"http://steamcommunity.com/id/SilverShadowPro/recommended/444250/","SilverShadowPro","Snuffalufigus","http://steamcommunity.com/id/SilverShadowPro/","153 products in account","It's just a fun little causual game I'm not sure why people are complaining about it. Yeah RNG can be a little annoying sometimes, but there is a bit of strategic play going into it. Idk maybe they are bad at strategy, although yes the person with the most gold typically wins, but if they somehow grew 3 times your size then yeah you are probably going to lose, its no big deal.","April 23","true","2.6"," No ratings yet","0","0","0","0","0"
"http://steamcommunity.com/id/LukaDamn/recommended/444250/","LukaDamn","ŁukaDamn","http://steamcommunity.com/id/LukaDamn/","224 products in account","Pros:\n-Simple\n-Fun\n-Very Strategic\n-Runs on a Microwave\n-Free\nCons:\n-No Multiplayer, if there was, it would be really good and much played\n-Always Blue","April 23","true","1.1"," No ratings yet","0","0","0","0","0"
"http://steamcommunity.com/profiles/76561197971965446/recommended/444250/","76561197971965446","NoxMortus","http://steamcommunity.com/profiles/76561197971965446/","33 products in account","This game while emulating elements of 'swarm' strategy games does not have the inherent mechanism in place that make the type enjoyable. To conquer adjacent provinces the player must simply click and 'hope' that the unseen and random mathematics in the background works. The only advantage having a multitude of provinces is you get more attempts at attacking, however unlike games such as Risk where you can stack your numbers advantage.\n\nThis game provides what appears to be a 50% win/loss ratio. Having a fortress built seems the only way to enhance your defence, but again the benefit/penalty is unseen and appears to be a 30% win/loss ratio (attacker).\n\nThis game is free and can be a time sink for 5-10mins. It lacks polish and consideration of tactical and strategic considerations.\n","April 23","false","0.1"," No ratings yet","0","0","0","0","0"
"http://steamcommunity.com/id/capashin/recommended/444250/","capashin","=5H= Death","http://steamcommunity.com/id/capashin/","323 products in account","Any game that invites a comparison to one of the worst strategy games ever made, Risk, better be bringing something amazing to the table.  This isn't.  Free, amusing for a good 10 minutes, but ultimately a waste of time.","April 23","false","0.5"," No ratings yet","0","0","0","0","0"
"http://steamcommunity.com/id/evilguywhoeatsbrains/recommended/444250/","evilguywhoeatsbrains","EvilGuyWhoEatsBrains","http://steamcommunity.com/id/evilguywhoeatsbrains/","104 products in account","I like this game, it's simple and a quick time waster.\n\nHowever, the AI is too easy and I'm about 30 maps in and I'm starting to get bored.\n\nIt would have made a perfect mobile game.","April 23","true","5.0"," No ratings yet","0","0","0","0","0"
"http://steamcommunity.com/id/arnfield/recommended/444250/","arnfield","sengel","http://steamcommunity.com/id/arnfield/","72 products in account","This is an extremely simple game.  You get what you pay for.  The computer underlying mathematics seem to be skewed towards the computer which reduces the "strategy" part of the game.","April 23","false","0.3"," No ratings yet","0","0","0","0","0"
"http://steamcommunity.com/profiles/76561197993317914/recommended/444250/","76561197993317914","silverfistpugilist","http://steamcommunity.com/profiles/76561197993317914/","339 products in account","I read reviews about the RNG being uninspireing but nothing could have reinforced that fact better than spending fifteen turns or more doing nothing.  This was a tutorial map, it shouldn't take this long.  Now believe me, if I had managed to lose I would have assumed I missed something important.  That is not the case here.  No one, not me,  not the computer opponets, nobody could progress.  Just droneing bordom watching everybody fail misserably.","April 23","false","0.2"," No ratings yet","0","0","0","0","0"
"http://steamcommunity.com/id/oblakoff/recommended/444250/","oblakoff","Oblakoff","http://steamcommunity.com/id/oblakoff/","292 products in account","Worst RNG0-based, pixelated BS ever concieved","April 23","false","2.1"," No ratings yet","0","0","0","0","0"
"http://steamcommunity.com/id/AQuestionableCharacter/recommended/444250/","AQuestionableCharacter","The Question","http://steamcommunity.com/id/AQuestionableCharacter/","368 products in account","Eternal stalemate simulator","April 23","false","2.5"," No ratings yet","0","0","0","0","0"
"http://steamcommunity.com/profiles/76561198019566790/recommended/444250/","76561198019566790","Mario-chan!","http://steamcommunity.com/profiles/76561198019566790/","559 products in account","Fun at first, and it's hard to complain when the game's free, but there's no skill here or if there is it's 1% skill. This is an entirely luck based game and it can be incredibly frustrating to throw attack after attack at an undefended island only to watch next turn as the enemy swings in and takes your defended homeland in a single efficient run. Not recommended at all.","April 23","false","1.2"," No ratings yet","0","0","0","0","0"
"http://steamcommunity.com/id/Strange_Brew/recommended/444250/","Strange_Brew","Albus Doubledoors","http://steamcommunity.com/id/Strange_Brew/","134 products in account","I had fun playing it.\n\nThe game's logic is very simple. It could probably be ported to table-top 1 to 1. Being a fan of table-top games, that's a positive in my mind.\n\nAdd multiplayer and some balanced maps and you've got yourself the perfect game to play after rage-quitting something more serious!","April 22","true","1.6"," No ratings yet","0","0","0","0","0"
"http://steamcommunity.com/id/manfrin/recommended/444250/","manfrin","Dr. Mantis Toboggan","http://steamcommunity.com/id/manfrin/","340 products in account","This game is severely buggy. Probably 70% of the time I clicked on something, it would half register that I clicked, but do nothing. Gameplay is pretty plain, it's basically just Risk, but designed to look like Castles/Castles 2. The sound design was initially nice and quaint-indie, until the 100th time I tried to click and it made a noise that I clicked, but then did nothing.\n\nAdditionally, resizing the window leaves the game in a box, with just empty black space around it.\n\nThis feels like it was a hackathon 24-hour-game, but then listed as a complete game on steam.\n\nThis would have been fun if it actually worked.","April 22","false","0.2"," No ratings yet","0","0","0","0","0"
"http://steamcommunity.com/id/ectso/recommended/444250/","ectso","Ectso","http://steamcommunity.com/id/ectso/","166 products in account","RNG Dookfest","April 23","false","0.2"," No ratings yet","0","0","0","0","0"
"http://steamcommunity.com/id/rizrael/recommended/444250/","rizrael","Rizrael","http://steamcommunity.com/id/rizrael/","204 products in account","So far I really enjoy it. My only issue with it is the window size and that wasn't much of an issue until I got the university and couldn't see the icons for each thing (due to the taskbar obstructing the view). The RNG is decent once you figure out what's going on.\n\nFor those having trouble with it, keep in mind you don't have to attack every turn. Sit and gather gold for a turn or two to make it easier when you next move. Seriously, it adds up fast and each step after (even one claimed space) will make it just enough faster to be worth it.\n\nHotkeys and window resizing are what I'd ask for in improvements, as well as a general options menuthat includes restarting the level and volume control. I'd rather not have to go to my computer volume controls to change that.\n\nOne last note on the RNG, stop whining about it. Every strategy game has RNG and if it's difficult then it's challenging. If you want an easy RNG (and this isn't even difficult for me yet), play something else. I'm sure you can find a flash game easy enough for you.","April 23","true","3.4"," No ratings yet","0","0","0","0","0"
"http://steamcommunity.com/id/Ave_Machina/recommended/444250/","Ave_Machina","Kestryl","http://steamcommunity.com/id/Ave_Machina/","1494 products in account","Free Risk-like, but with appalling RNG. AI takes territories 5x as often as you will, basic UI funtionality is broken (game recognizes about 20% of your clicks).\n\nIf it wasn't a failure on a technical level, this would be a fun little game.","April 23","false","0.3"," No ratings yet","0","0","0","0","0"
"http://steamcommunity.com/id/epelmontes/recommended/444250/","epelmontes","Montes","http://steamcommunity.com/id/epelmontes/","247 products in account","Despite the bugs and bad RNG, it's actually quite fun.\nI'm conspiring to make a free board game it of it.","April 23","true","8.4"," No ratings yet","0","0","0","0","0"
"http://steamcommunity.com/id/andrix3s/recommended/444250/","andrix3s","Andri_X3S","http://steamcommunity.com/id/andrix3s/","23 products in account","Well this game is really interesting, nothing special, its done in pixel art and we dont really know any outher games from Mojang that have any outher stile. It is a free to play game and nothing for me, i played it now 25min and i personally dont like it. How i said it is a free game and if you like strategy games this might be for you, it is a good game so try it out and see if you like it or not.","April 23","true","0.5"," No ratings yet","0","0","0","0","0"
"http://steamcommunity.com/id/Mustache_Bud/recommended/444250/","Mustache_Bud","Mustache Bud","http://steamcommunity.com/id/Mustache_Bud/","346 products in account","This game is really stupid...","April 23","false","0.3"," No ratings yet","0","0","0","0","0"
"http://steamcommunity.com/id/theironpaw/recommended/444250/","theironpaw","Theironpaw","http://steamcommunity.com/id/theironpaw/","1379 products in account","Really buggy. I Quit the game and the menu music is still playing. Make it stop! Can't find it in the processors in task manager.\n\nThere are no menu buttons so the game will freeze and and you are mashing random buttons to skip but you can't, Overall its a game that needs some basic functions like a menu screen to disable music and fix the resoultion problem and understand if there is any other controls I might need to know. I won't recommend downloading until there is a few patches. But Hey its free. but its below standard of what a steam game should be, even for a free 2 play game.\n\nEdit.\nPress M to mute music\nPress Space to end turn\nPress 1,2,3,4 to change amount of players\nPress R to restart","April 22","true","7.1"," No ratings yet","0","0","0","0","0"
"http://steamcommunity.com/id/kierenj/recommended/444250/","kierenj","kierenj","http://steamcommunity.com/id/kierenj/","58 products in account","Quite good fun - but a really messed up difficulty curve.  Ignore castles, universities and just grab land and it's almost instantaneous victory.. up to Map 17.  Then on Map 17, it seems nearly impossible to win (have tried maybe 20, 30 times vs. 1 or 2 for maps 1 through 16).  Weird!","April 23","true","2.4"," No ratings yet","0","0","0","0","0"
"http://steamcommunity.com/profiles/76561198061970724/recommended/444250/","76561198061970724","Mathgun","http://steamcommunity.com/profiles/76561198061970724/","111 products in account","Fun and relax old school game.\nStarted to play this and couldn't stop.\nThe progression is great.\nI love the pixelated art.\nI love the music and sound effect but I\nwhich there was a way to mute the repetitive music. Since the music is the same in all levels.\nIt´s for free.. Ho many features can we ask when the game is free.\nSame clever and creative mind as Minecraft and Scrolls (even if Scrolls was canceld)\nIt's great. Thank you Mojang.","April 23","true","4.9"," No ratings yet","0","0","0","0","0"
"http://steamcommunity.com/id/oblakoff/recommended/444250/","oblakoff","Oblakoff","http://steamcommunity.com/id/oblakoff/","292 products in account","Worst RNG0-based, pixelated BS ever concieved","April 23","false","2.1"," No ratings yet","0","0","0","0","0"
"http://steamcommunity.com/id/AQuestionableCharacter/recommended/444250/","AQuestionableCharacter","The Question","http://steamcommunity.com/id/AQuestionableCharacter/","368 products in account","Eternal stalemate simulator","April 23","false","2.5"," No ratings yet","0","0","0","0","0"
"http://steamcommunity.com/profiles/76561197993317914/recommended/444250/","76561197993317914","silverfistpugilist","http://steamcommunity.com/profiles/76561197993317914/","339 products in account","I read reviews about the RNG being uninspireing but nothing could have reinforced that fact better than spending fifteen turns or more doing nothing.  This was a tutorial map, it shouldn't take this long.  Now believe me, if I had managed to lose I would have assumed I missed something important.  That is not the case here.  No one, not me,  not the computer opponets, nobody could progress.  Just droneing bordom watching everybody fail misserably.","April 23","false","0.2"," No ratings yet","0","0","0","0","0"
"http://steamcommunity.com/profiles/76561198012778824/recommended/444250/","76561198012778824","nitrojuice","http://steamcommunity.com/profiles/76561198012778824/","467 products in account","Good easy game, leave it running and come back to it every hour or so to finish a few maps","April 23","true","1.9"," No ratings yet","0","0","0","0","0"
"http://steamcommunity.com/profiles/76561198019566790/recommended/444250/","76561198019566790","Mario-chan!","http://steamcommunity.com/profiles/76561198019566790/","559 products in account","Fun at first, and it's hard to complain when the game's free, but there's no skill here or if there is it's 1% skill. This is an entirely luck based game and it can be incredibly frustrating to throw attack after attack at an undefended island only to watch next turn as the enemy swings in and takes your defended homeland in a single efficient run. Not recommended at all.","April 23","false","1.2"," No ratings yet","0","0","0","0","0"
"http://steamcommunity.com/profiles/76561198094323568/recommended/444250/","76561198094323568","LionWanderer","http://steamcommunity.com/profiles/76561198094323568/","158 products in account","It's free. It's a jam game. That being said, the game is really poorly thought. The window doesn't resize, there's no full screen, menu or options. Conquering each tile can take from 1 to endless turns, if there's a tower, and you have no way of knowing, so you may loose in a turn just out of random chance. There's not much else to the game either. I guess it's nice to spend some time, but that's it.","April 23","true","0.2"," No ratings yet","0","0","0","0","0"
"http://steamcommunity.com/profiles/76561198020088759/recommended/444250/","76561198020088759","Faggit","http://steamcommunity.com/profiles/76561198020088759/","61 products in account","Short review: It's all that's good about Risk with a magical touch of Civilization. It's fun and challenging once you get through the "teaching levels" and for the low low price of nothing it's a must play. It would work wonders on mobile devices, but on PC is still great.\n\nLong review: It's not as unfair as some people are pointing out. The random number generator (RNG) looks wild at first but once you get to the complex gameplay it really shines. It's a shame the game doesn't do a really good job of telling you it's just teaching you on the first level because it's kind of confusing. Once you get to the real boards it catches you offguard when the AI wipes you out and you realize it is you fault not the RNG. Managing your space becomes way more important and you start thinking twice. I'll be playing this from time to time. Nice job Mojang!\n\nPS:I'd LOVE to be able to play this with friends a multiplayer version would really do this game well. Maybe not a public one but still.","April 23","true","5.7"," No ratings yet","0","0","0","0","0"
"http://steamcommunity.com/id/spracky_98/recommended/444250/","spracky_98","Spracky","http://steamcommunity.com/id/spracky_98/","158 products in account","This is a good FREE game, all these negative reviews for a free game that has NO real life monetary in game purchases are just silly. It says what it does on the advert and delivers a simple yet addictive land grabbing game. I liked it, but I ran into a bug where if I get over 10 research points I can't click anything :/. In summary, it's good, it's free, it's fun (if you can get past the bugs) play it if you want.\n\nPS: Mojang, I wouldn't mind paying $5 for a polished updated multiplayer version of this game for me and my friends, just a suggestion ;)","April 23","true","5.2"," No ratings yet","0","0","0","0","0"
"http://steamcommunity.com/profiles/76561198210857320/recommended/444250/","76561198210857320","davidroma","http://steamcommunity.com/profiles/76561198210857320/","20 products in account","I understand this is going for a retro look, but the graphics just feel old and outdated.\nAnd the gameplay.. well everything's too random.","April 23","false","8.7"," No ratings yet","0","0","0","0","0"
"http://steamcommunity.com/id/greedisgood666/recommended/444250/","greedisgood666","Greed","http://steamcommunity.com/id/greedisgood666/","234 products in account","Not bad, it's just not very addicting.\n\n5/10","April 24","true","1.1"," No ratings yet","0","0","0","0","0"
"http://steamcommunity.com/profiles/76561198010356660/recommended/444250/","76561198010356660","Mario","http://steamcommunity.com/profiles/76561198010356660/","77 products in account","This could as well be called Mojang: The coin flip simulator.\nDon't let it fool you with its' mask of strategy. I've been in several situations where I was dominating the map with over twice the resources of the AI, only to lose to arbitarily not being able to take maps.\n","April 24","false","0.7"," No ratings yet","0","0","0","0","0"
"http://steamcommunity.com/id/HMK3/recommended/444250/","HMK3","HMK3","http://steamcommunity.com/id/HMK3/","124 products in account","A great game! made in 48 hours for a Game Jam competition.\n\nI hope it gets finished in the future","April 24","true","5.5"," No ratings yet","0","0","0","0","0"
"http://steamcommunity.com/id/2001225/recommended/444250/","2001225","Andro","http://steamcommunity.com/id/2001225/","54 products in account","The game is very good for the first 2 hours then it gets boring","April 24","true","2.5"," No ratings yet","0","0","0","0","0"
"http://steamcommunity.com/id/louislbnc/recommended/444250/","louislbnc","Burgundy Brown","http://steamcommunity.com/id/louislbnc/","21 products in account","Basically feel like a typical flash-based time waster.\n\nThe interface is subpar, running only at a set resolution in 4:3. There are no options menu so you learn about the controls through the vignettes between level. Really glad I learned how to turn off the music. There's just one track and doesn't fit the style of the game.\n\nFor a strategy game, it's overly simplified and basically just becomes you wondering what the RNG will give you. The CPU players also aren't very good which just makes it boring even faster.\n\nThe begining of the game does feel good when you're deciding which part of the map you could strategically get and hold on to.\n\nFun little thing for about 20min, when features get added (spoiler there aren't a lot). Then you figured it out. No one would be talking about this if it wasn't a Mojang game.","April 24","false","1.6"," No ratings yet","0","0","0","0","0"
"http://steamcommunity.com/profiles/76561198059639184/recommended/444250/","76561198059639184","Garp","http://steamcommunity.com/profiles/76561198059639184/","164 products in account","Really good game..","April 24","true","1.4"," No ratings yet","0","0","0","0","0"
"http://steamcommunity.com/id/jlukanc1/recommended/444250/","jlukanc1","jlukanc1","http://steamcommunity.com/id/jlukanc1/","10 products in account","needs full screen. its ok","April 24","false","0.2"," No ratings yet","0","0","0","0","0"
"http://steamcommunity.com/id/igpollitzer/recommended/444250/","igpollitzer","Bonus","http://steamcommunity.com/id/igpollitzer/","455 products in account","Even though I like Mojang, I can't find this game to be recommendable for anyone. It's a simple strategy game, but you don't need anything special to win. You just attack each opponent, and win most of the time. The upgrades are almost useless, because attacking your opponent to reduce his income is the key strategy.","April 24","false","3.5"," No ratings yet","0","0","0","0","0"
"http://steamcommunity.com/id/tozys/recommended/444250/","tozys","Tozy","http://steamcommunity.com/id/tozys/","85 products in account","This game is too bad to be from the Mohang brand. I wonder if it is an experiment to see if we would buy any shet from them. Game design wise, it's to shallow and flawed. No novelty either. Is really cheap. I know it's free, but anyway.","April 24","false","1.2"," No ratings yet","0","0","0","0","0"
"http://steamcommunity.com/profiles/76561198264971594/recommended/444250/","76561198264971594","love2pamperyou","http://steamcommunity.com/profiles/76561198264971594/","8 products in account","Irecomend this game but be warned that there are lots of bugs and i cant get past level 2 because my screen isn't big enoph to click done","April 24","true","1.1"," No ratings yet","0","0","0","0","0"
"http://steamcommunity.com/id/xeredar/recommended/444250/","xeredar","VICE.Woodhouse","http://steamcommunity.com/id/xeredar/","388 products in account","The game looks nice and is very well paced in the very early levels. But after a few mission, the difficulty scyrockets - not because the enemies got smarter, but because you get put into positions, where you have to fight with horrible RNG. Some missions are decided in the very first round. And there is no option to surrender - you have to wait until the NPCs decide to kill you.\n\nSpeaking of options: The game has none. Don't like the music? Your problem!\n\nThis game looks nice, has a decent idea behind it, but you wouldn't believe it came from Mojang, a now Microsoft backed Game Developer, that has one of the biggest names in gaming history in their repertoire: Minecraft.\n\nI would recomment everyone to play it, just to see how a really bad game looks like. And not one of the "Greenlight Trash" kind, but one from an actual developer.","April 23","false","1.1"," No ratings yet","0","0","0","0","0"
"http://steamcommunity.com/profiles/76561198118424637/recommended/444250/","76561198118424637","Guy Fieri","http://steamcommunity.com/profiles/76561198118424637/","85 products in account","Great Game- at first.... when you get more into the game it becomes impossible for the player to win. If the devs see this please put the odds a tiny bit more into the players favour","April 23","true","0.4"," No ratings yet","0","0","0","0","0"
"http://steamcommunity.com/id/CrunchyCamsta/recommended/444250/","CrunchyCamsta","Crunchy","http://steamcommunity.com/id/CrunchyCamsta/","42 products in account","Its fun at first but then i just stop being able to click any of the options and cant progress any further","April 23","false","0.5"," No ratings yet","0","0","0","0","0"
