"url","reviewerUsername","reviewerDisplayName","reviewerUrl","reviewerProductsCount","reviewText","date","recommended","hoursPlayed","voteText","helpfulPercent","votesHelpful","votesTotal","votesFunny","commentsCount"
"http://steamcommunity.com/id/pohotu/recommended/444250/","pohotu","pohotu3","http://steamcommunity.com/id/pohotu/","526 products in account","Neat strategy game, very RNG heavy. Kinda similar to risk, but really freaking easy. There is a list of things wrong with it however: Window is not resizable, controls are somewhat obfuscated, they're only really relayed by the loading screens between games, and the game has no real menus, including no start menus.\n\nWhile it does have it's problems, it is still pretty fun, and it's technical problems don't make the game unplayable in any way (it's hard to break a TBS) It's worth playing for a bit, but probably not with playing for very long without some content and technical updates.","April 22","true","5.1"," 49 of 58 people (84%) found this review helpful 1 person found this review funny","84","49","58","0","0"
"http://steamcommunity.com/id/princewilliam3/recommended/444250/","princewilliam3","Prince","http://steamcommunity.com/id/princewilliam3/","7 products in account","It's a great game but there are quite a few glitches (which is understandable).\n\nCons:\nThe clicking is very off, sometimes I have to click on something 5 times.\nOn level 39 there was a hidden 1 pixel peninsula.\nIt doesn't fit on my 1366x768 screen.  In order to play I need to maximize and move the taskbar.  They could at least make it fullscreen.\nPros:\nVery fun and addictive, probably one of the more fun turn based strategy games I've played.\nThere's really nothing in particular that's good about it, it's really only fairly good in all.\nI REALLY think they should add online multiplayer though.  That would make it so much more fun.","April 23","true","6.2"," 45 of 59 people (76%) found this review helpful","76","45","59","0","2"
"http://steamcommunity.com/id/Mochachill/recommended/444250/","Mochachill","GREAT SAGE DOGGO","http://steamcommunity.com/id/Mochachill/","183 products in account","PROS\nVery fun game\nSimplistic map warfare with a decent bit of strategy behind it\nFree\nCONS\nDoesn't seem to be entirely polished, some minor clicking errors\n\nI definitely recommend giving it a go at the very least. If you don't like it, you won't pay anything for it anyways.","April 22","true","1.0"," 39 of 53 people (74%) found this review helpful 3 people found this review funny","74","39","53","3","1"
"http://steamcommunity.com/id/Tackotacko/recommended/444250/","Tackotacko","Tackotacko™","http://steamcommunity.com/id/Tackotacko/","37 products in account","Crown and Council is a very nice casual game.\nEasy to learn, easy to play.\nBut a multiplayer would be nice.","April 22","true","1.5"," 46 of 66 people (70%) found this review helpful 3 people found this review funny","70","46","66","3","0"
"http://steamcommunity.com/profiles/76561198006264420/recommended/444250/","76561198006264420","uNV Annihilator","http://steamcommunity.com/profiles/76561198006264420/","190 products in account","It's free.\n\nThat being said the RNG is SO strong in this game. After the first few missions (when it hits 4 players) it seems that RNG can ruin a game. Attack the same place multiple times and don't even get a hit (I'm assuming there are misses) but then the AI comes in and takes down a fresh fort in 1 hit.\n\nIf I'm going to have a chance at failing an attack, maybe let me know why it failed?\n\nUnable to resize the window and also has problems with losing your current action selection? Would not be as unbearable to deal with if there were hotkeys for the actions.\n\nAssuming the QOL is improved and maybe a little less RNG and this would be a GREAT game to play in your freetime.","April 22","false","0.5"," 93 of 152 people (61%) found this review helpful 2 people found this review funny","61","93","152","2","11"
"http://steamcommunity.com/profiles/76561198191269407/recommended/444250/","76561198191269407","Original Matthew","http://steamcommunity.com/profiles/76561198191269407/","10 products in account","Great mini stragey game, eager for some new updates and more intuitive ai. Overall a fun game to waste some time playing, again great start however it feels like a incomplete game.","April 22","true","9.3"," 18 of 21 people (86%) found this review helpful","86","18","21","0","0"
"http://steamcommunity.com/id/AoE3bro/recommended/444250/","AoE3bro","Uberpwner","http://steamcommunity.com/id/AoE3bro/","14 products in account","Not a bad game. Definitely could use some updates to add more stuff, but hey, it's free!\nPROS\n-It's free.\n-It's a little like Risk and Age of Empires 2 put together and shrunk down to micro-form.\n-It's simple and easy to pick up.\n-Graphics aren't anything from, say, Civ V, but they still look nice.\n-The music isn't bad.\nCONS\n-The music can get repetitive, though.\n-Other than the change in maps, the game feels about the same after getting the fourth AI.\n-More stuff in the game would be nice in, say, a future update.\n\nAll in all, 7/10 stars. Not the best game I've ever played, but it's not half bad.","April 22","true","0.5"," 16 of 20 people (80%) found this review helpful","80","16","20","0","0"
"http://steamcommunity.com/id/groundfx/recommended/444250/","groundfx","Potato","http://steamcommunity.com/id/groundfx/","41 products in account","Great game for being 100% free","April 22","true","2.6"," 17 of 22 people (77%) found this review helpful 1 person found this review funny","77","17","22","0","0"
"http://steamcommunity.com/id/izibaar/recommended/444250/","izibaar","Izibaar","http://steamcommunity.com/id/izibaar/","147 products in account","The player with most luck gets more gold and will win the game.\nMaybe you can find some skill based gameplay after you luck through some maps. But I had no fun to try it.","April 22","false","0.3"," 28 of 44 people (64%) found this review helpful","64","28","44","0","0"
"http://steamcommunity.com/id/MangoMangoDave/recommended/444250/","MangoMangoDave","MangoMango","http://steamcommunity.com/id/MangoMangoDave/","213 products in account","Random Number Generator hell. Don't even.","April 22","false","0.4"," 45 of 77 people (58%) found this review helpful 7 people found this review funny","58","45","77","7","1"
"http://steamcommunity.com/profiles/76561198083544274/recommended/444250/","76561198083544274","Mr. Prez","http://steamcommunity.com/profiles/76561198083544274/","25 products in account","I have played this game for a while now and I find that it is a great way to pass the time! It can be a little frustrating at times, but it is very fun to play.\n\nPros:\n- Very nice and simple interface\n- easy to use controls\n- decent amount of gameplay\n\n\nMy only con for this game is:\n- there is only one resolution\n","April 22","true","2.6"," 10 of 12 people (83%) found this review helpful 1 person found this review funny","83","10","12","0","0"
"http://steamcommunity.com/id/cussbrother/recommended/444250/","cussbrother","A WINDSHIELD WIPER","http://steamcommunity.com/id/cussbrother/","861 products in account","A simplistic and slightly buggy game that absolutely feels like the jam-game (a game created in a short amount of time, usually in a distracting party environment) it is.\n\nFor starters, clicking doesn't quite work right. Sometimes clicks just won't register, other times the hit detection just doesn't quite align with the displayed cursor. Managing to mess up the act of pointing a mouse and clicking on things - something that's been handled with grace and relative aplomb since approximately the mid-1980s - is bad enough, but in a game consisting mostly of clicking it's borderline unforgivable.\n\nThere's an RNG element which is utterly frustrating - sometimes you'll waste an entire turn trying to attack an undefended territory and repeatedly losing, then watch the AI attack one of your fortified strongholds and capture it on the first try. RNG absolutely *can* spice things up when used sparingly, but this game offers no real strategic choices to mitigate the RNG. You can't choose between a high risk / high reward or low risk / low reward technique, and territories don't have any form of a hitpoint system, so attacking multiple times isn't necessarily going to chip away at a wall of defenses. You're basically just rolling a d6 and if it's 2 or higher you win, or natural 6 to capture a fortified territory.\n\nFurthermore, because of the RNG and simplistic (as in "virtually non-existent") strategic element, the broader game quickly collapses into which side manages to capture the most territory on the first turn. More territory = more money = more attacks = more territory. Sure, that's the basic gist of every 4X game and RTS on the planet, but - for example - in Civilization I can place cities in better territory for defense and economic bonuses, and easily hold back an opponent with twice as many cities in poor locations. In Starcraft, I can use recon to see an enemy is weak against air, and focus my research and unit creation into air units, making the best of what may be a bad situation and eventually turning the tables. Hell, even old-school DOTA (even before all the comeback mechanics) wasn't quite as much of a snowball as this game - and nothing is more tedious than playing out the last few turns when you're in an unwinnable situation, or even the last few turns when the enemy has just one territory left and you can't tickle the RNG into giving you your justly-earned victory.\n\nIt's single-player only, and the AI is about as bland as it gets. You don't see certain opponents prioritize defensive fortifications and others going for larger acquisition - it's just a cacophony of attacks and random tile improvements. It's the worst sort of AI - not smart enough to bother planning ahead for, and even worse, not predictably dumb enough to manipulate.\n\nTo top it off, there's seemingly no options menu, which means you're stuck listening to the bland and repetitive music throughout the experience. It's a bit like the songs in a Koei game from the SNES era, except far shorter and far, far more repetitive. No full-screen option either - hell, you can't even change your character color away from blue.\n\nAll in all it reminds me of the "games" that might be bundled with a Linux distro ten years ago - sort of a tile-based Liquid War, except Liquid War had more map variety and, hell, you could even change your color and name.\n\nIt's free and I think it's still a little bit overpriced.","April 24","false","0.3"," 49 of 85 people (58%) found this review helpful 15 people found this review funny","58","49","85","15","12"
"http://steamcommunity.com/id/ChromeE/recommended/444250/","ChromeE","Kirby","http://steamcommunity.com/id/ChromeE/","216 products in account","While this is a very bare and unpolished game, it is fun and addicting and very worth the short time it takes to download. The game jam beginnings definitely show, but it is definitely a complete and functional product that shows promise if they ever revisit it. I have a lot of fun with it and i haven't even played with a group yet. I definitely reccomend this for anyone who wants a relaxing strategy game.","April 24","true","15.0"," 12 of 16 people (75%) found this review helpful","75","12","16","0","0"
"http://steamcommunity.com/id/stuph312/recommended/444250/","stuph312","Sgt. Hankey","http://steamcommunity.com/id/stuph312/","137 products in account","All you can do is pray. There is literally just about no strategy to this game. It's a real waste of time. Victory / defeat is determined through randomly generated numbers and it's just BS.\n\nSure it's free, but that shouldn't shield a game from critique. Even for a free game, this is junk.\n\nEdit: Lemme flesh it out some more.\n\nWhile I can appreciate the simplicity of the game, the one soundtrack being pleasant and it of course being free, the complete randomness of the game just ruins it. It doesn't matter if you're smarter, quicker or anything. It's pure luck. And it's also extremely repetitive.\n\nI made it to the water level, where both times it turned into very slow and boring wars.\n\nThis is however still an early point in the game. I can't exclude the possibility it gets better later on, but I highly, sincerely, doubt it.","April 22","false","0.6"," 32 of 54 people (59%) found this review helpful 1 person found this review funny","59","32","54","0","2"
"http://steamcommunity.com/id/Griffinsteam/recommended/444250/","Griffinsteam","RobotNinja","http://steamcommunity.com/id/Griffinsteam/","453 products in account","No bad. its a fun little Pixel are strategy game.\n\nits not very hard, but fun for a quick time killer\n\nplus its free which is always a plus","April 24","true","3.6"," 12 of 18 people (67%) found this review helpful 1 person found this review funny","67","12","18","0","0"
"http://steamcommunity.com/profiles/76561198040687103/recommended/444250/","76561198040687103","InGabWeTrust","http://steamcommunity.com/profiles/76561198040687103/","192 products in account","Great casual game.\nAddictive.\nFree.\nLike others have said, bring in multiplayer because that AI sucks.","April 22","true","2.5"," 13 of 20 people (65%) found this review helpful 1 person found this review funny","65","13","20","0","0"
"http://steamcommunity.com/profiles/76561198065612514/recommended/444250/","76561198065612514","lhpotter64d","http://steamcommunity.com/profiles/76561198065612514/","60 products in account","Downloaded and played to Map 3. No-one mentioned the RNG screws you hard, even when you're on top with assets and funds.\n\nFor example, Forts. Supposedly increase your defense by a factor of 2, however it is quite annoying when you attack a fortified position 3+ times in a row (happens often) with no success and the NPC attack once, bringing down your fort and territory.\n\nIf you can get passed that, it's definetely a fun, quick game.","April 22","false","6.3"," 13 of 20 people (65%) found this review helpful 1 person found this review funny","65","13","20","0","0"
"http://steamcommunity.com/id/dairyproduce/recommended/444250/","dairyproduce","hinosduck","http://steamcommunity.com/id/dairyproduce/","63 products in account","literally the most bs ive seen in a long time. i conquer three islands forts on all. ais take them out instantly and have forts on them. i try to do the same. have enough money to attack twice and lose both times. So in essence, this isnt worth the 0p its priced at.\nEdit: all my areas rebelled. i instantly lose. probably not even worth them paying you to download it.","April 22","false","7.9"," 13 of 20 people (65%) found this review helpful 1 person found this review funny","65","13","20","0","0"
"http://steamcommunity.com/id/stopstalkingmeyouweirdo/recommended/444250/","stopstalkingmeyouweirdo","Angry_Max(CSGOEgg.com)","http://steamcommunity.com/id/stopstalkingmeyouweirdo/","17 products in account","When I first started the game, I had to move my Windows task bar to the right instead of the bottom, because the game takes a lot of verticle space and can be resize, but does't allow a scroll option, rendering resizing useless. Once I was able to actually see the game, it quickly became quite addicting. My first sitting of the game was 112 minutes. When you start, each level gives you a new mechanic. Unfortunatly, the game starts to become stale once you've been introduced to all the mechanics. To avoid writing too much, I'm just going to put everything else in a list of pros and cons since everything else doesn't need explaing.\nPros:\n-it's free\n-nice time killer\n-easy to run\n-easy to play\n-balance of mechanics\n-not a whole lot is thrown on you at the start\n\nCons\n-no fullscreen from what I could see\n-game doesn't resize with window\n-gameplay gets stale after a while\n-RNG of the rebellions made me go crazy\n-actions will sometimes deselect themselves\n\nThe pros outweigh the cons, its a good game. Plus its free, so no harm in getting it.\n","April 22","true","2.0"," 6 of 7 people (86%) found this review helpful","86","6","7","0","0"
"http://steamcommunity.com/profiles/76561198035676290/recommended/444250/","76561198035676290","archeralley","http://steamcommunity.com/profiles/76561198035676290/","93 products in account","This is  a very simple and fun strategy game.  Others have mentioned that the interface is a little irritating at times with clicks on countries not always registering.  Honestly, not that big of a deal but I can see how it may frustrate some people.  My biggest problem with this game is the AI is not that intelligent. Once you understand how the game works it becomes mindlessly easy.  The AI tends to spend a lot of money on buildings while you are sweeping up huge swaths of land, at which point you have large amounts of money coming in and you can quickly dominate the board.  The AI also tends to focus on small border enemies and completely ignores you while you build a massive empire.  There seems to be some kind of animosity mechanic in the game where if you don't attack another player, they will generally leave you alone until they have to attack you because you're the only one left, or there is no other way for them to expand.  I have found that, generally, it is best to just ignore building anything and focus on grabbing as much land as possible.  Then use your increased income to crush your enemies.  Several people have said this game is like Risk.  Anyone saying that has never played Risk before.  This game has little in common with Risk.\n\nBasically a fun little game to play around with but it gets old fairly fast.","April 27","true","5.3"," 6 of 7 people (86%) found this review helpful 1 person found this review funny","86","6","7","0","0"
"http://steamcommunity.com/id/Nugginator/recommended/444250/","Nugginator","Nugginator","http://steamcommunity.com/id/Nugginator/","163 products in account","Very Fun, multiplayer and a mobile port would make this VERY good","April 22","true","1.0"," 7 of 9 people (78%) found this review helpful","78","7","9","0","0"
"http://steamcommunity.com/profiles/76561198117310096/recommended/444250/","76561198117310096","Natsurr","http://steamcommunity.com/profiles/76561198117310096/","45 products in account",""Yo mama so fat you need to expand your empire."\n10/10 would get insulted again.","May 1","true","3.1"," 7 of 9 people (78%) found this review helpful 7 people found this review funny","78","7","9","7","0"
"http://steamcommunity.com/id/Coil_Whine/recommended/444250/","Coil_Whine","Coil_Whine","http://steamcommunity.com/id/Coil_Whine/","1290 products in account","Microsoft's Mojang Presents... the Red RNG of Death. All jokes aside, fun and free game released by the developers of Minecraft. Check it out!","May 8","true","3.2"," 7 of 9 people (78%) found this review helpful 2 people found this review funny","78","7","9","2","0"
"http://steamcommunity.com/id/TallenMF/recommended/444250/","TallenMF","Tallen","http://steamcommunity.com/id/TallenMF/","129 products in account","RNG: the game","April 22","false","0.6"," 20 of 34 people (59%) found this review helpful 6 people found this review funny","59","20","34","6","2"
"http://steamcommunity.com/id/iScrE4m/recommended/444250/","iScrE4m","iScrE4m","http://steamcommunity.com/id/iScrE4m/","159 products in account","At least an hour of fun, pretty great considering it's a one man free time thing. And that one man is an artist, not a programmer, so pretty good :)","April 24","true","3.0"," 9 of 13 people (69%) found this review helpful","69","9","13","0","0"
"http://steamcommunity.com/profiles/76561198053738401/recommended/444250/","76561198053738401","amitkk","http://steamcommunity.com/profiles/76561198053738401/","139 products in account","Those ♥♥♥♥ing yellow ♥♥♥♥♥♥♥s.\nI protected them from the red army while they were researching something at the university.\nWhen I finally defeated the red, they attacked me with some ♥♥♥♥ing badass impossible to kill forces.\n\n♥♥♥♥ you yellow.","April 22","true","3.0"," 10 of 15 people (67%) found this review helpful 13 people found this review funny","67","10","15","13","0"
"http://steamcommunity.com/id/luckyghost/recommended/444250/","luckyghost","LuckyGhost","http://steamcommunity.com/id/luckyghost/","16 products in account","Overall a fantastic game, it is very simplistic yet it's a very complex and enjoyable game. However, the game's resolution can get annoying and is something that needs to be fixed.","April 22","true","1.6"," 11 of 17 people (65%) found this review helpful 1 person found this review funny","65","11","17","0","0"
"http://steamcommunity.com/id/greensoap/recommended/444250/","greensoap","GreenSoap","http://steamcommunity.com/id/greensoap/","125 products in account","- It's Risk\n- Free\n- The RNG is real\n- Too easy\n- Garbage interface\n- Pretty fun","April 24","true","6.0"," 5 of 6 people (83%) found this review helpful 1 person found this review funny","83","5","6","0","0"
"http://steamcommunity.com/id/Jurk0wski/recommended/444250/","Jurk0wski","Jurk0wski","http://steamcommunity.com/id/Jurk0wski/","720 products in account","A worthwhile time waster with no replayability. You'll get 30-60 minutes out of it, depending on how well you play.\n\nThere is RNG, but it's not as bad as all the negative reviewers are saying, and even if you do get a bout of bad RNG, you can quickly restart the map by hitting "R", meaning there's not much downtime if something screws up. I'd say that in the 75 maps, there's about 5 that I felt the RNG was actively against me from the start, but after you get the ball rolling, it's rarely an issue.\n\nMy biggest complaint with this game is the lack of viable strategies. on large connected maps, the best strategy is just zerg rushing the AI and grabbing as much land as possible, ignoring buildings. On smaller island maps, you simply need to build villages on every piece of land you have held for longer than 1 turn. There's no reason to go for upgrades or forts, and usually, by the time you're going for fleets, you can just throw them at your enemies because you have so much income.","April 22","true","2.2"," 6 of 8 people (75%) found this review helpful","75","6","8","0","0"
"http://steamcommunity.com/profiles/76561197994479186/recommended/444250/","76561197994479186","weeglbag","http://steamcommunity.com/profiles/76561197994479186/","111 products in account","It's like risk without all the ruined friendships.","April 22","true","7.4"," 7 of 10 people (70%) found this review helpful 2 people found this review funny","70","7","10","2","0"
"http://steamcommunity.com/id/wuxian/recommended/444250/","wuxian","Wuxian","http://steamcommunity.com/id/wuxian/","186 products in account","A very nice free little Risk-like casual board game with excellent music","April 22","true","0.8"," 3 of 3 people (100%) found this review helpful","100","3","3","0","0"
"http://steamcommunity.com/id/Jann180/recommended/444250/","Jann180","Novi","http://steamcommunity.com/id/Jann180/","189 products in account","What others said - a simple and fun risk game, where each game takes a couple minutes to finish at most. The game would do better if it explained the controls though (it does, but only in tips which are random).\n\nM - Turns music on/off\nG - Generate a random map\nR - Restarts the map\nK - Auto play\nSpace - End turn\nRight click - Attack an area until you win or run out of gold\n1-4 - Apparently changes the number of human players (didn't get it to work, probably needs to be on a generated map?) for local mp\n\nThere's probably more which I haven't found, but this should help you nicely.","April 22","true","3.7"," 3 of 3 people (100%) found this review helpful","100","3","3","0","0"
"http://steamcommunity.com/id/sadistichikikomori/recommended/444250/","sadistichikikomori","Squeak","http://steamcommunity.com/id/sadistichikikomori/","828 products in account","This is a fun little strategy game with fairly quick and interesting matches.\n\nIt has unmutable music and the AI is a bit too easy, but its overall pretty amusing.\n\n*Edit: Actually if you press M, it toggles the music on/off.","April 22","true","9.6"," 4 of 5 people (80%) found this review helpful","80","4","5","0","0"
"http://steamcommunity.com/profiles/76561198050902405/recommended/444250/","76561198050902405","Pegs.exe","http://steamcommunity.com/profiles/76561198050902405/","55 products in account","nice game","April 22","true","3.6"," 4 of 5 people (80%) found this review helpful","80","4","5","0","0"
"http://steamcommunity.com/id/SecularBaron/recommended/444250/","SecularBaron","MyName™","http://steamcommunity.com/id/SecularBaron/","255 products in account","Simple but fun risk-like game.","April 23","true","1.6"," 4 of 5 people (80%) found this review helpful","80","4","5","0","0"
"http://steamcommunity.com/id/simplythurny/recommended/444250/","simplythurny","Thurny","http://steamcommunity.com/id/simplythurny/","122 products in account","Mojangs new little game , is it worth playing? I'm gonna tell ya.\n\nWhat's good?\n-Free to play and people like free stuff, right?\n-Easy to understand, even I could understand it (and I'm pretty much of a ♥♥♥♥♥♥)\n-Runs fine on every PC you could possibly find\n-Some buildings with their own pro's and con's\n\nWhat's bad?\n-Really repetetive (My advice would be to add a mulitplayer.)\n-There are a bunch of bugs\n-Graphics ain't too neat\n-No actual story\n\nIt's not the best game on the planet, but if you like that kind of games trying won't really hurt you because the download just takes about 3 minutes anyway.","April 23","true","0.9"," 4 of 5 people (80%) found this review helpful","80","4","5","0","0"
