"url","reviewerUsername","reviewerDisplayName","reviewerUrl","reviewerProductsCount","reviewText","date","recommended","hoursPlayed","voteText","helpfulPercent","votesHelpful","votesTotal","votesFunny","commentsCount"
"http://steamcommunity.com/id/outrageouslysubtle/recommended/4560/","outrageouslysubtle","Haifisch","http://steamcommunity.com/id/outrageouslysubtle/","131 products in account","This game really upped the bar for RTS games. Not the greatest of all time, but still damn good.\nThe action is awesome, the explosions and environmental destruction are gorgeous.\nThe Opposing fronts expansion was a great touch as well with the added factions (love playing as the Brits). Tales of Valor was an okay add on, it didn't add too much. I prefer this one over CoH2, though the second isn't terrible.\n\nIf you like action, explosions, tanks running through buildings (this can be used strategically for epic results), and the feel of tanks demolishing 40's French cars in the country side, get this damn game.\n\nWhat are you waiting for?\n10/10","February 18","true","208.9"," 2 of 2 people (100%) found this review helpful 1 person found this review funny","100","2","2","0","0"
"http://steamcommunity.com/profiles/76561198094131595/recommended/4560/","76561198094131595","Herr_General","http://steamcommunity.com/profiles/76561198094131595/","101 products in account","Great game!","June 1, 2014","true","0.1"," 2 of 2 people (100%) found this review helpful","100","2","2","0","0"
"http://steamcommunity.com/profiles/76561198032247214/recommended/4560/","76561198032247214","Raven","http://steamcommunity.com/profiles/76561198032247214/","85 products in account","fantastic , i really like this game one of my all time favorites:))","November 2, 2014","true","11.9"," 3 of 4 people (75%) found this review helpful","75","3","4","0","0"
"http://steamcommunity.com/id/GhostFoxote/recommended/4560/","GhostFoxote","Big-Eared Trash Eater","http://steamcommunity.com/id/GhostFoxote/","55 products in account","With how infuriatingly cheap, spammy, ridiculous, and imbalanced this game tends to be, I really shouldn't like it.\n\nBut I do.","December 21, 2014","true","662.9"," 3 of 4 people (75%) found this review helpful 1 person found this review funny","75","3","4","0","1"
"http://steamcommunity.com/profiles/76561198025113133/recommended/4560/","76561198025113133","marin3xu","http://steamcommunity.com/profiles/76561198025113133/","54 products in account","great game, don't stop playing","December 20, 2013","true","0.4"," 3 of 4 people (75%) found this review helpful","75","3","4","0","0"
"http://steamcommunity.com/profiles/76561197987275861/recommended/4560/","76561197987275861","Viiksi","http://steamcommunity.com/profiles/76561197987275861/","79 products in account","Super hyvä","December 20, 2013","true","6.9"," 3 of 4 people (75%) found this review helpful","75","3","4","0","0"
"http://steamcommunity.com/id/richyboy319/recommended/4560/","richyboy319","Richards [1-32]","http://steamcommunity.com/id/richyboy319/","188 products in account","GET IT! BEST RTS 10/10","May 6, 2014","true","6.3"," 3 of 4 people (75%) found this review helpful","75","3","4","0","0"
"http://steamcommunity.com/profiles/76561198062394737/recommended/4560/","76561198062394737","Doug","http://steamcommunity.com/profiles/76561198062394737/","68 products in account","This is the best RTS ever. It is extremely historically acurate and foccusses on expansion of territory and annihilation of the enemy. It portrays WWII and its belligerents in the brightest of an epic light.","January 21, 2014","true","0.7"," 3 of 4 people (75%) found this review helpful","75","3","4","0","3"
"http://steamcommunity.com/id/revoooooo/recommended/4560/","revoooooo","Rev","http://steamcommunity.com/id/revoooooo/","152 products in account","One of the better RTS games out there at the moment. The game is built on a strong, proven engine and they do a great job of encompassing the era of the Second World War. If you enjoy tactical RTS games and the WW2 era, then this game is definitely a must-buy","January 20, 2014","true","2.1"," 3 of 4 people (75%) found this review helpful","75","3","4","0","0"
"http://steamcommunity.com/id/Connor1337/recommended/4560/","Connor1337","Connor l Lebron","http://steamcommunity.com/id/Connor1337/","192 products in account","FUN FILLED ACTION","September 27, 2014","true","8.2"," 3 of 4 people (75%) found this review helpful 1 person found this review funny","75","3","4","0","0"
"http://steamcommunity.com/id/godijustfuckingloveanime/recommended/4560/","godijustfuckingloveanime","Spiderfork","http://steamcommunity.com/id/godijustfuckingloveanime/","325 products in account","THIS GAME IS PRETTY GOOD","January 19, 2015","true","11.5"," 3 of 4 people (75%) found this review helpful 2 people found this review funny","75","3","4","2","0"
"http://steamcommunity.com/profiles/76561198058212014/recommended/4560/","76561198058212014","Sgt.Rock","http://steamcommunity.com/profiles/76561198058212014/","59 products in account","Great WWII RTS, can be frustrating at times, I recommend having some experienced Allies with you on your first few battles, but once you get used to it, you can have lots of fun. Most annoying thing in the game is mortars and.... that.... one.... same..... line..... from.... AT guns...... "AT SQUAD UNDER FIRE" I swear i have heard that 3 times in 5 seconds. Sadly SEGA is taking almost all credit for making this game, while is was originally made by THQ. Like "SEGA Presents" When it should say "THQ Presents"","May 16, 2015","true","10.2"," 3 of 4 people (75%) found this review helpful 2 people found this review funny","75","3","4","2","0"
"http://steamcommunity.com/id/GhostFoxote/recommended/4560/","GhostFoxote","Big-Eared Trash Eater","http://steamcommunity.com/id/GhostFoxote/","55 products in account","With how infuriatingly cheap, spammy, ridiculous, and imbalanced this game tends to be, I really shouldn't like it.\n\nBut I do.","December 21, 2014","true","662.9"," 3 of 4 people (75%) found this review helpful 1 person found this review funny","75","3","4","0","1"
"http://steamcommunity.com/profiles/76561198055926518/recommended/4560/","76561198055926518","Some guy named Will","http://steamcommunity.com/profiles/76561198055926518/","79 products in account","Dat WW2 Strategy. Much WW2-Army controlling","December 24, 2013","true","23.6"," 3 of 4 people (75%) found this review helpful","75","3","4","0","0"
"http://steamcommunity.com/id/draginol/recommended/4560/","draginol","Draginol","http://steamcommunity.com/id/draginol/","78 products in account","One of the best games of all time.","May 8, 2012","true","11.9"," 3 of 4 people (75%) found this review helpful","75","3","4","0","0"
"http://steamcommunity.com/profiles/76561198058212014/recommended/4560/","76561198058212014","Sgt.Rock","http://steamcommunity.com/profiles/76561198058212014/","59 products in account","Great WWII RTS, can be frustrating at times, I recommend having some experienced Allies with you on your first few battles, but once you get used to it, you can have lots of fun. Most annoying thing in the game is mortars and.... that.... one.... same..... line..... from.... AT guns...... "AT SQUAD UNDER FIRE" I swear i have heard that 3 times in 5 seconds. Sadly SEGA is taking almost all credit for making this game, while is was originally made by THQ. Like "SEGA Presents" When it should say "THQ Presents"","May 16, 2015","true","10.2"," 3 of 4 people (75%) found this review helpful 2 people found this review funny","75","3","4","2","0"
"http://steamcommunity.com/id/Connor1337/recommended/4560/","Connor1337","Connor l Lebron","http://steamcommunity.com/id/Connor1337/","192 products in account","FUN FILLED ACTION","September 27, 2014","true","8.2"," 3 of 4 people (75%) found this review helpful 1 person found this review funny","75","3","4","0","0"
"http://steamcommunity.com/profiles/76561197972690594/recommended/4560/","76561197972690594","(UvG)Ninja Tom","http://steamcommunity.com/profiles/76561197972690594/","235 products in account","This game is, for me, the greatest top down strategy game of all time.\n\nWith a resource system that requires constant aggression, deep strategic choices in your style of commander, solid multiplayer, highly tactical combat based on cover, positioning and abilities, no game does strategic combat like this one does.\n\nNot starcraft, not company of heroes 2, none of them, the closest to this one is the original Dawn of War and it has nothing on this game.\n\nCompany of Heroes 2 is a travesty from the company that brought us this, accept no substitute, if you want a strategy game at all, and you don't own Company of Heroes BUY COMPANY OF HEROES.\n\nAlso the campaigns are fun as ♥♥♥♥.\n\n10/10, the standard by which all RTS's are judged.","January 19","true","54.4"," 3 of 4 people (75%) found this review helpful","75","3","4","0","0"
"http://steamcommunity.com/id/Appleorgasm/recommended/4560/","Appleorgasm","Appleorgasm","http://steamcommunity.com/id/Appleorgasm/","218 products in account","No words can describe this game except for being a brutal simulation of war with the right mods. It provides an excellent simulation of real time war would be like and I HIGHLY reccomend you should buy it, since it's one of the closest games we will get to being able to command nazis on a massive scale invasion.","June 1, 2014","true","0.4"," 3 of 4 people (75%) found this review helpful","75","3","4","0","0"
"http://steamcommunity.com/profiles/76561198190547930/recommended/4560/","76561198190547930","Tiger Kommandant","http://steamcommunity.com/profiles/76561198190547930/","13 products in account","Fun RTS. and still has a strong\nonline bunch.","October 5, 2015","true","5.5"," 4 of 6 people (67%) found this review helpful","67","4","6","0","0"
"http://steamcommunity.com/id/renok2234/recommended/4560/","renok2234","Ren0k.","http://steamcommunity.com/id/renok2234/","29 products in account","Best Real time strategy game ever made!\n- Fun\n- Entertaining\n- Interesting\n- Flawless graphic","January 18","true","0.5"," 4 of 6 people (67%) found this review helpful","67","4","6","0","0"
"http://steamcommunity.com/profiles/76561198088242750/recommended/4560/","76561198088242750","Viagra Falls","http://steamcommunity.com/profiles/76561198088242750/","9 products in account","make this for ♥♥♥♥ing mac\n","October 25, 2014","true","16.0"," 6 of 10 people (60%) found this review helpful","60","6","10","0","0"
"http://steamcommunity.com/id/Tehgig/recommended/4560/","Tehgig","MGGAR | General Giggy","http://steamcommunity.com/id/Tehgig/","467 products in account","One of the Best RTS WWII games on the Market.\n\nSherman Ready to do some damage!","March 18, 2014","true","38.5"," 6 of 10 people (60%) found this review helpful 1 person found this review funny","60","6","10","0","0"
"http://steamcommunity.com/id/Excalibursin-X/recommended/4560/","Excalibursin-X","Lum Laisin","http://steamcommunity.com/id/Excalibursin-X/","80 products in account","If you're my friend, buy this game and like it so we can play. I don't want to play any of your ♥♥♥♥♥♥ games that don't have the line "on my ♥♥♥ and stay there" uttered by the infantry every minute. If you don't like it you must have good taste.","October 24, 2014","true","51.9"," 7 of 12 people (58%) found this review helpful","58","7","12","0","0"
"http://steamcommunity.com/id/Excalibursin-X/recommended/4560/","Excalibursin-X","Lum Laisin","http://steamcommunity.com/id/Excalibursin-X/","80 products in account","If you're my friend, buy this game and like it so we can play. I don't want to play any of your ♥♥♥♥♥♥ games that don't have the line "on my ♥♥♥ and stay there" uttered by the infantry every minute. If you don't like it you must have good taste.","October 24, 2014","true","51.9"," 7 of 12 people (58%) found this review helpful","58","7","12","0","0"
"http://steamcommunity.com/profiles/76561198007187961/recommended/4560/","76561198007187961","J3w Jitsu","http://steamcommunity.com/profiles/76561198007187961/","306 products in account","awesome game","May 27, 2014","true","46.4"," 1 person found this review helpful","0","1","1","0","0"
"http://steamcommunity.com/id/thonggg/recommended/4560/","thonggg","||||||||||||","http://steamcommunity.com/id/thonggg/","46 products in account","REALLY GOOD GAME. Super fun play in offine and online. Great sound track, a lot of things to do in to the game.","May 28, 2014","true","16.4"," 1 person found this review helpful","0","1","1","0","0"
"http://steamcommunity.com/profiles/76561198052630498/recommended/4560/","76561198052630498","Raxeraki","http://steamcommunity.com/profiles/76561198052630498/","41 products in account","THIS GAME IS AWESOME!","May 31, 2014","true","15.8"," 1 person found this review helpful","0","1","1","0","0"
"http://steamcommunity.com/profiles/76561198074104201/recommended/4560/","76561198074104201","Brad steele","http://steamcommunity.com/profiles/76561198074104201/","135 products in account","great game 0ne of my best games of all time much better than coh 2 and a lot of mods that makes the game more fun and i still play it today worth the money","June 1, 2014","true","4.8"," 1 person found this review helpful","0","1","1","0","0"
"http://steamcommunity.com/profiles/76561198073468967/recommended/4560/","76561198073468967","cocoa","http://steamcommunity.com/profiles/76561198073468967/","27 products in account","ah the best RTS i have ever played, this game is full of energy when it comes to the gameplay, you can either get owned by the AIs or the players or you can own them! this game is for the people that like big and long battles.","June 2, 2014","true","6.4"," 1 person found this review helpful","0","1","1","0","0"
"http://steamcommunity.com/id/drrrrrrrrrrrrrrrrrrrrrrr/recommended/4560/","drrrrrrrrrrrrrrrrrrrrrrr","bone","http://steamcommunity.com/id/drrrrrrrrrrrrrrrrrrrrrrr/","341 products in account","Good game!","May 15, 2014","true","7.2"," 1 person found this review helpful","0","1","1","0","0"
"http://steamcommunity.com/profiles/76561197985389455/recommended/4560/","76561197985389455","Innocent Dingo","http://steamcommunity.com/profiles/76561197985389455/","69 products in account","RTS WW2 at its best.\n","December 27, 2011","true","3.1"," 1 person found this review helpful","0","1","1","0","0"
"http://steamcommunity.com/id/Boobla/recommended/4560/","Boobla","Fresh Potato","http://steamcommunity.com/id/Boobla/","100 products in account","♥♥♥♥! so much bugs...enjoy :D","May 25, 2012","true","91.5"," 1 person found this review helpful","0","1","1","0","0"
"http://steamcommunity.com/id/gigmajor/recommended/4560/","gigmajor","Hérétique","http://steamcommunity.com/id/gigmajor/","708 products in account","This is a game for fairly serious RTS players only. There are a large number of factors and tactical considerations to ponder, and a majority of the maps are not really fair. I would warn players that many would find this game tedious and boring if they are not in the right mindset when playing the game.\n\nYou have infantry and tanks, as well as everything in between. The objectives are dynamic, in that the game presents them in a way that does not seem like the entire mission is "go here and kill everything along the way". Progress is generally slow, and the game tends to rush you.\n\nThe pathfinding is a bit suspect. The satisfaction is not.\n\nThere have been times that I had to quit playing to keep cool since the game likes to suggest that you do stupid things and then scold you for screwing up. It is really annoying when it YELLS at you to do A, then A is obviously going to end in death.\n\nThe expansions are more of the same. One thing I cannot easily comprehend is how this game manages to make tank battles kinda boring and tedious. Probably has to do with the pathfinding.","November 25, 2013","true","2.7"," 1 person found this review helpful","0","1","1","0","0"
"http://steamcommunity.com/id/lunchbox4332/recommended/4560/","lunchbox4332","Lunchbox4332","http://steamcommunity.com/id/lunchbox4332/","84 products in account","Amazing game. You will get lost playing this for hours on end. There seems to be an endless amount of fun to this game no matter how long or grueling the campaign missions are. If you want action and are a World War 2 kinda person, this is the game for you! I give this a 9/10","March 19, 2014","true","18.5"," 1 person found this review helpful","0","1","1","0","0"
"http://steamcommunity.com/id/kennyNuss/recommended/4560/","kennyNuss","Stevvu -K-|♥","http://steamcommunity.com/id/kennyNuss/","104 products in account","Best RTS game I have ever played!In my opinion it's better than Company of heroes 2 :)","June 28, 2014","true","11.6"," 1 person found this review helpful","0","1","1","0","0"
"http://steamcommunity.com/id/cs_jean302/recommended/4560/","cs_jean302","S.T.A.L.K.E.R","http://steamcommunity.com/id/cs_jean302/","98 products in account","Great strategy game 10/10\nPlay as Americans or Germans, upgrade your soldiers, make tanks and destroy bridges and houses to prevent enemy from closing in to your HQ.\nIf you like strategy games alot then buy this!","February 26, 2013","true","50.2"," 1 person found this review helpful","0","1","1","0","0"
"http://steamcommunity.com/id/jayem/recommended/4560/","jayem","Hugo Boss™","http://steamcommunity.com/id/jayem/","1152 products in account","I love this game! Besides Dawn of War II, Age of Empires and Command & Conquer one of  my favourite RTS ever!","December 27, 2011","true","15.0"," 1 person found this review helpful","0","1","1","0","0"
"http://steamcommunity.com/profiles/76561197990448040/recommended/4560/","76561197990448040","IITeamCanada REforever","http://steamcommunity.com/profiles/76561197990448040/","150 products in account","One of the greatest RTS games that you'll ever play.","December 29, 2011","true","081.6"," 1 person found this review helpful","0","1","1","0","0"
"http://steamcommunity.com/id/Quadbrew/recommended/4560/","Quadbrew","Pvt Mullet","http://steamcommunity.com/id/Quadbrew/","505 products in account","No matter how old this games get, I will always recommend this game.\nThe graphics were amazing back then and they still hold up now to current standards.\nBest playing the campaigns, even bester playing with or against your friends.\n\n10/10\nEinfach Wunderbar!!!","June 25, 2014","true","2.2"," 1 person found this review helpful","0","1","1","0","0"
"http://steamcommunity.com/id/thescotty/recommended/4560/","thescotty","Medscootsman","http://steamcommunity.com/id/thescotty/","218 products in account","SHINGEKI NO TIGER.","July 19, 2014","true","8.4"," 1 person found this review helpful","0","1","1","0","0"
"http://steamcommunity.com/profiles/76561198051710710/recommended/4560/","76561198051710710","Tazzie","http://steamcommunity.com/profiles/76561198051710710/","6 products in account","++++1","August 14, 2014","true","18.0"," 1 person found this review helpful","0","1","1","0","0"
"http://steamcommunity.com/profiles/76561198052198203/recommended/4560/","76561198052198203","FoShizzleMyNizzle","http://steamcommunity.com/profiles/76561198052198203/","56 products in account","I dont like playing rts games but this game i love to play","July 1, 2014","true","2.9"," 1 person found this review helpful","0","1","1","0","0"
"http://steamcommunity.com/id/dinosammy1/recommended/4560/","dinosammy1","Burrely","http://steamcommunity.com/id/dinosammy1/","40 products in account","The game's really good.\n\nDoesn't lag badly (mentioning this since mah laptop is getting old n' dusty) and the game's also challenging.\nA single mission can easilly drain your time as you progress in the campaign.\n\nHowever it is challenging it's also only one campaign,\nand the adds in the game for the expansion sets are a sore in the ey though, and discourage you,\nunless you think it's actually worth it.\n\nFurtherwise there's loads of detail in the game,\nhowever I didn't dare to put the graphics any higher in case it would start lagging.\nAs low graphics already look good, I tested the game with highest settings too, yet that lags for me but that's reasonable,\nthe game looks amazing but yet it doesn't really bother me as the gameplay ultimatelly makes this up.\n\nOther than the brutal difficulty and the in-game adds for the expansion set 4.5 / 5","July 23, 2014","true","17.8"," 1 person found this review helpful","0","1","1","0","0"
"http://steamcommunity.com/id/bclatt1/recommended/4560/","bclatt1","[GoochDong] NastyMan","http://steamcommunity.com/id/bclatt1/","124 products in account","a WW2 Stratagy game... da best man!","March 8, 2013","true","14.7"," 1 person found this review helpful","0","1","1","0","0"
"http://steamcommunity.com/id/Moosey123/recommended/4560/","Moosey123","Herr Älg","http://steamcommunity.com/id/Moosey123/","187 products in account","Probably the best stragegy game i've ever played, Company of Heroes brings a new light to the battlefield and allows you to control several squads to overpower your enemies, 10/10.","December 12, 2013","true","5.0"," 1 person found this review helpful","0","1","1","0","0"
"http://steamcommunity.com/id/Naveedster/recommended/4560/","Naveedster","Naveedster","http://steamcommunity.com/id/Naveedster/","192 products in account","Starcraft meets COD: World at War!","December 30, 2012","true","2.5"," 1 person found this review helpful","0","1","1","0","0"
"http://steamcommunity.com/profiles/76561198076781964/recommended/4560/","76561198076781964","InukedCanada","http://steamcommunity.com/profiles/76561198076781964/","150 products in account","I ♥♥♥♥ing suck at this game.","April 20, 2014","true","63.7"," 1 person found this review helpful","0","1","1","0","3"
"http://steamcommunity.com/profiles/76561197978345691/recommended/4560/","76561197978345691","Zuckerhund ®","http://steamcommunity.com/profiles/76561197978345691/","122 products in account","Quite possibly the best RTS in recent memory, using fast paced action with deep combat tactics.","December 27, 2011","true","18.1"," 1 person found this review helpful","0","1","1","0","0"
"http://steamcommunity.com/profiles/76561197961956141/recommended/4560/","76561197961956141","a potato","http://steamcommunity.com/profiles/76561197961956141/","199 products in account","Still one of the best looking and satisfying RTS to date","December 28, 2011","true","15.5"," 1 person found this review helpful","0","1","1","0","0"
"http://steamcommunity.com/id/niscimble/recommended/4560/","niscimble","Niscimble","http://steamcommunity.com/id/niscimble/","488 products in account","Quite possibly one of the best Real Time Strategy games ever made.  It rewards good micromanagement, but it doesn't require nanosecond reaction time to be successful.  Highly recommended for anyone seeking a solid game.","July 3, 2011","true","1.5"," 1 person found this review helpful","0","1","1","0","1"
"http://steamcommunity.com/id/demostheens/recommended/4560/","demostheens","demostheens","http://steamcommunity.com/id/demostheens/","178 products in account","Very brutal game. Blitzkrieg mod is the more fully-realized version of this game, definitely a must play mod.","May 8, 2013","true",""," 1 person found this review helpful","0","1","1","0","0"
"http://steamcommunity.com/id/bradford342/recommended/4560/","bradford342","bradford342","http://steamcommunity.com/id/bradford342/","101 products in account","One of my most favorite, well rounded stratagy games, I played in all time.","August 6, 2014","true","138.2"," 1 person found this review helpful","0","1","1","0","0"
"http://steamcommunity.com/profiles/76561198098132249/recommended/4560/","76561198098132249","BellyCheese","http://steamcommunity.com/profiles/76561198098132249/","89 products in account","Fun as Hell with friends. alone not so much campaing multiplayer very fun. 7.5/10","November 21, 2014","true","1.8"," 1 person found this review helpful","0","1","1","0","0"
"http://steamcommunity.com/id/disporting/recommended/4560/","disporting","Dank Meme","http://steamcommunity.com/id/disporting/","199 products in account","Wow. And simply wow. Deep. Challenging. Realistic. Addictive.\n\nDon't let my play time fool you - I've had this on CD years before it merged to Steam and we could redeem the codes on here.","November 22, 2014","true","4.1"," 1 person found this review helpful","0","1","1","0","0"
"http://steamcommunity.com/profiles/76561198162695083/recommended/4560/","76561198162695083","Gunny1372","http://steamcommunity.com/profiles/76561198162695083/","5 products in account","Love this game","November 25, 2014","true","8.4"," 1 person found this review helpful","0","1","1","0","0"
"http://steamcommunity.com/profiles/76561198011820438/recommended/4560/","76561198011820438","Noice","http://steamcommunity.com/profiles/76561198011820438/","212 products in account","This is such a good game, paired with the blitzkrieg mod its a real challenge and great to play with friends","November 27, 2014","true","0.3"," 1 person found this review helpful","0","1","1","0","0"
"http://steamcommunity.com/id/Fikachu/recommended/4560/","Fikachu","Fika","http://steamcommunity.com/id/Fikachu/","128 products in account","Absolutely great RTS! It's so realistic and fun...Too bad I suck at RTS...","November 14, 2014","true","6.5"," 1 person found this review helpful","0","1","1","0","0"
"http://steamcommunity.com/id/judehasjuice/recommended/4560/","judehasjuice",".jude","http://steamcommunity.com/id/judehasjuice/","81 products in account","Best RTS game in history","November 20, 2014","true","0.2"," 1 person found this review helpful","0","1","1","0","0"
