"url","reviewerUsername","reviewerDisplayName","reviewerUrl","reviewerProductsCount","reviewText","date","recommended","hoursPlayed","voteText","helpfulPercent","votesHelpful","votesTotal","votesFunny","commentsCount"
"http://steamcommunity.com/profiles/76561198041783213/recommended/4560/","76561198041783213","Tric","http://steamcommunity.com/profiles/76561198041783213/","69 products in account","Basic things do not work for this game and it is filled with bugs for the modding community that were never fixed that they broke right before THQ went under.\n\nGod forbid you have a monitor that is not inside it's preset resolutions too, as that means if you ever alt tab it will forever play at the preset resolutions and not the custom one you used until you close and reopen the game.  Playing in windowed mode to remedy this situation just further ♥♥♥♥s it up with huge amounts of lag.  Lag by that you click on something and tell it to go, but it never registered that your mouse was actually there and therefore does nothing, or better yet you use abilities on your own troops!  As in drop ♥♥♥♥ing bombs on them instead of the enemy.  Overall ♥♥♥♥ing pathetic support and the second game is an even bigger ♥♥♥♥ing joke.\n\nThis is coming from somone that was big in the mapping scene before this game was even on steam about 9 years ago.  Do not ever purchase this game unless it is on sale, and even then it should be below 10 dollars.","January 18","false","0.2"," 0 of 8 people (0%) found this review helpful","0","0","8","0","0"
"http://steamcommunity.com/id/gooddog25/recommended/4560/","gooddog25","Gooddog","http://steamcommunity.com/id/gooddog25/","45 products in account","The incessant scrolling, squad menus, stupid squad response,  the inability of these soldiers and squads under my command to stay out of my line of site, or evade the enemy and enemy fire are the standards of video games these days.  it's not MY unfamiliarity with the controls, or recognize the positions of each unit, it is how poorly they are identified, or their position.\nThe bumbling stupidity of these troops to execute orders without tripping over one another, or obstructing one another is stupifying. It's like trying to run a painting company with the three stooges, except it's an entire army of stooges in a restricted locational overview.\nAdd to the sheer stupidity of these guys the macros, keybinds, tactics incongruity, and building area restrictions, and you have another frustrating exercise trying to coordinate strategies with illogical menu interfaces.\nMore and more, I see developers who can't place menus in smart locations away from the center, out of the way, without obstructing MY view. It is funny how the robot invaders range, and field of view advantages exceed my own, and they trap my stupid army in an ambush while they move intelligently and easily to surround us.\nI save a lot of money on games now, but can't get refunds for glitchy, clumsy interfaces, and unfair 'stupid logic' as the only thing I have to command.","March 23, 2013","false","153.7"," 4 of 17 people (24%) found this review helpful 1 person found this review funny","24","4","17","0","0"
"http://steamcommunity.com/profiles/76561198051286867/recommended/4560/","76561198051286867","zeezeezone","http://steamcommunity.com/profiles/76561198051286867/","14 products in account","I paid for and downloaded CoH from steam. Yet when I try and play it, I am asked for to install the CD ???\nI have tried for three weeks to enlist help from steam. It is virtually impossible. There is no link to so called support for downloads that dont work.\nThey pass me along to SEGA 3 weeks ago. I was told that they were reshuffling offices or some such tripe, and would get back to me. I do believe it's not a sega problem, as I am sure if I'd bought the game physically from some store, the CD would work.\nSteam should not be selling downloads if you cant open them without a CD.","April 11, 2015","false","0.3"," 4 of 17 people (24%) found this review helpful","24","4","17","0","0"
"http://steamcommunity.com/profiles/76561197981876676/recommended/4560/","76561197981876676","digideus","http://steamcommunity.com/profiles/76561197981876676/","61 products in account","it uses a varient of the Dawn of War engine, but you have bugger all vontrol over your forces and its more like an interactive slaughterfest than a strategy game.  Poorly executed and with no real feeling of control make this game utterly demoralising.  That could be the point, war being terribly wasteful and all that, but as a game this is not so much a class A title as a curisoity you will play and forget.  Not recommended for RTS fans.  more for people who have an interest in WW2","January 28, 2015","false","4.3"," 3 of 15 people (20%) found this review helpful","20","3","15","0","0"
"http://steamcommunity.com/id/byork9/recommended/4560/","byork9","byork9","http://steamcommunity.com/id/byork9/","147 products in account","horrible game paid good money for it to play the single player campaign that was supposed to come along with however it still tells me to purchase it again.","August 26, 2015","false","94.1"," 3 of 15 people (20%) found this review helpful","20","3","15","0","0"
"http://steamcommunity.com/id/897902478936309253789057230/recommended/4560/","897902478936309253789057230","LiteUp","http://steamcommunity.com/id/897902478936309253789057230/","184 products in account","Game is totally unblanced by far. Germans have better units in every kind of way.","December 24, 2014","false","37.6"," 3 of 15 people (20%) found this review helpful 1 person found this review funny","20","3","15","0","4"
"http://steamcommunity.com/id/ShawolEXO-LSONE/recommended/4560/","ShawolEXO-LSONE","MonMon","http://steamcommunity.com/id/ShawolEXO-LSONE/","3 products in account","Everytime I tried to play CoH, it always said "cannot validate media" then I tried the steam version, I can't open it\n","August 23, 2014","false","0.9"," 8 of 26 people (31%) found this review helpful 1 person found this review funny","31","8","26","0","0"
"http://steamcommunity.com/profiles/76561198058062584/recommended/4560/","76561198058062584","Ancient tech user","http://steamcommunity.com/profiles/76561198058062584/","50 products in account","don't get me wrong, it's a good game, i just find that 45% of the time it crashes after saying "SEGA" and another 20% after it says "NVIDIA the way it's meant to be played" 15% the screen pops ups before closing, 10% i select a campaign or skirmish when it shuts down, 5% shuts down at the beggining of a cutscene and the final 5% Allows me to play the actual game","December 25, 2015","false","2.7"," 2 of 13 people (15%) found this review helpful","15","2","13","0","2"
"http://steamcommunity.com/profiles/76561198205964816/recommended/4560/","76561198205964816","Scheivolt","http://steamcommunity.com/profiles/76561198205964816/","71 products in account",">bought the game\n>loved the whole 4 hours it worked\n>tried to play again\n>doesn't load at all, doesn't even make it to the menu\n>consulting the forums and helpful places and step by step directions\n>F****** game still doesn't work\n>waste of money and raging followed\n>but COH 2 works just fine for now.\n>Best WW2 rts I've ever played, but it's completely buggered for no reason at all\n>wtfcarl.jph","August 31, 2015","false","8.0"," 2 of 13 people (15%) found this review helpful 1 person found this review funny","15","2","13","0","0"
"http://steamcommunity.com/profiles/76561198042846725/recommended/4560/","76561198042846725","[CLUMSY]Dragon","http://steamcommunity.com/profiles/76561198042846725/","385 products in account","Arcade WWII strategy: Meh.\nIf you're into WWII history and real strategy go play Hearts of Iron, if you like arcade strategy play Total War","January 19","false","7.7"," 2 of 13 people (15%) found this review helpful","15","2","13","0","0"
"http://steamcommunity.com/id/Tierrah/recommended/4560/","Tierrah","Tierrah","http://steamcommunity.com/id/Tierrah/","537 products in account","Just buy Men of War. It's better in every aspect.","April 14","false","34.4"," 2 of 13 people (15%) found this review helpful","15","2","13","0","1"
"http://steamcommunity.com/id/gayboikevin/recommended/4560/","gayboikevin","SOUND MUTED FUCKTARDS","http://steamcommunity.com/id/gayboikevin/","98 products in account","10/10 Goblin Legs","August 10, 2015","false","1.1"," 1 of 11 people (9%) found this review helpful","9","1","11","0","0"
"http://steamcommunity.com/profiles/76561198013671766/recommended/4560/","76561198013671766","KRAZYCAMMY","http://steamcommunity.com/profiles/76561198013671766/","53 products in account","Wow such balance very wow....\n(Basically if you want to win, play Germany)\nDo not want","May 16, 2015","false","4.0"," 1 of 11 people (9%) found this review helpful","9","1","11","0","3"
"http://steamcommunity.com/id/dillonneil123/recommended/4560/","dillonneil123","Gandalf","http://steamcommunity.com/id/dillonneil123/","63 products in account","Doesnt work with windows 8. Tried everything but nothing works. 10/10 Would cry again.","June 18, 2015","false","0.1"," 1 of 11 people (9%) found this review helpful 1 person found this review funny","9","1","11","0","0"
"http://steamcommunity.com/id/black_wolf301/recommended/4560/","black_wolf301","Squirrel Salesman","http://steamcommunity.com/id/black_wolf301/","88 products in account","Allies are just a lot easier to play. My stats with brits are 1.6 Americans are something like 1.2 which is nothing to boast about but I almost got on the leaderboards for brit 1v1. While my wehr stats are 0.75. My 1v1 stats are all positive as every faction though, although, not by much when I play as Germans. Games as allies don't seem very stressful compared to games where I play as axis, I feel like I'm holding on by the skin of my teeth for the entire match. Maybe I'm a noob but staghounds and brens just aren't fun to play against. Calliopes destroy everything, allied war machine makes sure that you never take any real losses when you launch an attack. Canister shots with stuarts are just plain ridiculous. 75 munitions for an instant squad wipe I put 150 munitions into for an anti tank squad? What about lieutennant arty? absolutely no time to react to the first shell that decimates blobs. I'm sure you're thinking "don't blob up then". Just think about that for 1 second mr. brit blob. I feel like a bad player everytime I use those things because it doesn't require any skill.\n\nGrenades nullify mg's which is really the only advantage wehr gets early game, that being said mg's are a lot harder to use than rifles because they can be flanked fairly easily and you're forced to retreat them otherwise you're just giving your opponent the means to defeat you. Don't even bother using the wehr grenade though. You'll never get the mg clearing properties that the americans have. Another thing I hate about americans: WHY ARE CALLIOPES SO TOUGH? They have the armour of a sherman and they're an artillery unit. Back in the day I heard they had a turret too. Nothing but stupid in my opinion. Even if you do get a kill, its likely, they just used allied war machine anyway and they're about to fire another round of rockets on your army from the fresh calliope you just gave them.\n\nWhat I really have a problem with is that allies require so much less thought than what you would need as a wehr player.  Rifles are literally the answer to everything. infantry? Rifles. MGs? Rifles. Panthers? Rifles. When I use my panthers, I'm more scared of rifles than I am of almost anything else. Besides, panthers come out so late in the game, you should have 3 m10s waiting for it already. I see players with really good stats and all they do is para-snipe spam. In other words, they just make 2 units for the majority of the game. I've won like that before and I feel disgusted with myself. Although force retreat works well against that so potientally there is a counter to that if you choose terror as your doctrine. Honestly, what they should do is make reinforcing on the battle field more expensive than reinforcing in your base. Because that just means that the axis player might get a little bit of a rest from the endless assault.\n\nHonestly with all of that being said, I still think 1v1s are still pretty balanced for vanilla armies. Team games on the other hand, don't seem balanced to me. Brits can just set up halfway across the map and suddenly you're fighting to hold 25% of the map as the german player. The Brits weakness is that they're slow but an american player fills that gap. I used to think axis where OP simply because I used to be an allied player. As soon as I started playing wehr, my attitude completely changed. No matter how hard I try, I simply can't get good as axis.","August 10, 2015","false","0.5"," 1 of 11 people (9%) found this review helpful","9","1","11","0","0"
"http://steamcommunity.com/profiles/76561197992032939/recommended/4560/","76561197992032939","Lawndart","http://steamcommunity.com/profiles/76561197992032939/","67 products in account","I think I set my expectations too high... I was hoping for a modern version of Close Combat, but CoH just never felt right.  It felt way too "arcady" for my tastes.  It might get better as you go deeper into the game, but I couldn't bring myself to get past the first 2 hours, it never grabbed me.","October 21, 2015","false","1.4"," 1 of 11 people (9%) found this review helpful","9","1","11","0","0"
"http://steamcommunity.com/id/twitterpated/recommended/4560/","twitterpated","Chaos Void","http://steamcommunity.com/id/twitterpated/","27 products in account","Bought on sale, Can't play all the game, Was mislead. Fun game, Misleading information about what you get access to.","December 2, 2015","false","20.7"," 1 of 11 people (9%) found this review helpful","9","1","11","0","0"
"http://steamcommunity.com/id/Szwedenero/recommended/4560/","Szwedenero","Salter","http://steamcommunity.com/id/Szwedenero/","62 products in account","Before you read this you should know I have player Men Of War.\n\nWHAT I DIDN'T LIKE:\nIt would be an awesome game if it wasn't for the fact it's so unreal.\nTanks have healthbars like a MMORPG troll, and its damage barely varies from where it is hit.\nTanks can't use HE for a reason. Which results in 2 minutes of missing one soldier.\nI miss the direct control over units, cause they REALLY like to put their backs toward enemies.\nI don't get the point why the enemy keeps getting Stugs and Pz, while all I can do is set up mines which takes forever,\nresulting in leaving me defenseless.\nI have no idea why units can't throw multiple grenades (must wait 5 seconds), and why are they infinite.\nUnits cannot run for their lives when pinned but throw themselves right into enemy fire. Like it would save them.\nIn general the game is hard to understand because it isn't made in a way anyone could easily understand.\nSoldiers are really a general "thing" without different weapons.\nI am not sure if they can take a couple of hits or are this bad at aiming.\n\nWHAT I DID LIKE:\nThe cinematics, they remind me of Band Of Brothers a little, are well made and makes you kind of bond with the NPC soldiers.\nLoved the TF2/AoE2 reference hitting things makes other things.\n\nI wouldn't reccomend this game for anyone new to strategy games, nor a veteran who has many more better games.","December 26, 2015","false","3.7"," 1 of 11 people (9%) found this review helpful 1 person found this review funny","9","1","11","0","0"
"http://steamcommunity.com/id/PortugaltheBro/recommended/4560/","PortugaltheBro","Portugal. the Bro","http://steamcommunity.com/id/PortugaltheBro/","40 products in account","Interesting game, but felt dated. I also expirienced a fair amount of glitches.\n\n6/10","December 28, 2015","false","10.1"," 1 of 11 people (9%) found this review helpful","9","1","11","0","0"
"http://steamcommunity.com/profiles/76561198046873680/recommended/4560/","76561198046873680","SGThollywd","http://steamcommunity.com/profiles/76561198046873680/","15 products in account","small scale strategy not for me","January 20","false","6.5"," 1 of 11 people (9%) found this review helpful","9","1","11","0","0"
"http://steamcommunity.com/profiles/76561198175687325/recommended/4560/","76561198175687325","marcantoineg","http://steamcommunity.com/profiles/76561198175687325/","67 products in account","the amount of glitches is unbelievable","January 21","false","2.8"," 1 of 11 people (9%) found this review helpful","9","1","11","0","0"
"http://steamcommunity.com/profiles/76561198191027618/recommended/4560/","76561198191027618","steven_scott1057","http://steamcommunity.com/profiles/76561198191027618/","26 products in account","ive downloaded the game but it dosnt load properly and i cant see the carachters sorry about spelling why","April 25","false","0.2"," 1 of 11 people (9%) found this review helpful","9","1","11","0","2"
"http://steamcommunity.com/id/NessThanThree/recommended/4560/","NessThanThree","Raccoon Thing","http://steamcommunity.com/id/NessThanThree/","290 products in account","I prefer the company of women.","May 4, 2014","false","3.1"," 51 of 120 people (43%) found this review helpful 65 people found this review funny","43","51","120","65","2"
"http://steamcommunity.com/id/SpikeTheGrimReaper/recommended/4560/","SpikeTheGrimReaper","SpikeTheGrimReaper","http://steamcommunity.com/id/SpikeTheGrimReaper/","74 products in account","As far as I know, some people will have this problem, whenever in game I start to play its all good, this stays the same for awhile then all of a sudden my units start to delay order say I clicked them and told them to go inside few minute later they then will go inside. This really ruined the online experience for me however everything else seems to work but I really would like to play online so can you fix this?","January 20, 2014","false","40.9"," 6 of 22 people (27%) found this review helpful","27","6","22","0","0"
"http://steamcommunity.com/profiles/76561198152500776/recommended/4560/","76561198152500776","gastroepiploica","http://steamcommunity.com/profiles/76561198152500776/","22 products in account","Very bad. Not worth the money","November 21, 2015","false","1.4"," 0 of 9 people (0%) found this review helpful 1 person found this review funny","0","0","9","0","0"
"http://steamcommunity.com/id/drspacejam/recommended/4560/","drspacejam","Lil Yachty","http://steamcommunity.com/id/drspacejam/","33 products in account","PFTTTTTTTTT AHAHAHAHAHAHAHA\nWHY WH-\nPPPFPFFFFPFPFPFPFPFPFPTTTTTT\nJESYS CHRISE DONT SAY THAT AAAAHAHAHAHAHAHA\nFU CK ME AHAHA\n\n\nYou can't even win as the nazis\n0/10\nGarbagio Jones my friend\nEven raccoons wouldnt eat this one","December 6, 2014","false","7.2"," 0 of 9 people (0%) found this review helpful 1 person found this review funny","0","0","9","0","0"
"http://steamcommunity.com/id/murfbard/recommended/4560/","murfbard","Keef","http://steamcommunity.com/id/murfbard/","582 products in account","The game plays a bit too rigid for my taste.  Instead of being open world and do strategy as YOU want, you are forced to follow orders.  I suppose that makes sense for a military game, but it doesn't make it more fun than most other RTS titles out there.","December 22, 2015","false","0.1"," 0 of 9 people (0%) found this review helpful","0","0","9","0","1"
"http://steamcommunity.com/profiles/76561198207672467/recommended/4560/","76561198207672467","daming345","http://steamcommunity.com/profiles/76561198207672467/","29 products in account","lack content","October 8, 2015","false","2.5"," 0 of 9 people (0%) found this review helpful","0","0","9","0","0"
"http://steamcommunity.com/id/kidbrotherAWP/recommended/4560/","kidbrotherAWP","Fuck This Team","http://steamcommunity.com/id/kidbrotherAWP/","20 products in account","no more","January 10","false","0.3"," 0 of 9 people (0%) found this review helpful","0","0","9","0","0"
"http://steamcommunity.com/profiles/76561198029229064/recommended/4560/","76561198029229064","h266647","http://steamcommunity.com/profiles/76561198029229064/","143 products in account","i wish i could recomend this game, but there are huge graphical bugs meaning that all i can see is constant flashing lights","December 22, 2014","false","0.8"," 0 of 9 people (0%) found this review helpful 1 person found this review funny","0","0","9","0","0"
"http://steamcommunity.com/profiles/76561198084538969/recommended/4560/","76561198084538969","PFC. Kinney","http://steamcommunity.com/profiles/76561198084538969/","21 products in account","Not what I thought unless you like strategic","August 19, 2015","false","2.3"," 0 of 9 people (0%) found this review helpful","0","0","9","0","0"
"http://steamcommunity.com/profiles/76561198029229064/recommended/4560/","76561198029229064","h266647","http://steamcommunity.com/profiles/76561198029229064/","143 products in account","i wish i could recomend this game, but there are huge graphical bugs meaning that all i can see is constant flashing lights","December 22, 2014","false","0.8"," 0 of 9 people (0%) found this review helpful 1 person found this review funny","0","0","9","0","0"
"http://steamcommunity.com/id/deathkiller4541/recommended/4560/","deathkiller4541","MrJuredson","http://steamcommunity.com/id/deathkiller4541/","43 products in account","This game needs to be updated ASAP because everytime i try to play, the guys dont show up on my screen its just shadows.","June 21, 2015","false","5.6"," 0 of 9 people (0%) found this review helpful","0","0","9","0","0"
"http://steamcommunity.com/id/focus0mg/recommended/4560/","focus0mg","focus","http://steamcommunity.com/id/focus0mg/","20 products in account","dank af' in a bad way","June 26, 2015","false","0.1"," 0 of 9 people (0%) found this review helpful","0","0","9","0","0"
"http://steamcommunity.com/profiles/76561198020359917/recommended/4560/","76561198020359917","Stormrain24","http://steamcommunity.com/profiles/76561198020359917/","14 products in account","having a lot of trouble playing this game will get it to load but not much more than that","July 24, 2015","false","2.3"," 0 of 9 people (0%) found this review helpful","0","0","9","0","0"
"http://steamcommunity.com/profiles/76561198237275434/recommended/4560/","76561198237275434","Mitchell2002","http://steamcommunity.com/profiles/76561198237275434/","4 products in account","rubbish would not to suggest to waist money","August 30, 2015","false","0.4"," 0 of 9 people (0%) found this review helpful","0","0","9","0","0"
"http://steamcommunity.com/id/global21banterbrigade/recommended/4560/","global21banterbrigade","~~Spectre~~","http://steamcommunity.com/id/global21banterbrigade/","13 products in account","this si the ♥♥♥♥ing worst game i have ever bought.dont get it it wont play will on say a ♥♥♥♥ig crash report","November 30, 2015","false","0.6"," 0 of 9 people (0%) found this review helpful","0","0","9","0","5"
"http://steamcommunity.com/id/sicokiller/recommended/4560/","sicokiller","Burning Eclipse","http://steamcommunity.com/id/sicokiller/","24 products in account","Took me 2 hours and 1 min to lose one skirmish! Then the next day i went to play this game and everything was glitchy! The screen was all staticky and i couldnt see any troops or building i tried both new version and regular and both had the same problem. I tried to reinstall the game and it didnt work. -_- cmon and i just bought the game","September 5, 2015","false","72.1"," 0 of 9 people (0%) found this review helpful","0","0","9","0","1"
"http://steamcommunity.com/profiles/76561198043841604/recommended/4560/","76561198043841604","AXIMATT","http://steamcommunity.com/profiles/76561198043841604/","29 products in account","There are some recent grafical glitches A.K.A all the men not being visable and loads of random bars and out of place coulors on the screen dont buy this game... unless they fix these glitches","December 24, 2015","false","9.8"," 0 of 9 people (0%) found this review helpful","0","0","9","0","4"
"http://steamcommunity.com/id/murfbard/recommended/4560/","murfbard","Keef","http://steamcommunity.com/id/murfbard/","582 products in account","The game plays a bit too rigid for my taste.  Instead of being open world and do strategy as YOU want, you are forced to follow orders.  I suppose that makes sense for a military game, but it doesn't make it more fun than most other RTS titles out there.","December 22, 2015","false","0.1"," 0 of 9 people (0%) found this review helpful","0","0","9","0","1"
"http://steamcommunity.com/profiles/76561198152500776/recommended/4560/","76561198152500776","gastroepiploica","http://steamcommunity.com/profiles/76561198152500776/","22 products in account","Very bad. Not worth the money","November 21, 2015","false","1.4"," 0 of 9 people (0%) found this review helpful 1 person found this review funny","0","0","9","0","0"
"http://steamcommunity.com/profiles/76561198035223774/recommended/4560/","76561198035223774","a dead beat","http://steamcommunity.com/profiles/76561198035223774/","46 products in account","♥♥♥♥ THIS GAME. The latest patch ♥♥♥♥ on this game so bad you can't even contact servers half the time and even after 25 minutes of waiting to find a decent game everybody gets kicked within 5 minutes of the game starting because the servers are so ♥♥♥♥, don't give relic any more money on this game because they've destroyed a once good rts game.\n\nedit*\nhey sorry i was mad but this game is really bad with the new updates don't buy it, thank ya!","July 22, 2014","false","54.3"," 5 of 20 people (25%) found this review helpful 6 people found this review funny","25","5","20","6","0"
