"url","reviewerUsername","reviewerDisplayName","reviewerUrl","reviewerProductsCount","reviewText","date","recommended","hoursPlayed","voteText","helpfulPercent","votesHelpful","votesTotal","votesFunny","commentsCount"
"http://steamcommunity.com/profiles/76561198037787576/recommended/4560/","76561198037787576","The♘Red♘Knight","http://steamcommunity.com/profiles/76561198037787576/","89 products in account","One of the best RTS's ever made.","April 12, 2015","true","19.4"," 1 of 2 people (50%) found this review helpful","50","1","2","0","0"
"http://steamcommunity.com/profiles/76561198088317488/recommended/4560/","76561198088317488","[DEL] ClonesDream","http://steamcommunity.com/profiles/76561198088317488/","36 products in account","You can take control of a Tiger Ace Tank.\n\n10 trillion/10 Game of the universe.","August 17, 2014","true","8.5"," 1 of 2 people (50%) found this review helpful","50","1","2","0","0"
"http://steamcommunity.com/profiles/76561198059315770/recommended/4560/","76561198059315770","The Demon Fisherman","http://steamcommunity.com/profiles/76561198059315770/","121 products in account","One of the best strategy games I have ever played! No other strategy game I've played has lived up to my standards, but this game is something special.\n\nI would Definatley recommend this game to anyone!\n\nBuy this game. you wont regret it.","August 27, 2015","true","17.6"," 1 of 2 people (50%) found this review helpful","50","1","2","0","0"
"http://steamcommunity.com/id/naylynnaung/recommended/4560/","naylynnaung","Renegade","http://steamcommunity.com/id/naylynnaung/","4 products in account","The best action strategy game series that I've ever been played and still playing now. This games is excellent in not only depicting the most famous operations of all times and it let us to take part in it and feel it as if we were there. Actually, I don't have to play it a second to know this game is good. I played it many times in cracked version and only now I bought official licensed digital copy from Steam store. Play it guys. You all will surely love it.","June 24, 2015","true","6.1"," 1 of 2 people (50%) found this review helpful","50","1","2","0","0"
"http://steamcommunity.com/profiles/76561197977632063/recommended/4560/","76561197977632063","Xetelian","http://steamcommunity.com/profiles/76561197977632063/","680 products in account","Played most of my hours off steam so there isn't many recorded.\n\nReally truly a good RTS.","June 17, 2015","true","1.3"," 1 of 2 people (50%) found this review helpful","50","1","2","0","1"
"http://steamcommunity.com/id/aftershock112/recommended/4560/","aftershock112","Aftershøck","http://steamcommunity.com/id/aftershock112/","202 products in account","Decent game. On sale a lot for like two euros. So if you're not sure whether or not to buy, wait until it's on sale.","June 22, 2015","true","0.1"," 1 of 2 people (50%) found this review helpful","50","1","2","0","0"
"http://steamcommunity.com/profiles/76561198094508043/recommended/4560/","76561198094508043","Duckjnr2012","http://steamcommunity.com/profiles/76561198094508043/","22 products in account","this is awesome and you will ♥♥♥ over it so fast so get it now you ♥♥♥♥♥s","August 3, 2015","true","0.1"," 1 of 2 people (50%) found this review helpful 1 person found this review funny","50","1","2","0","0"
"http://steamcommunity.com/profiles/76561198059315770/recommended/4560/","76561198059315770","The Demon Fisherman","http://steamcommunity.com/profiles/76561198059315770/","121 products in account","One of the best strategy games I have ever played! No other strategy game I've played has lived up to my standards, but this game is something special.\n\nI would Definatley recommend this game to anyone!\n\nBuy this game. you wont regret it.","August 27, 2015","true","17.6"," 1 of 2 people (50%) found this review helpful","50","1","2","0","0"
"http://steamcommunity.com/id/naylynnaung/recommended/4560/","naylynnaung","Renegade","http://steamcommunity.com/id/naylynnaung/","4 products in account","The best action strategy game series that I've ever been played and still playing now. This games is excellent in not only depicting the most famous operations of all times and it let us to take part in it and feel it as if we were there. Actually, I don't have to play it a second to know this game is good. I played it many times in cracked version and only now I bought official licensed digital copy from Steam store. Play it guys. You all will surely love it.","June 24, 2015","true","6.1"," 1 of 2 people (50%) found this review helpful","50","1","2","0","0"
"http://steamcommunity.com/profiles/76561197977632063/recommended/4560/","76561197977632063","Xetelian","http://steamcommunity.com/profiles/76561197977632063/","680 products in account","Played most of my hours off steam so there isn't many recorded.\n\nReally truly a good RTS.","June 17, 2015","true","1.3"," 1 of 2 people (50%) found this review helpful","50","1","2","0","1"
"http://steamcommunity.com/id/aftershock112/recommended/4560/","aftershock112","Aftershøck","http://steamcommunity.com/id/aftershock112/","202 products in account","Decent game. On sale a lot for like two euros. So if you're not sure whether or not to buy, wait until it's on sale.","June 22, 2015","true","0.1"," 1 of 2 people (50%) found this review helpful","50","1","2","0","0"
"http://steamcommunity.com/profiles/76561198094508043/recommended/4560/","76561198094508043","Duckjnr2012","http://steamcommunity.com/profiles/76561198094508043/","22 products in account","this is awesome and you will ♥♥♥ over it so fast so get it now you ♥♥♥♥♥s","August 3, 2015","true","0.1"," 1 of 2 people (50%) found this review helpful 1 person found this review funny","50","1","2","0","0"
"http://steamcommunity.com/profiles/76561198070684600/recommended/4560/","76561198070684600","Starlore","http://steamcommunity.com/profiles/76561198070684600/","8 products in account","This is  good game if you like rts games and ww2 games","August 8, 2015","true","27.9"," 1 of 2 people (50%) found this review helpful","50","1","2","0","0"
"http://steamcommunity.com/profiles/76561198183982527/recommended/4560/","76561198183982527","Vittorio Luciano","http://steamcommunity.com/profiles/76561198183982527/","24 products in account","Great game ,easy to use and get used to","July 29, 2015","true","2.7"," 1 of 2 people (50%) found this review helpful","50","1","2","0","0"
"http://steamcommunity.com/profiles/76561198098380683/recommended/4560/","76561198098380683","Julius","http://steamcommunity.com/profiles/76561198098380683/","29 products in account","a lot of nice mods,but a lack of players in those.the base game is fun too.","March 15, 2015","true","8.4"," 2 of 4 people (50%) found this review helpful","50","2","4","0","0"
"http://steamcommunity.com/profiles/76561198210623668/recommended/4560/","76561198210623668","TURTLES","http://steamcommunity.com/profiles/76561198210623668/","11 products in account","One of my favorite RTS","April 16, 2015","true","18.6"," 2 of 4 people (50%) found this review helpful 1 person found this review funny","50","2","4","0","0"
"http://steamcommunity.com/id/Fauzananda/recommended/4560/","Fauzananda","MHF.SimpleMan","http://steamcommunity.com/id/Fauzananda/","342 products in account","WW2 Game :D","May 17, 2015","true","11.4"," 3 of 6 people (50%) found this review helpful 1 person found this review funny","50","3","6","0","0"
"http://steamcommunity.com/id/yazzoony/recommended/4560/","yazzoony","GrumpyArab","http://steamcommunity.com/id/yazzoony/","3977 products in account","One of my favorite RTS games of all time. Solid gamplay, realisitc battles and amazing graphics for a RTS.","January 14, 2011","true",""," 1 of 2 people (50%) found this review helpful","50","1","2","0","0"
"http://steamcommunity.com/id/360cougar2187/recommended/4560/","360cougar2187","CougarTheOtaku","http://steamcommunity.com/id/360cougar2187/","147 products in account","GREATYTTTTTTTTTTTTTTTTTTTTTTTTTTTTTTTTTTTTTTTTTTTTTTTTTTTT\n","December 18, 2015","true","2.4"," 1 of 2 people (50%) found this review helpful 1 person found this review funny","50","1","2","0","0"
"http://steamcommunity.com/profiles/76561198056405329/recommended/4560/","76561198056405329","BAZ00KaNukE","http://steamcommunity.com/profiles/76561198056405329/","197 products in account","amazing strategy game and really nice\ngameplay","July 13, 2012","true","37.9"," 1 of 2 people (50%) found this review helpful","50","1","2","0","0"
"http://steamcommunity.com/profiles/76561198157218111/recommended/4560/","76561198157218111","ajbusiness","http://steamcommunity.com/profiles/76561198157218111/","12 products in account","Took over 20 hours to finish the campan which was fun but was long.","August 24, 2015","true","63.5"," 2 of 4 people (50%) found this review helpful","50","2","4","0","0"
"http://steamcommunity.com/id/Houseofjuilii/recommended/4560/","Houseofjuilii","House Of Juilii","http://steamcommunity.com/id/Houseofjuilii/","26 products in account","I love RTS and aleays have. Until i found the Total war Series i used to be an MLG pro at any and all RTS. that has changed since then. I was introduced to the game by a friend of mine, And i have loved it ever since.","October 30, 2014","true","4.4"," 1 of 2 people (50%) found this review helpful","50","1","2","0","0"
"http://steamcommunity.com/profiles/76561198097324851/recommended/4560/","76561198097324851","Agent Mustache","http://steamcommunity.com/profiles/76561198097324851/","45 products in account","Company of heros is a great game. I used to play it.","February 13, 2015","true","0.8"," 1 of 2 people (50%) found this review helpful","50","1","2","0","0"
"http://steamcommunity.com/id/gpsmanijak/recommended/4560/","gpsmanijak","gutenfucken","http://steamcommunity.com/id/gpsmanijak/","25 products in account","Great game,recommend to anyone ;)","January 31, 2015","true","0.4"," 1 of 2 people (50%) found this review helpful","50","1","2","0","0"
"http://steamcommunity.com/profiles/76561198062136085/recommended/4560/","76561198062136085","xXPossesXx","http://steamcommunity.com/profiles/76561198062136085/","16 products in account","best game ever made","December 11, 2014","true","39.8"," 1 of 2 people (50%) found this review helpful","50","1","2","0","0"
"http://steamcommunity.com/profiles/76561198033322769/recommended/4560/","76561198033322769","Reaper_ft_ripper*","http://steamcommunity.com/profiles/76561198033322769/","155 products in account","Great Strategy, but also very hard","December 14, 2014","true","60.8"," 1 of 2 people (50%) found this review helpful","50","1","2","0","0"
"http://steamcommunity.com/id/gakoggQgl/recommended/4560/","gakoggQgl","((3400)) gQgleren","http://steamcommunity.com/id/gakoggQgl/","42 products in account","SPIL LØS !","December 12, 2015","true","21.8"," 1 of 2 people (50%) found this review helpful 1 person found this review funny","50","1","2","0","1"
"http://steamcommunity.com/profiles/76561198081344628/recommended/4560/","76561198081344628","Exiled_CannonCatcher","http://steamcommunity.com/profiles/76561198081344628/","39 products in account","One of The best RTS games out there since i have bought this game i have played it for days on end. If you really enjoy WW2 RTS games i highly recommend this for you.","January 11","true","0.1"," 1 of 2 people (50%) found this review helpful","50","1","2","0","0"
"http://steamcommunity.com/id/Freerider-Dave/recommended/4560/","Freerider-Dave","Freerider-Dave","http://steamcommunity.com/id/Freerider-Dave/","220 products in account","Brilliant Game, Single player is great. Multiplayer is great. Therfore its great. The cover system and special abiliteis are brilliant. The way you can set up machine gun nests and then make sandbag or barbed wire surrounds. Brilliant. Looking forward to COH2","July 19, 2013","true","16.9"," 1 of 2 people (50%) found this review helpful","50","1","2","0","0"
"http://steamcommunity.com/id/daazzz/recommended/4560/","daazzz","=Daazzz^^=","http://steamcommunity.com/id/daazzz/","652 products in account","Fantastic game 8/10","March 15, 2013","true","25.2"," 1 of 2 people (50%) found this review helpful","50","1","2","0","0"
"http://steamcommunity.com/id/ZeroXcuses/recommended/4560/","ZeroXcuses","Zero Tolerance","http://steamcommunity.com/id/ZeroXcuses/","294 products in account","Following the legacy of Commandos: Behind Enemy Lines and Fallout Tactics, and rivaling World In Conflict, this game is for those who enjoy managing small squads rather than massive armies. If you mourn the fall of the RTS genre, check out this flagship of the "RTT" genre.","June 7, 2013","true",""," 1 of 2 people (50%) found this review helpful","50","1","2","0","0"
"http://steamcommunity.com/profiles/76561198137084168/recommended/4560/","76561198137084168","Mach_5","http://steamcommunity.com/profiles/76561198137084168/","41 products in account","This game is extremely fun. From chaotic infantry fights to daring tank battles, you will always be entertained! Especially if you like destroying nazi swine...","February 17","true","0.4"," 2 of 4 people (50%) found this review helpful","50","2","4","0","0"
"http://steamcommunity.com/profiles/76561198061788702/recommended/4560/","76561198061788702","Spartan","http://steamcommunity.com/profiles/76561198061788702/","16 products in account","Hey guys, I love this game and always will. BUT i purchased the Anthology Pack non steam, and it included opposing fronts and tales of valor. However i activated it on steam and i only have CoH and OF. I really need to know how to get ToV? please contact me if you know how.","April 25","true","0.2"," 1 of 2 people (50%) found this review helpful","50","1","2","0","0"
"http://steamcommunity.com/profiles/76561198075491202/recommended/4560/","76561198075491202","♛♛Jägermeister♛♛","http://steamcommunity.com/profiles/76561198075491202/","55 products in account","A WW2 Stratagy Game, With real life events, Makes you feel like your the commander of your army in these Amazing battles. Even though it has a small range of bugs the devs have been working hard to eliminate them. Very well Polished Game.","June 14, 2013","true","20.4"," 1 of 2 people (50%) found this review helpful","50","1","2","0","0"
"http://steamcommunity.com/profiles/76561198108268460/recommended/4560/","76561198108268460","Priller","http://steamcommunity.com/profiles/76561198108268460/","53 products in account","DEUTCHLAND UBER ALLES! DEUTCHLAND UBER ALLES! DEUTCHLAND UBER ALLES! DEUTCHLAND UBER ALLES! DEUTCHLAND UBER ALLES! DEUTCHLAND UBER ALLES! DEUTCHLAND UBER ALLES! DEUTCHLAND UBER ALLES! DEUTCHLAND UBER ALLES! DEUTCHLAND UBER ALLES! DEUTCHLAND UBER ALLES! DEUTCHLAND UBER ALLES! DEUTCHLAND UBER ALLES! DEUTCHLAND UBER ALLES! DEUTCHLAND UBER ALLES! DEUTCHLAND UBER ALLES! DEUTCHLAND UBER ALLES! DEUTCHLAND UBER ALLES! DEUTCHLAND UBER ALLES! DEUTCHLAND UBER ALLES! DEUTCHLAND UBER ALLES! DEUTCHLAND UBER ALLES! DEUTCHLAND UBER ALLES! DEUTCHLAND UBER ALLES! DEUTCHLAND UBER ALLES! DEUTCHLAND UBER ALLES! DEUTCHLAND UBER ALLES! DEUTCHLAND UBER ALLES!\n\nin this Game every time that you play, you need to choose 2 desitions: LIVE WITH HONOR, OR DIE WITH GLORY!","May 1","true","2.0"," 7 of 14 people (50%) found this review helpful 7 people found this review funny","50","7","14","7","0"
"http://steamcommunity.com/profiles/76561198003101639/recommended/4560/","76561198003101639","H.","http://steamcommunity.com/profiles/76561198003101639/","164 products in account",""Krupp steel on Porsche Engines, who can defeat us?"","April 24, 2012","true","108.5"," 1 of 2 people (50%) found this review helpful","50","1","2","0","0"
"http://steamcommunity.com/id/NandiL/recommended/4560/","NandiL","De' Ron","http://steamcommunity.com/id/NandiL/","17 products in account","AAAAAAAAA Best RTS 4 ever","June 4","true","9.5"," 1 of 2 people (50%) found this review helpful","50","1","2","0","0"
"http://steamcommunity.com/id/THE_RACING_MAN/recommended/4560/","THE_RACING_MAN","THE_RACING_MAN™","http://steamcommunity.com/id/THE_RACING_MAN/","69 products in account","good","May 3","true","0.1"," 9 of 18 people (50%) found this review helpful 3 people found this review funny","50","9","18","3","0"
"http://steamcommunity.com/profiles/76561198034546781/recommended/4560/","76561198034546781","BluWaffles","http://steamcommunity.com/profiles/76561198034546781/","24 products in account","Game is good.","October 19, 2014","true","76.5"," 5 of 11 people (45%) found this review helpful","45","5","11","0","0"
"http://steamcommunity.com/profiles/76561198139455470/recommended/4560/","76561198139455470","SKY_WALKER_DXB","http://steamcommunity.com/profiles/76561198139455470/","18 products in account","great game","October 16, 2014","true","0.3"," 4 of 9 people (44%) found this review helpful","44","4","9","0","0"
"http://steamcommunity.com/id/TheSCREWEDSoftware/recommended/4560/","TheSCREWEDSoftware","Nudeln","http://steamcommunity.com/id/TheSCREWEDSoftware/","99 products in account","Yes i do, n' CoH2 to","October 15, 2014","true","0.2"," 3 of 7 people (43%) found this review helpful","43","3","7","0","0"
"http://steamcommunity.com/id/75867362354/recommended/4560/","75867362354","sox","http://steamcommunity.com/id/75867362354/","181 products in account","bad","September 3, 2014","true","14.7"," 2 of 5 people (40%) found this review helpful","40","2","5","0","0"
"http://steamcommunity.com/id/BL00DCR0W/recommended/4560/","BL00DCR0W","BloodCrow","http://steamcommunity.com/id/BL00DCR0W/","159 products in account","Just get Tales of Valor,  if thats how you spell it. This is a pretty cool game,  for a while.","December 23, 2013","true","3.9"," 2 of 5 people (40%) found this review helpful","40","2","5","0","0"
"http://steamcommunity.com/profiles/76561198144924481/recommended/4560/","76561198144924481","BeeZy","http://steamcommunity.com/profiles/76561198144924481/","22 products in account","Best of WWI( World War I) games EVER!!!!!!!!! 10/10","August 28, 2015","true","25.7"," 2 of 5 people (40%) found this review helpful 2 people found this review funny","40","2","5","2","2"
"http://steamcommunity.com/id/TychoCelchuuu/recommended/4560/","TychoCelchuuu","TychoCelchuuu","http://steamcommunity.com/id/TychoCelchuuu/","402 products in account","Company of Gyros is Relic's bold attempt to bring their experience on the sublime Homeworld 2 to the more down-to-earth genre of restaurant simulations. As the CEO of Gyros 'n Stuff, you control the national (and eventually multinational) policies of your gigantic corporation, but the game also allows you to micromanage various franchise owners if you wish. This is its greatest strength, because franchises in different regions have different challenges and objectives, and the higher level gameplay mirrors this, so that by spending time playing as these different franchises, you'll learn about the "realities on the ground" that are so crucial to success as a CEO. The endgame gets pretty bogged down because the game starts throwing lawsuits at you over the most tedious, petty details, and God help you if you actually did something REALLY bad. If your very first restaurant 10 years ago served ONE half-rat, half-lamb gyro on accident, you'll probably lose, long after you've quicksaved.","November 25, 2010","true","148.3"," 1 of 3 people (33%) found this review helpful","33","1","3","0","0"
"http://steamcommunity.com/profiles/76561198124761746/recommended/4560/","76561198124761746","Nightmare","http://steamcommunity.com/profiles/76561198124761746/","15 products in account","I have i little bit problem... I just buy this game on Steam but game still want CD. What to do ?","September 29, 2014","true","0.4"," 1 of 3 people (33%) found this review helpful","33","1","3","0","0"
"http://steamcommunity.com/id/mangosareexoticandtasty/recommended/4560/","mangosareexoticandtasty","Maxwell","http://steamcommunity.com/id/mangosareexoticandtasty/","67 products in account","♥♥♥♥♥♥ game that shoves DLC in your face, its literally 2 teams(germans/allies) and 1 campaign scenario, not worth the 10$ if you want the real game you have to buy the DLC to "unlock" the rest. cheap ♥♥♥♥♥♥ technique.\n\nbut I gotta say this sad piece of ♥♥♥♥ that game out of the ♥♥♥ oven covered in ♥♥♥♥ vomit and ♥♥♥♥♥, is supprisingly fun with its overpriced DLC that is shoved in your face and mocked with.","November 27, 2014","true","35.4"," 1 of 3 people (33%) found this review helpful","33","1","3","0","0"
"http://steamcommunity.com/profiles/76561198074324511/recommended/4560/","76561198074324511","dabigfattuba","http://steamcommunity.com/profiles/76561198074324511/","118 products in account","mod it play it its sooo fun i recomend the blitzkrieg mod\n","March 27, 2014","true","2.1"," 1 of 3 people (33%) found this review helpful","33","1","3","0","0"
"http://steamcommunity.com/profiles/76561198040854090/recommended/4560/","76561198040854090","SwoopahHotFire","http://steamcommunity.com/profiles/76561198040854090/","184 products in account","My friend made me play this. The Luftwaffers got me. RUN AWAY!!! (In all seriousness it's a breath of fresh air in the point and click genre.)","July 26, 2014","true","2.6"," 1 of 3 people (33%) found this review helpful","33","1","3","0","0"
"http://steamcommunity.com/id/sireriond/recommended/4560/","sireriond","SirEriond","http://steamcommunity.com/id/sireriond/","243 products in account","Great Game! On of the Great Classics of rts games. Good mechanics, decent gaphics and great music all nicely bound together :) Warning: Historicly accurate! ;)","November 28, 2013","true","22.4"," 1 of 3 people (33%) found this review helpful","33","1","3","0","0"
"http://steamcommunity.com/profiles/76561198060207568/recommended/4560/","76561198060207568","[NS] Stultitiae Laus","http://steamcommunity.com/profiles/76561198060207568/","35 products in account","Great RTS, probably the best I've ever played.\nNothing else to say.","January 16","true","18.0"," 1 of 3 people (33%) found this review helpful","33","1","3","0","0"
"http://steamcommunity.com/id/2345254252312312/recommended/4560/","2345254252312312","[UNAA☭]Little Baby Man","http://steamcommunity.com/id/2345254252312312/","153 products in account","Its Gud","May 9, 2014","true","0.9"," 1 of 3 people (33%) found this review helpful","33","1","3","0","0"
"http://steamcommunity.com/id/KeaganZev/recommended/4560/","KeaganZev","Zev","http://steamcommunity.com/id/KeaganZev/","213 products in account","Gave me PTSD.","June 25, 2014","true","12.7"," 1 of 3 people (33%) found this review helpful 1 person found this review funny","33","1","3","0","0"
"http://steamcommunity.com/profiles/76561198120531233/recommended/4560/","76561198120531233","360 NO $COPE*MT DEWKING420BLAZE","http://steamcommunity.com/profiles/76561198120531233/","49 products in account","gay\n","April 17, 2014","true","31.3"," 1 of 3 people (33%) found this review helpful","33","1","3","0","0"
"http://steamcommunity.com/profiles/76561198065099823/recommended/4560/","76561198065099823","theMAC","http://steamcommunity.com/profiles/76561198065099823/","56 products in account","come on seriously...nothing comes close. In a league of it's own...fogetabout it","June 8, 2015","true","0.1"," 1 of 3 people (33%) found this review helpful","33","1","3","0","0"
"http://steamcommunity.com/id/kleidophoros/recommended/4560/","kleidophoros","Kleidophoros","http://steamcommunity.com/id/kleidophoros/","1045 products in account","Great strategy game; good for hundreds of hours with add-ons.","July 12, 2012","true","80.4"," 1 of 3 people (33%) found this review helpful","33","1","3","0","0"
"http://steamcommunity.com/id/PocketWatchFox/recommended/4560/","PocketWatchFox","❤ Snuggle Pop-A-Saurus ❤","http://steamcommunity.com/id/PocketWatchFox/","349 products in account","The definitive RTS of WWII will have you cheering as your panzers roll over the allies or your rangers shred armored cars.  Making full use of terrain, cover, battlefield deployments and combined arms tactics, CoH is one of the best RTS games available.","November 19, 2010","true","105.4"," 1 of 3 people (33%) found this review helpful","33","1","3","0","0"
"http://steamcommunity.com/id/jocosity/recommended/4560/","jocosity","Communist "Joseph Ballin" Layton","http://steamcommunity.com/id/jocosity/","920 products in account","this game is a ripoff of world war 2","July 5, 2011","true","2.4"," 1 of 3 people (33%) found this review helpful 1 person found this review funny","33","1","3","0","1"
"http://steamcommunity.com/profiles/76561198033984598/recommended/4560/","76561198033984598","BG110478","http://steamcommunity.com/profiles/76561198033984598/","147 products in account","7/10","May 1","true","3.2"," 1 of 3 people (33%) found this review helpful","33","1","3","0","0"
"http://steamcommunity.com/id/Gerach/recommended/4560/","Gerach","Gerach","http://steamcommunity.com/id/Gerach/","293 products in account","Seems like a very good strategy game, sadly i dont play that type of games.","May 28","true","0.1"," 1 of 3 people (33%) found this review helpful","33","1","3","0","1"
