"url","reviewerUsername","reviewerDisplayName","reviewerUrl","reviewerProductsCount","reviewText","date","recommended","hoursPlayed","voteText","helpfulPercent","votesHelpful","votesTotal","votesFunny","commentsCount"
"http://steamcommunity.com/profiles/76561198110797826/recommended/4560/","76561198110797826","Ben Cote [11thMS]","http://steamcommunity.com/profiles/76561198110797826/","80 products in account","Kids play Call of Duty\nBoys play Battlefield\nMen play Arma\n\n...and I play Company of Heroes","July 3, 2015","true","33.9"," 604 of 683 people (88%) found this review helpful 544 people found this review funny","88","604","683","544","23"
"http://steamcommunity.com/id/anemeros/recommended/4560/","anemeros","Anemeros","http://steamcommunity.com/id/anemeros/","194 products in account","I remember when World War 2 games were king back in the old Medal of Honor days; To such a degree that people were sick of them, no matter the quality, like they are now of Military Shooter X and its various clones. Well Company of Heroes took the WW2 setting and built a fantastic, modern RTS around it. What they made is easily one of the best RTS games ever, and maybe even the best game set in WW2.","September 28, 2013","true","17.0"," 226 of 237 people (95%) found this review helpful","95","226","237","0","0"
"http://steamcommunity.com/id/RazielTheSoulReaver/recommended/4560/","RazielTheSoulReaver","Viscount Raziel von Neukarthago","http://steamcommunity.com/id/RazielTheSoulReaver/","148 products in account","I love this game. I love it so much. But first the basics. Company of Heroes is a real-time strategy game in the times of WW2, directly after the D-Day. It features 1 campaign for vanilla, but you can expand that number by buying the really good DLCs. But the best about this game is the mp. All the factions (America,Commonwealth,Wehrmacht and Panzer Elite) are really well balanced and if you loose, it's only your fault. Every faction has 3 different trees of abilities, but you can only choose one per game. The abilities reach from little boosts or infantry drops to V1 Rockets or mighty king tiger tanks. Thanks to the "new steam version" the mp still works and many people are still playing it (up to 4000 people peak, source Steamcharts by 21st of february), so there's no reason to not get it. Thanks for reading and i hope you endorse this little review of me. ^^ And now go ahead, scroll up and buy it. I'm not kidding, go, there's nothing more to see here.","October 8, 2014","true","12.4"," 215 of 231 people (93%) found this review helpful 20 people found this review funny","93","215","231","20","23"
"http://steamcommunity.com/id/Airbees/recommended/4560/","Airbees","Arbies","http://steamcommunity.com/id/Airbees/","218 products in account","a german soldier was crying because his friend died and I didnt want to play any more","December 23, 2015","true","140.8"," 320 of 363 people (88%) found this review helpful 229 people found this review funny","88","320","363","229","7"
"http://steamcommunity.com/id/Jakiebob/recommended/4560/","Jakiebob","Cybercacoarchubus","http://steamcommunity.com/id/Jakiebob/","233 products in account","There's a guy named Jerry and everyone really hates him.","August 6, 2014","true","19.7"," 490 of 601 people (82%) found this review helpful 193 people found this review funny","82","490","601","193","15"
"http://steamcommunity.com/id/starfleet86/recommended/4560/","starfleet86","Mayor Milo","http://steamcommunity.com/id/starfleet86/","142 products in account","Like big battles?\n\nPlay.\n\nLike big battles that go to ♥♥♥♥ for you?\n\nPlay.\n\nLike losing at everything you do because you barely play strategy games, but you love WWII?\n\n♥♥♥♥ing play.\n\nLike seriously, play this game.","November 26, 2014","true","4.9"," 181 of 202 people (90%) found this review helpful 124 people found this review funny","90","181","202","124","0"
"http://steamcommunity.com/id/shinonome_nano/recommended/4560/","shinonome_nano","「世姉☆莉夜」","http://steamcommunity.com/id/shinonome_nano/","235 products in account","Best game I ever played. Period.\nAnd still better than CoH2.","September 30, 2015","true","170.2"," 203 of 231 people (88%) found this review helpful 15 people found this review funny","88","203","231","15","5"
"http://steamcommunity.com/id/t22r91s/recommended/4560/","t22r91s","Lt_Stade","http://steamcommunity.com/id/t22r91s/","313 products in account","10/10 would bang... This game is amazing. Every ounce of detail poured into it is easily seen. This game was released in 2k6, and still plays and feels amazing. Steam even hosts the new servers, so this game isn't going down anytime soon.","November 27, 2013","true","14.2"," 182 of 206 people (88%) found this review helpful 1 person found this review funny","88","182","206","0","9"
"http://steamcommunity.com/id/Slauce/recommended/4560/","Slauce","Sauce½","http://steamcommunity.com/id/Slauce/","212 products in account","My units told me to ♥♥♥♥ off because I kept clicking on them.","April 11, 2015","true","0.8"," 400 of 508 people (79%) found this review helpful 572 people found this review funny","79","400","508","572","5"
"http://steamcommunity.com/id/foederatus/recommended/4560/","foederatus","Foe","http://steamcommunity.com/id/foederatus/","200 products in account","One of the better RTS games out there at the moment.  The game is built on a strong, proven engine and they do a great job of encompassing the era of the Second World War.  If you enjoy tactical RTS games and the WW2 era, then this game is definitely a must-buy.","December 4, 2013","true","20.7"," 101 of 107 people (94%) found this review helpful","94","101","107","0","0"
"http://steamcommunity.com/profiles/76561198053111355/recommended/4560/","76561198053111355","Lead (Probably won't talk much)","http://steamcommunity.com/profiles/76561198053111355/","89 products in account","(Something to quickly note first - Don't let the amount of time I have put into this game misguide you. This review was actually meant for Company of Heroes (New Steam Version) which I have put over 120 hours into but for some reason, you cannot do reviews of it and can only do reviews for COH itself as well as its two expansion packs.)\n\nAlright, enough dilly-dallying. Let's get this show on the road.\n\nWhen it comes to games that try to capture the hard, bloody and steely conflicts of World War II then one game usually comes to mind (my mind that is) and that is Company of Heroes.\n\nA game I would easily consider to be one of the greatest RTSs of all time alongside the likes of Age of Empires II, Rome: Total War, Men of War and Dawn of War (So many wars!). I would also say it is one of my own personal favourite games of all time.\n\nSet in the western front of the European Theatre of World War II. Company of Heroes sees the US Army (As well as the British Army with Opposing Fronts installed) and the Wehrmacht (As well as the Panzer Elite {Waffen SS in reality} with OF installed) battling each other for the control of France and the Netherlands in the numerous conflicts and engagements of that era.\n\nCompany of Heroes is a game that just does so many things right when it comes to strategy. It has a user friendly interface and easy to learn controls which are key to any strategy game in my opinion – both real-time and turn-based – and gives a really realistic and striking depiction of the war. It has easy to understand game mechanics and it is quite literally a blast to play as it takes little time before the action begins and gets intense real fast when there is so much happening at once in devastating and explosive fire fights.\n\nWhen it comes to its gameplay, it seems fairly simple enough. You start off with a single building for a base and a group of engineers (your builders in the game), a big map to explore and expand into as well as using what resources you can secure from the area to use so you can try to build up your base and call in what units or support options you need to attain victory, such as infantry, paratroopers, special weapons teams, armoured cars, medium and heavy tanks, artillery barrages, P-51 strafing runs and V1 Rocket strikes etc. It’s your standard RTS mash up.\n\nThis game is the epitome of how a strategy game should play out; rather than just the usual strategy game method of having larger numbers than the other guy (Although that certainly helps in this game). COH requires you to utilise your given surroundings, putting soldiers in buildings and environmental cover to give them an edge in the fight while also attempting to use your units special abilities like throwing grenades and sticky bombs or using flamethrowers to try and maximise enemy casualties.\n\nMaybe trying to exploit certain tactics like flanking maneuverers, suppression of an enemy squad, going around the back of an enemy tank and hitting it in its vulnerable sides and rear armour or trying to hold onto a strategic position with well-placed fortifications, traps and emplacements. That is what real strategy and tactical prowess is about and COH does it beautifully.\n\nThis means that you must be cunning and always planning for the unexpected, always being one step ahead of the opposing commander. Be ready for when the enemy comes charging at you with everything they have while calling in whatever long range assets they can muster against your forces.\n\nGraphics are decent, they may not be all the way up there when compared to the likes of StarCraft 2 or the Total War games but they do the job as far as I’m concerned and still hold up pretty well to this day. When you see an artillery barrage devastate a patch of land, turning it into a series of craters while a nearby squad of soldiers gets blown apart (literally) by the shrieking shells all the while screaming that “They don’t want to be there, they just want to go home, man!” then I would definitely say that the graphics and audio department have very much done their job to the nth degree.\n\nThere are problems with the game though. The AI is questionable at times with enemies running entire platoon sized forces into fortified positions without trying to soften up the defenders with artillery or anything first, more often or not I saw the spamming of the same unit over again from my AI controlled enemies also while not trying to diversify their unit types to counter any certain units I had. The AI also cheats sometimes, knowing exactly where to call in an artillery barrage on your units despite that the fog of war would prevent them from knowing their exact location. The campaign(s) are quite scripted and often don’t present much of a challenge, even on the harder difficulties.\n\nIt’s not a perfect game by any means but I still recommend it for all the good I have mentioned above and hope this review can help your perspective should you think about purchasing it.\n\nOn the side as well, I just want to say that this game has some of the best voice acting I have ever heard with soldiers spouting some really emotional and funny dialogue with professional voice talent provided from the likes of Steve Blum and of course, dear old Nolan North. Somehow the creators even managed to work in some humorous fourth wall breaking dialogue as well, my favourite having to be from a British Infantry Section, “Excuse me, sir, would you mind not clicking me anymore?” or “Oi! Get your bloody hands off the mouse!”\n\nAnd if you do ever think about getting Company of Heroes then I highly recommend that you download the Blitzkrieg mod which amplifies the game like 10 times in terms of gameplay and player choice, making it even more gripping and awesome to play.\n\nSo there you have it. Sorry about the length of this review but I simply had to put down what I liked about this game, which unfortunately was a lot….sorry.\n\nHave a good day, sir or madam.\n\n\nQuote of the day - “We’re f*cked, crew! Command is drunk again!” - US Artillery crewman.","July 5, 2015","true","1.5"," 98 of 104 people (94%) found this review helpful 18 people found this review funny","94","98","104","18","5"
"http://steamcommunity.com/id/LiquidMasters/recommended/4560/","LiquidMasters","Liquid","http://steamcommunity.com/id/LiquidMasters/","172 products in account","Even better than company of heroes 2","December 29, 2013","true","3.1"," 129 of 148 people (87%) found this review helpful","87","129","148","0","1"
"http://steamcommunity.com/id/ogrefest/recommended/4560/","ogrefest","-[FF]-Calamari","http://steamcommunity.com/id/ogrefest/","32 products in account","Engineer shoots from 10 inches away, misses","November 16, 2014","true","9.2"," 161 of 195 people (83%) found this review helpful 190 people found this review funny","83","161","195","190","0"
"http://steamcommunity.com/id/dawgbert/recommended/4560/","dawgbert","DawgBert","http://steamcommunity.com/id/dawgbert/","189 products in account","My favorite game of all time...!!!","November 8, 2014","true","523.2"," 186 of 234 people (79%) found this review helpful 23 people found this review funny","79","186","234","23","9"
"http://steamcommunity.com/id/Yuber8f/recommended/4560/","Yuber8f","Yuber8f","http://steamcommunity.com/id/Yuber8f/","114 products in account","Most Innovative RTS Game of all time.\n\nCompany of Heroes is unlike any other traditional RTS games. Many have tried to innovate the RTS genre, but none that has been more successful over Company of Heroes. Relic has always been in the forefront of innovtive RTS experiences, But I have to say CoH is their ultimate masterpiece, not even its sequel, can beat it.\n\nEverything in CoH is realistic without compromising balanced gameplay mechanics and fun. I have yet to see a new RTS game to beat this game as of this writing.\n\nIn CoH, massing units do not work when a horde of infantry is halted by single tank, or even worse: face a hail of mortar strikes. Your seemingly unstoppable tank column can be put to a halt with well placed gun enplacement in a superior position  . Simly put, you cannot steamroll to victory in this game like you would in any other RTS games.\n\nTechnically speaking CoH revolves around tactics, resources and base building is still a major mechanic in the game, but superior maneuvers and positioning is everything. Resource management is a zero-sum tug of war as the only way to secure more resources is to hod more teritorries, the more territories you hold the harder it is defend.\n\nThe units are consisted of infantry squads or singular tank units. These units are very accurate to its real-life counterparts,  a US rifleman squad armed with M1 Garrand rifles will defeat KAR98-wielding german counterparts at medium to close range, but the opposite happens in long range engagements. Heavy Machine gun emplacements provide supressing fire that reduces the target's ability to fight or maneuver well. Long range artillery is inaccurate but deadly when it lands home - tanks are impervious to anti infantry weaponry giving them free reign to dominate an opponent with no proper anti-tank response.\n\nFurthermore, as the game progresses, every action in the battlefield earn you commander points which allow the playerto level up and gain access to special units, powers, or even superweapons such as the V1 Rocket strike or even call out powerful german Tiger Tanks. This allows the player to adapt apidly varying battlefield conditions.\n\nThere are many more innovative gameplay mechanics such as Directional cover, retreat mechanic, triage, battlefield destruction and many more. It also has a very compelling single player campaign - long enough for you to grasp and master these mechanics. And if that isn't good enough for you, gimping and gore in this game is fantastic. Nothing more exhilirating and satisfying seeing your opponents army's flying limbs and smoking scrap by a well placed artillery barrage.\n\nCoh is an absolute get and an instant timeless piece - I seriously doubt anything coming out sooner or later will top the bar this game has set so high.","June 22, 2014","true","54.9"," 78 of 82 people (95%) found this review helpful","95","78","82","0","0"
"http://steamcommunity.com/id/wildman_616/recommended/4560/","wildman_616","Guetapens","http://steamcommunity.com/id/wildman_616/","149 products in account","When released this game raised the RTS bar.\n\nIt's sequel took a decade to lower it again.","September 14, 2015","true","0.2"," 80 of 92 people (87%) found this review helpful 35 people found this review funny","87","80","92","35","0"
"http://steamcommunity.com/id/MaccaUK/recommended/4560/","MaccaUK","Macca | 506thPIR","http://steamcommunity.com/id/MaccaUK/","97 products in account","Company of Heroes is a very good game. There's so much to doo , too! The game has good graphics, details and a lot of amazing units. Campaign's alright, but Multiplayer is great. Different types of missions/battles to play.","November 28, 2013","true","21.5"," 72 of 81 people (89%) found this review helpful","89","72","81","0","0"
"http://steamcommunity.com/id/GenPattonBR/recommended/4560/","GenPattonBR","GenPattonBR","http://steamcommunity.com/id/GenPattonBR/","466 products in account","Possibly one of the best war-based RTS out there.\n\nIt is has beatiful graphics, and max settings will take a toll on more modest graphics cards, making it very slow.\n\nIt is still much better than CoH2.","May 14, 2014","true","1.1"," 94 of 116 people (81%) found this review helpful","81","94","116","0","0"
"http://steamcommunity.com/id/wifind/recommended/4560/","wifind","Knight","http://steamcommunity.com/id/wifind/","79 products in account","JESUS, CONRAD. TIE YOUR ♥♥♥♥ING LACES","March 13, 2015","true","2.3"," 166 of 228 people (73%) found this review helpful 165 people found this review funny","73","166","228","165","1"
"http://steamcommunity.com/profiles/76561198019227164/recommended/4560/","76561198019227164","carlw","http://steamcommunity.com/profiles/76561198019227164/","67 products in account","Brought this game a couple of years ago and still play today, its a timeless classic. I am now addicted to the entire series!","November 22, 2014","true","85.9"," 69 of 81 people (85%) found this review helpful 2 people found this review funny","85","69","81","2","0"
"http://steamcommunity.com/id/TraitorsDagger/recommended/4560/","TraitorsDagger","Traitors Dagger","http://steamcommunity.com/id/TraitorsDagger/","191 products in account","The benchmark for all RTS should be, and have been, set by this game.\nBeautifully crafted mechanics and an attention to detail make this game phenomenal, the maps are varied, some are large, other like Achelous River contain various chokepoints that will make you scream as you watch your Shermans be blown up as the bridge collapses. The modding community has also had its hand in making CoH fantastic, my favorite being the Blitzkrieg Mod which makes the game brutal and glorious.\nAll in all, a fantastic RTS, one that everybody should play and one last note:\n"JESUS CHRIST CONRAD TIE YOUR ♥♥♥♥ING LACES"","October 15, 2014","true","3.4"," 64 of 74 people (86%) found this review helpful 15 people found this review funny","86","64","74","15","0"
"http://steamcommunity.com/id/chrisisaboss/recommended/4560/","chrisisaboss","a shiny spoon","http://steamcommunity.com/id/chrisisaboss/","58 products in account","This game is absolutely amazing. I would assassinate the president to experience this game for the first time again. I would burn down a city to experience this game for the first time. I bought this game on sale, but let me tell you: It is well worth the price. Or triple the price. This is one of the only WWII rts games that actually does the job as a good rts. The game has aged well, graphics are quite high. The map is 90% destructable, your units can hide in the craters made by tank shells. Good campaign, multiplayer is mostly dead though. This game is a solid 9001/10","January 26, 2015","true","56.4"," 73 of 90 people (81%) found this review helpful 28 people found this review funny","81","73","90","28","3"
"http://steamcommunity.com/profiles/76561198063176763/recommended/4560/","76561198063176763","John Graham Doe","http://steamcommunity.com/profiles/76561198063176763/","39 products in account","On behalf of the Grateful Fatherland in this Glorious Struggle, for honor and blood, I present to you this Iron Cross.","April 13, 2015","true","77.8"," 106 of 143 people (74%) found this review helpful 46 people found this review funny","74","106","143","46","0"
"http://steamcommunity.com/id/miyumiayase/recommended/4560/","miyumiayase","Miyumi Ayase","http://steamcommunity.com/id/miyumiayase/","288 products in account","NOTE 1:My game time should be around 500 hours by now if I count my time outside of Steam when I first bought this game in 2006.\n\nNOTE 2:Also see my Company of Heroes: Opposing Fronts review here:\nhttp://steamcommunity.com/id/miyumiayase/recommended/9340\n\nAnd my Company of Heroes: Tales of Valor here:\nhttp://steamcommunity.com/id/miyumiayase/recommended/20540\n\nTL:DR? See Conclusion\nINTRODUCTION:Company of Heroes is a real-time strategy game developed by Relic Entertainment and published by THQ (RIP). It boasts an authentic World War 2 RTS experience with a squad based infantry mechanic, tactical and strategic map control, realistic armored combat and intense battles that will leave players at the edge of their seats. The game was originally released in 2006 and the first game to be labeled with the Games for Windows tag on the box cover.\n\nMuch like other World War 2 video game stories, Company of Heroes lets you take the role of an American army company called 'Able Company' who takes part in some of the most major operations of the allied forces during the war such as D-Day and the Falaise Pocket.\n\nPROS:+ Great graphics that looks good even in today's standards\n+ Great sound effects\n+ Amazing voice acting that gives life to the battlefield (probably my favorite PRO)\n+ Dark humor from the units “Main gun is out, we're screwed, we're screwed!” - Allied tank when the Main Gun is disabled and low on HP “I don't want to die...in FRAAANCCCEE” -Wehrmacht Soldier when low in HP.\n+ Intense action packed combat\n+ Great atmosphere (A PRO I rarely put on an RTS title)\n+ Great core game mechanic\n+ Faction versatility: Each faction has 3 'branches' where the player can adopt different bonuses to better suit their play style.\n+ Fully destructible environment that leaves the battlefield deformed after each match\n\nCONS:- Low quality textures when zoomed in (probably because of the game's age)\n- No melee or close quarter combat like Relic's other series 'Warhammer 40,000: Dawn of War'\n- Relatively long load times\n- Occasional pathfinding problems\n- No Axis / German Campaign (Added in the Expansions)\n- AI could use some improvement\n- Relic Entertainment Account (DRM)\n\n\nCONCLUSION:GREAT GAME and comes HIGHLY RECOMMENDED. The game provides one of the most authentic experiences I have ever gotten on a World War 2 RTS game. It has excellent game mechanics; great graphics that aged really well despite some low textures; awesome voice acting from the cast; fun factions with a good variety of units to play with; and an over all solid core gameplay. It has its fair share of CONS but in my opinion, the PROS definitely outweighs them by a large margin specially with the removal of Games for Windows Live and its migration on Steam.\n\nMUST BUY for RTS and World War 2 fans whether at full price or on sale although, I highly advice the 'Complete Pack' (which includes the original game and the 2 expansions) to have the full Company of Heroes 1 experience.\n\n---------------------------------------------------------\nLike my Reviews? Follow my Curator's Page:\nhttp://store.steampowered.com/curator/6861651-Miyumi%27s-Review-Corner/","March 8, 2015","true","0.1"," 96 of 129 people (74%) found this review helpful 13 people found this review funny","74","96","129","13","3"
"http://steamcommunity.com/profiles/76561198075774703/recommended/4560/","76561198075774703","Rawlson","http://steamcommunity.com/profiles/76561198075774703/","149 products in account","Company of Heores... wow where to start. This game is truly amazing. I remember when I first played this game. I said "holy sh*t, this game was made in 2006?"\nThis game has a very fun campaign with about 15 missions. Command the US Forces landing on the beaches of Normandy, then the Airborne Infantry. This game combines realism with fun arcade style gameplay.\nThere is so much to do in this game; upgrade your riflemen to have BARs, give your Shermans Mine Flails to get through minefields or build a machinegun nest to keep sneaky Germans out of your base.\nThe other great thing about this game is after you beat the campaign, it doesn't end. Multiplayer, skirmishs, 2 huge DLCs and a German Army to command in skirmishs or multiplayer.\nI would easily pay 60$ for this game now. 10$ is a steal.","December 23, 2013","true","115.7"," 39 of 40 people (98%) found this review helpful","98","39","40","0","0"
"http://steamcommunity.com/id/Turtool/recommended/4560/","Turtool","Turtool","http://steamcommunity.com/id/Turtool/","88 products in account","This game is crazy fun, alone and with friends! I highly recommend this game to all!","December 20, 2013","true","165.1"," 49 of 56 people (88%) found this review helpful","88","49","56","0","0"
