"url","reviewerUsername","reviewerDisplayName","reviewerUrl","reviewerProductsCount","reviewText","date","recommended","hoursPlayed","voteText","helpfulPercent","votesHelpful","votesTotal","votesFunny","commentsCount"
"http://steamcommunity.com/profiles/76561198049160248/recommended/47000/","76561198049160248","Practical Problems","http://steamcommunity.com/profiles/76561198049160248/","73 products in account","░░█▌░░░░░░░░░░░░░░░▀██████░░░\n░█▌░░░░░░░░░░░░░░░░███████▌░░\n░█░░░░░░░░░░░░░░░░░████████░░\n▐▌░░░░░░░░░░░░░░░░░▀██████▌░░\n░▌▄███▌░░░░▀████▄░░░░▀████▌░░\n▐▀▀▄█▄░▌░░░▄██▄▄▄▀░░░░████▄▄░\n▐░▀░░═▐░░░░░░══░░▀░░░░▐▀░▄▀▌▌\n▐░░░░░▌░░░░░░░░░░░░░░░▀░▀░░▌▌\n▐░░░▄▀░░░▀░▌░░░░░░░░░░░░▌█░▌▌\n░▌░░▀▀▄▄▀▀▄▌▌░░░░░░░░░░▐░▀▐▐░\n░▌░░▌░▄▄▄▄░░░▌░░░░░░░░▐░░▀▐░░\n░█░▐▄██████▄░▐░░░░░░░░█▀▄▄▀░░\n░▐░▌▌░░░░░░▀▀▄▐░░░░░░█▌░░░░░░\n░░█░░▄▀▀▀▀▄░▄═╝▄░░░▄▀░▌░░░░░░\n░░░▌▐░░░░░░▌░▀▀░░▄▀░░▐░░░░░░░\n░░░▀▄░░░░░░░░░▄▀▀░░░░█░░░░░░░\n░░░▄█▄▄▄▄▄▄▄▀▀░░░░░░░▌▌░░░░░░\n░░▄▀▌▀▌░░░░░░░░░░░░░▄▀▀▄░░░░░\n▄▀░░▌░▀▄░░░░░░░░░░▄▀░░▌░▀▄░░░\n░░░░▌█▄▄▀▄░░░░░░▄▀░░░░▌░░░▌▄▄\n░░░▄▐██████▄▄░▄▀░░▄▄▄▄▌░░░░▄░\n░░▄▌████████▄▄▄███████▌░░░░░▄\n░▄▀░██████████████████▌▀▄░░░░\n▀░░░█████▀▀░░░▀███████░░░▀▄░░\n░░░░▐█▀░░░▐░░░░░▀████▌░░░░▀▄░\n░░░░░░▌░░░▐░░░░▐░░▀▀█░░░░░░░▀\n░░░░░░▐░░░░▌░░░▐░░░░░▌░░░░░░░","February 5, 2015","true","7.1"," 5 of 12 people (42%) found this review helpful 6 people found this review funny","42","5","12","6","0"
"http://steamcommunity.com/id/SwiftCrack/recommended/47000/","SwiftCrack","[LUE] SwiftCrack","http://steamcommunity.com/id/SwiftCrack/","1347 products in account","Too much repetition in the end.","February 20, 2014","false","7.6"," 3 of 8 people (38%) found this review helpful","38","3","8","0","0"
"http://steamcommunity.com/id/BridgetFisher/recommended/47000/","BridgetFisher","BridgetFisher","http://steamcommunity.com/id/BridgetFisher/","4086 products in account","Great puzzle game that as a bonus contains magic and faeries!  Save the land of mythical wonder from tragedy by solving the puzzles, no worries if you get stuck the faerie can offer you a hint to guide adventurers on their way using magic!  Voice acting is good and the game is fun.  Cant get stuck with the hint button, and only encountered 2 puzzles that could be a bit iffy during a nonstsop powerrun of the game since its so addictive and fun being filled with magic and faeries.  Did you miss the part about the faeries and magic?   Because this game has faeries and magic!\n\nRating:  10/10  Value:  9.99","October 8, 2013","true","10.7"," 2 of 6 people (33%) found this review helpful","33","2","6","0","2"
"http://steamcommunity.com/id/cherosh/recommended/47000/","cherosh","Tentacle-Kitty (Level 4)","http://steamcommunity.com/id/cherosh/","482 products in account","4 Elements, as so many games centered around matching 3 or more same-colored stones, is a rather short and pretty much straightforward game. After every four levels, you'll get to play a short game of "Spot the difference", but that's pretty much all the excitement happening. Oh, and you get to search for objects before you open up another part of the game.\n\nThe plot of restoring four books of magic, so that the powers within are in balance again, are a nice little touch, but pretty much all there is to it. After 64 levels, the game is played through completely, and you have the choice of starting all over again. (I played the first 16 levels again to gain the last two achievements, but that's it - I'm done with this game.)\n\nOverall, I wouldn't recommend the game unless you are really a match 3 fan, and find it funny to have a fairy at your side making you think of Navi. Granted, the fairy in this game is not as obnoxious, but not as helpful as Navi either. And that is a feat.\n\nDone with the game, moving on to something more entertaining - at least I hope the next one will be more entertaining.","February 4, 2015","false","10.1"," 1 of 4 people (25%) found this review helpful","25","1","4","0","0"
"http://steamcommunity.com/id/GunPlayer/recommended/47000/","GunPlayer","The Orca","http://steamcommunity.com/id/GunPlayer/","441 products in account","These are the type of games that make you nostalgic. I used to play this when i was younger.","July 19, 2015","true","8.5"," 0 of 2 people (0%) found this review helpful 1 person found this review funny","0","0","2","0","0"
"http://steamcommunity.com/id/alvietron/recommended/47000/","alvietron","Alvie","http://steamcommunity.com/id/alvietron/","977 products in account","I must have gotten this game in some dumb bundle and I only clicked play on it by accident. It is like an interactive version of the puzzles on the backs of offbrand cereal boxes except the art is worse. Thumbs down.","May 13, 2015","false","0.1"," 0 of 2 people (0%) found this review helpful","0","0","2","0","0"
"http://steamcommunity.com/id/excruciate/recommended/47000/","excruciate","Excruciate","http://steamcommunity.com/id/excruciate/","717 products in account","For people who are into jewel match puzzle games it can be addicting. I made it about an hour and was bored out of my ♥♥♥♥ing mind. All I could think of was how there are so many ways in life for my time to be more well spent, whether with other, much better games, or anything outside of games in real life. It is just a series of still pictures that you find items then point-and-click then a bunch of uninteresting, unfun, bleak, bland, boring jewel matching. For a decent jewel matching game play Bejeweled 3, not this snorefest. SNORE ZZzzZzZZZzzZZZ...","April 26, 2014","false","3.3"," 4 of 11 people (36%) found this review helpful","36","4","11","0","0"
"http://steamcommunity.com/id/dimon222/recommended/47000/","dimon222","dimon222","http://steamcommunity.com/id/dimon222/","2741 products in account","Very nice interesting game!","July 7, 2013","true","8.6"," 1 of 5 people (20%) found this review helpful","20","1","5","0","0"
"http://steamcommunity.com/profiles/76561198166623629/recommended/47000/","76561198166623629","zeldafan45","http://steamcommunity.com/profiles/76561198166623629/","36 products in account","this game wont run. can someone tell me how to fix it. when opened it says it encountered a problem. it used to work but i hadn't opened it for a while.","December 11, 2015","true","0.5"," 0 of 3 people (0%) found this review helpful","0","0","3","0","0"
"http://steamcommunity.com/profiles/76561197983225082/recommended/47000/","76561197983225082","baddog993","http://steamcommunity.com/profiles/76561197983225082/","649 products in account","Sad to say the game is fun but relies on luck way to much instead of skill be prepared to restart games a lot more then should be NECESSARY. The power ups are woefully slow to load back up and some of the time your just going to lose because you have to wait for a power up to recharge. Now games do have some luck involved of course but when it becomes a game mechanic instead of skill then we have some issues with it.\n\nMostly a game of luck rather then a game of skill really. ALso the dumb idea to add a timer is stupid and dumb and a little cruel to people who pay for this. Why does this need a timer at all??? It doesnt. . Also the price is way to high for this game bought it on sale for a buck. Im really not liking this game as much as I thought I would. Rather hard later on and gets on my nerves with just luck ruling the day in this game.","April 26, 2014","false","6.8"," 0 of 3 people (0%) found this review helpful","0","0","3","0","0"
"http://steamcommunity.com/id/risen_glory/recommended/47000/","risen_glory","kincky_kacky","http://steamcommunity.com/id/risen_glory/","54 products in account","lol","October 16, 2014","true","0.2"," 2 of 8 people (25%) found this review helpful","25","2","8","0","0"
"http://steamcommunity.com/id/brattysnax/recommended/47000/","brattysnax","𝕭 𝖗 𝖆 𝖙 𝖙 𝖞","http://steamcommunity.com/id/brattysnax/","4637 products in account","It's not a bad game. I picked this up in a bundle, so for the price it couldn't be beat. I really think that they should cut the regular price in half on Steam, however, because of certain elements of the game. It's in a very low resolution, which stretches to the size of the resolution you have set on your monitor.\n\nAt least from what I saw, there's no way to change this. A bad soundtrack is always my main complaint with games, but that's easily fixed with this game by just turning it off and putting on your own music - as I've stated in reviews for other games. 10 hours is about the maximum amount of time you'll get out of this game by the time you complete it.\n\nThat isn't entirely a bad thing.\n\nIt combines several different types of casual games. Click'n'find, image matching, and matching up crystals which give you some useful powers. Interesting, and not a bad game, just not amazing, either. Even for 2008 and a casual game, it could've been better. However, it did soak up 10 hours of my time and for that, it's definitely worth it for you to check it out next time it pops up in a bundle.\n\n6.5/10 - Fun factor is huge, everything else is just okay.","June 5, 2014","true","10.6"," 1 of 6 people (17%) found this review helpful","17","1","6","0","0"
"http://steamcommunity.com/id/TheToenninga/recommended/47000/","TheToenninga","Tim Timsen","http://steamcommunity.com/id/TheToenninga/","721 products in account","1.5/10\nBoring - because repetitive - as hell.\nKeep your hands off this, it's just a total pain...","June 18, 2012","false","2.4"," 0 of 5 people (0%) found this review helpful","0","0","5","0","0"
"http://steamcommunity.com/profiles/76561198036338106/recommended/47000/","76561198036338106","smelliga","http://steamcommunity.com/profiles/76561198036338106/","162 products in account","I really liked this game... on my first playthrough.\n\nPuzzles include 4 FROG (fractured object) screens, 16 spot-the-difference screens, and 64 match-3 levels.\n\nThe main match-3 levels are different from any other genre game I have played.  I was expecting a classic Bejeweled-style game, but instead of swapping tiles or sliding rows, you form chains by clicking and dragging a path through adjacent matching symbols.  The paths do not have to form a straight line, you can zig-zag any direction except diagonally (for all the explanation the game gives, they never actually tell you this).\n\nAs the game progresses, you will encounter obstacles such as ice, immovable blocks, narrow passages, and rocks; however, you will also gain access to rechargeable tools that help you overcome these obstacles.  There is a timer, but chances are you will not need to worry about it until 3/4 of the way through the game, and even if you fail you just restart the level with no penalties.  The levels are increasingly challenging, but never frustrating or boring.  In fact, I found I enjoyed the later levels more because they forced you to use a bit of strategy to complete.\n\nI thought it was a nice touch that each of the four elements have a slightly different level aesthetic, which helps keep the levels feeling fresh.\n\nAs great as the gameplay was, though, there are things that destroy the replay value:\n- The story is cheesy.  Although, that's to be expected for this genre.\n- The chatty fairy.  She was fine for the first playthrough, providing necessary instructions and tips to help you learn and understand the game.  Subsequent playthroughs, though, are a different story - her dialogue cannot be skipped or turned off, so you will have to suffer through "Pop-Ups: The Game" every single time.  This is annoying if you just want to sit down and replay a few levels casually.\n- There is no option to select your starting level.  Whether you want to challenge yourself by replaying a tricky stage, or whether you are just trying to go for a specific achievement, your only choices are to continue from your last autosave or to completely start over.  Again, this is fine for the first playthrough, but an unlockable freeplay mode would have been appreciated.\n- The achievements are a bear to get.  It took me 1.5 playthroughs to get "Overachiever" because it is partially luck-dependent, and "Quick as a Flash" took 11 angry hours: The first FROG screen does not count toward the achievement because the fairy's dialogue and tutorial eat up so much of your time, so you are left with only three chances per game to earn it (the FROGs for the fire key, the air key, and the water key).  Basically, this means you will need to play through 16 match-3 levels and 4 spot-the-difference puzzles before you even reach the first applicable fractured object screen, and you will be continuously forced to deal with the fairy's "helpfulness."  If you miss the 90-second timeframe on the fire key puzzle, there is no way to just try it again because the game autosaves just AFTER you complete it.  You will either need to restart the game, or hope that you have better luck with the air key.  Regardless, you are looking at another 16 levels and 4 puzzles before getting a second opportunity to win this achievement.\n\nIf there had been either a freeplay mode, or a way to turn off the fairy, I might have given this game a 9.5/10 because the gameplay is solid, and it would have been incredibly replayable.  As is, though, I would have to give it a 6.5/10.","January 1, 2015","true","11.2"," No ratings yet","0","0","0","0","0"
"http://steamcommunity.com/profiles/76561198024920171/recommended/47000/","76561198024920171","Brakkish","http://steamcommunity.com/profiles/76561198024920171/","521 products in account","Played this on a tablet and liked it enough to purchase it again on steam. This version looks like a crappy port (with no graphical improvements for PC), but still fun. Hesitantly recommend if you've never played it before.","January 2, 2015","true","4.3"," No ratings yet","0","0","0","0","0"
"http://steamcommunity.com/id/Spaz9K/recommended/47000/","Spaz9K","Spaz9K","http://steamcommunity.com/id/Spaz9K/","345 products in account","Refreshing game.. Well worth 2 quid for a few hours gaming..","November 16, 2012","true","19.4"," No ratings yet","0","0","0","0","0"
"http://steamcommunity.com/profiles/76561198024050400/recommended/47000/","76561198024050400","iHugTrees ^_^","http://steamcommunity.com/profiles/76561198024050400/","332 products in account","Very pleasant music... Last stages are challenging.\n\nOverall I enjoyed this 10/10.\n\nYes I was an addict of Candy Crush and Candy Crush Soda. :P","February 1, 2015","true","23.7"," No ratings yet","0","0","0","0","0"
"http://steamcommunity.com/profiles/76561197993782445/recommended/47000/","76561197993782445","FunnyCide","http://steamcommunity.com/profiles/76561197993782445/","154 products in account","Find pieces of objects to use them to find a key, spot the difference, and chain making all in one.  Plus explosions for long chains.  Must love the explosions!","November 17, 2011","true","45.5"," No ratings yet","0","0","0","0","0"
"http://steamcommunity.com/profiles/76561198060191430/recommended/47000/","76561198060191430","Wolfheart","http://steamcommunity.com/profiles/76561198060191430/","53 products in account","Well made game, love the way it functions and works.\nGood puzzle game to pass time. Wish there was another game or more to it though.\nAll in all its a good game. Bought it when it was on sale.","January 15, 2015","true","9.6"," No ratings yet","0","0","0","0","0"
"http://steamcommunity.com/profiles/76561198092065417/recommended/47000/","76561198092065417","PineyCreek","http://steamcommunity.com/profiles/76561198092065417/","931 products in account","A nice but dated (graphically) casual game that has some strategy, although it isn't apparent at first.  The longer the chains you make, the bigger the explosion at the end of the chain.  Each chain of each color powers a particular power up to help get you through the level before the time runs out.  Most are easy, but the game does have a certain replayability in terms of getting faster at the levels.  Cutesy story.  After each set of four levels there is a spot the difference level.  At the start of each 16 pick-3 style levels (64 total) there is a find the hidden object level.  Good time waster, took me about 7 hours to beat all the levels.","January 15, 2015","true","7.6"," No ratings yet","0","0","0","0","0"
"http://steamcommunity.com/profiles/76561198024050400/recommended/47000/","76561198024050400","iHugTrees ^_^","http://steamcommunity.com/profiles/76561198024050400/","332 products in account","Very pleasant music... Last stages are challenging.\n\nOverall I enjoyed this 10/10.\n\nYes I was an addict of Candy Crush and Candy Crush Soda. :P","February 1, 2015","true","23.7"," No ratings yet","0","0","0","0","0"
"http://steamcommunity.com/id/Remy_D_Marquis/recommended/47000/","Remy_D_Marquis","Remy D. Marquis","http://steamcommunity.com/id/Remy_D_Marquis/","695 products in account","A really fun game to kill time","December 10, 2014","true","26.4"," No ratings yet","0","0","0","0","0"
"http://steamcommunity.com/profiles/76561198024920171/recommended/47000/","76561198024920171","Brakkish","http://steamcommunity.com/profiles/76561198024920171/","521 products in account","Played this on a tablet and liked it enough to purchase it again on steam. This version looks like a crappy port (with no graphical improvements for PC), but still fun. Hesitantly recommend if you've never played it before.","January 2, 2015","true","4.3"," No ratings yet","0","0","0","0","0"
"http://steamcommunity.com/id/Spaz9K/recommended/47000/","Spaz9K","Spaz9K","http://steamcommunity.com/id/Spaz9K/","345 products in account","Refreshing game.. Well worth 2 quid for a few hours gaming..","November 16, 2012","true","19.4"," No ratings yet","0","0","0","0","0"
"http://steamcommunity.com/profiles/76561198120650301/recommended/47000/","76561198120650301","YoshiRider","http://steamcommunity.com/profiles/76561198120650301/","279 products in account","Could have been a good game. It is fun to play for the first hour. Unfortunatley the story is not really interesting why I had the feeling that progress is not rewarded. Level design and tasks are repeating themself very early on and the game becomes boring soon.","December 24, 2014","false","13.6"," No ratings yet","0","0","0","0","0"
"http://steamcommunity.com/id/rocky1138/recommended/47000/","rocky1138","Rocky1138","http://steamcommunity.com/id/rocky1138/","687 products in account","Out of five stars, I would give this game 2.\n\nIt's got nice artwork and the game isn't buggy.\n\nThe problem is with the core game mechanics. You can't control where the camera goes and so the thrill and reward of making large chains is denied. This is especially frustrating when you can see a large chain at the beginning when the camera is zooming around but when it comes near to the point of a large chain, the camera doesn't go far enough and you can't complete it. A much better game would allow the player complete control of the camera.","December 25, 2014","false","13.2"," No ratings yet","0","0","0","0","0"
"http://steamcommunity.com/id/dsloon/recommended/47000/","dsloon","dsloon","http://steamcommunity.com/id/dsloon/","128 products in account","It's magical, fun, and insanely addictive.  I'm currently working on my fourth playthrough - can't recommend it enough!","December 25, 2014","true","128.8"," No ratings yet","0","0","0","0","0"
"http://steamcommunity.com/profiles/76561197988509067/recommended/47000/","76561197988509067","Gravesmeister","http://steamcommunity.com/profiles/76561197988509067/","68 products in account","One of the better puzzle games I've played.","December 25, 2014","true","6.4"," No ratings yet","0","0","0","0","0"
"http://steamcommunity.com/profiles/76561198102251403/recommended/47000/","76561198102251403","mechashadow7","http://steamcommunity.com/profiles/76561198102251403/","87 products in account","A fun game that gets surpisingly complex in the later levels, and very easy to get lost in. I bought it, started playing it, next thing I knew I'd been up all night and was still plugging along determined to finish. Has pretty good replayablity, because even though the layout of the levels doesn't change, the rng of the gem placement makes it differrent everytime.","December 18, 2014","true","21.4"," No ratings yet","0","0","0","0","0"
"http://steamcommunity.com/id/gamehits/recommended/47000/","gamehits","gamehits","http://steamcommunity.com/id/gamehits/","1889 products in account","fun. difficulty ramps up and the graphics are elementary, but overall it's a replay! yes!","December 28, 2014","true","3.4"," No ratings yet","0","0","0","0","0"
"http://steamcommunity.com/id/sparrowswings/recommended/47000/","sparrowswings","Sparrow","http://steamcommunity.com/id/sparrowswings/","317 products in account","This is an excellent game to play when you want to play a game, but are too god damned stoned to play a game of real substance. You could play Bejeweled, I guess, but if you buy it you're giving EA money, so play this instead.","April 4, 2013","true","2.1"," No ratings yet","0","0","0","0","0"
"http://steamcommunity.com/id/andrew-film/recommended/47000/","andrew-film","andrew-film","http://steamcommunity.com/id/andrew-film/","999 products in account","4 Elements is a nice little puzzle. Not very challenging, but captivating, nice variety of mini-games and 64 levels. It took me 15 hours to complete it.","July 21, 2012","true","14.4"," No ratings yet","0","0","0","0","0"
"http://steamcommunity.com/id/rascilon/recommended/47000/","rascilon","Rascilon","http://steamcommunity.com/id/rascilon/","2159 products in account","Wonderful puzzle game.  In my top 5 puzzle games.  If you like games like Bejeweled, don't miss out on this title!  4.5 out of 5 Stars.","February 19, 2012","true","32.0"," No ratings yet","0","0","0","0","0"
"http://steamcommunity.com/id/criticalcomposer/recommended/47000/","criticalcomposer","CriticalComposer","http://steamcommunity.com/id/criticalcomposer/","980 products in account","A fun game when you just want to kick back and kill some time without really thinking about it.","February 15, 2013","true","8.5"," No ratings yet","0","0","0","0","0"
"http://steamcommunity.com/id/netherfiend/recommended/47000/","netherfiend","Netherfiend","http://steamcommunity.com/id/netherfiend/","944 products in account","A fun gem matching game. No frills, but enjoyable and challenging. A few hidden picture puzzles and find the difference puzzles keep the tedium at bay.","June 5, 2013","true","34.3"," No ratings yet","0","0","0","0","0"
"http://steamcommunity.com/id/Soluna/recommended/47000/","Soluna","Soluna","http://steamcommunity.com/id/Soluna/","523 products in account","Classic time vampire, good puzzle based casual game.","September 12, 2013","true","1.6"," No ratings yet","0","0","0","0","0"
"http://steamcommunity.com/id/CosmoTuxieNova/recommended/47000/","CosmoTuxieNova","Jada","http://steamcommunity.com/id/CosmoTuxieNova/","826 products in account","A pretty fun puzzle game. I enjoyed playing it most when I had trouble falling asleep. While fun, I wouldn't pay full price for it if I didn't have to.","August 2, 2013","true","79.1"," No ratings yet","0","0","0","0","0"
"http://steamcommunity.com/id/noisetank13/recommended/47000/","noisetank13","societalkrazyglue","http://steamcommunity.com/id/noisetank13/","212 products in account","looked like a bunch of ike and mikes threw up in my computer and over my lotr files\n\ni think i bought it for my laptop but never played it. well i guess its alright since it got my money","December 22, 2013","true","1.3"," No ratings yet","0","0","0","0","0"
"http://steamcommunity.com/id/Lechs5/recommended/47000/","Lechs5","Lechs5","http://steamcommunity.com/id/Lechs5/","45 products in account","Nice game. It's great if you're just in the mood to sit back and relax. The different kinds of puzzles in the game are fun.","December 19, 2013","true","3.2"," No ratings yet","0","0","0","0","0"
"http://steamcommunity.com/profiles/76561198041194031/recommended/47000/","76561198041194031","TimidOwl","http://steamcommunity.com/profiles/76561198041194031/","92 products in account","Fun puzzle game.","December 19, 2013","true","11.3"," No ratings yet","0","0","0","0","0"
