"url","reviewerUsername","reviewerDisplayName","reviewerUrl","reviewerProductsCount","reviewText","date","recommended","hoursPlayed","voteText","helpfulPercent","votesHelpful","votesTotal","votesFunny","commentsCount"
"http://steamcommunity.com/id/X-C-V/recommended/47000/","X-C-V","XCV","http://steamcommunity.com/id/X-C-V/","1041 products in account","Game doesn't work anymore for some time now, crashes on start\n//All known fixes doesn't seem to work// and there is no support at all\n\nDo not buy in its current state!\n\n*edit*\n\nThere is a fix that works\nhttp://steamcommunity.com/app/47000/discussions/0/451848855003818400/\n\nShame we have to fix it ourselfs yet the developer still does nothing","November 30, 2015","false","3.3"," 52 of 59 people (88%) found this review helpful 1 person found this review funny","88","52","59","0","0"
"http://steamcommunity.com/profiles/76561198189155037/recommended/47000/","76561198189155037","Susan","http://steamcommunity.com/profiles/76561198189155037/","231 products in account","Nice relaxing game that is basically a match 3 (or more gems) game.\nThere is a hidden object scene at the end of every chapter to mix things up a bit.\nIt can get more challenging as the game progresses, and you can't replay previously completed stages unless you restart the game.","November 30, 2015","true","8.0"," 33 of 34 people (97%) found this review helpful 1 person found this review funny","97","33","34","0","0"
"http://steamcommunity.com/id/dyehardz/recommended/47000/","dyehardz","DyeHardZ","http://steamcommunity.com/id/dyehardz/","3794 products in account","a nice simple casual match-three (or more) game.\n\n+ colorful & cute animation, with lots of explosion.\n+ hidden objects & spot the difference mini games.\n+ can be finished in 7+ hours with 70% achievements.\n\n- can be stressful at later levels because there are time limits.\n- there is no way to re-play earlier finished levels.","January 17, 2014","true","13.8"," 30 of 31 people (97%) found this review helpful","97","30","31","0","1"
"http://steamcommunity.com/id/briancarnell/recommended/47000/","briancarnell","briancarnell","http://steamcommunity.com/id/briancarnell/","865 products in account","Do not buy. A very good game, but force crashes every time on launch.\n\nThis has been reported to the devs numerous times in the discussion, but Devs apparently don't care.","December 19, 2015","false","0.1"," 30 of 34 people (88%) found this review helpful","88","30","34","0","0"
"http://steamcommunity.com/id/MakoSipper/recommended/47000/","MakoSipper","MakoSipper","http://steamcommunity.com/id/MakoSipper/","3792 products in account","Short Verdict: 4 Elements is a fun match-3 game that doesn't get old quickly. Instead of aiming for points, your objective is to make your way through the levels by breaking the path with your matches. It was a great surprise--I didn't expect much, but ended up having some fun for a few hours!\n\nPros:\nInnovative mechanic on the match-3 genre\nTotal of 64 basic levels, plus 4 hidden-object and 16 spot-the-difference levels, making it just long enough for this kind of game\nSmart puzzles that require fast thinking\nA unique atmosphere in each "world"\nExcellent difficulty advancement--you'll find it too easy at first, but it'll get harder as you move on\nSpecial powers add another layer to the puzzles\nPleasant BGM and cute graphics\nCons:\nTerrible (almost non-existent) story, but who cares?\nFixed very low resolution\nHO and STD levels were really annoying, mostly because of the low res, making me just click around like crazy\nBoring animations and character cards (that you collect to progress in the game)\nBought on / for: Razor Bundle by Bundle Stars for an average of US$0.35 (R$ 0,91). Definitely worth it! I wouldn't pay its full price, though.","November 14, 2014","true","13.6"," 24 of 26 people (92%) found this review helpful","92","24","26","0","4"
"http://steamcommunity.com/id/Venaxi/recommended/47000/","Venaxi","Venaxi","http://steamcommunity.com/id/Venaxi/","180 products in account","If you read the forum, this game has stopped working for many people.  I played this game for years and loved it.  Now it doesn't work.","November 26, 2015","false","65.7"," 22 of 24 people (92%) found this review helpful","92","22","24","0","0"
"http://steamcommunity.com/id/amuzz18/recommended/47000/","amuzz18","thetechguy95","http://steamcommunity.com/id/amuzz18/","1779 products in account","Probably the best casual game that I have played in a while. Levels are challenging after the half way point, not too hard to cause you to stop playing though. Can sometimes appear to be repetitive but it then adds something else to the gameplay to change the dynamic of it. Very enjoyable. Would recommend. 9/10.","July 9, 2014","true","5.3"," 19 of 19 people (100%) found this review helpful","100","19","19","0","0"
"http://steamcommunity.com/id/redheaddenise/recommended/47000/","redheaddenise","Queen D","http://steamcommunity.com/id/redheaddenise/","151 products in account","P.S: This review is based on MY experience only.\n\nOne of the best "casual" genre games I have ever played.\n\n...and I play casual games, a lot.\n\n+ Addictive, makes you wanna play it everyday until you completely finish it.\n+ Colorful\n+ Simple, but some levels actually takes few restarts to complete succesfully.\n+ Has a simple storytelling, rather focused on gameplay.\n+ Sounds effects are not annoying.\n+ Keeping the mind / brain peaceful for a while. I played it right before I went to sleep for few weeks.\n\nI keep searching for a similar game, tell me if you know any.","December 9, 2013","true","44.3"," 20 of 21 people (95%) found this review helpful","95","20","21","0","2"
"http://steamcommunity.com/profiles/76561198062930115/recommended/47000/","76561198062930115","DG Dobrev","http://steamcommunity.com/profiles/76561198062930115/","403 products in account","A wonderful casual game combining hidden objects, spot the differences and a rather elaborate match 3 gameplay, fit for kids and adults alike. It's a great time sink.\n\nWhat this game does well:\n1. The artwork is beautiful.\n2. The Match 3+ puzzles are based on a maze-type "map" where you need to find your way from your starting position to the end, rather than a simple X by X board. Aided by 4 usable rechargeable items, you need to make your way to the end of the maze by any means necessary. And there are also explosions when you match 5 or more gems!\n3. The hidden object games are nice and challenging.\n4. The spot the differences game is lot's of fun - some puzzles are quite tough, too.\n\nWhat this game does poorly:\nIn my opinion - nothing, really... I guess the spot the differences puzzles could have had more differences to spot, but then again, it works fine as it is.\n\nThe conclusion:\nA magnificent casual 5+ hours game, with wonderful artwork and fun gameplay, which would cost you under 1€/$ on sale (like right now). This is cheaper than a bag of peanuts or chips, or a beer and will provide you with way more hours of enjoyment. What's not to like?","April 18, 2015","true","10.6"," 19 of 20 people (95%) found this review helpful","95","19","20","0","5"
"http://steamcommunity.com/id/ownosourus/recommended/47000/","ownosourus","ownosourus","http://steamcommunity.com/id/ownosourus/","3349 products in account","4 Elements is a fun match-3 puzzler weighed down by unnecessary seek-and-find sequences and occasionally frustrating level design. 4 Elements' generic fantasy presentation hides an addictive game that will appeal to fans of Bejeweled and other "casual" puzzle titles. There's nothing wrong with story in a puzzle game, but with the relatively low resolution of the somewhat blurry art in the seek-and-find sequences, gamers will want the title to get out of its own way and let the real game breathe.\n\n4 Elements tells a simple story of an ancient evil that was locked away by the power of the titular elements — earth, wind, fire and water — but has now been unleashed. It's up to the player to unlock four books to release the elements and save the realm. It's inoffensive and flat, but the story is bolstered by a fairy who accompanies the player and periodically provides tips and hints. Unlike some other games that have overused the "helper" character while not allowing the player to discover and explore, the fairy is here to explain the various rules and power-ups and won't get in your way.\n\nThe main gameplay of 4 Elements involves creating chains of three or more jewels of the same colour to clear a pathway for a liquid to reach the tree at the end of each level. The 64 timed levels are large and sprawling, with multiple pathways and strategies for the player to take. There are 16 levels per "element," and the colours and visuals change depending on which element you're playing, adding a bit of variety to the proceedings while playing; as you progress, the levels become harder, longer and with more obstacles. For example, you might stumble upon a stone that can only be destroyed via a bomb power-up, or a frozen tile that must be chained several times before breaking.\n\nThere are environmental tricks, as well, with arrows that help clear large sections of the level when the liquid reaches them. There are several power-ups, such as the aforementioned bomb, the ability to swap any two regular jewels, "dig" out a tile to make way for another, and a power-up that reshuffles all jewels in the level besides stones and frozen tiles. Some jewels sit on more than one layer and must be cleared several times, as well. The time limit is rarely going to make players nervous, but it does add a good bit of tension as players scramble to reach the tree after a long journey.\n\nSupplementing the main gameplay are four hidden object sequences to find the key to each elemental book. The still paintings, while pretty, are a bit washed out on both the top screen and the touch screen, making it difficult to find each item. The fairy is available to point players in the right direction, but these sections feel like filler. There are also near-identical cards that require the player to spot the differences, which are short and relatively simple, but the small pictures on the card had us resort to pixel hunting and tapping the screen until we found something; these sequences aren't challenging so much as frustrating, and feel extraneous to the rest of the game.\n\nAlthough the colours seem a little washed out, the visuals are lovely and soft, evoking a fairy tale fantasy realm. The music and sound effects are quite soothing and peaceful, and the pay-off to a large combo or clearing a huge section of a level with "whoosh" and "ringing" sounds is surprisingly effective. The top screen is used as a map, while the bottom screen is where the action takes place. There is not much 3D implementation here, but it's not missed.\n\nThough 4 Elements is hampered by its filler hidden object/seek-and-find sequences, the puzzle gameplay is very fun and surprisingly involving. So while it's not the perfect puzzle game, players could certainly do worse. For a lengthy and well-crafted experience, 4 Elements is recommended; just be ready to do some pixel hunting in-between matching those jewels.","February 13","true","84.3"," 15 of 17 people (88%) found this review helpful","88","15","17","0","0"
"http://steamcommunity.com/id/Faudraline/recommended/47000/","Faudraline","Faudraline","http://steamcommunity.com/id/Faudraline/","1196 products in account","Among many casual games that I've been playing, I took a particular liking towards this one, visiting it over and over again just to take my mind off something now and then. Is there anything extraordinary? Nah, not really. But it has a story at least.\n\nThe Magic Land - yeah, this is the name of the realm that we are in. Creative I know, bear with me for the time - is in turmoil! The altars of the 4 Elements fell into ruin and the careful balance of nature is tipped off to result in catastrophes all over the place, so it is our casual gaming skills that shall save the Magic Land. With our trusted fairy companion - that girl is useful, I tell you - we are to unlock the books of 4 Elements and bring peace to the realm once again! For a casual game, it comes with a story and some lore about magical creatures. I must say that's a bonus.\n\n4 Elements is an entertaining, casual puzzle game that takes attention, quick-thinking and resourcefulness. Rules are very simple: your aim is to open a path way for the energy flow through the puzzle board labyrinth within a time limit, by matching as many possible same colored stones at a time. Your casual Match 3 game. It starts easy enough, and progresses to become 'what the heck I'm doing, I wonder???'. It has some HOG and “Find the Difference” scenes between chapters that are moronically hard: I couldn't decide whether they are a plus or a minus.\n\nThe game itself is kinda addictive. You find yourself passing an hour or two, then realize that you've just lost that hour, which is the exact purpose of these games. Theme is really pretty, and the design is well above the average. I'd recommend it to whomever that looks for a fancy Bejeweled alternative with flashy gameplay and needs a game that doesn't use much brain activity rather than some attention span.\n\nPlease also check out Lady Storyteller's Curator page here - follow for regular updates on reviews for other games!","August 15, 2015","true","10.9"," 20 of 27 people (74%) found this review helpful 1 person found this review funny","74","20","27","0","0"
"http://steamcommunity.com/profiles/76561198035285721/recommended/47000/","76561198035285721","bigh","http://steamcommunity.com/profiles/76561198035285721/","2448 products in account","4 Elements are the 4 worlds of this game: Earth, Fire, Wind and Water.\nSuch a lovely game with a little Tinkerbell like helping fairy and faboulos drawings of landscapes and creatures. The graphics are so sweet. Unfortunately the resolution is fixed to 800 x 600. Could be HD. A really relaxing and outstanding soundtrack. Love this instrumental music. Panpipes, whistles, guitar and piano.\n\nLike every puzzle game it starts easy. Connect some chains with min 3 tiles ... but then the hardness raises quickly. Destroy stone blocks make longer chains. But it's much more. Every book part level has it's own break to solve a "spott-the-differences" minigame. Really not easy. To enter a new book you have solve a "quest", meaning search a big picture for several item parts. It's unnatural hard. But if you proceed you'll get into the game and enjoy the thrill of puzzeling. The last two levels are a pain in the ♥♥♥. You have to quick solve chains and may need many tries ...\n\nHighly recommend as a classic puzzlegame","April 28, 2014","true","11.0"," 16 of 22 people (73%) found this review helpful","73","16","22","0","3"
"http://steamcommunity.com/id/joecool4279/recommended/47000/","joecool4279","JoeCool","http://steamcommunity.com/id/joecool4279/","4975 products in account","4 Elements is a simple, fun, relaxing game. The objective of each level is to clear the blocks, which destroys the path below them, which allows the water to progress. The goal is to get the water from the start to the finish. As the levels progress, the size of the board increases and obstacles pop up. Destroying colors builds toward power ups. Collecting green blocks builds towards a shovel that allows you to dig away a piece of the path, for example. Making long chains creates explosions to destroy obstacles like ice.\n\nWhile the game is designed with a ticking clock each level, I think I only ran out of time maybe twice just from bad luck on what colors came my way. It's not really difficult. After a few boards, the game switches things up with some puzzles where you need to find the differences in two pictures or search for hidden objects. Many of these items/differences are extremely well hidden, basically blending into the backgrounds, which made that a bit of an annoyance. I had a few times where I just went click crazy all over the screen.\n\nThere are A LOT of levels in this game. After a while I thought it would never end, so it does feel like it stretches out a bit too long. It's still fun and completely worth a play through, though I can't see me playing it again anytime soon. There are more addictive casual games out there.","December 21, 2013","true","8.4"," 10 of 11 people (91%) found this review helpful","91","10","11","0","0"
"http://steamcommunity.com/id/cypher504/recommended/47000/","cypher504","Mr.Cypher!","http://steamcommunity.com/id/cypher504/","2149 products in account","Real casual match 3 / hidden object game !! This one is fun and very well animated. Real good for the casual player or kids ! Get this game if you dont have it  !\n\n","April 19, 2015","true","6.3"," 12 of 15 people (80%) found this review helpful 1 person found this review funny","80","12","15","0","1"
"http://steamcommunity.com/id/philonerd/recommended/47000/","philonerd","Ria","http://steamcommunity.com/id/philonerd/","75 products in account","Good casual game. I personally find it rather relaxing to play and it's nice to take a break from more serious games every once in a while. It's not terribly deep, but I don't think anyone buys it expecting some kind of epic storyline.","December 19, 2013","true","6.9"," 9 of 10 people (90%) found this review helpful","90","9","10","0","0"
"http://steamcommunity.com/profiles/76561198036498823/recommended/47000/","76561198036498823","Solanum nigrum","http://steamcommunity.com/profiles/76561198036498823/","1058 products in account","This game is an waste of time and that means that it does what it shall do.\nIf you want to spend some time with an mildly complicated game that has some fantasy-elements for your eyeballs and low brain-usage for your... well, brain, than go fetch this.\nOh yeah, I might add that you need to be a little bit quick in the end to get through the last levels, but that is it.\nAAAAnd... when you are searching for the hidden objects it is nearly impossible without the hint-button.\nAAAAAAAAAnd..... when you search for the errors in the double-pictures in the game you start to pull your hair in the last levels... damn.. I mean... I am bald now! Why? It started so easy... so f*#king easy.......\n\n10/10 for an very relaxing gaming experience\n\nAll the review-flashbacks... terrible","May 23, 2015","true","10.0"," 9 of 10 people (90%) found this review helpful 3 people found this review funny","90","9","10","3","5"
"http://steamcommunity.com/profiles/76561198068000482/recommended/47000/","76561198068000482","gibbousmoon100","http://steamcommunity.com/profiles/76561198068000482/","1996 products in account","Casual match-the-stone puzzle game.  It's relaxing, with high production values but mediocre level design.  They could have done so much more with this.  The second-to-last level (level 63 out of 64) was the first one that was really interesting.  Level 64 has a sudden difficulty spike which was not logical in the context of the rest of the game's super-easy difficulty, but I enjoyed it.  That said, level 63 and level 64 (out of a total of 64 levels) being interesting was far too little, far too late.\n\n+Good production values.\n+Stable.  Didn't crash on me a single time.  (Sad that this cannot be taken for granted these days.)\n\n-No interesting learning curve or progression.  Level 62 is not much more difficult than level 2.\n-Boring level design.","January 22, 2014","false","27.6"," 12 of 16 people (75%) found this review helpful","75","12","16","0","0"
"http://steamcommunity.com/id/heikkito/recommended/47000/","heikkito","Nax_o","http://steamcommunity.com/id/heikkito/","1467 products in account","Excellent puzzle game to be played WITH the kids but not to be played just by the kids themselves. This is more a game for adults who want a bit more challenge from their casual games.\n\nGame requires quite good mouse handling skills as you are constantly drawing paths back and forth on the screen to create as long gem chains as possible. You must also be able to think fast what gem colors do you need to collect in order to get a specific tool or bomb to get past a barrier.\n\nEspecially in the later water and air levels time limits are quite tough and usually if you fail to quickly break out of the starting section of the map you might as well restart the level as time is quite scarce.\n\nEvery now and then there are nice 'find the difference' between two similar pictures sections and clearing up temples by finding pieces of artifacts scattered around the screen.","July 21, 2014","true","7.6"," 10 of 13 people (77%) found this review helpful","77","10","13","0","0"
"http://steamcommunity.com/id/c00lizz/recommended/47000/","c00lizz","c00lizz","http://steamcommunity.com/id/c00lizz/","2086 products in account","4 Elements is an old tile matching game where you instead of moving tiles around to form links just point out to the game links that are already there. It takes you through a fairly lengthy single-player campaign and even manages to mix in a few Hidden Object and Spot the Difference mini-games. It is however not a game that can stand up to the more modern tile matching games and it's attempts at branching out, through the use of a small storyline and the previously mentioned hidden object games, does not add much to the experience.\n\nThe gameplay is simple enough, you have to lead a liquid from the start of a maze to the end by matching tiles to open up paths. Most of it is pretty straight forward but the game does add in a few special puzzles and traps as you progress however the really interesting ones only show up in the very last levels and you don't really feel challenged until then. You get a few special abilities that are charged by matching tiles of a specific color however their use is mostly limited to the areas where they are required to progress.\n\nOne bug that kept annoying me throughout the game was that the on-screen arrow that shows you which direction you need to go always blocks your view of a tile.\n\nAll in all there is not much to see here. The game is not impressive or interesting and the fact that the individual levels are fairly lengthy means it does not even qualify as a decent timesink. Not a good game to buy.","May 11, 2013","false","52.6"," 12 of 17 people (71%) found this review helpful 1 person found this review funny","71","12","17","0","0"
"http://steamcommunity.com/id/flamingmonocle/recommended/47000/","flamingmonocle","Flaming Monocle","http://steamcommunity.com/id/flamingmonocle/","3680 products in account","What can I say, I want nothing more than to say this is a juvenile puzzle game with a cutesy story, and zero real plot development and terrible graphics and gameplay.\n\nMost of that however is not true.\n\nYes, this game does look like it's aimed at the younger casual player, and yes, the story is sugar fried in honey, and the plot is merely a device to keep you playing the game... and yes - the graphics are by no means revolutionary...\n\nBut by the gods is this game addictive.\n\nAfter playing the obligatory amount to formulate a review, I found myself determined to finish the game, which involves firstly 'Unlocking' one of four books of elements - cue an object-finding puzzle, which doesn't penalise you for being slow at, and it's just as well, because the puzzles are very intricate, and have several 'layers' of object mechanics. You may need to find an object to uncover a button which opens a chest which has part of another object inside - and so on. Once you've solved the puzzle and opened the book, you are faced with the task of collecting four 'cards' featuring a different mythical creature or race. You do this by playing two different puzzles - a series of 'spot the difference' games, and the main bulk of the game: a series of four puzzles whereby you must direct the flow of 'magic' to a given point by destroying groups of gems.\n\nThe plot is all by-the-by if you just want to play the puzzles, which is great, because the storytelling isn't exactly stellar. But the gameplay more than makes up for it.\n\nI dare you not to become addicted to this game - and determined to keep playing until you finish the last book!\n\nI've recorded a short gameplay video of the beginning sequence, which documents how to play all three different types of puzzles:\n\nhttps://www.youtube.com/watch?v=Q00x_q4RX8o","March 2, 2015","true","7.8"," 7 of 8 people (88%) found this review helpful 1 person found this review funny","88","7","8","0","0"
"http://steamcommunity.com/id/JDisOwO/recommended/47000/","JDisOwO","JD OwO","http://steamcommunity.com/id/JDisOwO/","1116 products in account","Great puzzle game with a developed storyline and entertaining gameplay. Graphics and music are good, while difficulty is also well-balanced.\n\nGive it a shot if you like to play light puzzle games as time killers.\n\n4 Elements\n[7/10]","April 27, 2014","true","25.9"," 8 of 10 people (80%) found this review helpful","80","8","10","0","0"
"http://steamcommunity.com/profiles/76561198128149213/recommended/47000/","76561198128149213","Judge479","http://steamcommunity.com/profiles/76561198128149213/","33 products in account","I do not recommend purchasing this game or any other titles developed by Playrix. 4 Elements has not worked since october 2105 and no amount of support tickets or complaints by the community has recieved any replies.\n\nDo yourself a favor and research the many problems people have had in their dealings with Playrix before deciding to purchase any of their products. The best advice I can give you is don't waste your money,","December 7, 2015","false","15.6"," 10 of 14 people (71%) found this review helpful","71","10","14","0","0"
