"url","reviewerUsername","reviewerDisplayName","reviewerUrl","reviewerProductsCount","reviewText","date","recommended","hoursPlayed","voteText","helpfulPercent","votesHelpful","votesTotal","votesFunny","commentsCount"
"http://steamcommunity.com/profiles/76561198024920171/recommended/47000/","76561198024920171","Brakkish","http://steamcommunity.com/profiles/76561198024920171/","521 products in account","Played this on a tablet and liked it enough to purchase it again on steam. This version looks like a crappy port (with no graphical improvements for PC), but still fun. Hesitantly recommend if you've never played it before.","January 2, 2015","true","4.3"," No ratings yet","0","0","0","0","0"
"http://steamcommunity.com/id/gamehits/recommended/47000/","gamehits","gamehits","http://steamcommunity.com/id/gamehits/","1889 products in account","fun. difficulty ramps up and the graphics are elementary, but overall it's a replay! yes!","December 28, 2014","true","3.4"," No ratings yet","0","0","0","0","0"
"http://steamcommunity.com/id/rocky1138/recommended/47000/","rocky1138","Rocky1138","http://steamcommunity.com/id/rocky1138/","687 products in account","Out of five stars, I would give this game 2.\n\nIt's got nice artwork and the game isn't buggy.\n\nThe problem is with the core game mechanics. You can't control where the camera goes and so the thrill and reward of making large chains is denied. This is especially frustrating when you can see a large chain at the beginning when the camera is zooming around but when it comes near to the point of a large chain, the camera doesn't go far enough and you can't complete it. A much better game would allow the player complete control of the camera.","December 25, 2014","false","13.2"," No ratings yet","0","0","0","0","0"
"http://steamcommunity.com/id/dsloon/recommended/47000/","dsloon","dsloon","http://steamcommunity.com/id/dsloon/","128 products in account","It's magical, fun, and insanely addictive.  I'm currently working on my fourth playthrough - can't recommend it enough!","December 25, 2014","true","128.8"," No ratings yet","0","0","0","0","0"
"http://steamcommunity.com/profiles/76561197988509067/recommended/47000/","76561197988509067","Gravesmeister","http://steamcommunity.com/profiles/76561197988509067/","68 products in account","One of the better puzzle games I've played.","December 25, 2014","true","6.4"," No ratings yet","0","0","0","0","0"
"http://steamcommunity.com/profiles/76561198001367201/recommended/47000/","76561198001367201","Pixy Misa","http://steamcommunity.com/profiles/76561198001367201/","1117 products in account","A polished and surprisingly satisfying puzzle game.  New elements are added to the puzzles at just the right rate to keep you on your toes without every feeling overwhelmed or (worse) bored.","December 27, 2014","true","19.0"," No ratings yet","0","0","0","0","0"
"http://steamcommunity.com/profiles/76561198102251403/recommended/47000/","76561198102251403","mechashadow7","http://steamcommunity.com/profiles/76561198102251403/","87 products in account","A fun game that gets surpisingly complex in the later levels, and very easy to get lost in. I bought it, started playing it, next thing I knew I'd been up all night and was still plugging along determined to finish. Has pretty good replayablity, because even though the layout of the levels doesn't change, the rng of the gem placement makes it differrent everytime.","December 18, 2014","true","21.4"," No ratings yet","0","0","0","0","0"
"http://steamcommunity.com/profiles/76561198120650301/recommended/47000/","76561198120650301","YoshiRider","http://steamcommunity.com/profiles/76561198120650301/","279 products in account","Could have been a good game. It is fun to play for the first hour. Unfortunatley the story is not really interesting why I had the feeling that progress is not rewarded. Level design and tasks are repeating themself very early on and the game becomes boring soon.","December 24, 2014","false","13.6"," No ratings yet","0","0","0","0","0"
"http://steamcommunity.com/id/Remy_D_Marquis/recommended/47000/","Remy_D_Marquis","Remy D. Marquis","http://steamcommunity.com/id/Remy_D_Marquis/","695 products in account","A really fun game to kill time","December 10, 2014","true","26.4"," No ratings yet","0","0","0","0","0"
"http://steamcommunity.com/profiles/76561198064586532/recommended/47000/","76561198064586532","Blkik","http://steamcommunity.com/profiles/76561198064586532/","140 products in account","Too easy.\nToo childish.\nBored quickly.\n\nAfter played 20 levers i realized i don't want another.\nThe differences between the levers are subtle","July 29, 2014","false","1.7"," No ratings yet","0","0","0","0","0"
"http://steamcommunity.com/id/galyndean/recommended/47000/","galyndean","Galyndean","http://steamcommunity.com/id/galyndean/","115 products in account","I got this game when it was 79 cents.  It's a nice 'match three' (or more) type game with some interesting mechanics.  I beat it after ten hours, so I think I got my money's worth.  Not sure how much replay value there is, as I'm pretty sure you would just replay the levels over again.  Overall difficulty was not very hard.  There were only a couple levels that took more than once for me to beat and those were near the end of the game.\n\nIf you like match 3 type games, I'd recommend this one if it's on sale.","April 23, 2015","true","10.2"," No ratings yet","0","0","0","0","0"
"http://steamcommunity.com/profiles/76561198035697980/recommended/47000/","76561198035697980","zappa","http://steamcommunity.com/profiles/76561198035697980/","75 products in account","89¢ divided by 2.7 hours = thumbs up.\n\nGood casual game.","April 14, 2015","true","8.8"," No ratings yet","0","0","0","0","0"
"http://steamcommunity.com/id/chdanu/recommended/47000/","chdanu","Maelstrom","http://steamcommunity.com/id/chdanu/","146 products in account","This game is one of those hidden gems.  It's got hidden objects, but it's not nothing but hidden objects, it's got puzzles, it's got dragons, it's a good soundtrack, and a total excuse plot.  I totally recommend picking up this game, especially if it's on sale.","March 16, 2014","true","9.9"," No ratings yet","0","0","0","0","0"
"http://steamcommunity.com/id/purplespandex/recommended/47000/","purplespandex","Purple Spandex","http://steamcommunity.com/id/purplespandex/","667 products in account","Honestly better than I was expecting. If you are looking for a puzzle game that is OK and runs at a bad resolution this is the game for you.","July 12, 2012","true","10.2"," No ratings yet","0","0","0","0","0"
"http://steamcommunity.com/id/riveriss/recommended/47000/","riveriss","Silver","http://steamcommunity.com/id/riveriss/","1077 products in account","Varied, fun, great game in category with a lot of goals, collectible cards - but for god's sake, the last levels are extremly insane! 7/10","May 30, 2014","true","7.4"," No ratings yet","0","0","0","0","0"
"http://steamcommunity.com/profiles/76561197973880388/recommended/47000/","76561197973880388","Lornie","http://steamcommunity.com/profiles/76561197973880388/","730 products in account","Its an OK puzzle game.  I beat it fairly quickly, and it doesn't have much replay value.  The setting is the most generic fantasy setting ever, they probally did that on purpose.  It was fun while it lasted.","May 31, 2014","true","12.2"," No ratings yet","0","0","0","0","0"
"http://steamcommunity.com/profiles/76561198029900005/recommended/47000/","76561198029900005","tigrawd","http://steamcommunity.com/profiles/76561198029900005/","60 products in account","Fun Challenging Game","May 31, 2014","true","13.7"," No ratings yet","0","0","0","0","0"
"http://steamcommunity.com/id/ginjaninja88/recommended/47000/","ginjaninja88","ginjaninja88","http://steamcommunity.com/id/ginjaninja88/","777 products in account","I have to confess originally I bought this game purely for my wife who loves nothing more than casual games involving blowing up multi coloured blocks or games where you click and find. This game incorporates both those elements , by switching the levels from block bashing to point and find ever so often. Nearly three hours of playtime have been had on this game and my wife hasnt played a single minute , for i have hogged this game for it is so addictive to chain massive combos. This game really did surprise me on how much i enjoyed it.\n73%","December 29, 2011","true","11.6"," No ratings yet","0","0","0","0","0"
"http://steamcommunity.com/profiles/76561198072390811/recommended/47000/","76561198072390811","Your Momma","http://steamcommunity.com/profiles/76561198072390811/","77 products in account","Excellent game. Cleverly made, beautifully drawn; even the story has a good bit of charm if not originality.\nWhile it is not the type of game that will keep you up at night or blow your mind (to be fair, few casual games are!), you may well find yourself staying up to play just one more level... again, and again, and again.\nI highly recommend this game to people (who deal) with children. Especially if you want to introduce said children to the wonderful world of fantasy and fairy tells. This could be the first step, followed by Trine and then the Elder Scrolls :)))\n\n","June 7, 2014","true","3.9"," No ratings yet","0","0","0","0","0"
"http://steamcommunity.com/id/zfish96/recommended/47000/","zfish96","zfish96","http://steamcommunity.com/id/zfish96/","11 products in account","One of my favorites","May 26, 2014","true","8.6"," No ratings yet","0","0","0","0","0"
"http://steamcommunity.com/profiles/76561198039619705/recommended/47000/","76561198039619705","AngelofNoMercyX","http://steamcommunity.com/profiles/76561198039619705/","3956 products in account","I am going to lightly recommend this mostly because it is obvious that a tremendous amount of care went into this game.  The game is a variation on the match 3 genre. There is some nice variety between the four elements but the last two (wind and water) are obviously the most polished.  There are some really nice backgrounds with some animation (like fish swimming in some of the water levels).  The story is minimal but nice although the ending is really anticlimactic.  SPOILER   The intro has voiceover and more than one image but the ending is only a static image and some scrolling text.    After each four levels is a spot the difference game and once for each element there is a hidden object game.  You cannot revisit levels you have already played without starting a new game because there is only the linear story.  Also disappointing is the fact that you cannot scroll around a level and some of the action will happen offscreen at times.\n\nIn summary, this is a casual game in the match 3 genre with some nice polish that slightly outweighs its faults.","May 3, 2014","true","21.4"," No ratings yet","0","0","0","0","0"
"http://steamcommunity.com/profiles/76561198079017859/recommended/47000/","76561198079017859","Aira","http://steamcommunity.com/profiles/76561198079017859/","508 products in account","Nice match-three game with some interesting, original mechanics. I enjoyed playing it, for the most part. It does have its downsides, though. First of all, you can't go back and re-play levels, or select your level at all. You're forced to progress level by level, which I think is a massive oversight in a game like this. Some of the achievements don't seem to work. Some of the levels are based on sheer luck, or force you to just grind to build up your power-ups, which I dislike. There is a time limit on each level, but this is not obvious and not pointed out to you until you're a good ways into the game.\n\nIf you're looking for a different kind of match-three game, you'll have some fun with this. Just be aware of the downsides and don't expect anything amazing.","May 3, 2014","true","7.2"," No ratings yet","0","0","0","0","0"
"http://steamcommunity.com/id/barrabus/recommended/47000/","barrabus","Barrabus","http://steamcommunity.com/id/barrabus/","661 products in account","Decently fun puzzle game. It's reasonably easy to get 100% of the achievements if you're looking for games to get perfect completion.","May 6, 2014","true","9.6"," No ratings yet","0","0","0","0","0"
"http://steamcommunity.com/id/Soluna/recommended/47000/","Soluna","Soluna","http://steamcommunity.com/id/Soluna/","523 products in account","Classic time vampire, good puzzle based casual game.","September 12, 2013","true","1.6"," No ratings yet","0","0","0","0","0"
"http://steamcommunity.com/profiles/76561198019606155/recommended/47000/","76561198019606155","lovecraft2","http://steamcommunity.com/profiles/76561198019606155/","709 products in account","Pour le prix une trés bonne détente et finalement pas mal de reflexion","November 11, 2012","true","13.3"," No ratings yet","0","0","0","0","0"
"http://steamcommunity.com/id/SZ2/recommended/47000/","SZ2","Lv100 Magikarp","http://steamcommunity.com/id/SZ2/","849 products in account","Nice little casual game.","November 27, 2013","true","3.6"," No ratings yet","0","0","0","0","0"
"http://steamcommunity.com/id/the42nddruid/recommended/47000/","the42nddruid","Druid42","http://steamcommunity.com/id/the42nddruid/","652 products in account","A fun little puzzle game. Not worth full price though.","July 3, 2011","true","3.0"," No ratings yet","0","0","0","0","0"
"http://steamcommunity.com/profiles/76561198031782599/recommended/47000/","76561198031782599","Devs","http://steamcommunity.com/profiles/76561198031782599/","257 products in account","Great pass time,good one to have in library.","January 30, 2014","true","10.1"," No ratings yet","0","0","0","0","0"
"http://steamcommunity.com/id/happycerberus/recommended/47000/","happycerberus","Happy.Cerberus","http://steamcommunity.com/id/happycerberus/","1811 products in account","TL;DR: Small puzzle game. If you like bejewelled, and similar games, you will like this one. Low graphical fidelity.\n\nI would recommend this game to players who like puzzle games. This one is short and can feel a bit repetetive, but well, that is sort of the point of most puzzle games. You sit down, do a stage or two and then move on with your life.\n\nOne big drawback is the low graphical fidelity of the game.","February 2, 2014","true","9.3"," No ratings yet","0","0","0","0","0"
"http://steamcommunity.com/id/badastro/recommended/47000/","badastro","BadAstronaut","http://steamcommunity.com/id/badastro/","441 products in account","This game is a great way to while away a couple of hours. You can quit and save progress after every level. It's simple to learn, is easy pick-up and play, and you can buy it pretty cheap too. Fun match three (or more) with some unique 'items' (spades, bombs etc) and different block types. Not bad at all.","January 20, 2014","true","0.9"," No ratings yet","0","0","0","0","0"
"http://steamcommunity.com/profiles/76561198137069780/recommended/47000/","76561198137069780","StreetTuff","http://steamcommunity.com/profiles/76561198137069780/","129 products in account","Lots of fun, addictive.","June 25, 2014","true","16.7"," No ratings yet","0","0","0","0","0"
"http://steamcommunity.com/id/fatcatx/recommended/47000/","fatcatx","FatCatX","http://steamcommunity.com/id/fatcatx/","684 products in account","Nicely rendered casual game.","July 3, 2011","true","11.2"," No ratings yet","0","0","0","0","0"
"http://steamcommunity.com/id/remyys/recommended/47000/","remyys","Remy Ys","http://steamcommunity.com/id/remyys/","204 products in account","Easy and beautiful but short :-(","April 6, 2014","true","10.4"," No ratings yet","0","0","0","0","0"
"http://steamcommunity.com/id/zfish96/recommended/47000/","zfish96","zfish96","http://steamcommunity.com/id/zfish96/","11 products in account","One of my favorites","May 26, 2014","true","8.6"," No ratings yet","0","0","0","0","0"
"http://steamcommunity.com/id/GothicHM/recommended/47000/","GothicHM","GothicHM","http://steamcommunity.com/id/GothicHM/","236 products in account","simple connect puzzle game 65/100","June 23, 2011","true","10.8"," No ratings yet","0","0","0","0","0"
"http://steamcommunity.com/id/criticalcomposer/recommended/47000/","criticalcomposer","CriticalComposer","http://steamcommunity.com/id/criticalcomposer/","980 products in account","A fun game when you just want to kick back and kill some time without really thinking about it.","February 15, 2013","true","8.5"," No ratings yet","0","0","0","0","0"
"http://steamcommunity.com/id/netherfiend/recommended/47000/","netherfiend","Netherfiend","http://steamcommunity.com/id/netherfiend/","944 products in account","A fun gem matching game. No frills, but enjoyable and challenging. A few hidden picture puzzles and find the difference puzzles keep the tedium at bay.","June 5, 2013","true","34.3"," No ratings yet","0","0","0","0","0"
"http://steamcommunity.com/id/Soluna/recommended/47000/","Soluna","Soluna","http://steamcommunity.com/id/Soluna/","523 products in account","Classic time vampire, good puzzle based casual game.","September 12, 2013","true","1.6"," No ratings yet","0","0","0","0","0"
"http://steamcommunity.com/profiles/76561198019606155/recommended/47000/","76561198019606155","lovecraft2","http://steamcommunity.com/profiles/76561198019606155/","709 products in account","Pour le prix une trés bonne détente et finalement pas mal de reflexion","November 11, 2012","true","13.3"," No ratings yet","0","0","0","0","0"
"http://steamcommunity.com/id/SZ2/recommended/47000/","SZ2","Lv100 Magikarp","http://steamcommunity.com/id/SZ2/","849 products in account","Nice little casual game.","November 27, 2013","true","3.6"," No ratings yet","0","0","0","0","0"
"http://steamcommunity.com/id/sparrowswings/recommended/47000/","sparrowswings","Sparrow","http://steamcommunity.com/id/sparrowswings/","317 products in account","This is an excellent game to play when you want to play a game, but are too god damned stoned to play a game of real substance. You could play Bejeweled, I guess, but if you buy it you're giving EA money, so play this instead.","April 4, 2013","true","2.1"," No ratings yet","0","0","0","0","0"
"http://steamcommunity.com/id/drshows/recommended/47000/","drshows","drshows","http://steamcommunity.com/id/drshows/","301 products in account","4 Elements is another connect-the-pieces type game.  The adventure elements are a nice addition, but aren't as good as the video makes out.  If you enjoy games like Bejeweled 3 and 7 Wonders - Ancient Aliens then I suggest 4 elements.","November 30, 2013","true","12.8"," No ratings yet","0","0","0","0","0"
"http://steamcommunity.com/id/andrew-film/recommended/47000/","andrew-film","andrew-film","http://steamcommunity.com/id/andrew-film/","999 products in account","4 Elements is a nice little puzzle. Not very challenging, but captivating, nice variety of mini-games and 64 levels. It took me 15 hours to complete it.","July 21, 2012","true","14.4"," No ratings yet","0","0","0","0","0"
"http://steamcommunity.com/id/rawfoodgamer/recommended/47000/","rawfoodgamer","Jojen Paste","http://steamcommunity.com/id/rawfoodgamer/","1786 products in account","4 Elements is a nicely executed match-3 game . The game has 3 types of levels - a kind of match 3 level, a find hidden objects level and a find the differences between 2 images level.\n\nThe theme (plot) of the game is to restore the 4 elemental books. The way to do so is to first unlock the elemental book by playing a 'find hidden object' level. Then you have to unlock 4 cards for each elemental book. To unlock each card, you need to complete 4 objective based match 3 levels followed by a 'find the differences' level. There are 4 books - in total so 4 'find hidden object' levels. There are 4 cards per book so 64 (4x4x4) match 3 levels and 16 (4x4) 'find the differences' levels. So, although the game officially just tracks 64 levels, in total there are 84.\n\nThe match 3 levels have a maze like design. You start at one point and need to reach another point within allocated time. There are 4 power ups which help you on the way. These power ups charge as you match more of the same colored gems.\n\nThis is a good game to play when waiting for matchmade/MOBA games.","January 2, 2014","true","21.7"," No ratings yet","0","0","0","0","0"
"http://steamcommunity.com/id/mahoumikekun/recommended/47000/","mahoumikekun","♡ Taryn ♡","http://steamcommunity.com/id/mahoumikekun/","496 products in account","4 Elements is a casual puzzle game with a whimsical theme and clever gameplay mechanics. Although puzzlers certainly aren't for everyone, and its difficulty isn't exactly chart-topping, I had a lot of fun playing through the game and adding magical creatures to my spell book. I wouldn't say this is a must-buy, but if you're looking for a fun, yet simple puzzle game to pass the time while in class or on the bus or something, I'd say to go for it.","January 6, 2014","true","8.1"," No ratings yet","0","0","0","0","0"
"http://steamcommunity.com/profiles/76561198121318320/recommended/47000/","76561198121318320","Gianna627","http://steamcommunity.com/profiles/76561198121318320/","19 products in account","fun relaxing type of game to just zone out on....     really enjoyed it","January 9, 2014","true","34.3"," No ratings yet","0","0","0","0","0"
"http://steamcommunity.com/profiles/76561198031782599/recommended/47000/","76561198031782599","Devs","http://steamcommunity.com/profiles/76561198031782599/","257 products in account","Great pass time,good one to have in library.","January 30, 2014","true","10.1"," No ratings yet","0","0","0","0","0"
"http://steamcommunity.com/id/happycerberus/recommended/47000/","happycerberus","Happy.Cerberus","http://steamcommunity.com/id/happycerberus/","1811 products in account","TL;DR: Small puzzle game. If you like bejewelled, and similar games, you will like this one. Low graphical fidelity.\n\nI would recommend this game to players who like puzzle games. This one is short and can feel a bit repetetive, but well, that is sort of the point of most puzzle games. You sit down, do a stage or two and then move on with your life.\n\nOne big drawback is the low graphical fidelity of the game.","February 2, 2014","true","9.3"," No ratings yet","0","0","0","0","0"
"http://steamcommunity.com/id/Tekjet/recommended/47000/","Tekjet","Tekjet","http://steamcommunity.com/id/Tekjet/","2421 products in account","Pretty standard color-matching game. Nothing special.","December 17, 2011","true","15.0"," No ratings yet","0","0","0","0","0"
"http://steamcommunity.com/id/NeiroAtOpelCC/recommended/47000/","NeiroAtOpelCC","Neiro","http://steamcommunity.com/id/NeiroAtOpelCC/","2888 products in account","Nifty little bejewelled clone with added 'story' elements and some occassional puzzles mixed in","February 5, 2014","true","1.4"," No ratings yet","0","0","0","0","0"
"http://steamcommunity.com/profiles/76561198122354912/recommended/47000/","76561198122354912","Aliganna","http://steamcommunity.com/profiles/76561198122354912/","102 products in account","Good puzzel game. I found it relaxing to play and a good game to waste time when you needed to.","May 13, 2015","true","14.7"," No ratings yet","0","0","0","0","0"
"http://steamcommunity.com/profiles/76561198173423249/recommended/47000/","76561198173423249","Tokimi","http://steamcommunity.com/profiles/76561198173423249/","166 products in account","This is a really cute if you are looking for a good way to spend a few hours with a casual game. A mix of jewel matching and hidden object levels, there are enough levels to keep you going for a while.","May 2, 2015","true","13.5"," No ratings yet","0","0","0","0","0"
"http://steamcommunity.com/id/galyndean/recommended/47000/","galyndean","Galyndean","http://steamcommunity.com/id/galyndean/","115 products in account","I got this game when it was 79 cents.  It's a nice 'match three' (or more) type game with some interesting mechanics.  I beat it after ten hours, so I think I got my money's worth.  Not sure how much replay value there is, as I'm pretty sure you would just replay the levels over again.  Overall difficulty was not very hard.  There were only a couple levels that took more than once for me to beat and those were near the end of the game.\n\nIf you like match 3 type games, I'd recommend this one if it's on sale.","April 23, 2015","true","10.2"," No ratings yet","0","0","0","0","0"
"http://steamcommunity.com/id/zfish96/recommended/47000/","zfish96","zfish96","http://steamcommunity.com/id/zfish96/","11 products in account","One of my favorites","May 26, 2014","true","8.6"," No ratings yet","0","0","0","0","0"
"http://steamcommunity.com/profiles/76561198061478179/recommended/47000/","76561198061478179","eidheann","http://steamcommunity.com/profiles/76561198061478179/","18 products in account","Generally fun, a clever take on a bead matching game. Only issue I have is the final book changes the tactics entirely, away from a focus on longer chains and into powerup management in tight quarters.","March 23, 2014","true","28.8"," No ratings yet","0","0","0","0","0"
"http://steamcommunity.com/id/remyys/recommended/47000/","remyys","Remy Ys","http://steamcommunity.com/id/remyys/","204 products in account","Easy and beautiful but short :-(","April 6, 2014","true","10.4"," No ratings yet","0","0","0","0","0"
"http://steamcommunity.com/profiles/76561198047529272/recommended/47000/","76561198047529272","Griffin_Myth","http://steamcommunity.com/profiles/76561198047529272/","44 products in account","I've had a lot of fun playing this game and also the sequel to 4 elements. I hope future players will feel the say as they experience the fun puzzles that make up the game.","July 31, 2014","true","11.0"," No ratings yet","0","0","0","0","0"
