"url","reviewerUsername","reviewerDisplayName","reviewerUrl","reviewerProductsCount","reviewText","date","recommended","hoursPlayed","voteText","helpfulPercent","votesHelpful","votesTotal","votesFunny","commentsCount"
"http://steamcommunity.com/profiles/76561198185420845/recommended/47000/","76561198185420845","Regal_Witch13","http://steamcommunity.com/profiles/76561198185420845/","6 products in account","Great game, I've played the 4 Elements 2 special edition for the xbox on my pc, and I love it, so I figured I would give this one a try. It's just as enjoyable to play and easy to follow along.","June 30, 2015","true","13.0"," 1 person found this review helpful","0","1","1","0","0"
"http://steamcommunity.com/profiles/76561198060034265/recommended/47000/","76561198060034265","asle","http://steamcommunity.com/profiles/76561198060034265/","116 products in account","Yet another "match 3"-like game. Though, this time, no tile to move but tiles to select, starting at 3 that have at least one border in common. The more you link, the better. At 5 linked (or more) an explosion happens, clearing more background and tiles. Some more options can be set during the game (bomb, swap tile, etc.), provided you filled them up first. Throught the four books, representing the elements, there are four "find the differences" mini games per book, and one other "find the object" mini game per book.\nThat's the basic of gameplay. Design wise, it's a very pleasant trip. The graphics are beautiful and music is relaxing. "4 Elements" starts easy but quickly becomes challenging. Near the end, it leans towards the very difficult.\nAround the last levels (amongst 66) the automated camera may show a part of the screen that isn't very useful. And that's  about the only issue I've found.","December 1, 2013","true","19.1"," 1 person found this review helpful","0","1","1","0","0"
"http://steamcommunity.com/id/Ploxiii/recommended/47000/","Ploxiii","^Ploxii.A4","http://steamcommunity.com/id/Ploxiii/","73 products in account","I recommend this game for people that is bored alot on your PCs. Its a great time consumer, and its accualy pretty fun!\nI realy like it.\n","April 16, 2015","true","7.5"," 1 person found this review helpful","0","1","1","0","0"
"http://steamcommunity.com/id/erign/recommended/47000/","erign","bagels","http://steamcommunity.com/id/erign/","230 products in account","I loved this. Relaxing time killer that is actually a bit of a challenge due to the board being randomly generated. Could have been a little longer. :)","June 30, 2015","true","25.6"," 1 person found this review helpful","0","1","1","0","0"
"http://steamcommunity.com/profiles/76561198083846953/recommended/47000/","76561198083846953","IceMan","http://steamcommunity.com/profiles/76561198083846953/","44 products in account","nice game","June 26, 2015","true","4.1"," 1 person found this review helpful","0","1","1","0","0"
"http://steamcommunity.com/id/hitzk/recommended/47000/","hitzk","Hitzk","http://steamcommunity.com/id/hitzk/","87 products in account","Good fun game. Not much of puzzle elements (which is good thing for me, as play it to have light, casual fun). It has some hidden objects segments and "Find the difference" as well, which are fun.\nGood color scheme and nice graphics. Me and my 4 year daughter are loving it.","July 28, 2015","true","20.0"," 1 person found this review helpful","0","1","1","0","0"
"http://steamcommunity.com/id/Uniflame/recommended/47000/","Uniflame","Uniflame","http://steamcommunity.com/id/Uniflame/","83 products in account","Picked this up for 99 cent. You have to restore the elements by making chains of the same colored gems. The basics are simple but the obstacles get harder and sometimes you will have to play a level multiple times before you know how to clear it. But it never got me frustrated so the difficulty level was perfect for me. There are 64 levels, and in between there are some other puzzles to restore the books of elements. This game kept me busy for about 9 hours, so that is good value for just 99 cents.","July 12, 2015","true","9.9"," 1 person found this review helpful","0","1","1","0","0"
"http://steamcommunity.com/id/danbull/recommended/47000/","danbull","Dan Bull","http://steamcommunity.com/id/danbull/","2604 products in account","A fluid, addictive gem swapping game that gently ramps up the difficulty, and switches the pace with some puzzles now and again. Worth a blast.","October 12, 2015","true","9.9"," 1 person found this review helpful","0","1","1","0","0"
"http://steamcommunity.com/id/Goands/recommended/47000/","Goands","Gonads","http://steamcommunity.com/id/Goands/","769 products in account","DON'T BUY IT! I love puzzle RPGs but this was really boring and repetitive. Only played through it because of my OCD for achievments and feeling like I wanted to get my moneys worth. You only get 4 spells which you get in the first area or two and use throughout. The spot the difference puzzles were too easy even when windowed so I could barely see the pictures. The object finding puzzles were entertaining but there are only 4 and most of the items are really easy to spot with a few being almost impossible to see. Only the last few levels were interesting. Also I got excited about voice acting at the start but that is the only time there is any, not even some at the end.\n\nBasically I am minutely irritated that I have spent £5 on it and many hours of my life. Why didn't I just play puzzle quest. Could have completed it by now.","June 3, 2011","false","10.1"," 1 person found this review helpful","0","1","1","0","0"
"http://steamcommunity.com/profiles/76561198088376827/recommended/47000/","76561198088376827","carash00","http://steamcommunity.com/profiles/76561198088376827/","308 products in account","This game is perfect for anytime u just want to while away some time having some fun but not having to really think or save your self from being eaten or shot.","December 31, 2015","true","179.5"," 1 person found this review helpful","0","1","1","0","0"
"http://steamcommunity.com/profiles/76561198126715118/recommended/47000/","76561198126715118","zipper4613","http://steamcommunity.com/profiles/76561198126715118/","231 products in account","I have played this for years.  If you like Match 3 games this is a "must have".","January 15","true","3.7"," 1 person found this review helpful","0","1","1","0","0"
"http://steamcommunity.com/id/PrimalWeaponsXX/recommended/47000/","PrimalWeaponsXX","PrimalWeaponsXX","http://steamcommunity.com/id/PrimalWeaponsXX/","21 products in account","Very addicting and very fun.  Has a mini game that reminds me of Tetris.","May 22","true","6.4"," 1 person found this review helpful","0","1","1","0","0"
"http://steamcommunity.com/profiles/76561198097916337/recommended/47000/","76561198097916337","Fistful0fMetal","http://steamcommunity.com/profiles/76561198097916337/","425 products in account","Can recommend now the game is fixed and no crash on start up.","March 13","true","2.1"," 1 person found this review helpful","0","1","1","0","0"
"http://steamcommunity.com/profiles/76561197971716114/recommended/47000/","76561197971716114","Disciple1968","http://steamcommunity.com/profiles/76561197971716114/","784 products in account","This is a excellent 3+in a row game, with dashes of spot the difference and hidden object thrown in. Some varied powerups add to the strategy side of it and at times can really be a game changer. Great for a doing a couple of levels here and there or for when you are not in the mood for a serious game session. Not massively challenging though that's half it's beauty; a relaxing game at which you can amble along taking you time. A very basic story helps join all the levels together and keep the flow of game going.\n\nHighly recommended, just don't expect anything jaw dropping.","March 26","true","19.0"," 1 person found this review helpful","0","1","1","0","0"
"http://steamcommunity.com/profiles/76561197990287930/recommended/47000/","76561197990287930","jhall41647","http://steamcommunity.com/profiles/76561197990287930/","106 products in account","great game play on window 7 and 10","April 3","true","36.0"," 1 person found this review helpful","0","1","1","0","0"
"http://steamcommunity.com/profiles/76561198034601961/recommended/47000/","76561198034601961","The !mmoꝚTaℒs of m€Lµℎa","http://steamcommunity.com/profiles/76561198034601961/","69 products in account","One of the Best Match 3 Puzzler <3\n9.5/10","April 23","true","1.4"," 1 person found this review helpful","0","1","1","0","0"
"http://steamcommunity.com/id/leviathancain/recommended/47000/","leviathancain","leviathancain","http://steamcommunity.com/id/leviathancain/","88 products in account","This game is now working again, and i am enjoying it quite emensely. a steal at 19 cents when i bought it","May 14","true","15.8"," 1 person found this review helpful","0","1","1","0","0"
"http://steamcommunity.com/id/Naxame/recommended/47000/","Naxame","Naxame","http://steamcommunity.com/id/Naxame/","62 products in account","I played this game when I was young so I was happy to see this and its a good time-waster but I wish they'd have an option to [Skip Tutorial] because it annoyed me...","May 17","true","13.6"," 1 person found this review helpful 1 person found this review funny","0","1","1","0","0"
"http://steamcommunity.com/id/Elventin/recommended/47000/","Elventin","Elventin","http://steamcommunity.com/id/Elventin/","191 products in account","i love this super fun and relaxing nice game to pass the time away :)","May 20","true","1.3"," 1 person found this review helpful","0","1","1","0","0"
"http://steamcommunity.com/profiles/76561198179974283/recommended/47000/","76561198179974283","fredex","http://steamcommunity.com/profiles/76561198179974283/","15 products in account","I'd recommend this when it is on sale - it's nice to play a casual match three game without constantly being spammed by flashing adverts or demands for money to buy lives, energy, sausages and... whatever other nonsense the developer decided to put in to scam money out of people. 2008 was a much simplier time...\n\nOtherwise I probably wouldn't recommend it though solely because... it's from 2008. That means 800x600 resolution that messes with my desktop and results in other programs getting rescaled and thrown all over the place and my monitor flashing up a warning to change the resolution every time I start the game. There is no option to change the resolution... because it was 2008 and 1080p was like something out of 2001.\n\nYour options are limited to playing fullscreen with horribly stretched graphics and the desktop suffering or playing in a tiny window too small to see anything. As I say... fun if it is cheap and on sale but otherwise probably not worth it.","May 20","true","2.1"," 1 person found this review helpful","0","1","1","0","0"
"http://steamcommunity.com/profiles/76561198065819152/recommended/47000/","76561198065819152","ジェイ･シー","http://steamcommunity.com/profiles/76561198065819152/","418 products in account","This game is hit-or-miss, play it only if you like a few hours of simple but time-limited puzzle-solving. Whatever else the game pretended to offer (story, achievements or what have you) it's not very appealing to me. I enjoyed the basic campaign puzzle solving, and that's enough for me.","February 26","true","10.8"," 1 person found this review helpful","0","1","1","0","0"
"http://steamcommunity.com/id/34df693mFs/recommended/47000/","34df693mFs","Marona","http://steamcommunity.com/id/34df693mFs/","659 products in account","There is a good range of games within this game. Match three(not swap) game is the main one. There are also spot the difference and hidden object within the adventure mode of the game. Pretty fun if you ask me.","February 2, 2014","true","9.5"," 1 person found this review helpful","0","1","1","0","0"
"http://steamcommunity.com/id/Nawrusi/recommended/47000/","Nawrusi","Nawrusi","http://steamcommunity.com/id/Nawrusi/","789 products in account","Mini games amd colour maching the game.\n\nintroduction:\nTo start out with, you are introduced to the story, wich involve the elements running amok in a magical world. We are told to restore peace to each element; earth, wind, fire, and water. On the menu screen we can see all the levls representet by books and gems, and we get an idea of how long this game is going to take.\n\nTherefore I felt the introduction to be really boring. It shows the whole game from the get go, and there are no surprises along the way.\n\nGamplay:\nThe gamepaly is split up into 3 diffrent games, where one acts as the main game, while the others are mini-games. The main game is very simple, match coloured blocks in a chain, in order to make sand dissaper. When the sand is gone, the water you need to get to the end of the stage can continue to flow. After you let the water flow to the end, you win the level.\n\nThe levels have diffrent obsticles along the way that can block the way to completion, these items is for eksample rocks.\n\nThe levels are getting harder along the way, but you also unlock power-ups, that will help you to reach the goal. The power-ups fells really overpowered, and can easily make the game a win for you, nearly every single time. This was a huge letdown for me, since I never really felt challenged. The powerups can be things like changing around blocks and blowing up paths.\n\nThe two mini games are done, in order to unlock new levels. The first one is a "spot the diffrence" game, where you click a place on a picture, to spot the flaw on the other picture.\n\nThe other part is a "find the objects" game, where you must spot things hidding in the background. All the games are controlled by simple mouse-clicking., and it fells rather slow and boring now and again. The overall games are not boring as such, but it quikly get`s repetative.\n\nCharecters:\nWell there are only two charecters in this game, and they both have no persanality. This game is clearly not story driven, but in my opinion, they did not need to include these charecters to complete a already unnesesary story. The charecters are a wizard, which we never see after the starting scren, and a fariy which guides you throughout the game. There is not much to say to this part, so let`s move on.\n\nVisuels:\nThe game looks kinda ok, but I really did not exspect anything brillaint to be honest. The overall visuesl in-game are accually pretty fluid, and looks fine. But when you do anything outside the main game, the grafics fells weaker and more bluery. It`s hard to explain, but I felt there was something wrong.\n\nSound:\nThe music is acually ok in this game. I fellt it was a nice thing to include, and the diffrent themes are acually not that bad. Other then that, there are not much to say to the sounds other than the star theme will blast your speakers out, it is so loud!\n\nStory:\nSo the story is pretty basic as said, clear all levels to controle all elements. The boring part is that the sory really has no twists and turns, instead it fells like it only is there to give you a reason to why there is 4 main levels.\n\nThe other mini-games really has some cool story. Not so much the hidden object part. But when you complete the spot the diffrence game. You see the real picture, and get`s the lore of the charecter on it. This was some intresting reading, and felt like a nice inclusion to the game, and the lore of the establist world.\n\nConclusion:\nThe game is far from a masterpice, and it really is just another time killer game. This dose not mean I dislike the game at all, I am just saying you can find better games of this type out there. I completed the story and it really is just a congratiolation screen and nothing more. But if you are looking for a simple game to sit down and play, this one coul be a nice choice. I give this game a thumps up.","December 6, 2014","true","8.7"," 1 person found this review helpful","0","1","1","0","0"
"http://steamcommunity.com/id/Othrandur/recommended/47000/","Othrandur","Othrandur","http://steamcommunity.com/id/Othrandur/","3488 products in account","This is a very tepid recommendation. The part of the game where you get to actually play isn't bad. It's extremely simple, probably intended for young children, but it's reasonably enjoyable. If it were only for this, my recommendation would be more enthusiastic. But the game is dragged down by a boring, cliché, contrived "story" that's duct taped around the game and adds absolutely no value to it, nor does it have any bearing on the game itself. In the aggregate, the game still tips the scales on the positive side, but just barely. I would recommend waiting for a hefty rebate or grabbing it as part of a bundle, if that ever happens.","May 7, 2014","true","0.5"," 2 of 3 people (67%) found this review helpful","67","2","3","0","0"
"http://steamcommunity.com/profiles/76561198037197299/recommended/47000/","76561198037197299","EPlue","http://steamcommunity.com/profiles/76561198037197299/","652 products in account","A good match 3 game where you have to actively match them with mouse click. There is also a find the differences mini game along with some hidden object elements in it. While you match the elements there are also 4 different powerups which are useful to complete each level faster. Main goal in match 3 mode is to transport a green liquid until it reaches a tree that grows and shows that you have finished the level. Each level is designed very different and makes the game more challenging and gives it variety.\n\nThe only compliant with this game i have is the unskippable sequences between levels. I can see such comfortable features were not common in these type of games back in 2008 and there are much better games released based of comfort function. If you are not patient gamer i wouldnt recommend this game. If you want to enjoy a different type of match 3 game i can recommend this for you.","April 16, 2015","true","6.9"," 2 of 3 people (67%) found this review helpful","67","2","3","0","0"
"http://steamcommunity.com/id/tridons/recommended/47000/","tridons","Tridon","http://steamcommunity.com/id/tridons/","2941 products in account","A fun puzzler with fairly simple mechanics. It took me 12 hours to finish, and that was a nice length for this game, considering it never grew too repetitive or boring. Ok value for the money when on sale. Grab it if you like a puzzle game once in a while.","April 29, 2013","true","12.5"," 2 of 3 people (67%) found this review helpful","67","2","3","0","0"
"http://steamcommunity.com/id/orca11/recommended/47000/","orca11","[MOG] Orca","http://steamcommunity.com/id/orca11/","158 products in account","This use to be a great game, but has been broken for a long time with ZERO support from the developer.  It crashes on launch, do not buy.","January 13","false","90.3"," 2 of 3 people (67%) found this review helpful","67","2","3","0","0"
"http://steamcommunity.com/id/arca20/recommended/47000/","arca20","arca20","http://steamcommunity.com/id/arca20/","178 products in account","I was really enjoying this game and had gotten as far as Part 4 when it crashed. Game won't work anymore and when I contacted the makers they took ages to reply then gave me a deadline to reply by which I did...and I have not heard back from them. So - AVOID!","January 18","false","14.0"," 2 of 3 people (67%) found this review helpful","67","2","3","0","0"
"http://steamcommunity.com/id/xTechno/recommended/47000/","xTechno","Tech","http://steamcommunity.com/id/xTechno/","206 products in account","Concept is nice, after the first few levels it gets boring and tedious. If I had to choose between this and Candy Crush, i'd take my own life.","June 23, 2014","false","5.8"," 3 of 5 people (60%) found this review helpful 5 people found this review funny","60","3","5","5","0"
"http://steamcommunity.com/profiles/76561198040466770/recommended/47000/","76561198040466770","abcdefghijklmnopqrstuvwxyz","http://steamcommunity.com/profiles/76561198040466770/","669 products in account","She is like a pretzel with too much salt. NO she was like meat lovers pizza with only one bite of meat.  when I started her up she came at me with the typical array of weapons most puzzle games that boast to have a story tend to do.  She had the expicit fantasy theme, the boistrous all of nothing music, the cute but elborate graphical fairies, buttons, whizzles and whigets.  but I blew past all that because I have done it so many times before.  I have kinda given up on the hope of any puzzle game  incorporating a story as an intregral inseperable part of the puzzle itself.  so I get the baby started.  I was pleased with initial premise of her.  She introduced herself with one face, then switched character to another, rode that one out for a spell, then once again another somersault face-change.  needless to say I was pleased.  I like surprises. eventually I came to understand that former and latter faces were mere attempts to keep things fresh, a little sugar to compliment her salty meat, her middle face.  and I appreciate that.  shows that she really cares about (me).","July 22, 2014","true","8.3"," 1 of 2 people (50%) found this review helpful","50","1","2","0","0"
"http://steamcommunity.com/id/AmbivalentIdeal/recommended/47000/","AmbivalentIdeal","Amby [Death Squad <3]","http://steamcommunity.com/id/AmbivalentIdeal/","357 products in account","this game is bad, it's addictive and i like it, i guess.\n\n10/10","October 6, 2014","true","11.7"," 4 of 8 people (50%) found this review helpful","50","4","8","0","0"
"http://steamcommunity.com/id/emkiser/recommended/47000/","emkiser","ellen","http://steamcommunity.com/id/emkiser/","366 products in account","The video game version of a Highlights Magazine for kids. It was a guilty pleasure but oh how I relished matching all the gems.","September 29, 2014","true","7.5"," 1 of 2 people (50%) found this review helpful","50","1","2","0","0"
"http://steamcommunity.com/profiles/76561198040466770/recommended/47000/","76561198040466770","abcdefghijklmnopqrstuvwxyz","http://steamcommunity.com/profiles/76561198040466770/","669 products in account","She is like a pretzel with too much salt. NO she was like meat lovers pizza with only one bite of meat.  when I started her up she came at me with the typical array of weapons most puzzle games that boast to have a story tend to do.  She had the expicit fantasy theme, the boistrous all of nothing music, the cute but elborate graphical fairies, buttons, whizzles and whigets.  but I blew past all that because I have done it so many times before.  I have kinda given up on the hope of any puzzle game  incorporating a story as an intregral inseperable part of the puzzle itself.  so I get the baby started.  I was pleased with initial premise of her.  She introduced herself with one face, then switched character to another, rode that one out for a spell, then once again another somersault face-change.  needless to say I was pleased.  I like surprises. eventually I came to understand that former and latter faces were mere attempts to keep things fresh, a little sugar to compliment her salty meat, her middle face.  and I appreciate that.  shows that she really cares about (me).","July 22, 2014","true","8.3"," 1 of 2 people (50%) found this review helpful","50","1","2","0","0"
"http://steamcommunity.com/id/meoweo/recommended/47000/","meoweo","meoweo","http://steamcommunity.com/id/meoweo/","946 products in account","Great Puzzle Game. Gets kinda hard towards the end. But not unfair hard.","March 10, 2014","true","12.9"," 1 of 2 people (50%) found this review helpful","50","1","2","0","0"
"http://steamcommunity.com/id/demonasgodz/recommended/47000/","demonasgodz","Riki Martin "Livin La Vida Loca"","http://steamcommunity.com/id/demonasgodz/","1487 products in account","Backlog Clearing #2\n\nComprises of 3 game parts (looking for items on screen, jewel clearing, spot the difference).\nMainly portion of the game revolves bejewel-ish kinda game.\nIt gets repetitive easily, I only got to the 2nd element - Fire\n\n2/10","April 9, 2014","false","2.5"," 9 of 18 people (50%) found this review helpful","50","9","18","0","0"
"http://steamcommunity.com/id/mojza/recommended/47000/","mojza","Admiral Thomas "Tug" Benson","http://steamcommunity.com/id/mojza/","246 products in account","I absolutely loved it. If you're into this kind of games you're gonna love it too. The "story" part is absolutely useless and despite I beat the game I have no idea what was going on with the story. The card and keys minigames are boring but also easy and short so it doesn't really matter. The game itself is challenging and fun as hell. Just one more level, just one more level... oh and another hour passed by. Once you get an option to buy this for spare change - do it.","March 7, 2014","true","15.4"," 1 of 2 people (50%) found this review helpful","50","1","2","0","0"
"http://steamcommunity.com/id/mykwon/recommended/47000/","mykwon","Mykwon","http://steamcommunity.com/id/mykwon/","1225 products in account","This is an ok game that will entertain you for a while but it's way too expensive for the value it gives. You should get it at a high discounted price.","November 25, 2013","true","6.4"," 1 of 2 people (50%) found this review helpful","50","1","2","0","0"
