"url","reviewerUsername","reviewerDisplayName","reviewerUrl","reviewerProductsCount","reviewText","date","recommended","hoursPlayed","voteText","helpfulPercent","votesHelpful","votesTotal","votesFunny","commentsCount"
"http://steamcommunity.com/profiles/76561198063185839/recommended/67370/","76561198063185839","Barkly the Basketball","http://steamcommunity.com/profiles/76561198063185839/","230 products in account","Good Game Homes :D","April 13, 2015","true","34.6"," 2 of 5 people (40%) found this review helpful","40","2","5","0","0"
"http://steamcommunity.com/id/dmc_human/recommended/67370/","dmc_human","Advanced Autism","http://steamcommunity.com/id/dmc_human/","92 products in account","> First Date Ever With Twins\n> Twins Get Killed\n","July 17, 2014","true","6.7"," 2 of 5 people (40%) found this review helpful","40","2","5","0","0"
"http://steamcommunity.com/profiles/76561198046696823/recommended/67370/","76561198046696823","Feistykitten","http://steamcommunity.com/profiles/76561198046696823/","228 products in account","Having played the original Darkness game on the PS3 I had high hopes for this sequel. Unfortunately I ended up not even finishing it as it felt like a kick to the stomach. It just seems to lack the heart of the original and feels like the video game equivalent of soggy cardboard. Buy it if it's dirt cheap and you're bored. Or go play Mirror's Edge instead.","April 4, 2014","false","14.9"," 2 of 5 people (40%) found this review helpful","40","2","5","0","0"
"http://steamcommunity.com/id/jamieb452/recommended/67370/","jamieb452","Greenfields🐱","http://steamcommunity.com/id/jamieb452/","689 products in account","The game is all about you having the evil inside you and to get back at the mob that killed your girlfriend Jenny. You Rip out heart of your enemies, rip them into strips, and kill them with a pole.","November 24, 2014","true","0.7"," 2 of 5 people (40%) found this review helpful","40","2","5","0","0"
"http://steamcommunity.com/id/kabic/recommended/67370/","kabic","kababowie","http://steamcommunity.com/id/kabic/","769 products in account","My Ravioli's Too Spicy! Awesome game.","April 15","true","9.5"," 2 of 5 people (40%) found this review helpful","40","2","5","0","0"
"http://steamcommunity.com/id/FreshNewMemes/recommended/67370/","FreshNewMemes","JoostBuis","http://steamcommunity.com/id/FreshNewMemes/","97 products in account","Who doesnt want to become a ♥♥♥♥ing crazy Op deamon creature and go around killing gangsters and mob wanks alike .\nPretty fun game but doesnt really have much re-play ability , so you play it once and have great quality bants . Worth a play at least . easy to run , like you could take a burnt out gt 430 and still run this on high ...♥♥♥♥ this game is easy to run but i digress , fun comabt and pretty decent story but dont play if your either :\n- christain\n- a jew\n- a ♥♥♥♥in loser\n- or canny take a wee joke ya poosay\n\nso yeah take that in mind before you buy  , but I would reccomend this game , and papa bless ya shiters","April 19","true","2.1"," 2 of 5 people (40%) found this review helpful 1 person found this review funny","40","2","5","0","0"
"http://steamcommunity.com/profiles/76561198069799537/recommended/67370/","76561198069799537","madnoke","http://steamcommunity.com/profiles/76561198069799537/","284 products in account","If you own a mac, don't buy this game. The amount of textures missing makes it unplayable.","April 22","false","0.5"," 2 of 5 people (40%) found this review helpful 2 people found this review funny","40","2","5","2","0"
"http://steamcommunity.com/profiles/76561198015307033/recommended/67370/","76561198015307033","calcpinkthemassimatic","http://steamcommunity.com/profiles/76561198015307033/","321 products in account","Thumbs up!","December 20, 2014","true","1.8"," 1 of 3 people (33%) found this review helpful","33","1","3","0","0"
"http://steamcommunity.com/id/AllenWalker23/recommended/67370/","AllenWalker23","Allen Walker","http://steamcommunity.com/id/AllenWalker23/","192 products in account","Great game, great story. tenouttaten","September 5, 2014","true","15.0"," 1 of 3 people (33%) found this review helpful","33","1","3","0","0"
"http://steamcommunity.com/profiles/76561198078658142/recommended/67370/","76561198078658142","Trenuraj","http://steamcommunity.com/profiles/76561198078658142/","82 products in account","40 mins of gameplay, I got to decapitate a dude, throw his corpse onto another dude, then eat the heart of that dude, and then a black midget took a leak on the dudes dead, ripped apart body. 10/10","November 12, 2014","true","0.7"," 1 of 3 people (33%) found this review helpful","33","1","3","0","0"
"http://steamcommunity.com/id/kokpit/recommended/67370/","kokpit","Kokpit","http://steamcommunity.com/id/kokpit/","269 products in account","Darkness, Blood, Shooters\nThis game is really very nice to play in\nI love this game","December 9, 2013","true","10.5"," 1 of 3 people (33%) found this review helpful","33","1","3","0","0"
"http://steamcommunity.com/id/mikeleedd/recommended/67370/","mikeleedd","Makena [Life After Death]","http://steamcommunity.com/id/mikeleedd/","148 products in account","This game is  better story shooters! Like it!","January 17, 2014","true","12.5"," 1 of 3 people (33%) found this review helpful","33","1","3","0","0"
"http://steamcommunity.com/id/GnomeChompski/recommended/67370/","GnomeChompski","Peanits","http://steamcommunity.com/id/GnomeChompski/","674 products in account","There's not really much to say. It's a shooter. It does all the things a shooter should do, and it does have a feature to make it unique. In this case, giant evil tentacles that have all sorts of powers.\n\nIf it's on sale, go ahead and get it, but these games are never really made around replayability.","August 15, 2014","true","0.7"," 1 of 3 people (33%) found this review helpful","33","1","3","0","0"
"http://steamcommunity.com/id/dynecked/recommended/67370/","dynecked","Ben","http://steamcommunity.com/id/dynecked/","150 products in account","I can't stop playing! Well done on a great Story-Driven action game! Loving it! Keep up the work, 2K!","October 8, 2014","true","6.2"," 1 of 3 people (33%) found this review helpful","33","1","3","0","0"
"http://steamcommunity.com/id/rotking/recommended/67370/","rotking","LOCKJAW","http://steamcommunity.com/id/rotking/","73 products in account","i can literally never ♥♥♥♥ing see what the hell is going on i played this once and i dont remember it being like this\nwhy","February 4","false","14.4"," 1 of 3 people (33%) found this review helpful","33","1","3","0","0"
"http://steamcommunity.com/id/RubberCentury/recommended/67370/","RubberCentury","RubberCentury","http://steamcommunity.com/id/RubberCentury/","18 products in account","This game is BAD DO NOT BUY FOR MAC I REPEAT DO NOT BUY FOR MAC THIS GAME IS ♥♥♥♥ SERIOUSLY I BOUGHT IT FOR MAC ON THE 2/9/16 AND HALF THE SCREEN WAS YELLOW AND TEXTURES WERE GOING THROUGH EACH OTHER. THIS WAS SUPPOSED TO BE UPDATED 2 YEARS AGO BUT GUESS WHAT 2K DONT GIVE A RATS ♥♥♥ ABOUT THIS GAME OR FOR ANYONE WHO BUYS IT IF FOR MAC AND NO ITS NOT MY MAC ITS THAT THE GAME DOES NOT SUPPORT MACS GRAPHIC CARD SO YEA I WARNED YOU.","February 10","false","0.3"," 1 of 3 people (33%) found this review helpful","33","1","3","0","0"
"http://steamcommunity.com/id/heartless_jack/recommended/67370/","heartless_jack","</3 Jack","http://steamcommunity.com/id/heartless_jack/","129 products in account","This is a rail-shooter/FPS based on a Top Cow comic book series, in case you didn't already know.\n\nFollow Jackie Estocato, a New York mafioso who has risen through the ranks in the previous game, to be the boss he is now.\n\nOh and he is demonically posessed, and on a quest into his own personal, and literal hell, for the soul of his girlfriend.\n\nController is probably the best way to play it, since remapping the keyboard isn't an option that's available for some keys, at least it wasn't for me, as I had broken those keys.\n\nIt was a fun romp for the 6-8 hours you get out of it, and some ideas there in the later chapters give you some other ideas about Jackie, and leaves you wondering.\n\n7/10 - I personally didn't connect with Jackie, but that didn't stop me from having fun with this shoot-em-up. Would be nice if it were longer, or the multiplayer were better or just not included so that the main game could have that energy spent on it. And then there's the controversy over the field of view. I had to take off another point just for that.","March 31, 2015","true","7.9"," 1 of 3 people (33%) found this review helpful 1 person found this review funny","33","1","3","0","6"
"http://steamcommunity.com/profiles/76561198038994337/recommended/67370/","76561198038994337","harvista","http://steamcommunity.com/profiles/76561198038994337/","228 products in account","Four arms, four times the fun! in the darkness 2 gorey executions ftw!","March 21, 2015","true","2.5"," 1 of 3 people (33%) found this review helpful","33","1","3","0","0"
"http://steamcommunity.com/id/jocosity/recommended/67370/","jocosity","Communist "Joseph Ballin" Layton","http://steamcommunity.com/id/jocosity/","920 products in account","my names jackie avacado and i approve of the dorkness 2","February 8, 2012","true","19.2"," 1 of 3 people (33%) found this review helpful 1 person found this review funny","33","1","3","0","1"
"http://steamcommunity.com/id/RubberCentury/recommended/67370/","RubberCentury","RubberCentury","http://steamcommunity.com/id/RubberCentury/","18 products in account","This game is BAD DO NOT BUY FOR MAC I REPEAT DO NOT BUY FOR MAC THIS GAME IS ♥♥♥♥ SERIOUSLY I BOUGHT IT FOR MAC ON THE 2/9/16 AND HALF THE SCREEN WAS YELLOW AND TEXTURES WERE GOING THROUGH EACH OTHER. THIS WAS SUPPOSED TO BE UPDATED 2 YEARS AGO BUT GUESS WHAT 2K DONT GIVE A RATS ♥♥♥ ABOUT THIS GAME OR FOR ANYONE WHO BUYS IT IF FOR MAC AND NO ITS NOT MY MAC ITS THAT THE GAME DOES NOT SUPPORT MACS GRAPHIC CARD SO YEA I WARNED YOU.","February 10","false","0.3"," 1 of 3 people (33%) found this review helpful","33","1","3","0","0"
"http://steamcommunity.com/id/KingSnowBlack/recommended/67370/","KingSnowBlack","SnowBlack","http://steamcommunity.com/id/KingSnowBlack/","206 products in account","I would this game 8/10.\nThere are minor issues with the AI but the game is 4 years old.\nOther than that the story is great, the voice acting is alright, there are good plot-twists, I didn't get bored while playing the game.\nP.S.\nThe guns are not hard to shoot with at all, but thats something you would expect from such a game","February 19","true","4.9"," 1 of 3 people (33%) found this review helpful 1 person found this review funny","33","1","3","0","0"
"http://steamcommunity.com/profiles/76561198134306890/recommended/67370/","76561198134306890","deus_extrem","http://steamcommunity.com/profiles/76561198134306890/","53 products in account","The darkness was the best fps I've played in a long time. The darnkess powers add another aspect of the combat along with lvling up and gaining new darkness poweres. And when the darkness tells you to do bad things it adds to the ambiance of insanity going on in Jackies head!! I would recommend this 100%!!!","March 6","true","7.7"," 1 of 3 people (33%) found this review helpful","33","1","3","0","0"
"http://steamcommunity.com/profiles/76561198078188251/recommended/67370/","76561198078188251","Agosaxv:LERP 100 GUY","http://steamcommunity.com/profiles/76561198078188251/","356 products in account","Supernatural Shooter done right , buy it!","March 9","true","5.2"," 1 of 3 people (33%) found this review helpful","33","1","3","0","1"
"http://steamcommunity.com/profiles/76561198082133339/recommended/67370/","76561198082133339","Squid","http://steamcommunity.com/profiles/76561198082133339/","93 products in account","The Darkness is one of my favourite comic book series of all time, and I think this game does a really good job of breathing some new life into it, while capturing the crime-filled, bloody action of being Jackie Estacado.","March 14","true","23.5"," 1 of 3 people (33%) found this review helpful","33","1","3","0","0"
"http://steamcommunity.com/id/xenothedude/recommended/67370/","xenothedude","Zένο","http://steamcommunity.com/id/xenothedude/","279 products in account","Very unique and ♥♥♥♥in awesome fps game!If you are tired of the industry which recycles the same ideas over and over again,try this game and you will be surprised","February 29","true","13.8"," 1 of 3 people (33%) found this review helpful","33","1","3","0","0"
"http://steamcommunity.com/id/Ornlu2/recommended/67370/","Ornlu2","Ornlu2","http://steamcommunity.com/id/Ornlu2/","73 products in account","While I have not played the first Darkness game, I am in love with this one. The aesthetic is fantastic and looks great not matter what settings you play on, the gameplay brings something new to the genre of linear shooters, the story is gripping and I had a lot of fun learning the lore of the story in general.\n\nPros:\n- Interesting use of light as a mechanic\n- Duel wielding semi-automatic guns\n- Interesting story\n- Being able to slash people with a shadowy tentacle from hell\n- Being able to pick up people and throw them into walls and watching their corpse rag doll onto the ground\n- Upgrade system\n\nCons:\n- Game is really linear\n- Is fairly basic in terms of how many mechanics it provides\n\nIf you want a game to provide you a power trip, this is what this game excels at and I recommend it highly. If you are not seeking a power trip and want to try a new game that has some interesting mechanics and brings something new to the genre, I would still recommend it.","March 9","true","67.2"," 1 of 3 people (33%) found this review helpful","33","1","3","0","0"
"http://steamcommunity.com/profiles/76561198017946533/recommended/67370/","76561198017946533","Dogishappy","http://steamcommunity.com/profiles/76561198017946533/","175 products in account","A fun, quick little game. 6 hours of excessive power fantasy violence. More with newgame+ and the non-storyline missions that come with the game. There are a few twists in the story that really caught me off guard and had me questioning my decisions. The art style is timeless, character development is a solid A+, and the gunplay is solid. Definately worth picking up on sale.\n\nonly cons are an annoying sidekick, and i had to reload a checkpoint when he glitched out once while opening a door.","April 8","true","6.1"," 1 of 3 people (33%) found this review helpful","33","1","3","0","0"
"http://steamcommunity.com/id/zpikey/recommended/67370/","zpikey","| ZPIKEY","http://steamcommunity.com/id/zpikey/","2286 products in account","I love the Darkness II, it has awesome gameplay, your movement and the fighting mechanics feel super smooth. There is a fun and exciting multiplayer co-op mode! The achievements keep you coming back for more and gives you just another reason for another run-through of the game.\n\nHOWEVER, Darkness II has one downside, the length of the game, both single player and especially co-op is all played through within a very short time.\nId love to be able to play the normal Story as co-op or have some form of expansion of the game after the normal run through. Beating the game on the more intense difficulty or grinding Achievements is less awarding than more content, but non the less I love this game and highly recommend it!","April 16","true","6.7"," 1 of 3 people (33%) found this review helpful","33","1","3","0","0"
"http://steamcommunity.com/id/raiden_xl/recommended/67370/","raiden_xl","Raiden","http://steamcommunity.com/id/raiden_xl/","16 products in account","10/10 - The Darkness II Limited Edition Review\n\n+Awesome graphics / Art Style\n+Lots of Blood & Gore with epic EXECUTIONS :D\n+Great dark & gritty atmosphere\n+Great Gameplay\n+Best companion after Elizabeth from Bioshock: Infinite - the one and only Darkling :D\n+Story\n+\n+Great PC Port with everything set on Maximum & 1080p not once i had framedrops or a lag, crash or a bug nothing its truly great PC Port\n\n(Not Important)\n\n-Difficulty names didnt know wkich one is  easy - medium or hard - they are named as Thug - Mobster - Hitman & Don .....\nwhen i finished the game i realised that i played on Don which is ♥♥♥♥ing nuts ahahah\n\nBut ist still 10/10 game.","May 2","true","10.5"," 1 of 3 people (33%) found this review helpful","33","1","3","0","0"
"http://steamcommunity.com/profiles/76561198105035048/recommended/67370/","76561198105035048","ZoA","http://steamcommunity.com/profiles/76561198105035048/","65 products in account","Terrible FPS with bad unresponsive controls and swarms of stupid spongy opponents. Irritating and tedious.","April 10","false","9.4"," 1 of 3 people (33%) found this review helpful","33","1","3","0","0"
"http://steamcommunity.com/profiles/76561198008222626/recommended/67370/","76561198008222626","hibbi88","http://steamcommunity.com/profiles/76561198008222626/","25 products in account","Total crap","April 14","false","5.6"," 1 of 3 people (33%) found this review helpful","33","1","3","0","0"
"http://steamcommunity.com/id/UnderGrounder96/recommended/67370/","UnderGrounder96","UnderGrounder96","http://steamcommunity.com/id/UnderGrounder96/","80 products in account","This game is awesome both story and gameplay wise! Get this.","April 23","true","6.6"," 1 of 3 people (33%) found this review helpful","33","1","3","0","0"
"http://steamcommunity.com/id/Iamdigidude/recommended/67370/","Iamdigidude","Pvt. Jackson [2RB]","http://steamcommunity.com/id/Iamdigidude/","348 products in account","It needs to be a movie.","May 17","true","11.2"," 1 of 3 people (33%) found this review helpful","33","1","3","0","0"
"http://steamcommunity.com/profiles/76561198046979143/recommended/67370/","76561198046979143","Militiaspack 🆅🅰🅻🆅🅴","http://steamcommunity.com/profiles/76561198046979143/","241 products in account","This game is a kinda creepy horror game in which you become a mafia gang leader with a strange power called the Darkness which is trying to take control of you. The game is unlike no other and like other 2K games I was impressed.","July 16, 2014","true","4.2"," 1 of 3 people (33%) found this review helpful","33","1","3","0","0"
"http://steamcommunity.com/profiles/76561198006066906/recommended/67370/","76561198006066906","Pingping","http://steamcommunity.com/profiles/76561198006066906/","137 products in account","Beat it in one sitting. 6.5 hours. Totally worth it! Awesome game and gruesome, inventive ways to kill. Some parts were pretty funny too! Well worth the $5 spent while on sale. Haven't tried the coop. Too short of a game for 30$ so get it on sale.","December 16, 2014","true","6.5"," 0 of 1 people (0%) found this review helpful","0","0","1","0","0"
"http://steamcommunity.com/id/captainmellow/recommended/67370/","captainmellow","CaptainMellow","http://steamcommunity.com/id/captainmellow/","157 products in account","The darkness 2 is a stylish game, with a well written story.","December 18, 2014","true","4.6"," 0 of 1 people (0%) found this review helpful","0","0","1","0","0"
"http://steamcommunity.com/id/GK733/recommended/67370/","GK733","DOOM cums","http://steamcommunity.com/id/GK733/","419 products in account","A dark and gory game set in the catholic world where you control Jackie Escetado, the welder of demonic powers and two firearms. While the combat is kinda decent, the darkness brings in the difference with its rgihtening power of slashing humans and eating their still beating hearts. It has pretty goo story too.","November 13, 2013","true","8.1"," 0 of 1 people (0%) found this review helpful","0","0","1","0","0"
"http://steamcommunity.com/profiles/76561198078057919/recommended/67370/","76561198078057919","ziggyzoomzooom","http://steamcommunity.com/profiles/76561198078057919/","82 products in account","good game Darkness II.","February 12, 2014","true","5.9"," 0 of 1 people (0%) found this review helpful","0","0","1","0","0"
"http://steamcommunity.com/id/thejester86/recommended/67370/","thejester86","The Jester","http://steamcommunity.com/id/thejester86/","155 products in account","I ripped a man's spine out of his ♥♥♥. Assecution it was called. 11/10","January 18, 2015","true","8.2"," 0 of 1 people (0%) found this review helpful","0","0","1","0","0"
"http://steamcommunity.com/profiles/76561197985666459/recommended/67370/","76561197985666459","Bilbo Swaggins","http://steamcommunity.com/profiles/76561197985666459/","71 products in account","A lot of fun ;)","January 19, 2015","true","5.3"," 0 of 1 people (0%) found this review helpful","0","0","1","0","0"
"http://steamcommunity.com/id/SyntraS/recommended/67370/","SyntraS","🍺💃🍕","http://steamcommunity.com/id/SyntraS/","256 products in account","3/3","January 3, 2015","true","18.1"," 0 of 1 people (0%) found this review helpful","0","0","1","0","0"
"http://steamcommunity.com/id/l3v1l33/recommended/67370/","l3v1l33","l3v1l33™","http://steamcommunity.com/id/l3v1l33/","248 products in account","pretty good game. i like how you can do a lot with your surroundings and the darkness its self. only problem i had with the game is the short life it had. i beat the game in 6 hours. maybe i should have played on hard. other then that the art work and game play is a 9/10 very well put together game and im hoping for a number 3.","August 18, 2014","true","6.0"," 0 of 1 people (0%) found this review helpful","0","0","1","0","0"
"http://steamcommunity.com/id/brycedude/recommended/67370/","brycedude","BryceIsRad","http://steamcommunity.com/id/brycedude/","183 products in account","Do peoples funny Accents Make you want to rip people into pieces and eat there heart?\nIf so, this game is for you.","September 25, 2014","true","3.6"," 0 of 1 people (0%) found this review helpful","0","0","1","0","0"
"http://steamcommunity.com/id/peacequefer/recommended/67370/","peacequefer","Orpheus","http://steamcommunity.com/id/peacequefer/","74 products in account","Jenny Simulator XD","October 24, 2014","true","5.5"," 0 of 1 people (0%) found this review helpful","0","0","1","0","0"
"http://steamcommunity.com/profiles/76561198078057919/recommended/67370/","76561198078057919","ziggyzoomzooom","http://steamcommunity.com/profiles/76561198078057919/","82 products in account","good game Darkness II.","February 12, 2014","true","5.9"," 0 of 1 people (0%) found this review helpful","0","0","1","0","0"
"http://steamcommunity.com/id/skullsgate/recommended/67370/","skullsgate","Skinner Sweet","http://steamcommunity.com/id/skullsgate/","199 products in account","A lot of fun but way too short.","August 16, 2014","true","6.5"," 0 of 1 people (0%) found this review helpful","0","0","1","0","0"
"http://steamcommunity.com/id/GK733/recommended/67370/","GK733","DOOM cums","http://steamcommunity.com/id/GK733/","419 products in account","A dark and gory game set in the catholic world where you control Jackie Escetado, the welder of demonic powers and two firearms. While the combat is kinda decent, the darkness brings in the difference with its rgihtening power of slashing humans and eating their still beating hearts. It has pretty goo story too.","November 13, 2013","true","8.1"," 0 of 1 people (0%) found this review helpful","0","0","1","0","0"
"http://steamcommunity.com/id/Saint_Satan/recommended/67370/","Saint_Satan","Saint Satan","http://steamcommunity.com/id/Saint_Satan/","905 products in account","You do not need to play the first game at all to enjoy The Darkness II. This game is a flawless console port and it runs great. It has great graphics and art style, excellent controls, very engaging story that's well written, heart pumping ultra violent action, tons of sweet power ups, very nice soundtrack, superb voice acting, great cut scenes, and all around has an extrememe amount of polish - I could go on and on. The only negitive thing I can think of is that it's linear, but I don't mind at all. This is how to do a single player first person shooter. If you like first person shooters it's a must play - it doesn't get much better than this.","February 18, 2012","true","9.3"," 0 of 1 people (0%) found this review helpful","0","0","1","0","0"
"http://steamcommunity.com/id/KIEZ5823/recommended/67370/","KIEZ5823","★KIE","http://steamcommunity.com/id/KIEZ5823/","190 products in account","เลือดสาดกระจุยกระจายยย มันสาสสสสสสสสส","July 13, 2014","true","2.7"," 0 of 1 people (0%) found this review helpful","0","0","1","0","0"
"http://steamcommunity.com/id/reboot/recommended/67370/","reboot","ReBoot","http://steamcommunity.com/id/reboot/","1259 products in account","Totally worth it. Despite all the violence, there's a deep story.","March 31, 2012","true","23.9"," 0 of 1 people (0%) found this review helpful","0","0","1","0","0"
"http://steamcommunity.com/id/diametrodon/recommended/67370/","diametrodon","Ultimat3spaz","http://steamcommunity.com/id/diametrodon/","394 products in account","Eeehhhehehehehee... I ♥♥♥♥ing love the darkness!","August 12, 2014","true","19.4"," 0 of 1 people (0%) found this review helpful","0","0","1","0","0"
"http://steamcommunity.com/id/pankin/recommended/67370/","pankin","Closet Pankin","http://steamcommunity.com/id/pankin/","362 products in account","you're a spooky hentai aminals 16/6","July 24, 2014","true","27.9"," 0 of 1 people (0%) found this review helpful","0","0","1","0","0"
"http://steamcommunity.com/id/Gayporn-Michi-Karl/recommended/67370/","Gayporn-Michi-Karl","123","http://steamcommunity.com/id/Gayporn-Michi-Karl/","540 products in account","nur uncut is cool ^^","August 5, 2013","true","4.1"," 0 of 1 people (0%) found this review helpful","0","0","1","0","0"
