"url","reviewerUsername","reviewerDisplayName","reviewerUrl","reviewerProductsCount","reviewText","date","recommended","hoursPlayed","voteText","helpfulPercent","votesHelpful","votesTotal","votesFunny","commentsCount"
"http://steamcommunity.com/id/RoyalK1ng/recommended/67370/","RoyalK1ng","King Vengeance","http://steamcommunity.com/id/RoyalK1ng/","143 products in account","This game is honestly a ♥♥♥♥ ton of fun. I really like the story, gameplay, just everything about it. The only think I dislike, however, is the game's ending(s). It's really unfortunate a game like "The Darkness"(First game of series) is only on console, I would have loved to play it on PC. Another the chances of there being a 3rd one for this series is low, which really sucks. The ending is SO unsatisfying and leaves you wondering. The co-op campaign is really cool because it relates/connects to the single-player story. It sucks that it's also fairly dead, however if you have friends that have this game. It's REALLY fun.\n\nI rate this game a 9/10. It would of gotten higher if it had a better ending, the game was kind of short but it was still fun.","September 6, 2015","true","4.1"," 2 of 2 people (100%) found this review helpful","100","2","2","0","0"
"http://steamcommunity.com/id/insomniacpaci/recommended/67370/","insomniacpaci","B+","http://steamcommunity.com/id/insomniacpaci/","134 products in account","The host with the most\n\n10/10 would get worms again","January 25, 2015","true","22.0"," 2 of 2 people (100%) found this review helpful 7 people found this review funny","100","2","2","7","0"
"http://steamcommunity.com/id/iceman8868/recommended/67370/","iceman8868","Jack Bauer","http://steamcommunity.com/id/iceman8868/","181 products in account","Все-таки Digital Extremes выступили в своем коронном стиле - испоганили атмосферу! Комикс-стилистика смотрится свежо и красиво, но для данного тайтла это совершенно не подходит. В целом, новичкам игра понравиться, а фанаты будут в разочаровании... Если 2К соберется делать третью часть, то дай бог, чтоб у них мозги на место встали и они наконец-то пригласят Starbreeze Studios!","February 12, 2012","true","8.5"," 2 of 2 people (100%) found this review helpful","100","2","2","0","3"
"http://steamcommunity.com/profiles/76561198117507122/recommended/67370/","76561198117507122","M.Night Shyamalan","http://steamcommunity.com/profiles/76561198117507122/","58 products in account","Weird as f**k 'bout to pass out, destinations Jimmy Saville's couch!","September 25, 2014","true","4.1"," 2 of 2 people (100%) found this review helpful 2 people found this review funny","100","2","2","2","1"
"http://steamcommunity.com/id/solarom/recommended/67370/","solarom","solarom","http://steamcommunity.com/id/solarom/","134 products in account","Haven't tried the solo campaign yet, but the multiplayer is a blast. It's short, reasonably challenging and the debriefings you receive in between missions are actually funny.","December 31, 2013","true","3.2"," 2 of 2 people (100%) found this review helpful","100","2","2","0","0"
"http://steamcommunity.com/id/BRITNEY5PEARS/recommended/67370/","BRITNEY5PEARS","BRITNEY SPEARS","http://steamcommunity.com/id/BRITNEY5PEARS/","1105 products in account","I highly recommend you to try this game.\nReally good story. It's about imagination and reallity\nJackie will have a real life or not, It's your choice!\n\nSuch a shame, It's too short.","November 8, 2014","true","5.5"," 2 of 2 people (100%) found this review helpful","100","2","2","0","0"
"http://steamcommunity.com/profiles/76561197972273712/recommended/67370/","76561197972273712","Brukakis","http://steamcommunity.com/profiles/76561197972273712/","133 products in account","A horror-comic and off the beaten track cell-shaded FPS, painted in vivid colors and framed by a cinematographic narration.\nThe gameplay is action based: controlling four arms allows some nice and satisfying killing combos alternating grabbing, throwing, slicing and, of course, shooting. The action sequences are interspersed with frequent cutscenes, building the player partecipation and creating a movie-like atmosphere. Even if the single player campaign is way too short, the vendetta's missions extend -a little bit- the game longevity. They run parallel to the main campaign and they include 4 playable characters and a coop mode.\n\n81/100","January 2, 2015","true","11.4"," 2 of 2 people (100%) found this review helpful","100","2","2","0","0"
"http://steamcommunity.com/id/SERIALKILLERAXU/recommended/67370/","SERIALKILLERAXU","忍びX","http://steamcommunity.com/id/SERIALKILLERAXU/","175 products in account","Very artistic visuals, lots of gunplay, gore, cool use of powers and a very deep storyline that lives up to the original while also standing on its own. One of the best Single-Player experiences I've ever participated in along with the Co-op campaign which adds even more entertainment with new characters and powers... XD","January 12, 2015","true","49.4"," 2 of 2 people (100%) found this review helpful","100","2","2","0","0"
"http://steamcommunity.com/id/xsource1000/recommended/67370/","xsource1000","Ukiro Urusama","http://steamcommunity.com/id/xsource1000/","43 products in account","i loved every sec of this game... yust makes you feel how it would be like if you were the monster of the game and other would run from you insted of beyng you the pray.","December 16, 2015","true","11.8"," 2 of 2 people (100%) found this review helpful","100","2","2","0","0"
"http://steamcommunity.com/id/insomniacpaci/recommended/67370/","insomniacpaci","B+","http://steamcommunity.com/id/insomniacpaci/","134 products in account","The host with the most\n\n10/10 would get worms again","January 25, 2015","true","22.0"," 2 of 2 people (100%) found this review helpful 7 people found this review funny","100","2","2","7","0"
"http://steamcommunity.com/id/iceman8868/recommended/67370/","iceman8868","Jack Bauer","http://steamcommunity.com/id/iceman8868/","181 products in account","Все-таки Digital Extremes выступили в своем коронном стиле - испоганили атмосферу! Комикс-стилистика смотрится свежо и красиво, но для данного тайтла это совершенно не подходит. В целом, новичкам игра понравиться, а фанаты будут в разочаровании... Если 2К соберется делать третью часть, то дай бог, чтоб у них мозги на место встали и они наконец-то пригласят Starbreeze Studios!","February 12, 2012","true","8.5"," 2 of 2 people (100%) found this review helpful","100","2","2","0","3"
"http://steamcommunity.com/id/sdx3/recommended/67370/","sdx3","Murp#sDx3","http://steamcommunity.com/id/sdx3/","2091 products in account","Very fun and addicting game... Great story-line, dialogue between NPCs is hilarious... Highly recommended.","December 28, 2013","true","2.3"," 2 of 2 people (100%) found this review helpful","100","2","2","0","0"
"http://steamcommunity.com/id/azLis1337/recommended/67370/","azLis1337","azL","http://steamcommunity.com/id/azLis1337/","338 products in account","Nice story, but small.That ending tho =D","July 14, 2014","true","5.3"," 2 of 2 people (100%) found this review helpful","100","2","2","0","0"
"http://steamcommunity.com/id/sirmcboing/recommended/67370/","sirmcboing","Baconosaurus Fried","http://steamcommunity.com/id/sirmcboing/","725 products in account","My favourite game about anime styled hentai-tentacle-guro-♥♥♥♥.\n\n8/10 - Would penetrate again!","July 12, 2014","true","5.0"," 2 of 2 people (100%) found this review helpful 1 person found this review funny","100","2","2","0","1"
"http://steamcommunity.com/id/xsource1000/recommended/67370/","xsource1000","Ukiro Urusama","http://steamcommunity.com/id/xsource1000/","43 products in account","i loved every sec of this game... yust makes you feel how it would be like if you were the monster of the game and other would run from you insted of beyng you the pray.","December 16, 2015","true","11.8"," 2 of 2 people (100%) found this review helpful","100","2","2","0","0"
"http://steamcommunity.com/id/LouieBee/recommended/67370/","LouieBee","LouieBee","http://steamcommunity.com/id/LouieBee/","2282 products in account","With it's story depending highly on your experience of Starbreeze's console exclusive release of 2007, it is some wonder that this sequel to Darkness was made available for PC or, heck, even at all when you consider how the first game even ended. Yet with the stark differences in art-style and ultimately approach to the structure itself  in The Darkness 2, Digital Extremes also wisely fixed the cumbersome combat of the original Darkness with much better shooting mechanics and much better implementation of the titular demon itself during fights. Additionally, the co-op heavy Vendettas game mode is a nice surprise and a lot of fun both online and off. Performance is neither an issue here or there with this one, The Darkness II can be maxed out smoothly on modest DX10 video cards and budget Dual core CPUs although it doesn't quite have proper full-frame support, squashing the picture similar to Digital Extreme's previous work on Homefront. Otherwise, aside from the occassional cheap enemy chokepoint, you're more than likely to enjoy what you get out of The Darkness II, especially if it is less than £5.","August 13, 2013","true","12.2"," 2 of 2 people (100%) found this review helpful","100","2","2","0","1"
"http://steamcommunity.com/id/excruciate/recommended/67370/","excruciate","Excruciate","http://steamcommunity.com/id/excruciate/","717 products in account","One of the better fps games I've ever played. Solid, unflinching combat mechanics, great graphics, cool story, and a lot of fun to play. Not only can you dual wield weapons, you have two demon arms that come out of you to slash and grab enemies and do gruesome executions, and you can grab items and throw them at enemies. The ultra-violence in this game knows no limits. Another big plus: the story is easily one of the best video game stories I've ever seen. Simple to grasp yet very well written and well acted, even sad at times. The graphics are also very well done and hold up well today even as of 2016, with a almost Borderlands-ish comic style. But things look more human-like and the game is much more serious than BL games, and it manages to feel like its own style of art.\n\nIf you like well made FPS games that feel nice and tight when you play them, like a young, hot, 18yr old super-long haired red head prom date with a quiver in her panties that you can feel on your leg while dancing, quit waiting and go for it.\n\nGameplay 9/10\nGraphics 8/10\nEffects 8/10\nPerformance 10/10\nSounds/music 9/10\nStory 10/10\nLength 9/10\nReplay value 7/10\nLevel of Violence 10/10\nTechnical problems: none for me/10\n\n8.5/10 one of my fav fps games","December 29, 2015","true","9.4"," 2 of 2 people (100%) found this review helpful","100","2","2","0","0"
"http://steamcommunity.com/id/hevybullet/recommended/67370/","hevybullet","Hevybullet","http://steamcommunity.com/id/hevybullet/","71 products in account","The Darkness... Jackieeee.\nMy god I loved this game, so into the story, the gameplay was fun and brutal, cool levelling system, interesting cutscenes.\nSo sad that I finished it but I feel like I could replay it many times over. Also heard that they could make a 3rd but are very busy so quite unlikely? I dunno, anyway, amazing game... don't wanna spoil it just play it for yourself.","November 30, 2014","true","6.0"," 2 of 2 people (100%) found this review helpful","100","2","2","0","0"
"http://steamcommunity.com/profiles/76561198092988457/recommended/67370/","76561198092988457","Valerie Kier","http://steamcommunity.com/profiles/76561198092988457/","231 products in account","So some sorta monkey-looking demon with voice of Mike Patton talks with you all the time and follow your every step. It's basically "1 day with Mike Patton simulator." Jokes aside it's above average FPS with good story, nice visuals and sometimes even atmosphere.","May 19","true","8.3"," 2 of 2 people (100%) found this review helpful 1 person found this review funny","100","2","2","0","0"
"http://steamcommunity.com/id/CremoOfficial/recommended/67370/","CremoOfficial","Cremo","http://steamcommunity.com/id/CremoOfficial/","140 products in account","A really sick FPS\nYou're playing as a cartel leader, who has some weird tentacle - nothing bad, dont worry - powers. Gameplay and story rocks as well, you will enjoy every bit of this game!","May 27","true","15.0"," 2 of 2 people (100%) found this review helpful","100","2","2","0","0"
"http://steamcommunity.com/id/GoesWellWithNoodle/recommended/67370/","GoesWellWithNoodle","GoesWellWithNoodle","http://steamcommunity.com/id/GoesWellWithNoodle/","115 products in account","I've gotta say the best word I can come up with for this game is fun.  I found myself replaying the game even after I beat it just to explore the different ways I could be a hyper-efficient killing machine.\n\nLights out here, grab cover there, light pole to his body there, headshot for you, you and you, reload and toss the car door killing someone AS I reload.\n\nGood art style + smooth fufilling gameplay = good time","December 3, 2014","true","18.6"," 2 of 2 people (100%) found this review helpful","100","2","2","0","0"
"http://steamcommunity.com/profiles/76561198087942662/recommended/67370/","76561198087942662","xx420xxVulpixKwikscopesxx","http://steamcommunity.com/profiles/76561198087942662/","135 products in account","I ripped a man's spine and skull out through his ♥♥♥...it was as gratifying as you think it would be.","March 1, 2014","true","5.3"," 3 of 4 people (75%) found this review helpful","75","3","4","0","0"
"http://steamcommunity.com/id/sebastiaaaaan/recommended/67370/","sebastiaaaaan","drago","http://steamcommunity.com/id/sebastiaaaaan/","205 products in account","10/10 best tentacle simulator out there","January 20, 2014","true","5.9"," 3 of 4 people (75%) found this review helpful","75","3","4","0","0"
"http://steamcommunity.com/profiles/76561198043870460/recommended/67370/","76561198043870460","Inanimate Fucking Object","http://steamcommunity.com/profiles/76561198043870460/","194 products in account","In general a very enjoyable game. Not going to lie, it has a few kinks I hope they fix for Darkness III (oh please let it happen), but those are easy to look past considering all the other great parts of the game.\n\nGood things:\nThe story about Jenny is fantastic (minor spoiler, yes she's in the game a bit). It really got me sucked into it all because alot of very logical things surfaced when playing, which gave a rather interresting perspective about the game itself.\nThe gore...I mean come on you have to love it. Actually one of the most brutal games I've ever played, but at the same time not the most graphic one. The artstyle makes you enjoy it alot more than get grossed out by it.\nThe artstyle I can't explain why but I really like it. It has a comic noir sense to it and looks really good.\nThe gameplay has a really nice touch to it. Demons and guns, how do you say no to that? Also there's a skilltree you level up depending on how you want to play, so personalized customization for you and your abilities.\nFinally you can tell that the developers have put alot of time and effort into the game because of all the amazing voiceacting. If you feel like it you can double your gameplay time by talking to everyone possible and not only get alot of info about what's going on and personal opinions which add alot of depth to the story, you can also enjoy a comedic side to this game which I personally was happily surprised to discover.\n\nThings that can be improved:\nFirst thing that comes to mind is the amount of execution animations. Though horrendous and incredible great to watch, they get quite repetitive once you've played for a while. For the next game I wish they mix it up a bit and expand the ways you can kill people with your demons, because, and be honest to yourself, that is one of the coolest things about this game.\nSecondly I really enjoyed the story and the campaign and it all had a nice flow all the way through. I just wish for the flow to extend another few hours. I finished the game in about ten hours or so, and I really think a game should be longer than that. Especially since this one doesn't have free roaming and maybe not so much replay value since the story is such a big part of the game.\n\nOverall I give this game 8.5/10. Get it and enjoy this very unique FPS where YOU are the nightmare everyone fears ;)","July 6, 2014","true","10.0"," 3 of 4 people (75%) found this review helpful","75","3","4","0","0"
"http://steamcommunity.com/id/J3ez/recommended/67370/","J3ez","Vi","http://steamcommunity.com/id/J3ez/","279 products in account","This game is totally kickass! The gameplay is amazing and the story is astonishing!","July 12, 2014","true","9.5"," 3 of 4 people (75%) found this review helpful","75","3","4","0","0"
"http://steamcommunity.com/id/ryencoke/recommended/67370/","ryencoke","Ryencoke","http://steamcommunity.com/id/ryencoke/","1803 products in account","What a great game. Shame that the campaign was so short. I however highly suggest playing this game.\n\n8.4/10","January 22, 2014","true","5.4"," 3 of 4 people (75%) found this review helpful","75","3","4","0","0"
"http://steamcommunity.com/id/Dramira/recommended/67370/","Dramira","Cannibal Countess","http://steamcommunity.com/id/Dramira/","214 products in account","So...it's like, you're part The Crow, part New Yawk gangster, and a little Devil May Cry on top.\nThis is pretty awesome. Especially, uh, all the New Yawkness goin' on in here, ya'know? Gunna go use the dawkness to, uh... just get sum'more body bags, aright?\nReally, though! I enjoyed the gameplay and story a hell of a lot. :)","April 9, 2014","true","10.1"," 3 of 4 people (75%) found this review helpful","75","3","4","0","0"
"http://steamcommunity.com/id/pytox/recommended/67370/","pytox","¦ Pytox ¦","http://steamcommunity.com/id/pytox/","1875 products in account","Great game, although SP is only about 5 hours. There is replayability though cause of different options to choose storywise  and also powers can be upgraded differently each playthrough","March 30, 2013","true","5.4"," 3 of 4 people (75%) found this review helpful","75","3","4","0","0"
"http://steamcommunity.com/id/MasterJonah/recommended/67370/","MasterJonah","MasterJonah","http://steamcommunity.com/id/MasterJonah/","223 products in account","Best heart eating simulator to date!\n\n10/10 all the way to the end.","July 23, 2014","true","8.8"," 3 of 4 people (75%) found this review helpful","75","3","4","0","0"
"http://steamcommunity.com/id/sebastiaaaaan/recommended/67370/","sebastiaaaaan","drago","http://steamcommunity.com/id/sebastiaaaaan/","205 products in account","10/10 best tentacle simulator out there","January 20, 2014","true","5.9"," 3 of 4 people (75%) found this review helpful","75","3","4","0","0"
"http://steamcommunity.com/profiles/76561198043870460/recommended/67370/","76561198043870460","Inanimate Fucking Object","http://steamcommunity.com/profiles/76561198043870460/","194 products in account","In general a very enjoyable game. Not going to lie, it has a few kinks I hope they fix for Darkness III (oh please let it happen), but those are easy to look past considering all the other great parts of the game.\n\nGood things:\nThe story about Jenny is fantastic (minor spoiler, yes she's in the game a bit). It really got me sucked into it all because alot of very logical things surfaced when playing, which gave a rather interresting perspective about the game itself.\nThe gore...I mean come on you have to love it. Actually one of the most brutal games I've ever played, but at the same time not the most graphic one. The artstyle makes you enjoy it alot more than get grossed out by it.\nThe artstyle I can't explain why but I really like it. It has a comic noir sense to it and looks really good.\nThe gameplay has a really nice touch to it. Demons and guns, how do you say no to that? Also there's a skilltree you level up depending on how you want to play, so personalized customization for you and your abilities.\nFinally you can tell that the developers have put alot of time and effort into the game because of all the amazing voiceacting. If you feel like it you can double your gameplay time by talking to everyone possible and not only get alot of info about what's going on and personal opinions which add alot of depth to the story, you can also enjoy a comedic side to this game which I personally was happily surprised to discover.\n\nThings that can be improved:\nFirst thing that comes to mind is the amount of execution animations. Though horrendous and incredible great to watch, they get quite repetitive once you've played for a while. For the next game I wish they mix it up a bit and expand the ways you can kill people with your demons, because, and be honest to yourself, that is one of the coolest things about this game.\nSecondly I really enjoyed the story and the campaign and it all had a nice flow all the way through. I just wish for the flow to extend another few hours. I finished the game in about ten hours or so, and I really think a game should be longer than that. Especially since this one doesn't have free roaming and maybe not so much replay value since the story is such a big part of the game.\n\nOverall I give this game 8.5/10. Get it and enjoy this very unique FPS where YOU are the nightmare everyone fears ;)","July 6, 2014","true","10.0"," 3 of 4 people (75%) found this review helpful","75","3","4","0","0"
"http://steamcommunity.com/id/thatguywiththechexquestavatar/recommended/67370/","thatguywiththechexquestavatar","Shaq Fu Panda","http://steamcommunity.com/id/thatguywiththechexquestavatar/","376 products in account","They should rename this game The Dankness II.","July 9, 2014","true","11.8"," 3 of 4 people (75%) found this review helpful","75","3","4","0","0"
"http://steamcommunity.com/profiles/76561198009398717/recommended/67370/","76561198009398717","AngelSlayer","http://steamcommunity.com/profiles/76561198009398717/","155 products in account","MEET THE DARKNESS !\n\nPros\n\n-Nice Cartoonish graphic (Pretty much like Borderlands 2 style)\n\n-Innovative FPS style ,  your Tentacles 'demon' arms   can help you perform a brutal kill (Gore Gore Gore !) in multiple ways   depend on how you use it , moreover you can use it to throw any objects that the game provided  to your enemies. Let's say , the entire chapter is your playground.\n\n-Well -made NPCs , your allies have a lot of dialogues to say to you , among your progression through the storyline. Feel free to talk to them.\n\n-Very nice voice acting. Italiano....\n\n-Deep and unique storytelling.\n\n-Jenny ? (You there ??)\n\n-Evil monkey as your companion.\n\nCons\n\n-Campaign is a bit short but yet  longer than COD : Ghost (At least)\n\nOne of the most  underrated game from 2012 , grab it if you have a chance !\n\n8.5 / 10\n","December 15, 2013","true","8.1"," 3 of 4 people (75%) found this review helpful","75","3","4","0","1"
"http://steamcommunity.com/id/reart/recommended/67370/","reart","reAfter","http://steamcommunity.com/id/reart/","667 products in account","The Darkness II is good FPS of 2012, it has really nice graphics with comic style. The story is great, I liked so much those talks with mafia family members. Gameplay isn't annoying, but game requires more fatalities and weapons, because at the middle of the game it will become boring to use same stuff. In conclusion we got great FPS for one weekend, but isn't worth be recompleted. reVote 7/10","July 27, 2014","true","20.8"," 3 of 4 people (75%) found this review helpful","75","3","4","0","0"
"http://steamcommunity.com/id/l1ghTcsgo/recommended/67370/","l1ghTcsgo","plebS","http://steamcommunity.com/id/l1ghTcsgo/","161 products in account","One of the best arcade fps I've played.\nThe design is wonderfull, the story is dope, the characters are quite cool but the best is the gameplay.\nBelieve me being four handed is quite fun, you can throw spear or hold a shield while shooting down ennemies, you can realize gorish executions and more.\nYou may be a killing machine but the game is difficult, you're not in cod, the ennemies can kill you easily if you make a mistake.\nI don't see any bad points in this game, except the lack of subtitles but I didn't realy search for that.\nTotally worth buying.\nCoop seems cool too.","December 21, 2014","true","4.8"," 3 of 4 people (75%) found this review helpful 1 person found this review funny","75","3","4","0","0"
"http://steamcommunity.com/profiles/76561198081215343/recommended/67370/","76561198081215343","Mista Borg","http://steamcommunity.com/profiles/76561198081215343/","131 products in account","Darkness 2 , is one of the best games I have ever played , It includes only single player but the gameplay is just unbeliveable, I recommend this game to anyone who seeks for good gameplay which does not include multiplayer.\nIf the game had even more gameplay in it , I would compare it to all Assaisin's creed games together , as the game has so much good stuff about it.","November 25, 2014","true","7.9"," 3 of 4 people (75%) found this review helpful","75","3","4","0","0"
