"url","reviewerUsername","reviewerDisplayName","reviewerUrl","reviewerProductsCount","reviewText","date","recommended","hoursPlayed","voteText","helpfulPercent","votesHelpful","votesTotal","votesFunny","commentsCount"
"http://steamcommunity.com/id/exenderves/recommended/67370/","exenderves","-ExenderVes-","http://steamcommunity.com/id/exenderves/","604 products in account","Pros:\n-Nice soundtrack\n-Cool gameplay\n-Coop campaign\n-Mike Patton\n\nCons:\n-Short duration\n\nThis game was way better than expected. I thought it'd be bad but it ended up being an amazing game. Though there are some features from the first game that don't appear in this one, there are new features which make up for that.\n\nThe only negative aspect about this game is its duration, it took me about 17 hours to finish it twice (The first time in normal difficulty and the second one on the hardest one) and also finish the Vendetta campaign, and the hardest difficulty isn't that difficult.\n\nSo... as I said before, this is a great game and even though it can be pretty short if you're fast and don't die much, it's definitely worth paying.","July 24, 2014","true","18.5"," 1 person found this review helpful","0","1","1","0","0"
"http://steamcommunity.com/profiles/76561198083832402/recommended/67370/","76561198083832402","Pink Guy","http://steamcommunity.com/profiles/76561198083832402/","8 products in account","Jimmy made this game good\n","August 16, 2015","true","5.4"," 1 person found this review helpful","0","1","1","0","0"
"http://steamcommunity.com/id/SketchyHD/recommended/67370/","SketchyHD","SketchyHD","http://steamcommunity.com/id/SketchyHD/","22 products in account","Absolutely loved this game, the greatly story driven FPS with a search to find your beloved girlfriend was a great thrill to play through. I couldn't find myself to stop playing. As you go on through the game you find your "Darkness" to have a great impact on the story and changing the setting in great fashion, along side the monologue from Jackie Estacado after everything happens. The combat is also never a boring task as the game gives you multiple ways to either execute, mutilate or just shoot up your enemies. Anyways this game is fantastic and I can't believe it took me this long to play it.","August 9, 2015","true","5.9"," 1 person found this review helpful","0","1","1","0","0"
"http://steamcommunity.com/id/mal2/recommended/67370/","mal2","Malacalypse","http://steamcommunity.com/id/mal2/","257 products in account","Highly recmmended.","August 17, 2014","true","6.8"," 1 person found this review helpful","0","1","1","0","0"
"http://steamcommunity.com/id/werfest/recommended/67370/","werfest","WerFEST","http://steamcommunity.com/id/werfest/","295 products in account","Finally, I have done everything to achievments.\nAfter 16 hours of play, I got a double view on the recommendations of the game.\n\nFirstly, I do not particularly like when the game makes the same place for the second time. It notes that the developers can not come up with interesting content for the game. But I enjoyed the first walk the DARKNESS.\n\nSecond, a little lengthy and boring shooting.\n\nThird, the inability to skip dialogs saver (can skip, but after some time)\n\nThe game is different to the first walk, quite a cute story, especially when you meet Jenny.\nInteresting system upgrading because of which changes the gameplay and the possibility of the player.\nPerhaps not enough variety of weapons but almost always appear any of them and used most of the time.\nA bit sad optimization.\n\nI passed 100% achievement as a test for yourself. I thought to give up the game even after the first pass, but light enough to achieve returned me to the game again and again.\n\nI think the game is worth the money and it is quite possible to spend time with pleasure.","November 18, 2015","true","16.1"," 1 person found this review helpful","0","1","1","0","0"
"http://steamcommunity.com/id/kupustaa/recommended/67370/","kupustaa","Jumpman","http://steamcommunity.com/id/kupustaa/","100 products in account","Great story and gameplay mechanics. If you want to dismember people with dark energy, play this.","June 28, 2015","true","7.1"," 1 person found this review helpful","0","1","1","0","0"
"http://steamcommunity.com/id/dewby898/recommended/67370/","dewby898","Kirk Lazarus","http://steamcommunity.com/id/dewby898/","113 products in account","This game is so epic. The gameplay was great and the story was amazing, I give this game 1000/100.","December 11, 2013","true","5.7"," 1 person found this review helpful","0","1","1","0","0"
"http://steamcommunity.com/profiles/76561198243122966/recommended/67370/","76561198243122966","RaptorClaws","http://steamcommunity.com/profiles/76561198243122966/","81 products in account","I am having fun playing this game. Its not too Hi-End graphics like the games we have now ,since its an older game. However, still it interests me to play it.I recommend it and also wish that they come out with one more version of it with Cool Hi-End graphics.","September 1, 2015","true","12.7"," 1 person found this review helpful","0","1","1","0","0"
"http://steamcommunity.com/id/thetruecobra/recommended/67370/","thetruecobra","Cobra","http://steamcommunity.com/id/thetruecobra/","189 products in account","This is some real badass masterpiece, is the tragic story of Jackie and his gf Jenny, separated by death she still lives in his crecent melancholy, nothing can break his grief... hallucination, obsession, spirit and mind decending into insanity, devoured by the darkness, it lives in his heart and its time to awake...\n\nAction packed up the ♥♥♥, multiple types of attacks simultaneously, you can use guns akimbo style while attaking with the serpent demon creatures, along with many darkness perks like extra power on slashes, the swarm, gun channeling which is extra useful against multiple targets, plenty of ways to kill enemies.\n\nGraphics mantain the comic book looks of the source material, and sound its just majestic, well done dialogue and top notch voice talents, including Mike Patton as the voice of the Darkness, too ♥♥♥♥ing awesome, bad side for me: short adventure and anticlimatic finale. 8/10","October 9, 2013","true","36.5"," 1 person found this review helpful","0","1","1","0","1"
"http://steamcommunity.com/id/Dark_Souls_Prepare_to_Die/recommended/67370/","Dark_Souls_Prepare_to_Die","Kel'Thuzad","http://steamcommunity.com/id/Dark_Souls_Prepare_to_Die/","151 products in account","если вы не играли в первую часть The Darkness, то сиквел вам безусловно понравится и в первую очерез она подкупает своей жестокостью, где можно всех можно рвать в мясо. Сюжет в игре довольно премитивен, но интересно наблюдать за ним коорперативный режим тоже не плохой займёт на пару вечеров,но не более и повторюсь не советую брать тем кто играл в оригинал не буду говорить почему кто играл тот поймёт.","July 25, 2012","true","10.0"," 1 person found this review helpful","0","1","1","0","0"
"http://steamcommunity.com/id/xsoull/recommended/67370/","xsoull","⎛✖Soull⎞","http://steamcommunity.com/id/xsoull/","30 products in account","Great story, great gameplay. 10/10 recommend.  Finished it in 6 hours , but still awesome. I would play it again .","January 18","true","6.4"," 1 person found this review helpful","0","1","1","0","0"
"http://steamcommunity.com/profiles/76561198030805532/recommended/67370/","76561198030805532","Teukro","http://steamcommunity.com/profiles/76561198030805532/","68 products in account","This game has some years on it and its current price is a thing of madmen, but if you can get it on a sale, you will get a lot of content for your money.\nThe story is very good, with many fun characters, and the combat mechanics, product of the "darkness", make the gunplay very fun. After finishing it, you can try to play it again with the full power set from the start, putting those amazing powers in display. Gore galore.\nTo top it off, you get an extra campaing (online coop or offline solo) and some extra assasinations mission, with 4 new characters to explore.","January 10","true","12.6"," 1 person found this review helpful","0","1","1","0","0"
"http://steamcommunity.com/id/killerodin27/recommended/67370/","killerodin27","Odin","http://steamcommunity.com/id/killerodin27/","133 products in account","Not a long game, but it is a good game.\nCheck it out on discount. Worth $10, not $30.","January 29","true","4.3"," 1 person found this review helpful 1 person found this review funny","0","1","1","0","0"
"http://steamcommunity.com/id/peterhollo/recommended/67370/","peterhollo","CorvusCorax","http://steamcommunity.com/id/peterhollo/","533 products in account","Aren't these the guys who developed Unreal and Unreal Tournament? I know of no other Digital Extremes. Beside them you also have 2K so you really have everything you need to make a really good game.\n\nI never played the first one as it was never released on PC. But from what I understand the story takes place a couple of years after the events of its predecessor. You play the don of an infamous crime family who is attacked at the beginning of the story. One of the rival gangs almost eliminates Jackie, our protagonist, who eventually gives in to the Darkness which saves his life.\n\nAnd this is where the game gets interesting: Jackie has two tentacles protruding from his body and you can use them to crush, dismember or simply slice up your enemies. Oh, and of course you have your good old pistols, machine guns and shotguns to annihilate all the bad guys approaching you. Jackie did not want the Darkness to return - under the circumstances, however, he needs to rely on them and throughout the game you need to find out who and why attacked you in the restaurant.\n\nWith the tentacles you can also pick up objects - e.g. the door of a vehicle - and throw them at your enemies. And as you can do some dual wielding with the firearms you can practically say you are doing quad wielding with the two tendrils. How cooler can a game be, am I right? With the killings you can collect what the game calls essence; a substance that eventually lets you purchase new powers or the upgraded version of the ones you already have. It should also be note that as the title refers to it darkness is also Jackie's ally - if you are in an illuminated area the tentacles immediately retract.\n\nDarkness II is a fast-paced action horror game that utilises a cel-shading technique to give the game a comic book influenced visual style. Multiplayer is limited to cooperative gameplay that does not really add anything to the story but lets you enjoy quad wielding with your friends.\n\nI highly recommend it - for 30 EUR it's a bit too much at the moment but you should definitely pick this one up if discounted.","March 9, 2014","true","13.6"," 1 person found this review helpful","0","1","1","0","0"
"http://steamcommunity.com/profiles/76561198119057120/recommended/67370/","76561198119057120","malpiszon7","http://steamcommunity.com/profiles/76561198119057120/","1253 products in account","Well, this was an interesting game to play. A fresh air after playing so many crappy indie productions.\n\nPros:\n- the plot is kind of nice if you know something about Image Comics and the Artifacts series - reading the story of hidden relics and immersing in the whole Darkness backstory is really fun\n- graphics are well fitting into comic book stylistics\n- playing with the Darkness tentacles is really fun\n- the whole concept of destroying light sources in order to be able to use the Darkness is an interesting idea, well fitting into the whole concept of the Darkness\n- character development system is not overwhelming the whole game - there is no point in maxing out character except for pure fun\n- some abilities give a lot of tactical advantages and possibilities - black holes can be of great help and autoaiming provided by one of high tier abilities, even while lasting about 5 seconds, can make the difference\n- last levels in hell are very nice and atmospheric\n\nCons:\n- the plot is kind of dumb if you're not into The Darkness comic books - Darkness says something, blablabla, Angelus blablabla, Brotherhood blablabla, vengance yadayada, Jenny hurrdurr, so on and so forth\n- you cannot skip some cutscenes - this is really bad\n- well, considering this is a shooter there aren't many different weapons - pistol, revolver, desert eagle, two different shotguns, winchester (you have it for about 15 minutes), two or three smgs, two or three different assault rifles and that's all\n- guns can use ammo really fast and there are not really that many ammo boxes laying around so you can find yourself in a situation where you don't have any bullets to shoot\n- I think that the games relies too much on the finisher mechanics - need to replenish health? Use Finisher #1. Need to get some additional ammo - guessed it, Finisher #2. Considering that uzis and other guns do use ammo pretty fast you may find yourself in a situation that you try to finish enemies with Finisher #1 or #2\n- special abilities are fun to use, but recharge slow and you don't really need them - they help, true, but they are not game changing abilities like for example slow motion in Max Payne 1.\n- this game is short (about 6-7 hours)\n\nAs you can see I have described many cons so you may think that this is a mediocre game. By any means no, this is a really good game, I had a lot of fun playing it. There is New Game + option after beating the game, which adds some playtime if someone would like to go for the second run and max out character abilities. In the first run I think you can get 60-70% of all abilities so there is just enough reason to play the game for the second time.\n\nI just pass this option because I don't like to watch the same long cutscenes over again.\n\nAnyways... you can try Demo. Go and try it.\n\n----------\nFor anyone interested in joining in on completing your own backlog; check it out here - http://steamcommunity.com/groups/completingthebacklog/discussions/5/530645446320364338/","January 16","true","11.0"," 1 person found this review helpful","0","1","1","0","0"
"http://steamcommunity.com/profiles/76561198134122159/recommended/67370/","76561198134122159","Firetail123","http://steamcommunity.com/profiles/76561198134122159/","164 products in account","Best Game ive played in a long time Amazing Game Plz Make Darkness 3 or dlc or something PLEASE SO AMAZING PLZ LISTEN TO ME WHEN I SAY THIS IS A GREAT GAME TO PLAY !!!!!!!!!!!!!!!!!!!!!!!!!!!!!!!!!!!!!!!!!!!!!!!!!!!!!!!!!","August 29, 2014","true","3.7"," 1 person found this review helpful","0","1","1","0","0"
"http://steamcommunity.com/profiles/76561198155789857/recommended/67370/","76561198155789857","brucekjeff55","http://steamcommunity.com/profiles/76561198155789857/","14 products in account","Overall I would say about 8/10. Love the story and the way you upgrade Jackie. The combat however is a bit stale. The boss fights are all pretty much the same. But if story is more important to you then I would definitely check this game out.\n\nPros:\nGood graphics\nGreat story\nGreat audio and voice acting\n\nCons:\ncombat gets a bit stale towards the end\nRepetitive enemies and bosses","January 6","true","20.7"," 1 person found this review helpful","0","1","1","0","0"
"http://steamcommunity.com/profiles/76561198018953177/recommended/67370/","76561198018953177","Phantasmagoria","http://steamcommunity.com/profiles/76561198018953177/","136 products in account","I pulled a man's spine out of his ♥♥♥♥","December 26, 2015","true","9.4"," 1 person found this review helpful 1 person found this review funny","0","1","1","0","0"
"http://steamcommunity.com/id/misterfiend/recommended/67370/","misterfiend","Mister Fiend Zero","http://steamcommunity.com/id/misterfiend/","890 products in account","It ain't terrible.","December 9, 2013","true","9.4"," 1 person found this review helpful","0","1","1","0","0"
"http://steamcommunity.com/profiles/76561198044635875/recommended/67370/","76561198044635875","wagman","http://steamcommunity.com/profiles/76561198044635875/","130 products in account","This is a game that took me by surprise. After hearing average reviews of this game, I went to it expecting the average, run of the mill FPS that we've recently become accustomed to. Not only was it above average and exceeded what I was expecting, it killed it. Almost everything in this game was done well, and even some of the stuff that missed still wasn't that bad.\n\nPlot: The Darkness 2 is about Jackie Estacado, the protagonist from the first game that you may remember, if you played it. That being said though, you don't have to have played the first one to understand the story of this one. It's been a few years since the events of the first game, and the death of Jenny. Jackie's been keeping the darkness under control, but after a hit is put out on him, he can't control it anymore. You'll learn about ancient artifacts, a secret society, and two different endings, which offers a bit of replay value.\n\nSetting: This game has many different set pieces, and while the first hour or so is repetitive in terms of the stages, the rest of the game has much more creative level design. Even in the hallucinations he has, the asylum is one of the most interesting and also tense settings I've ever seen, providing a frightening reality of being trapped and unable to escape. If you choose the ending to fight the darkness and save Jenny, you'll have to fight in Hell, which is in my opinion, one of the most beautiful levels I've seen in a game, ever.\n\n\nGameplay: On its surface, The Darkness 2 may seem like a bog standard shooter, and at some points, it is. But Jackie gets all sorts of awesome and violent powers to wield. With many skills you can level up using "essence" (a sort of xp you get for doing various things, including killing enemies and getting collectables), you can do "executions", which include ripping someone in half for health, or pulling someone's spine literally out of their ♥♥♥ (creatively called an "assecution"). That being said though, after you do each execution a few times, it gets old. And if you're playing on the harder difficulties, you need to do them to keep getting health and ammo. Luckily though, enemies can't damage you while they're being performed.\n\nHowever, one fault that the game has is that the main story is a little too short. It can be beaten, if you dedicated, in about 5-6 hours, maybe a little longer if you go for relics. There is a "New Game +" mode, where you get to keep all your power ups and essence, but it's the same game, only slightly harder. The game does offer "Vendettas", which allow you to play as a different character than Jackie, each with their own ability. These vendettas will take you about 3 hours or so, depending on what difficulty you choose, and there's also bonus missions you can do. Online multiplayer is there too, but it seems that nobody is playing it.\n\nVerdict: Overall, The Darkness 2 is a good game. It's not ground breakign, but it's a fun ride that will keep you occupied for at least 5 hours. With two endings, one of them that was heartbreaking, at least for me, and a fun, brainless, Vendetta mode, this game should offer some good, violent, and disgusting entertainment. I reccommend it strongly. Check it out.","December 30, 2013","true","13.2"," 1 person found this review helpful","0","1","1","0","0"
"http://steamcommunity.com/id/hohiboo/recommended/67370/","hohiboo","Hohiboo","http://steamcommunity.com/id/hohiboo/","976 products in account","Update 12/25/2015\nReinstalled the game yesterday and played through the whole story.  Relatively quick 4-5 hours (if looking for relics occasionally). Really fun and entertaining throughout the whole game.  The kills are quite creative and I highly recommend this game (more than before).\n\n_________________________________________________________________________________\nAmazing game where you have the power to control an old power called the Darkenss. You can use the arms to destroy and dismember every single thing in your path. Its a very fun and enjoyable game. I would recomend getting this game","August 8, 2014","true","6.6"," 1 person found this review helpful","0","1","1","0","0"
"http://steamcommunity.com/id/BethanyAmelia/recommended/67370/","BethanyAmelia","Snow","http://steamcommunity.com/id/BethanyAmelia/","218 products in account","I found this to be a refreshing "solo" fps game. The multiple choice of weapons + demonic powers made it stand out from the usual game genre. I found the story line to be somewhat exciting to the point of, I simply couldn't stop playing until I had completed the game. I'm a massive fan of the DMC series and to an extent it had the same elements.\n\n10/10 would play again.\n\nMy only issue with this game, is occassionally I would have bugs where I had to reset my checkpoint in order to progress. Overall a fantastic game.","November 10, 2015","true","11.7"," 1 person found this review helpful","0","1","1","0","0"
"http://steamcommunity.com/id/alchineer/recommended/67370/","alchineer","Alchineer","http://steamcommunity.com/id/alchineer/","272 products in account","Play it with Iron Maiden - Number of the Beast","August 22, 2014","true","1.1"," 1 person found this review helpful","0","1","1","0","0"
"http://steamcommunity.com/id/misterfiend/recommended/67370/","misterfiend","Mister Fiend Zero","http://steamcommunity.com/id/misterfiend/","890 products in account","It ain't terrible.","December 9, 2013","true","9.4"," 1 person found this review helpful","0","1","1","0","0"
"http://steamcommunity.com/id/xsoull/recommended/67370/","xsoull","⎛✖Soull⎞","http://steamcommunity.com/id/xsoull/","30 products in account","Great story, great gameplay. 10/10 recommend.  Finished it in 6 hours , but still awesome. I would play it again .","January 18","true","6.4"," 1 person found this review helpful","0","1","1","0","0"
"http://steamcommunity.com/id/psych0p4t/recommended/67370/","psych0p4t","// ACiiD","http://steamcommunity.com/id/psych0p4t/","108 products in account","I can eat hearts..... 10/10","July 12, 2014","true","7.6"," 1 person found this review helpful","0","1","1","0","0"
"http://steamcommunity.com/id/gilion1/recommended/67370/","gilion1","gilion","http://steamcommunity.com/id/gilion1/","128 products in account","befor you play this game atleast watch a playthrough of the first one or else you wont understand what is happening storywise","February 6, 2012","true","20.5"," 1 person found this review helpful","0","1","1","0","0"
