"url","reviewerUsername","reviewerDisplayName","reviewerUrl","reviewerProductsCount","reviewText","date","recommended","hoursPlayed","voteText","helpfulPercent","votesHelpful","votesTotal","votesFunny","commentsCount"
"http://steamcommunity.com/id/yurupari/recommended/95900/","yurupari","yuru","http://steamcommunity.com/id/yurupari/","1608 products in account","I do not like plane sims","January 2, 2015","false","2.0"," 0 of 6 people (0%) found this review helpful","0","0","6","0","0"
"http://steamcommunity.com/id/TeamTom/recommended/95900/","TeamTom","TeamTom","http://steamcommunity.com/id/TeamTom/","2816 products in account","Not exactly a high quality AAA title, lacks very basic settings you should now expect from any PC game, resolution settings at the very least, but sadly, nothing, so you are forced to play in a square box at some pretty poor looking models.\n\nThe game play itself is pretty solid, I assume this is very basic flight simulator stuff though, taking off and landing is very easy, it takes a lot for you to stall your plane. There is a wide selection of different planes to choose from at the start of your missions, each having their own different stats, strengths and weaknesses. I won't spoil too much, but one of the planes is so much better than any of the others so the large choice is kind of pointless once you work it out.\n\nThere is an essence of customization when you reach certain goals, you will be granted experience points to improve your character (planes). I focused on agility and luck (which increases your critical shot chance), and this turned my plane into a little nippy bomber that could avoid pretty much any rockets!\n\nThe main story took me about 8-9 hours to complete,  and it was quite an enjoyable play through. There is plenty of re-playability in the arcade mode, which is where I spent most of my time.\n\nI would recommend this game, however if you are playing this expecting a crisp AAA experience, you will be disappointed, if you go into this with the only expectation is that you are going to fly a plane and blow stuff up, you'll enjoy it.\n\n7/10","December 11, 2014","true","31.2"," 8 of 23 people (35%) found this review helpful 1 person found this review funny","35","8","23","0","0"
"http://steamcommunity.com/id/dohuytuong/recommended/95900/","dohuytuong","Tuong","http://steamcommunity.com/id/dohuytuong/","2330 products in account","Air Conflicts: Secret Wars is an arcade flight simulation set in a world war I + II scenario. During the 7 campaigns the player has to fly and fight through 49 missions. Before taking off, the player can choose between different aircrafts, each with different strengths and weaknesses.\n\nWithin the missions the player gets different objectives like patrolling, sneaking, hit & run, bombing and escorting. Objectives are presented as dialogues between different characters. After some missions the player can upgrade one of his skills in order to maneuver the airplanes easier, have more endurance or have your wingman boosted. Further, the player can choose between two control schemes. Arcade and simulation. The first one makes the game easier to control, while the second one gives more options to control the aircraft.\n\nBeside the campaign the game also features several multiplayer modes, local and via internet for up to four players.","January 7, 2014","true","551.7"," 12 of 32 people (38%) found this review helpful","38","12","32","0","0"
"http://steamcommunity.com/id/steamprofileforme/recommended/95900/","steamprofileforme","LockDown172","http://steamcommunity.com/id/steamprofileforme/","62 products in account","This game sucks. Im sorry, but the inverted controls and bad graphics ruin it. 0/10\n","June 22, 2014","true","0.3"," 0 of 7 people (0%) found this review helpful","0","0","7","0","0"
"http://steamcommunity.com/profiles/76561198051882220/recommended/95900/","76561198051882220","johnsanders","http://steamcommunity.com/profiles/76561198051882220/","10 products in account","will not run vido.  will run blank screen  if i could see it it might be good","July 6, 2014","false","65.6"," 0 of 8 people (0%) found this review helpful","0","0","8","0","0"
"http://steamcommunity.com/profiles/76561197988077759/recommended/95900/","76561197988077759","danny_maland","http://steamcommunity.com/profiles/76561197988077759/","156 products in account","Sort of a "poor man's Ace Combat," this game can be quite fun. The core flight and combat mechanics are simple, but competently executed. This makes for gameplay that remains basically fun, even if it isn't all that varied.\n\nThe game does indeed have some flaws. The voice acting is sometimes unconvincing, and every so often you'll catch an error where earlier text dialogue loads into the subtitle area. The stealth mission functionality is not as advertised - there's no "detection zone" displayed on your radar - and so certain stealth missions present a frustrating difficulty spike. There are little hints here and there of features that didn't quite get fully implemented, but still made it in somehow.\n\nBut the game is remarkably fun, because even simplified, "arcade-style" air combat can offer lots of opportunities to try a mission in a slightly different way.\n\nNo, this isn't a AAA title, but it can be highly enjoyable if you're willing to "suspend your disbelief" a bit and enjoy the ride.","November 30, 2014","true","22.2"," No ratings yet","0","0","0","0","0"
"http://steamcommunity.com/id/0maxx0/recommended/95900/","0maxx0","[maxx]","http://steamcommunity.com/id/0maxx0/","112 products in account","Arcade air combat game with quite pleasant graphics & sound, but very (very) shallow plot.\n6/10.","October 8, 2013","true","8.3"," No ratings yet","0","0","0","0","0"
"http://steamcommunity.com/id/snakedrone/recommended/95900/","snakedrone","SnakeDrone","http://steamcommunity.com/id/snakedrone/","571 products in account","Seems to be exactly what I was looking for in the genre. Haven't had a lot of time to play it yet. But on the first test it fully supported my joystick (Logitech X3D pro) unlike few other resently released titles. The plane seemed to handle like I expaected them to do. Honestly I just played 1 dogfight, so I wount comment on the campaign mode. My biggest problem with this title is that it doesn't support 1080p resolution.","January 7, 2012","true","0.2"," No ratings yet","0","0","0","0","0"
"http://steamcommunity.com/id/backstory/recommended/95900/","backstory","AM Bakastory","http://steamcommunity.com/id/backstory/","1186 products in account","This game plays like Rogue Squadron in World War 2. If that's not appealing in some way, then I just don't know about you... The story is even pretty decent and cuts between WW1 and 2 dogfights. Occasionally really pretty looking too.","December 24, 2012","true","9.3"," No ratings yet","0","0","0","0","0"
"http://steamcommunity.com/id/PR0XIDIAN/recommended/95900/","PR0XIDIAN","Joe Isuzu (PR0XIDIAN)","http://steamcommunity.com/id/PR0XIDIAN/","1494 products in account","Best flight game I've found on steam yet. The missions are fun, the controls are easy to learn when set to arcade style. Hell, it even supports my 360 controller. When looking for a dogfighting game in steam, look no further. Air conflicts secret wars is tons of fun and well put together.","July 6, 2012","true","0.6"," No ratings yet","0","0","0","0","0"
"http://steamcommunity.com/id/derezzedjack/recommended/95900/","derezzedjack","Derezzedj4ck","http://steamcommunity.com/id/derezzedjack/","386 products in account","Around two years ago I was looking for a game about piloting planes and possibly shooting other planes, because I was always somewhat interested in this sort of genre. Since I'm not really into simulations I thought I try out the "Blazing Angels" games, but Ubisoft apparently can't make games work on Windows 7 and so far I wasn’t able to run both “Blazing Angels” games on my pc.\n\nSo I was still looking for a game to scratch that itch I was having. I then stumbled onto "Air Conflicts: Secret Wars". Looking primarily for a game that would let me fly something like prototype planes from the Second World War I thought with a title like "Secret Wars" I'd hit the jackpot.\n\nWell, after about 5 hours I'm sure of a few things:\n(0. So far I haven't seen a plane I would describe as a prototype, just the standard planes of British and Russian fighter planes and/or bombers. But this is mostly my fault for expecting something that the game probably doesn't provide. That’s the reason I’m not factoring this in my overall opinion of the game, but I thought I let you know.)\n\n1. I had to restart my campaign progression, because I couldn't find my save files after I de-installed the game, so I spent the last hour or so of my whole experience with this game getting back to where I was before.\nBut after only 5 hours I seriously couldn't drag myself through the campaign again. Story wise it progresses very slowly, since there isn't much happening inside of the mission except for a few radio messages every now and then. "Cutscenes" outside of the missions are made with a comic-like style and subtitles (although they are narrated). Everything else is pure text (mostly diary entries).\nAlso missions seem to be very repetitive (from what I've seen of the game). So far it's been pretty much about shooting other fighter planes, shooting bombers, destroying stationary ground targets, destroying moving ground targets and sometimes defending other planes by doing the before mentioned things. Although it’s maybe a bit unfair to expect more of this sort of game.\n\n2. Overall control of the planes and how keys are setup works really nice, although some advanced maneuvers, like looping or barrel-rolls don't seem to be possible. I was playing on the arcade mouse + keyboard setting, so it's maybe possible that controlling the game with a joystick or something similar might enable it.\n\n3. Shooting other planes felt like fun, although I couldn't really find a good middle way with the difficulty settings. Either I was shooting everything easily while not really getting shot at (aside from stationary AA) or I was damaged far too fast for me to enjoy the game. So while the original control and feeling for a plane is nice, it just isn’t fun for too long, when barely anything gives you a fight and what you’re doing is pretty much flying circles to get a few hits on target and repeat.\n\nOver all I could say it probably wasn't the game I was looking for (I'm much more sure it was "Blazing Angels" but that didn't work out). I should have also probably checked a few reviews or just some random campaign gameplay before I bought it.\nIt's just that the game isn't bad, maybe the story gets better after a while or the missions are more varied in the end, but to get there I don't want to go through the first missions again.\n\nAlthough I don’t have knowledge of the full game, after the 5+ hours I have no desire to play it again, because have tried to get into the game, but it just won’t click, like many other games do.\nSo no, I cannot recommend this game.","December 8, 2013","false","5.3"," No ratings yet","0","0","0","0","0"
"http://steamcommunity.com/profiles/76561197981203183/recommended/95900/","76561197981203183","","http://steamcommunity.com/profiles/76561197981203183/","356 products in account","Cool little indie arcade flight sim, there's about 50 missions at about 8 min each one, it can be played either in arcade or simulation mode, it was in one of the indie bundles, cool game to waste some time.","September 11, 2012","true","7.1"," No ratings yet","0","0","0","0","0"
"http://steamcommunity.com/id/PR0XIDIAN/recommended/95900/","PR0XIDIAN","Joe Isuzu (PR0XIDIAN)","http://steamcommunity.com/id/PR0XIDIAN/","1494 products in account","Best flight game I've found on steam yet. The missions are fun, the controls are easy to learn when set to arcade style. Hell, it even supports my 360 controller. When looking for a dogfighting game in steam, look no further. Air conflicts secret wars is tons of fun and well put together.","July 6, 2012","true","0.6"," No ratings yet","0","0","0","0","0"
"http://steamcommunity.com/profiles/76561198044629701/recommended/95900/","76561198044629701","Katze !","http://steamcommunity.com/profiles/76561198044629701/","236 products in account","looks nice but actually i didnt understand","August 22, 2012","true","0.2"," No ratings yet","0","0","0","0","0"
"http://steamcommunity.com/id/derezzedjack/recommended/95900/","derezzedjack","Derezzedj4ck","http://steamcommunity.com/id/derezzedjack/","386 products in account","Around two years ago I was looking for a game about piloting planes and possibly shooting other planes, because I was always somewhat interested in this sort of genre. Since I'm not really into simulations I thought I try out the "Blazing Angels" games, but Ubisoft apparently can't make games work on Windows 7 and so far I wasn’t able to run both “Blazing Angels” games on my pc.\n\nSo I was still looking for a game to scratch that itch I was having. I then stumbled onto "Air Conflicts: Secret Wars". Looking primarily for a game that would let me fly something like prototype planes from the Second World War I thought with a title like "Secret Wars" I'd hit the jackpot.\n\nWell, after about 5 hours I'm sure of a few things:\n(0. So far I haven't seen a plane I would describe as a prototype, just the standard planes of British and Russian fighter planes and/or bombers. But this is mostly my fault for expecting something that the game probably doesn't provide. That’s the reason I’m not factoring this in my overall opinion of the game, but I thought I let you know.)\n\n1. I had to restart my campaign progression, because I couldn't find my save files after I de-installed the game, so I spent the last hour or so of my whole experience with this game getting back to where I was before.\nBut after only 5 hours I seriously couldn't drag myself through the campaign again. Story wise it progresses very slowly, since there isn't much happening inside of the mission except for a few radio messages every now and then. "Cutscenes" outside of the missions are made with a comic-like style and subtitles (although they are narrated). Everything else is pure text (mostly diary entries).\nAlso missions seem to be very repetitive (from what I've seen of the game). So far it's been pretty much about shooting other fighter planes, shooting bombers, destroying stationary ground targets, destroying moving ground targets and sometimes defending other planes by doing the before mentioned things. Although it’s maybe a bit unfair to expect more of this sort of game.\n\n2. Overall control of the planes and how keys are setup works really nice, although some advanced maneuvers, like looping or barrel-rolls don't seem to be possible. I was playing on the arcade mouse + keyboard setting, so it's maybe possible that controlling the game with a joystick or something similar might enable it.\n\n3. Shooting other planes felt like fun, although I couldn't really find a good middle way with the difficulty settings. Either I was shooting everything easily while not really getting shot at (aside from stationary AA) or I was damaged far too fast for me to enjoy the game. So while the original control and feeling for a plane is nice, it just isn’t fun for too long, when barely anything gives you a fight and what you’re doing is pretty much flying circles to get a few hits on target and repeat.\n\nOver all I could say it probably wasn't the game I was looking for (I'm much more sure it was "Blazing Angels" but that didn't work out). I should have also probably checked a few reviews or just some random campaign gameplay before I bought it.\nIt's just that the game isn't bad, maybe the story gets better after a while or the missions are more varied in the end, but to get there I don't want to go through the first missions again.\n\nAlthough I don’t have knowledge of the full game, after the 5+ hours I have no desire to play it again, because have tried to get into the game, but it just won’t click, like many other games do.\nSo no, I cannot recommend this game.","December 8, 2013","false","5.3"," No ratings yet","0","0","0","0","0"
"http://steamcommunity.com/profiles/76561197962001763/recommended/95900/","76561197962001763","[CUC] Funiculus","http://steamcommunity.com/profiles/76561197962001763/","259 products in account","By far the weakest of the "Air Conflicts" series of games.  The campaign is highly repetitive and the AI is little match for a child let alone an experienced flight sim buff.  The graphics and aircraft damage are very well done, scenery looks quite nice.  The real selling factor on this is the multiplayer which can be quite a bit of fun.  Unfortunately, the community for it has dried up a bit with the release of subsequent titles, so you're better off buying those both for a better campaign and the larger online multiplayer community.  The game's not terrible, but I just can't recommend a purchase given the draw backs and easily available alternatives.","December 21, 2013","false","5.7"," No ratings yet","0","0","0","0","0"
"http://steamcommunity.com/id/08111/recommended/95900/","08111","111","http://steamcommunity.com/id/08111/","77 products in account","Nice game! Nice quality! / Хорошая игра! Хорошего качества!","November 29, 2012","true","0.4"," No ratings yet","0","0","0","0","0"
"http://steamcommunity.com/id/WelcomeToThePartyPal/recommended/95900/","WelcomeToThePartyPal","WelcomeToThePartyPal!!","http://steamcommunity.com/id/WelcomeToThePartyPal/","133 products in account","Fun Enteraining game reminds me of old 2d game Secret Weapons of the Luftwaffe which is now abandonware and free to download at many site but here is one http://www.xtcabandonware.com/game/1386/secret-weapons-of-the-luftwaffe\n\nControls are simple with multi ways to control your aircraft with the use of Mouse/Keyboard Arcade mode, Joystick/Keyboard Simulator mode, Gamepad Arcade mode.\n\nI have started the game playing in Joystick/Gampad with Arcade mode because I do not own the proper Flight Joystick to play the game in Simulator mode without going nutts. I have not try yet but i doubt It will be enjoyable  playing in simulator mode with a Gamepad. The aircraft fly well and the story so far has been entertaining as you are a girl who's father was an Ace in WW2.\n\nGraphices are nice the terrain has detailed buildings, docks, ships, tanks, vehicals the usual things you would find in a arcade sim. Have not tryed the online mutiplayer yet I hope it is as enjoyable as the single player mode.\n\nThe game and two more games of the same nature are on sale right now 75% of so you get Air Conflicts: Secret Wars, Air Conflicts: Pacific Carriers & Air Conflicts: Vietnam all for $11 and some odd cents well worth it if you like these types of games.\n\nNot sure if they have coop support but if they do and anyone wants to be my wingman I would Love to give it a try just send me a msg/invite.\n\nUpdate. I have ust completed the Campain it was a blast the story telling was very good and missions well thought. There are alot of missions in the campain which is a good thing didn't want it to end to soon. After playing the game a while it really reminded me of a classic SNES game called Aces High or Wings 2 Aces High, I loved playing that game fighting the aces at the end and if your pilot died he stayed dead. You had 5 pilots each with there own unquie skills each one was skilled best for certain missions, strafing/bombing/air combat so on. This game has a few hard missions like shooting down a zillion guys parachuting out of bombers that mission took many trys to complete but it was fun. This game is a classic to me now. Well on to the next one "Air Conflicts: Pacific Carriers", hope it is as enjoyable as "Air Conflicts: Secret Wars"","March 22, 2014","true","22.2"," No ratings yet","0","0","0","0","0"
"http://steamcommunity.com/profiles/76561198067714224/recommended/95900/","76561198067714224","Blaze","http://steamcommunity.com/profiles/76561198067714224/","55 products in account","As a fan of Ace Combat 5 and Zero, I miss a good flight game now that Im playing more PC games. Air Conflcits fills that nice for a good old semi realistic flight game perfectly. Some people complain or have arguements against the intro picture at the start of new missions, but I think they add a charm that is compariable to the charm given by the Earth Defense Force Series. There is also stealth parts in missions, which a unique feature not seen in most flight games. However, the controls are a bit wonky for a gamepad, but once learned you can make some interesting dogfighting moves. All in all, worth the ten bucks if you have been itiching for a an arcade-simulation flight game for  a while","March 2, 2014","true","10.2"," No ratings yet","0","0","0","0","0"
"http://steamcommunity.com/profiles/76561198007655039/recommended/95900/","76561198007655039","ByteTheDust","http://steamcommunity.com/profiles/76561198007655039/","619 products in account","Simple but fun gameplay with a nice single player campaign to go with it. What more do you need.\n\nThe voice acting is s**t though.","March 4, 2014","true","8.7"," No ratings yet","0","0","0","0","0"
"http://steamcommunity.com/id/Fedexico/recommended/95900/","Fedexico","Fedexico","http://steamcommunity.com/id/Fedexico/","280 products in account","A fresh foray into a genre I do not normally touch and one which I did not regret in the least. Air Conflicts: Secret Wars is an accade flying game at its core and takes place primarly during WWII (with some flashbacks to WWI), throwing you into the cockpit of dozens of different airplanes during dangerous and daring missions. While this game is not a realistic flight simulator, it does not pretend to be. Instead, Air Conflicts offers a fun, exciting, and gripping story as you battle your way through the various missions. Give this game a look if you want to try out a flying game with more emphesis on story than on true flight simulation realism.","December 22, 2012","true","10.2"," No ratings yet","0","0","0","0","0"
"http://steamcommunity.com/id/shadowhunter103/recommended/95900/","shadowhunter103","DARKNESS","http://steamcommunity.com/id/shadowhunter103/","75 products in account","not too bad good fun","April 4, 2014","true","12.8"," No ratings yet","0","0","0","0","0"
"http://steamcommunity.com/profiles/76561198026628147/recommended/95900/","76561198026628147","TheGodfather","http://steamcommunity.com/profiles/76561198026628147/","35 products in account","This game is crap!","January 2, 2013","true","0.3"," No ratings yet","0","0","0","0","0"
"http://steamcommunity.com/profiles/76561198007655039/recommended/95900/","76561198007655039","ByteTheDust","http://steamcommunity.com/profiles/76561198007655039/","619 products in account","Simple but fun gameplay with a nice single player campaign to go with it. What more do you need.\n\nThe voice acting is s**t though.","March 4, 2014","true","8.7"," No ratings yet","0","0","0","0","0"
"http://steamcommunity.com/id/shadowhunter103/recommended/95900/","shadowhunter103","DARKNESS","http://steamcommunity.com/id/shadowhunter103/","75 products in account","not too bad good fun","April 4, 2014","true","12.8"," No ratings yet","0","0","0","0","0"
"http://steamcommunity.com/id/zrad/recommended/95900/","zrad","R4DFIELD","http://steamcommunity.com/id/zrad/","356 products in account","Cool little indie arcade flight sim, there's about 50 missions at about 8 min each one, it can be played either in arcade or simulation mode, it was in one of the indie bundles, cool game to waste some time.","September 11, 2012","true","7.1"," No ratings yet","0","0","0","0","0"
"http://steamcommunity.com/id/PR0XIDIAN/recommended/95900/","PR0XIDIAN","Joe Isuzu (PR0XIDIAN)","http://steamcommunity.com/id/PR0XIDIAN/","1494 products in account","Best flight game I've found on steam yet. The missions are fun, the controls are easy to learn when set to arcade style. Hell, it even supports my 360 controller. When looking for a dogfighting game in steam, look no further. Air conflicts secret wars is tons of fun and well put together.","July 6, 2012","true","0.6"," No ratings yet","0","0","0","0","0"
"http://steamcommunity.com/id/backstory/recommended/95900/","backstory","AM Bakastory","http://steamcommunity.com/id/backstory/","1186 products in account","This game plays like Rogue Squadron in World War 2. If that's not appealing in some way, then I just don't know about you... The story is even pretty decent and cuts between WW1 and 2 dogfights. Occasionally really pretty looking too.","December 24, 2012","true","9.3"," No ratings yet","0","0","0","0","0"
"http://steamcommunity.com/id/m1014/recommended/95900/","m1014","Wreck It Eric","http://steamcommunity.com/id/m1014/","88 products in account","Horrible, simply, horrible. Poor game play, terrible controls, just a crap game.","March 28, 2015","false","0.6"," No ratings yet","0","0","0","0","0"
"http://steamcommunity.com/id/Logun007/recommended/95900/","Logun007","Logun","http://steamcommunity.com/id/Logun007/","636 products in account","Recommend or not recommend is such a polarizing review method. I played for a short time and buzzed through the first first levels. It was enjoyable enough but I found the story too thin for me and the game play bland. I became confused on the last level as to what I actually needed to do. While I am "recommending" this game I doubt I will ever pick it up again.\n\nThat's me though, it still played well enough that it may turn out to be some one else's cup of tea.","March 13","true","0.5"," No ratings yet","0","0","0","0","0"
