"url","reviewerUsername","reviewerDisplayName","reviewerUrl","reviewerProductsCount","reviewText","date","recommended","hoursPlayed","voteText","helpfulPercent","votesHelpful","votesTotal","votesFunny","commentsCount"
"http://steamcommunity.com/profiles/76561198006175835/recommended/95900/","76561198006175835","IrisZero.-","http://steamcommunity.com/profiles/76561198006175835/","59 products in account","Only a few min to finish a mision, thats why 49 in total.\nPoor mision content, bring this ♥♥♥♥ here and then go here, done and sometimes no enemies in it. easy+.\nThe invisibility system sucks, not fun at all trying to avoid being seen\nWW2 game? if u are expecting an epic battles all over europe with a really nice motivation like\nwas in Air conflicts: Pacific Carriers, u will find a stupid mercenary girl with annoying voice\nand not a ♥♥♥♥♥♥ single movie just a bad comic in the introduction of every mision.\n\nWasted 5 euros in this ♥♥♥♥. Not recomended","November 29, 2014","false","1.2"," No ratings yet 1 person found this review funny","0","0","0","0","0"
"http://steamcommunity.com/profiles/76561198023397641/recommended/95900/","76561198023397641","keep_on_rocking","http://steamcommunity.com/profiles/76561198023397641/","48 products in account","A great game overall, with a good story and great unlockables and planes. I only wish they had added the lancaster...","January 17","true","110.5"," No ratings yet","0","0","0","0","0"
"http://steamcommunity.com/id/ubercrue/recommended/95900/","ubercrue","[UC]Uber","http://steamcommunity.com/id/ubercrue/","189 products in account","Hats off to producers/publishers and devs of this game. It's older but OMG, the multiplayer actually works! Unlike 80% of the crap out there. Flawless install, nice GFX and easy to get a game going with your homies. Had it installed and playing with my bros in less than 5 minutes. Highly recommended!","June 2, 2015","true","0.2"," No ratings yet","0","0","0","0","0"
"http://steamcommunity.com/profiles/76561198106436283/recommended/95900/","76561198106436283","stanb70","http://steamcommunity.com/profiles/76561198106436283/","13 products in account","I can only say this game should work with my XP but it did not, I had problems with other works in progress games So, I asked for and got a refund. Stan. B","June 30, 2015","false","0.2"," No ratings yet","0","0","0","0","0"
"http://steamcommunity.com/id/LordAsgard/recommended/95900/","LordAsgard","Lord Setesh","http://steamcommunity.com/id/LordAsgard/","178 products in account","A good flying arcade game with storyline but dead multiplayer. It may take a while to adjust with the mouse movement if you played other fly simulation games, overall it's not bad.","December 1, 2015","true","20.0"," No ratings yet","0","0","0","0","0"
"http://steamcommunity.com/id/captainwabbit/recommended/95900/","captainwabbit","Wabbit","http://steamcommunity.com/id/captainwabbit/","1291 products in account","Simple and arcadey. Not that great. Get Birds of Prey for something similar plus a little more depth or IL2 Sturmovostokovich 1942 for an extremely polished though long in the tooth and deep old plane shooty sim.","December 27, 2011","false","1.8"," No ratings yet","0","0","0","0","0"
"http://steamcommunity.com/profiles/76561198006557711/recommended/95900/","76561198006557711","Terminus","http://steamcommunity.com/profiles/76561198006557711/","409 products in account","Make no mistake, this is NOT a simulation. It's Mario Kart with WWII airplanes; that being said, it's kinda fun. Doesn't take itself too brainnumbingly serious, like it's more recent successor.","September 23, 2012","true","6.8"," No ratings yet","0","0","0","0","0"
"http://steamcommunity.com/profiles/76561198006175835/recommended/95900/","76561198006175835","IrisZero.-","http://steamcommunity.com/profiles/76561198006175835/","59 products in account","Only a few min to finish a mision, thats why 49 in total.\nPoor mision content, bring this ♥♥♥♥ here and then go here, done and sometimes no enemies in it. easy+.\nThe invisibility system sucks, not fun at all trying to avoid being seen\nWW2 game? if u are expecting an epic battles all over europe with a really nice motivation like\nwas in Air conflicts: Pacific Carriers, u will find a stupid mercenary girl with annoying voice\nand not a ♥♥♥♥♥♥ single movie just a bad comic in the introduction of every mision.\n\nWasted 5 euros in this ♥♥♥♥. Not recomended","November 29, 2014","false","1.2"," No ratings yet 1 person found this review funny","0","0","0","0","0"
"http://steamcommunity.com/profiles/76561198011226273/recommended/95900/","76561198011226273","Petr[CZ]","http://steamcommunity.com/profiles/76561198011226273/","116 products in account","Pretty good arcade game with very impressive and long singleplayer campaign.\n\n\nAnd if you are not ♥♥♥♥♥♥♥♥ and spoiled child, you can easily change settings and resolution. Just go to installation folder of the game and hit Configure.exe (Full HD resolution is available too).","February 15","true","13.9"," No ratings yet","0","0","0","0","0"
"http://steamcommunity.com/id/Logun007/recommended/95900/","Logun007","Logun","http://steamcommunity.com/id/Logun007/","636 products in account","Recommend or not recommend is such a polarizing review method. I played for a short time and buzzed through the first first levels. It was enjoyable enough but I found the story too thin for me and the game play bland. I became confused on the last level as to what I actually needed to do. While I am "recommending" this game I doubt I will ever pick it up again.\n\nThat's me though, it still played well enough that it may turn out to be some one else's cup of tea.","March 13","true","0.5"," No ratings yet","0","0","0","0","0"
"http://steamcommunity.com/profiles/76561198023397641/recommended/95900/","76561198023397641","keep_on_rocking","http://steamcommunity.com/profiles/76561198023397641/","48 products in account","A great game overall, with a good story and great unlockables and planes. I only wish they had added the lancaster...","January 17","true","110.5"," No ratings yet","0","0","0","0","0"
