"url","reviewerUsername","reviewerDisplayName","reviewerUrl","reviewerProductsCount","reviewText","date","recommended","hoursPlayed","voteText","helpfulPercent","votesHelpful","votesTotal","votesFunny","commentsCount"
"http://steamcommunity.com/id/Ank501/recommended/95900/","Ank501","Ank","http://steamcommunity.com/id/Ank501/","1595 products in account","Air Conflicts: Secret Wars is an arcade flying game published by bitComposer Games.\n\nSet in World War 2 with linear storyline. It's not about military power of the Nazi, Red Army or even RAF. It's about a person who try to survive in the war that consumes many other. But of course, you will be joining the Allies in the war against the German. From the desert of Tobruk to the plains and forest of Europe, you fight for your survival.\n\nAir Conflicts: Secret Wars has good gameplay, it's just since the game is about a person, it doesn't have so many great battles and some of it are stealth mission. Still, it's a challenges, not a bad game for me. The graphics is quite good, the sounds are good and the music is kinda good. I still recommend this if you like arcade games.\n\nRating 6/10","February 11, 2014","true","8.4"," 35 of 39 people (90%) found this review helpful 1 person found this review funny","90","35","39","0","0"
"http://steamcommunity.com/id/voidremedy/recommended/95900/","voidremedy","VoidЯemedy","http://steamcommunity.com/id/voidremedy/","940 products in account","Air Conflicts Secret Wars is a solid arcade style air combat game. Decent graphics and sound, but the gameplay can become repetitive. There seems to be no way to adjust visuals or controls. Very easy most of the time. I enjoyed the experience. Extremely simple to pick up due to its extremely arcadey style.","December 6, 2013","true","2.1"," 17 of 20 people (85%) found this review helpful","85","17","20","0","0"
"http://steamcommunity.com/id/spiderlocmtgo/recommended/95900/","spiderlocmtgo","BackStabbed","http://steamcommunity.com/id/spiderlocmtgo/","455 products in account","Fun arcadey flight sim. It's more of an XBL-arcade-tier indie title than a full-fledged flight sim, which is good because I'm terrible at flight sims. The planes seem kinda the same, the missions are uninspired, but if you want to fly around and blow stuff up, this does the trick.","May 25, 2014","true","0.6"," 13 of 13 people (100%) found this review helpful","100","13","13","0","0"
"http://steamcommunity.com/id/albertrayon/recommended/95900/","albertrayon","albertrayon","http://steamcommunity.com/id/albertrayon/","1581 products in account","Air Conflicts: Secret Wars is an arcade style flight game. This is not a simulator, flight controls are very simple. Missions consist of destroying ground targets, taking out rival aircraft, protecting allies and picking up supplies. I found all the missions to be quite similar after a few rounds. The planes are incredibly easy to control, so you can start divebombing and doing flybys of every tower in no time. The bombs and rockets are a little more difficult to use than the machine guns. I found myself having to loop around and try to hit targets multiple times.\n\nThe cutscenes are voice overs over well drawn still frames. The graphics overall could have used some polish. This is definitely a budget game, in that most objects are quite blocky. The resolution settings do not go very high, so you will most likely be playing in a lower resolution than you are used to. The voice acting is not offensive but not great. I couldn't really tell the difference between the male characters.\n\nDon't mistake this for a flight sim. If you are looking for a cheap arcade flight game, you could do worse than Air Conflict. However, the dated graphics and repetitive gameplay will not keep your attention for long.\n\nGrade: C","June 18, 2014","false","1.3"," 23 of 34 people (68%) found this review helpful","68","23","34","0","0"
"http://steamcommunity.com/profiles/76561198045043728/recommended/95900/","76561198045043728","Taylor","http://steamcommunity.com/profiles/76561198045043728/","575 products in account","Love this arcade style flight sim fun to play simple controls a little to easy but enjoyable and good story. If you only have an hour or so to spare you can jump straight in and play.","March 18, 2014","true","13.7"," 11 of 12 people (92%) found this review helpful","92","11","12","0","0"
"http://steamcommunity.com/profiles/76561197995381979/recommended/95900/","76561197995381979","Billy_Brightside","http://steamcommunity.com/profiles/76561197995381979/","225 products in account","Air Conflicts: Secret Wars is a mixed bag of things, but mostly an arcade sim with a decent (though hyperbolic) story wrapped around it. You play a female protagonist named DeeDee who, being a pilot smuggler gets caught up into World War II. And she serves with a man who personally flew and fought with her father in World War One. As the missions progress, the story unfolds through static cut scenes that have a pleasant cell shaded hand drawn look. Missions vary from stealthy strike missions to all out balls to the wall multi-plane dogfights. If you’re looking to play an IL-2 Sturmovik imitation, look elsewhere; this is strictly for the arcade fans. Difficulty can be toggled, but some missions are more difficult than they have any right to be. One particular mission toward the end involved destroying fleeing vehicles through the city of Berlin. Tall buildings made it difficult to get decent bombing runs or rocket attacks, and it took me over 50 tries to get it. (But at this point, being so close to the end I had to finish it!)\n\nGraphics are okay, serving the purpose. They look console-ish, and the voice acting is pretty much done by three people. One guy doing four different men’s voices with different accents is cheesy to the point of being hilarious. The music score, on the other hand, is polished and grandiose. It’s on par with a Stephen Spielberg Hollywood feature. I even looked during the end credits to find out who the composer was. Sadly, he was not credited.\nThe game offers multiplayer, but servers were pretty scant. I did find one each time I logged on, and this is probably a testament to the game’s age. It was fun, but mostly consisted of aerial jousts with rockets being launched at each other. A lot of my kills were dumb luck.\n\nI won’t be in a hurry to play the original Air Conflicts or Air Conflicts: Vietnam, but if you have a few bucks left in your Steam Wallet during a Summer or Winter Steam sale, you could do worse.\n","January 18, 2015","true","38.2"," 10 of 12 people (83%) found this review helpful 1 person found this review funny","83","10","12","0","0"
"http://steamcommunity.com/id/heikkito/recommended/95900/","heikkito","Nax_o","http://steamcommunity.com/id/heikkito/","1467 products in account","Begins slowly and starts to pick up speed when the story progresses.\n\nUnfortunately this game also illustrates very well why action flight sims are a niche product: half-way through the game difficulty suddenly jumps a lot and every missions becomes a grinding bore. You destroy more planes than rambo kills people and you still fail missions. and those tight time limits...\n\nGood buy from a bundle anyways. Just dont pay full price on this!","March 28, 2014","true","6.8"," 8 of 9 people (89%) found this review helpful","89","8","9","0","0"
"http://steamcommunity.com/id/EroticBunny/recommended/95900/","EroticBunny","♛ƸӁƷErotic BunnyƸӁƷ♛","http://steamcommunity.com/id/EroticBunny/","539 products in account","Pretty old game, but got nice game play, not bad graphic. Little stupid story :D UK gor war vs Germany, then vs USSR then USSR is friends then again and bla bla bla :D Some time USA take games where USA vs URRR (Russia)","October 23, 2014","true","7.6"," 26 of 43 people (60%) found this review helpful 2 people found this review funny","60","26","43","2","5"
"http://steamcommunity.com/profiles/76561198072637934/recommended/95900/","76561198072637934","The Irish Cabbage","http://steamcommunity.com/profiles/76561198072637934/","26 products in account","Its a good game not a realistic game though however multiplayer is arcadey which i like a lot overall if your looking for a sim this isnt the game but if your looking for an arcade kinda game this is worth it.","August 3, 2015","true","4.3"," 6 of 6 people (100%) found this review helpful","100","6","6","0","0"
"http://steamcommunity.com/id/systemic13/recommended/95900/","systemic13","Systemic","http://steamcommunity.com/id/systemic13/","1974 products in account","Plus: Great arcade flight simulator! Decent graphics and reasonably challenging gameplay make this a winner. Interesting storyline, and no noticable graphic or audio flaws. Fast load times. Level skip feature, on the off chance you cant get past a level.\nMinus: Simulation controls are nigh impossible to smoothly work with. Storyline is kind of wandering. Infantry and paratroopers are rediculously difficult to hit although you are required to at times.\n8/10 Overall: For what it is, its a pretty solid little plane game, with decent graphics and sound, and fun gameplay if you use the arcade control scheme with a controller.\n\nAMD Phenom II X6 1100T 3.3Ghz.\n6GB DDR2\n2.5TB 7200RPM, 16MB, SATA II\n16MB/s Cable/N300 Wifi\nXFX 2GB Radeon 6950\nVizio 42" 1080P 3D LED","November 29, 2013","true","17.3"," 10 of 15 people (67%) found this review helpful","67","10","15","0","0"
"http://steamcommunity.com/profiles/76561198014922772/recommended/95900/","76561198014922772","davidbld","http://steamcommunity.com/profiles/76561198014922772/","80 products in account","I'm about 10 missions in and enjoying it. Its definitly an arcade flight sim but I like it that way, the more realistic flight sims get, the more I suck at them, lol. I use the mouse controlls and have no problem. Graphics for me are nice and smooth on my medium quality PC and the music is good. I recommend for the casual flight sim player and if your the hardcore type its good popcorn fun if nothing else.","June 1, 2015","true","18.9"," 4 of 4 people (100%) found this review helpful","100","4","4","0","0"
"http://steamcommunity.com/id/rattlesnake8/recommended/95900/","rattlesnake8","Rattlesnake8","http://steamcommunity.com/id/rattlesnake8/","1314 products in account","This is an arcade style flight sim with a focus on fun. The game looks great, damage models look nice and being it is an arcade game, the planes handle very easy. There are a number of different campaigns and a good variety of aircraft to fly.\n\nGoing in for a bombing run and strafing enemy infantry as they scatter away from the tank you are about to destroy is very satisfying and looks great. If you want a fun flight sim without all the complexity and learning curve, and something you can just jump in and blow stuff up then this is perfect for you.\n\n\nI have played for almost 10 hours so far and I've only just started the last campaign. I did try out multiplayer briefly, but this game has a great length.\n\nPros:\n- Game looks good.\n- Basic controls.\n- Multiple campaigns.\n- Good variety of aircraft.\n- Decent length.\n- Fun.\n\nCons:\n- Not for you if you want an indepth flight simulator with complete realism.","January 5, 2015","true","11.9"," 5 of 6 people (83%) found this review helpful","83","5","6","0","0"
"http://steamcommunity.com/profiles/76561198061955363/recommended/95900/","76561198061955363","Null_Unit","http://steamcommunity.com/profiles/76561198061955363/","173 products in account","Game is called Secret Wars, but i cant find Dr. Doom or Galactus anywhere. Great arcadey style flying game anyway. 8/10.","April 17, 2015","true","1.8"," 6 of 8 people (75%) found this review helpful 6 people found this review funny","75","6","8","6","0"
"http://steamcommunity.com/id/Wild_Cheese/recommended/95900/","Wild_Cheese","Wild Cheese","http://steamcommunity.com/id/Wild_Cheese/","151 products in account","A simple, arcade air combat game, not for flight sim fans.\nGood for some fun in between playing other games.\nSuggest you get it during one of the sales.","April 6, 2015","true","5.2"," 3 of 3 people (100%) found this review helpful","100","3","3","0","0"
"http://steamcommunity.com/id/largehobbit/recommended/95900/","largehobbit","largehobbit","http://steamcommunity.com/id/largehobbit/","1112 products in account","A solid fighter pilot sim with an OK storyline. Nice selection of planes to try out and some good action sequences in the air. Got a little bored before the last few missions but pushed through to complete what is essentially a good game. Give it a go.","January 25, 2015","true","13.6"," 2 of 2 people (100%) found this review helpful","100","2","2","0","0"
"http://steamcommunity.com/profiles/76561198011965365/recommended/95900/","76561198011965365","Saint Aaron","http://steamcommunity.com/profiles/76561198011965365/","804 products in account","I actually enjoyed this game. An arcade  WWI and WWII plane shooter!! Works best with a controller!! Take on german planes and tanks!!! Graphics are good for its time. Nice small details in the city and Online still ACTIVE!!","May 1","true","24.8"," 2 of 2 people (100%) found this review helpful","100","2","2","0","0"
"http://steamcommunity.com/profiles/76561197972918384/recommended/95900/","76561197972918384","Demon Horde","http://steamcommunity.com/profiles/76561197972918384/","152 products in account","a suprising refresher.\n\nThere are better arcade air combat games out there, but not many. There's defintiely better air combat sims , so if you are looking for a sim style game go else where. This one does offer excellent arcade style air combat.\n\nThe good:\n\nFun easy to pick up game play.\nTons of single player missions that vary in length.\nNice mission variety.\nits got top secret jets in ww 2!\n\nthe bad\n\nStory seems implausible at times. The main character is a woman  (no offence ladies)  but durring WW2 I doubt there were any lady pilots seeing combat.\nSome of the missions seem a bit short.\nThe aformentioned top secret jet planes are not unlocked till you are near the end of the game.\nFeels like a "poor man's" Blazing angels at times.\nThe graphics are good but not great for this kind of game.\n\n\nThat said i'd give this game a 70% overall. it is a lot of fun especially if you like air plane games that are of the arcade variety like Blazing angels. BUT if you haven't played blazing angels 1 or 2 yet i'd recommend them first before you dive into this game. (I played blazing angels on xbox 360 but you can get both of them on steam as well).","August 14, 2014","true","13.9"," 3 of 4 people (75%) found this review helpful","75","3","4","0","0"
"http://steamcommunity.com/id/grossi77/recommended/95900/","grossi77","crisgrossi","http://steamcommunity.com/id/grossi77/","642 products in account","Great game! Easy to control the plane. I like this kind of game where you can control the plane using the mouse.\nThe graphics are good, but not realistic scenarios, its just like the Blazing Angels franchise.\n\nFor the price they ask its worth 100%. I recommend.","March 17, 2015","true","0.7"," 1 person found this review helpful","0","1","1","0","0"
"http://steamcommunity.com/profiles/76561198074538743/recommended/95900/","76561198074538743","Swiggity Swooty","http://steamcommunity.com/profiles/76561198074538743/","485 products in account","Not the worst flight sim I've ever played. It feels a bit slow the whole way through and some mission types get repetitive (Like Stealth missions.) Good for a discount game or if you're really into air combat","March 8, 2015","true","8.5"," 1 person found this review helpful","0","1","1","0","0"
"http://steamcommunity.com/id/5081/recommended/95900/","5081","Commander Matt","http://steamcommunity.com/id/5081/","209 products in account","In my 30 hours (at this point in time) playing this, I thoroughly enjoyed this game, especially for $10.\nIt has the feeling of a budget game, which I expect it was (the first Air Conflicts has recieved so much Flak [Ha ha ha, get it? Flak? Anti-Air? Anyone?] that they probably were a little scared of how the second would turn out) but they managed to make this game a very, VERY, good budget game, especially for $10.\nI'm not sure what people are talking about with the low resolution stuff. These past two weeks I've been able to play it in full 1920 x 1080, no iffy decals or anything. Though, on my laptop (I used to play this on a laptop, ran pretty well actually) I encountered a bug where the text, some of the logos, and most of the decals were very, very, low res. Didn't happen to me when I played it on my desktop, though.\nI'll cover a few key parts:\nGameplay - For a budget game (budget game in this context is something that doesn't have EA throwing money at it) the gameplay is excellent, furthurmore with it only being $10. It CAN be repetitive and frustrating at times, but it was still a fun game, for me at least.\nVoice acting - Lemme let you in on a little secret I bet a lot of people didn't notice. They had, I believe it was four or five (can't remember) voice actors, for about eight or so characters. Don't believe me? Watch the credits. Despite this, those voice actors deserve some (a lot) of credit. Personally I heard some similarites, never suspected it was because they were all the same voice actor. I just thought it was (no offense) the English accent.\nGraphics - In my opinion, 9.5/10. You must remember this is "AIR conflicts" not "GROUND conflicts" they put a lot of work into the planes to make them detailed. Seriously, the machine gun bullets ACTUALLY shoot out of the machine guns! (This is a big deal because this is pretty rare among air sims under $20) The ground graphics were sacrificed, of course. I was able to fly through some of the buildings to a point without exploding, as an example. The building textures seem low res as well. But if you want this game for it's ground graphics, you really should spend your $10 on a FPS shooter.\nCamera - VERY well suited for this game. You can change camera locations, such as 3rd person, in-cabin without the cockpit visible, in-cabin with the cockpit visible. There's also a follow bomb/missile ability.\nMissiles are NOT lock-on/tracking. You must manually aim them. As said in-game, they did not have tracking missiles during WW2.\nMy experience was probably made better by the fact that I have a joystick (Logitech Extereme 3D Pro)\n\nAll in all, the game is worth the $10, in my opinion.","March 9, 2015","true","31.7"," 1 person found this review helpful","0","1","1","0","0"
"http://steamcommunity.com/id/CommissarTommy/recommended/95900/","CommissarTommy","CommissarTommy","http://steamcommunity.com/id/CommissarTommy/","276 products in account","This isn't a review that I could make an easy decision about, whilst the game doesn't have the greatest graphics or particualrly the best story it has lots of variety in the missions and also features many different battlefields ranging from WW1 to the end of WW2.\n\nThe game isn't a high budget triple A title and it's not a simulation but it's a reasonably fun arcadey style game that allows you to play through various battlefields with a variety of machines, I would certinaly recommend picking this up in a sale if you're looking for a simple arcade-like flight game.\n\nAlso in my experience this game worked great with a controller (Xinput) and ran very well on my PC","February 24, 2015","true","8.3"," 1 person found this review helpful","0","1","1","0","0"
"http://steamcommunity.com/profiles/76561198095424289/recommended/95900/","76561198095424289","Mattof7questions","http://steamcommunity.com/profiles/76561198095424289/","204 products in account","Eh...\n\nThis is not a simulator, lets get that straight, this is an "arcade" flying game.\n\nSo yeah\n\nNow that most people got there answer on if they should buy this game, lets move onto thouse who remain undesided.\n\nThe Story's kinda meh.... it takes place part in flash backs to WW1 and the other part in WW2. honestly that summs it up, moving on.\n\nGameplay is "Arcade-like" all you propeller heads can avoid this one. How "arcade-like", Magic aim-bot bullets.... when you go to place your crosshair on an enemy, said crosshair will "lock" on to your oppoent and the bullets will defy the law of phyics to do so. Also decreasing your speed all the way will cause you plane to "fall out of the sky"....\n\nStill with me? Great...\n\nTo sum up the gameplay: its alright i guess\n\nWhy bother buying?; you want some Vagly anti-war story mixed with par for the course arcade flying action?  Cause thats what your getting....\n\nTL:DR - Eh, could be worse","April 27","true","6.4"," 1 person found this review helpful","0","1","1","0","0"
"http://steamcommunity.com/id/Whiterabbit01/recommended/95900/","Whiterabbit01","Whiterabbit-uk","http://steamcommunity.com/id/Whiterabbit01/","7727 products in account","Air Conflicts is an arcade version of a flight sim which means you can have loads of fun without having to learn a vast number of key bindings like you do with games like the digital combat sims such as The Warthog and Black Shark sims. It reminds me of a vastly improved version of Wings of War, which was a lot of fun to play with back in the mid 2000's.\n\nCompared to several other recently released flight sims it is rather dumbed down, but that said it's satisfyingly easy to play and has a reasonable number of varied missions to complete with decent graphics.\n\nIf you're a hardened flight sim enthusiast this isn't for you, but if you just want to jump in and start blasting away without having to learn any key bindings then this is worth getting, though I'd recommend waiting till it's on sale, which I reckon won't be too  long as most of the reviews I've read weren't impressed with the game. Don't let that put you off though. Basically it's a budget arcade flyer.\n","October 27, 2011","true","11.3"," 2 of 3 people (67%) found this review helpful","67","2","3","0","0"
