"url","reviewerUsername","reviewerDisplayName","reviewerUrl","reviewerProductsCount","reviewText","date","recommended","hoursPlayed","voteText","helpfulPercent","votesHelpful","votesTotal","votesFunny","commentsCount"
"http://steamcommunity.com/id/kschang77/recommended/95900/","kschang77","kschang77","http://steamcommunity.com/id/kschang77/","993 products in account","Air Conflicts: Secret War is a sequel of the original Air Conflicts from 2006. It is an arcade turn-and-burn WW2 flight game with some interesting story line rarely covered in WW2 games: the Balkan conflict, and how the resistance in Poland, Azerbaijan, and other eastern European countries fought the Nazi invasion. You play the daughter of a WW1 Ace, "Deedee" as you attempt to work your way out of Africa into Eastern Europe, attempting to work your way through the war, as sort of a mercenary / smuggler for hire of the Allied side, along with your mentor Tommy (who flew with your father) and Clive, the best mechanic / drunk. You start working for Flight Captain McIntyre of the RAF, but you'll end up helping a lot fo different factions on the Allied side, not all of whom are that friendly, as you attempt to survive WW2.\n\nThe game has quite good graphics, and fully supports high resolution screens, as well as all sort of eye candy, from bump maps to high polygon models to post processing effects, and more. However, your windows need to use the regular DPI instead of any enlargement (125% or 150% under display) or you won't be able to run the config program as you can't see the buttons. Sound is quite good.\n\nThe game play has variety of mission types, such as eliminate all enemies. Though it's the timed missions, as well as the "plinking" missions that are the most frustrating. As an example of timed mission, you have to destroy advancing German tanks within 2 minutes (or they'll fire upon the convoy and you'll fail the mission).  Another example is the "plink the parachutes" mission... German transports are bringing in paratroopers. You need to shoot down the paratroopers. Yes, you are here to shoot parachutes (WTF?!)  And you need to shoot dozens and dozens of them... until you killed at least 12% of those darn parachutes. There's another one where "kill 70 soldiers on the ground with bombs or strafing". YIKES.\n\nThat parachute missions is the most hideous I've encountered so far, with the "kill 70 soldiers on ground" a close second. And I don't mean the objective, but the sheer frustration attempting to finish such. The parachute mission lasts 12 minutes, and you are barely informed of how you're doing. You simply keep shooting parachutes until you get a 'pass' or 'fail'. And yes, the paratroopers will scream as they fall from the sky. Same with ground soldiers you kill.\n\nOn the other hand, there are some missions that are more... subtle, such as the "smuggle" missions where you are trying to stay undetected (with a stealth meter), or a rescue / recon mission about finding a signal (radio finder blips). There's also a mission or two where you simply pilot a captured Luftwaffe plane and fly over enemy territory for recon... and hopefully not get caught by air patrols. That can get tense.\n\nDepending on the aircraft you fly (and you fly a lot, from WW1 fighter to civilian transport, from fighters to fighter bombers, even a B-24... ) you get guns, bombs, and maybe rockets. The bombs and rockets are unlimited but takes time to regen. The guns are unlimited too, but won't fire if overheated.  If you can hit a plane with a rocket, you get insta-kill, but obviously that'll be quite difficult. Hit ground targets with bombs or rockets, but you need to be VERY precise... or you don't get the kill (and fail the objective). The bigger planes have additional turrets and tail guns, and those fire automatically. You can even take control fo the turrets and let AI fly for a while. Bombers may be able to drop salvos of bombs rather than one at a time.\n\nThere are missions set in both WW1 and WW2. The story is told from POV of Dorothy "Deedee" Derbec, who fight in the various conflicts (that you play) in WW2, but also relive the missions talked about by friends of Deedee's father in WW1.\n\nAs you complete missions, depending in kills and objective completion you gain 'stars', which you accumulate to add a point to your four attributes such as luck, leadership, armor, and damage, giving it a slight RPG flavor. This also controls what planes you can unlock, and there are more than a dozen planes from all sides: German, American, British, Russian, even a few jets and rocket powered planes, not to mention bombers, fighter bombers, and pure fighters.\n\nThe locations are interesting, at least to those accustomed to regular WW2 games, as you do a lot of fighting in Eastern Europe (but that's understandable, the developers are from Slovakia), and they mixed in quite a bit of WW2 history (or at least, hypothetical history).\n\nThe game has simplified landing... basically fly through a series of "rings" and you're considered "landed". Taking off is easy: full throttle and you'll take off.\n\nController is fully supported, and can be set to arcade or sim mode with different control schemes. There's also multiple difficulty levels to customize your game. There's also plenty of quick dogfight missions (random AI opponents) and plenty of multiplayer options.\n\nEnemy AI is not bad, as they do try to get on your tail and stay there.\n\nOverall, my impression of the game is positive, except for those painfully tedious "plinking" missions (i.e. kill paratroopers and kill 70 ground troops). I'm about 60% complete and I sincerely hope I don't run into more missions of that type. Once I got past the female narrator (female French accented English) the game is actually quite enjoyable. Enemy planes smoke and break apart convincingly, and at Rookie difficulty you generally do breeze through the missions (except for those tedious plinking missions).\n\nif you like the genre, arcade WW2 flight game, this game is quite good. Not a must play, but definitely something to try.","January 18, 2015","true","7.1"," 2 of 3 people (67%) found this review helpful","67","2","3","0","0"
"http://steamcommunity.com/id/PieceOfMind1/recommended/95900/","PieceOfMind1","PieceOfMind","http://steamcommunity.com/id/PieceOfMind1/","2414 products in account","Arcade flight combat game best suited to gamepads, not joysticks.\n\nThe story is pretty boring and tends to drag on, told through pre and post mission briefings, narrated scenes with paintings and some in-game conversations (radio chatter).\n\nThe campaign is alright and it does get better as you get further in.  The flight model/controls is highly simplified (designed for consoles) meaning you only turn up/down (pitch) and left/right. It is possible to roll the aircraft in 'simulation' mode but without rudder controls it is rather pointless.  Ammo also refills automatically.\n\nShooting down lots of enemy planes and bombing lots of tanks, soldiers etc. is pretty fun. There's a bit of variety to missions but overall you still spend a lot of time shooting down planes and bombing vehicles. The AI for enemy planes, particularly for evasive manoeuvres is just awful though.\n\nMultiplayer is so laggy it's unplayable.\n\n6/10.","January 21, 2012","true","9.5"," 1 of 2 people (50%) found this review helpful","50","1","2","0","0"
"http://steamcommunity.com/profiles/76561198118396171/recommended/95900/","76561198118396171","sticksgezer","http://steamcommunity.com/profiles/76561198118396171/","26 products in account","yep. thumbs up. best part of this flight sim experience are the explosions. well done developers. you got the most important part of a combat flight sim right. if only all the other, blowing up airplanes, airplane sims did this.","January 22, 2015","true","7.6"," 1 of 2 people (50%) found this review helpful","50","1","2","0","0"
"http://steamcommunity.com/id/nivy565/recommended/95900/","nivy565","Mr_Gold","http://steamcommunity.com/id/nivy565/","313 products in account","7 planes out of 10 planes","December 10, 2013","true","0.2"," 1 of 2 people (50%) found this review helpful","50","1","2","0","0"
"http://steamcommunity.com/profiles/76561197975641025/recommended/95900/","76561197975641025","Cromat","http://steamcommunity.com/profiles/76561197975641025/","287 products in account","An enjoyable WW2 combat flight sim. Nothing mind blowing, but with a decent amount of planes to choose from, decent combat and just a little bit of RPG mechanics thrown in provides a fun arcade style flight experience.\n\nFinal Score 75/100","January 9, 2015","true","11.9"," 2 of 4 people (50%) found this review helpful","50","2","4","0","0"
"http://steamcommunity.com/id/ch3mist/recommended/95900/","ch3mist",".","http://steamcommunity.com/id/ch3mist/","337 products in account","I was in a mood for flying games, and ended up purchasing this through a bundle pack.  I gave it a good chance with at least an hour of play, but it never really progressed beyond a watered down Crimson Wings.  The missions were boring, and combat was more of the same.  Oh well, at least I only payed a few cents.","April 1","false","1.3"," 1 of 2 people (50%) found this review helpful","50","1","2","0","0"
"http://steamcommunity.com/id/DivertingTitan2/recommended/95900/","DivertingTitan2","Pingu","http://steamcommunity.com/id/DivertingTitan2/","234 products in account","I bought this game hoping it would be somewhat like Wings of Prey, but it's not at all like it. The physics are weird, very unrealistic and just not apealing to play. To someone who just wants a game to fly around in and shoot this this may be interesting, but to someone who actually wants an air combat simulator this is not a good choice.","February 3, 2014","false","0.2"," 3 of 7 people (43%) found this review helpful","43","3","7","0","0"
"http://steamcommunity.com/id/phann/recommended/95900/","phann","phann","http://steamcommunity.com/id/phann/","1162 products in account","See my impressions at https://youtu.be/qF1yiEUrDtM","May 3","false","0.6"," 0 of 1 people (0%) found this review helpful","0","0","1","0","0"
"http://steamcommunity.com/id/Evilnames/recommended/95900/","Evilnames","Evilnames","http://steamcommunity.com/id/Evilnames/","2557 products in account","A long slog through war as a bumbling French merc attempting to find out the truth about her father.  Gameplay is extremely repatative, though there are a couple stealth missions to break up the dry combat missions.  Your wingman AI is completely useless and you can offer them no orders.   Ultimately you get to make a decision at the end of the game which was actually rather interesting to get too, but the amount of gameplay was almost too much to bear.","November 25, 2013","false","6.3"," 11 of 24 people (46%) found this review helpful","46","11","24","0","0"
"http://steamcommunity.com/profiles/76561197985930393/recommended/95900/","76561197985930393","Psychopat","http://steamcommunity.com/profiles/76561197985930393/","427 products in account","I like combat part of game, i like planes, but: who the f,,,,k is responsible for dialogues and picking the actors???!!! This womans voice is killing my patience, its boring with wierd tone even in combat situations..blehhh   6/10","March 1, 2015","false","6.5"," 5 of 12 people (42%) found this review helpful 1 person found this review funny","42","5","12","0","0"
"http://steamcommunity.com/profiles/76561198054469743/recommended/95900/","76561198054469743","seattlesbadboy","http://steamcommunity.com/profiles/76561198054469743/","20 products in account","This game sucks It would not work with my logitech 3d extrem joy stick or my usb game pad. he only way I could get it to play was using the keyboard and then it would not let me change the key settings.","March 21, 2014","false","223.4"," 4 of 10 people (40%) found this review helpful","40","4","10","0","0"
"http://steamcommunity.com/id/I_keeel_U/recommended/95900/","I_keeel_U","HappyClown","http://steamcommunity.com/id/I_keeel_U/","1081 products in account","Very good game even though it is from 2011. Great graphics and gameplay.","June 23, 2014","true","2.2"," 4 of 10 people (40%) found this review helpful","40","4","10","0","0"
"http://steamcommunity.com/profiles/76561198034605837/recommended/95900/","76561198034605837","[TV] (Sui) PFC Piggingtons","http://steamcommunity.com/profiles/76561198034605837/","126 products in account","Blew up tiger tanks with machine guns. 99/10","October 20, 2014","true","2.6"," 4 of 10 people (40%) found this review helpful","40","4","10","0","0"
"http://steamcommunity.com/id/likeucare/recommended/95900/","likeucare","LIKEUCARE","http://steamcommunity.com/id/likeucare/","1377 products in account","Average flight action game... at least, from where I am at the momen, the game is quite average. Hopefully it'll become more challenging and less bland... however the reviews of this game weren't much positive..\n\nOh well, it was cheap and if your interested in this game, buy it on a cheap deal!","January 8, 2012","false","11.0"," 3 of 8 people (38%) found this review helpful","38","3","8","0","0"
"http://steamcommunity.com/profiles/76561198007669286/recommended/95900/","76561198007669286","woollybully_EMU","http://steamcommunity.com/profiles/76561198007669286/","174 products in account","ABSOLUTE  CRAP","March 21","false","1.7"," 3 of 8 people (38%) found this review helpful","38","3","8","0","0"
"http://steamcommunity.com/profiles/76561197983740996/recommended/95900/","76561197983740996","Chane","http://steamcommunity.com/profiles/76561197983740996/","348 products in account","The single-player is kind of boring. It's a long game and becomes very repetitive. The story feels like an endless lamentation about the players long lost father. It sucks.\nAstonishingly the multi-player is very good. Multi-Player is a lot of fun and surprisingly addictive. I played it a lot.\nUnfortunately all multi-player achievements are broken.\nIf you only care for multi-player and do not mind the bugged achievements the game deserves a recommendation.\nBut since I prefer single-player over multi-player, like a good story and care for achievements I can not recommend the game.","July 15, 2015","false","24.6"," 2 of 6 people (33%) found this review helpful","33","2","6","0","0"
"http://steamcommunity.com/id/UAowner/recommended/95900/","UAowner","Alys Yate","http://steamcommunity.com/id/UAowner/","187 products in account","Just recently finshed it\nThe story is heart breaking and awsome\nThe planes to unlock ARE AWSeom 1000000000000/10","November 9, 2014","true","14.8"," 0 of 2 people (0%) found this review helpful","0","0","2","0","0"
"http://steamcommunity.com/profiles/76561198015983358/recommended/95900/","76561198015983358","megaD","http://steamcommunity.com/profiles/76561198015983358/","128 products in account","Easy but nice flight sime. Tries to transport a story.","November 23, 2014","true","2.3"," 0 of 2 people (0%) found this review helpful","0","0","2","0","0"
"http://steamcommunity.com/id/shwen/recommended/95900/","shwen","Shwgar","http://steamcommunity.com/id/shwen/","770 products in account","An oldish game by now but graphics still look nice and it's always fun to shoot down planes!\n\nhttp://youtu.be/vOXN30RwPM8","February 20, 2015","true","0.4"," 0 of 2 people (0%) found this review helpful","0","0","2","0","0"
"http://steamcommunity.com/id/rammsteniako/recommended/95900/","rammsteniako","Rammsteniako","http://steamcommunity.com/id/rammsteniako/","1447 products in account","Pretty good arcade aircraft fighting :) 8/10","April 12, 2013","true","8.7"," 0 of 2 people (0%) found this review helpful","0","0","2","0","0"
"http://steamcommunity.com/id/sqook/recommended/95900/","sqook","Nik","http://steamcommunity.com/id/sqook/","332 products in account","Beware! Buggy sound, the game makes a noise like a dying mouse regardless of sound settings. Really irritating, ruins the game as it is too annoying to play. Probably a compatibility problem with Win8.1, would be nice to see this fixed, yet I have a feeling that will never happen since this game is so old. Bit of a shame.","May 4, 2014","false","0.2"," 3 of 9 people (33%) found this review helpful","33","3","9","0","0"
"http://steamcommunity.com/profiles/76561198012536363/recommended/95900/","76561198012536363","STRYKE","http://steamcommunity.com/profiles/76561198012536363/","205 products in account","I like it","January 12, 2014","true","0.6"," 2 of 7 people (29%) found this review helpful","29","2","7","0","0"
"http://steamcommunity.com/profiles/76561198109669131/recommended/95900/","76561198109669131","Tosser","http://steamcommunity.com/profiles/76561198109669131/","406 products in account","Game is OK","December 20, 2014","true","11.3"," 0 of 3 people (0%) found this review helpful","0","0","3","0","0"
"http://steamcommunity.com/id/kinnn/recommended/95900/","kinnn","kinnn ✿ܓ","http://steamcommunity.com/id/kinnn/","336 products in account","ay.ya.ya","March 9, 2015","true","4.5"," 0 of 3 people (0%) found this review helpful","0","0","3","0","0"
"http://steamcommunity.com/id/nb264/recommended/95900/","nb264","NB264","http://steamcommunity.com/id/nb264/","1682 products in account","Surprisingly fun arcade air-combat, with interesting visit to Yugoslav sky, lol.","June 25, 2012","true","2.2"," 0 of 3 people (0%) found this review helpful","0","0","3","0","1"
"http://steamcommunity.com/id/lostness/recommended/95900/","lostness","lostness","http://steamcommunity.com/id/lostness/","35 products in account","Another drop in the bucket of air combat games. While the graphics are satisfactory, and good for persons with lower end computers (single-core, 512MB graphics card), the general game play is more arcade than simulation--this isn't a sit in your ♥♥♥♥-pit and sweat it out combat (even getting the ♥♥♥♥-pit view is hard, and flying the 'chase' default is a pain).  The combat experience leaves much to be desired in regards to realism--your ammo in unlimited, your 'damage' repairs over time, and your weapons have a very generous lead tolerance when it comes to targeting enemy aircraft.\n\nThe plus side to the game is that it has a decent story-line to follow, that offers up different challenges to the player.\n\nIf you are looking for a game that offers realism in terms of flight and fight--get DOS Box and download Aces Over Europe. Otherwise, this is just an annoying want-to-be. If you are looking for a fun arcade that offers a bit of eye-candy and a tad of challenge, go ahead, and have some fun with the game.","November 25, 2013","false","0.4"," 6 of 16 people (38%) found this review helpful","38","6","16","0","2"
"http://steamcommunity.com/profiles/76561198037287374/recommended/95900/","76561198037287374","Rubsam","http://steamcommunity.com/profiles/76561198037287374/","157 products in account","GOD AWFUL.","November 23, 2014","false","0.1"," 2 of 8 people (25%) found this review helpful","25","2","8","0","0"
"http://steamcommunity.com/profiles/76561198037287374/recommended/95900/","76561198037287374","Rubsam","http://steamcommunity.com/profiles/76561198037287374/","157 products in account","GOD AWFUL.","November 23, 2014","false","0.1"," 2 of 8 people (25%) found this review helpful","25","2","8","0","0"
"http://steamcommunity.com/profiles/76561198038778468/recommended/95900/","76561198038778468","warlock198552","http://steamcommunity.com/profiles/76561198038778468/","192 products in account","GAME SUCKS","February 8, 2015","false","0.5"," 1 of 6 people (17%) found this review helpful","17","1","6","0","0"
"http://steamcommunity.com/profiles/76561197979920601/recommended/95900/","76561197979920601","esel","http://steamcommunity.com/profiles/76561197979920601/","75 products in account","This game looked good. I was in the mood for a good ww2 flight sim.  But it was terrible..  I crashed my plane into the ground, and it bounced back. And that was in simulator mode.  You don't have to aim, the game does that for you.  I don't understand, when they have the physics and graphics, why not add a realistic mode?  It could have been a good game, but instead it's completely worthless!","August 12, 2014","false","0.1"," 0 of 4 people (0%) found this review helpful","0","0","4","0","0"
"http://steamcommunity.com/profiles/76561197993593347/recommended/95900/","76561197993593347","tim","http://steamcommunity.com/profiles/76561197993593347/","92 products in account","Horrible combat, horrible plane controls. Unrelistic missions. 3-10","December 25, 2014","false","8.1"," 0 of 4 people (0%) found this review helpful","0","0","4","0","0"
"http://steamcommunity.com/id/darkmyth10/recommended/95900/","darkmyth10","DarkMyth","http://steamcommunity.com/id/darkmyth10/","265 products in account","A classic arcade shooter game but the planes feel like flying bricks and it has mouse and keyboard controls with auto aiming so the player doesn't even need to have the crosshairs on the target to hit.  If you want to play a flying shooter try War Thunder or World of Warplanes which are way better games.","March 28, 2015","false","1.4"," 0 of 4 people (0%) found this review helpful","0","0","4","0","0"
"http://steamcommunity.com/profiles/76561198098768799/recommended/95900/","76561198098768799","Cops On Coke","http://steamcommunity.com/profiles/76561198098768799/","12 products in account","The controls are very confusing and it's hard to play. I don't recommend it.","April 17, 2015","false","0.2"," 0 of 4 people (0%) found this review helpful 1 person found this review funny","0","0","4","0","0"
"http://steamcommunity.com/profiles/76561198027069936/recommended/95900/","76561198027069936","shiski1605","http://steamcommunity.com/profiles/76561198027069936/","90 products in account","Save your money.","July 4, 2015","false","0.6"," 0 of 4 people (0%) found this review helpful","0","0","4","0","0"
"http://steamcommunity.com/profiles/76561198067532715/recommended/95900/","76561198067532715","troutwine","http://steamcommunity.com/profiles/76561198067532715/","8 products in account","NO GOOD!!!!!!","November 30, 2015","false","13.1"," 0 of 4 people (0%) found this review helpful","0","0","4","0","0"
"http://steamcommunity.com/id/bigboyjoepepperoni/recommended/95900/","bigboyjoepepperoni","Big Boy Joe Pepperoni","http://steamcommunity.com/id/bigboyjoepepperoni/","156 products in account","I don't remember buying this","April 7","false","0.6"," 0 of 4 people (0%) found this review helpful 1 person found this review funny","0","0","4","0","0"
"http://steamcommunity.com/profiles/76561198027288903/recommended/95900/","76561198027288903","Dozer","http://steamcommunity.com/profiles/76561198027288903/","221 products in account","Seems like a great game but it gets so long, boring and pointless and then you don't even know what is point of the game.","December 1, 2013","false","2.2"," 4 of 13 people (31%) found this review helpful","31","4","13","0","1"
"http://steamcommunity.com/id/grimhound/recommended/95900/","grimhound","Fwozl","http://steamcommunity.com/id/grimhound/","936 products in account","The game wouldn't even start.","April 20, 2013","false","0.0"," 2 of 9 people (22%) found this review helpful 2 people found this review funny","22","2","9","2","0"
"http://steamcommunity.com/id/godfilma/recommended/95900/","godfilma","Godfilma","http://steamcommunity.com/id/godfilma/","48 products in account","I wish I could get my 10$ back","March 17, 2014","false","0.3"," 1 of 7 people (14%) found this review helpful","14","1","7","0","0"
"http://steamcommunity.com/id/Cliff_utubius/recommended/95900/","Cliff_utubius","Cliff","http://steamcommunity.com/id/Cliff_utubius/","209 products in account","WORST Flight SIM EVERR!","February 2, 2014","false","0.4"," 1 of 7 people (14%) found this review helpful","14","1","7","0","0"
"http://steamcommunity.com/profiles/76561198043767280/recommended/95900/","76561198043767280","bbweaves","http://steamcommunity.com/profiles/76561198043767280/","182 products in account","Thid game, no me gusta. Jittery plane controls, aiming is way too sensitive, planes are way too ♥♥♥♥ing strong (yours and the enemies). If you want to play a fun plane sim get War Thunder its a lot cheaper than this.","May 19, 2014","false","1.1"," 0 of 5 people (0%) found this review helpful","0","0","5","0","0"
"http://steamcommunity.com/id/1388246/recommended/95900/","1388246","mikpro1","http://steamcommunity.com/id/1388246/","786 products in account","THE GAME CRUSHING DEVELOPERS .I.. AT LEAST GOT GAME FOR FREE","November 15, 2015","false","0.1"," 0 of 5 people (0%) found this review helpful","0","0","5","0","0"
"http://steamcommunity.com/id/TheOlppoMan/recommended/95900/","TheOlppoMan","Kärry :)))","http://steamcommunity.com/id/TheOlppoMan/","254 products in account","I did not play for long, but it just didn't feel good. The controls were bad and the visuals are meh. I don't recommend it","January 6, 2014","false","0.1"," 4 of 14 people (29%) found this review helpful","29","4","14","0","0"
"http://steamcommunity.com/id/Rubberjohnny/recommended/95900/","Rubberjohnny","MiG-21bis Fishbed-L","http://steamcommunity.com/id/Rubberjohnny/","380 products in account","I literally fell asleep playing this. I wish I was joking.","March 4, 2014","false","0.4"," 4 of 14 people (29%) found this review helpful","29","4","14","0","0"
"http://steamcommunity.com/profiles/76561198049926726/recommended/95900/","76561198049926726","jeffreyyoung20","http://steamcommunity.com/profiles/76561198049926726/","147 products in account","THIS  GAME DOES NOT WORK WELL","August 8, 2014","false","1.7"," 3 of 12 people (25%) found this review helpful","25","3","12","0","0"
